EL_A,"ELLA.    	Ella Fitzgerald, the ""First Lady of Song"", had a hard and tough upbringing. She was raised by her mother alone in Yonkers, New York. Her mother died while Ella was still a schoolgirl, and around that time the young girl became less interested in her education. She fell in with a bad crowd, even working as a lookout for a bordello and as a Mafia numbers runner. She ended up in reform school, from which she escaped, and found herself homeless and living on the streets for a while. Somehow Fitzgerald managed to get herself a spot singing in the Apollo Theater in Harlem. From there her career took off and as they say, the rest is history."
OP_L,"OPAL.    	97% of the world's opals come from Australia, so it's no surprise perhaps that the opal is the national gemstone of the country. The state of South Australia provides the bulk of the world's production, about 80%."
OM_R,"OMAR.    	Omar Khayyám was a Persian with many talents. He was a poet as well as an important mathematician, astronomer and physician. A selection of his poems were translated by one Edward Fitzgerald in a collection called ""Rubaiyat of Omar Khayyám""."
T_T,"TET.    	The full name for the New Year holiday in Vietnam is 'Tet Nguyen Dan' meaning ""Feast of the First Morning"", with the reference being to the arrival of the season of spring. Tet usually falls on the same day as Chinese New Year."
IP_,"IPO.    	An Initial Public Offering (IPO) is the very first offer of stock for sale by a company on the open market. In other words, an IPO marks the first time that a company is traded on a public exchange. Companies have an IPO to raise capital to expand (usually)."
AS_A,ASIA.    	Asia is a progressive rock band from England that formed in 1981.
E_T,"EST.    	The Orange Bowl football game is played annually in Florida on New Year&#8217;s Day, which means that the local time is Eastern Standard Time (EST)."
NA_,"NAT.    	The Washington Nationals baseball team started out life as the Montreal Expos in 1969. The Expos moved to Washington in 2005 becoming the Nats. There are only two Major Leagues teams that have never played in a World Series, one being the Mariners and the other the Nats."
IDE_,"IDES.    	There were three important days in each month of an old, Roman calendar. These days originally depended on the cycles of the moon, but were eventually ""fixed"" by law. Kalendae were the first day of each month, originally the day of the new moon. Nonae were originally the day of the half moon. And idus (the ides) was originally the day of the full moon, eventually fixed as the 15th day of the month. Well, the Ides were the 15th day of March, May, July and October. For all other months, the Ides fell on the 13th. Go figure ..."
SO_,"SOT.    	Our word ""sot"" comes from the Old English ""sott"", meaning a fool. The word ""sot"" started to be associated with alcohol and not just foolery in the late 1500s."
_RL,URL.    	Internet addresses (like NYTCrossword.com and LAXCrossword.com) are more correctly called Uniform Resource Locators (URLs).
ST_N,STAN.    	Stan Smith is a former professional tennis player who was particularly successful as a doubles player with partner Bob Lutz. The Adidas Stan Smith tennis shoe has been selling well since 1971.
A_A,AKA.    	Also known as (aka)
ETA_,"ET AL.    	Et alii is the equivalent of et cetera, with et cetera being used in place of a list of objects, and et alii used for a list of names."
_ST,"SST.    	The most famous supersonic transport (SST) is the retired Concorde. Concorde was developed and produced under an Anglo-French treaty by France's Aérospatiale and the UK's British Aircraft Corporation (BAC). Concordes were mainly operated by Air France and British Airways, with both companies buying the planes with substantial subsidies from the French and British governments."
UL_A,"ULNA.    	The oblique cord is a ligament, one that joins the radius and ulna in the arm near the elbow."
SO_,"SOL.    	Sol is the fifth note in a musical scale, equivalent to G if one starts on the note C (i.e. ""do"")."
_KA,AKA.    	A police blotter is (or used to be) a daily record of arrests made.
_LC,"TLC.    	The girl band called TLC is from Atlanta, Georgia. The trio's original members were:"
I_EA,"IKEA.    	The furniture chain IKEA was founded by Ingvar Kamprad in 1943, when he was just 17-years-old. IKEA is an acronym that stands for Ingvar Kamprad Elmtaryd Agunnaryd (don't forget now!). Elmtaryd was the name of the farm where Ingvar Kamprad grew up, and Agunnaryd is his home parish in Sweden."
NC_A,"NCAA.    	In the NCAA Division I Basketball Championship, the teams remaining at various stages of the tournament are known as:"
AS_A,"ASIA.    	The Dardanelles and Bosphorus (also 'Bosporus') are two straits in Turkey. The Bosphorus and the Dardanelles lie either side of the Sea of Marmara, allowing continuous navigation from the Aegean Sea to the Black Sea. The Turkish Straits also form the boundary between Europe and Asia."
EL_A,"ELIA.    	Elia Kazan won Oscars for best director in 1948 for ""Gentleman's Agreement"" and in 1955 for ""On The Waterfront"". In 1999, he was given an Academy Lifetime Achievement Award."
I_ES,IDES.    	In Act I of William Shakespeare's 'Julius Caesar' a soothsayer warns the doomed emperor to 'beware the Ides of March'. Caesar ignores the prophesy and is of course killed on the steps of the Capitol by a group of conspirators on that very day.
E_AM,"EDAM.    	Edam cheese takes its name from the Dutch town of Edam in North Holland. The cheese is famous for its coating of red paraffin wax, a layer of protection that helps Edam travel well and prevents spoiling. You might occasionally come across an Edam cheese that is coated in black wax. The black color indicates that the underlying cheese has been aged for a minimum of 17 weeks."
_RI,"MRI.    	MRI scans can be daunting for many people as they usually involve the patient lying inside a tube with the imaging magnet surrounding the body. Additionally, the scan can take up to 40 minutes in some cases. There are some open MRI scanners available that help prevent a feeling of claustrophobia. However, the image produced by open scanners are of lower quality as they operate at lower magnetic fields."
AL_N,"ALAN.    	The actor Alan Arkin won his only Oscar (Best Supporting Actor) for his role in ""Little Miss Sunshine"" from 2006, a movie I just did not understand ..."
_LAN,"ALAN.    	Alan Freed was an early disk-jockey, who was known by the nickname ""Moondog"". Based in the US, he also recorded radio shows for broadcast in Europe. He earned quite a reputation promoting African-American rhythm and blues music, and ultimately rock and roll. However, Freed's career came to an abrupt end when it was proven that he was at the receiving end of ""payola"" payments, profiting from promotion of specific records on his shows."
E_AL,"ET AL.    	Et alii is the equivalent of et cetera, with et cetera being used in place of a list of objects, and et alii used for a list of names."
S_TS,"SSTS.    	The most famous Supersonic Transport (SST) was the Concorde, a plane that's no longer flying. Concorde had that famous ""droop nose"". The nose was moved to the horizontal position during flight to create the optimum aerodynamic shape thereby reducing drag. It was lowered during taxi, takeoff and landing, so that the pilot had better visibility. The need for the droop nose was driven largely by the delta-shaped wings. The delta wing necessitates a higher angle of attack at takeoff and landing than conventional wing designs, so the pilot needed the nose lowered so that he or she could see the ground."
NC_A,"NCAA.    	The National Collegiate Athletic Association (NCAA) dates back to the Presidency of Theodore Roosevelt. When his son broke his nose playing football at Harvard, President Roosevelt turned his attention to the number of serious injuries and even deaths occurring in college sports. He instigated meetings between the major educational institutions, leading to the formation of the Intercollegiate Athletic Association of the United States (IAAUS) in 1906, which was given the remit of regulating college sports. The IAAUS became the NCAA in 1910."
AV_,"AVE.    	New York City's 6th Avenue was such a shabby and run-down thoroughfare that in 1945 Mayor La Guardia had the name changed to Avenue of the Americas as a first step in changed the image of the street. All along the street, the national seals of all the countries in the Western Hemisphere were hung from streetlights as part of a marketing campaign to promote trade. Over the next couple of decades, the elevated train line along the street was demolished and many buildings were rebuilt so that today the avenue is lined with modern towers housing many corporate offices."
OPE_A,"OPERA.    	""A Night at the Opera"" is a 1935 Marx Brothers film that was the first movie in which Chico, Harpo and Groucho appeared without their brother Zeppo. ""A Night at the Opera"" is really great entertainment!"
IKE_,"IKEA.    	The IKEA furniture stores use the colors blue and yellow for brand recognition. Blue and yellow are the national colors of Sweden, where IKEA was founded and is headquartered."
OS_A,"OSHA.    	The Occupational Safety and Health Administration (OSHA) was created in 1970 during the Nixon administration. OSHA regulates workplaces in the private sector and regulates just one government agency, namely the US Postal Service."
TE_I,"TERI.    	Teri Hatcher's most famous role these days is the Susan Mayer character in ""Desperate Housewives"". I've never seen more than a few minutes of ""Housewives"" but I do know Teri Hatcher as a Bond girl, as she appeared in ""Tomorrow Never Dies""."
O_T,"OTT.    	I don't think Mel Ott took steroids! At 5' 9"" he weighed just 170 lb.. Yet he was the first National League player to hit over 500 home runs. Ott died in a car accident in New Orleans in 1958, at age 49 years."
_ES,"RES.    	The Latin term 'res nullius' translates as 'nobody's property'. In law, it describes something that has no owner, and is often used when ownership has subsequently been claimed. An example is a wild animal, which is nobody's property. However, if a hunter kills that animal, the body becomes the hunter's property."
RE_,"RES.    	""Res"" is the Latin for ""thing"". ""Res"" is used in a lot of phrases in the law, including ""res ipsa loquitur"". The literal translation of ""res ipsa loquitur"" is ""the thing speaks for itself"". It refers to situations when there is an injury, and the nature of the injury is such that one can assume that negligence had to have taken place."
STA_,"STAN.    	Stan Musial is a retired baseball player who went by the nickname ""Stan the Man"", a moniker he was awarded by the Brooklyn dodgers fans in 1946. Apparently, Stan is also quite the harmonica player."
O_R,"O'ER.    	The words ""o'er the ramparts we watched"" come from ""The Star Spangled Banner"" written by Francis Scott Key."
AVO_,"AVON.    	The River Avon that flows in the southwest of England is sometimes referred to as the Lower Avon or Bristol Avon. The extra wording is to distinguish it from a number of other River Avons in the country, including the famous one through William Shakespeare's Stratford. The Lower Avon passes through the cities of Bristol and Bath."
S_AN,STAN.    	South Park' is an adult-oriented cartoon series on Comedy Central. I don't do 'South Park' ...
SO_,"SOL.    	Spain's Costa del Sol (""Coast of the Sun"") is in Andalusia in the South of Spain. It lies sandwiched between two other ""costas"", the Costa de la Luz and the Costa Tropical. The city of Malaga is on the Costa del Sol, as well as the famous European tourist destinations of Torremolinos and Marbella. The Costa del Sol was made up of sleepy little fishing villages until the 1980s when the European sun-seekers descended on the region. I wouldn't recommend it for a holiday quite frankly ..."
R_S,"RES.    	""Res"" is the Latin for ""thing"". ""Res"" is used in a lot of phrases in the law."
U_I,"URI.    	Supposedly William Tell came from Uri, a canton in the German part of Switzerland. Altdorf is the capital of Uri and is the city where William Tell shot the apple off his son's head, at least according to legend."
O_IO,"OHIO.    	Ohio's state flag is referred to as the Ohio Burgee. A burgee is a roughly triangular flag, with two tails at one end. The Ohio Burgee is the only US state flag that is nonrectangular."
OPER_,"OPERA.    	Arrigo Boito was an Italian poet and librettist who completed one opera of his own (""Mefistofele"") and who left one other opera partially complete called ""Nerone"". This incomplete opera tells the story of Rome at the time of Emperor Nero. 'Nerone' was completed after Boito's death by a trio of musicians, including Arturo Toscanini, and was premiered at La Scala in 1924, six years after Boito died."
OAH_,"OAHU.    	An Ironman Triathlon is a race involving a 2.4 mile swim, a 112 mile bike ride, and a marathon run of just over 26 miles. The idea for the race came out of a debate between some runners in the 1977 Oahu Perimeter Relay. They were questioning whether runners, swimmers or bikers were the most fit athletes. The debaters decided to combine three local events to determine the answer, inviting athletes from all three disciplines. The events that were mimicked to come up with the first triathlon were the Waikiki Roughwater swim (2.4 miles), the Around-Oahu Bike Race (115 miles) and the Honolulu Marathon (26.2 miles). The idea was that whoever finished first would be called ""the Iron Man"". The first triathlon was run in 1978, with fifteen starters and only twelve finishers. The race format is used all over the world now, but the Hawaiian Ironman is the event that everyone wants to win."
ETA_,"ET AL.    	Et alii (et al.) is the equivalent of et cetera (etc.), with et cetera being used in place of a list of objects, and et alii used for a list of names. In fact ""et al."" can stand for et alii (for a group of males, or males and females), aliae (for a group of women) and et alia (for a group of neuter nouns, or for a group of people where the intent is to retain gender-neutrality)."
E_TU,"ET TU.    	It was Shakespeare who popularized the words ""Et tu, Brute?"" (And you, Brutus?), in his play ""Julius Caesar"", although the phrase had been around long before he penned his drama. It's not known what Julius Caesar actually said in real life just before he was assassinated on the steps of the Senate in Rome."
ES_E,"ESSE.    	Tiberius was the second Emperor of Rome, succeeding Augustus (himself the adopted son of Julius Caesar)."
_DES,"IDES.    	St Ides is made by Pabst, a beer with a high alcohol content (8.2%). St. Ides is better known as St. Ita. She was an Irish nun and teacher who lived most of her life in County Limerick, in the west of Ireland. She is reputed to have taught the more famous St. Brendan. I'm not sure how much beer she drank ..."
APS_,"APSE.    	The apse of a church or cathedral is a semicircular recess in an outer wall, usually with a half-dome as a roof and often where there resides an altar. Originally apses were used as burial places for the clergy and also for storage of important relics."
ER_,ERS.    	Registered nurses (RNs) might be found in an operating room (OR) or emergency room (ER).
EM_R,"EMIR.    	In English, emir can also be written as emeer, amir and ameer (watch out for those spellings in crosswords!)."
AN_,ANT.    	The Ant and the Grasshopper' is one of Aesop's fables.
IP_,"IPO.    	An Initial Public Offering (IPO) is the very first offer of stock for sale by a company on the open market. In other words, an IPO marks the first time that a company is traded on a public exchange. Companies have an IPO to raise capital to expand (usually)."
OSH_,"OSHA.    	The Occupational Safety and Health Administration (OSHA) was created in 1970 during the Nixon administration. OSHA regulates workplaces in the private sector and regulates just one government agency, namely the US Postal Service."
IK_A,"IKEA.    	Did you know that IKEA was founded by Ingvar Kamprad in 1943 when he was just 17-years-old??!! IKEA is an acronym that stands for Ingvar Kamprad Elmtaryd Agunnaryd (don't forget now!). Elmtaryd was the name of the farm where Ingvar Kamprad grew up, and Agunnaryd is his home parish in Sweden."
IP_,"IPO.    	An Initial Public Offering (IPO) is the very first offer of stock for sale by a company on the open market. In other words, an IPO marks the first time that a company is traded on a public exchange. Companies have an IPO to raise capital to expand (usually)."
EN_D,"ENID.    	Enid, Oklahoma takes its name from the old railroad station around which the city developed. Back in 1889, that train stop was called Skeleton Station. An official who didn't like the name changed it to Enid Station, using a character from Alfred Lord Tennyson's ""Idylls of the King"". Maybe if he hadn't changed the name, the city of Enid would now be called Skeleton, Oklahoma! Enid has the nickname ""Queen Wheat City"" because is has a huge capacity for storing grain, the third largest grain storage capacity in the world."
OD_N,"ODIN.    	In Norse mythology, Odin was the chief of the gods. Odin's wife Frigg was the queen of Asgard whose name gave us our English term ""Friday"" (via Anglo-Saxon). Odin's son was Thor, and his name gave us the term ""Thursday"". Odin himself gave us our word 'Wednesday', from 'Wodin', the English form of his name."
U_NA,"ULNA.    	The ulnar nerve runs alongside the ulna (one of the bones in the lower arm). The ulnar nerve is the largest unprotected (not surrounded by muscle or bone) nerve in the human body. The nerve can be touched under the skin at the outside of the elbow. Striking the nerve at this point causes and an electric-type shock, known as hitting one's ""funny bone"" or 'crazy bone'."
EL_A,"ELIA.    	The 1954 drama ""On the Waterfront"", starring Marlon Brando, told a story of violence and corruption among longshoremen, and was based on a series of 24 articles written by investigative journalist Malcolm Johnston and published in ""The New York Sun"". The original news stories uncovered mob infiltration on the New York City Waterfront, but in the film the location was changed to Hoboken, New Jersey."
OHI_,"OHIO.    	Cincinnati, Ohio was the first major city to be founded after the American Revolution, and indeed was the first major inland city to be founded in the whole country. Cincinnati was a boomtown in the 1800s, but it's growth slowed as the the railroads displaced the steamboats as the major form of transportation. The city was founded in 1788, and was named 'Cincinnati' two years later. It was named for the Society of Cincinnati, an organization with the mission to preserve the ideals and fellowship of the officers of Revolutionary War. The society was in turn named for Lucius Quinctius Cincinnatus. cincinnatus was farmer in ancient Rome who left his land to serve as Consul and then lawful dictator of Rome during a war emergency, before happily handing back power to the Senate after the war was won."
_NID,"ENID.    	""Idylls of the King"" is a cycle of twelve poems by Alfred, Lord Tennyson, that retell the tale of King Arthur. The sixth of the twelve ""idylls"" is the story of Geraint and Enid."
OTO_,"OTOE.    	The Otoe were the first Native American tribe encountered in the West by the Lewis and Clark. The explorers met with the Otoe (and Missouria) tribes in 1804 at a spot that became known as Council Bluff. The site is now a National Historic Landmark known as Fort Atkinson, Nebraska, as a fort was built there on the recommendation of Lewis."
TL_,"TLC.    	TLC is an American hip-hop, girl-group. The trio's name comes from the stage names of the band members: T-Boz, Left Eye and Chilli. I'd never heard of them, but they are apparently the biggest selling female group of all time. I find that hard to believe! The Supremes? The Andrews Sisters? I need to stop living in the past ..."
OTO_,"OTOE.    	The Otoe (also Oto) Native American tribe originated in the Great Lakes region as part of the Winnebago or Siouan tribes. The group that would become the Otoe broke away from the Winnebago and migrated southwestwards ending up in the Great Plains. In the plains the Otoe adopted a semi-nomadic lifestyle dependent on the horse, with the American bison becoming central to their diet."
_LC,TLC.    	Tender loving care (TLC).
_SIA,"ASIA.    	The seven continents, in order of size, are:"
_TT,"OTT.    	The Senators are the NHL hockey team in Ottawa, Canada. The current team, founded in the 1992-93 season, is the second NHL team in the city to use the name ""Senators"". The original team was founded in 1917 and had a very successful run until the league expanded into the US in the late twenties. The cost of operating in what became the smallest NHL city eventually drove the Senators to St. Louis where they played for a year as the Eagles before finally folding."
_EN,"YEN.    	The word ""yen"", meaning ""urge"", has been around in English since the very early 1900s. It comes from the earlier word ""yin"" imported from Chinese, which was used in English to describe an intense craving for opium!"
O_AR,"OMAR.    	In response to a 2003 rebellion in the Darfur region of Sudan, the Sudanese government embarked on a campaign of ethnic cleansing against the non-Arab population in the region. Hundreds of thousands of civilian deaths ensued, and eventually Sudan's president Omar al-Bashir was indicted for crimes against humanity by the International Criminal Court. al Bashir is still in office."
OLE_,"OLEO.    	Emperor Louis Napoleon III of France announced a competition to develop a substitute for butter, something that would be more accessible to the lower classes and more practical for the armed forces. A French chemist called Hippolyte Mege-Mouries came up with something he called oleomargarine in 1869, which was eventually manufactured under the trade name ""margarine""."
_AT,"NAT.    	Nat Turner was a slave in Virginia who led a slave rebellion in 1831 that led to the deaths of over a hundred people. Half of the casualties were white,and half were black. The 55 white deaths took place on the day of the rebellion as a growing mob of slaves traveled from house-to-house freeing fellow slaves but also killing any white people they came across; men, women and children. The rebellion was suppressed within two days by a white militia. Slaves involved in the rebellion were tried for insurrection and related crimes, and a total of 56 blacks were executed on suspicion of involvement in the uprising. In the aftermath, life for slaves became even more difficult as any freedoms that they had earned were largely curtailed."
_ASA,"NASA.    	The Soviet Union launched the Sputnik satellite towards the end of 1957, a development that shocked the establishment in the US. Within months, President Eisenhower created the Advanced Research Projects Agency (ARPA, now DARPA) and the National Aeronautics and Space Administration (NASA). The Space Race had begun ..."
_LC,TLC.    	Tender loving care (TLC)
_PSE,"APSE.    	The apse of a church or cathedral is a semicircular recess in an outer wall, usually with a half dome as a roof, and often where there resides an altar. Originally, apses were used as burial places for the clergy and also for important relics."
_ET,"TET.    	The full name for the new year holiday in Vietnam is Tet Nguyen Dan, meaning ""Feast of the First Morning"". Tet usually falls on the same day as Chinese New Year."
S_A,"SEA.    	The Caribbean Sea takes its name from the Carib people. The Caribs are an American Indian people that live in the Lesser Antilles islands, part of the West Indies."
_GRA,"AGRA.    	The most famous mausoleum in the world has to be the Taj Mahal in Agra, India. The Taj Mahal was built after the death of the third wife of Shah Jahan, Mumtaz Mahal (hence the name of the mausoleum). The poor woman died in childbirth delivering the couple's 14th child."
ELL_,"ELLA.    	Ella Fitzgerald, the ""First Lady of Song"", had a hard and tough upbringing. She was raised by her mother alone in Yonkers, New York. Her mother died while Ella was still a schoolgirl, and around that time the young girl became less interested in her education. She fell in with a bad crowd, even working as a lookout for a bordello and as a Mafia numbers runner. She ended up in reform school, from which she escaped, and found herself homeless and living on the streets for a while. Somehow Fitzgerald managed to get herself a spot singing in the Apollo Theater in Harlem. From there her career took off and as they say, the rest is history."
_VE,"AVE.    	""Ave Maria"" (""Hail Mary"" in English) is the prayer at the core of the Roman Catholic Rosary, which itself is a set of prayers asking for the assistance of the Virgin Mary. Much of the text of the ""Hail Mary"" comes from the Gospel of Luke. The words in Latin are:"
Y_N,"YEN.    	The Korean Won, the Chinese Yuan, and the Japanese Yen (all of which are Asian currencies) take their names from the Chinese written character that represents ""round shape""."
T_R,"TAR.    	'Tarmac' and 'macadam' are short for ""tarmacadam"". In the 1800s, Scotsman John Loudon McAdam developed a style of road known as ""macadam"". Macadam had a top-layer of crushed stone and gravel laid over larger stones. The macadam also had a convex cross-section so that water tended to drain to the sides. In 1901, a significant improvement was made by English engineer Edgar Purnell Hooley who introduced tar into the macadam, improving the resistance to water damage and practically eliminating dust. The ""tar-penetration macadam"" is the basis of what we now call Tarmac."
