XEN_,"XENA.    	The Xena character, played by New Zealander Lucy Lawless, was introduced in a made-for-TV movie called 'Hercules and the Amazon Women'. Lawless reprised the role in a series called 'Hercules: The Legendary Journeys'. Xena became so popular that a series was built around her character, with Lawless retained for the title role. The fictional Xena supposedly came from the 'non-fictional' Greek city of Amphipolis."
AUD_,"AUDI.    	'Audi' sounds like 'owdy', which is perhaps how a Cockney would say 'howdy'."
KO_LA,"KOALA.    	The koala bear really does look like a little bear, but it's not even closely related. The koala is an arboreal marsupial and a herbivore, native to the east and south coasts of Australia. Koalas aren't primates, and are one of the few mammals other than primates who have fingerprints. In fact, it can be very difficult to tell human fingerprints from koala fingerprints, even under an electron microscope. Male koalas are called 'bucks', females are 'does', and young koalas are 'joeys'. I'm a little jealous of the koala, as it sleeps up to 20 hours a day ..."
FD_,"FDR.    	Franklin Delano Roosevelt was the only child of Sara Delano and James Roosevelt Sr. The Delano family history in America goes back to the pilgrim Philippe de Lannoy, an immigrant of Flemish descent who arrived at Plymouth, Massachusetts in 1621. The family name ""de Lannoy"" was anglicized here in the US, to ""Delano""."
ODES_A,"ODESSA.    	The city of Odessa in Ukraine was founded relatively recently, in 1794 by Catherine the Great. The city was originally meant to be called Odessos after an ancient Greek city believed to have been located nearby. Catherine liked the way the locals pronounced the name as ""Odessa"", so went with the less Greek-sounding name."
_LNINO,"EL NINO.    	When the surface temperature of the Pacific Ocean rises or falls more that half a degree centigrade, then there is said to be an El Niño episode. That small temperature change in the Pacific has been associated with climatic changes that can stretch right across the globe. El Niño is Spanish for ""the boy"" and is a reference to the Christ child. It was given this Spanish name because the warming is usually noticed near South America and around Christmas-time."
E_OLA,"EBOLA.    	The Ebola virus causes a very nasty form of hemorrhagic fever. The name comes from the site of the first known outbreak of the disease, in a mission hospital in the Ebola River Valley in the Democratic Republic of the Congo."
_HARE,"O'HARE.    	O'Hare International is the fourth busiest airport in the world. The original airport was constructed on the site between 1942 an 1943, and was used by the Douglas Aircraft Company for the manufacture of planes during WWII. Before the factory and airport were built there was a community in the area called Orchard Place, so the airport was called Orchard (OR) Place Airport/Douglas (D) Field. This name is the derivation of the airport's current location identifier: ORD."
IZ_D,"IZOD.    	Jack Izod was a tailor of some repute over in England, producing shirts for King George V as well as other members of the Royal Family. As Izod was about to retire, he was approached for the use of his name by an American clothing manufacturer based in New York. The brand Izod of London was introduced to America in 1938."
TH_I,"THAI.    	The delicious dish called Pad Thai is a meld of stir-fried rice noodles with tamarind juice, red chili pepper plus a mix of vegetables and possibly tofu, meat or fish. It is usually topped with crushed peanuts, coriander and lime. The name ""Pad Thai"" translates as ""fried Thai style""."
AB_,"ABC.    	ABC' topped the charts for the Jackson 5 in 1970, and might perhaps be called the Jackson 5's signature tune."
TV_,"TVA.    	The Tennessee Valley Authority (TVA) has to be one of America's great success stories when it comes to economic development. Created in 1933, the TVA spearheaded economic development in the Tennessee Valley at the height of the Great Depression. Central to the success was the federally-funded construction of flood-control and electricity-generation facilities."
TS_,TSP.    	Teaspoon (tsp.)
_ACO,"WACO.    	Remember Ken Starr of Whitewater fame? He is now the President of Baylor University in Waco, Texas."
AM_SH,"AMISH.    	The Amish are a group of Christian churches, a subgroup of the Mennonite churches. The Amish church originated in Switzerland and Alsace in 1693 when it was founded by Jakob Ammann. It was Ammann who gave the name to the Amish people. Many Amish people came to Pennsylvania in the 18th century."
_DR,"FDR.    	'The New Deal' was the series of economic programs championed by President Franklin D. Roosevelt in response to the Great Depression. The New Deal was focused on three objectives, the '3 Rs':"
A_IA,"APIA.    	Polynesian Airlines is the national airline of Samoa, and as such is based in the capital of Samoa, Apia."
_EE,DEE.    	The actress Dee Wallace is best known for playing young Elliot's mother in the Steven Spielberg 1982 masterpiece 'E.T. the Extra-Terrestrial'.
OSA_A,"OSAKA.    	The Japanese city of Osaka used to be called Naniwa, with the name changing to Osaka sometime before 1500. ""Osaka"" can be translated either as ""large hill"" or ""large slope"". Osaka is sometimes referred to as 'the Chicago of Japan' as it is a major center of commerce and industry."
PI_A,"PITA.    	Pita is a lovely bread in Middle-Eastern and Mediterranean cuisines. Pita is usually round, and has a ""pocket"" in the center. The pocket is created by steam that puffs up the dough during cooking leaving a void when the bread cools. The pockets were a big hit in the seventies when someone came up with the idea of using them for fillings hence creating pita sandwiches or ""pita pockets""."
ST_RR,"STARR.    	Octopus's Garden' is a song released by the Beatles in 1969, one that was written and performed by drummer Ringo Starr. This was only Ringo's second musical composition and he gets sole credit for the writing, even though it is well established that George Harrison gave him quite a bit of ""help"". The idea for the song came to Ringo while he was on holiday with his family in Sardinia. The captain of the boat on which they were staying told Ringo that an octopus would spend its time traveling the seabed collecting shiny objects with which to make itself a garden. I don't know how true that is, but Ringo seemed to find it inspiring."
O_S,OPS.    	Opportunities (ops.)
A_EVE,"ALEVE.    	Aleve is a anti-inflammatory drug, Naproxen sodium."
_TOP,"T-TOP.    	A T-top is a car roof that has removable panels on either side of a rigid bar that runs down the center of the car, above the driver."
_BC,"NBC.    	NBC has had a number of different logos in the history of the company. There was a microphone from 1942-1954, and a xylophone from 1954-1959. The first peacock appeared in 1956, but was replaced with a snake in 1959. A second peacock raised its head in 1962, only to be shot down by an ""N"" logo in 1975. Today's peacock finally emerged in 1986. That first peacock was introduced in the early days of color television and was designed to illustrate how wonderful color television would be, so go buy one! (NBC was owned by RCA, and they had a vested interest in sales of color television sets)."
OL_S,"OLDS.    	The REO Motor Company was founded by Ransom E. Olds (hence the name REO). The company made cars, trucks and buses, and was in business from 1905 to 1975 in Lansing, Michigan."
A_UA,"AGUA.    	In Spanish, a 'golfo' (gulf) is full of 'agua' (water)."
RE_O,REPO.    	Repossession (repo)
S_S,STS.    	Street (st.)
OSA_A,OSAKA.    	Kansai International Airport is a remarkable facility built on an artificial island out in the middle of Osaka Bay. At the time it was built (starting in 1987) it was the most expensive construction project in history.
F_R,FDR.    	Franklin Delano Roosevelt (FDR)
LE_H,"LEAH.    	According to the Bible, Leah was one of the two wives of Jacob, the other being Leah's sister Rachel. Jacob's intention had been to marry Rachel, but the Leah and Rachel's father 'switched' his daughters and provided Leah as the veiled bride. Jacob married Rachel a week later, and lived with the two wives concurrently."
US_A,"USDA.    	The US Department of Agriculture dates back to 1862 when it was established by then-president Abraham Lincoln. Notably, Lincoln referred to the USDA as the ""people's department"", reflecting the agrarian basis of our economy back then."
T_P,"TSP.    	There seems to some uncertainty about the origin of the symbol ""Rx"", used for a medical prescription. One explanation is that it comes from the astrological sign for Jupiter, a symbol put on prescriptions to invoke Jupiter's blessing to help the patient recover. "
_OE,"DOE.    	A fawn is a young deer, usually less than a year old."
_DSEL,"EDSEL.    	It was Henry Ford's son, Edsel Ford, who gave his name to the Edsel make of automobile, a name that has become synonymous with ""failure""."
LO_,"LON.    	Lon McEachern is a sports commentator working for ESPN. McEachern is particularly well known for providing commentary for the World Series of Poker events. As a result, he has the nickname 'voice of poker'."
_YE,"LYE.    	What we call 'lye' is usually sodium hydroxide, although historically the term was used for potassium hydroxide. Lye has many uses, including to cure several foodstuffs. Lye can make olives less bitter, for example. The chemical is also found in canned mandarin oranges, pretzels and Japanese ramen noodles. More concentrated grades of lye are used to clear drains and clean ovens. Scary ..."
CO_TI,"COATI.    	A coati is a member of the raccoon family, and is also known as the Brazilian aardvark, or the snookum bear. They are native to Central and South America, but can be found in the southwest of the Untied States."
E_ON,"EBON.    	Ebony is another word for the color black (often shortened to ""ebon"" in poetry). Ebony is a dark black wood that is very dense, one of the few types of wood that sinks in water. Ebony has been in high demand so the species of trees yielding the wood are now considered threatened. It is in such short supply that unscrupulous vendors have been known to darken lighter woods with shoe polish to look like ebony, so be warned ..."
_PIA,"APIA.    	Apia is the capital city, and in fact the only city, of the Pacific island-nation of Samoa. The harbor of Apia is famous for a very foolish incident in 1889 involving seven naval vessels from Germany, the US and Britain. A typhoon was approaching so the safest thing to do was to head for open water away from land, but no nation would move its ships for fear of losing face in front of the others. Six of the ships were lost in the typhoon as a result and 200 American and German sailors perished. The British cruiser HMS Calliope barely managed to escape from the harbor and rode out the storm safely."
I_AS,IRAS.    	Individual retirement account (IRA)
_TS,"STS.    	GPS stands for Global Positioning System. The modern GPS system that we use today was built by the US military who received the massive funding needed because of fears during the Cold War of the use of Intercontinental Ballistic Missiles. We civilians, all round the world, owe a lot to President Ronald Reagan because he directed the military to make GPS technology available to the public for the common good. He was moved to do so after the Soviet Union shot down KAL flight 007 carrying 269 people, just because the plane strayed&nbsp;accidentally&nbsp;into Soviet airspace."
ST_,"STS.    	Famously, the layout of the streets in Washington was designed by French-born American architect Pierre Charles L'Enfant. The L'Enfant Plan called for a grid of east-west and north-south streets. This grid was criss-crossed with diagonal avenues. The avenues and streets met at circles and rectangular plazas. Later, the diagonal avenues were named for states of the union."
_NS,RNS.    	Registered nurses (RNs) are licensed medical (med.) personnel.
N_C,"NBC.    	""McMillan & Wife"" was a crime series on NBC TV, famously starring Rock Hudson as San Francisco police commissioner McMillan, and Susan Saint James as his wife. Towards the end of the run, Susan Saint James had a contract dispute with the producers, so her character was killed off, and THE show was renamed ""McMillan""."
E_ON,ECON.    	There are lots of graphs presented in an economics class.
_RO,"CRO.    	Ayla is a little Cro-Magnon girl who is orphaned and then adopted by a Neanderthal tribe, as told in ""The Clan of the Cave Bear"", the first of a series of novels written by Jean Auel that set in prehistoric times. I haven't read any of Auel's books myself, but they are on my reading to-do list as my wife recommends them. They sound interesting ..."
EMI_,"EMIL.    	Emil Jannings was an actor from Switzerland, who also held German and Austrian citizenship. Jannings was the first person to receive an Oscar, as the star of the 1928 silent movie called 'The Last Command'. He also starred opposite Marlene Dietrich in the 1930 classic 'The Blue Angel'."
_TF,"ATF.    	The Bureau of Alcohol, Tobacco, Firearms and Explosives (ATF) is today part of the department of Justice. The ATF has its roots in the Department of Treasury dating back to 1886 when it was known as the Bureau of Prohibition. ""Explosives"" was added to the ATF's name when the bureau was moved under the Department of Justice as part of the government reorganization called for in the Homeland Security Act of 2002."
_RICA,ERICA.    	'All My Children' was the first daytime soap opera to debut in the seventies. Star of the show was Susan Lucci who played Erica Kane. The show was cancelled in 2011 after having being on the air for 41 years.
ASTR_,ASTRO.    	The Houston baseball team changed its name to the Astros from the Colt .45s in 1965 when they started playing in the Astrodome. The Astrodome was so called in recognition of the city's long association with the US space program. The Astros moved from the National League to the American League starting in the 2013 season.
_AL,"VAL.    	Val d'Isère is a noted ski resort in south-eastern France, lying just 3 miles from the Italian border. If you've ever watched the British sitcom 'Absolutely Fabulous', Edina and Patsy used to holiday in Val d'Isère whenever they got they chance."
OP_,"OPS.    	""Black ops"" is the name given to covert operations, activities that are usually outside of standard military protocol and may even be against the law. Funding for black ops is usually provided by a secret ""black budget""."
FL_,"FLO.    	Rapper Tramar Dillard is better known as (but not by me!) rapper Flo Rida. As you might have guessed, Flo Rida was born in the state of Florida."
EWO_,"EWOK.    	The Ewoks are creatures that live on the moon of Endor, first appearing in ""Star Wars episode VI: Return of the Jedi"". They're the cute and cuddly guys that look like teddy bears."
KO_LA,"KOALA.    	The koala bear really does look like a little bear, but it's not even closely related. The koala is an arboreal marsupial and a herbivore, native to the east and south coasts of Australia. Koalas aren't primates, and are one of the few mammals other than primates who have fingerprints. In fact, it can be very difficult to tell human fingerprints from koala fingerprints, even under an electron microscope. Male koalas are called 'bucks', females are 'does', and young koalas are 'joeys'. I'm a little jealous of the koala, as it sleeps up to 20 hours a day ..."
IRA_I,IRANI.    	Tabriz is a large city in the very northwest of Iran.
A_ATI,"AMATI.    	The first of the Amati family to make violins was Andrea Amati, who lived in the 14th century. He was succeeded by his sons, Antonio and Girolamo. In turn, they were succeeded by Girolamo's son, Nicolo. Nicolo had a few students who achieved fame making musical instruments as well. One was his own son, Girolamo, and another was the famed Antonio Stradivari."
_OE,"DOE.    	Though the English court system does not use the term today, John Doe first appeared as the ""name of a person unknown"" in England in 1659, along with another unknown, Richard Roe. An unknown female is referred to as Jane Doe. Variants of 'John Doe' are 'Joe Blow' and 'John Q. Public'."
_EDA,"LEDA.    	In Greek mythology, Leda was the beautiful Queen of Sparta who was seduced by Zeus when he took the form of a swan. Leda produced two eggs from the union. One egg hatched into the beautiful Helen, later to be known as Helen of Troy and over whom was fought the Trojan War. The other egg hatched into the twins Castor and Pollux. Castor and Pollux had different fathers according to the myth. Pollux was the son of Zeus and was immortal, while Castor was the son of Leda's earthly husband, and so he was a mortal. William Butler Yeats wrote a famous sonnet called 'Leda and the Swan' in 1924. Peter Paul Rubens made a copy of a painting called 'Leda and the Swan' by Michelangelo, which is now lost."
A_N,"AYN.    	Ayn Rand was a Russian-American novelist born Alisa Rosenbaum. Her two best known works are her novels ""The Fountainhead"" published in 1943 and ""Atlas Shrugged"" in 1957. Back in 1951, Ayn Rand moved from Los Angeles to New York City. Soon after, she gathered a group of admirers around her with whom she discussed philosophy and shared drafts of her magnum opus, ""Atlas Shrugged"". This group called itself ""The Collective"", and one of the ""founding members"" was future Federal Reserve chairman, Alan Greenspan."
SLE_,"SLED.    	'Toboggan' came into English from the French Canadian ""tabagane"", the name for a long sled with a flat bottom. The French Canadian word is probably from the Algonquian word for a sled, ""tobakun"","
SI_,"SIM.    	""SimCity"" is a very clever computer game, in which players build and grow cities and societies by creating the conditions necessary for people (the Sims) to move in and thrive. ""SimCity"" first came out in 1989, and to this day is consistently ranked as one of the greatest computer games of all time."
RO_,"ROM.    	Romania sits just east of Hungary and north of Bulgaria in Europe. Romania was formed from the union of two principalities in 1859, Moldavia and Wallachia. The Kingdom of Romania grew larger in size after WWI with the addition of three new regions, including the ""vampirish"" Transylvania. After the collapse of the Soviet Union, the nation developed stronger ties with the West. Romania joined NATO in 2004 and the EU in 2007."
_TEM,"ITEM.    	An unmarried couple known to be involved with each other might appear in the gossip columns. This appearance as ""an item"" in the papers, led to the use of ""item"" to refer to such a couple, but only since the very early seventies."
OS_,"OSU.    	I think the rivalry here is the Big Ten football rivalry between Nebraska and Ohio State University, but I could be wrong ..."
D_E,"DIE.    	The verb phrase 'to peter out', meaning 'to fizzle out', originated in the 1840s in the American mining industry. While the exact etymology isn't clear, it probably derives from the term 'saltpetre', a constituent of gunpowder."
_EL,"DEL.    	Del Mar translates into English as 'of the sea' aptly enough. Also aptly enough, this upscale beach town started out as a purpose-built resort developed for the rich and famous, back in 1885. Desi Arnaz and Lucille Ball had a house there for many years, as did Burt Bacharach. Skateboarder Tony Hawks grew up in Del Mar."
ARK_,"ARKS.    	The term 'ark', when used with reference to Noah, is a translation of the Hebrew word 'tebah'. The word 'tebah' is also used in the Bible for the basket in which Moses was placed by his mother when she floated him down the Nile. It seems that the word 'tebah' doesn't mean 'boat' and nor does it mean 'basket'. Rather, a more appropriate translation is 'life-preserver' or 'life-saver'. So, Noah's ark was Noah's life-preserver during the flood."
ANO_E,"ANODE.    	Thermionic tube is another name for a vacuum tube, something we used to come across in old radios and televisions. The tube consists of two electrodes (an anode and cathode) encased in a vacuum in a sealed glass tube. The anode can be heated, just like a light-bulb, and will give off electrons, and so is said to be thermionic."
_FT,EFT.    	Electronic funds transfer (EFT)
_TOP,T-TOP.    	A T-top is a car roof that has removable panels on either side of a rigid bar that runs down the center of the vehicle above the driver.
IL_AD,"ILIAD.    	The Iliad is the epic poem by the Greek poet Homer, which tells the story of the siege of Ilium during the Trojan war."
_ON,"LON.    	Lon Chaney, Sr. played a lot of crazed-looking characters in the days of silent movies. He did much of his own make-up work, developing the grotesque appearances that became his trademark, and earning himself the nickname ""the man of a thousand faces"". Most famous were his portrayals of the title characters in the films 'The Hunchback of Notre Dame' (1923) and ""The Phantom of the Opera"" (1925)."
_SP,TSP.    	Teaspoon (tsp.)
E_IAC,"ENIAC.    	The acronym ENIAC stands for Electronic Numerical Integrator and Calculator (although many folks insist that the C was for ""Computer""). ENIAC was the first general-purpose electronic computer. It was designed to calculate artillery firing tables, but it ended up being used early on to make calculations necessary for the development of the hydrogen bomb. Given its uses, it's not surprising to hear that development of ENIAC was funded by the US Army during WWII."
ASIA_,"ASIAN.    	The so called ""Asian Flu"" was a pandemic that originated in China in 1956, and lasted until 1958. The H2N2 virus, which caused the disease, killed an estimated 2 million people worldwide, including almost 70,000 in the US. Years later, in 1997, the financial crisis that rocked many countries across Asia was given the same name, ""Asian Flu"". The crisis started in Thailand when the Thai currency collapsed, and like a virus the panic spread across much of southeast Asia and Japan."
_OLA,"LOLA.    	""Lola"" is a fabulous song, written by Ray Davies and released by the Kinks back in 1970. Inspired by a real life incident, the lyrics tell of young man who met a young ""lady"" in a club, danced with her, and then discovered ""she"" was actually a transvestite. The storyline isn't very traditional, but the music is superb."
S_ARR,"STARR.    	Ringo Starr's real name is Richard Starkey. Before he joined the Beatles (replacing drummer Pete Best), Starkey played with the Raving Texans. It was with this band that he adopted the name ""Ringo Starr"" because he were a lot of rings, and he thought it sounded ""cowboyish"". Back then his drum solos were billed as ""Starr Time""."
IR_S,IRAS.    	Individual retirement account (IRA)
WAC_,"WACO.    	The Texas Ranger Hall of Fame and Museum is a historical center for the Texas Ranger law enforcement agency. The museum is located in Waco, Texas and it was opened in 1968."
_XEL,AXEL.    	An Axel is a forward take-off jump in figure skating. It was first performed by Norwegian Axel Paulsen at the 1882 World Figure Skating championships.
_NISE,"ANISE.    	Jelly beans are thought to have originated in Boston, and it is documented that they were sent by families and friends of soldiers fighting in the Civil War."
AP_A,"APIA.    	Apia is the capital city, in fact the only city, of the Pacific island-nation of Samoa. The harbor of Apia is famous for a very foolish incident in 1889 involving seven ships from Germany, the US and Britain. A typhoon was approaching so the safest thing to do was to head for open water away from land, but no nation would move its ships for fear of losing face in front of the others. Six of the vessels were lost in the typhoon as a result and 200 American and German sailors perished. The British cruiser HMS Calliope barely managed to escape from the harbor and rode out the storm safely."
EMT_,EMTS.    	Emergency medical technician (EMT)
P_AT,PSAT.    	Preliminary Scholastic Aptitude Test (PSAT)
NE_F,"NERF.    	Nerf is the name given to a series of toys made out of a soft material, designed for ""safe"" play indoors. The Nerf material is used as ammunition, darts, and balls for example. The acronym NERF stands for Non-Expanding Recreational Foam."
R_S,"RAS.    	RAs are resident assistants or resident advisers, the peer leaders found in residence halls, particularly on a college campus."
_SAKA,"OSAKA.    	The Orix Buffaloes are the professional baseball team based in Osaka, Japan. Orix is a financial services company headquartered in Tokyo."
E_ON,"EBON.    	Ebony is another word for the color black (often shortened to ""ebon"" in poetry). Ebony is a dark black wood that is very dense, one of the few types of wood that sinks in water. Ebony has been in high demand so the species of trees yielding the wood are now considered threatened. It is in such short supply that unscrupulous vendors have been known to darken lighter woods with shoe polish to look like ebony, so be warned ..."
_ED,"QED.    	Q.E.D. is used at the end of a mathematical proof (or a philosophical argument). The acronym stands for the Latin ""quod erat demonstrandum"" meaning ""that which was to be demonstrated""."
_TF,"ATF.    	The Bureau of Alcohol, Tobacco, Firearms and Explosives (ATF) is today part of the Department of Justice. The ATF has its roots in the Department of Treasury dating back to 1886 when it was known as the Bureau of Prohibition. ""Explosives"" was added to the ATF's name when the bureau was moved under the Department of Justice as part of the reorganization called for in the Homeland Security Act of 2002."
