IS_,ISR.    	Bar-Ilan University (BIU) is a school in the Tel Aviv District of Israel. BIU opened for classes in 1955.
CE_AR,"CESAR.    	Cesar Millan is the real name of television's 'Dog Whisperer'. Millan has been working with overly aggressive dogs on his show 'Dog Whisperer with Cesar Millan' since 2004. Millan was an illegal immigrant from Mexico in the US back in 1990, became legal in 2000 and then became a US citizen in 2009."
_VES,"YVES.    	Yves Saint-Laurent was a French fashion designer, actually born in Algeria. Saint-Laurent started off working as an assistant to Christian Dior at the age of 17. Dior died just four years later, and as a very young man Saint-Laurent was named head of the House of Dior. However, in 1950 Saint-Laurent was conscripted into the French Army and ended up in a military hospital after suffering a mental breakdown from the hazing inflicted on him by his fellow soldiers. His treatment included electroshock therapy and administration of sedatives and psychoactive drugs. He was released from prison, managed to pull his life back together and started his own fashion house. A remarkable story ..."
N_ALE,NEALE.    	Greasy Neale was head coach of the Philadelphia Eagles from 1941-1950.
LO_,"LOU.    	Lou Reed is best known as a rock musician and songwriter, especially for his fabulous 1973 hit ""Walk on the Wildside"". Reed is less well known as a photographer, but he has published two collections of his work. The first was released in 2003 under the title ""Emotions in Action"", and the second in 2006 called ""Lou Reed's New York""."
CZ_R,"CZAR.    	At the second party congress of the Marxist Russian Social Democratic Labour Party in 1903, a split developed. The faction with the most support was led by Vladimir Lenin, and as they were in the majority, they became known as the Bolsheviks, derived from the Russian word for ""more"" or ""majority""."
NIK_,"NIKE.    	By now, everyone must know everything there is to know about Tiger Woods. But did you know that Tiger's real name is Eldrick Tont Woods? ""Tont"" is a traditional Thai name."
A_NO,AT NO.    	The element helium (He) has an atomic number (at. no.) of 2.
_ARP,TARP.    	A baseball diamond is often covered by a tarpaulin.
_MS,"OMS.    	Om is a sacred, mystic word from the Hindu tradition. It is sometimes used as a mantra, a focus for the mind in meditation."
Y_GA,"YOGA.    	In the West we tend to think of yoga as a physical discipline, a means of exercise that uses specific poses to stretch and strengthen muscles. While it is true that the ancient Indian practice of yoga does involve such physical discipline, the corporeal aspect of the practice plays a relatively small part in the whole philosophy. Other major components are meditation, ethical behavior, breathing and contemplation."
R_MA,"ROMA.    	In Italian, the city of Rome (Roma) is in Italy (Italia)."
_PY,"SPY.    	The character of Austin Powers was created by the actor who plays him, Mike Myers. Apparently Myers came up with the idea for Powers while listening to the Burt Bacharach song 'The Look of Love'."
ASLA_,"ASLAN.    	In the C. S. Lewis books, Aslan is the name of the lion character (as in ""The Lion, the Witch and the Wardrobe""). ""Aslan"" is actually the Turkish word for lion. Anyone who has read the books will recognize the the remarkable similarity between the story of Aslan and the story of Christ, including a sacrifice and resurrection."
_IE,"NIE.    	In German, not in a million years (eine Million Jahre), never (nie)."
AS_AM,"ASSAM.    	Assam is a state in the very northeast of India, just south of the Himalayas. Assam is noted for its tea, as well as its silk."
GER_,GERE.    	'American Gigolo' is a 1980 film starring Richard Gere as a Los Angeles male escort. 'American Gigolo' is famous for being the first movie in which a major Hollywood actor appeared in a full-frontal nude scene.
TB_,TBA.    	Something not yet on the schedule (sked) is to be advised (TBA).
CZ_R,"CZAR.    	The term czar (also tsar) is a Slavic word that was first used as a title by Simeon I of Bulgaria in 913 AD. ""Czar"" is derived from the word ""Caesar"", which was synonymous with ""emperor"" at that time."
_OH,"NOH.    	Noh is a form of musical drama in Japan that has been around since the 14th century. Many of the performers are masked, allowing all the roles to be played by men, both male and female parts."
_JAX,"AJAX.    	Ajax was a figure in Greek mythology, and was the cousin of Achilles. Ajaz is an important figure in Homer's 'Iliad'. According to Homer, Ajax was chosen by lot to meet Hector in an epic duel that lasted a whole day. The duel ended in a draw."
G_RE,"GERE.    	Richard Gere has played such great roles on the screen, and I find him to be a very interesting character off the screen. Gere has been studying Buddhism since 1978 and is a very visible supporter of the Dalai Lama and the people of Tibet."
NI_,"NIX.    	Our word ""nix"" is a German word, a variant of ""nichts"" meaning ""nothing""."
_SE,"-OSE.    	Sugars are usually named using the '-ose' suffix e.g. glucose, fructose, sucrose."
C_I,CGI.    	Computer-generated imagery(CGI)
_PP,"APP.    	When you buy your iPhone, you'll probably find yourself downloading loads of apps (applications)."
CA_I,"CALI.    	Baja California is both the most northern, and the most western of the Mexican states."
NEHR_,"NEHRU.    	Indira Gandhi's father was Jawaharlai Nehru, Prime Minister of India (and the Nehru of the Nehru Jacket). Indira herself became Prime Minister in 1966. She was assassinated in 1984 by two of her own bodyguards, as she was walking to meet Peter Ustinov who was to interview her for Irish television."
LOK_,"LOKI.    	Loki is a god appearing in Norse mythology. In one story about Loki, he was punished by other gods for having caused the death of Baldr, the god of light and beauty. Loki is bound to a sharp rock using the entrails of one of his sons. A serpent drips venom which is collected in a bowl, and then his wife must empty the venom onto Loki when the bowl is full. The venom causes Loki great pain, and his writing results in we poor humans experiencing earthquakes."
AR_ES,"ARIES.    	Aries is the first astrological sign in the Zodiac, and is named after the constellation. Your birth sign is Aries if you were born between March 21 and April 20, but if you are an Aries you would know that!"
AGO_A,"AGORA.    	In early Greece the ""agora"" was a place of assembly. Often the assemblies held there were quite formal, perhaps for the reading of a proclamation. Later in Greek history, things became less formal as the agora evolved into a market place. Our contemporary word ""agoraphobia"" comes from these agorae, in the sense that an agoraphobe has a fear of open spaces, a fear of ""public meeting places""."
_LTS,"BLTS.    	The BLT (bacon, lettuce and tomato) is the second most popular sandwich in the US, after the plain ham sandwich."
_UR,"OUR.    	'Our Mutual Friend' is the last novel that Charles Dickens finished, first published in 1865. The last novel that Dickens worked on is 'The Mystery of Edwin Drood', which he left unfinished."
YE_TA,"YENTA.    	Yenta (also ""Yente"") is actually a female Yiddish name. In Yiddish theater ""yenta"" came to mean a busybody."
_VES,"YVES.    	Yves Saint-Laurent (YSL) was a French fashion designer, actually born in Algeria. Saint-Laurent started off working as an assistant to Christian Dior at the age of 17. Dior died just four years later, and as a very young man Saint-Laurent was named head of the House of Dior. However, in 1950 Saint-Laurent was conscripted into the French Army and ended up in a military hospital after suffering a mental breakdown from the hazing inflicted on him by his fellow soldiers. His treatment included electroshock therapy and administration of sedatives and psychoactive drugs. He was released from hospital, managed to pull his life back together and started his own fashion house. A remarkable story ..."
ETA_S,ETATS.    	'Les États-Unis d'Amérique' is what French speakers call 'the United States of America'.
L_I,"LAI.    	The My Lai Massacre took place in the Vietnamese village of that name in March, 1968. After an investigation it was determined that at least 347 unarmed civilians, mostly women, children and elderly people, were murdered by a unit of US soldiers. It was also revealed that gang rapes and torture took place during the massacre. At least three servicemen tried to halt the killing, but they were outnumbered by those participating. About two years after the massacre, 26 men were charged with crimes, but only one man was convicted. William Calley was found guilty of murder and sentenced to life imprisonment and hard labor. President Nixon stepped in the day after Calley was sentenced and ordered him transferred from Leavenworth prison and placed under house arrest pending appeal. On appeal the life sentence was reduced to 20 years, and this was further reduced to 10 years as an act of clemency by the Secretary of the Army. Calley was released after serving three years in total."
A_TS,"ANTS.    	The 'echidna' is also called the spiny anteater. Just like the platypus, the echidna is a mammal that lays eggs."
EMU_,"EMUS.    	The emu has had a tough time in Australia since man settled there. There was even an ""Emu War"" in Western Australia in 1932 when migrating emus competed with livestock for water and food. Soldiers were sent in and used machine guns in an unsuccessful attempt to drive off the ""invading force"". The emus were clever, breaking their usual formations and adopting guerrilla tactics, operating as smaller units. After 50 days of ""war"", the military withdrew. Subsequent requests for military help for the farmers were ignored. The emus had emerged victorious ..."
C_S,CTS.    	Cents (cts.)
ET_TS,"ETATS.    	In French, members of the United Nations (les Nations Unies) are sovereign states (états)."
HANO_,"HANOI.    	Hanoi was the capital of North Vietnam, and Saigon the capital of South Vietnam. After the Vietnam War, Hanoi was made capital of the reunified state. Saigon, the larger metropolis, was renamed to Ho Chi Minh City. Hanoi is located in the delta of the Red River, and is just over 50 miles from the Gulf of Tonkin in the South China Sea."
A_RIE,AERIE.    	An aerie is the nest of an eagle.
_AM,"NAM.    	Air cavalry is an infantry unit, especially in the US Army, that is transported into combat by helicopter."
_DE,"-ADE.    	Powerade is one of those sports drinks, the only real competitor to Gatorade. Pepsi produces Gatorade, so in 1988 Coke introduced Powerade as a competing brand. I really do question the value of these hyped up beverages ..."
_ZAR,"CZAR.    	The term czar (also tsar) is a Slavic word, and was first used as a title by Simeon I of Bulgaria in 913 A.D. It is derived from the word Caesar, which was synonymous with emperor at that time."
OA_S,OARS.    	A scull is a rowing boat used for competitive rowing. The main hull of the boat is often referred to as a shell.
UL_E,"ULEE.    	""Ulee's Gold"" is a highly respected film from 1997 in which Peter Fonda plays the title role of Ulee. Ulee's ""gold"" is the honey that Ulee produces. It is a favorite role for Peter Fonda and he has shared that playing Ulee brought to mind his father, Henry Fonda, who himself kept a couple of hives. So if you see Peter Fonda in ""Ulee's Gold"" you're witnessing some characteristics that Peter saw in his father."
GER_,"GERE.    	Richard Gere has played such great roles on the screen, and I find him to be a very interesting character off the screen. Gere has been studying Buddhism since 1978 and is a very visible supporter of the Dalai Lama and the people of Tibet."
_TLO,"ST LO.    	Saint-Lô is a town in Normandy that was occupied by Germany in 1940. Saint-Lo stood at a strategic crossroads and so there was intense fighting there during the Normandy invasion of 1944. After a prolonged bombardment, very little of the town was left standing."
_US,"BUS.    	We use the term 'bus' for a mode of transportation, an abbreviated form of the original 'omnibus'. We imported 'omnibus' via French from Latin, in which language it means 'for all'. The idea is that an omnibus is a 'carriage for all'."
S_NE,"SINE.    	A sine wave is a mathematical function that describes a simple, smooth, repetitive oscillation. The sine wave is found right throughout the natural world. Ocean waves, light waves and sound waves all have a sine wave pattern."
RL_,"RLS.    	Robert Louis Stevenson was a Scottish author, famous for his novels 'Treasure Island', 'Kidnapped' and 'The Strange Case of Dr Jekyll and Mr Hyde'."
LA_RA,"LAURA.    	Laura Bush, wife of President George W. Bush, had her memoir ""Spoken from the Heart"" published in 2010. Born Laura Lane Welch, the former First Lady has a Master's degree in Library Science (as does my wife, my own First Lady!). Given that background, it's not surprising that two causes that Laura Bush focused on while in the White House were education and literacy. She established the annual National Book Festival, first held in Washington, D.C. in 2001, after having co-founded the Texas Book Festival in her home state."
_ETA,"BETA.    	In the world of software development, the first tested issue of a new program is usually called the ""alpha"" version. Expected to have a lot of bugs that need to be fixed, the alpha release is usually distributed to a small number of testers. After reported bugs have been eliminated, the refined version is called a ""beta"" and is released to a wider audience, but with the program clearly labeled as ""beta"". The users generally check functionality and report further bugs that are encountered. The beta version feeds into a release candidate, the version that is tested just prior to the software being sold into the market, bug-free. Yeah, right ..."
J_N,"JON.    	Jon Bon Jovi was born John Francis Bongiovi, Jr., and he is the leader of the band that took his name: Bon Jovi."
NF_,"NFL.    	The Washington Redskins NFL team were founded as the Boston Braves in 1932. The following year, the team moved to Fenway Park and the franchise name was changed to the Boston Redskins. The Redskins relocated to Washington in 1937."
O_OOLE,"O'TOOLE.    	""Ratatouille"" is a 2007 animated film produced by Pixar. The hero of the piece is Remy, a rat whose ambition is to become a chef. Remy was voiced by stand-up comedian Patton Oswalt. The veteran actor Peter O'Toole voiced the character Anton Ego, a restaurant critic."
E_N,"ERN.    	The ern (also erne) is also called the while-tailed eagle, and the sea-eagle."
_AJ,"RAJ.    	The period of colonial rule by the British in South Asia from 1858 to 1947 is referred to as the British Raj. Prior to 1858, the area was ruled by a private enterprise, the British East India Company. 'Raj' is the Hindi word for 'reign'."
S_LO,"ST LO.    	Saint-Lô is a town in Normandy that was occupied by Germany in 1940. Saint-Lo stood at a strategic crossroads and so there was intense fighting there during the Normandy invasion of 1944. After a prolonged bombardment, very little of the town was left standing."
O_R,"OUR.    	'Our Town' is a play by Thornton Wilder, first performed in 1938. Wilder won a Pulitzer for the work. 'Our Town' was actually banned by the Soviet authorities in East Berlin in 1946. Their reasoning was that 'the drama was too depressing and could inspire a German suicide wave'."
_SSISI,"ASSISI.    	St. Francis founded the Franciscan religious order in Assisi in 1208. He died in 1226, and was declared a saint just two years later in 1228."
_OK,"WOK.    	'Wok' is a Cantonese word, the name for the frying pan now used in many Asian cuisines."
EG_D,"EGAD.    	'Egad' developed as a polite way of saying ""oh God"" in the late 1600s and is an expression of fear or surprise somewhat like ""good grief!"""
_MAS,AMAS.    	The American Music Awards (AMAs) were created by Dick Clark for ABC in 1973 when the network lost the right to present the Grammy Awards.
LS_,LSU.    	LSU's full name is Louisiana State University and Agricultural and Mechanical College.
D_NA,"DANA.    	Dana Perino served as the White House Press Secretary from 2007 until 2009, working in the administration of President George W. Bush. Perino was the second woman to work as White House Press Secretary, with Dee Dee Myers having paved the way during the Clinton Administration."
A_SAM,"ASSAM.    	Assam is a state in the very northeast of India, just south of the Himalayas. Assam is noted for its tea, as well as its silk."
AER_E,"AERIE.    	An aerie is the nest of an eagle, and is also known as an 'eyrie'."
TE_L,"TEAL.    	The beautiful color of teal takes it name from the duck called a ""teal"", which has dark greenish-blue (teal) markings on its head and wings."
_ALA,"NALA.    	In ""The Lion King"", Nala is a lioness and the childhood friend of Simba."
EL_ZA,ELIZA.    	78D. See 28-Across : DOOLITTLE
ROM_,ROME.    	Nathaniel Hawthorne's romance 'The Marble Faun' was published in 1860 simultaneously in American and in England. The work had a different title on the other side of the Atlantic: 'Transformation'. The two different titles persist on either side of 'the pond' to this day.
AS_OT,ASCOT.    	The Gold Cup is held on day three of the Royal Ascot meeting each year. Day three of the meeting is also famously known as 'Ladies' Day' at Ascot.
SIN_,"SINE.    	A sine wave is a mathematical function that describes a simple, smooth, repetitive oscillation. The sine wave is found right throughout the natural world. Ocean waves, light waves and sound waves all have a sine wave pattern."
OS_,"-OSE.    	Sugars are usually named using the '-ose' suffix e.g. glucose, fructose, sucrose."
H_RO,"HERO.    	I think the reference is to Hearts for Heroes, a project designed to show appreciation for our troops fighting for us overseas. The main activity is the sending of ""hearts"" to soldiers on Valentine's Day."
NE_,NEC.    	NEC is the name that the Nippon Electric Company chose for itself outside of Japan after a re-branding exercise in 1983.
MEN_A,"MENSA.    	If you ever had to learn Latin, as did I, ""mensa"" was probably taught to you in Lesson One as it's the word commonly used as an example of a first declension noun. Mensa means ""table"". The Mensa organization for folks with high IQs was set up in Oxford, England back in 1946. To become a member, one is required to have an IQ that is in the top 2% of the population."
R_L,REL.    	Religion (rel.)
ANDE_,"ANDES.    	The Andes is the longest continuous chain of mountains in the world, running right down the length of the west coast of South America for about 4,300 miles. The highest peak in the range is Mt. Aconcagua, at an elevation of 22,841 feet. Interestingly, the peak of Mt. Chimborazo in Ecuador is the furthest point on the Earth's surface from the center of the planet. That's because of the equatorial ""bulge"" around the Earth's ""waist""."
ASS_SI,"ASSISI.    	St. Francis founded the Franciscan religious order in Assisi in 1208. He died in 1226, and was declared a saint just two years later in 1228."
ON_D,"ONE-D.    	The dimension of an object is defined as the minimum number of coordinates needed to specify each point in the object. Therefore a line is one-dimensional, as you only need an x-coordinate to specify a particular point on the line. A plane is two-dimensional, as you need both an x-coordinate and a y-coordinate to locate a point on the plane. The inside of a solid object is then three-dimensional, needing an x-, y- and z-coordinate to specify a point, say within a cube."
SO_,SOO.    	Jack Soo was a Japanese American actor noted for playing Detective Nick Yemana on the sitcom 'Barney Miller' in the seventies and eighties.
AGOR_,"AGORA.    	In early Greece the ""agora"" was a place of assembly. Often the assemblies held there were quite formal, perhaps for the reading of a proclamation. Later in Greek history, things became less formal as the agora evolved into a market place. Our contemporary word ""agoraphobia"" comes from these agorae, in the sense that an agoraphobe has a fear of open spaces, a fear of ""public meeting places""."
_LB,"ALB.    	Alberta is a big province, about the size of Texas. Alberta is named after Princess Louise Caroline Alberta, the fourth child of Queen Victoria and Prince Albert. Princess Louise also donated her name to Lake Louise, the large glacial lake in the province, now withing the bounds of Banff National Park. "
NI_E,"NINE.    	ZIP codes were introduced in 1963. The acronym ZIP stands for Zone Improvement Plan, a name indicating that mail travels more efficiently when the codes are included in the postal address."
ERI_,"ERIS.    	Eris is the largest known dwarf planet in our solar system. It is also the ninth largest body orbiting the sun, a fact that helped relegate Pluto (the tenth largest body) from its status of planet in 2006. Eris was discovered in 2005."
_ST,PST.    	Pacific Standard Time (PST)
M_GI,"MAGI.    	""Magi"" is the plural of the Latin word ""magus"", a term applied to someone who was able to read the stars. Hence, magi is commonly used with reference to the ""wise men from the East"" who followed the star and visited Jesus soon after he was born."
AE_O,AERO-.    	Aeroméxico is the flag carrier airline of Mexico. Aeroméxico started out in 1934 as Aeronaves de México.
ORE_S,"OREOS.    	How the Oreo cookie came to get its name seems to have been lost in the mists of time. One theory is that it comes from the French 'or' meaning 'gold', a reference to the gold color of the original packing. Another suggestion is that the name is the Greek word 'oreo' meaning 'beautiful, nice, well-done'."
_DZ,"ADZ.    	An adze (also adz) is similar to an axe, but different in that the blade of an adze is set at right angles to the tool's shaft. An axe's blade is set in line with the shaft."
A_NO,"AT NO.    	Tungsten is the chemical element with the symbol 'W' and the atomic number of 74. The name 'tungsten' is Swedish in origin, with 'tung sten' translating as 'heavy stone'. The material used in tungsten light bulbs is a tungsten alloy."
T_OS,"TAOS.    	The city of Taos, New Mexico is named for the Native American village nearby called Taos Pueblo. Taos is famous for its art colony. Artists began to settle in Taos in 1899, and the Taos Society of Artists was founded in 1915."
I_ERE,"ISERE.    	The Isère river gives its name to the French Department of Isère, located partly in the French Alps. In turn, Isère gave its name to a somewhat famous ship called the Isère, which in 1885 delivered the Statue of Liberty from France to America, in 214 crates."
O_ERI,OTERI.    	Cheri Oteri was the SNL cast member who regularly appeared with Will Farrell in the skit featuring a pair of Spartan cheerleaders.
GE_E,"GERE.    	Richard Gere and Juliette Binoche starred in 'The Bee Season', a 2005 movie adapted from the Myla Goldberg novel of the same name. The 'bee' in the title is a spelling bee."
OU_,"OUR.    	""Our Father ..."" are the opening words of the Lord's Prayer (""Pater Noster"" in Latin), which is probably the best-known prayer in the Christian tradition."
NE_LE,"NEALE.    	Zora Neale Hurston was an American author, most famous for her 1937 novel ""Their Eyes Were Watching God"". Like the author, the main character in the novel is an African American woman, a part played by Halle Berry in a television movie adaptation that first aired in 2005."
MENS_,"MENSA.    	If you ever had to learn Latin as did I, ""mensa"" was probably taught to you in lesson one as it's the word commonly used as an example of a first declension noun. Mensa means ""table"". The Mensa organization, for folks with high IQs, was set up in Oxford, England back in 1946. To become a member you are required to have an IQ that is in the top 2% of the population."
_US,"BUS.    	A busboy is a person who assists a waiter, mainly by clearing tables. The verb 'to bus' arose in the early 1900s and is probably a reference to the wheeled cart that was used to carry dishes."
BLT_,"BLTS.    	The BLT (bacon, lettuce and tomato) is the second most popular sandwich in the US, after the plain old ham sandwich."
OPU_,"OPUS.    	'Magnum opus' is a Latin term meaning 'great work'. The magnum opus of a writer or composer perhaps, is his or her greatest work."
TA_S,"TAOS.    	The city of Taos, New Mexico is named for the Native American village nearby called Taos Pueblo. Taos is famous for its art colony. Artists began to settle in Taos in 1899, and the Taos Society of Artists was founded in 1915."
M_D,"MAD.    	George III was King of Great Britain and Ireland until 1801, at which time he became the first king of the new state known as the United Kingdom of Great Britain and Ireland. George III was on the throne during turbulent times. He saw Britain defeat France in the Seven Years' War, Britain lose in the American War of Independence, and the defeat of Napoleon in the Battle of Waterloo. Famously, George became quite mad towards the end of his life. During that period, his eldest son George ruled as Prince Regent."
NAN_,"NANO.    	The iPod Nano is the successor to the iPod Mini and was introduced to the market at the end of 2005. There have been seven versions of the Nano to date and the current Nano as well as playing tunes is an FM player, records voice memos, has a pedometer and can connect with external devices (like a heart monitor, maybe) using Bluetooth technology."
UNT_,"UNTO.    	The Golden Rule is also known as the ethic of reciprocity, and is a basis for the concept of human rights. A version of the rule used in the Christian tradition is attributed to Jesus: 'Do unto others as you would have them do unto you'."
