BY_E,"BYTE.    	In the world of computers, a ""bit"" is the basic unit of information. It has a value of 0 or 1. A ""byte"" is a small collection of bits (usually 8), the number of bits needed to uniquely identify a character of text. The prefix giga- means 10 to the power of 9, so a gigabyte is 1,000,000,000 bytes."
AUT_,"AUTO.    	VW stands for Volkswagen, which translates from German into ""people's car"". The original ""Volkswagen"" was built under a directive from Adolf Hitler, who wanted a cheap car built that ordinary people could afford to purchase, and he awarded the contract to engineer Ferdinand Porsche, whose name (paradoxically) would forever be associated with high performance, expensive cars."
G_AM,"GUAM.    	Guam is a US territory in the western Pacific Ocean, the largest of the Mariana Islands. Guam is also the first territory in the United States to see the sun rise on any particular day. As such, the territory has adopted the motto, ""Where America's day begins"". During WWII, the US territory of Guam was occupied by the Japanese for 31 months until it was liberated in the Battle of Guam in July 1944. Of the 18,000 Japanese men holding the island, only 485 surrendered, so almost all perished in the invasion. One Japanese sergeant hid out on the island for an incredible 28 years, finally surrendering in 1972!"
R_CS,"ROCS.    	The mythical roc is a huge bird of prey, reputedly able to carry off and eat elephants."
L_CO,"LOCO.    	In Spanish, if one isn't 'sano' (sane) one might be described as 'loco' (crazy)."
ULCE_,"ULCER.    	Until fairly recently, a peptic ulcer was believed to be caused by undue amounts of stress in one's life. It is now known that 70-90% of all peptic ulcers are in fact associated with a particular bacterium."
A_RON,"AKRON.    	The University of Akron was founded as a small college in 1870 by the Universalist Church, which handed it over to the city of Akron in 1913. Today the school is part of Ohio's State University system, and is renowned for its research into the science of polymers."
_ATL,"NATL.    	The Soviet Union launched the Sputnik satellite towards the end of 1957, a development that shocked the establishment in the US. Within months, President Eisenhower created the Advanced Research Projects Agency (ARPA, now DARPA) and the National Aeronautics and Space Administration (NASA). The Space Race had begun ..."
S_ENOS,"STENOS.    	Stenography is the process of writing in shorthand. The term comes from the Greek ""steno"" (narrow) and ""graphe"" (writing)."
RADO_,"RADON.    	Radon is a radioactive gas, a byproduct produced when uranium decays naturally in the earth. Radon gas can collect and accumulate in buildings and rooms that are particularly well insulated with very little air exchange. The danger is very real, as radon is listed as the second most frequent cause of lung cancer after cigarette smoke."
"I,_INA","I, TINA.    	""I, Tina"", the 1986 autobiography of Tina Turner. The book was so successful, it was adapted into a movie ""What's Love Got to Do With It?"", released in 1993 and starring Angela Bassett as Tina Turner."
SE_,SER.    	Martin Luther King Jr. often delivered a sermon.
O_H,"OSH.    	Osh is the second largest city in the former Soviet Republic of Kyrgyzstan. Osh was a center of silk production and lies along the old Silk Road, the trade route that traversed Asia."
S_LO,"SILO.    	'Silo' is a Spanish word that we absorbed into English, originally coming from the Greek word ""siros"" that described a pit in which one kept corn."
F_U,"FLU.    	Influenza (flu) is an ailment that is caused by a virus. The virus is readily inactivated by the use of soap, so washing hands and surfaces is especially helpful in containing flu outbreaks."
EL_ID,"EL CID.    	Rodrigo Diaz de Vivar was known as El Cid Campeador, which translates as ""The Champion"" or perhaps ""The Lord, Master of Military Arts"". El Cid was a soldier who fought under the rule of King Alfonso VI of Spain (among others). However, he was sent into exile by the King in 1080, after acting beyond his authorization in battle. El Cid then offered his services to his former foes, the Moorish kings, After a number of years building a reputation with the Moors, he was recalled from exile by Alfonso. By this time El Cid was very much his own man. Nominally under the orders of Alfonso, he led a combined army of Spanish and Moorish troops and took the city of Valencia on the Mediterranean coast, making it is headquarters and home. He died there, quite peacefully in 1099."
EW_,EWE.    	Lanolin is a greasy substance secreted from the skin of woolly animals. It usually extracted from wool sheared from sheep for use in textiles. Medical grade lanolin is used to soothe skin in ointments. It is a relatively hypoallergenic and has antibacterial properties.
IRI_H,IRISH.    	Begorrah ...
S_TS,SETS.    	There might be three or five sets in a tennis match.
LE_O,"LETO.    	Jared Leto is an actor and musician. In the world of music, Leto is the lead singer and rhythm guitarist for the rock band 30 Seconds to Mars. In the film world his most critically acclaimed role was that of a heroin addict in ""Requiem for a Dream"". He also appeared in ""American Psycho"", ""Panic Room"" and ""Lord of War""."
ME_,"MEG.    	In the world of computers, a ""bit"" is the basic unit of information. It has a value of 0 or 1. A ""byte"" is a small collection of bits (usually 8), the number of bits needed to uniquely identify a character of text. The prefix mega- stands for 10 to the power of 6, so a megabyte (meg) is 1,000,000 bytes. And the prefix giga- means 10 to the power of 9, so a gigabyte (gig) is 1,000,000,000 bytes. Well, those are the SI definitions of megabyte and kilobyte. The purists still use 2 to the power of 20 for a megabyte (i.e. 1,048,576), and 2 to the power of 30 for a gigabyte."
DOD_,"DODO.    	The dodo was a direct relative of the pigeon and dove, although the fully grown dodo was usually three feet tall. One of the reasons the dodo comes to mind when we think of extinction of a species, is that it disappeared not too long ago, in the mid-1600s, and humans were the reason for its demise. The dodo lived exclusively on the island of Mauritius, and when man arrived he cut back the forest that was its home, and introduced domestic animals, such as dogs and pigs, that ransacked the dodo's nests."
_NDIA,"INDIA.    	Bollywood is an informal name given to the huge film industry based in Mumbai in India. The term ""Bollywood"" is a melding of ""Bombay"", the old name for Mumbai, and of course Hollywood."
_REE,"TREE.    	Maine's state flag features the state coat of arms on a blue background. The center of the shield depicts a moose resting under a pine tree, and the shield is supported by a farmer and seaman. The North Star sits atop the shield."
ARSE_AL,"ARSENAL.    	Our word ""arsenal"" comes from the Italian ""arzenale"", a work adapted from the Arabic for ""workshop"". There was a large wharf in Venice called the Arzenale that became associated with the storage of weapons and ammunition, and this led to our contemporary usage."
_EA,"BEA.    	Actress Bea Arthur's most famous roles were on television, as the lead in the 'All in the Family' spinoff 'Maude' and as Dorothy Zbornak in 'The Golden Girls'. Arthur also won a Tony for playing Vera Charles on stage in the original cast of 'Mame' in 1966, two years after she played Yente the matchmaker in the original cast of 'Fiddler on the Roof'."
SI_,"SIX.    	Boxcars is a slang term for two sixes rolled on a pair of dice, particularly in the game of craps. The idea is that the twelve pips on the dice resemble a pair of boxcars on a freight train."
MS_,"MSU.    	Michigan State University (MSU) is located in East Lansing, Michigan. MSU has the largest study-abroad program of any single-campus university in the US. Programs are offered on all continents of the world, including Antarctica. MSU's athletic teams are called the Spartans."
UTIC_,"UTICA.    	Today, Utica in New York is known as 'Second Chance City' due to the recent influx of refugees from war-torn parts of the world, and from Bosnia in particular. These immigrants have helped revitalize the area and reverse a trend of population loss."
SAN_,"SANS.    	In French, one can be with (avec) or without (sans)."
M_S,"MGS.    	My neighbor used to keep his MG Midget roadster in my garage (away from his kids!) back in Ireland many moons ago. The Midget was produced by MG division of the British Motor Corporation from 1961 to 1979, with the MG acronym standing for 'Morris Garages'."
PJ_,"PJS.    	Our word ""pajamas"" comes to us from the Indian subcontinent, where ""pai jamahs"" were loose fitting pants tied at the waist and worn at night by locals and ultimately by the Europeans living there. And ""pajamas"" is another of those words that I had to learn to spell differently when I came to America. In the British Isles the spelling is ""pyjamas""."
MET_,"META.    	In recent decades the prefix 'meta-' has started to be used as a standalone adjective. In this sense 'meta' means 'self-referential', describing something that refers to itself. For example, 'This sentence starts with the word 'this' and ends with the word 'this'' might be called a meta sentence. A movie that is about the making of the very same movie could also be described as meta."
DO_,"D'OH.    	""The Simpsons"" is one of the most successful programs produced by the Fox Broadcasting Company. Homer Simpson's catchphrase is ""D'oh!"", which is such a famous exclamation that it has been included in the Oxford English Dictionary (OED) since 2001."
G_T,"GMT.    	Greenwich Mean Time (GMT) is the time at the Prime Meridian, the meridian that runs through Greenwich in London."
IT_LO,"ITALO.    	As well as being an author, Italo Calvino was a famous Italian journalist. He was a supporter of communism and so wasn't very popular in the US nor in Britain."
IT_LO,"ITALO.    	As well as being an author, Italo Calvino was a famous Italian journalist. He was a supporter of communism and so wasn't very popular in the US nor in Britain."
ME_CA,"MECCA.    	The central hotel building of the Abraj Al-Bait Towers complex in Mecca is crowned by a magnificent clock tower. The clock tower is topped by 75-foot tall golden crescent that weighs about 35 tonnes. Just below are four clock faces, 43 meters in size, the world's largest clock faces. To me, the clock tower resembles the Palace of Westminster clock tower ('Big Ben'), but the Abraj Al-Bait tower is 35-times larger."
M_L,"MIL.    	One G, one grand, one thousand dollars ..."
J_NE,"JANE.    	In Jane Austen's novel 'Pride and Prejudice', Mr. and Mrs. Bennet have five daughters. They are, ranked from the eldest:"
A_ES,"ABES.    	""Abe"" is slang for a five-dollar bill."
EVI_A,"EVITA.    	""Evita"" was the follow-up musical to ""Jesus Christ Superstar"" for composer Andrew Lloyd Weber and lyricist Tim Rice. Both of these works were originally released as album musicals, and very successful ones at that. I remember buying them when they first came out in the seventies ..."
_ION,"LION.    	Bert Lahr's most famous role was that of the cowardly lion in ""The Wizard of Oz"". Lahr had a long career in burlesque, vaudeville and on Broadway. Remember the catchphrase made famous by the cartoon character Snagglepuss, ""Heavens to Murgatroyd!""? Snagglepuss stole that line from a 1944 movie called, ""Meet the People"" in which it was first uttered by Bert Lahr."
L_L,"LIL.    	Here's yet another rapper, Lil Wayne. His real name is Dwayne Carter, Jr."
F_D,"FAD.    	There were originally just nine Beanie Babies when Ty Warner Inc introduced the stuffed animal in 1993. In the late nineties the toy became a real fad, largely due to innovative marketing techniques. For example, there was no mass marketing with constant TV ads, and the production volume was limited pushing the line into the real of collectibles. Beanie Baby models were also ""retired"" on a regular basis, fueling a ""must have"" behavior in the market."
S_LEO,"ST LEO.    	Pope Saint Leo the Great is famous for having met with the feared Attila the Hun, and persuading him to turn back his invading force that was threatening to overrun Western Europe."
_EN,"E'EN.    	In poetry, e'en is used as a contraction for evening, but also for the adverb ""even""."
T_R,"TER.    	Ter is the Latin word for ""three"", commonly used in the medical world on prescriptions as part of the expression ""ter in die"". ""Ter in die"" is Latin for ""three times a day"", abbreviated to ""TID"". ""Bis in die"" (BID) would be twice a day, and ""quater in die"" (QID) would be four times a day."
T_E,"THE.    	In French, a cup of tea (thé) might be served with milk (au lait)."
N_ET,"NEET.    	The hair removal product ""Neet"" was launched in Canada in 1901, and was also sold as ""Immac"". Today it is sold under the name ""Veet""."
STE_,"STES.    	Some holy women in France are saints (saintes, in French)."
A_IS,"ANIS.    	Anis is a Spanish liqueur, equivalent to what's called anisette in other countries (in France, for example). It has a licorice taste as it is produced by distilling the seeds of the anis plant. Like all anis-type drinks, it is usually mixed with water and turns a milky white color when the water is added."
ODE_N,ODEON.    	Several older movie theaters in the US bear the name 'Odeon Theater'.
A_PS,"AMPS.    	An electric guitar, for example, needs an amplifier (amp) to take the weak signal created by the vibration of the strings and turn it into a signal powerful enough for a loudspeaker."
MO_T,"MOET.    	Moët & Chandon is a French winery, one of the world's largest producers of champagne. The company was founded by wine trader Claude Moët in 1743. The name was changed to Moët & Chandon in the 1830s when Pierre-Gabriel Chandon, an in-law to the Moët family, was given co-ownership. Moët & Chandon owns the famous Dom Pérignon brand name, honoring the Benedictine monk who did so much to improve the quality of champagne."
SCIO_,"SCION.    	Scion comes from the old French word sion or cion, meaning ""a shoot or a twig"". In botanical terms today, a scion is used in grafting two compatible plants together. In grafting, one plant is selected for its root system (the 'rootstock'), and the other plant is selected for its stems, leaves and fruit (the scion). The term scion migrated naturally into the world of family history. A scion is simply a descendant, a son or a daughter, and therefore a branching point in the family tree."
SIER_A,SIERRA.    	The GMC Sierra truck is also sold as the Chevrolet Silverado.
_IT,"RIT.    	Rit. (or sometimes ritard.) is the abbreviation for ritardando, the musical direction to slow down the tempo."
L_S,LBS.    	The unit of mass that we know today as a 'pound' is descended from the old Roman unit of weight known as a 'libra'. That 'libra' connection is why we abbreviate pound to 'lb'. The name 'pound' though comes from the Latin 'pondo' meaning 'weight'.
MAN_,"MANN.    	Thomas Mann was a German novelist whose most famous work is probably his novella ""Death in Venice"", originally published in German in 1912 as ""Der Tod in Venedig"". The story was famously adapted for the big screen in 1971, in a movie starring Dirk Bogarde."
M_ON,"MOON.    	All of the twenty-seven moons of the planet Uranus are named for characters from literature, characters created by William Shakespeare and Alexander Pope. The five major moons are so large that they would be considered planets in their own right if they were orbiting the sun directly. The names of these five moons are:"
_NK,INK.    	'Ink' and 'press' are both informal terms meaning 'coverage in the news media'.
Z_P,"ZIP.    	The term ""fly"" is used to describe the flap covering the buttons or zipper in the front of a pair of pants. Before ""fly"" was used for pants, it was the name given to a tent flap."
_RI,"TRI-.    	The triceratops is that dinosaur that kind of looked like a rhinoceros, but with three horns. The name ""triceratops"" is derived from the Greek for ""three-horned face""."
PE_,PER.    	Miles per hour (mph)
A_S,"AUS.    	The name 'Austria' is a Latin variant of the German name for the country: 'Österreich'. 'Österreich' itself means 'Eastern borderlands', a reference to the country&#8217;s history as a prefecture of neighboring Bavaria to the west."
IN_,"IN F.    	Although I love all of Beethoven's symphonies, I tend not to listen very often to the 8th. Chronologically, it is squeezed between my favorite, the 7th, and the magnificent 9th. I think I should point out that Beethoven considered the 8th a far better piece than the 7th, but his public tended not to agree."
U_IS,UZIS.    	The first Uzi submachine gun was designed in the late 1940s by Major Uziel Gal of the Israel Defense Forces who gave his name to the gun.
AXI_,AXIS.    	A mathematical reflection reflects on or around an axis.
TRE_,"TREE.    	A steppe is a grassland, devoid of trees apart from those growing near rivers and lakes. We would likely call such a geographic feature a prairie in this country."
_ABLO,"PABLO.    	""Tortilla Flat"" was the first of John Steinbeck's novels to become a commercial success, published in 1935. The novel was made into a film of the same name in 1942 starring Spencer Tracy and Hedy Lamarr (with Akim Tamiroff playing Pablo)."
_ITT,"PITT.    	William Pitt was Prime Minister of Britain from 1766 to 1768. He lent his name to the city of Pittsburgh, Pennsylvania."
_AAN,"NAAN.    	Naan (also 'nan') bread is very popular in Indian restaurants, as well as in other West, Central and South Asian cuisines. Indian Naan is traditionally baked in a clay oven known as a tandoor."
R_SIE,"ROSIE.    	Rosie Perez is an American actress born in New York City of Puerto Rican descent. As well as pursuing her acting career, Perez is an activist promoting Peurto Rican rights, and was arrested in 2000 at a rally to protest US Navy weapons-training off the coast of Puerto Rica."
BB_,"BBS.    	A BB gun is an air pistol or rifle that shoots birdshot known as BBs. Birdshot comes in a number of different sizes, from size 9 (0.070&#8243; in diameter) to size FF (.230&#8243;). Birdshot that is size BB (0.180"" in diameter) gives the airgun its name."
PERO_,"PEROT.    	Ross Perot graduated from the US Naval Academy in 1953, as president of his class. He served his 4-year commitment but then apparently resigned his commission, being somewhat disillusioned with the navy."
_GS,"MGS.    	My neighbor used to keep his MG Midget roadster in my garage (away from his kids!) back in Ireland many moons ago. The Midget was produced by MG division of the British Motor Corporation from 1961 to 1979, with the MG acronym standing for 'Morris Garages'."
_AMB,"JAMB.    	A door jamb is the vertical portion of a door frame. The term ""jamb"" comes from the French word ""jambe"" meaning ""leg""."
M_S,"MGS.    	My neighbor used to keep his MG Midget roadster in my garage (away from his kids!) back in Ireland many moons ago. The Midget was produced by MG division of the British Motor Corporation from 1961 to 1979, with the MG acronym standing for 'Morris Garages'."
_RTS,"ARTS.    	The Academy of Motion Picture Arts and Sciences (AMPAS) is the organization that gives the annual Academy Awards also known as the ""Oscars"". The root of the name ""Oscar"" is hotly debated, but what is agreed is that the award was officially named ""Oscar"" in 1939."
_UMA,PUMA.    	Puma is a German company that sells athletic shoes worldwide. The company is most famous for its line of soccer boots.
T_NOR,TENOR.    	The purport or tenor of something is its general sense.
OPIA_E,"OPIATE.    	Opiates are the narcotic alkaloids found in the opium poppy plant, although some synthetic versions and derivatives of the same alkaloids are also called opiates. To produce opiates, the latex sap of the opium poppy is collected and processed. The naturally occurring drugs of morphine and codeine can both be extracted from the sap. Some synthesis is required to make derivative drugs like heroin and oxycodone."
KOB_,"KOBE.    	Kobe Bryant played basketball for the LA Lakers. Kobe Bryant got his name from a menu would you believe? His parents were in a Japanese restaurant and liked the name of ""Kobe"" beef, the beef from around the city of Kobe on the island of Honshu in Japan."
_ITAR,"SITAR.    	The sitar has been around since the Middle Ages. The sitar is a stringed instrument that is played by plucking, and is used most often in Hindustani classical music. In the West we have been exposed to the instrument largely through the performances of Ravi Shankar and some music by George Harrison of the Beatles, a onetime student of Shankar."
U_IS,"UZIS.    	The first Uzi submachine gun was designed in the late 1940s by Major Uziel 'Uzi' Gal of the Israel Defense Forces, who gave his name to the gun."
M_U,MSU.    	Michigan State University's (MSU's) athletic team is known as the Spartans.
_AVA,"LAVA.    	Pumice is volcanic rock that is formed by lava cooling, but with bubbles in it due to water and carbon dioxide frothing out of the lava as it cools. Because of the frothy structure, pumice is relatively light and is a great thermal insulator. As such, it is used in construction to make insulating breeze blocks."
NN_,"NNE.    	Hurricanes are given names primarily to help the public keep track dangerous systems. The names are decided ahead of the hurricane season, with the first system given a name beginning with A, the second, B etc. The names are alternated between male and female names throughout the season. Also, if the first storm of the season is male, then the following year a female name is chosen. For hurricanes in the North Atlantic, names are assigned for every letter, except Q, U, X, Y and Z."
SIE_RA,SIERRA.    	The GMC Sierra truck is also sold as the Chevrolet Silverado.
K_EV,"KIEV.    	Kiev is the capital city of Ukraine, and a beautiful city from what I've heard from friends that have visited."
B_W,BTW.    	By the way (BTW)
G_AM,"GUAM.    	Guam is a US territory in the western Pacific Ocean, the largest of the Mariana Islands. Guam is also the first territory in the United States to see the sun rise on any particular day. As such, the territory has adopted the motto, ""Where America's day begins"". During WWII, the US territory of Guam was occupied by the Japanese for 31 months until it was liberated in the Battle of Guam in July 1944. Of the 18,000 Japanese men holding the island, only 485 surrendered, so almost all perished in the invasion. One Japanese sergeant hid out on the island for an incredible 28 years, finally surrendering in 1972!"
T_BU,TABU.    	Tabu is a whole line of cosmetics and perfumes produced by the House of Dana. The company's brand names were purchased by a Florida company called Dana Classic Fragrances in 1999.
TO_H,"TOSH.    	""Tosh"" is British slang for ""foolish nonsense"", and is likely a combination of ""trash"" and ""bosh""."
ER_T,"ERST.    	Erstwhile means ""in the past"" or ""once upon a time""."
J_B,"JEB.    	I always thought that Jeb was an American nickname for James or Joseph but I must be wrong, because George and Barbara's son John Ellis Bush is called ""Jeb"". A kind blog reader has suggested the the name ""Jeb"" may have been chosen as JEB are the initials of John Ellis Bush."
U_I,"UNI.    	Uni is short for ""university""."
_HORA,"AHORA.    	""Ahora"" is the Spanish for ""now"", as is 'hoy día'."
BO_A,BONA.    	'Bona' translates from Latin as 'good'.
SE_IA,"SEPIA.    	Sepia is that lovely rich, brown-grey color so common in old photographs. ""Sepia"" is the Latinized version of the Greek word for cuttlefish, as sepia pigment is derived from the ink sac of the cuttlefish.The ""sepia tone"" of old photographs is not the result of deterioration over time. Rather, it is the result of a deliberate preservation process which converts the metallic silver in the photographic image to a more stable silver sulfide. Prints that have been sepia-toned can last in excess of 150 years."
I_TINA,"I, TINA.    	Tina Turner is actually a stage name, used by Anna Mae Bullock, the ""Queen of Rock 'n' Roll"". Turner has always loved Europe, and moved there in the eighties. She now splits her time between her homes in England, France and Switzerland."
EL_E,"E LEE.    	Mary Anna Custis was a popular young lady, and at one time was courted by Sam Houston, who was to play such a large role in the history of Texas. But instead, Mary Anna opted to marry her second cousin and childhood friend, Robert E. Lee."
ME_,"MEG.    	In the world of computers, a ""bit"" is the basic unit of information. It has a value of 0 or 1. A ""byte"" is a small collection of bits (usually 8), the number of bits needed to uniquely identify a character of text. The prefix mega- stands for 10 to the power of 6, so a megabyte (meg) is 1,000,000 bytes. And the prefix giga- means 10 to the power of 9, so a gigabyte (gig) is 1,000,000,000 bytes."
_RTS,"ORTS.    	Orts are small scraps of food left after a meal. 'Ort' comes from Middle English, and originally described scraps left by animals."
PU_A,"PUMA.    	Puma is a German company that sells athletic shoes worldwide, but is most famous for producing soccer boots."
TS_S,"TSO'S.    	General Tso's chicken is an American creation, often found on the menu of a Chinese restaurant. The name General Tso may be a reference to General Zuo Zongtang of the Qing Dynasty, but there is no clear link."
S_AR,SCAR.    	Nice one ...
