SI_M,SIAM.    	Siam was the official name of Thailand up to 1939 (and from 1945 to 1949).
AS_AN,"ASLAN.    	In the C. S. Lewis books, Aslan is the name of the lion character (as in ""The Lion, the Witch and the Wardrobe""). Aslan is actually the Turkish word for lion. Anyone who has read the books will recognize the the remarkable similarity to the story of Aslan and the story of Christ, including a sacrifice and resurrection."
NIN_,NINE.    	The musical 'Nine' is based on the Federico Fellini movie '8&#189;'. I guess we 'rounded up' for the stage show ...
UGL_,"UGLI.    	The ugli fruit is a hybrid of an orange and a tangerine, first discovered growing wild in Jamaica where most ugli fruit comes from today. 'UGLI' is a trademark name that is a variant of 'ugly', a nod to the fruits unsightly wrinkled rind."
J_E,"JOE.    	It seems that no one really knows why we refer to coffee as ""joe"", but we've been doing so since early in WWII."
O_ED,"ONE-D.    	The dimension of an object is defined as the minimum number of coordinates needed to specify each point in the object. A line, therefore, is one-dimensional as you only need an x-coordinate to specify a particular point on the line. A surface is two-dimensional, as you need both an x-coordinate and a y-coordinate to locate a point on the surface. The inside of a solid object is then three-dimensional, needing an x-, y- and z-coordinate to specify a point, say within a cube."
AORT_,AORTA.    	The aorta originates in the heart and extends down into the abdomen. It is the largest artery in the body.
SA_,"SAX.    	The saxophone was invented by Belgian, Adolphe Sax. Strangely, he developed lip cancer at one point in his life, but recovered. I had the privilege of visiting his grave in the Cemetery of Montmartre in Paris a few years ago."
YENT_,YENTA.    	Yenta (Yente) is actually a female Yiddish name. In Yiddish theater it came to mean a busybody.
S_AM,"SIAM.    	Siamese twins are identical twins who are conjoined. Famously, the conjoined twins Chang and Eng Bunker traveled with P.T. Barnum's circus in the last half of the 19th century. The Bunker twins were billed as the Siamese Twins, as they were born in Siam, which is now Thailand. This led to the condition being called 'Siamese twins'."
_DSELS,"EDSELS.    	It was Henry Ford's son Edsel, who gave his name to the Edsel brand of automobile, a name that has become synonymous with ""failure""."
A_EVE,ALEVE.    	Aleve is a brand name used for the anti-inflammatory drug Naproxen sodium.
LLA_A,LLAMA.    	Many female mammals lick off their newborn. That's not an option for llamas as their tongues only reach out of their mouths about half an inch. Instead llama dams nuzzle their young and hum to them.
_REOS,"OREOS.    	The Oreo was the biggest selling cookie in the 20th century, and almost 500 billion of them have been produced since they were introduced in 1912 by Nabisco. In those early days the creme filling was made with pork fat, but today vegetable oils are used instead. If you take a bite out of an Oreo sold outside of America you might notice a difference from the homegrown cookie, as coconut oil is added in the overseas version to give a different taste."
E_LAT,"ECLAT.    	Éclat can mean a brilliant show of success, or the applause or accolade that one receives. The word derives from the French ""éclater"" meaning ""to splinter, burst out""."
_TO,"OTO.    	The Otoe (also Oto) Native American tribe originated in the Great Lakes region as part of the Winnebago or Siouan tribes. The group that would become the Otoe broke away from the Winnebago and migrated southwestwards ending up in the Great Plains. In the plains the Otoe adopted a semi-nomadic lifestyle dependent on the horse, with the American bison becoming central to their diet."
ASLA_,"ASLAN.    	In the C. S. Lewis books, Aslan is the name of the lion character (as in ""The Lion, the Witch and the Wardrobe""). Aslan is actually the Turkish word for lion. Anyone who has read the books will recognize the the remarkable similarity to the story of Aslan and the story of Christ, including a sacrifice and resurrection."
CH_I,"CHAI.    	Chai is a drink made from spiced black tea, honey and milk. ""Chai"" is the Hindi word for ""tea"". We often called tea ""a cup of char"" growing up, with ""char"" being the slang word for tea derived from ""chai""."
SIA_,SIAM.    	Siam was the official name of Thailand up to 1939 (and again from 1945 to 1949).
_ATE,"TATE.    	The days ""the Tate"" is actually made up of four separate galleries in England. The original Tate gallery was founded by Sir Henry Tate as the National Gallery of British Art. It is located on Millbank in London, on the site of the old Millbank Prison, and is now called Tate Britain. There is also the Tate Liverpool in the north of England located in an old warehouse, and the Tate St. Ives in the west country located in an old gas works. My favorite of the Tate galleries is the Tate Modern which lies on the banks of the Thames in London. It's a beautiful building, a converted power station, that you have to see to believe."
_NIT,"UNIT.    	A peck is a unit of dry volume, equivalent to two gallons. Four pecks then make up a bushel."
S_C,"SAC.    	Sacrifice fly, in baseball ..."
_BC,"NBC.    	Parks and Recreation' is a sitcom that started airing on NBC in 2009, and it is a show that has grown on me. It stars the ""Saturday Night Live"" alum, Amy Poehler. The creators of ""Parks and Recreation"" are part of the team responsible for the American version of 'The Office', so you'll notice some similarities in the style of the two shows, and some actors that have appeared in both."
A_L,ALL.    	'All My Children' was the first daytime soap opera to debut in the seventies. Star of the show was Susan Lucci who played Erica Kane. The show was cancelled in 2011 after having being on the air for 41 years.
_NTS,"ANTS.    	The aardvark is the oddest looking of creatures, a nocturnal burrowing animal, native to Africa. The name ""aardvark"" is Afrikaans for ""earth pig"", although it is not in fact related to the pig. Aardvarks are noted, among other things, for their unique teeth. Their teeth have no enamel and wear away quite readily, but continuously regrow."
_NOLA,"ENOLA.    	As we all know, the Enola Gay was the B-29 that dropped the first atomic bomb, on Hiroshima in August 1945. Enola Gay was the name of the mother of the pilot, Col. Paul W. Tibbets, Jr."
_GORA,"AGORA.    	In early Greece the ""agora"" was a place of assembly. Often the assemblies held there were quite formal, perhaps for the reading of a proclamation. Later in Greek history, things became less formal as the agora evolved into a market place. Our contemporary word ""agoraphobia"" comes from these agorae, in the sense that a sufferer has a fear of open spaces, a fear of ""public meeting places""."
ANOD_,"ANODE.    	A battery is a device that converts chemical energy into electric energy. A simple battery is made up of three parts: a cathode, an anode and a liquid electrolyte. Ions from the electrolyte react chemically with the material in the anode producing a compound and releasing electrons. At the same time, the electrolyte reacts with the material in the cathode, absorbing electrons and producing a different chemical compound. In this way, there is a buildup of electrons at the anode and a deficit of electrons at the cathode. When a connection (wire, say) is made between the cathode and anode, electrons flow through the resulting circuit from the anode to cathode in an attempt to rectify the electron imbalance."
_LF,"ELF.    	One of Santa's elves might be said to ""hold a position"" making toys at the North Pole ..."
COAT_,"COATI.    	A coati is a member of the raccoon family and is also known as the Brazilian aardvark, or the snookum bear. The coati is native to Central and South America, but can also be found in the southwest of the United States."
EDSEL_,"EDSELS.    	It was Henry Ford's son, Edsel Ford, who gave his name to the Edsel make of automobile, a name that has become synonymous with ""failure""."
UGL_,"UGLI.    	The ugli fruit is a hybrid of an orange and a tangerine, first discovered growing wild in Jamaica where most ugli fruit comes from today."
N_E,"NIE.    	""Nie"" is the German word for ""never""."
UGL_,"UGLI.    	The ugli fruit is a hybrid of an orange and a tangerine, first discovered growing wild in Jamaica, where most ugli fruit comes from today."
RTE_,"RTES.    	GPS stands for Global Positioning System. The modern GPS system that we use today was built by the US military who received the massive funding needed because of fears during the Cold War of the use of Intercontinental Ballistic Missiles. We civilians, all round the world, owe a lot to President Ronald Reagan because he directed the military to make GPS technology available to the public for the common good. He was moved to do so after the Soviet Union shot down KAL flight 007 carrying 269 people, just because the plane strayed accidentally into Soviet airspace."
TA_OE,"TAHOE.    	Lake Tahoe is up in the Sierra Nevada mountains, and sits right on the border between California and Nevada. Given its location, there are tall casinos that sit right on the shore on the Nevada side of the state line where gambling is legal. Lake Tahoe is the largest alpine lake in the country. It's also the second deepest lake, with only the beautiful Crater Lake in Oregon being deeper."
ECL_T,"ECLAT.    	'Éclat' can mean a brilliant show of success, or the applause or accolade that one receives. The word derives from the French ""éclater"" meaning ""to splinter, burst out""."
_RNE,"ARNE.    	Thomas Arne was an English composer from London. Arne wrote some iconic compositions including 'Rule, Britannia!' He also wrote a version of 'God Save the King' that became the British national anthem."
_ANTE,DANTE.    	Dante Alighieri (usually just 'Dante') was an Italian poet of the Middle Ages. Dante's 'Divine Comedy' is widely considered to be the greatest literary work ever written in the Italian language.
_CT,"OCT.    	The discovery of the New World by Christopher Columbus is celebrated with a national holiday in many countries. Here in the US we have Columbus Day, and in the Bahamas there is Discovery Day, and the Day of the Americas in Uruguay."
_VA,"UVA.    	The University of Virginia (UVA) was of course founded by Thomas Jefferson, who sat on the original Board of Visitors with former US Presidents James Madison and James Monroe. In fact, the original UVA campus was built on land that was once a farm belonging to President Monroe."
_LIBI,"ALIBI.    	""Alibi"" is the Latin word for ""elsewhere"" as in, ""I claim that I was 'elsewhere' when the crime was committed ... I have an 'alibi'""."
_GE,"AGE.    	In order to be President of the US, a candidate have been born in the country and qualify for citizenship. He or she must also be at least 35 years of age when taking office, and have been a permanent residence of the US for at least 14 years."
_AO,"YAO.    	Yao Ming is a retired professional basketball player from Shanghai who played for the Houston Rockets. At 7'6"", Yao was the tallest man playing in the NBA."
_AX,"SAX.    	The saxophone was invented by Belgian, Adolphe Sax. Sax developed lip cancer at one point in his life, and one has to wonder if that was related to his saxophone playing (I am sure not!). I had the privilege of visiting Sax's grave in the Cemetery of Montmartre in Paris a few years ago."
_SAGE,OSAGE.    	Much of the Osage River in Missouri is now taken up by two large reservoirs created behind two dams that provide power for St. Louis and the surrounding area. The two reservoirs are the Truman Reservoir and the Lake of the Ozarks.
_DT,EDT.    	Eastern Daylight Time (EDT)
_AGI,"MAGI.    	Magi is the plural of the Latin word ""magus"", a term applied to someone who was able to read the stars. Hence, magi is commonly used with reference to the ""wise men from the East"" who followed the star and visited Jesus just after he was born."
MIR_,"MIRA.    	Mira Sorvino is an American actress, winner of an Oscar for her supporting role in the 1995 Woody Allen movie ""Mighty Aphrodite"". Sorvino also played a title role opposite Lisa Kudrow in the very forgettable ""Romy and Michele's High School Reunion""."
_IVA,"DIVA.    	""Diva"" comes to us from Latin via Italian. ""Diva"" is the feminine form of ""divus"" meaning ""divine one"". The word is used in Italy to mean ""goddess"" or ""fine lady"", and especially is applied to the prima donna in an opera. We often use the term to describe a singer with a big ego."
_IRA,"MIRA.    	Mira is a red giant star in the constellation Cetus. Red giants are very large stars with a relatively low mass. The atmosphere of a red giant is also very inflated and extends a long way into space so the surface of that atmosphere that we see is relatively cool, which gives it a red color. Stars are classified by their spectral characteristics, basically the color of the light they emit. As such, red giants are classified as M stars. Cool red giants are of a color beyond the usual range, and are classified as S stars."
LE_O,"LEGO.    	'The LEGO Movie' is a 2014 computer animated film in which all the characters are Lego figures. Apparently 'The Lego Movie' was well received, and there;s already a sequel in the works."
NB_,"NBC.    	Wagon Train' was a Western series that ran on NBC and ABC in the late fifties and early sixties. The series was a spin-off from a John Ford Western movie called 'Wagon Master' released in 1950. The show featured outstanding guest actors in various episodes including, Lou Costello, Angie Dickenson, Leonard Nimoy, Ronald Reagan, Peter Lorre and Mickey Rooney. There was even a brief appearance by John Wayne, billed under the pseudonym Michael Morris, a throwback to Wayne's real name of Marion Michael Morrison."
CIA_,"CIAO.    	""Ciao"" is the Italian for ""bye"". ""Arrivederci"" is more formal, and translates better as ""goodbye""."
_NIME,ANIME.    	Anime is animation in the style of Japanese Manga comic books.
O_A,"OLA.    	Payola is the illegal practice of paying radio stations or disk jockeys to repeatedly play a particular piece of music. The idea is that the more often a song is played, the more likely it is to sell. The term ""Payola"" comes from the words ""pay"" and ""Victrola"", an RCA brand name for an early phonograph."
_SP,"ISP.    	An Internet Service Provider (ISP) is just what the name indicates, a company that provides its customers with access to the Internet. One way that ISPs differentiate themselves from each other is in the way in which end users are connected to the ISP's network. So, there are cable ISPs, DSL ISPs, dial-up ISPs and satellite ISPs. I'd go with cable if I were you, if it's available in your area ..."
CT_,CTS.    	Cents (cts.)
OO_,"OOP.    	""Alley Oop"" is a comic strip that ran for four decades starting in 1932. ""Alley Oop"" was drawn by V. T. Hamlin. The title character lived in the prehistoric kingdom of Moo and had a pet dinosaur called Dinny. Alley Oop also had a girlfriend called Ooola. I had assumed that Ooola's name was a play on 'hula hoop', but that wasn't invented until the 1950s (a kind blog reader informs me) ..."
O_L,"OIL.    	The OPEC cartel (the Organization of the Petroleum Exporting Countries) was formally established in 1960 and has been headquartered in Vienna since 1965. The US is actually the third largest oil producer in the world (after Russia and Saudi Arabia). One reason America isn't in OPEC, even though we are a big producer, is that we import a lot more than we export. But we all probably knew that already ..."
EP_OT,"EPCOT.    	EPCOT Center (now just called Epcot) is the theme park beside Walt Disney World in Florida. EPCOT is an acronym for Experimental Prototype Community of Tomorrow and is a representation of the future as envisioned by Walt Disney. Walt Disney actually wanted to build a living community for 20,000 residents at EPCOT, but he passed away before that vision could be realized."
G_ENA,"GEENA.    	As well as being a successful Hollywood actress, Geena Davis is an accomplished archer and came close to qualifying for the US archery team for the 2000 Summer Olympics. Davis is also a member of American Mensa. She is quite the lady ..."
EB_RT,"EBERT.    	Roger Ebert co-hosted a succession of film review television programs for over 23 years with his Gene Siskel, until Siskel passed away in 1999. Ebert was diagnosed and treated for thyroid cancer in 2002, and since then has undergone a number of surgical procedures. Sadly, he has lost his voice, but continues work as a film critic, focusing these days on the print medium."
_ONIC,"IONIC.    	An Ionic column is relatively ornate. It usually has grooves running up and down its length and at the top there is a ""scroll"" design called a ""volute"". The scroll design makes it a popular inclusion in academic buildings."
RL_,"RLS.    	Robert Louis Stevenson's most celebrated work I'd say is ""Treasure Island"", originally written as a series for a children's magazine in 1881. I remember it as the first ""real"" novel I read as a youngster ..."
ION_C,"IONIC.    	An Ionic column is relatively ornate. It usually has grooves running up and down its length and at the top there is a ""scroll"" design called a ""volute"". The scroll design makes it a popular inclusion in academic buildings."
LEE_,"LEES.    	The Lee company famous for making jeans was formed in 1889, by one Henry David Lee in Salina, Kansas."
UGL_,"UGLI.    	The ugli fruit is a hybrid of an orange and a tangerine, first discovered growing wild in Jamaica where most ugli fruit comes from today."
S_T,"SAT.    	Saturn was a Roman deity, the god of agriculture and harvest. Both the planet Saturn and ""Saturday"" are named after Saturn the god."
AN_DE,ANODE.    	The two terminals of a battery are called the anode and the cathode. Electrons travel from the anode to the cathode creating an electric current.
_ITHE,"TITHE.    	A tithe is traditional payment of one tenth of a person's annual income, usually given to a church. Tithing is a practice taught in many traditions and according to a 2002 survey, about 3% of American adults donate 10% or more of their income to a church."
SA_,"SAC.    	Spiders reproduce sexually, but the process is a bit ""different"". Male spiders deposit sperm on specially made sperm webs. He then collects the sperm inside a syringe-like structure, and drops that into the female's genital opening (if he doesn't get eaten by the female!). The female then lays eggs in egg sacs, with about 3,000 eggs per sac."
_II,"WII.    	The Wii is the biggest-selling game console in the world. Two distinguishing features are the impressive wireless remote control and its WiiConnect24 system which allows the console to get messages and updates wirelessly in standby mode. I have my kids unplug the darn thing when they aren't using it, as even in standby mode it sucks up bandwidth on my wireless network here at the house."
I_U,ICU.    	After being wheeled out of the Operating Room (OR) a patient might spend some time in the Intensive Care Unit (ICU).
A_AX,"AJAX.    	As described in Homer's ""Iliad"", Hector was a Trojan prince and a great fighter. During the war with the Greeks, in order avoid a bloody battle, Hector challenges any one of the Greek warriors to a duel. Ajax is chosen by the Greeks, and the two fight for an entire day before they declare a stalemate."
NER_,"NERF.    	Nerf is the name given to the soft material used in a whole series of toys designed for ""safe"" play indoors. The Nerf product is used to make darts, balls and ammunition for toy guns. ""NERF"" is an acronym, standing for Non-Expanding Recreational Foam."
S_X,"SAX.    	The saxophone was invented by Belgian Adolphe Sax. Sax developed lip cancer at one point in his life, and one has to wonder if his affliction was related to his saxophone playing (I am sure not!). I had the privilege of visiting Sax's grave in the Cemetery of Montmartre in Paris a few years ago."
_OME,"ROME.    	""I, Claudius"" is a 1934 novel by Robert Graves, written in the form of an autobiography of Emperor Claudius of Rome. Graves wrote a sequel in 1935, ""Claudius the God"". Both books were adapted by the BBC into a fabulous series that went by the name ""I, Claudius""."
WA_T,"WATT.    	James Watt was a Scottish inventor, a man who figured prominently in the Industrial Revolution in Britain largely due to the improvements he made to the fledgling steam engine. The SI unit of power is called the watt, named in his honor."
DI_A,"DIVA.    	""Diva"" comes to us from Latin via Italian. ""Diva"" is the feminine form of ""divus"" meaning ""divine one"". The word is used in Italy to mean ""goddess"" or ""fine lady"", and especially is applied to the prima donna in an opera. We often use the term to describe a singer with a big ego."
_DOR,"ODOR.    	The disinfectant called Lysol takes its name from the words ""lysosome"" and ""solvent"". Lysosomes are structures found within cells that have the job of breaking up waste material and cellular debris."
_MEN,T-MEN.    	A T-man is a law-enforcement agent of the US Treasury (the 'T' stands for Treasury).
ION_,"IONA.    	Although the small island of Iona lies just off the west coast of Scotland, it was the site of a monastery built in the Middle Ages by a monk from Ireland names Colm Cille (also known as Columba). Colm Cille and his followers were sent into exile from the Irish mainland and settled in Iona, as at that time the island was part of an Irish kingdom. This monastery in Iona expanded its influence over the decades and founded other institutions all over Ireland and Great Britain. It is believed that the famous Book of Kells may have been written, or at least started, at the monastery on Iona. Iona is also the burial site for Macbeth, King of Scotland who was immortalized in Shakespeare's fictional account of the king's life."
_DOR,"ODOR.    	An effluvium is an invisible emanation, usually an odorous gas coming from waste material. The term has the same root as our word 'effluent', namely 'effluere', the Latin for 'to flow out'."
N_M,"NOM.    	In French, 'je m'appelle ...' translates literally as 'I am called ...', or perhaps more smoothly as 'my name is ...'"
MO_,"MOT.    	'Bon mot' translates from French as ""good word"". We use ""bon mot"" (and sometimes just ""mot"") to mean a quip, a witticism."
RUN_,"RUNE.    	A rune is a character in an alphabet (including the Viking alphabet), believed to have mysterious powers."
_SRS,"SSRS.    	The former Soviet Union was created in 1922, not long after the Russian Revolution of 1917 that overthrew the Tsar. The new Soviet Union was roughly equivalent geographically to the old Russian Empire, and was made up of fifteen Soviet Socialist Republics."
T_SER,"TASER.    	Victor Appleton wrote a novel for young adults called ""Tom Swift and His Electric Rifle"". The company that developed the TASER electroshock weapon named their product as a homage to the novel, as TASER stands for ""Thomas A. Swift's Electric Rifle"". Interesting, eh?"
A_S,"ANS.    	Answer, for short."
AL_VE,ALEVE.    	Aleve is a brand name used for the anti-inflammatory drug Naproxen sodium.
_SA,"BSA.    	As every little boy (of my era) knows, the Scouting movement was founded by Lord Baden Powell, in 1907. The Boy Scouts of America (BSA) soon followed, in 1910."
_IMO,"LIMO.    	The word ""limousine"" actually derives from the French city of Limoges. The area around Limoges is called the Limousin, and it gave its name to a cloak hood worn by local shepherds. In early motor cars, a driver would sit outside in the weather, while the passengers would sit in the covered compartment. The driver would often wear a limousin-style protective hood, giving raise to that type of transportation being called a ""limousine"". Well, that's how the story goes anyway ..."
_OME,"ROME.    	""Coriolanus"" is one of William Shakespeare's tragedies. The play tells the story of the real-life Roman general Gaius Marcius Coriolanus, who lived in the 5th century BC."
MO_,"MOT.    	In France, one might look up a word (mot) in the dictionary (dictionnaire)."
M_OT,"MOOT.    	To moot' is to bring up as a subject for discussion or debate. So, something that is moot is open to debate. Something that is no longer moot, is no longer worth debating. We don't seem to be able get that right ..."
M_C,MAC.    	Lion is the name of the operating system that runs on Apple's Macintosh line of computers.
D_NTE,DANTE.    	Dante Alighieri (usually just 'Dante') was an Italian poet of the Middle Ages. Dante's 'Divine Comedy' is widely considered to be the greatest literary work ever written in the Italian language.
_APA,"PAPA.    	""Oh! My Papa"" was recorded in English by Eddie Fisher in 1953. The song was originally written in German by a Swiss composer in 1939, as part of a musical. The original title is 'O mein Papa'."
ERR_L,ERROL.    	Errol is one of the magical creatures from the 'Harry Potter' series of books by J. K. Rowling. Errol is a Great Grey Owl that delivers the mail for the Weasley family. He is old and prone to accidents so often needs help from other owls.
B_E,BEE.    	Drone bees and ants are fertile males of the species whose sole role in life seems to be to mate with a queen.
OREID_,"ORE-IDA.    	Ore-Ida frozen foods are all made with potatoes. The company is located in Oregon, just across the border from Idaho. ""Ore-Ida"" is a melding of the two state names."
