_ATAN,"SATAN.    	English poet John Milton is best known for his epic poem ""Paradise Lost"". Milton also wrote several sonnets, the most famous of which is probably ""On His Blindness"". The poet developed glaucoma which rendered him completely blind so he had to dictate a lot of his work, including the whole of ""Paradise Lost""."
P_N,"PEN.    	The pen (penitentiary) is ""up the river"". The phrase derives from the fact that Sing Sing prison (in Ossinging, NY) is up the Hudson River from New York City."
I_PS,"ISPS.    	An Internet Service Provider (ISP) is just what the name indicates, a company that provides its customers with access to the Internet. One way that ISPs differentiate themselves from each other is in the way in which end users are connected to the ISP's network. So, there are cable ISPs, DSL ISPs, dial-up ISPs and satellite ISPs. I'd go with cable if I were you, if it's available in your area ..."
_MEARA,"O'MEARA.    	Mark O'Meara is an American golfer from Goldsboro, North Carolina. He is known as one of the American players who competes in international tournaments more than most, and has a reputation as a real gentleman all around the world."
ETH_O,ETHNO-.    	Ethnomusicology is the comparative study of music from different cultures.
NA_CE,"NANCE.    	John Nance Garner was Speaker of the House when he ran against New York Governor, Franklyn Roosevelt for the nomination for the presidential race in 1932. When it was clear that Roosevelt was to win the nomination, he cut a deal with FDR and joined the ticket as candidate for Vice President. When the two Democrats won, they were sworn into office on March 4, 1933. As Garner was still Speaker of the House at the time, he is the only person to have held the office of Speaker and Vice President on the same day."
N_OS,"NCOS.    	A PX is a Post Exchange, a retail store operating on a US Army Base. The equivalent on an Air Force Base is a Base Exchange (BX). At a Navy installation it's a Navy Exchange (NEX), at a Marine Corps installation it's a Marine Corps Exchange (MCX) and at a Coast Guard Installation it's a CGX."
S_IS,SRIS.    	Sri is a title of respect for a male in India.
_OV,"NOV.    	Thanksgiving Day was observed on different dates in different states for many years, until Abraham Lincoln fixed the date for the whole country in 1863. Lincoln's presidential proclamation set that date as the last Thursday in November. In 1941, President Franklin D. Roosevelt moved the holiday to the fourth Thursday in November, arguing that the earlier date would give the economy a much-needed boost."
_IT,"KIT.    	A kit is a young mammal of several species, including the ferret and the fox. 'Kit' is probably a shortened form of 'kitten'."
_OD,"GOD.    	In Norse mythology, Odin was the chief of the gods. His wife, Frigg, was the queen of Asgard, and the deity that gave us our English term Friday (via Anglo-Saxon). Odin's son was Thor, and he gave us the name Thursday."
R_INO,"RHINO.    	There are five types of rhinoceros that survive today, and the smaller Javan Rhino is the most rare. The rhinoceros is probably the rarest large mammal on the planet, thanks to poaching. Hunters mainly prize the horn of the rhino as it is used in powdered form in traditional Chinese medicine."
_AY,"KAY.    	Mary Kay Ash founded her skin care and cosmetics company, somewhat ominously on Friday 13th, 1963. In 1968, Mary Kay Ash bought herself a pink Cadillac, specially painted to match the color of one of her compacts. The car became so famous that she gave away five of them to her top sales women, a tradition that lasts to this day."
_IT,"TIT.    	The Bearded Tit is more usually known as the Bearded Reedling. The bird doesn't actually have a ""beard"", although the male has black marks around the bill that resemble a mustache."
_OCA,"BOCA.    	The name of the city of Boca Raton in Florida translates from Spanish as 'Mouse Mouth'. There doesn't seem to be a definitive etymology of the name, but one plausible explanation is a nautical one. 'Boca', as well as meaning 'mouth' can mean 'inlet'. 'Ratón', as well as meaning 'mouse' was also used to describe rocks that chewed away at a ship's cable. so possibly Boca Ration was named for a rocky inlet."
C_MEL,"CAMEL.    	The dromedary, also known as the Arabian Camel or Indian Camel, is the camel that has only one hump. The other species of camel is the Bactrian, which has two humps. The hump of a dromedary contains up to 80 pounds of fat, which can be broken down into water and energy if no food or water is available."
TID_,"TIDE.    	Tides of course are caused by the gravitational pull of the moon on the oceans. At neap tide, the smaller gravitational effect of the sun cancels out some of the moon's gravitational force. At spring tides, the sun and the moon's gravities act in concert causing more extreme movement of the oceans."
_ESOS,"PESOS.    	The coin called a 'peso' is used in many Spanish-speaking countries around the world. The coin originated in Spain where the word 'peso' means 'weight'. The original peso was what we know in English as a 'piece of eight', a silver coin of a specific weight that had a nominal value of eight 'reales'."
PH_L,"PHIL.    	The Everly Brothers are noted for their steel guitar sound, and their great use of harmony. Their harmony onstage wasn't reflected off the stage though. In 1973 the brothers decided to pursue separate careers and scheduled a farewell performance attended by many fans, family and stalwarts from the music industry. Don Everly came on stage too drunk to perform, and eventually brother Phil just stormed off into the wings, smashing his guitar as he left. The boys didn't talk to each other for ten years after that incident. Phil Everly passed away in January 2014."
R_G,"REG.    	The difference between a a premium and regular gasoline is its octane rating. The octane rating is measure of the resistance of the gasoline to auto-ignition, it's resistance to ignition just by virtue of being compressed in the cylinder. This auto-ignition is undesirable, as multiple-cylinder engines are designed so that ignition within each cylinder takes place precisely when the plug sparks, and not before. If ignition occurs before the spark is created, the resulting phenomenon is called ""knocking""."
RA_M,"RAHM.    	The current Mayor of Chicago, Rahm Emanuel, was an Illinois representative in the US House before resigning to take up President Obama's offer to become the White House Chief of Staff."
CHA_,"CHAD.    	We are all familiar with ""hanging chads"" after the famous Florida election recounts of 2000. A chad is any piece of paper punched out from a larger sheet. So, those round bits of paper we've all dropped over the floor when emptying a hole punch, they're chads."
_TRL,CTRL.    	The control key ...
Y_Z,YAZ.    	Yaz was the nickname for Carl Yastrzemski who played his whole career with the Boston Red Sox.
HOM_,"HOMO.    	The Homo genus includes, of course, the species Homo sapiens (modern humans), but we're the only species left. All the other species that were part of the genus Homo are all extinct. The last known species related to humans was Homo neanderthalensis (Neanderthal Man) which died off about 24,000 years ago. However, another species was discovered in Indonesia in 2003 that has been dubbed Homo floresiensis (Flores Man ... sometimes called ""hobbit""), and it may possibly have lived as recently as 12,000 years ago. Watch this space ..."
RI_T,"RIOT.    	One might sarcastically say that ""Mr. Hilarious"" is a riot."
YA_,"YAZ.    	Yaz was the nickname for Carl Yastrzemski, who played his whole career with the Boston Red Sox."
BEE_E,"BEENE.    	Geoffrey Beene was an American fashion designer. On his list of notable clients were three First Ladies, Lady Bird Johnson, Pat Nixon and Nancy Reagan."
_EVUE,"REVUE.    	""Closer Than Ever"" is indeed a musical revue, first performed at the Williamstown Theater Festival in 1989, before moving to an off-Broadway location. There is no dialogue in the revue, and is a series of song routines, dealing with different aspects of life."
FE_A,"FEMA.    	Federal emergency management has been structured for over 200 years, but what we know today as the Federal Emergency Management Agency (FEMA) was created in 1979 in an Executive Order issued by President Jimmy Carter."
EL_,"ELL.    	The 'head' letter, the first letter, in the word 'letterhead' is the letter L (ell)."
_RIAH,"URIAH.    	Uriah Heep is a sniveling insincere character in the novel ""David Copperfield"" by Charles Dickens. The character is such a ""yes man"" that today, if we know someone who behaves the same way, then we might call that person a ""Uriah Heep""."
REM_,"REMO.    	The Italian city of San Remo sits on the Mediterranean, right on the border with France. In Italian the city is named Sanremo, just one word, although the spelling of ""San Remo"" dates back to ancient times."
E_ROY,"ELROY.    	The Jetsons' is an animated show from Hanna-Barbera that had its first run in 1962-1963, and then was recreated in 1985-1987. When it was debuted in 1963 by ABC, 'The Jetsons' was the network's first ever color broadcast. 'The Jetsons' are like a space-age version of 'The Flintstones'. The four Jetson family members are George and Jane, the parents, and children Judy and Elroy. Residing with the family are Rosie the household robot, and Astro the pet dog."
_OD,"LOD.    	The city of Lod lies just a few miles southeast of Tel Aviv, and is the home of Ben Gurion International, Israel's main airport."
CO_A,"CODA.    	In music, a coda is primarily a passage that brings a movement to a conclusion. 'Coda' is Italian for 'tail'."
SA_IN,"SATIN.    	Sateen and satin are two different things (like I'd known the difference!). Sateen is a cotton fabric, with a weave that is ""four over, one under"" meaning that most of the threads come to the surface giving it a softer feel."
SW_SS,"SWISS.    	Supposedly William Tell came from Uri, a canton in the German part of Switzerland. Altdorf is the capital of Uri and is the city where William Tell shot the apple off his son's head, according to legend."
O_RA,"OKRA.    	The plant known as okra is mainly grown for it edible green pods. The pods are said to resemble 'ladies' fingers', which is an alternative name for the plant. Okra is known as 'ngombo' in Bantu, a name that might give us the word 'gumbo', the name for the name of the southern Louisiana stew that includes okra as a key ingredient."
S_NECA,"SENECA.    	When I first moved to the US I came to Upstate New York, and was lucky enough to live near the beautiful Finger Lakes. The largest of the eleven lakes is Seneca Lake, one of the deepest bodies of water in the United States. My wife and I visited the Finger Lakes region in 2010 and stopped at one of the best wineries in the area and frankly were blown away by the quality of the wines available. Coming from California it's very refreshing to taste great wines that are made without the benefit of irrigation."
_ENNA,SENNA.    	Sennas are used as purgatives and laxatives
V_RNE,"VERNE.    	Jules Verne really was a groundbreaking author. Verne pioneered the science fiction genre, writing about space, air and underwater travel, long before they were practical and proved feasible. Verne is the second most translated author of all time, with only Agatha Christie beating him out."
EMIL_O,"EMILIO.    	Emilio Estevez is one of the members of the famous ""Brat Pack"", having appeared in ""The Breakfast Club"" and ""St. Elmo's Fire"". Estevez's father (and can't you tell it from looking at him?) is actor Martin Sheen. Estevez decided to keep his father's real name, and not his stage name of ""Sheen"". Charlie Sheen is Emilio's brother, and Charlie's real name is Carlos Estevez."
OATE_S,"OATERS.    	The American actor known as Tom Mix made an incredible number of films, 336 in all. Most of these were Westerns, and almost all were silent movies. He was known as Hollywood's first megastar."
W_A,WBA.    	The World Boxing Association sanctions bouts.
A_ACIN,"ANACIN.    	Anacin is a pain reliever, with aspirin and caffeine as active ingredients."
TO_N,"TOON.    	Wile E. Coyote and Road Runner are two, much-loved cartoon characters from Warner Bros. Wile E. Coyote was created first, and Road Runner was invented as someone for Wile E. to play off. I love this cartoon; definitely one of the best ..."
_OON,"TOON.    	Donald Duck was created in 1934 by Walt Disney Productions, first appearing 'The Wise Little Hen' in 1934. Donald's full name is Donald Fauntleroy Duck."
FE_N,FERN.    	Fiddleheads are those furled fronds that you often see on young ferns. They can be harvested and served as a vegetable.
_AXE,"SAXE.    	The Duchy of Saxe-Altenburg was located south of Leipzig, and existed for centuries until the monarchies ceased to exist in the German Revolution of 1918-19, at the end of WWI."
MAU_,"MAUI.    	Maui is the second largest of the Hawaiian islands. Maui is sometimes called the 'Valley Isle' as it is composed of two volcanoes to the northwest and southeast of the island, each with numerous, beautiful valleys carved into them."
SW_,SWM.    	Single White Male (SWM).
HIL_,"HILO.    	Hilo is the largest settlement on the big island of Hawai'i, with a population of over 43,000 (that's not very many!). Oh, I love the Big Island ..."
SPEED_,"SPEEDO.    	Speedo brand swim-wear first came out of Australia in 1928, from a hosiery company that wanted to diversify. The brand name was chosen after a slogan competition among the employees was won by ""Speed on in your Speedos"". It was a long time ago ..."
_CRO,"ACRO-.    	Our prefix ""acro-"" comes from the Greek ""akros"" meaning ""at the top"". Examples are 'acrophobia' (fear of heights) and 'Acropolis' ('city at the top')."
_ELT,CELT.    	The Boston Celtics NBA basketball team were founded just after WWII in 1946. The Celtics won eight league championships in a row from 1958 to 1966. That's the longest consecutive championship winning streak of any professional sports team in North America.
CA_,"CAN.    	""The pokey, poky"" is a slang term for prison, possibly a corruption of ""pogie"", a term for a ""poorhouse""."
N_S,"NOS.    	ZIP codes were introduced in 1963. The acronym ZIP stands for Zone Improvement Plan, a name indicating that mail travels more efficiently when the codes are included in the postal address. "
_INE,"WINE.    	Shiraz is another name for the grape better known as Syrah. The Shiraz name is most widely used in Australia, and also in South Africa and Canada."
TR_PE,"TRIPE.    	'Tripe' is an informal term meaning 'rubbish, of little value'. Tripe is actually the rubbery lining of say a cow, which in the UK is traditionally eaten with onions."
PCB_,"PCBS.    	Polychlorinated biphenyls were banned with good reason. Apart from their link to cancer and other disorders in humans and animals, they are extremely persistent in the environment once contamination has occurred. Among other things, PCBs were used as coolants and insulating fluids in electrical gear such as transformers and large capacitors."
T_TES,"TETES.    	In French, one's 'tête' (head) might produce an 'idée' (idea)."
OD_ST,"ODIST.    	Pindar was an Ancient Greek poet, most famous perhaps for composing a series of Victory Odes that celebrated triumph in competition, most notably the Olympian Games of the day."
R_OS,"REOS.    	The REO Motor Company was founded by Ransom Eli Olds (hence the name REO). The company made cars, trucks and buses, and was in business from 1905 to 1975 in Lansing, Michigan. Among the company's most famous models were the REO Royale and the REO Flying Cloud."
_ORSE,"NORSE.    	Litmus is a mixture of naturally-occurring dyes that responds to acidity by changing color. Litmus was probably first used around 1300 by the Spanish alchemist Arnaldus de Villa Nova, who extracted the blue dye from lichens. One suggestion is that the term 'litmus' comes from the Old Norse 'litmose' meaning 'lichen for dyeing'."
UTER_,"UTERO.    	'In utero' is a Latin term meaning 'in the uterus'. The Latin 'uterus' translates as both 'womb' and 'belly'. The Latin word was derived from the Greek 'hystera' also meaning womb, which gives us the words 'hysterectomy', and 'hysterical'."
ERGO_,"ERGOT.    	Ergot is a fungus, or actually a group of fungi, that cause disease in rye and related plants."
ED_,EDE.    	Ede is a small town in the Netherlands located between the cities of Arnhem and Utrecht.
TE_RA,"TETRA.    	A tetra is a small freshwater fish found in Africa, Central America and South America."
AGASS_,"AGASSI.    	Renowned tennis professional Andre Agassi wrote an autobiography called ""Open"", published in 2009. An amazing revelation in the book is that Agassi's famous head of hair was actually a wig for much of his playing career. Can you imagine how hard it must have been to play tennis at his level with a rug stuck on?"
S_GER,"SEGER.    	Bob Seger struggled as a performing artist right through the sixties and early seventies before becoming a commercial success in 1976 with the release of his album ""Night Moves"". Since then, Seger has recorded songs that have become classics like, ""We've Got Tonight"" and ""Old Time Rock & Roll""."
_TTILA,"ATTILA.    	Giuseppe Verdi's opera ""Attila"" is based on a play :Attilla, King of the Huns"" written by Friedrich Werner. It was premiered in 1846 in Venice."
"T.N_G.""","T.N.G."".    	Deanna Troi, the character on ""Star Trek: The Next Generation"", is played by the lovely Marina Sirtis. Sirtis is a naturalized American citizen and has what I would call a soft, American accent on the show. However, she was born in the East End of London and has a natural accent off-stage that is more like that of a true Cockney."
N_EST,"N-TEST.    	There are two classes of nuclear weapons, both of which get the energy for the explosion from nuclear reactions. The first nuclear bombs developed, called atomic bombs (A-bombs), use fission reactions. In an atomic bomb, uranium nuclei are split into smaller nuclei with the release of an awful lot of energy in the process. The second class of nuclear weapons are fusion bombs. Fusion devices are also called thermonuclear weapons or hydrogen bombs (H-bombs). In a fusion reaction, the nuclei of hydrogen isotopes are fused together to form bigger nuclei, with the release of even greater amounts of energy than a fission reaction."
A_N,"AWN.    	An awn isn't specific to barley. An awn is the name given to hair or bristle-like structures found in numerous species of plants. In some species, like barley, the awns can contain photosynthetic tissue."
SO_,"SON.    	In the Christian tradition, the Father, Son and Holy Spirit are three persons in One Divine Being, the Holy Trinity."
BAN_,"BANA.    	Eric Bana is an Australian actor who enjoyed a successful career in his home country before breaking into Hollywood playing an American Delta Force sergeant in ""Black Hawk Down"". A couple of years later he played the lead in Ang Lee's 2003 movie ""The Hulk"", the role of Dr Bruce Banner. More recently he played the Romulan villain Nero, in the 2009 ""Star Trek"" movie."
G_LA,"GILA.    	The Gila River is a tributary of the Colorado and flows through New Mexico and Arizona. From 1848 to 1853, the Gila marked part of the border between the US and Mexico."
TI_AN,"TITAN.    	The Titans were a group of twelve elder deities in Greek mythology. In the celebrated Battle of the Titans, they were overthrown by the young upstarts, the Olympians, twelve younger gods."
ON_,"ON A.    	""Three on a match"" is a superstition, apparently dating back to the Crimean War. If three people light their cigarette from the same match, then supposedly one of the soldiers would be killed. A further superstition, called ""third on a match"" was that the third soldier who gets the light would be killed. The rationale was that if an enemy sniper saw the light of a match, he would take aim as the first person takes the light, determine whether he was seeing friend or foe with the second lighting, and then shoot at the third lighting."
L_S,"LYS.    	""Lys"" is the French word for ""lily"", as in fleur-de-lys, the heraldic symbol often associated with the French monarchy."
C_M,"CAM.    	From what I just read, it is legal to record video with a hidden camera, at least to monitor the behavior of a caregiver in your home. Apparently there is a law, however, that prohibits the recording of audio. So, ""nanny cams"" are sold without audio capability. But (disclaimer) that's just what I read, so don't take my word for it!"
EILE_N,"EILEEN.    	Eileen Collins was the first female pilot of a Space Shuttle, and the first female commander of a Space Shuttle mission. She was also the first astronaut to fly the shuttle through the 360-degree, rendezvous pitch maneuver. This maneuver became routine for Shuttles in docking with the International Space Station. The idea is to for the spacecraft to perform a back-flip so that the crew of the Space Station can photograph the Shuttle's heat-shield to verify integrity prior to reentry."
_UN,"NUN.    	The full name of the Carmelite religious order of the Catholic church is the Order of the Brothers of Our Lady of Mount Carmel. It is thought that the order was founded on Mt. Carmel in northern Israel in the 12th century, giving the name."
P_NN,"PENN.    	Penn Jillette is one half of the duo of magicians known as Penn & Teller (Penn is the one who talks). Penn teamed up with Teller on stage in 1981, having met him through a friend back in 1974. As well as being talkative onstage, Penn is very vocal offstage when it comes his causes and beliefs. He is a devout atheist, a libertarian and a supporter of free-market capitalism."
_IN,"SIN.    	Las Vegas, Nevada was founded as a city in 1905. It became a stop-off point for pioneers travelling west, and eventually a railroad town, although with the coming of the railroad growth halted as folks began to bypass Las Vegas. The city's tourism industry took off in 1935 with the completion of the nearby Hoover Dam, and visitors to Vegas take tours of the dam to this day. Then gambling was legalized, and things really started to move. Vegas was picked, largely by celebrated figures in ""the mob"", as a convenient location across the California/Nevada state line that could service the vast population of Los Angeles. As a result, Las Vegas became the most populous US city founded in the 20th century (an honor that had belonged to Chicago in the 19th century)."
O_A,OCA.    	The plant called an oca is also known as the New Zealand Yam. The tubers of the oca are used as a root vegetable.
AMI_,"AMIN.    	Idi Amin received most of his military training in the British armed forces, eventually achieving the highest rank possible for a Black African in the British Colonial Army in 1959, that of Warrant Officer. On his return to Uganda Amin joined his country's military and quickly rose to the rank of Deputy Commander of the Army. During that time he was quite the athlete. He was a noted rugby player and swimmer, and for nine years held the Ugandan national light-heavyweight boxing title. By the early seventies, Amin was commander of all the armed forces of Uganda and in 1971 seized power in a military coup, displacing the country's president Milton Obote. There followed seven years of brutal rule by Amin during which it is estimated that between 100,000 and 500,000 people were murdered. Amin was ousted from power in 1979 after a war with Tanzania, and fled to Libya where he stayed for a year. He then moved to Saudi Arabia, where he was financially supported by the Saudi Royal Family for the remainder of his life. Amin died in 2003."
KTE_,"K-TEL.    	K-Tel was founded 1962 in Winnipeg, Manitoba by one Philip Kives. The company's recipe for success was the sale of inexpensive goods with a simple sales pitch and mail-order distribution."
P_AT,"PLAT.    	A plat is a map showing actual and planned features, so a town might have a plat showing existing and intended buildings."
GLO_,"GLOM.    	'Glom' is a slang term meaning 'steal', although it can also be used to mean 'latch onto' when used as 'glom onto'. The term probably comes from the Scots word 'glam' meaning 'to snatch at'."
SI_,"SIE.    	""Sprechen Sie Deutsch?"" is the German for ""Do you speak German?"""
A_ONIS,"ADONIS.    	In Greek mythology Adonis is a beautiful, young god, loved by Aphrodite. He dies in a hunting accident, but not before he gives Aphrodite a child. Adonis was originally a Phoenician god (Phoenicia is modern day Lebanon) ""absorbed"" into Greek lore. The child born of Adonis to Aphrodite was called Beroe, after which is named Beirut, the capital city of Lebanon."
K_EE,"KLEE.    	The artist Paul Klee was born in Switzerland, but studied art in Munich in Germany. You can see many of Klee's works in the San Francisco Museum of Modern Art. If you get to Bern in Switzerland, even more of them can be seen at the Zentrum Paul Klee that was opened in 2005."
STEA_,"STEAK.    	'Fajita' is a Tex-Mex term that refers to grilled meat served on a tortilla. The Mexican term 'fajita' is used to describe a small strip of chicken or beef. Nowadays, fajitas are often served on a sizzling platter with the tortillas and condiments on the side."
NY_D,"NYPD.    	The New York Police Department (NYPD) is the largest municipal police force in the country. The department's roots go back as far at 1625 when there was an eight-man night watch in the days when New York was still known as New Amsterdam. Several disparate forces with policing responsibility were amalgamated in 1844 to form the New York City Police Department, signalling the end of the night watch force that had existed for over 200 years."
