S_L,"SAL.    	""My Gal Sal"" is a song written by composer Paul Dresser. ""My Gal Sal"" is also the name of the movie recounting Dresser's life made in 1942. It stars Victor Mature as Dresser, and Rita Hayworth as Sally ""Sal"" Elliott."
D_E,"DRE.    	Dr. Dre is the stage name of rapper Andre Romelle Young. Dr. Dre is perhaps as well known for his own singing career as he is for producing records and starting the careers of others such Snoop Dog, Eminem and 50 Cent."
O_TO,"OTTO.    	Sgt. Snorkel ('Sarge') is Beetle Bailey's nemesis in the cartoon strip that bears his name. Snorkel has a dog called Otto that he dresses up to look just like himself. Otto started off as a regular dog, but artist Mort Walker decide to draw him more like his owner, and soon Otto became a big hit."
STE_,"STET.    	""Stet"" is the Latin word meaning ""let it stand"". In editorial work, the typesetter is instructed to disregard any change previously marked by writing the word ""stet"" and then underscoring that change with a line of dots or dashes."
_BOE,"OBOE.    	The oboe is perhaps my favorite of the reed instruments. The name ""oboe"" comes from the French ""hautbois"" which means ""high wood"". When you hear an orchestra tuning before a performance you'll note (pun intended!) that the oboe starts off the process by playing an ""A"". The rest of the musicians in turn tune to that oboe's ""A""."
ATAR_,"ATARI.    	Do you remember the arcade video game that was like a game of tennis, with paddles moving up and down to hit what looked like a ball, over what looked like a net? Well, that was 'Pong'."
_RO,SRO.    	Standing Room Only (SRO)
_MA,"AMA.    	The American Medical Association was founded in 1847, at the Academy of Natural Sciences in Philadelphia. The first female member was allowed to join in 1868, but the first African American members weren't let in until 1968."
_MA,AMA.    	American Medical Association (AMA)
A_IA,"ASIA.    	The Mongols are an ethnic group that is found today in modern Mongolia, in China and in Russia."
NE_,NES.    	The acronym stands for Super Nintendo Entertainment System. The kids probably have one. I wouldn't know ...
AT_A,"ATRA.    	Fortunately for crossword setters, the Atra razor was introduced by Gillette in 1977. The Atra was sold as the Contour in some markets and its derivative products are still around today."
ETT_,"ETTA.    	Etta James is best known for her rendition of ""At Last"". Sadly, she discloses in her autobiography, Etta James has lived a life that has been ravaged by drug addiction, leading to numerous legal and health problems."
AJA_,"AJAR.    	Our word ""ajar"" is thought to come from Scottish dialect, in which ""a char"" means ""slightly open""."
ARA_,"ARAL.    	The Aral Sea is great example of how man can have a devastating effect on the environment. In the early sixties the Aral Sea covered 68,000 square miles of Central Asia. Soviet Union irrigation projects drained the lake to such an extent that today the total area is less than 7,000 square miles, with 90% of the original lake's volume gone. Sad ..."
A_A,"ARA.    	The constellation of Ara takes its name from the Latin word for ""altar""."
_RE,"TRE.    	Rai 3 is one of three television channels owned and operated by the Italian government. They also operate Rai 1 and Rai 2. Rai stands for 'Radiotelevisione Italiana', Italian public broadcasting."
A_A,"ARA.    	The constellation of Ara takes its name from the Latin word for ""altar""."
_RIS,IRIS.    	The iris is the colored part of the eye with an aperture in the center that can open or close depending on the level of light hitting the eye.
ES_,"ESS.    	Slalom is an anglicized version of the Norwegian word ""slalam"" that translates as ""skiing race""."
IS_E,"ISLE.    	'Archipelago' is a name often used for a group or chain of islands. 'Archipelago' is our spelling of the Italian 'arcipelago', a word that has Greek roots. 'Arcipelago' was the proper name for the Aegean Sea in Greek, a word that was eventually used for the Aegean Islands."
U_O,"UNO.    	In my youth I remember being taught a great card game by a German acquaintance of mine, a game called Mau Mau. Years later I discovered that Uno is basically the same game, but played with a purpose-printed deck instead of the regular deck of playing cards that's used for Mau Mau."
_RENE,"IRENE.    	""Goodnight, Irene"", also known as ""Irene, Goodnight"", is a lovely American folk song that was first recorded commercially back in 1932 by blues singer Lead Belly. The song made it to number one in the charts for the Weavers in 1950 and for Frank Sinatra in the same year."
_AL,"SAL.    	Sal Mineo's most famous role was John ""Plate"" Crawford, the kid who was in awe of the James Dean character in ""Rebel Without a Cause"". Sadly, Mineo was murdered in 1976 when he was just 37 years old. He was attacked in the alley behind his Los Angeles apartment and stabbed through the heart. When an arrest was made it was discovered that the murderer had no idea that his victim was a celebrity, and that his plan was just to rob anyone who came along."
_AL,SAL.    	'Sal' is a pharmacological term meaning 'salt'.
EN_S,"ENOS.    	Enos was a chimpanzee who was launched into Earth orbit in 1961 by NASA on a Mercury Atlas 4 rocket. Enos's flight was a rehearsal for the first orbital flight made by an American, astronaut John Glenn. Enos returned from his mission safely, but died the following year from dysentery."
_LAN,"ELAN.    	Elan: ardor inspired by passion or enthusiasm. I guess that could be ""zing""."
ES_,ESL.    	English as a Second Language (ESL) is sometimes referred to as English for Speakers of Other Languages (ESOL) and English as a Foreign Language (EFL).
A_EE,"ALEE.    	The direction ""alee"" is the direction away from the wind. If a sailor points into the wind, he is pointing ""aweather""."
_RO,ORO.    	'El tiempo es oro' is a Spanish proverb that translates as 'time is gold'.
_LLE,"ELLE.    	""Elle"" magazine was founded in 1945 in France and today has the biggest circulation of any fashion magazine in the world. ""Elle"" is the French word for ""she""."
O_OE,"OBOE.    	The oboe is perhaps my favorite of the reed instruments. The name ""oboe"" comes from the French ""hautbois"" which means ""high wood"". When you hear an orchestra tuning before a performance you'll note (pun intended!) that the oboe starts off the process by playing an ""A"". The rest of the musicians in turn tune to that oboe's ""A""."
ALO_,"ALOE.    	Aloe vera has a number of alternate names that are descriptive of its efficacy as a medicine. These include the First Aid plant, Wand of Heaven, Silent Healer and Miracle Plant."
TSA_,"TSAR.    	The year 1917 saw two revolutions in Russia, with the pair collectively called 'the Russian Revolution'. As a result of the February Revolution that centered on Petrograd, the last Emperor of Russia (Tsar Nicholas II) abdicated and members of the Imperial parliament took control of the country, forming the Russian Provisional Government. The Provisional Government was itself overthrown in the October Revolution, by Vladimir Lenin and the Bolshevik party."
ID_,"IDA.    	Interstate 86 is a little unusual, in that it is actually and ""intrastate"" highway. It is located entirely within the state of Idaho. Now to be fair, there are also two sections of road called Interstate 86 back east, running through parts of Pennsylvania and New York."
_DA,IDA.    	The Salmon River Mountains in Idaho cover much of the central part of the state. The range forms part of the central Rocky Mountains.
_GEE,"AGEE.    	James Agee was a noted, American film critic. He wrote an autobiographical novel ""A Death in the Family"" that was published in 1957, and won him his Pulitzer, albeit posthumously, in 1958."
E_SO,"ESSO.    	The brand name Esso has its roots in the old Standard Oil company, as it uses the initial letters of Standard and Oil (ESS-O). The Esso brand was replaced by Exxon in the US but it is still used in many other countries."
RO_,"ROO.    	Like most of the characters in A. A. Milne's 'Winnie the Pooh', the kangaroo named Roo was inspired by on a stuffed toy belonging to Milne's son Christopher Robin."
S_A,"SPA.    	The word ""spa"" migrated to English from Belgium, as Spa is the name of a health resort there. The name ""Spa"" comes from the Walloon word ""espa"" meaning ""spring, fountain""."
A_LO,"ARLO.    	Arlo Guthrie is the son of Woody Guthrie. Both father and son are renowned for their singing of protest songs about social injustice. Arlo is most famous for his epic ""Alice's Restaurant Massacree"", a song that lasts a full 18m 34s. In the song Guthrie tells how, after being drafted, he was rejected for service in the Vietnam War based on his criminal record. He had only one incident on his public record, a Thanksgiving Day arrest for littering and being a public nuisance when he was 18-years-old."
AR_,"ARA.    	Ara Parseghian coached the Notre Dame football team from 1964 to 1974, a period known as ""The Era of Ara""."
_TET,"STET.    	Stet is the Latin word meaning ""let it stand"". In editorial work, the typesetter is instructed to disregard any change previously marked by writing the word ""stet"" beside the change, and then underscoring the change with a line of dots (or dashes)."
EN_A,"ENYA.    	Enya's real name is Eithne Patricia Ní Bhraonáin, which can translate from Irish into Enya Brennan. Her Donegal family (in the northwest of Ireland) formed a band called Clannad, which included Enya. In 1980 Enya launched her very successful solo career. She sure does turn up a lot in crosswords!"
T_AR,"TSAR.    	Peter the Great was perhaps the most successful of the Romanov tsars, famous for modernizing Russia and expanding the country's sphere of influence, creating the Russian Empire. He ruled from 1682 until his death in 1725."
_SL,ESL.    	English as a Second Language (ESL) is sometimes referred to as English for Speakers of Other Languages (ESOL) and English as a Foreign Language (EFL).
L_O,"LOO.    	It has been suggested that the British term ""loo"" comes from Waterloo (water-closet ... water-loo), but no one seems to know for sure. Another suggestion is that the term comes from the card game of ""lanterloo"" in which the pot was called the loo!"
S_L,"SAL.    	Sal Mineo's most famous role was that of John ""Plate"" Crawford, the kid who was in awe of the James Dean character in ""Rebel Without a Cause"". ""Exodus"" is the 1960 film of the Leon Uris novel of the same name. Paul Newman heads the cast, and Sal Mineo had a supporting role playing Dov Landau. Sadly, Sal Mineo was murdered in in 1976, when he was just 37 years old. He was attacked in the alley behind his Los Angeles apartment, and stabbed through the heart. An arrest was made, and the murderer apparently had no idea who his victim was, and had committed a number of robberies in the area."
E_L,ESL.    	English as Second Language (ESL) can also be called English for Speakers of Other Languages (ESOL) and English as a Foreign Language (EFL).
ES_,ESL.    	English as a Second Language (ESL) is sometimes referred to as English for Speakers of Other Languages (ESOL) and English as a Foreign Language (EFL).
S_A,"SPA.    	The word ""spa"" migrated into English from Belgium, as Spa is the name of a municipality in the east of the country that is famous for its healing hot springs. The name ""Spa"" comes from the Walloon word ""espa"" meaning ""spring, fountain""."
ANN_,"ANNA.    	""Anna and the King of Siam"" is a semi-biographical novel written by Margaret Landon and first published in 1944. The book tells the largely true story of Anna Leonowens who spent five years in Siam teaching English to the children and wives of King Mongkut. The novel was adapted as a 1946 movie of the same name starring Irene Dunne and Rex Harrison. Then followed a 1951 stage musical titled 'The King and I'. The musical was written as a vehicle for Gertrude Lawrence, who played Anna. Rex Harrison was asked to play the King, but he turned it down and Yul Brynner was cast instead. A movie version of the stage musical was released in 1956, famously starring Yul Brynner and Deborah Kerr."
TS_,"TSA.    	The TSA is the Transportation Security Administration, the agency that employs the good folks that check passengers and baggage at airports."
ELA_,"ELAN.    	Elan: ardor inspired by passion or enthusiasm. I guess that could be ""verve""."
_RES,"ARES.    	The Greek god Ares is often referred to as the Olympian god of warfare, but originally he was regarded as the god of blood-lust and slaughter. Ares united with Aphrodite to create several gods, including Phobos, Deimos and Eros."
_RE,"TRE.    	In ancient Rome, the number three was written as 'III', in Roman numerals. In modern-day Rome, 'tre' is Italian for the same number."
AL_C,"ALEC.    	Alec Baldwin is the oldest of the acting Baldwin brothers. I think his big break was playing Tom Clancy's Jack Ryan in ""The Hunt for Red October"", but thank goodness that role was taken over by Harrison Ford for the subsequent Jack Ryan movies. Baldwin is making a name for himself these days playing Jack Donaghy on ""30 Rock"", opposite Tina Fey."
PS_,PSI.    	Pounds Per Square Inch (PSI) is a measure of pressure.
_PA,"SPA.    	The word ""spa"" migrated into English from Belgium, as Spa is the name of a municipality in the east of the country that is famous for its healing hot springs. The name ""Spa"" comes from the Walloon word ""espa"" meaning ""spring, fountain""."
OHI_,"OHIO.    	Nope, not the Nile, but the Ohio River. The Ohio is formed in Pittsburgh where the Allegheny and Monongahela Rivers meet. It empties into the Mississippi near the city of Cairo, Illinois."
E_S,"ESS.    	Slalom is an anglicized version of the Norwegian word ""slalam"", meaning ""skiing race""."
_AS,"LAS.    	Gran Canaria, or Grand Canary Island, may be grand but it isn't quite as big as Tenerife, the largest island of the group and the most populated. The capital of Gran Canaria is Las Palmas, a port of call for Christopher Columbus in 1492 on his way to the Americas."
A_ES,"ARES.    	The Greek god Ares is often referred to as the Olympian god of warfare, but originally he was regarded as the god of blood-lust and slaughter. Ares united with Aphrodite to create several gods, including Phobos, Deimos and Eros. The Roman equivalent to Ares was Mars."
_SIA,"ASIA.    	Marco Polo was a merchant from Venice, and famous traveler throughout Asia. He journeyed with his father and uncle on an epic tour of Central Asia and China that lasted 24 years. Marco is the one we remember today because he documented their travels in the book ""Il Milione""."
_EN,"KEN.    	Barbie's male counterpart doll is Ken, and Ken's family name is Carson. Barbie's full name is Barbie Millicent Roberts. When Ken was introduced in 1959, it was as Barbie's boyfriend. In 2004 it was announced that Ken and Barbie were splitting up, and needed to spend quality time apart. Soon after the split, Barbie 'met' Blaine, a boogie boarder from Australia."
_TTA,"ETTA.    	Etta James was best known for her beautiful rendition of the song ""At Last"". Sadly, as she disclosed in her autobiography, James lived a life that was ravaged by drug addiction leading to numerous legal and health problems. Ms. James passed away in January 2012 having suffered from leukemia."
A_AL,"ARAL.    	The Aral Sea is another great example of how man can have a devastating effect on the environment. In early sixties the Aral Sea covered 68,000 square miles of Central Asia. Soviet Union irrigation projects drained the lake to such an extent that today the total area is less than 7,000 square miles, with 90% of the lake now completely dry. Sad ..."
_SHE,"ASHE.    	The Arthur Ashe Stadium in Queens, New York opened in 1997 and is the largest outdoor, tennis-only venue in the world. The stadium is sometimes criticized for not having a retractable dome to protect the playing surface from inclement weather."
ANN_,"ANNA.    	The King and I' is a Rodgers and Hammerstein musical based on a book by Margaret Landon called 'Anna and the King of Siam', first published in 1944. Landon's book is based on a true story, told in the memoirs of Anna Leonowens. Leonowens was the governess of the children of King Mongkut of Siam in the 1860s, and she also taught the King's wives."
_SL,ESL.    	English as a Second Language (ESL) is sometimes referred to as English for Speakers of Other Languages (ESOL) and English as a Foreign Language (EFL).
L_S,"LAS.    	Gran Canaria, or Grand Canary Island, may be grand but it isn't quite as big as Tenerife, the largest island of the group and the most populated. The capital of Gran Canaria is Las Palmas, which was a port of call for Christopher Columbus in 1492 on his way to the Americas."
ANN_,"ANNA.    	The King and I' is a Rodgers and Hammerstein musical based on a book by Margaret Landon called 'Anna and the King of Siam', first published in 1944. Landon's book is based on a true story, told in the memoirs of Anna Leonowens. Leonowens was the governess of the children of King Mongkut of Siam in the 1860s, and she also taught the King's wives."
E_SO,"ESSO.    	The brand name Esso has its roots in the old Standard Oil company, as it uses the initial letters of Standard and Oil (ESS-O). The Esso brand was replaced by Exxon in the US, but it is still used all over the rest of the world."
AL_E,"ALOE.    	The so called ""true aloe"" is aloe vera, a succulent plant that grows in relatively dry climates and one native to Africa. The plants leaves are full of biologically active compounds that have been studied extensively. Regardless of the studies, aloe vera has been used for centuries in herbal medicine, mainly for topical treatment of wounds."
ATR_,"ATRA.    	Fortunately for crossword setters, the Atra razor was introduced by Gillette in 1977. It was sold as the Contour in some markets, and its derivative products are still around today."
_CRU,"ECRU.    	The shade called ecru is a grayish, yellowish brown. The word ""ecru"" comes from French and means ""raw, unbleached"". ""Ecru"" has the same roots as our word ""crude""."
_NYA,"ENYA.    	Enya's real name is Eithne Patricia Ni Braonain, which can translate from the Irish into Enya Brennan. Her Donegal family (in the northwest of Ireland) formed a band called Clannad, which included Enya. In 1980 Enya launched her very successful solo career. Personally, I don't like her music as it all sounds the same to me, but she sure does turn up in crosswords a lot!"
_LEE,"ALEE.    	The direction ""alee"" is the direction away from the wind. If a sailor points into the wind, he is pointing ""aweather""."
O_AR,"OMAR.    	The character Omar Little is played on ""The Wire"" by Michael K. Williams. I didn't watch ""The Wire"" when it first aired but we ending up buying all five series on DVD and we watched the whole thing earlier this year. It's is a great drama series, and I thoroughly recommend it. Personally, I think that HBO produces some of the best dramas on American television."
_RO,"ORO.    	'Oro, plata, bronce' is 'gold, silver, bronze' in Spanish."
OR_,ORO.    	'Oro' is Spanish for 'gold'.
A_EC,"ALEC.    	Alec is the oldest of the acting Baldwin brothers. I think Alec's big break was playing Tom Clancy's Jack Ryan in ""The Hunt for Red October"", but thank goodness that role was taken over by Harrison Ford for the subsequent Jack Ryan movies. Baldwin made a name for himself in recent times playing Jack Donaghy on ""30 Rock"", opposite Tina Fey. He has also hosted the sketch show 'Saturday Night Live' on more occasions than anyone else (16 times)."
AL_E,"ALOE.    	Aloe vera has a number of alternate names that are descriptive of its efficacy as a medicine. These include the First Aid plant, Wand of Heaven, Silent Healer and Miracle Plant."
A_HE,"ASHE.    	Arthur Ashe was a professional tennis player from Richmond, Virginia. In his youth, Ashe found himself having to travel great distances to play against Caucasian opponents due to the segregation that still existed in his home state. He was rewarded for his dedication by being selected for the 1963 US Davis Cup team, the first African American player to be so honored. Ashe continued to run into trouble because of his ethnicity though, and in 1968 was denied entry into South Africa to play in the South African Open. In 1979 Ashe suffered a heart attack and had bypass surgery, with follow-up surgery four years later during which he contracted HIV from blood transfusions. Ashe passed away in 1993 due to complications from AIDS. Shortly afterwards, Ashe was posthumously awarded the Presidential Medal of Freedom by President Bill Clinton."
_PA,"SPA.    	Note the official punctuation in 'Mother's Day', even though one might think it should be 'Mothers' Day'. President Wilson, and Anna Jarvis who created the tradition, specifically wanted Mother's Day to honor the mothers within each family and not just ""mothers"" in general, so they went with the ""Mother's Day"" punctuation."
_RENE,"IRENE.    	The Broadway musical 'Irene' is based on a play by James Montgomery called 'Irene O'Dare'. When the musical opened for the first time, in 1919, it ran for 675 performances, a record for Broadway that stood for nearly 20 years. The show was revived in 1973, with Debbie Reynolds in the title role, and ran for 594 performances."
_SSO,"ESSO.    	The brand name Esso has its roots in the old Standard Oil company, as it uses the initial letters of Standard and Oil (ESS-O). The Esso brand was replaced by Exxon in the US, but it is still used all over the rest of the world."
PS_,PSI.    	The Greek letter psi is the one that looks a bit like a trident or a pitchfork.
OB_E,"OBOE.    	The oboe is perhaps my favorite of the reed instruments. The name ""oboe"" comes from the French ""hautbois"" which means ""high wood"". When you hear an orchestra tuning before a performance, you'll note (pun intended!) the oboe starts off the process by playing an ""A"". Everyone tunes in turn to that oboe's ""A"". Oh, and if you want to read a fun book (almost an ""expose"") about life playing the oboe, you might try ""Mozart in the Jungle"" by oboist Blair Tindall."
LA_,"LAS.    	Back in the 1800s, the Las Vegas Valley was given its name from the extensive meadows (""las vegas"" is Spanish for ""the meadows"") present in the area courtesy of the artesian wells drilled by the local farmers. Las Vegas was incorporated as a city in 1905, in the days when it was a stopping-off point for pioneers travelling west. It eventually became a railroad town, although with the coming of the railroad growth halted as travelers began to bypass Las Vegas. The city's tourism industry took off in 1935 with the completion of the nearby Hoover Dam, which is still a popular tourist attraction. Then gambling was legalized, and things really started to move. Vegas was picked, largely by celebrated figures in ""the mob"", as a convenient location across the California/Nevada state line that could service the vast population of Los Angeles. As a result, Las Vegas is the most populous US city founded in the 20th century (Chicago is the most populous city founded in the 19th century, just in case you were wondering)."
ED_,EDS.    	Editor (ed.)
IR_S,"IRIS.    	The pupil of the eye is the 'hole' located in the center of the iris through which light enters the retina. The term 'pupil' came into English via French from the latin 'pupilla', which is the diminutive form of 'pupa' meaning 'girl, doll'. The term came about due to the tiny doll-like image that one can see of oneself when looking into the center of another's eyes."
ETT_,ETTA.    	Etta Candy was introduced into Wonder Woman's universe by DC Comics in 1942. She started out as a undernourished young woman that Wonder Woman encountered in a local hospital. The next time she appeared in the comics she was a rather rotund woman who claims to have been rejuvenated by eating candy. This was 1942 ...
ALO_,"ALOE.    	Aloe vera has a number of alternate names that are descriptive of its efficacy as a medicine. These include the First Aid plant, Wand of Heaven, Silent Healer and Miracle Plant."
ISL_,"ISLE.    	The island of Capri off the coast of Southern Italy has been a tourist resort since the days of ancient Rome. Capri is home to the famous Blue Grotto, a sea cave that is illuminated with sunlight that's colored blue as it passes through the seawater into the cave. Natives of Capri are known as Capriotes."
S_A,"SPA.    	Someone who is ""chichi"" is showily trendy and pretentious. 'Chichi' is a French noun meaning 'airs, fuss'."
_DA,"IDA.    	Ida B. Wells was an African American journalist and leader of the civil rights movement. She published a pamphlet in 1892 called ""Southern Horrors: Lynch Law in All Its Phases"", which publicized the horrors of lynching of African Americans by white mobs in the South."
_NT,"ENT.    	An otoscope is that instrument that an Ear, Nose and Throat (ENT) specialist uses to look into the interior of your ears."
AL_C,"ALEC.    	Sir Alec Guinness played many great roles over a long and distinguished career, but nowadays is best remembered for playing the original Obi-Wan Kenobi in ""Star Wars""."
_EA,NEA.    	The National Endowment for the Arts (NEA)
R_E,RTE.    	A Global Positioning System (GPS) might suggest a route (rte.).
_PERA,"OPERA.    	'The Makropulos Affair' is an opera by the Czech composer Leoš Janáček, and is based on a play of the same name by author Karel Čapek."
