NS_,"NSW.    	New South Wales (NSW) is the most populous state in Australia and is home to Sydney, the most populous city in the country. New South Wales was founded in 1788. When the British took over New Zealand in 1840, for a while New Zealand was actually governed as part of New South Wales."
ES_,"-EST.    	""The Guinness Book of World Records"" holds some records of its own. It is the best-selling, copyrighted series of books of all time and is one of the books most often stolen from public libraries! The book was first published in 1954 by two twins, Norris and Ross McWhirter. The McWhirter twins found themselves with a smash hit, and eventually became very famous in Britain hosting a TV show based on world records."
_BER,"CBER.    	A CBer is someone who operates a Citizens' Band radio. In 1945, the FCC set aside certain radio frequencies for the personal use of citizens. The use of the Citizens' Band increased throughout the seventies as advances in electronics brought down the size of transceivers and their cost. There aren't many CB radios sold these days though, as they have largely been replaced by cell phones."
MESS_S,"MESSRS.    	The abbreviation 'Messrs.' is used at the head of a list of male names, in place of 'Misters'. It is an abbreviation of the French 'messieurs', the plural of 'monsieur'."
C_PAN,"C-SPAN.    	C-SPAN is a privately-funded, nonprofit cable channel that broadcasts continuous coverage of government proceedings."
_ALO,"HALO.    	The Greek word 'halos' is the name given to the ring of light around the sun or moon, which gives us our word 'halo'."
_BOMB,"A-BOMB.    	The Manhattan project was the joint US-Canada-UK project to develop an atomic bomb during WWII. Initially, the Army headquarters for the program was located on the 18th floor of a building on Broadway in New York City. Eventually, because of that first location, the project adopted the name 'Manhattan'."
EER_E,"EERIE.    	The terms ""goosebumps"" and 'goose flesh' come from the fact that skin which is cold can look like the flesh of a plucked goose."
M_SSRS,"MESSRS.    	The abbreviation 'Messrs.' is used at the head of a list of male names, in place of 'Misters'. It is an abbreviation of the French 'messieurs', the plural of 'monsieur'."
_ISI,"NISI.    	A decree nisi is a court order, one that only comes into force when certain specified conditions are met. At the point where the conditions are met, it becomes a decree absolute and is binding. 'Nisi' is Latin for 'unless'."
ACT_R,"ACTOR.    	Actor Sean Penn is a two-time Oscar winner, for his roles in ""Mystic River"" released in 2003 and ""Milk"" released in 2008. Penn's celebrity on screen is only matched with his fame off the screen. Apart from his ""big name"" marriages to singer Madonna and actress Robin Wright, Penn is also well known for political and social activism. He perhaps inherited some of his political views from his father, actor and director Leo Penn. As an actor, Leo refused to ""name names"" in front of the House Un-American Activities Committee and so was blacklisted in Hollywood and had to move into directing to put bread on the table. In later years as a director he gave his son Sean his first acting role, in a 1974 episode of ""Little House on the Prairie""."
_ECK,"NECK.    	The term 'necking' applies to kissing and caressing. I like what Groucho Marx had to say on the subject: ""Whoever named it necking was a poor judge of anatomy."""
TE_,"TES.    	'Tes' is the French word for 'your', when referring to a group of items and when talking to someone with whom you are familiar."
_NKARA,"ANKARA.    	Ankara is the second largest city in Turkey, after Istanbul (formerly Constantinople). After WWI, the Ottoman Empire had been defeated and the Allies occupied the Ottoman capital of Istanbul. The victors planned to break up most of Turkey, leaving native Turks just part of their country for their own. In the inevitable War of Independence that followed, the Turkish Nationalists used Ankara as their base. When the Nationalists emerged victorious, they declared Ankara the new capital of Turkey."
A_GELA,"ANGELA.    	The formidable politician Angela Merkel is the current Chancellor of Germany, the country's head of state. Merkel is the first female German Chancellor and when she chaired the G8 in 2007 she became only the second woman to do so, after the UK's Margaret Thatcher. Merkel grew up in East Germany under Communist rule."
_RAM,"TRAM.    	Walt Disney came up with the idea of building Disneyland after visiting other theme parks with his daughters in the thirties and forties. He started building the park at Anaheim, California in 1954, and the facility opened just one year and one day later. The total cost of construction was $17 million. Opening day did not go smoothly, largely because over 28,000 people visited the park compared to the 11,000 people expected at the invitation-only event. The opening day went so badly that for years Disney executives referred to it as 'Black Sunday'."
AURO_A,"AURORA.    	Having been rapped over the knuckles in Latin class a few times at school, I have to point out that 'aurora' is a singular noun, with the plural being 'aurorae'."
ALIBAB_,"ALI BABA.    	In the Arabic tale ""Ali Baba and the Forty Thieves"", the magical cave entrance is opened with the words ""Open, Simsim"", but this mutated into ""Open Sesame"" in European translations."
RAD_I,"RADII.    	Radius (plural 'radii') is a Latin word, as one might expect, meaning ""spoke of a wheel"". Makes sense, huh ...?"
OBIW_N,"OBI-WAN.    	Obi-Wan Kenobi is one of the more beloved of the 'Star Wars' characters. Kenobi was portrayed by two fabulous actors in the series of films. As a young man he is played by Scottish actor Ewan McGregor, and as an older man he is played by Alec Guinness."
YU_,"YUL.    	Yul Brynner was a Russian-born actor. Brynner was well known for his great performances, but also for his shaved head and his deep rich voice. He first adopted the ""hairstyle"" while playing the King of Siam in the stage version of ""The King and I"", and he stuck with it."
ACER_,"ACERB.    	'Acerb' is a variant of 'acerbic', meaning sour or bitter-tasting, acidic."
P_SAN,"PISAN.    	Leonardo of Pisa was a famous and respected Italian mathematician, also known as simply 'Fibonacci'. He is remembered for writing about a number sequence (although he didn't ""discover' it) that later was given the name 'Fibonacci sequence'. He wrote about the series of numbers in his book called 'Liber Abaci', a celebrated work that introduced Arabic numerals (i.e. 0-9) to the Western world."
_IL,"TIL.    	Til Tuesday was a New Wave band from Boston that performed and recorded from 1982 to 1988. Aimee Mann got her start with 'Til Tuesday, as bass player and vocalist. The band's best-known song is the hit 'Voices Carry', released in 1985."
_SAHI,"ASAHI.    	Asahi is a beer, and the name of the brewery that produces it. 'Asahi' is Japanese for 'morning sun'. Asahi introduced a 'dry beer' in 1987, igniting a craze that rocketed the brewery to the number one spot in terms of beer production in Japan, with Sapporo close behind."
L_ER,"LEER.    	""Visage"" is the French word for ""face"", and is a term we've imported into English to mean 'face' or 'facial expression'."
S_NAT,SENAT.    	The French parliament (Parlement français) is divided into the Senate (Sénat) and the National Assembly (Assemblée nationale).
ASA_A,"ASANA.    	Asana is a Sanskrit word literally meaning ""sitting down"". The asanas are the poses that a practitioner of yoga assumes. The most famous is the lotus position, the cross-legged pose, or padmasana."
F_G,"FIG.    	The Fig Newton is based on what is actually a very old recipe that dates back to Ancient Egypt. Whereas we grew up with 'Fig Rolls' in Ireland, here in America the brand name 'Fig Newton' was used, named after the town of Newton, Massachusetts where they were first produced."
SY_,SYR.    	The modern state that we know as Syria was established after WWI as a French mandate. Syria was granted independence from France in 1946. 
D_HS,DAHS.    	Dahs and dits are the sound equivalents of dashes and dots in Morse Code.
_ESS,"BESS.    	Harry and Bess Truman met when they were very young children, at Sunday school. They were friends right through high school and became engaged in 1918 just before Harry went off to France during WWI, marrying the next year. Bess never really took to the Washington scene when she became First Lady, and stayed out of the limelight as much as she could. Perhaps that contributed to her longevity. Mrs. Truman lived to the age of 97, the longest living First Lady in US history."
OHM_,"OHM'S.    	The unit of electrical resistance is the ohm (with the symbol omega) named after German physicist Georg Simon Ohm. Ohm was the guy who established experimentally that the amount of current flowing through a circuit is directly proportional to the voltage applied, (V=IR) a relationship that every school kid knows as Ohm's Law."
SA_O,"SAGO.    	When I was growing up in Ireland I was very familiar with pearl sago, which is very similar to pearl tapioca. Pearls of sago are simply little balls of sago starch used to make breads, pancakes, biscuits, or the steamed puddings that we ate as kids. Sago comes from pith of the sago palm tree. To get at the starch the tree has to be cut down and the trunk split to reveal the pith. The pith is crushed and manipulated to make the starch available, which is then washed out of a fibrous suspension. One sago palm tree yields about 150-300 kg of starch. Personally I love the stuff, but then, I am a bit weird ..."
O_ACLE,"ORACLE.    	In Ancient Greece and Rome, an oracle was someone believed inspired by the gods to give wise counsel. The word ""oracle"" derives from the Latin ""orare"" meaning ""to speak"", which is the same root for our word ""orator"". One of the most important oracles of Ancient Greece was the priestess to Apollo at Delphi."
HE_DI,"HEIDI.    	Heidi' is a Swiss children's book written by Johanna Spyri and published in two parts. The first is 'Heidi's years of learning and travel', and the second 'Heidi makes use of what she has learned'. The books tell the story of a young girl in the care of her grandfather in the Swiss Alps."
_TORK,"STORK.    	In German and Dutch society, storks resting on the roof of a house were considered a sign of good luck. This tradition led to nursery stories that babies were brought to families by storks."
M_RC,"MERC.    	The Chicago Mercantile Exchange started its life as the Chicago Butter and Egg Board in 1898. The Merc is the site for exchange of commodities, among other things."
T_G,"TAG.    	""Graffiti"" is the plural of ""graffito"", the Italian for ""a scribbling"". The word was first used to describe ancient inscriptions on the walls in the ruins of Pompeii."
_ARP,"GARP.    	John Irving's 1978 novel ""The World According to Garp"" is somewhat biographical. In fact, Irving's mother found parts of the novel difficult to read, recognizing elements of herself in Garp's mother, Jenny Fields."
TA_OR,"TABOR.    	A tabor is a portable snare drum that is played with one hand. The tabor is usually suspended by a strap from one arm, with the other hand free to beat the drum. It is often played as an accompaniment for a fife or other small flutes. The word ""tabor"" comes from ""tabwrdd"", the Welsh word for 'drum'."
OUI_A,"OUIJA.    	The Ouija board was introduced to America as a harmless parlor game at the end of the 19th century, although variations of the board date back to 1100 BC in China, where it was apparently used to ""contact"" the spirit world. The name ""Ouija"" is relatively recent, and is probably just a combination of the French and German words for ""yes"" ... ""oui"" and ""ja""."
_BN,"IBN.    	In Arabic names, 'ibn' is a word meaning 'son of'. The words 'bin' and 'ben' are also used for 'son of'. The word 'bint' means 'daughter of'. Similarly, in Hebrew 'ben' is used to mean 'son of', and 'bat' is used to mean 'daughter of'."
_AORIS,"MAORIS.    	The Māori are the indigenous people of New Zealand. The Māori are eastern Polynesian in origin and began arriving in New Zealand relatively recently, starting sometime in the late 13th century. The word ""māori"" simply means ""normal"", distinguishing the mortal human being from spiritual entities."
S_TRA,"SUTRA.    	Kama is the Hindu god of love. He is portrayed as a youth bearing a bow and arrows, much like Eros and Cupid."
W_LCO,"WILCO.    	In the world of radiotelephony, 'wilco' is short for 'I understand and will comply'."
T_KE,"TYKE.    	'Tyke' has been used playfully to describe a young child since at least 1902, but for centuries before that a tyke was a cur or mongrel, or perhaps a lazy or lower-class man."
_AG,"HAG.    	All Saints' Day is November 1st each year. The day before All Saints' Day is All Hallows' Eve, better known by the Scottish term, ""Halloween""."
ZALE_,"ZALES.    	The first Zales jewelry store was opened by Morris and William Zale and Ben Lipshy in Wichita Falls, Texas, in 1924. Zales became successful largely by offering credit to their customers, a revolutionary concept at the time."
RA_PH,"RALPH.    	The classic sitcom 'The Honeymooners' only aired for 39 episodes, with the last being broadcast in September of 1956. However, the sitcom itself was based on a recurring sketch that appeared on 'Cavalcade of Stars' and then 'The Jackie Gleason Show' from 1951-1955."
O_S,OBS.    	Obstetrician (Ob.)
_INI,"MINI.    	The original mini was a fabulous car, one that I drove all over Ireland in my youth. It had a unique front-wheel-drive layout that took up very little space, allowing for a lot of room (relatively speaking) for passengers and baggage. One space-saving trick was to mount the engine transversely, so it sits rotated 90 degrees from the norm. That engine had a capacity of only 848cc. In 1961, a Mini Cooper model was introduced, a sporty version of the Mini. The Mini Cooper was a phenomenal hit, especially after repeated wins in the Monte Carlo Rally. The Mini marque has been owned by BMW since 1994."
A_ER,AGER.    	A 'golden ager' is a senior citizen.
_ICE,"RICE.    	We refer to the Japanese alcoholic beverage made from rice as 'sake'. We've gotten things a bit mixed up in the West. 'Sake' is actually the word that the Japanese use for all alcoholic drinks. What we know as sake, we sometimes refer to as rice wine. Also, the starch in the rice is first converted to sugars that are then fermented into alcohol. This is more akin to a beer-brewing process than wine production, so the end product is really a rice 'beer' rather than a rice 'wine'."
RO_EO,"ROMEO.    	In William Shakespeare's play 'Romeo and Juliet', the lovers discuss the sad fact that they have been born into two feuding families in the famous balcony scene. Juliet says:"
_AREE,"PAREE.    	""Who Said Gay Paree?"" is a song from the Cole Porter musical ""Can-Can""."
_ARLE,"EARLE.    	Earle ""Bus"" Wheeler was an Army General who served as Chairman of the Joint Chiefs from 1964-70, during the turbulent times of the Vietnam War."
RIA_,RIAA.    	The Recording Industry Association of America (RIAA) represents music distributors. It is the RIAA that certifies records that have gone gold and platinum i.e. reached fixed sales thresholds. It's also the RIAA that goes after individuals who share music illegally online.
G_EL,"GAEL.    	A Gael is anyone of a race that speaks or spoke one of the Erse tongues. There are actually three Erse languages. Irish, Manx (spoken on the Isle of Man) and Scots Gaelic. In their own tongues, these would be Gaeilge (in Ireland), Gaelg (on the Isle of Man) and Gaidhlig (in Scotland)."
AR_EN,"ARLEN.    	Harold Arlen is a composer of popular music who will forever be associated with his composition 'Over the Rainbow' from the movie 'The Wizard of Oz'. Arlen also composed the music to 'Come Rain or Come Shine', 'It's Only a Paper Moon', 'Lydia the Tattooed Lady' and the wonderful 'Stormy Weather'."
ROGE_,"ROGER.    	The term 'roger', meaning 'yes' or 'acknowledged', comes from the world of radiotelephony. The British military used a phonetic alphabet in the fifties that included ""Roger"" to represent the letter 'R'. As such, it became customary to say 'Roger' when acknowledging a message, with R (Roger) standing for 'received'."
SA_IRE,"SATIRE.    	'Dr. Strangelove' is a black comedy directed and produced by Stanley Kubrick, released in 1964. The big star in the film is the great Peter Sellers, who plays three key roles. The full name of the movie is 'Dr. Strangelove or: How I learned to Stop Worrying and Love the Bomb'."
T_TI,TATI.    	Jacques Tati was a very famous filmmaker in France.
A_EL,"AUEL.    	As Jean Auel prepared her first book in the 'Earth's Children' series, she did a lot of research about the Ice Age, the setting for her stories. She went as far as taking a survival course in cold conditions, learning to build an ice cave and how to make fire, tan leather and knap stone."
C_MI,"CAMI.    	A camisole (also 'cami') is a sleeveless undergarment worn by women that extends down to the waist. 'Camisole' is a French word that we imported into English, which ultimately derives from the Latin 'camisia' meaning 'shirt, nightgown'."
H_S,"HIS.    	Sir Arthur Conan Doyle's short story titled 'His Last Bow' features the author's most famous character Sherlock Holmes. Published in 1917, during WWI, 'His Last Bow' might be referred to as a propaganda tool, written with the intent of boosting morale. It is an unusual Sherlock Holmes tale in that it is not a detective story, but rather deals with British and German spies."
HA_O,"HALO.    	The Greek word 'halos' is the name given to the ring of light around the sun or moon, which gives us our word 'halo', used for a radiant light depicted above the head of a saintly person."
ADID_S,"ADIDAS.    	The brand name Adidas dates back to when Adolf ""Adi"" Dassler started making his own sports shoes in his mother's laundry room in Bavaria after returning from WWI. With his brother, Adi founded Dassler shoes. The companies big break came in 1936 at the Berlin Olympics, when Adi persuaded American sprinter Jesse Owens to use his shoes, and with the success of Jesse Owens came success for the fledgling shoe company. After WWII the brothers split, acrimoniously. Adi's brother, Ru-dolf Da-ssler, formed ""Ruda"" shoes (later to become Puma), and Adi Das-sler formed ""Adidas""."
_IL,"TIL.    	Marvin Gaye was a singer-songwriter from Washington, D.C. who came to be known as 'Prince of Soul' and 'Prince of Motown'. Some of Gaye's biggest hits are 'I Heard It Through the Grapevine' (1968), 'What's Going On?' (1971), 'Let's Get It On' (1973) and 'Sexual Healing' (1982). Famously, Gaye was shot dead by his father while Marvin was sitting on his mother's bed just talking to her. Marvin had given the gun to his father as a Christmas gift."
IB_,"IBN.    	In Arabic names, 'ibn' is a word meaning 'son of'. The words 'bin' and 'ben' are also used for 'son of'. The word 'bint' means 'daughter of'. Similarly, in Hebrew 'ben' is used to mean 'son of', and 'bat' is used to mean 'daughter of'."
LE_,"LEX.    	'Lex scripta' is Latin for 'statutory law', whereas 'lex non scripta' is Latin for 'common law'."
ELU_,ELUL.    	Elul is the month in the Hebrew calendar that occurs in August-September.
P_CE,"PUCE.    	The name of the purple shade known as ""puce"" has a strange derivation. ""Puce"" came into English from French, in which language ""puce"" means ""flea"". Supposedly, puce is the color of a flea!"
_RGYLE,"ARGYLE.    	The argyle pattern is based on the Campbell tartan. The Campbell clan is based in the Argyll region (note the spelling) in the west of Scotland, giving the Argyle pattern its name."
E_C,"EEC.    	The Treaty of Rome is the international agreement of 1957 that established the European Economic Community (EEC). The original signatory countries were Belgium, France, Italy, Luxembourg, the Netherlands and West Germany. The EEC was also called ""the Common Market"". It was a NAFTA-like structure that was eventually absorbed into today's European Union."
_RTES,"ERTES.    	I don't think the artist Erte had any particular link to crosswords, but he sure does turn up a lot in crosswords. 'Erte' is a classic example of 'crosswordese'."
ULN_E,"ULNAE.    	The humerus is the long bone in the upper arm. The bones in the forearm are the radius and ulna. 'Ulna' is the Latin word for 'elbow', and 'radius' is Latin for 'ray'."
BLAN_,BLANC.    	'Vin blanc' is French for 'white wine'.
RA_A,"RAMA.    	The kings of Thailand (what used to be Siam) are often referred to as ""Rama"", so the current king Bhumibol Adulyadej is known as Rama IX. The name ""Rama"" is used as it's the name of the Hindu god Rama, a reincarnation of Vishnu."
ANA_,"ANAT.    	In an anatomy course one will study the anatomy of the ""gut""."
CEL_B,CELEB.    	People are always gossiping about celebrities.
_CS,OCS.    	Officer Candidate School (OCS)
_STIN,"ASTIN.    	Sean Astin is best known for playing the title role in the 1993 film ""Rudy"" and the character Samwise Gamgee in the ""Lord of the Rings"" movies. You might also have seen him playing Lynn McGill in the 5th season of ""24"". Astin is the son of actress Patty Duke."
_OLA,"KOLA.    	The nut of the kola tree has a bitter taste, and is loaded with caffeine. Despite the taste, the nut is habitually chewed in some cultures, especially in West Africa where the tree is commonly found in the rainforest. Here in the US we best know the kola nut as a flavoring used in cola drinks."
HE_DI,"HEIDI.    	German-born Heidi Klum was married to the successful English singer, Seal. Klum is a talented lady and has built a multi-faceted career based on her early success as a model. She is the force behind the Bravo reality show called ""Project Runway"" that has been on the air since 2004. Klum has been nominated 4-5 times for an Emmy for her association with the show. Klum was also signed up as the official ambassador for Barbie in 2009, the 50th anniversary of the Barbie Doll, and for her service that year a Heidi Klum Barbie was produced. She has a added a touch of class to the judging panel on the show 'America's Got Talent' since 2013."
WI_CO,"WILCO.    	In the world of radio telephony, 'wilco' is short for 'I understand and will comply'."
_TIR,"STIR.    	The drink we know today as Kool-Aid was invented by Edward Perkins and his wife, in Perkins' mother's kitchen in southwest Nebraska. Kool-Aid is now the Official Soft Drink of the state."
TO_D,TOAD.    	The 'warts' on the skin of a toad have no relation to the viral infection that can occur on human skin. A toad's warts a colored bumps that are believed to help the animal blend more effectively into its environment.
_IM,"HIM.    	""California Girls"" was released in 1965 by the Beach Boys, and reached number three in the ""Billboard"" charts. Twenty years later David Lee Roth recorded a very successful cover version of the song, and it reached exactly the same spot in the charts, number three."
SO_ATA,"SONATA.    	Beethoven subtitled his 'Piano Sonata No. 14, Op. 27, No. 2' as 'Quasi una fantasia', or 'sonata in the manner of a fantasy' in English. Five years after Beethoven died, a music critic wrote that the (superb!) first movement of the piece had an effect like that of moonlight shining on Lake Lucerne. Since then, the work has been known as the Moonlight Sonata."
_HOU,THOU.    	'G' and 'thou' are slang terms used for a 'thousand'.
_EAN,"BEAN.    	A noggin was the name of a small cup back in the 1600s, and later lent its name to a small drink (and eventually to ""eggnog""). Somehow the word morphed into usage meaning the ""head"" back in the mid-1800s."
B_T,"BIT.    	A ""shtick"" is a routine, a bit, a piece of entertainment. It comes from the Yiddish ""shtick"" which has the same meaning, and derives from the Middle High German word ""stücke"", the word for ""piece""."
_LA,"ELA.    	Lisbon is the capital of Portugal. Lisbon is the westernmost capital city in Europe, and indeed is the westernmost large city on the continent. It is also the oldest city in Western Europe and was founded hundreds of years before London, Paris and Rome."
MA_E,"MALE.    	There are lots of terms to describe horses of different ages and sexes, it seems:"
YAL_A,"YALTA.    	The Yalta Conference was a wartime meeting between WWII leaders Franklin D. Roosevelt, Winston Churchill and Joseph Stalin. Held in February of 1945, the conference is most remembered for decisions made on the post-war organization of Europe. To a large extent, the three leaders made decisions carving up influence around the world that has had implications to this day."
SATI_E,"SATIRE.    	The movie ""Network"" was released in 1976. It was directed by Sidney Lumet and stars Peter Finch in his final role, for which he won a posthumous Academy Award. That Oscar for Peter Finch was remarkable in that it was the first time the Best Actor award had been won after the actor passed away, and it was also the first time it had been won by an Australian."
G_EL,"GAEL.    	A highlander would be someone from the highlands of Scotland, and would qualify as a Gael. To me a Gael is anyone who speaks one of the Erse tongues."
SA_S,"SATS.    	Today the standardized test for admission to colleges is known as the SAT Reasoning Test, but it used to be called the Scholastic Aptitude Test and Scholastic Assessment Test, which led to the acronym SAT."
