_SB,"USB.    	Universal Serial Bus (USB) is an industry standard dealing with how computers and electronic devices connect and communicate, and deal with electrical power through those connections."
_AM,"HAM.    	The word ""ham"", describing a performer who overacts, is apparently a shortened form of ""hamfatter"" and dates back to the late 1800s. ""Hamfatter"" comes from a song in old minstrel shows called ""The Ham-Fat Man"". It seems that a poorly performing actor was deemed to have the ""acting"" qualities of a minstrel made up in blackface."
L_A,"LEA.    	Lea Michele is both an actor and a singer and started performing as a child actor on Broadway, including appearances in ""Les Miserables"" and ""Fiddler on the Roof"". These days Michele plays Rachel Berry on the Fox TV show ""Glee""."
RE_O,REPO.    	Repossession (repo)
_ON,"LON.    	Lon Nol was a soldier and politician in Cambodia, later serving twice as the country's president. When the Khmer Rouge took over Cambodia in 1975, Nol escaped the country to Indonesia. He eventually found a home in Fullerton, California, where he died in 1985."
_UDI,"AUDI.    	The Audi name has an interesting history. The Horch company was founded by August Horch in 1909. Early in the life of the new company, Horch was forced out of his own business. He set up a new enterprise and continued to use his own name as a brand. The old company sued him for using the Horch name so a meeting was held to choose something new. Horch's young son was studying Latin in the room where the meeting was taking place. He pointed out that ""Horch"" was German for ""hear"" and he suggested ""Audi"" as a replacement, the Latin for ""listen""."
OLG_,"OLGA.    	Olga Korbut is from modern-day Belarus, but was born during the days of the Soviet Union. She competed for the USSR team in the 1972 and 1976 Olympic Games. Korbut was 17 when she appeared in the 1972 Munich Games, and had been training in a sports school since she was 8-years-old. The world fell in love with her as she was a very emotional young lady, readily expressing joy and disappointment, something that we weren't used to seeing in athletes from behind the Iron Curtain. Korbut immigrated to the US in 1991, and now lives in Scottsdale, Arizona."
_ED,"QED.    	QED is used at the end of a mathematical proof or a philosophical argument. The QED acronym stands for the Latin ""quod erat demonstrandum"" meaning ""that which was to be demonstrated""."
_TA,"UTA.    	Uta Hagen was a German-born American actress. Hagen married Jose Ferrer in 1938, but they were divorced ten years later after it was revealed that she was having a long-running affair with Paul Robeson. Her association with Robeson, a prominent civil rights activist, earned her a spot on the Hollywood Blacklist during the McCarthy Era. This forced her away from film, but towards a successful stage career in New York City."
RO_,ROM.    	Read-only memory (ROM)
ANO_E,"ANODE.    	The two terminals of a battery are called the anode and the cathode. Electrons travel from the anode to the cathode, creating an electric current."
T_A,"TVA.    	The Tennessee Valley Authority has to be one of America's great success stories when it comes to economic development. Created in 1933, the TVA spearheaded economic development in the Tennessee Valley at the height of the Great Depression. Central to the success was the federally funded construction of flood control and electricity generation facilities."
ORS_N,"ORSON.    	Orson Scott Card is a science fiction author (mainly). Card's most famous work is his novel 'Ender's Game' first published in 1985. 'Ender's Game' was adapted into a movie and released in 2013, with a cast that includes Harrison Ford."
ST_RR,"STARR.    	Ken Starr has to be one of the most famous lawyers in recent history, due to his tenure as Independent Counsel when President Bill Clinton was in office. Starr's original brief was to investigate the suicide of White House Counsel Vince Foster as well as to continue the investigation of the Whitewater controversy in which then-Governor Clinton was accused of applying pressure to arrange an illegal loan to one of his partners in the Whitewater land deal. Famously, Starr's purview was extended to include an investigation into President Clinton's extramarital affair with Monica Lewinsky, to determine if the President had lied under oath about his relationship with the young intern."
_TR,"LTR.    	Like so many things it seems, our paper sizes here in North America don't conform with the standards in the rest of the world. ISO standard sizes used elsewhere have some logic behind them in that the ratio of width to length is usually one to the square root of two. This mathematical relationship means that when you cut a piece of paper in two each half preserves the aspect ratio of the original, which can be useful in making reduced or enlarged copies of documents. Our standard size of ""letter"" (8.5 x 11 inches) was determined in 1980 by the Reagan administration to be the official paper size for the US government. Prior to this, the official ""government"" letter size had been 8 by 10.5 inches."
OLA_,"OLAV.    	Of the many kings of Norway named Olaf/Olav (and there have been five), Olaf II is perhaps the most celebrated as he was canonized and made patron saint of the country. Olaf II was king from 1015 to 1028 and was known as ""Olaf the Big"" (or Olaf the Fat) during his reign. Today he is more commonly referred to as ""Olaf the Holy"". After Olaf died he was given the title of Rex Perpetuus Norvegiae, which is Latin for 'Norway's Eternal King'."
NA_A,"NADA.    	""Nada"" is the Spanish word for ""nothing"". ""De nada"" translates literally from the Spanish as ""of nothing"", and is used to mean ""you're welcome"" or ""don't mention it"". The French have the same saying ""de rien"", also translating to ""of nothing"" and used the same way."
RN_,RNS.    	A registered nurse (RN) might work in an intensive care unit (ICU).
_TOP,T-TOP.    	A T-top is a car roof that has removable panels on either side of a rigid bar that runs down the center of the vehicle above the driver.
ENOL_,"ENOLA.    	As we all know, the Enola Gay was the B-29 that dropped the first atomic bomb. Enola Gay was the name of the mother of the pilot, Col. Paul W. Tibbets, Jr."
AL_R,"ALAR.    	The chemical name for Alar, a plant growth regulator and color enhancer, is daminozide. Alar was primarily used on apples but was withdrawn from the market when it was linked to cancer."
_EE,"DEE.    	The Ramones were an American punk rock band. The group formed in Forest Hills, New York in the mid-seventies. The band members took on the stage names Dee Dee, Joey, and Johnny Ramone, even though they were not related. Arguably, the Ramones were the first punk rock group, defining the genre. Something else that's not my cup of tea ..."
PEL_,"PELE.    	Pelé is the nickname of Edson de Nascimento, a soccer player who has used the name Pelé for most of his life. Pelé is now retired, and for my money was the world's greatest ever player of the game. He is the only person to have been part of three World Cup winning squads, and is a national treasure in his native Brazil. One of Pele's nicknames is 'O Rei do Futebol' (the King of Football)."
STE_O,"STENO.    	Stenography is the process of writing in shorthand. The term comes from the Greek ""steno"" (narrow) and ""graphe"" (writing)."
O_OO,"OMOO.    	""Omoo: A Narrative of the South Seas"" is Herman Melville's auto-biographical sequel to ""Typee""."
IMA_,"IMAM.    	An imam is a Muslim leader, often the person in charge of a mosque or perhaps a Muslim community."
DI_,"DIS.    	'Dis' is a slang term meaning 'insult' that originated in the eighties, and is a shortened form of ""disrespect: or ""dismiss""."
D_E,"DEE.    	Ruby Dee is an American actress and activist. Her big movie appearance early in her career was in ""The Jackie Robinson Story"" from 1950, in which she played Robinson's sweetheart and wife. More recently, Dee was nominated for a Best-Supporting Actress Oscar for her role as Mama Lucas in ""American Gangster"". At 83 years of age, she is the second oldest actress to be so nominated."
_IS,DIS.    	'Dis' is a slang term meaning 'insult' that originated in the eighties. It is a shortened form of 'disrespect' or 'dismiss'.
OR_ON,"ORSON.    	""Mork & Mindy"" was broadcast from 1978 to 1982. We were first introduced to Mork (played by Robin Williams, of course) in a special episode of ""Happy Days"". The particular episode in question has a bizarre storyline culminating in Fonzie and Mork having a thumb-to-finger duel. Eventually Richie wakes up in bed, and alien Mork was revealed as a character in a dream!"
EP_OM,"EPSOM.    	The Surrey town of Epsom in England is most famous for its racecourse (Epsom Downs), at which is run the Epsom Derby every year, one of the three races that make up the English Triple Crown. We also come across Epsom salt from time to time. Epsom salt is magnesium sulfate, originally prepared by boiling down mineral waters. Epsom was indeed a spa town at one time. The town is also home to Epsom College, an English 'public school' (which actually means 'private, and expensive'). One of Epsom's 'old boys' was the Hollywood actor Stewart Granger."
O_OO,"OMOO.    	Herman Melville mined his own experiences when writing his novels. Melville sailed from New Bedford, Massachusetts in 1841 on a whaler heading into the Pacific Ocean (a source for ""Moby-Dick""). Melville ended up deserting his ship 18 months later and lived with natives on a South Pacific Island for three weeks (a source for ""Typee""). He picked up another whaler and headed for Hawaii, where he joined the crew of a US navy frigate that was bound for Boston (a source for ""Omoo"")."
E_TE,"ESTE.    	The Villa d'Este is a beautiful Renaissance villa situated close to Tivoli near Rome, Italy."
ISA_,"ISAO.    	Isao Aoki is one of Japan's greatest golfers, now playing on the senior circuit. His best finish in a major tournament was runner-up to Jack Nicklaus in the 1980 US Open."
EW_K,"EWOK.    	The Ewoks are creatures who live on the moon of Endor, first appearing in ""Star Wars Episode VI: Return of the Jedi"". They're the cute and cuddly little guys that look like teddy bears."
LAO_,"LAOS.    	The official name for the country of Laos is the Lao People's Democratic Republic. In the Lao language, the country's name is ""Meuang Lao"". The French ruled Laos as part of French Indochina, having united three separate Lao kingdoms. As there was a plural of ""Lao"" entities united into one, the French added the ""S"" and so today we tend to use ""Laos"" instead of ""Lao""."
YEN_,"YENS.    	The word ""yen"", meaning ""urge"", has been around in English since the very early 1900s. It comes from the earlier word ""yin"" imported from Chinese, which was used in English to describe an intense craving for opium!"
RO_E,"ROSE.    	The Wars of the Roses was a series of civil wars fought for the throne of England between the rival Houses of Lancaster and York. Ultimately the Lancastrians emerged victorious after Henry Tudor defeated King Richard III at the Battle of Bosworth Field. Henry was crowned King Henry VII, and so began the Tudor dynasty. Henry Tudor united the rival houses by marrying his cousin Elizabeth of York. Henry VII had a relatively long reign of 23 years that lasted until his death, after which his son succeeded to the throne as Henry VIII, continuing the relatively short-lived Tudor dynasty. Henry VIII ruled from 1509 until his death in 1547. Henry VIII was the last male to lead the the House of Tudor, as his daughter Queen Elizabeth I died without issue. When Elizabeth died, the Scottish King James VI succeeded to the throne as James I of England and Ireland. James I was the first English monarch of the House of Stuart."
ORS_N,"ORSON.    	Orson Scott Card is a science fiction author (mainly). Card's most famous work is his novel 'Ender's Game' first published in 1985. 'Ender's Game' was adapted into a movie and released in 2013, with a cast that includes Harrison Ford."
I_E,"ICE.    	Ice is something that numbs, ""a number"", and is found in a pack, like ""pack ice"". Pack ice is ice that floats on the ocean, packed into a single mass."
OPRA_,"OPRAH.    	Maya Rudolph is riding high right now, having gotten her break as a comedian on 'Saturday Night Live'. Rudolph is now making a lot of appearances as an actress, both on television and in the movies. On the small screen she plays a leading role in 'Up All Night' alongside Christina Applegate. On the big screen she had a prominent role in the relatively recent hit 'Bridesmaids'."
RE_,RET.    	Retired (ret.)
EY_,"EYE.    	A private investigator is often known as a PI, or ""private eye"", with the ""eye"" just a phonetic for the letter ""I""."
TR_S,"TRES.    	In French, something can be more than ""a little"" (un peu), it can be ""very"" (très)."
AL_R,"ALAR.    	The chemical name for Alar, a plant growth regulator, is daminozide. Initially it was primarily used on apples, but was banned when it was linked to a high risk of cancer."
ILI_D,"ILIAD.    	The Iliad is the epic poem by the Greek poet Homer, which tells the story of the siege of Ilium during the Trojan war."
E_E,"EYE.    	CBS is the second-largest broadcaster in the world, second only to the BBC in the UK. CBS introduced its 'eye' logo in 1951."
_TOP,T-TOP.    	A T-top is a car roof that has removable panels on either side of a rigid bar that runs down the center of the vehicle above the driver.
ER_ST,"ERNST.    	Max Ernst was a painter and sculptor, a pioneer in the Dada movement and Surrealism. Ernst was born near Cologne in Germany in 1891 and he was called up to fight in WWI, as were most young German men at that time. In his autobiography he writes ""Max Ernst died the 1st of August, 1914"" a statement about his experiences in the war. In reality, Ernst died in 1976 having lived to the ripe old age of 85."
T_M,"TAM.    	A tam o'shanter is a man's cap traditionally worn by Scotsmen. ""Tams"" were originally all blue (and called ""blue bonnets""), but as more dyes became readily available they became more colorful. The name of the cap comes from the title character of Robert Burns' poem ""Tam O'Shanter""."
RO_,"ROM.    	CD-ROM is an acronym standing for Compact Disc - Read-Only Memory. This means that a CD-ROM is memory that is available in the form of a disc, and can be accessed by some computer device but it cannot be written to ... it's read-only."
E_E,"ERE.    	Emily Dickinson wrote nearly 1800 poems in her lifetime, with less than a dozen published before she died in 1886. Emily's younger sister discovered the enormous collection, and it was published in batches over the coming decades. Here is the first verse of one of her poems:"
LOL_,"LOLA.    	""Lola"" is a fabulous song, written by Ray Davies and released by the Kinks back in 1970. Inspired by a real life incident, the lyrics tell of young man who met a young ""lady"" in a club, danced with her, and then discovered ""she"" was actually a transvestite. The storyline isn't very traditional, but the music is superb."
ETHE_,"ETHER.    	The Greek philosopher Empedocles proposed that there are four elements that made up the universe, namely earth, water, air and fire. Aristotle later proposed a fifth element which he called aether (also ""ether""). Aether was the divine substance that made up the stars and planets."
EY_,"EYE.    	If you look at the back of a one-dollar bill there is an eye sitting above a pyramid. This is known as the Eye of Providence, and is similar to the Eye of Horus that we see so often in Ancient Egyptian designs and hieroglyphs. The Eye of Providence is a common Christian emblem from the Middle Ages and Renaissance."
OD_SSA,"ODESSA.    	The Potemkin Stairs is a symbol of Odessa, Ukraine, and is a staircase with 192 steps in total. Prior names for the structure were Boulevard Steps, the Giant Staircase, the Richelieu Steps and the Primorsky Stairs. The 'Potemkin' name was applied in 1955 in honor of the 30th anniversary of the Battleship Potemkin."
A_ER,"ACER.    	I owned several Acer laptops, which are for my money the most reliable machine at the best price. Acer is a Taiwanese company that I used to visit a lot when I was in the electronics business. I was very impressed with the company's dedication to quality, and haven't been let down since."
_RTA,"SRTA.    	A young lady in France is addressed as ""mademoiselle"", and in Spain as ""senorita""."
_OAN,"ROAN.    	A roan horse has an even mixture of white and colored hairs on the body with the head, lower legs, mane and tail having a more solid color."
_LDS,"OLDS.    	The REO Motor Company was founded by Ransom E. Olds (hence the name REO). The company made cars, trucks and buses, and was in business from 1905 to 1975 in Lansing, Michigan. Olds introduced the Oldsmobile brand in 1897."
A_ATI,"AMATI.    	The first of the Amati family to make violins was Andrea Amati, who lived in the 14th century. He was succeeded by his sons, Antonio and Girolamo. In turn, they were succeeded by Girolamo's son, Nicolo. Nicolo had a few students who achieved fame making musical instruments as well. One was his own son, Girolamo, and another was the famed Antonio Stradivari."
_RLES,"ARLES.    	'Bedroom in Arles' is actually the name of three paintings by Vincent van Gogh. Each painting is his impression of his bedroom in the Yellow House in Arles, where Van Gogh rented four rooms in 1888."
_RED,"MR ED.    	""Mister Ed"" first aired in 1961 and ran for almost five years. It was a very successful show (and even made it to Ireland!). Mister Ed, the talking horse, was a palomino that had the real name of Bamboo Harvester. Mister Ed's ""voice"" was that of actor Allan ""Rocky"" Lane, a star of a lot of B-movie westerns from the forties and fifties. In the show, Mister Ed would only talk to the lead (human) character Wilbur, played by Alan Young, leading to some hilarious situations. Mister Ed had a stunt double and stand-in for the show, another horse called Pumpkin. Pumpkin later played the horse that made frequent appearances on the show ""Green Acres""."
AR_,ART.    	American artist Andy Warhol was a leader in the pop art movement that emerged in the mid-1950s. Many of his works became the most expensive paintings ever sold. A 1963 Warhol canvas titled 'Silver Car Crash (Double Disaster)' fetched over 100 million dollars in
R_M,"RPM.    	The tachometer takes its name from the Greek word ""tachos"" meaning ""speed"". A tachometer measures engine revolutions per minute (rpm)."
SM_G,"SMOG.    	""Smog"" is a portmanteau formed by melding ""smoke"" and ""fog"". The term was first used to describe the air around London in the early 1900s."
AUD_,"AUDI.    	The Audi name has an interesting history. The Horch company was founded by August Horch in 1909. Early in the life of the new company, Horch was forced out of his own business. He set up a new enterprise and continued to use his own name as a brand. The old company sued him for using the Horch name so a meeting was held to choose something new. Horch's young son was studying Latin in the room where the meeting was taking place. He pointed out that ""Horch"" was German for ""hear"" and he suggested ""Audi"" as a replacement, the Latin for ""listen""."
AVI_,"AVIA.    	The Avia brand name for athletic shoes was chosen as ""avia"" is the Latin word for ""to fly"", and suggests the concept of aviation. Avia was founded in Oregon in 1979."
A_EL,AXEL.    	An Axel is a forward take-off jump in figure skating. It was first performed by Norwegian Axel Paulsen at the 1882 World Figure Skating championships.
IRA_,IRAS.    	Individual retirement account (IRA)
L_E,"LYE.    	What we call 'lye' is usually sodium hydroxide, although historically the term was used for potassium hydroxide. Lye has many uses, including to cure several foodstuffs. Lye can make olives less bitter, for example. The chemical is also found in canned mandarin oranges, pretzels and Japanese ramen noodles. More concentrated grades of lye are used to clear drains and clean ovens. Scary ..."
IS_,"ISP.    	An Internet Service Provider is just what its name indicates, a company that provides its customers with access to the Internet. One way that ISPs differentiate themselves from each other is in the way that the end users are connected to the ISPs network. So, there are cable ISPs, DSL ISPs, dial-up ISPs and satellite ISPs. I'd go with cable if it's available in your area ..."
ETH_R,"ETHER.    	Ethers are a whole class of organic compounds, but in the vernacular 'ether' is specifically diethyl ether. Diethyl ether was once very popular as a general anesthetic."
OK_PI,"OKAPI.    	The okapi is closely related to the giraffe, although it does have markings on its legs and haunches that resemble those of a zebra. It is native to the Ituri Rainforest of the Democratic Republic of the Congo."
_TR,"LTR.    	Our paper sizes here in North America don't conform with the standards in the rest of the world. ISO standard sizes used elsewhere were chosen so that the ratio of width to length is usually one to the square root of two. This mathematical relationship means that when you cut a piece of paper in two each half preserves the aspect ratio of the original, which can be useful in making reduced or enlarged copies of documents. Our standard size of ""letter"" (8.5 x 11 inches) was determined in 1980 by the Reagan administration to be the official paper size for the US government. Prior to this, the ""legal"" size (8.5 x 14 inches) had been the standard, since 1921."
R_S,"RAS.    	RAs are resident assistants or resident advisers, the peer leaders found in residence halls, particularly on a college campus."
_HL,"NHL.    	The San Jose Sharks hockey team play their home games at the HP Pavillion in San Jose, a venue that we locals call 'the Shark Tank'."
OP_,"OPS.    	Psychological Operations (Psy Ops) is a contemporary name for propaganda, the ""winning of hearts and minds in a combat zone."
F_O,"FLO.    	Rapper Tramar Dillard is better known as rapper Flo Rida. As you might have guessed, Flo Rida was born in the state of Florida."
I_AO,"ISAO.    	Isao Aoki is one of Japan's greatest golfers, now playing on the senior circuit. Aoki's best finish in a major tournament was runner-up to Jack Nicklaus in the 1980 US Open."
AL_BI,"ALIBI.    	""Alibi"" is the Latin word for ""elsewhere"", as in I ""claim"" that I was ""elsewhere"" when the crime was committed ... I have an ""alibi""."
SAS_A,"SASHA.    	Sasha is the younger of the two Obama children, born in 2001. She is the youngest child to reside in the White House since John F. Kennedy, Jr. moved in with his parents as a small infant. Sasha's Secret Service codename is ""Rosebud"", and her older sister Malia has the codename ""Radiance""."
A_TRO,"ASTRO.    	'Astro Boy' is a manga cartoon series that appeared in print in the fifties and sixties. It was adapted for television starting in 1963, making it the first Japanese TV series in the genre now known as 'anime'."
OSAK_,"OSAKA.    	Sanyo is a Japanese electronics manufacturer based near Osaka and founded in 1947. The company name means ""three oceans"" reflecting the company's original aim to sell its products all around the world (across three oceans: the Atlantic, the Pacific and the Indian)."
TV_,"TVA.    	The Tennessee Valley Authority (TVA) has to be one of America's great success stories when it comes to economic development. Created in 1933, the TVA spearheaded economic development in the Tennessee Valley at the height of the Great Depression. Central to the success was the federally-funded construction of flood-control and electricity-generation facilities."
OM_O,"OMOO.    	Herman Melville mined his own experiences when writing his novels. Melville sailed from New Bedford, Massachusetts in 1841 on a whaler heading into the Pacific Ocean (a source for ""Moby Dick""). Melville ended up deserting his ship 18 months later and lived with natives on a South Pacific Island for three weeks (a source for ""Typee""). He picked up another whaler and headed for Hawaii, where he joined the crew of a US navy frigate that was bound for Boston (a source for ""Omoo"")."
TV_,"TVA.    	The Tennessee Valley Authority (TVA) has to be one of America's great success stories when it comes to economic development. Created in 1933, the TVA spearheaded economic development in the Tennessee Valley at the height of the Great Depression. Central to the success was the federally-funded construction of flood-control and electricity-generation facilities."
I_EM,"ITEM.    	An unmarried couple known to be involved with each other might appear in the gossip columns. This appearance as ""an item"" in the papers, led to the use of ""item"" to refer to such a couple, but only since the very early seventies."
_ES,"SES.    	'Ses' is the French word for 'his', 'her' or 'its', when referring to a group of items."
_SO,"USO.    	The United Service Organization (USO) was founded in 1941 at the request of FDR ""to handle the on-leave recreation of the men in the armed forces"". A USO tour is undertaken by a troupe of entertainers, many of whom are big-name celebrities. A USO tour usually includes troop locations in combat zones."
RO_N,"ROAN.    	A roan horse has an even mixture of white and colored hairs on the body with the head, lower legs, mane and tail having a more solid color."
