OPER_,"OPERA.    	The Latin for work is 'opus', with the plural being 'opera'."
_OO,"ROO.    	Like most of the characters in A. A. Milne's ""Winnie the Pooh"", the baby kangaroo called Roo was inspired by on a stuffed toy belonging to Milne's son Christopher Robin."
EL_E,"ELLE.    	""Elle"" magazine was founded in 1945 in France and today has the highest circulation of any fashion magazine in the world. ""Elle"" is the French word for ""she""."
IREN_,"IRENE.    	Princess Irene is the second child of the late Prince Bernhard and Queen Juliana of the Netherlands. Princess Irene created a great deal of turmoil in her homeland when she converted from Protestantism to Roman Catholicism in order to marry Prince Carlos Hugo of Bourbon-Parma. Such was the outcry that no one from the Dutch Royal Family attended her wedding, and she lost her right of succession to the throne. The couple settled in Madrid, but divorced 17 years later. While they were married Princess Irena never once returned to the Netherlands."
_DS,EDS.    	One might find plenty of editions (eds.) of some books in a library (lib.).
E_OS,"ENOS.    	Enos Slaughter has a remarkable playing record in Major League Baseball, over a 19-year career. His record is particularly remarkable given that he left baseball for three years to serve in the military during WWII."
IR_S,IRIS.    	Iris is a genus of flowering plants that come in a wide variety of flower colors. The term 'iris' is a Greek word meaning 'rainbow'.
I_ENE,"IRENE.    	Hurricane Irene caused extensive flooding in 2011 as it travelled through the Caribbean, up the East Coast of the United States and into the Atlantic seaboard of Canada. The hurricane was unusual in that it came so far up north. Fifty-five deaths were attributed to Irene."
E_T,"ENT.    	An Ear, Nose and Throat specialist is an ENT."
UT_,"UTE.    	The Ute are a group of Native American tribes that now reside in Utah and Colorado. The Ute were not a unified people as such, but rather a loose association of nomadic groups."
ANN_,"ANNA.    	I have to admit to not having read Tolstoy's novel ""Anna Karenina"", but I did see the excellent 1977 British television adaptation starring Nicola Pagett. Most regard the 1935 film starring Greta Garbo in the title role as the definitive big screen adaptation of the novel."
DN_,"DNA.    	Forensic scientists use DNA, usually taken from blood, semen, skin, saliva or hair follicles. Often DNA left at a crime scene can be used to identify a perpetrator of a crime, in a process called genetic fingerprinting."
OBO_,"OBOE.    	Nowadays we tend to use the NATO Phonetic Alphabet (Alfa, Bravo, Charlie etc.) but before this was introduced in 1956, the Joint Army/Navy Phonetic Alphabet was common. This latter series started with Able, Baker, Charlie, with O and P represented by Oboe and Peter. The NATO equivalents for O and P are Oscar and Papa."
D_A,"DNA.    	I've always been fascinated by the fact that the DNA of living things is so very similar across different species. Human DNA is almost exactly the same for every individual (to the degree of 99.9%). However, those small differences are sufficient to distinguish one individual from another, and to determine whether or not individuals are close family relations."
_AL,"SAL.    	Sal volatile is another word for ammonium carbonate. The action of crushing the salt gives off a smell of ammonia, and so it has been used for centuries as a ""smelling salt"", to revive someone who has fainted."
_RO,SRO.    	Standing Room Only (SRO).
O_OE,OBOE.    	The shawm is a double-reed woodwind instrument that was at its height of popularity from the Middle Ages through the Renaissance. The name 'shawm' came into English via a tortuous route from the Latin 'calamus' meaning 'reed'. The shawm lost its popularity with the arrival of the oboe family of instruments.
_LOE,"ALOE.    	Aloe vera has a number of alternate names that are descriptive of its efficacy as a medicine. These include the First Aid plant, Wand of Heaven, Silent Healer and Miracle Plant."
OBO_,"OBOE.    	The oboe is perhaps my favorite of the reed instruments. The name ""oboe"" comes from the French ""hautbois"" which means ""high wood"". When you hear an orchestra tuning before a performance, you'll note (pun intended!) the oboe starts off the process by playing an ""A"". The rest of the musicians in turn tune to that oboe's ""A"". Oh, and if you want to read a fun book (almost an ""exposé"") about life playing the oboe, I recommend ""Mozart in the Jungle"" by oboist Blair Tindall."
ATR_,"ATRA.    	Fortunately for crossword setters, the Atra razor was introduced by Gillette in 1977. The Atra was sold as the Contour in some markets and its derivative products are still around today."
AJA_,"AJAR.    	Our word ""ajar"" is thought to come from Scottish dialect, in which ""a char"" means ""slightly open""."
ECR_,"ECRU.    	The shade called ecru is a grayish, yellowish brown. The word 'ecru' comes from French and means 'raw, unbleached'. 'Ecru' has the same roots as our word 'crude'."
_OO,"ROO.    	Like most of the characters in A. A. Milne's ""Winnie the Pooh"", Roo is based on a stuffed toy belonging to his son, Christopher Robin Milne."
N_SA,"NASA.    	In the Apollo program, the Lunar Excursion Module (LEM) was the vehicle that actually landed on the moon and returned the astronauts to the command module that was orbiting overhead. The third LEM built was named ""Spider"", and it participated in the Apollo 9 mission which tested the functionality of the LEM design in space. The fourth LEM was called ""Snoopy"", and it flew around the moon in the Apollo 10 mission, the dress rehearsal for the upcoming moon landing. Apollo 11's LEM was of course called ""Eagle"", and it brought Neil Armstrong and Buzz Aldrin to and from the moon's surface."
_SI,PSI.    	Pounds per square inch (PSI) is a measure of pressure.
_DA,"IDA.    	Ida Rubinstein was an actress, dancer and patron of the arts from Russia. Rubinstein inherited her wealth and used it to form her own dance company and to commission artistic works. One of the more famous works that she commissioned was a ballet called 'Boléro' from Maurice Ravel, which nowadays is performed almost exclusively as an orchestral piece."
ELA_,"ELAN.    	Our word ""élan"" was imported from French, in which language the word has a similar meaning to ours i.e ""style"" or ""flair""."
U_E,"UTE.    	The Runnin' Utes are the basketball team of the University of Utah. The team was given the nickname the Runnin' Redskins back when Jack Gardner was the head coach from 1953 to 1971. The ""Runnin'"" part of the name was chosen because Gardner was famous for playing quick offenses. The ""Redskins"" name was later dropped in favor of the less controversial ""Utes""."
RE_,"REA.    	""Mens rea"" is Latin for ""guilty mind"" and is a central concept in criminal law. The concept is expanded to ""actus non facit reum nisi mens sit rea"" meaning ""the act does not make a person guilty unless the mind be also guilty"". In other words, a someone should not be deemed guilty of an act, unless he or she had a ""guilty mind"", intended to do wrong."
ALE_,"ALEC.    	The full name of Thomas Hardy's 1891 novel is ""Tess of the d'Urbervilles' A Pure Woman Faithfully Presented"". When it was originally published, ""Tess ..."" received very mixed reviews, largely because it addressed some difficult sexual themes including rape, and sexual double standards (attitudes towards men vs women). I suppose the most celebrated screen adaptation is Roman Polanski's ""Tess"" released in 1979. Polanski apparently made ""Tess"" because his wife, Sharon Tate, gave him Hardy's novel as her last act before she was murdered by the Manson family. There is a dedication at the beginning of the movie that just says ""To Sharon""."
AJ_R,"AJAR.    	Our word ""ajar"" is thought to come from Scottish dialect, in which ""a char"" means ""slightly open""."
S_O,SRO.    	Standing room only (SRO)
ER_,ERS.    	Registered nurses work in emergency rooms.
ALO_,"ALOE.    	Aloe vera has a number of alternate names that are descriptive of its efficacy as a medicine. These include the First Aid plant, Wand of Heaven, Silent Healer and Miracle Plant."
_RENE,IRENE.    	Irene Cara (as well as acting in 'Fame') sang the theme songs to the hit movies 'Fame' and 'Flashdance'.
R_A,"REA.    	Chris Rea is a singer-songwriter and respected blues guitar player from England. Rea's biggest hit is a song that he wrote himself called 'Fool (If You Think It's Over'), released in 1978."
S_A,"SPA.    	The word ""spa"" migrated into English from Belgium, as Spa is the name of a municipality in the east of the country that is famous for its healing hot springs. The name ""Spa"" comes from the Walloon word ""espa"" meaning ""spring, fountain""."
ES_,ESS.    	The Morse code symbol for the letter S is 'dot-dot-dot'.
RT_,"RTE.    	MapQuest is a very popular Internet site, one that provides driving directions and maps. MapQuest is actually owned by AOL."
ECR_,"ECRU.    	The shade called ecru is a grayish, yellowish brown. The word ""ecru"" comes from French and means ""raw, unbleached"". ""Ecru"" has the same roots as our word ""crude""."
AL_C,"ALEC.    	Alec Baldwin is the oldest of the acting Baldwin brothers. I think Alec's big break was playing Tom Clancy's Jack Ryan in ""The Hunt for Red October"", but thank goodness that role was taken over by Harrison Ford for the subsequent Jack Ryan movies. Baldwin is making a name for himself these days playing Jack Donaghy on ""30 Rock"", opposite Tina Fey."
DR_,"DRE.    	Dr. Dre is the stage name of rapper Andre Romelle Young. Dr. Dre is known for his own singing career as well as for producing records and starting the careers of others such Snoop Dogg, Eminem and 50 Cent."
_DAM,"EDAM.    	One cheese that is recognized by its coating is Edam. Edam cheese takes the name after the Dutch town of Edam in North Holland. It is famous for its coating of red paraffin wax, a layer of protection that helps it travel well and prevents spoiling. You might occasionally come across an Edam cheese that is coated in black wax. This means that the underlying cheese has been aged for a minimum of 17 weeks."
OR_,ORO.    	'Oro' is Spanish for 'gold'.
_EN,"KEN.    	Ken Kesey wrote the novel ""One Flew Over the Cuckoo's Nest"". Kesey was one of a group of friends who called themselves the ""Merry Pranksters"", a bunch of guys who were associated with the likes of Jack Kerouac, Allen Ginsberg and Timothy Leary, all icons of the Beat Generation."
AR_O,"ARLO.    	The comic strip ""Arlo and Janis"" is written by Jimmy Johnson. It was first published in 1985. The lead characters are named after the musicians Arlo Guthrie and Janis Joplin."
ED_,EDS.    	The masthead is a list of found on the editorial page of a newspaper that lists the members of a newspaper's editorial board.
A_AR,"AJAR.    	Our word ""ajar"" is thought to come from Scottish dialect, in which ""a char"" means ""slightly open""."
_AS,"LAS.    	The solfa syllables are: do, re, mi, fa, sol, la & ti."
IS_E,"ISLE.    	The island of Capri off the coast of Southern Italy has been a tourist resort since the days of ancient Rome. Capri is home to the famous Blue Grotto, a sea cave that is illuminated with sunlight that's colored blue as it passes through the seawater into the cave."
_PERA,"OPERA.    	'Anna Bolena' is an opera by Gaetano Donizetti, which tells the story of Anne Boleyn, the second wife of Henry VIII."
A_RA,"ATRA.    	Fortunately for crossword constructors, the Atra razor was introduced by Gillette in 1977. The Atra was sold as the Contour in some markets and its derivative products are still around today."
_RE,"DRE.    	Dr. Dre is the stage name of rapper Andre Romelle Young. He is perhaps as well known for his own singing career as he is for producing records and starting the careers of others such Snoop Dog, Eminem and 50 Cent."
ALE_,ALEC.    	Alec Wilkinson has been a staff writer for 'The New Yorker' since 1980. Wilkinson is also the author of ten books.
IR_S,"IRIS.    	The pupil of the eye is the 'hole' located in the center of the iris through which light enters the retina. The term 'pupil' came into English via French from the latin 'pupilla', which is the diminutive form of 'pupa' meaning 'girl, doll'. The term came about due to the tiny doll-like image that one can see of oneself when looking into the center of another's eyes."
SR_,SRO.    	Single Room Occupancy (SRO).
E_L,ESL.    	English as a Second Language (ESL) is sometimes referred to as English for Speakers of Other Languages (ESOL) and English as a Foreign Language (EFL).
AM_,AMA.    	American Medical Association (AMA)
ASH_,"ASHE.    	Arthur Ashe was a professional tennis player from Richmond, Virginia. In his youth he found himself having to travel great distances to play against Caucasian opponents, due to the segregation that still existed in Richmond. He was rewarded for his dedication by being selected for the 1963 US Davis Cup team, the first black player to be so honored. He still ran into trouble because of his ethnicity though, as in 1968 he was denied entry into South Africa to play in the South African Open. In 1979, Ashe suffered a heart attack and had bypass surgery. he had to have corrective surgery in 1983, and contracted HIV from blood transfusions during the surgery. He eventually passed away in 1993, due to complications from AIDS."
_RE,"DRE.    	In the original 1984 movie, the Karate Kid was named Daniel LaRusso, and in the 2010 remake was named Dre Parker."
UT_,UTE.    	The Utah Utes are the athletic teams of the University of Utah.
ENO_,"ENOS.    	The TV series ""Enos"" is a spinoff of the ""The Dukes of Hazard"". Enos Strate (played by Sonny Shroyer) was the small-town deputy in the original series, and the success of his character merited the follow-on show. It only ran for 18 episodes though."
_TE,"RTE.    	United Parcel Service (UPS) is based in Sandy Springs, Georgia and has its own airline that operates out of Louisville, Kentucky."
NE_,"NEA.    	The National Education Association (NEA) is the largest labor union in the country, and mainly represents public school teachers."
_RO,ORO.    	Guanajuato is one of the 31 states of Mexico.
_ES,NES.    	Nintendo Entertainment System (NES)
_NEA,"ONE-A.    	The US government maintains information on all males who are potentially subject to military conscription, using what is called the Selective Service System. In the event that a draft was held, men registered would be classified into groups to determine eligibility for service. Class 1-A registrants are those available for unrestricted military service. Other classes are 1-A-O (conscientious objector available for noncombatant service), 4-A (registrant who has completed military service) and 4-D (Minister of religion)."
OBO_,"OBOE.    	The oboe is perhaps my favorite of the reed instruments. The name ""oboe"" comes from the French ""hautbois"" which means ""high wood"". When you hear an orchestra tuning before a performance you'll note (pun intended!) that the oboe starts off the process by playing an ""A"". The rest of the musicians in turn tune to that oboe's ""A""."
_LLE,"ELLE.    	""Elle"" magazine was founded in 1945 and today has the biggest circulation of any fashion magazine in the world. ""Elle"" is the French word for ""she""."
R_NO,"RENO.    	Reno, Nevada takes its name from Major General Jesse Lee Reno, a Union officer killed in the Civil War. There is a famous ""Reno Arch"", a structure that stands over the city's main street erected in 1926 to promote an exposition planned for the following year. The city council decided to keep the arch and held a competition to decide what wording should be displayed, and the winner was ""The Biggest Little City in the World""."
ET_A,"ETTA.    	Etta James is best known for her rendition of ""At Last"". Sadly, she discloses in her autobiography, Etta James has lived a life that has been ravaged by drug addiction, leading to numerous legal and health problems."
_NA,"DNA.    	I've always been fascinated by the fact that the DNA of living things is so very similar across different species. Human DNA is almost exactly the same for every individual (to the degree of 99.9%). However, those small differences are sufficient to distinguish one individual from another, and to determine whether or not individuals are close family relations."
O_EA,"ONE-A.    	The US government maintains information on all males who are potentially subject to military conscription, using what is called the Selective Service System (SSS). In the event that a draft is held, men registered would be classified into groups to determine eligibility for service. Class 1-A registrants are those available for unrestricted military service. Other classes are 1-A-O (conscientious objectors available for noncombatant service), 4-A (registrants who have completed military service) and 4-D (ministers of religion)."
D_E,"DRE.    	Dr. Dre is the stage name of rapper Andre Romelle Young. He is perhaps as well known for his own singing career as he is for producing records and starting the careers of others such Snoop Dog, Eminem and 50 Cent."
_NO,UNO.    	'Uno momento' is Spanish for 'one minute'.
_LAN,"ELAN.    	Our word ""élan"" was imported from French, in which language the word has a similar meaning to ours, i.e 'style' or 'flair'."
_SHE,"ASHE.    	Arthur Ashe was a professional tennis player from Richmond, Virginia. In his youth, Ashe found himself having to travel great distances to play against Caucasian opponents due to the segregation that still existed in his home state. He was rewarded for his dedication by being selected for the 1963 US Davis Cup team, the first African American player to be so honored. Ashe continued to run into trouble because of his ethnicity though, and in 1968 was denied entry into South Africa to play in the South African Open. In 1979 Ashe suffered a heart attack and had bypass surgery, with follow-up surgery four years later during which he contracted HIV from blood transfusions. Ashe passed away in 1993 due to complications from AIDS. Shortly afterwards, Ashe was posthumously awarded the Presidential Medal of Freedom by President Bill Clinton."
A_EE,"AGEE.    	'Let Us Now Praise Famous Men' is a book by James Agee, with dramatic photographs by Walker Evans. The book chronicles the plight of sharecropper families in the American South during the Great Depression."
_SHE,"ASHE.    	Arthur Ashe was a professional tennis player from Richmond, Virginia. In his youth he found himself having to travel great distances to play against Caucasian opponents due to the segregation that still existed in his home state. He was rewarded for his dedication by being selected for the 1963 US Davis Cup team, the first African America player to be so honored. He continued to run into trouble because of his ethnicity though, and in 1968 was denied entry into South Africa to play in the South African Open. In 1979 Ashe suffered a heart attack and had bypass surgery, with follow-up surgery four years later during which he contracted HIV from blood transfusions. Ashe passed away in 1993, due to complications from AIDS. Shortly afterwards, Ashe was posthumously awarded the Presidential Medal of Freedom by President Bill Clinton."
IS_E,"ISLE.    	The Isle of Wight is the largest island in England, and lies about five miles off the south coast."
IR_S,"IRIS.    	The iris is the colored part of the eye, which has an aperture in the center that can open or close depending on the level of light hitting the eye."
_AS,"LAS.    	'Las Meninas' is a painting by Diego Velázquez, the name of which translates to 'The Maids of Honor'. 'Las Meninas' is the most famous painting owned by the Museo del Prado in Madrid."
ASI_,"ASIA.    	Risk is another fabulous board game, that was first released in France in 1957. The game was invented by a very successful French director of short films called Albert Lamorisse. The original French version was called ""La Conquete du Monde"" (The Conquest of the World). A game of Risk is a must during the holidays in our house."
T_AR,"TSAR.    	The term czar (also tsar) is a Slavic word and was first used as a title by Simeon I of Bulgaria in 913 AD. ""Czar"" is derived from the word ""Caesar"", which was synonymous with ""emperor"" at that time."
_RA,"ARA.    	Ara Parseghian coached the Notre Dame football team from 1964 to 1974, a period known as ""The Era of Ara""."
ELA_,"ELAN.    	Our word ""élan"" was imported from French, in which language the word has a similar meaning to ours i.e ""style"" or ""flair""."
PS_,PSI.    	The Greek letter psi is the one that looks a bit like a trident or a pitchfork.
_LEC,"ALEC.    	Alec Waugh was the older brother of the more famous Evelyn Waugh. Both were successful novelists (Evelyn of ""Brideshead Revisited"" fame), but what I like about Alec is that he supposedly invented the cocktail party. He invited his friends around ""for tea"" in the twenties, and served them all rum swizzles instead!"
T_A,"TSA.    	The Transportation Security Administration (TSA) was created in 2001, soon after the 9/11 attacks. TSA personnel carry out the baggage and body searches at US airports. The TSA has a Trusted Traveler program that allows certain passengers to move more quickly through security screening. These passengers pay the TSA a one-time fee that covers a background check after which successful applicants are issued a Known Traveler Number (KTN)."
I_LE,"ISLE.    	Aruba is one of the so-called ABC Islands. The ABC Islands is the nickname given to the three western-most islands of the Leeward Antilles in the Caribbean. The nickname comes from the first letters of the island names: Aruba, Bonaire and Curaçao. All three of the ABC Islands are part of the Kingdom of the Netherlands."
LO_,"LOO.    	When I was growing up in Ireland, a ""bathroom"" was a room that had a bath and no toilet. The separate room with the commode was called ""the toilet"" or sometimes the W.C. (the water closet). Apparently the term closet was used because in the 1800s when homeowners started installing toilets indoors they often displaced clothes and linens in a ""closet"", as a closet was the right size to take the commode. It has been suggested that the British term ""loo"" comes from Waterloo (water-closet ... water-loo), but no one seems to know for sure. Another suggestion is that the term comes from the card game of ""lanterloo"" in which the pot was called the loo!"
T_A,"TSA.    	The Transportation Security Administration (TSA) was created in 2001, soon after the 9/11 attacks."
_SSO,ESSO.    	'Put a Tiger in Your Tank' was an advertising slogan and theme used by Esso gasoline in the 1960s.
AR_S,"ARES.    	Wonder Woman first appeared in print in 1941, published by DC Comics. As she was created during WWII, Wonder Woman's first foes were the axis powers. In the less realistic world her biggest foe was, and still is, Ares, named for the Greek mythological figure."
NE_,NES.    	The Nintendo Entertainment System (NES) was sold in North America from 1985 to to 1995. The NES was the biggest selling gaming console of the era.
UT_,"UTE.    	A utility vehicle is often called a ""ute"" for short. Nowadays one mainly hears about sports utes and crossover utes."
S_L,"SAL.    	""My Gal Sal"" is a song written by composer Paul Dresser. ""My Gal Sal"" is also the name of the movie recounting Dresser's life made in 1942. It stars Victor Mature as Dresser, and Rita Hayworth as Sally ""Sal"" Elliott."
R_A,"REA.    	""Mens rea"" is Latin for ""guilty mind"" and is a central concept in criminal law. The concept is expanded to ""actus non facit reum nisi mens sit rea"" meaning ""the act does not make a person guilty unless the mind be also guilty"". In other words, a someone should not be deemed guilty of an act, unless he or she had a ""guilty mind"", intended to do wrong."
AL_E,"ALOE.    	Aloe vera has a number of alternate names that are descriptive of its efficacy as a medicine. These include the First Aid plant, Wand of Heaven, Silent Healer and Miracle Plant."
AJ_R,"AJAR.    	Our word ""ajar"" is thought to come from Scottish dialect, in which ""a char"" means ""slightly open""."
_ASA,"NASA.    	The Soviet Union launched the Sputnik satellite towards the end of 1957, a development that shocked the establishment in the US. Within months, President Eisenhower had made his moves, creating the Advanced Research Projects Agency (ARPA, now DARPA) and the National Aeronautics and Space Administration (NASA)."
OB_E,"OBOE.    	We've all probably heard the phrase ''tis an ill wind that blows nobody any good'. The poet Ogden Nash made a 'punny' statement about the oboe, calling the instrument ""an ill wind nobody blows good'. I must say though, I disagree ..."
AR_S,"ARES.    	The Greek god Ares is often referred to as the Olympian god of warfare, but originally he was regarded as the god of bloodlust and slaughter. Ares united with Aphrodite to create several gods, including Phobos, Deimos and Eros. The Roman equivalent to Ares was Mars. Ares was the son of Zeus and Hera."
