AT_,"ATF.    	The Bureau of Alcohol, Tobacco, Firearms and Explosives (ATF) is today part of the department of Justice. The ATF has its roots in the Department of Treasury dating back to 1886 when it was known as the Bureau of Prohibition. ""Explosives"" was added to the ATF's name when the bureau was moved under the Department of Justice as part of the government reorganization called for in the Homeland Security Act of 2002."
NYS_,"NYSE.    	The New York Stock Exchange has its roots back in 1792, when a group of 24 stock brokers set up the New York Stock & Exchange Board. They did so in an agreement signed under a buttonwood tree outside 68 Wall Street. That document became known as the Buttonwood Agreement."
_LGA,"OLGA.    	Olga Korbut is from modern-day Belarus, but was born during the days of the Soviet Union. Korbut competed for the USSR team in the 1972 and 1976 Olympic Games. She was 17 when she appeared in the 1972 Munich Games, and had been training in a sports school since she was 8-years-old. The world fell in love with her as she was a very emotional young lady, readily expressing joy and disappointment, something that we weren't used to seeing in athletes from behind the Iron Curtain. Korbut immigrated to the US in 1991 and now lives in Scottsdale, Arizona."
OR_ON,ORSON.    	'Mork & Mindy' is a sitcom that originally aired from 1978 to 1982. The title characters were played by Robin Williams and Pam Dawber. Mork is an alien from the planet Ork who reports back to his superior called Orson. Orson is played by voice actor Ralph James. Ralph James was also known for providing the voice of Mr Turtle in famous Tootsie Pop commercials in the seventies.
_EA,"LEA.    	The River Lea is a major waterway that meets up with the River Thames within the city of London. There have been persistent rumors over the past few years that a large predator lives in the Lea, as witnesses have seen Canada geese and other birds dragged vertically underwater. A favorite explanation from the tabloid press is that there is a crocodile lurking in the area, something that has been strenuously denied by the authorities."
I_P,"ISP.    	An Internet Service Provider is just what its name indicates, a company that provides its customers with access to the Internet. One way that ISPs differentiate themselves from each other is in the way that the end users are connected to the ISPs network. So, there are cable ISPs, DSL ISPs, dial-up ISPs and satellite ISPs. I'd go with cable if it's available in your area ..."
_NOLA,ENOLA.    	ENOLA/ALONE
TTO_,T-TOP.    	A T-top is a car roof that has removable panels on either side of a rigid bar that runs down the center of the vehicle above the driver.
S_HO,"SOHO.    	The area of London called Soho had a very poor reputation for most of the 20th century as it was home to the city's red light district. Soho has been transformed though, and has been a very fashionable neighborhood since the 1980s."
NC_,"NCR.    	NCR has been in business since 1884, and was originally called the National Cash Register Company. The company has done well in a market where new technologies seem to be constantly disrupting the status quo."
LED_,"LEDA.    	In Greek mythology, Leda was the beautiful Queen of Sparta who was seduced by Zeus when he took the form of a swan. Leda produced two eggs from the union. One egg hatched into the beautiful Helen, later to be known as Helen of Troy and over whom the Trojan War was fought. The other egg hatched into the twins Castor and Pollux. Castor and Pollux had different fathers according to the myth. Pollux was the son of Zeus and was immortal, while Castor was the son of Leda's earthly husband, and so he was a mortal. William Butler Yeats wrote a famous sonnet called 'Leda and the Swan' in 1924. Peter Paul Rubens made a copy of a painting called 'Leda and the Swan' by Michelangelo, which is now lost."
_OHO,"SOHO.    	The Manhattan neighborhood known today as SoHo was very fashionable in the early 1900s, but as the well-heeled started to move uptown the area became very run down and poorly maintained. Noted for the number of fires that erupted in derelict buildings, SoHo earned the nickname ""Hell's Hundred Acres"". The area was then zoned for manufacturing and became home to many sweatshops. In the mid-1900s artists started to move into open loft spaces and renovating old buildings as the lofts were ideal locations in which an artist could both live and work. In 1968, artists and others organized themselves so that they could legalize their residential use of an area zoned for manufacturing. The group they formed took its name from the name given to the area by the city's Planning Commission i.e ""South of Houston"". This was shortened from So-uth of Ho-uston to SoHo as in the SoHo Artists Association, and the name stuck."
EL_INO,"EL NINO.    	When the surface temperature of much of the Pacific Ocean rises more that half a degree centigrade, then there is said to be an El Niño episode. That small temperature change in the Pacific has been associated with climatic changes that can stretch right across the globe. El Niño is Spanish for ""the boy"" and is a reference to the Christ child. The phenomenon was given this particular Spanish name because the warming is usually noticed near South America and around Christmas-time."
IRA_I,"IRANI.    	Rosewater' is a 2014 movie that was written and directed by Jon Stewart of 'The Daily Show'. The film centers on the 118-day incarceration of Iranian-Canadian journalist Maziar Bahari by the Iranian authorities in 2009. Because of his work on the film, Stewart has been accused by Iran's state TV service of working with the CIA. When Bahari was being interrogated, he was blindfolded. He remembers that his main interrogator smelled of rosewater, hence the name of the film."
RE_,RET.    	Retired.
A_EL,AXEL.    	An 'axel' is a forward take-off jump in figure skating. It was first performed by Norwegian Axel Paulsen at the 1882 World Figure Skating championships.
L_AH,"LEAH.    	According to the Bible, Leah was one of the two wives of Jacob, the other being Leah's sister Rachel. Jacob's intention had been to marry Rachel, but the Leah and Rachel's father 'switched' his daughters and provided Leah as the veiled bride. Jacob married Rachel a week later, and lived with the two wives concurrently."
_EM,"DEM.    	Democrats, the type on the left side of politics."
DI_,"DIE.    	The numbers on dice are arranged so that the opposite faces add up to seven. Given this arrangement, the numbers 1, 2 and 3 all meet at a common vertex. There are two ways of arranging the 1, 2 and 3 around the common vertex, a so called right-handed die (clockwise 1-2-3) or a left-handed die (counterclockwise 1-2-3). Traditionally, dice used in Western cultures are right-handed, whereas Chinese dice are left-handed. Quite interesting ..."
A_IA,"APIA.    	Polynesian Airlines is the national airline of Samoa, and as such is based in the capital of Samoa, Apia."
_GEE,OGEE.    	An ogee is like an s-curve. Specifically it is a curve consisting of two arcs that curve in opposite directions (like an S) but both ends of the curve end up parallel to each other (which is not necessarily true for an S).
_MOO,"OMOO.    	Herman Melville mined his own experiences when writing his novels. Melville sailed from New Bedford, Massachusetts in 1841 on a whaler heading into the Pacific Ocean (a source for ""Moby Dick""). Melville ended up deserting his ship 18 months later and lived with natives on a South Pacific Island for three weeks (a source for ""Typee""). He picked up another whaler and headed for Hawaii, where he joined the crew of a US navy frigate that was bound for Boston (a source for ""Omoo"")."
_LAR,"ALAR.    	The chemical name for Alar, a plant growth regulator and color enhancer, is daminozide. It was primarily used on apples, but was withdrawn from the market when it was linked to cancer."
HA_,"HAM.    	Amateur radio operators were originally called ham operators by professional telegraph operators, and the term was intended to be insulting. It came from the similar term 'ham actor', describing a person who was less than effective on the stage. But amateur operators eventually embraced the moniker, and so it stuck."
SC_T,"SCOT.    	The lovely Scottish garment called a kilt is pleated, but only at the rear."
_PIA,"APIA.    	Apia is the capital city, and in fact the only city, of the Pacific island-nation of Samoa. The harbor of Apia is famous for a very foolish incident in 1889 involving seven naval vessels from Germany, the US and Britain. A typhoon was approaching so the safest thing to do was to head for open water away from land, but no nation would move its ships for fear of losing face in front of the others. Six of the ships were lost in the typhoon as a result and 200 American and German sailors perished. The British cruiser HMS Calliope barely managed to escape from the harbor and rode out the storm safely."
_UR,"SUR.    	Orléans is a city in France, located less than 100 miles southwest of Paris. The French city gives its name to the American city of New Orleans."
TA_,"TAM.    	A tam o'shanter is a man's cap traditionally worn by Scotsmen. ""Tams"" were originally all blue (and called ""blue bonnets"") but as more dyes became readily available, they became more colorful. The name tam o'shanter comes from the title character of Robert Burns poem ""Tam O'Shanter""."
ES_YS,ESPYS.    	Awards ceremony since 1993 : ESPYS. The ESPY Awards are a creation of the ESPN sports television network. One difference with similarly named awards in the entertainment industry is that ESPY winners are chosen solely based on viewer votes.
ECO_,ECON.    	Economics (econ.)
PIT_,"PITA.    	Falafel is a fried ball of ground chickpeas or fava beans served in pita bread. I love chickpeas, but falafel just seems too dry to me."
DI_,"DIS.    	'Dis' is a slang term meaning 'insult' that originated in the eighties, a shortened form of disrespect or dismiss."
S_S,STS.    	Street (st.)
SS_S,"SSNS.    	The main purpose of a Social Security Number (SSN) is to track individuals for the purposes of taxation, although given its ubiquitous use, it is looking more and more like an ""identity number"" to me. The social security number system was introduced in 1936. Prior to 1986, an SSN was required only for persons with substantial income so many children under 14 had no number assigned. For some years the IRS had a concern that a lot of people were claiming children on their tax returns who did not actually exist. So, from 1986 onward, it is a requirement to get an SSN for any dependents over the age of 5. Sure enough, in 1987 seven million dependents ""disappeared""."
AMAT_,"AMATI.    	The first of the Amati family to make violins was Andrea Amati, who lived in the 14th century. He was succeeded by his sons, Antonio and Girolamo. In turn, they were succeeded by Girolamo's son, Nicolo. Nicolo had a few students who achieved fame making musical instruments as well. One was his own son, Girolamo, and another was the famed Antonio Stradivari."
_MO,"HMO.    	Kaiser Permanente is a health maintenance organization (HMO) based in Oakland, California. Kaiser is the largest provider of managed care in the whole country."
STO_,"STOA.    	A stoa was a covered walkway in Ancient Greece. A stoa usually consisted of columns lining the side of a building or buildings, with another row of columns defining the other side of the walkway. The columns supported a roof. Often stoae would surround marketplaces in large cities."
_ON,"LON.    	Lon Kruger is a professional basketball coach from Silver Lake, Kansas, and former player with the Kansas State Wildcats. Kruger spent most of his career coaching college basketball, but did spend three years with the NBA's Atlanta Hawks."
EM_S,EMTS.    	Emergency Medical Technicians.
L_A,"LEA.    	The word ""bucolic"", meaning rustic or rural, comes to us from the Greek word ""boukolos"" meaning ""cowherd""."
T_U,"TRU.    	""Tru"" was written by Jay Presson Allen, which premiered in 1989. There is an interesting anachronism in the piece. It is set in Capote's New York City apartment in Christmas 1975, and at one point the Capote character talks about suicide saying he has enough pills to stage his own Jonestown Massacre. The Jonestown Massacre didn't happen until three years later, in 1978."
_PAM,"SPAM.    	I guess the idea is that SPAM is a con in the electronic world, in the world of email, in the 'e-world'."
_KEE,"SKEE.    	Skee Ball is that arcade game where you roll balls up a ramp trying to ""bounce"" it into rings for different numbers of points. The game was first introduced in Philadelphia, in 1909."
STE_O,"STENO.    	Stenography is the process of writing in shorthand. The term comes from the Greek ""steno"" (narrow) and ""graphe"" (writing)."
_LEET,"SLEET.    	Apparently ""sleet"" is a term used to describe two weather conditions. One is a shower of ice pellets, smaller than hail, and the second is a mixture of rain and snow, with the snow melting as it falls. It's the second definition that I have always used ..."
_EE,"DEE.    	The actress Sandra Dee started out as a model before moving into film. After a promising start to her career it seemed to peter out, and the public became more interested in her 7-year marriage to Bobby Darin. And of course she will forever be remembered from the song in the movie and stage-show ""Grease"" called ""Look at Me, I'm Sandra Dee""."
_ED,"QED.    	QED is used at the end of a mathematical proof or a philosophical argument. The QED acronym stands for the Latin ""quod erat demonstrandum"" meaning ""that which was to be demonstrated""."
A_ER,"ACER.    	I am typing away right now in an Acer laptop, for my money the most reliable machine at the best price. Acer is a Taiwanese company that I used to visit a lot when I was in the electronics business. I was very impressed with the company's dedication to quality, and haven't been let down since."
KO_LA,"KOALA.    	The koala really does look like a little bear, but it's not even closely related. The koala is an arboreal marsupial and a herbivore, native to the east and south coasts of Australia. Koalas aren't primates, and are one of the few mammals other than primates who have fingerprints. In fact, it can be very difficult to tell human fingerprints from koala fingerprints, even under an electron microscope."
_OSE,"ROSE.    	When James Cameron made his epic movie 'Titanic', released in 1997, it was the most expensive film ever made, costing about $200 million. It was a good investment for the studio as it became the highest-grossing film of all time, bringing in over $1.8 billion. 'Titanic' remained the highest-grossing film until 2010, when Cameron eclipsed the prior record with 'Avatar'."
R_T,RET.    	Retired (ret.)
NE_D,"NERD.    	""The Big Bang Theory"" is a wonderful sitcom that has been airing on CBS since 2007. There are a lot of high-powered equations and math in the show's dialog, but it is all checked by a professor of physics and astronomy at UCLA."
PO_,"POI.    	Nowadays the word 'luau' denotes almost any kind of party on the Hawaiian Islands, but to the purist a luau is a feast that always includes a serving of 'poi', the bulbous underground stems of taro baked with coconut milk."
IR_S,IRAS.    	Individual retirement account (IRA)
_OAN,"ROAN.    	A roan horse has an even mixture of white and colored hairs on the body with the head, lower legs, mane and tail having a more solid color."
N_RD,"NERD.    	Dweeb is relatively recent American slang that came out of college life in the late sixties. Dweeb, squarepants, nerd, they're all are not-nice terms that mean the same thing: someone excessively studious and socially inept."
_TS,"STS.    	When New Orleans was founded, the House of Bourbon was ruling France. Bourbon Street was named in its honor."
AL_R,"ALAR.    	""Alar"" means ""wing-shaped"", and comes from the Latin word ""alaris"" meaning ""wing""."
E_PYS,ESPYS.    	The ESPY Awards are a creation of the ESPN sports television network. One difference with similarly named awards in the entertainment industry is that the winners are chosen solely based on viewer votes.
_RLES,"ARLES.    	I had the privilege to live a short car-ride from the beautiful city of Arles in the South of France. Although it has a long and colorful history, the Romans had a tremendous influence over the city's design. It has a spectacular Roman amphitheater, arch, circus as well as old walls that surround the center of the city. In more modern times, it was a place that Vincent van Gogh often visited, and where he painted his famous ""Cafe Terrace at Night"", as well as ""Bedroom in Arles""."
C_O,"CRO.    	Remains of early man, dating back to 35,000 years ago, were found in Abri de Cro-Magnon in southwest France, giving the name to those early humans. Cro-Magnon remains are the oldest human relics that have been discovered in Europe."
EVA_,"EVAN.    	Evan Osnos is a journalist at 'The New Yorker', one noted for covering China. Osnos also won a 2014 National Book Award for his book 'Age of Ambition: Chasing, Fortune, Truth, and Faith in the New China'."
_MATI,"AMATI.    	The first of the Amati family to make violins was Andrea Amati, who lived in the 14th century. He was succeeded by his sons, Antonio and Girolamo. In turn, they were succeeded by Girolamo's son, Nicolo. Nicolo had a few students who achieved fame making musical instruments as well. One was his own son, Girolamo, and another was the famed Antonio Stradivari."
_OM,"NOM.    	Montréal and Québec are names (noms) of cities, in French."
LE_A,"LEDA.    	In Greek mythology, Leda was the beautiful Queen of Sparta who was seduced by Zeus when he took the form of a swan. Leda produced two eggs from the union. One egg hatched into the beautiful Helen, later to be known as Helen of Troy and over whom the Trojan War was fought. The other egg hatched into the twins Castor and Pollux. Castor and Pollux had different fathers according to the myth. Pollux was the son of Zeus and was immortal, while Castor was the son of Leda's earthly husband, and so he was a mortal. William Butler Yeats wrote a famous sonnet called 'Leda and the Swan' in 1924. Peter Paul Rubens made a copy of a painting called 'Leda and the Swan' by Michelangelo, which is now lost."
_LEVE,"ALEVE.    	Aleve is a anti-inflammatory drug, Naproxen sodium."
ESP_S,ESPYS.    	The ESPY Awards are a creation of the ESPN sports television network. One difference with similarly named awards in the entertainment industry is that ESPY winners are chosen solely based on viewer votes.
_OM,"ROM.    	CD-ROM stands for 'compact disc read only memory'. The name indicates that you can read information from the disc (like a standard music CD for example), but you cannot write to it. You can also buy a CD-RW, which stands for 'compact disc &#8211; rewritable', with which you can read data and also write over it multiple times using a suitable CD drive."
E_E,"ERE.    	George Gordon Byron, known simply as ""Lord Byron"", was an English poet active in the early 1800s. Byron was equally as famous for his poetry as he was for the wild excesses in his personal life. Byron lived much of that life outside of England, and fought for revolutionaries in both Italy and Greece. He died from a fever contracted while fighting for the Greeks against the Ottomans."
AMAT_,"AMATI.    	The first of the family to make violins was Andrea Amati, who lived in the 14th century. He was succeeded by his sons, Antonio and Girolama. In turn, they were succeeded by Girolama's son, Nicolo. Nicolo had a few students who achieved fame making musical instruments as well. One was his own son, Girolamo, and another, the infamous Antonio Stradivari."
OR_ON,"ORSON.    	Orson Welles is perhaps best-remembered in the world of film for his role in 1941's 'Citizen Kane'. In the world of radio, Welles is known for 1938's famous broadcast of 'The War of the Worlds', a broadcast that convinced many listeners that the Earth was indeed being invaded by aliens."
SCO_,"SCOT.    	The New Year's celebration in Scotland is known as Hogmanay, although the term 'Hogmanay' applies to New Year's Eve. Such is the extent of the party for Hogmanay, that New Year's Day is a public holiday across the country, and so is January 2nd."
_SB,"USB.    	Universal Serial Bus (USB) is an industry standard dealing with how computers and electronic devices connect and communicate, and deal with electrical power through those connections."
ILIA_,"ILIAD.    	'The Iliad' is an epic poem by the Greek poet Homer, which tells the story of the ten-year siege of Ilium (also known as Troy) during the Trojan war. 'The Odyssey', also attributed to Homer, is sometimes described as a sequel to 'The Iliad'."
R_M,RPM.    	Revolutions per minute (rpm)
UT_,"UTA.    	Uta Pippig is long-distance runner from Germany. Pippig became the first woman to win the Boston Marathon on three consecutive occasions, from 1994 to 1996."
QE_,"QED.    	Q.E.D. is used at the end of a mathematical proof or a philosophical argument. The acronym stands for the Latin ""quod erat demonstrandum"" meaning ""that which was to be demonstrated""."
_ECO,"DECO.    	Art Deco is the name given to a style of design and architecture of the 1920s, which actually had its roots in Belgium and then spread throughout Europe before arriving in North America. Celebrated examples of art deco architecture are the magnificent Chrysler Building in New York City completed in 1930, and the GE Building that sits in the middle of Rockefeller Center also in New York City, with the address of ""30 Rock""."
_AOS,"LAOS.    	Vientiane is the capital city of Laos, situated on the famous Mekong River. The city was originally called the ""city of sandalwood"" by Buddhist monks, naming after the valued trees that grew in the area. The French took the Pali words for ""city of sandalwood"" and rewrote it as the French-sounding ""Vientiane""."
IRAN_,"IRANI.    	The city of Hormuz in Iran sits on the coast, right beside the famed Strait of Hormuz."
A_AR,"ALAR.    	The chemical name for Alar, a plant growth regulator and color enhancer, is daminozide. Alar was primarily used on apples but was withdrawn from the market when it was linked to cancer."
EN_LA,"ENOLA.    	As we all know, the Enola Gay was the B-29 that dropped the first atomic bomb. Enola Gay was the name of the mother of pilot Col. Paul W. Tibbets, Jr."
M_ED,"MR ED.    	The sitcom ""Mister Ed"" first aired in 1961 and ran for almost five years. It was a very successful show (and even made it to Ireland!). Mister Ed, the talking horse, was a palomino that had the real name of Bamboo Harvester. Mister Ed's ""voice"" was that of actor Allan ""Rocky"" Lane, a star of a lot of B-movie westerns from the forties and fifties. In the show, Mister Ed would only talk to the lead (human) character Wilbur, played by Alan Young, leading to some hilarious situations. Mister Ed had a stunt double and stand-in for the show, another horse called Pumpkin. Pumpkin later made frequent appearances on the show ""Green Acres""."
K_ALA,"KOALA.    	The koala really does look like a little bear, but it's not even closely related. The koala is an arboreal marsupial and a herbivore, native to the east and south coasts of Australia. Koalas aren't primates, and are one of the few mammals other than primates who have fingerprints. In fact, it can be very difficult to tell human fingerprints from koala fingerprints, even under an electron microscope."
R_T,RET.    	Retired (ret.)
MRE_,"MR ED.    	""Mister Ed"" first aired in 1961 and ran for almost five years. It was a very successful show (and even made it to Ireland!). Mister Ed, the talking horse, was a palomino that had the real name of Bamboo Harvester. Mister Ed's ""voice"" was that of actor Allan ""Rocky"" Lane, a star of a lot of B-movie westerns from the forties and fifties. In the show, Mister Ed would only talk to the lead (human) character Wilbur, played by Alan Young, leading to some hilarious situations. Mister Ed had a stunt double and stand-in for the show, another horse called Pumpkin. Pumpkin later played the horse that made frequent appearances on the show ""Green Acres""."
_MO,HMO.    	Health Maintenance Organization (HMO)
D_CO,DECO.    	Miami Beach has an Art Deco Historic District that was listed on the National Register of Historic Places in 1979. The buildings in the district make up the largest collection of Art Deco architecture in the world.
_PAD,"IPAD.    	The iPad Air is Apple's 5th-generation table computer. The Air is just 7.5 mm thick, and is 22% lighter than the iPad 2."
_DESSA,"ODESSA.    	The city of Odessa in Ukraine was founded relatively recently, in 1794 by Catherine the Great. The city was originally meant to be called Odessos after an ancient Greek city believed to have been located nearby. Catherine liked the way the locals pronounced the name as ""Odessa"", so went with the less Greek sounding name."
_ET,RET.    	Retired (ret.)
ACE_,"ACER.    	I owned several Acer laptops, which are for my money the most reliable machine at the best price. Acer is a Taiwanese company that I used to visit a lot when I was in the electronics business. I was very impressed with the company's dedication to quality, and haven't been let down since."
OGE_,"OGEE.    	An ogee is a type of S-curve. Specifically it is a figure consisting of two arcs that curve in opposite directions (like an S) but both ends of the curve end up parallel to each other (which is not necessarily true for an S). An ogee arch is composed of two ogees, with one being the mirror of the other and meeting at the arch's apex."
