_AT,"GAT.    	A gat is a slang word used by ""hoods"" for a gun. It of course comes from the Gatling gun, the precursor to the machine gun. It was invented by Dr. Richard J. Gatling in 1861. Apparently he was inspired to invent the Gatling gun, so that one man could do as much damage as a hundred, thereby reducing the size of armies and diminishing the suffering caused by war. Go figure ..."
LEE_,"LEES.    	The dregs in wine, the sediment that settles during fermentation (and sometimes in the bottle), is also called ""lees""."
PA_A,"PAPA.    	Papa John's is the third largest takeout and delivery pizza chain in the US, with Pizza Hut and Domino's taking the top spots."
AEN_ID,"AENEID.    	""The Aeneid"" is Virgil's epic poem that tells of the journey of Aeneas, a Trojan who traveled to Italy to become the ancestor of all Romans."
SP_S,"SPAS.    	The word ""spa"" migrated into English from Belgium, as Spa is the name of a municipality in the east of the country that is famous for its healing hot springs. The name ""Spa"" comes from the Walloon word ""espa"" meaning ""spring, fountain""."
VE_,"VEE.    	Apparently geese fly in that V-formation for a couple of reasons. One is that it makes for efficient flight and conserves energy. The leading bird gets no advantage, but every following bird gets to ""slipstream"" a little. It has been noted that the lead bird drops to the back of the formation when he/she gets fatigued. It's also thought that the flock can stick together more easily when in formation, so it is more difficult to lose someone along the way."
_EES,"LEES.    	The dregs in wine, the sediment that settles during fermentation (and sometimes in the bottle), is also called ""lees""."
AL_A,"ALFA.    	The 'Alfa' in Alfa Romeo is actually an acronym, standing for Anonima Lombarda Fabbrica Automobili (""Lombard Automobile Factory, Public Company""). ALFA was an enterprise founded in 1909 and which was taken over by Nicola Romeo in 1915. In 1920 the company name was changed to Alfa Romeo."
I_AQ,"IRAQ.    	Many of us tend to use ""Operation Desert Storm"" as the overall name for the conflict more correctly called the Persian Gulf War. Operation Desert Storm was in fact just the air and land battle that took place between January 17th and April 11th 1991. The buildup of forces was called Operation Desert Shield, and the withdrawal of forces after the liberation of Kuwait was known as Operation Desert Farewell."
I_E,"ICE.    	I'll have that drink on the rocks, over ice."
RU_E,"RUNE.    	A rune is a character in an alphabet that is believed to have mysterious powers. In Norse mythology, the runic alphabet was said to have a divine origin."
_NES,ONES.    	The two digits in the number 11 are both ones.
NAD_,"NADA.    	""Nada"" is the Spanish word for ""nothing"". ""De nada"" translates literally from the Spanish as ""of nothing"", and is used to mean ""you're welcome"" or ""don't mention it"". The French have the same expression ""de rien"", also translating to ""of nothing"" and used the same way."
N_DA,"NADA.    	""Nada"" is the Spanish word for ""nothing"". ""De nada"" translates literally from the Spanish as ""of nothing"", and is used to mean ""you're welcome"" or ""don't mention it"". The French have the same expression ""de rien"", also translating to ""of nothing"" and used the same way."
LE_S,"LEES.    	The dregs in wine, the sediment that settles during fermentation (and sometimes in the bottle), is also called ""lees""."
RE_,REE.    	There's an old English nursery thyme that goes:
_SA,"BSA.    	As every little boy (of my era) knows, the Scouting movement was founded by Lord Baden Powell, in 1907. The Boy Scouts of America (BSA) soon followed, in 1910."
_DSEL,"EDSEL.    	The Edsel brand of automobile was named for Edsel, son of Henry Ford. Sadly, the name ""Edsel"" has become synonymous with ""failure"", which was no fault of Edsel himself who had died several years before the Edsel line was introduced. When the Ford Motor Company introduced the Edsel on 4 September 1957, Ford proclaimed the day to be 'E Day'."
DR_O,"DR NO.    	""Dr. No"" may have been the first film in the wildly successful James Bond franchise, but it was the sixth novel in the series of books penned by Ian Fleming. Fleming was inspired to write the story after reading the Fu Manchu tales by Sax Rohmer. If you've read the Rohmer books or seen the films, you'll recognize the similarities between the characters Dr. No and Fu Manchu."
BR_E,"BRIE.    	Brie is a soft cheese, named after the French province of Brie where it originated."
U_C,"UPC.    	UPC stands for Universal Price Code or Universal Product Code. The first UPC-marked item to get scanned in a store was on June 26, 1974 at 08:01 a.m. at Marsh's supermarket in Troy, Ohio. It was a 10-pack of Wrigley's Juicy Fruit chewing gum ..."
SIR_,"SIRI.    	Siri is software application that works with Apple's iOS operating system. 'Siri' is an acronym standing for Speech Interpretation and Recognition Interface. You've probably seen the ads on television, with folks talking to their iPhones asking for information and responding with a voice. I hear that Google is a little scared by Siri, as Siri is non-visual. There's no need to touch a screen or a keyboard to work with Siri, no opportunity to click on one of Google's ads! By the way, voice-over artist Susan Bennett revealed herself as the female American voice of Siri not that long ago. The British version of Siri is called Daniel, and the Australian version is called Karen. Also, 'Siri' is a Norwegian name meaning 'beautiful woman who leads you to victory', and was the name the developer had chosen for his first child."
_RON,"IRON.    	The Latin word for 'iron' is 'ferrum', which gives us 'Fe' as the metal's chemical symbol."
AMO_O,AMOCO.    	Amoco is an abbreviation for the American Oil Company. Amoco was the first oil company to introduce gasoline tanker trucks and drive through filling stations. There a few of them still around ...
IR_Q,"IRAQ.    	The most widely accepted etymology of the name ""Baghdad"" is that the name is derived from the Persian words ""bag"" (God) and ""dad"" (given)."
TE_,"TEL.    	The full name of Israel's second largest city is Tel Aviv-Yafo. Tel Aviv translates into ""Spring Mound"", a name chosen in 1910."
_AURA,"LAURA.    	Petrarch (Francesco Petrarca) was an Italian scholar and poet who lived during the Renaissance. Petrarch gave up his vocation as a priest, and soon after spotted a woman named Laura in his church in Avignon in France. He was so taken by Laura that he wrote many poems dedicated to her. He later clarified that he could not approach Laura with his feelings, as she was a married woman."
J_N,"JON.    	Lil Jon is a rapper, with the real name Jonathan Mortimer Smith. That's all I know ..."
DAN_E,"DANTE.    	Beatrice Portinari was a woman from Florence who was known as the poet Dante's muse. Dante featured two characters called Beatrice in his works (in 'Divine Comedy' and 'Paradiso'), and it is speculated that both were inspired by Portinati."
O_AGE,OSAGE.    	Much of the Osage River in Missouri is now taken up by two large reservoirs created behind two dams that provide power for St. Louis and the surrounding area. The two reservoirs are the Truman Reservoir and the Lake of the Ozarks.
_FPD,"SFPD.    	""Monk"" is a police drama set in San Francisco, starring Tony Shalhoub in the title role of Adrian Monk. Although the setting for the show is the San Francisco Bay Area, these days it is actually shot in Los Angeles. "
LIS_,"LISA.    	Lisa Simpson is Bart's brainy younger sister on TV's ""The Simpsons"". Lisa is voiced by actress Yeardley Smith."
WA_T,"WATT.    	James Watt was a Scottish inventor, a man who figured prominently in the Industrial Revolution in Britain largely due to the improvements he made to the fledgling steam engine. The SI unit of power is called the watt, named in his honor."
LEE_,"LEES.    	The dregs in wine, the sediment that settles during fermentation (and sometimes in the bottle), is also called 'lees'."
_CE,ICE.    	'Rocks' and 'ice' are slang terms for diamonds.
DE_,"DEI.    	""Agnus Dei"" is Latin for ""Lamb of God"", a term used in Christian faiths for Jesus Christ, symbolizing his role as a sacrificial offering to atone for the sins of man."
DRN_,"DR NO.    	""Dr. No"" may have been the first film in the wildly successful James Bond franchise, but it was the sixth novel in the series of books penned by Ian Fleming. Fleming was inspired to write the story after reading the Fu Manchu tales by Sax Rohmer, and if you've read the Rohmer books or seen the films, you'll recognize the similarity in the characters."
O_P,"OOP.    	French people, and circus acrobats in particular, use the phrase ""allez hop!"" as words of encouragement, sort of like our ""let's go!"". The phrase was anglicized to ""alley oop""."
C_S,"CTS.    	I assume this is the abbreviation for ""cents"" in the context of a price."
OL_N,"OLIN.    	The lovely Lena Olin is a Swedish actress, clearly someone who had acting in her blood. Her mother was the actress Britta Holmberg and her father the actor and director Stig Olin. Olin had a very successful career in Sweden, often working with the great Ingmar Bergman. Olin's breakthrough international and English-speaking role was playing opposite Daniel Day-Lewis in ""The Unbearable Lightness of Being"" released in 1988. Way back in 1974, the lovely Miss Olin was crowned Miss Scandinavia in a beauty pageant for Nordic women held in Helsinki, Finland."
AOR_A,AORTA.    	The aorta originates in the heart and extends down into the abdomen. It is the largest artery in the body.
ION_C,"IONIC.    	An Ionic column is relatively ornate. It usually has grooves running up and down its length, and at the top there is a ""scroll"" design called a ""volute"". The scroll design makes it a popular inclusion in academic buildings."
NAL_,"NALA.    	In ""The Lion King"", Nala is a lioness and the childhood friend of Simba."
STE_T,"STENT.    	In the world of medicine and surgery, a stent is an artificial tube inserted inside a vessel in the body, say a blood vessel, so that it reduces the effects of a local restriction in the body's conduit."
ALI_I,"ALIBI.    	Alibi' is the Latin word for 'elsewhere' as in, 'I claim that I was 'elsewhere' when the crime was committed ... I have an 'alibi''."
AENEI_,"AENEID.    	The Aeneid is Virgil's epic poem that tells of the journey of Aeneas, a Trojan that voyaged to Italy to become the ancestor of all Romans."
O_IE,OKIE.    	The Dust Bowl was the name given to a period in which severe dust storms ravaged the American and Canadian Prairies in the thirties. A major factor in the storms was the loss of the deep-rooted grasses native to the land that had been displaced by intensive farming. Without the grasses the topsoil was blown away in a period of drought.
ALIT_,"ALITO.    	Associate Justice Samuel Alito was nominated to the US Supreme Court by President George W. Bush. Alito is the second Italian-American to serve on the Supreme Court (Antonin Scalia was the first). Alito studied law at Yale and while in his final year he left the country for the first time in his life, heading to Italy to work on his thesis about the Italian legal system."
W_I,"WII.    	The Wii is the biggest-selling game console in the world. Two distinguishing features are the impressive wireless remote control and its WiiConnect24 system which allows the console to get messages and updates wirelessly in standby mode. I have my kids unplug the darn thing when they aren't using it, as even in standby mode it sucks up bandwidth on my wireless network here at the house."
T_OS,"TAOS.    	Taos Ski Valley is a resort village in New Mexico, founded in 1955. About twelve families live there, making up thirty or so households and a population of about 60 people. It is said to very much resemble a Swiss village, and even includes an elected village council."
MO_A,"MOMA.    	The founding of the Museum of Modern Art (MoMA) in New York City was very much driven by Abby Aldrich Rockefeller, the wife of John D. Rockefeller, son of the oil magnate. Working with two friends, Abby managed to get the museum opened in 1929, just nine days after the Wall Street Crash. The MoMA's sculpture garden bears the name of Abby Aldrich Rockefeller, and has done so since 1949."
GA_,"GAT.    	""Gat"" is a slang word used by ""hoods"" for a gun. It of course comes from the Gatling gun, the precursor to the machine gun. The Gatling gun was invented by Dr. Richard J. Gatling in 1861. Apparently he was inspired to invent it, so that one man could do as much damage as a hundred, thereby reducing the size of armies and diminishing the suffering caused by war. Go figure ..."
BE_,"BEE.    	A queen bee has a stinger, just like worker bees. When a worker bee stings, it leaves it stinger in its victim. The worker bee dies after losing its stinger as the loss rips out part of its insides. However, a queen bee can sting with impunity as the stinger's anatomy is different."
_BA,TBA.    	To Be Advised
_GA,"LGA.    	The accepted three big airports serving New York City are John F. Kennedy (JFK), LaGuardia (LGA) and Newark (EWR)."
E_IE,"ELIE.    	Elie Saab is a Lebanese fashion designer based in Beirut. He also goes by the name ""ES""."
_UR,"OUR.    	""Our Day Will Come"" was a number one hit in 1963 for Ruby & The Romantics. This was really the band's only big seller, so I guess they get filed away as ""one-hit wonders""."
AN_DE,"ANODE.    	A battery is a device that converts chemical energy into electric energy. A simple battery is made up of three parts: a cathode, an anode and a liquid electrolyte. Ions from the electrolyte react chemically with the material in the anode producing a compound and releasing electrons. At the same time, the electrolyte reacts with the material in the cathode, absorbing electrons and producing a different chemical compound. In this way, there is a buildup of electrons at the anode and a deficit of electrons at the cathode. When a connection (wire, say) is made between the cathode and anode, electrons flow through the resulting circuit from the anode to cathode in an attempt to rectify the electron imbalance."
R_ES,"RTES.    	GPS stands for Global Positioning System. The modern GPS system that we use today was built by the military who received the massive funding needed because of fears during the Cold War of the use of Intercontinental Ballistic Missiles. We civilians, all round the world, owe a lot to President Ronald Reagan because he directed the military to make GPS available to the public for the common good. He was moved to do so after the Soviet Union shot down KAL flight 007 carrying 269 people, when it accidentally strayed into Soviet airspace."
_RON,"IRON.    	There are 12 metal tokens used in Monopoly these days, including the iron. Two tokens, the battleship and the cannon (aka howitzer), were added to the Monopoly game set as part of a recycling exercise. The pieces were intended for the game ""Conflict"" released in 1940, but when Parker Bros. pulled the game off the market due to poor sales, they added their excess battleships and cannons to Monopoly."
_GE,"AGE.    	In the world of insurance, an actuary is a person who works out the appropriate premium based on risk."
AM_N,"AMEN.    	The word 'amen' is translated as 'so be it'. 'Amen' is said to be of Hebrew origin, but it is likely to be also influenced by Aramaic and Arabic."
_OATI,"COATI.    	A coati is a member of the raccoon family and is also known as the Brazilian aardvark, or the snookum bear. The coati is native to Central and South America, but can also be found in the southwest of the United States."
A_NO,"ANNO.    	Anno is the Latin for ""year""."
_AX,"SAX.    	The saxophone was invented by Belgian Adolphe Sax. Sax developed lip cancer at one point in his life, and one has to wonder if his affliction was related to his saxophone playing (I am sure not!). I had the privilege of visiting Sax's grave in the Cemetery of Montmartre in Paris a few years ago."
_IE,"PIE.    	In French, ""à la mode"" simply means ""fashionable"". In America, the term has come to describe a way of serving pie, usually with ice cream, or as I recall from when I lived in Upstate New York, with cheese."
E_OLA,"EBOLA.    	The Ebola virus causes a very nasty form of hemorrhagic fever. The name of the virus comes from the site of the first known outbreak of the disease, in a mission hospital in the Ebola River Valley in the Democratic Republic of the Congo."
IC_,ICE.    	'Frozen' is a 2013 animated feature from Walt Disney Studios that is based on the Hans Christian Andersen fairy tale 'The Snow Queen'.
IPO_,"IPOD.    	The iPod Touch is a portable media player, personal digital assistant and gaming console with a WiFi capability. Essentially I think it's a stripped-down version of an iPhone."
WI_,"WII.    	The Wii is the biggest selling game console in the world. Two distinguishing features are the impressive wireless remote control, and it WiiConnect24 system which allows the console get messages and updates wirelessly in standby mode. I have my kids unplug the darn thing when they aren't using it, as even in standby mode it sucks up bandwidth on my wireless network here at the house."
P_PA,"PAPA.    	Papa John's is the third largest takeout and delivery pizza chain in the US, with Pizza Hut and Domino's taking the top spots."
N_C,"NBC.    	Jimmy Fallon was a cast member for a number of years on 'Saturday Night Live' before getting his own talk show in 2009, 'Late Night with Jimmy Fallon'. Fallon is in the news right now as he is about to take over 'The Tonight Show' from Jay Leno."
ECL_T,"ECLAT.    	Éclat can mean a brilliant show of success, or the applause or accolade that one receives. The word derives from the French ""éclater"" meaning ""to splinter, burst out""."
R_S,"RLS.    	Robert Louis Stevenson's most celebrated work I'd say is ""Treasure Island"", originally written as a series for a children's magazine in 1881. I remember it as the first ""real"" novel I read as a youngster ..."
ARN_,"ARNE.    	A-Hunting We Will Go' is a song by Thomas Arne that the composer penned for a 1777 production of 'The Beggar's Opera'. I grew up with this song, as it is a popular nursery rhyme on the other side of the pond ..."
T_L,"TEL.    	Tel Dan is an ancient city, long abandoned, located in the very north of Israel."
A_FA,"ALFA.    	The 'Alfa' in Alfa Romeo is actually an acronym, standing for Anonima Lombarda Fabbrica Automobili (""Lombard Automobile Factory, Public Company""), an enterprise founded in 1909. The company was taken over by Nicola Romeo in 1915, and in 1920 the company name was changed to Alfa Romeo."
EL_,"ELF.    	Snap, Crackle and Pop are three elves employed as the mascots for Kellogg's Rice Krispies. The trio first appeared in an ad campaign in 1933, although the phrase ""snap, crackle and pop"" had been used for the cereal for some time in radio ads. By the way, the elves are selling ""Rice Bubbles"" in Australia, and the elves have different names in other parts of the world (like ""Cric!, Crac! and Croc! in Quebec)."
O_C,OTC.    	Over-the-counter (OTC) drugs don't need a prescription.
UNI_,"UNIT.    	The dram is a confusing unit of measurement, I think. It has one value as an ancient unit of mass, and two different values as a modern unit of mass, another value as a unit of fluid volume, and yet another varying value as a measure of Scotch whisky!"
S_RS,"SSRS.    	The former Soviet Union (USSR) was created in 1922, not long after the Russian Revolution of 1917 that overthrew the Tsar. Geographically, the new Soviet Union was roughly equivalent to the old Russian Empire, and was comprised of fifteen Soviet Socialist Republics (SSRs)."
R_ES,RTES.    	US Route 1 runs from Fort Kent in Maine right down to Key West in Florida. 
EBO_A,"EBOLA.    	The Ebola virus causes a very nasty form of hemorrhagic fever. The name of the virus comes from the site of the first known outbreak, in a mission hospital in the Ebola River Valley in the Democratic Republic of the Congo. The disease is transmitted from human to human by exposure to bodily fluids. In nature, the main carrier of Ebola is the fruit bat."
ECLA_,"ECLAT.    	'Éclat' can mean a brilliant show of success, or the applause or accolade that one receives. The word derives from the French ""éclater"" meaning ""to splinter, burst out""."
_IRI,"SIRI.    	Siri is software application that works with Apple's iOS operating system. 'Siri' is an acronym standing for Speech Interpretation and Recognition Interface. You've probably seen the ads on television, with folks talking to their iPhones asking for information and responding with a voice. I hear that Google is a little scared by Siri, as Siri is non-visual. There's no need to touch a screen or a keyboard to work with Siri, no opportunity to click on one of Google's ads! By the way, voice-over artist Susan Bennett recently revealed herself as the female American voice of Siri. The British version of Siri is called Daniel, and the Australian version is called Karen. By the way, 'Siri' is a Norwegian name meaning 'beautiful woman who leads you to victory', and was the name the developer had chosen for his first child."
TAH_E,"TAHOE.    	Lake Tahoe is up in the Sierra Nevada mountains, right on the border between California and Nevada. Lake Tahoe is the largest alpine lake in the country. It's also the second deepest lake, with only the beautiful Crater Lake in Oregon being deeper. Given its location, there are tall casinos that sit right on the shore on the Nevada side of the state line where gambling is legal."
S_C,"SAC.    	Sacrifice fly, in baseball ..."
MOM_,"MOMA.    	The founding of the Museum of Modern Art (MoMA) in New York City was very much driven by Abby Aldrich Rockefeller, the wife of John D. Rockefeller, son of the oil magnate. Working with two friends, she managed to get the museum opened in 1929, just nine days after the Wall Street Crash. The MoMA's sculpture garden bears the name of Abby Aldrich Rockefeller, and has done so since 1949."
LI_O,"LIMO.    	The word ""limousine"" actually derives from the French city of Limoges. The area around Limoges is called the Limousin, and it gave its name to a cloak hood worn by local shepherds. In early motor cars, a driver would sit outside in the weather, while the passengers would sit in the covered compartment. The driver would often wear a limousin-style protective hood, giving raise to that type of transportation being called a ""limousine"". Well, that's how the story goes anyway ..."
_ATE,"TATE.    	""The Tate"" is actually made now made up of four separate galleries in England. The original Tate gallery was founded by Sir Henry Tate as the National Gallery of British Art. It is located on Millbank in London, on the site of the old Millbank Prison, and is now called Tate Britain. There is also the Tate Liverpool in the north of England located in an old warehouse, and the Tate St. Ives in the west country located in an old gas works. My favorite of the Tate galleries is the Tate Modern which lies on the banks of the Thames in London. It's a beautiful building, a converted power station, that you have to see to believe."
A_NO,"ANNO.    	The designations Anno Domini (AD, ""year of Our Lord"") and Before Christ (BC) are found in the Julian and Gregorian calendars. The dividing point between AD and BC is the year of the conception of Jesus, with AD 1 following 1 BC, without a year ""0"" in between. The AD/BC scheme dates back to AD 525, and gained wide acceptance soon after AD 800. Nowadays, a modified version has become popular, with CE (Common/Christian Era) used to replace AD, and BCE (Before the Common/Christian Era) replacing BC."
_AO,"YAO.    	Yao Ming is a retired professional basketball player from Shanghai who played for the Houston Rockets. At 7'6"", Yao was the tallest man playing in the NBA."
AG_RA,"AGORA.    	In early Greece the ""agora"" was a place of assembly. Often the assemblies held there were quite formal, perhaps for the reading of a proclamation. Later in Greek history, things became less formal as the agora evolved into a market place. Our contemporary word ""agoraphobia"" comes from these agorae, in the sense that an agoraphobe has a fear of open spaces, a fear of ""public meeting places""."
O_EG,"OLEG.    	Oleg Cassini, the French-born American fashion designer has had two big names particularly associated with his designs. In the sixties he designed the state wardrobe for First Lady Jacqueline Kennedy. He was also the exclusive designer for Hollywood's Gene Tierney, Cassini's second wife."
A_IME,ANIME.    	Anime is cartoon animation in the style of Japanese Manga comic books.
ALF_,"ALFA.    	The 'Alfa' in Alfa Romeo is actually an acronym, standing for Anonima Lombarda Fabbrica Automobili (""Lombard Automobile Factory, Public Company""). ALFA was an enterprise founded in 1909 and which was taken over by Nicola Romeo in 1915. In 1920 the company name was changed to Alfa Romeo."
DI_A,"DIVA.    	The term 'diva' comes to us from Latin via Italian. ""Diva"" is the feminine form of ""divus"" meaning ""divine one"". The word is used in Italy to mean ""goddess"" or ""fine lady"", and especially is applied to the prima donna in an opera. We often use the term to describe a singer with a big ego."
AM_N,"AMEN.    	The word 'amen' is translated as 'so be it'. 'Amen' is said to be of Hebrew origin, but it is likely to be also influenced by Aramaic and Arabic."
