PES_S,"PESOS.    	The coin called a 'peso' is used in many Spanish-speaking countries around the world. The coin originated in Spain where the word 'peso' means 'weight'. The original peso was what we know in English as a 'piece of eight', a silver coin of a specific weight that had a nominal value of eight 'reales'."
_LENI,"ELENI.    	Nicholas Gage is a Greek-American author and investigative journalist. Gage wrote two memoirs, ""Eleni"" and ""A Place for Us"". ""Eleni"" tells of his life in Greece during WWII and the Greek Civil War. The title is a tribute to his mother Eleni who was executed by Communists who occupied her village, simply because she helped her children escape from the ravages of a war of occupation. ""Eleni"" was adapted into a movie in 1985, with John Malkovich playing Gage."
N_S,"NTS.    	Windows XP, Windows Vista and Windows 7, 8 and 10; they're all based on the Windows NT operating system. There is a common perception that Windows NT (WNT) takes its name from VMS, an earlier operating system developed by Digital Equipment Corporation. ""WNT"" is what's called a ""Caesar cypher"" of ""VMS"", as you just augment the letters of VMS alphabetically by one to arrive at WNT. Bill Gates disputes this derivation of the name, and in a 1998 interview stated that the NT originally stood for N-Ten and that the marketing folks at Microsoft revised history by changing it to ""New Technology""."
O_IOS,"OLIOS.    	Olio is a term meaning a hodgepodge or a mixture, coming from the mixed stew of the same name. The stew in turn takes its name from the Spanish ""olla"", the clay pot used for cooking."
_AAR,"PAAR.    	Jack Paar was most famous as the host of 'The Tonight Show', from 1957 to 1962. When he died in 2004, 'Time' magazine wrote that Paar was 'the fellow who split talk show history into two eras: Before Paar and Below Paar'. Very complimentary ..."
ANACI_,"ANACIN.    	Anacin is a pain reliever, with the active ingredients of aspirin and caffeine."
DEK_,"DEKE.    	A deke, also known as a dangle, is a technique used to get past an opponent. ""Deke"" is a colloquial shortening of the word ""decoy""."
G_SSO,"GESSO.    	Gesso is the Italian word for ""chalk"" and gives its name to the powdered calcium carbonate that is used as a primer coat under artistic panel paintings. The gesso is mixed with a glue and applied to wood so that it acts as an absorbent surface for paint."
ARKI_,"ARKIN.    	The actor Alan Arkin won his only Oscar (Best Supporting Actor) for his role in ""Little Miss Sunshine"" from 2006, a movie I just did not understand ..."
TAM_LE,"TAMALE.    	A tamale is a traditional dish from Central America composed of a starchy dough that is steamed or boiled in a wrapper made of leaves. The dough is called masa, and can include many different ingredients including meat, cheese fruit and vegetables."
_THOS,"ATHOS.    	The ""Three Musketeers"" were Athos, Porthos and Aramis, and their young protégé was D'Artagnan. A musketeer was an infantry soldier who was equipped with a musket. Funnily enough, Alexandre Dumas' ""Three Musketeers"" really didn't use their muskets, and were better known for their prowess with their swords."
APP_E,"APPLE.    	Apple Computers was founded in 1976 by Steve Jobs, Steve Wozniak and Ronald Wayne. The company incorporated the following year, but without Wayne. He sold his share of the company back to Jobs and Wozniak, for $800 ..."
R_MAN,"ROMAN.    	Cicero was a very influential senator in Ancient Rome, in part due to his renowned ability to deliver a persuasive speech."
D_NHO,"DON HO.    	Don Ho apparently had a pretty liberal arrangement with his wife. When he was touring with his two backing singers Pattie Swallie and Elizabeth Gevara, all three of them shared a room together. He had two children with each of his roommates, giving a total of ten kids including the six he had with his wife. The arrangement was quite open, it seems, with all ten kids visiting each other regularly. To each his own ..."
DI_E,"DICE.    	If one considers earlier versions of craps, then the game has been around for a very long time and probably dates back to the Crusades. Craps may be derived from an old English game called ""hazard"", also played with two dice and which was mentioned in Geoffrey Chaucer's ""Canterbury Tales"" from the 1300s. The American version of the game came here courtesy of the French and first set root in New Orleans where it was given the name ""crapaud"", a French word meaning ""toad""."
PANA_,"PAN AM.    	The Pan American Games are held every four years, the year just before the Summer Olympic Games. The participating athletes all come from the Americas."
_HETT,"RHETT.    	Rhett Butler woos Scarlett O'Hara at the Tara plantation in Margaret Mitchell's ""Gone with the Wind"". Tara was founded by Scarlett's father, Irish immigrant Gerald O'Hara. Gerald named his new abode after the Hill of Tara back in his home country, the ancient seat of the High King of Ireland. Rhett's rival for the affections of Scarlet is Ashley Wilkes who lives at the nearby Twelve Oaks plantation."
AMERI_A,"AMERICA.    	'America is another name for Opportunity' is a quotation from 'American Civilization', an essay by Ralph Waldo Emerson."
CA_,"CAY.    	A ""key"" (also ""cay"") is a low island offshore, as in the Florida Keys. Our term in English comes from the Spanish ""cayo"" meaning ""shoal, reef""."
PE_ER,"PETER.    	Peter, Peter Pumpkin Eater' is a nursery rhyme that has been around in the US at least since the early 1800s. It is possibly derived from an older English rhyme, but pumpkins certainly weren't in the English version."
BETT_,"BETTE.    	What Ever Happened to Baby Jane?"" is a 1960 novel by Henry Farrell about two aging sisters called Jane and Blanche Hudson. Famously, the film was adapted for the big screen in 1962, with Bette Davis and Joan Crawford playing Jane and Blanche respectively. Bette Davis scares me, especially in this film, so I have never watched the whole thing ..."
T_NGA,"TONGA.    	The Kingdom of Tonga is made up of 176 islands in the South Pacific, 52 of which are inhabited, scattered over an area of 270,000 square miles."
RI_,"RIN.    	The original Rin Tin Tin was an actual dog, a puppy found by a GI in a a bombed-out kennel in France during WWI. The soldier named the pup Rin Tin Tin, the same name as a puppet given to American soldiers for luck. On returning to the US, ""Rinty"", was trained by his owner, and was spotted doing tricks by a film producer. Rinty featured in some films, eventually getting his first starring role in 1923 in the silent movie ""Where the North Begins"". Legend has it that this first Rin Tin Tin died in the arms of actress Jean Harlow. Not a bad way to go ..."
LO_ITA,"LOLITA.    	Vladimir Nabokov's novel ""Lolita"" has a famously controversial storyline, dealing with a middle-aged man's obsession and sexual relationship with a 12-year-old girl. Although ""Lolita"" is considered a classic today, after Nabokov finished it in 1953 the edgy subject matter made it impossible for him to find a publisher in the US (where Nabokov lived). In 1955, he resorted to publishing it in English at a printing house in Paris. Publication was followed by bans and seizures all over Europe. A US printing house finally took on the project in 1958, by which time the title had such a reputation that it sold exceptionally quickly. ""Lolita"" became the first book since ""Gone with the Wind"" to sell over 100,000 copies in its first three weeks in stores."
_ICE,"DICE.    	As we all know, the numbers on dice are arranged so that the opposite faces add up to seven. Given this arrangement, the numbers 1, 2 and 3 all meet at a common vertex. Now, there are two ways of arranging the 1, 2 and 3 around the common vertex, a so called right-handed die (clockwise 1-2-3) or a left-handed die (counterclockwise 1-2-3). Traditionally, dice used in Western cultures are right-handed, whereas Chinese dice are left-handed. Quite interesting ..."
I_S,"IDS.    	The Transportation Security Administration (TSA) was of course created in 2001, soon after the 9/11 attacks."
H_LLE,"HALLE.    	The beautiful and talented actress Halle Berry was the first African American woman to win a Best Actress Oscar, which she received for her performance in the 2001 movie ""Monster's Ball"". Berry also won a Golden Raspberry Award for Worst Actress in 2005 for playing the title role in ""Catwoman"", and she very graciously accepted that award in person. Good for her!"
_LMS,"ELMS.    	""Desire Under the Elms"" is a classic American play written by Eugene O'Neill and published in 1924. It is basically a retelling of a Greek tragedy, but set in contemporary New England. Sophia Loren stars in a movie version released in 1958."
ATR_,"ATRI.    	Henry Wadsworth Longfellow wrote ""The Sicilian's Tale; The Bell of Atri"", a narrative poem set in the small town of Atri in the Abruzzo region of Italy."
MA_X,"MARX.    	Groucho Marx's real name was Julius Henry Marx. By the time Groucho started his successful, post-Hollywood career hosting the quiz show ""You Bet Your Life"", he was sporting a real mustache. For all his movies, his mustache had been painted on with greasepaint."
ACID_,"ACIDS.    	Saturated fats differ from unsaturated fats chemically in that saturated fats have chains of fatty acids that are relatively straight, allowing individual molecules to pack closely together. This close packing largely explains why saturated fats are solid at room temperature. Unsaturated fatty acids on the other hand have ""kinks"" in the chains of their fatty acids, so that they cannot pack together closely. Unsaturated fats are generally liquid at room temperature. Food manufacturers have learned that humans get sick by consuming saturated fats (i.e. fats from animal sources). So, they market ""healthy"" vegetable fats (naturally unsaturated and liquid at room temperature) that they have magically transformed in solid fats (like vegetable spreads). All they did was saturate the healthy fats, so that now it solidifies at room temperature, and in your arteries. There should be a law ..."
CAA_,"CAAN.    	The 1990 film 'Misery' is an adaptation of the Stephen King novel of the same name. I think it's the only movie of a King book that I've watched and enjoyed. I can't stomach his books, not because of the writing, but because of the gruesome scenes that are part of the plots. The screen version of 'Misery' is toned down a little from the original storyline. In the novel, the Kathy Bates character amputates the James Caan character's foot to incapacitate him. In the movie she just smashes his ankles. Big difference ..."
_RYSTS,"TRYSTS.    	In its most general sense, a tryst is a meeting at an agreed time and place. More usually it is associated with a prearranged meeting between lovers. The term comes from the Old French 'triste', a waiting place designated when hunting."
OR_,"ORT.    	Orts are small scraps of food left after a meal. 'Ort' comes from Middle English, and originally described scraps left by animals."
BOH_,"BOHR.    	Niels Bohr was a Danish physicist, who won his 1922 Nobel Prize for his work on quantum mechanics and atomic structure. Later in his life, he was part of the team working on the Manhattan Project, developing the first atomic bomb."
_RK,"ORK.    	""Mork & Mindy"" was broadcast from 1978 to 1982. We were first introduced to Mork (played by Robin Williams, of course) in a special episode of ""Happy Days"". The particular episode in question has a bizarre storyline culminating in Fonzie and Mork having a thumb-to-finger duel. Eventually Richie wakes up in bed, and alien Mork was just part of a dream! Oh, and ""Nanu Nanu"" means both ""hello"" and ""goodbye"" back on the planet Ork. ""I am Mork from Ork, Nanu Nanu"". Great stuff ..."
_YNOD,"SYNOD.    	The word synod comes from the Greek for assembly, or meeting. A synod is a church council, usually in the Christian faith."
RI_,RIM.    	That would be in basketball.
PO_OY,"PO' BOY.    	A po' boy is a submarine sandwich from Louisiana. There are a lot of theories about where the name came from, and none sound too convincing to me. A po' boy differs from a regular submarine sandwich in that it uses Louisiana French bread, which is soft in the middle and crusty on the outside."
T_TRA,"TETRA.    	The neon tetra is a freshwater fish, native to parts of South America. It is a very popular aquarium fish, and millions are imported into the US every year. Almost all of the imported tetras are farm-raised in Asia, and very few come from their native continent."
ELPA_O,"EL PASO.    	The Sun Bowl is an annual college football game played in El Paso. The Rose Bowl is the oldest of the bowl games, but the Sun Bowl, Sugar Bowl and Orange Bowl come in second. The first Sun Bowl was played on New Year's Day 1935. To be fair to the sponsors, the full name today is the Brut Sun Bowl ..."
BOSS_,"BOSSA.    	Bossa Nova is style of music from Brazil that evolved from samba. The most famous piece of bossa nova is the song ""The Girl from Ipanema""."
_UCRE,"LUCRE.    	Dough, lucre: slang terms for money."
WI_,WIE.    	Michelle Wie is an American golfer on the LPGA Tour. Wie began playing golf at the age of four and was the youngest player ever to qualify for an LPGA tour event. She turned pro just before her 16th birthday ...
T_SSA,"TESSA.    	""The Gondoliers"" is a delightful operetta by Gilbert & Sullivan, first performed in 1889 at the Savoy Theatre in London. Tessa is a maiden selected as a bride in a ""line up"" by one of the gondoliers. I last saw ""The Gondoliers"" decades ago, an amateur production in the small town where I was living at the time in Ireland. Good fun!"
E_INA,"EDINA.    	Edina, Minnesota lies just southwest of Minneapolis. The town takes its name from Edinburgh, the capital city of Scotland. It was suggested by a Scottish mill owner at the time a new village was being set up in 1888."
LO_RE,"LOIRE.    	The Loire River is so long that it drains a full one-fifth of France's land mass. It rises in the southeast, in the Cevennes mountain range, then it heads north and then due east, emptying into the Bay of Biscay at the city of Nantes."
DAN_,"DANE.    	The full title of William Shakespeare's play that we tend to call 'Hamlet' is 'The Tragedy of Hamlet, Prince of Denmark'. It is the most performed of all Shakespeare's plays and it is also his longest, the only one of his works comprising over 4,000 lines. That's about a 4-hour sitting in a theater ..."
PA_AM,"PAN AM.    	The Pan American Games are held every four years, the year just before the Summer Olympic Games. The participating athletes all come from the Americas."
GR_F,"GRAF.    	Steffi Graf is a former World No. 1 professional tennis player from Germany, and winner of 22 Grand Slam singles titles, more than any other man or woman other than Margaret Court. She is married to another former World No. 1, Andre Agassi."
NAI_,"NAIR.    	Nair is a hair removal product that has some pretty harsh ingredients. The most important active constituents are calcium hydroxide (""slake lime"") and sodium hydroxide (""caustic soda""). The balance of Nair's makeup seem to be there to soothe the skin after the harsher chemicals have done their job. The name ""Nair"" probably comes from combining ""no"" and ""hair""."
_ITAN,"TITAN.    	Titan is the largest moon of Saturn. Titan is unusual in many ways, including the fact that it is the only known satellite in the solar system that is has its own atmosphere (our own moon does not, for example). Titan is the second largest moon in the solar system, after Ganymede that orbits Jupiter. Titan is so large that it has a greater volume than Mercury, the solar system's smallest planet."
O_TOPI,"OCTOPI.    	The name 'octopus' comes from the Greek for 'eight-footed'. The most common plural used is 'octopuses', although the Greek plural form 'octopodes' is also quite correct. The plural 'octopi' isn't really correct as the inference is that 'octopus' is like a second-declension Latin noun, which it isn't. That said, dictionaries are now citing 'octopi' as an acceptable plural."
_DE,EDE.    	Ede is a small town in the Netherlands located between the cities of Arnhem and Utrecht.
B_YN,"BRYN.    	I used to live not far from Bryn-mawr (also Brynmwar) in Wales, the town with the highest elevation in the country. Appropriately enough, bryn mawr is Welsh for ""big hill"". There is also a Bryn Mawr in Pennsylvania (note the different capitalization), named after its Welsh counterpart. At the Pennsylvania location there's a Brynn Mawr college, a private women's school that was the first American university to offer graduate degrees to women."
_OM,"DOM.    	Dom Pérignon is the name given to the prestige label of champagne from Moët et Chandon, the French winery. The label's name honors the Benedictine monk, Dom Pérignon, who helped to improve the quality and production of champagne in the early 18th century. Although Dom Pérignon made major contributions to the production of champagne, many of the stories in which he figures are just myths. He did not ""invent"" champagne, nor sparkling wine in general. Nor did he say the famous words, ""Come quickly, I am drinking the stars!"". That lovely line first appeared in a print advertisement in the late 1800s!"
H_H,HRH.    	His or Her Royal Highness.
ADO_E,"ADOBE.    	Adobe has been around a long time, and has been used in dry climates all over the world. The original form of the word ""adobe"" dates back to Middle Egyptian times, about 2000 BC. The original ""spelling"" is dj-b-t, and translates as mud (sun-dried) brick."
SWA_,SWAT.    	One might swat at a fly that's annoyingly buzzing around.
_AY,"CAY.    	A key is a low island offshore (as in the Florida Keys), also known as a cay. Our term in English comes from the Spanish ""cayo"" meaning ""shoal, reef""."
MOT_,"MOTO.    	The mysterious Mr. Moto is a Japanese secret agent who appears in six novels by American author, John P. Marquand. In the movies, Mr. Moto was famously played by Peter Lorre in a series of eight films from the 1930s."
R_F,"REF.    	The Detroit Lions are the NFL team that plays home games at Ford Field in Detroit, Michigan. The team was founded way back in 1929 as the Portsmouth Spartans from Portsmouth, Ohio. The Spartans joined the NFL during the Great Depression as other franchises collapsed. However, the Spartans couldn't command a large enough gate in Portsmouth so the team was sold and relocated to Detroit in 1934."
PA_,"PAS.    	The term ""faux pas"" is French in origin, and translates literally as ""false step"" (or ""false steps"", as the plural has the same spelling in French)."
_ERAPE,"SERAPE.    	Serape is the English pronunciation and spelling of the Spanish word ""zarape"". A zarape is like a Mexican poncho, a soft woolen blanket with a whole in the middle for the head. Most have colorful designs that use traditional Mayan motifs."
BAE_,"BAEZ.    	Love Is Just a Four-Letter Word"" is a song written by Bob Dylan that was most famously recorded by Joan Baez. Apparently, when Dylan first heard Baez singing her recording on the radio he remarked, 'Hey, that's a great song!' He had forgotten that he was the composer!"
E_Q,"ESQ.    	The title ""esquire"" is of British origin, and is used differently today depending on whether one is in the US or the UK. Here in America, the term is usually reserved for those practicing the law (both male and female). In the UK it is a term of gentle respect, reserved for a male who has no other title that one can use. So, a mere commoner like me might receive a letter from the bank say, addressed to W. E. Butler Esq."
R_TI,"ROTI.    	In an Indian restaurant, naan bread is very popular. Roti is the unleavened cousin to naan."
R_F,"RAF.    	The Royal Air Force (RAF) is the oldest independent air force in the world (i.e. the first air force to become independent of army or navy forces). The RAF was formed during WWI on 1 April 1918, a composite of two earlier forces, the Royal Flying Corps (part of the Army) and the Royal Naval Air Service. The RAF's ""finest hour"" has to be the Battle of Britain when the vastly outnumbered British fighters fought off the might of the Luftwaffe causing Hitler to delay his plan to cross the English Channel. This outcome prompted Winston Churchill to utter the memorable words:"
STPET_R,"ST PETER.    	In the Christian tradition, Saint Peter is often depicted as the keeper of the gates of heaven. This depiction arises from a passage in the Gospel of Matthew:"
_RID,"ARID.    	The less than successful 1984 movie ""Dune"" (directed by David Lynch) was an adaptation of the spectacularly successful 1965 novel of the same name written by Frank Herbert."
ANN_,"ANNI.    	Anno (plural 'anni') is the Latin for ""year""."
O_TERS,"OATERS.    	The term ""oater"", used for a western movie, comes from the number of horses seen, and horses love oats!"
EATM_,"EAT ME.    	In Lewis Carroll's ""Alice's Adventures in Wonderland"", Alice follows the white rabbit down a rabbit hole and finds a bottle labelled ""DRINK ME"". When she drinks the contents, it causes her to shrink. She also sees a cake adorned with the words ""EAT ME"", and when she does so she grows so big she finds it hard to stand up. After eating the cake, she says the famous words, ""Curiouser and curiouser""."
T_IX,"TRIX.    	Trix is a corn-based breakfast cereal that has been around since 1954, produced by General Mills. Ads for the cereal featured Trix Rabbit, who would try hard to get hold of bowls of the cereal. He would always get caught though, and be admonished with, ""Silly rabbit, Trix are for kids!"" With 46% sugar content, the rabbit probably wouldn't have liked it anyway ..."
_RC,"NRC.    	The Atomic Energy Commission (AEC) was set up right after WWII in 1946, with the aim of promoting the peaceful use of atomic energy. Establishing the AEC was a significant move made by President Truman, as it passed control of atomic energy from the military to the civilian sector. The AEC continued to operate until 1974 when its functions were divided up into two new agencies: the Energy Research and Development Administration and the Nuclear Regulatory Commission (NRC)."
ONTA_IO,"ONTARIO.    	The great northern loon is the provincial bird of Ontario, and the state bird of Minnesota. The loon also once appeared on Canadian $20 bills. It also appears on the Canadian one dollar coin, giving the coin the nickname ""the Loonie""."
_DI,"SDI.    	One of the positive things about President Reagan's Strategic Defense Initiative, was that the US posture changed to using missiles to destroy incoming hostile weapons, from using missiles to destroy the nation attacking the country. The former doctrine of Mutually Assured Destruction went by the apt acronym of MAD ..."
ES_ANA,ESPANA.    	Santa Claus in Spain (España) is Father Christmas (Papá Noel).
NO_A,"NOLA.    	The city of New Orleans, Louisiana has the nickname ""The Big Easy"". This name might come from the early 1900s when musicians found it relatively ""easy"" to find work there. The city is also known by the acronym NOLA, standing for New Orleans, LA."
O_AN,"O-LAN.    	Pearl S. Buck's novel ""The Good Earth"" won a Pulitzer in 1932, and helped Buck win the Nobel Prize for literature a few years later. The story tells of life in a Chinese village, and follows the fortunes of Wang Lung and his wife O-Lan. Although ""The Good Earth"" has been around for decades, it hit the bestseller list again in 2004 when it was a pick for Oprah's Book Club."
_WAN,"EWAN.    	Ewan McGregor is a very talented Scottish actor, one who got his break in the 1996 film ""Trainspotting"". McGregor's first big Hollywood role was playing the young Obi-Wan-Kenobi in the ""Star Wars"" prequels. Less known is his televised marathon motorcycle journey from London to New York via central Europe, Ukraine, Siberia, Mongolia and Canada. The 2004 trip was shown as ""Long Way Round"" on TV. McGregor did a similar trip in 2007 called ""Long Way Down"", which took him and the same travelling companion from the north of Scotland to Cape Town in South Africa."
BEB_,"BEBE.    	In Spanish, a 'madre's' (mother's) treasure is her 'bebe' (baby)."
OV_,"OVO.    	A lacto-ovo vegetarian is someone who does not consume meat or fish, but does eat eggs (ovo) and dairy (lacto) products."
AAN_E,"A AND E.    	'Duck Dynasty' is a reality television show on the A&E cable channel. The show is centered on the Robertson family from Monroe, Louisiana who made a lot of money selling products to duck hunters. Phil Robertson was in the news awhile back for views he expressed on homeosexuality and other subjects in an interview with 'GQ' magazine."
SDA_,"S DAK.    	The state of South Dakota is bisected north to south by the Missouri River. One half of the state is known as East River and the other West River, and each has a contrasting history and geography. Most of the state's residents live east of the river, having settled in that part of South Dakota known for its fertile soil. As a result, East river's economy has historically been associated with agriculture, and the farming of corn and wheat. West River's economy has been dependent on ranching and mining."
_OE,"FOE.    	Before WWII, Hungary's prime minister was lobbying for an alliance between Germany, Hungary and Italy, and worked towards such a relationship that he called an ""axis"". The main Axis powers during the war of course, were Germany, Italy and Japan. However, also included in the relationship were Romania, Bulgaria and the aforementioned Hungary."
