NI_E,"NIKE.    	I remember seeing Carolyn Davidson on the television show ""I've Got a Secret"". Davidson created the Nike ""swoosh"" back in 1971 when she was a design student at Portland State. She came up with the design as freelance work for Blue Ribbon Sports (BRS), a local company introducing a new line of athletic footwear. The ""swoosh"" is taken from the wing of the Greek goddess of victory, Nike. Years later, BRS changed its name to Nike, so I suppose the company can be grateful to Carolyn for both the great design, and a great company name."
_GLOO,"IGLOO.    	The Inuit word for ""house"" is ""iglu"", which we usually write as ""igloo"". The Greenlandic (yes, that's a language) word for ""house"" is very similar: ""igdlo""."
RL_,"RLS.    	Robert Louis Stevenson's (RLS) most celebrated work I'd say is ""Treasure Island"", originally written as a series for a children's magazine in 1881. I remember ""Treasure Island"" as the first ""real"" novel I read as a youngster ..."
TIN_,"TINO.    	Tino Martinez has retired from Major League Baseball. Martinez played first base for a number of teams including the Mariners, Yankees, Cardinals and Devil Rays. Martinez was born and raised in Tampa, Florida and as a boy he worked in his father's cigar factory."
AS_S,ASPS.    	The venomous snake called an asp was a symbol of royalty in Ancient Egypt.
_LEG,"OLEG.    	Oleg Cassini, the French-born American fashion designer, had two big names particularly associated with his designs. In the sixties he produced the state wardrobe for First Lady Jacqueline Kennedy, and he was also the exclusive designer for Hollywood's Gene Tierney, who was Cassini's second wife."
VE_,VEE.    	V (vee) is the first letter of 'Victorian'.
ASS_SI,ASSISI.    	The Italian town of Assisi is famous as the birthplace of St. Francis and as the home to the Franciscan religious order. It was also the home to Saint Clare and her order of the Poor Sisters (later known as the Poor Clares).
RO_,ROY.    	Arundhati Roy is an Indian author best-known for her novel 'The God of Small Things' published in 1997.
LA_,"LAI.    	Zhou Enlai (also Chou En-Lai) was the first government leader of the People's Republic of China and held the office of Premier from 1949 until he died in 1976. He ran the government for Communist Party Leader Mao Zedong, often striking a more conciliatory tone with the West than that of his boss. He was instrumental, for example, in setting up President Nixon's famous visit to China in 1972. Zhou Enlai died just a few months before Mao Zedong, leading to unrest and a dramatic change in political direction for the country."
ALIT_,"ALITO.    	Associate Justice Samuel Alito was nominated to the US Supreme Court by President George W. Bush. Alito is the second Italian-American to serve on the Supreme Court (Antonin Scalia was the first). Alito studied law at Yale and while in his final year he left the country for the first time in his life, heading to Italy to work on his thesis about the Italian legal system."
N_KE,"NIKE.    	Nike was the Greek goddess of victory, often referred to as the Winged Goddess of Victory. The athletic shoe company Nike uses the 'Nike swoosh' as its logo, which is based on the goddess's wing."
N_M,NAM.    	Vietnam ('Nam')
DA_A,"DANA.    	Dana Carvey, along with the likes of Phil Hartman and Kevin Nealon, was part of the new breed of ""Saturday Night Live"" comedians accredited with resurrecting the show in the late eighties. One of Carvey's most popular characters was the Church Lady, and he became so associated with her that among fellow cast members Carvey was often referred to simply as ""the Lady"". Carvey had open-heart surgery in 1997 to clear a blocked artery, but the surgical team operated on the wrong artery. To recover, he had to have five more procedures so ended up suing for medical malpractice. Carvey donated the $7.5 million compensation payment to charity."
A_TA,AFTA.    	Afta is an aftershave in the Mennen range of products that is owned by Colgate-Palmolive.
_LS,"RLS.    	Robert Louis Stevenson was a Scottish author, famous for his novels 'Treasure Island', 'Kidnapped' and 'The Strange Case of Dr Jekyll and Mr Hyde'."
M_T,"MIT.    	The Massachusetts Institute of Technology moved into its magnificent mile-long campus on the Cambridge side of the Charles River in 1906. The campus was built largely with funds donated by George Eastman, the founder of the Eastman Kodak Company."
E_US,"EMUS.    	Emu eggs are very large, with a thick shell that is dark-green in color. One emu egg weighs about the same as a dozen chicken eggs. It's the males that incubate the eggs, a process that takes about eight weeks. During that time, the father hardly eats or drinks anything and loses quite a lot of weight."
D_I,DEI.    	'Deus' (plural 'dei') is Latin for 'god'.
_NTO,UNTO.    	From the Gospel of Matthew:
T_AL,"TEAL.    	The beautiful color of teal takes it name from the duck called a ""teal"", which has dark greenish-blue (teal) markings on its head and wings."
M_GI,"MAGI.    	""Magi"" is the plural of the Latin word ""magus"", a term applied to someone who was able to read the stars. Hence, magi is commonly used with reference to the ""wise men from the East"" who followed the star and visited Jesus soon after he was born."
HE_,"HEF.    	Hugh Hefner is from Chicago. His first job was in the military, where he worked as a writer for an Army newspaper (from 1944-46). He went to college after his military service, and then worked as a copywriter for ""Esquire"" magazine. He left ""Esquire"" to found his own magazine, ""Playboy"", which was first published in 1953. It has been around ever since."
_ES,"WES.    	Fantastic Mr Fox' is a children's novel by Roald Dahl. ""Fantastic Mr Fox"" was adapted into a 2006 animated film directed by Wes Anderson."
JO_,"JOE.    	It seems that no one really knows why we refer to coffee as ""joe"", but we've been doing so since early in WWII."
S_Y,"SPY.    	""The Bourne Identity"" is a great spy novel written by Robert Ludlum, first published in 1980. It has been ranked as the second best spy novel of all time, just behind the even more enjoyable ""The Spy Who Came in from the Cold"" by John le Carre. Ludlum wrote two sequels, and all three parts of ""The Bourne Trilogy"" have been made into very successful movies starring Matt Damon in the title role. Ludlum died before he could write more than three novels featuring Jason Bourne, but five more titles in the series have been published, written by Eric Van Lustbader. I must check them out ..."
H_TP,"HTTP.    	""http"" are the first letters in most Internet links. 'http' stands for HyperText Transfer Protocol."
NOL_,"NOLO.    	""Nolo contendere"" is a legal term that translates from Latin as ""I do not wish to contend"". It's the plea of ""no contest"" and is an alternative to ""guilty"" or ""not guilty"", meaning that one doesn't admit guilt but nor does one dispute the charge."
NOL_,"NOLO.    	""Nolo contendere"" is a legal term that translates from Latin as ""I do not wish to contend"". It's the plea of ""no contest"" and is an alternative to ""guilty"" or ""not guilty"", meaning that one doesn't admit guilt but nor does one dispute the charge."
CA_I,CALI.    	Frisco' is not a term you'd hear used in the San Francisco Bay Area for our main city. Acceptable nicknames are 'the City by the Bay' and 'Fog City'. We usually just refer to it as 'the City'.
M_MA,MAMA.    	(30. See 13-Down : CASS)
I_AL,"ITAL.    	Italic type leans to the right. The style is known as ""italic"" because the stylized calligraphic form of writing originated in Italy, probably in the Vatican."
M_NSA,"MENSA.    	If you ever learned Latin, you'll know that ""mensa"" is one of the first words you come across, the word used as an example of a first declension noun. Mensa means ""table"". The Mensa organization, for folks with high IQs, was set up in Oxford in England, back in 1946. To become a member, you have to score to be in the top 2% of the population's IQ. The IQ score needed depends on the test you use. For the Stanford-Binet test, that's an IQ of 132 or better; for the Cattell test it is 148 or better."
E_NUI,"ENNUI.    	Ennui is the French word for boredom, that we now readily use in English. It's one of the few French words we've imported that we haven't anglicized and actually pronounce ""correctly""."
_DIA,"ADIA.    	Based on what I just read, the song ""Adia"", co-written by McLachen, was written as an apology to her best friend ... for stealing her ex-boyfriend, and then marrying him!"
_AL,"TAL.    	Mikhail Tal was truly a chess legend. He holds the record for the longest unbeaten streak in competition chess. And the second longest winning streak, that was by Tal as well."
P_SO,PESO.    	'Cheddar' is a slang term for 'money'.
AN_IE,"ANNIE.    	Maybe 'Maybe' isn't the best-known of all the songs in the musical 'Annie', but it is the one that is sung most often during the show. 'Maybe' opens the first act and is reprised at the end of the same act. It is reprised again at the opening of the second act, and once more near the end of the show. The big hit from 'Annie' is 'Tomorrow'."
GER_,"GERE.    	The 1993 romantic drama ""Sommersby"" stars Richard Gere and Jodie Foster. It's all about an imposter who returns after the Civil War and moves in with a woman while claiming to be her husband. The real husband returns, and things get very rancorous. I know it sounds implausible, but the storyline is based on true events that took place in France in the 1500s."
OPU_,"OPUS.    	The Latin for work is 'opus', with the plural being 'opera'."
AG_E,"AGUE.    	An ague is a fever, one usually associated with malaria."
_EAR,"LEAR.    	Shakespeare was inspired to write his famous drama 'King Lear' by the legend of ""Leir of Britain"", the story of a mythological Celtic king."
_IL,"NIL.    	""Nada"" is the Spanish word for ""nothing""."
MA_I,"MAGI.    	""Magi"" is the plural of the Latin word ""magus"", a term applied to someone who was able to read the stars. Hence, magi is commonly used with reference to the ""wise men from the East"" who followed the star and visited Jesus soon after he was born."
N_LA,"NALA.    	In ""The Lion King"", Nala is a lioness and the childhood friend of Simba."
Y_DA,"YODA.    	Yoda is one of the most beloved characters of the ""Star Wars"" series of films. Yoda's voice was provided by the great modern-day puppeteer Frank Oz of Muppets fame."
E_IS,"ERIS.    	In Greek mythology, Eris is the goddess of strife and discord. The name ""Eris"" is derived from the Greek word for strife, and indeed translates into Latin as ""Discordia"". In Greek her counterpart is Harmonia, and in the world of the Roman gods, Concordia. The largest dwarf planet in our solar system is called Eris, named after the goddess."
ER_S,"ERIS.    	In Greek mythology, Eris is the goddess of strife and discord. The name ""Eris"" is derived from the Greek word for strife, and translates into Latin as ""Discordia"". In Greek her counterpart is Harmonia, and in the world of the Roman gods, Concordia. The largest dwarf planet in our solar system is called Eris, named after the goddess."
_IKE,"NIKE.    	Nike was the Greek goddess of victory, often referred to as the Winged Goddess of Victory. The athletic shoe company Nike uses the 'Nike swoosh' as its logo, which is based on the goddess's wing."
_GA,"LGA.    	Fiorello La Guardia was the Mayor of New York from 1934 to 1945, racking up three full terms in office. The famous airport that bears La Guardia's name was built at his urging, stemming from an incident that took place while he was in office. He was taking a TWA flight to ""New York"" and was outraged when the plane landed at Newark Airport, in the state of New Jersey. The Mayor demanded that the flight take off again and land at a small airport in Brooklyn. A gaggle of press reporters joined him on the short hop and he gave them a story, urging New Yorkers to support the construction of a new commercial airport within the city's limits. The new airport, in Queens, opened in 1939 as New York Municipal, often called ""LaGuardia"" as a nickname. The airport was officially relabeled as ""LaGuardia"" (LGA) in 1947."
AD_,"ADZ.    	An adze (also adz), while similar to an axe, is different in that the blade of an adze is set at right angles to the tool's shaft, whereas in an axe the blade is set inline with the shaft."
_ST,PST.    	Pacific Standard Time is eight hours behind Greenwich Mean Time. I should know. I just got off the phone with my mother in Ireland ...
_LEG,"OLEG.    	Oleg Cassini, the French-born American fashion designer, had two big names particularly associated with his designs. In the sixties he produced the state wardrobe for First Lady Jacqueline Kennedy, and he was also the exclusive designer for Hollywood's Gene Tierney, who was Cassini's second wife."
SRA_,"SRAS.    	Femmes marriees (""married women"" in French) on the other side of the Pyrenees (in Spain) are ""senoras"" (Sras.)."
A_S,ANS.    	One fills in an answer (ans.) on the SAT Reasoning Test. 
AJ_X,"AJAX.    	Ajax cleanser has been around since 1947, and it's ""stronger than dirt!"" That was the most famous slogan over here in the US. On my side of the pond, the celebrated slogan was ""it cleans like a white tornado""."
ANA_,"ANAL.    	Our use of the word 'anal' is an abbreviated form of 'anal-retentive', a term derived from Freudian psychology."
SOF_,"SOFA.    	""Sofa"" is a Turkish word, meaning ""bench""."
OLE_,"OLEG.    	Oleg Cassini, the French-born American fashion designer, had two big names particularly associated with his designs. In the sixties he produced the state wardrobe for First Lady Jacqueline Kennedy, and he was also the exclusive designer for Hollywood's Gene Tierney, who was Cassini's second wife."
N_NA,"NINA.    	The ship we know as the Niña was actually the nickname of a ship actually called the Santa Clara. The nickname ""Niña"" probably came from the name of her owner, Juan Niña of Moguer."
YA_G,"YANG.    	The yin and the yang can be explained using many different metaphors. In one, as the sun shines on a mountain, the side in the shade is the yin, and the side in the light is the yang. The yin is also regarded as the feminine side, and the yang the masculine."
U_A,"UVA.    	The University of Virginia (UVA) was founded by Thomas Jefferson, who sat on the original Board of Visitors alongside former US Presidents James Madison and James Monroe. In fact, the original UVA campus was built on land that was once a farm belonging to President Monroe."
_ISE,OISE.    	The River Oise rises in Belgium and joins up with the River Seine just outside Paris.
G_T,"GAT.    	'Gat' is a slang term for a gun that is derived from the Gatling gun, the precursor to the modern machine gun. The Gatling gun was invented by Dr. Richard J. Gatling in 1861. Apparently he was inspired to invent it so that one man could do as much damage as a hundred, thereby reducing the size of armies and diminishing the suffering caused by war. Go figure ..."
M_S,"MCS.    	The term 'emcee' comes from 'MC', an initialism standing for Master or Mistress of Ceremonies."
N_NO,"NANO.    	The iPod Nano is the successor to the iPod Mini and was introduced to the market at the end of 2005. There have been seven versions of the Nano to date and the current Nano as well as playing tunes is an FM player, records voice memos, has a pedometer and can connect with external devices (like a heart monitor, maybe) using Bluetooth technology."
H_S,HTS.    	Broadview Heights is a city in northern Ohio.
SR_S,"SRAS.    	According to Greek mythology, Pyrene was a lover of Hercules. Out of the relationship she bore a serpent, which understandably terrified her so she fled into the woods, and there died. Hercules made a tomb for her, piling rocks above it and thereby creating the Pyrenees mountain range, named after Pyrene."
PET_,"PETE.    	Pete Domenici served in the US Senate for the state of New Mexico from 1873 to 2009, making him the state's longest-serving US senator in history."
TA_S,"TAOS.    	McCloud' is a fun police drama that aired on television in the 1970s. Star of the show is Dennis Weaver who plays Marshal Sam McCloud, a law officer from Taos, New Mexico on special assignment in New York City. The idea for the show came from the 1968 Clint Eastwood movie called 'Coogan's Bluff', which has a similar premise."
HTT_,"HTTP.    	""http"" are the first letters in most Internet link addresses. 'http' stands for HyperText Transfer Protocol."
_HA,"CHA.    	The cha-cha-cha is a Latin dance with origins in Cuba, where it was introduced by composer Enrique Jorrin in 1953."
_NTS,"ANTS.    	Most nettle species have stinging hairs that secrete formic acid. This formic acid is the same chemical that is found in the venom injected with a bee or ant sting. The Latin word for ant is ""formica"" and gives its name to the acid."
KO_,KOI.    	Koi are also called Japanese carp. They have been bred for decorative purposes and there are now some very brightly colored koi found in Japanese water gardens.
E_NUI,"ENNUI.    	'Ennui' is the French word for boredom, a word that we now use in English. It's one of the few French words we've imported that we haven't anglicized and actually pronounce ""correctly""."
_EI,"DEI.    	Opus Dei is Roman Catholic institution that was founded in Spain in 1928, and officially approved by the church in 1950. In 2010, Opus Dei had over 90,000 members, mostly lay people. The institution's mission is to promote certain aspects of the Roman Catholic doctrine. Opus Dei was portrayed as a sinister organization by Dan Brown in his novel 'The Da Vinci Code'."
M_ITAI,"MAI TAI.    	The Mai Tai cocktail is strongly associated with the Polynesian islands, but the drink was supposedly invented in 1944 in Trader Vic's restaurant in Oakland, California. One recipe is 6 parts white rum, 3 parts orange curaçao, 3 parts Orgeat syrup, 1 part rock candy syrup, 2 parts fresh lime juice, all mixed with ice and then a float added of 6 parts dark rum."
HE_,"HEF.    	Hugh Hefner is from Chicago. His first publishing job was in the military, where he worked as a writer for an Army newspaper (from 1944-46). He went to college after his military service, and then worked as a copywriter for ""Esquire"" magazine. He left ""Esquire"" to found his own publication that he called ""Playboy"", which first hit the newsstands in 1953. It has been around ever since."
TA_,"TAL.    	Mikhail Tal was truly a chess legend. Tal holds the record for the longest unbeaten streak in competition chess. And the second longest winning streak, well, that was by Tal as well."
_ETA,"BETA.    	In the world of software development, the first tested issue of a new program is usually called the ""alpha"" version. Expected to have a lot of bugs that need to be fixed, the alpha release is usually distributed to a small number of testers. After reported bugs have been eliminated, the refined version is called a ""beta"" and is released to a wider audience, but with the program clearly labeled as ""beta"". The users generally check functionality and report further bugs that are encountered. The beta version feeds into a release candidate, the version that is tested just prior to the software being sold into the market, bug-free. Yeah, right ..."
_OK,"WOK.    	'Wok' is a Cantonese word, the name of the frying pan now used in many Asian cuisines."
M_S,MCS.    	Master or mistress of ceremonies (MC)
ALIT_,"ALITO.    	Associate Justice Samuel Alito was nominated to the US Supreme Court by President George W. Bush. Alito is the second Italian-American to serve on the Supreme Court (Antonin Scalia was the first). Alito studied law at Yale and while in his final year he left the country for the first time in his life, heading to Italy to work on his thesis about the Italian legal system."
CHA_,"CHAI.    	Chai is a drink made from spiced black tea, honey and milk, with ""chai"" being the Hindi word for ""tea"". We often called tea ""a cup of char"" growing up in Ireland, with ""char"" being our slang word for tea, derived from ""chai""."
CH_,"CHA.    	I believe the dance is called a 'cha-cha-cha', and not just 'cha-cha' ..."
N_L,"NIL.    	The use of the words ""zip"" and 'zippo' to mean ""nothing"" dates back to the early 1900s when it was student slang for being graded zero on a test."
O_SO,"OSSO.    	In Italian, the 'scapola' (scapula) and 'clavicola' (clavicle) are each an 'ossa' (bone)."
UNT_,"UNTO.    	The Golden Rule is also known as the ethic of reciprocity, and is a basis for the concept of human rights. A version of the rule used in the Christian tradition is attributed to Jesus:"
SWE_,"SWEE.    	Swee'Pea is a baby in the ""Popeye"" comic strip by E. C. Segar. Swee'Pea was left on Popeye's doorstep, delivered to him in a box. Popeye adopts and raises him."
_DIA,"ADIA.    	""Surfacing"" was recorded by Sarah McLachlan. Based on what I just read, the track ""Adia"", co-written by McLachen, was written as an apology to her best friend for stealing her ex-boyfriend, and eventually marrying him!"
RSV_,"RSVP.    	RSVP stands for ""Répondez s'il vous plaît"", which is French for ""please, answer""."
M_W,"MAW.    	'Maw' is a term used to describe the mouth or stomach of a carnivorous animal. ""Maw"" is also used as slang for the mouth or stomach of a greedy person."
ASC_T,"ASCOT.    	An Ascot tie is that horrible-looking (I think!) wide tie that narrows at the neck, which these days is only really worn at weddings. The tie takes its name from the Royal Ascot horse race at which punters still turn up in formal wear at Ascot Racecourse in England."
TER_SA,"TERESA.    	Mother Teresa was born in 1910 in the city that is now called Skopje, the capital of Macedonia. At birth she was given the names Agnes Gonxha Bojaxhiu (""Gonxha"" means ""little flower"" in Albanian). She left home at the age of 18 and joined the Sisters of Loreto, and headed to Loreto Abbey in Rathfarnham in Dublin, Ireland in order to learn English. Her goal was to teach in India, and English was the language used there for instruction by the nuns. After Mother Teresa passed away in 1997 she was beatified by Pope John Paul II, a step on the road to canonization. In order for her to be beatified there had to be documented evidence of a miracle that was performed due to her intercession. The miracle in question was the healing of a tumor in the abdomen of a woman due to the application of a locket containing a picture of Mother Teresa. Documentation of a second miracle is required for her to be declared a saint."
LS_,"LSU.    	The LSU Tigers are the sports teams of Louisiana State University (LSU). They are officially known as the Fightin' Tigers, and the school mascot is ""Mike the Tiger"". The name comes from the days of the Civil War, when two Louisiana brigades earned the nickname the ""Louisiana Tigers"". Given the French/Cajun history of Louisiana, the LSU fans use the cheer 'Geaux Tigers' instead of 'Go Tigers'."
UNT_,"UNTO.    	The Golden Rule is also known as the ethic of reciprocity, and is a basis for the concept of human rights. A version of the rule used in the Christian tradition is attributed to Jesus:"
T_S,TAS.    	Teaching Assistants (TAs)
_GI,"CGI.    	Industrial Light & Magic (ILM) is a visual effects company that was founded by George Lucas in 1975. Lucas set up the company when he started production of the movie 'Star Wars'. For many years, ILM led development in the world of computer-generated imagery (CGI)."
_AI,"LAI.    	In the mid-13th century a lay was a short song, a word that evolved from the Old French word ""lai"" meaning ""song, lyric""."
AR_OO,"ARTOO.    	Artoo's proper name is R2-D2. R2-D2 is the smaller of the two famous droids from the ""Star Wars"" movies. British actor Kenny Baker, who stands just 3 ft 8 ins tall, has been the man inside the R2-D2 droid for all six of the ""Star Wars"" movies."
O_S,"OMS.    	Om is a sacred, mystic word from the Hindu tradition. It is sometimes used as a mantra, a focus for the mind in meditation."
R_NI,RANI.    	A ranee (also spelled rani) is the female equivalent of a raja in India.
CZA_,"CZAR.    	The term czar (also tsar) is a Slavic word, and was first used as a title by Simeon I of Bulgaria in 913 A.D. It is derived from the word Caesar, which was synonymous with emperor at that time."
IGL_O,"IGLOO.    	The Inuit word for ""house"" is ""iglu"", which we usually write as ""igloo"". The Greenlandic (yes, that's a language) word for ""house"" is very similar: namely ""igdlo""."
_ENSA,"MENSA.    	If you ever had to learn Latin, as did I, ""mensa"" was probably taught to you in Lesson One as it's the word commonly used as an example of a first declension noun. Mensa means ""table"". The Mensa organization for folks with high IQs was set up in Oxford, England back in 1946. To become a member, one is required to have an IQ that is in the top 2% of the population."
VE_,"VEE.    	One has to be careful making that V-sign depending where you are in the world. Where I came from, the V for victory (or peace) sign has to be made with the palm facing outwards. If the sign is made with the palm facing inwards, it can be interpreted as a very obscene gesture."
_UC,"LUC.    	'March of the Penguins' is a truly moving, and humorous, nature documentary film by co-writer and director Luc Jacquet. It is a remarkable production, often filmed in temperatures between -58 and -76 degrees Fahrenheit."
ASSA_,"ASSAM.    	Assam is a state in the very northeast of India, just south of the Himalayas. Assam is noted for its tea, as well as its silk."
R_Y,ROY.    	Roy Acuff was a country music singer and fiddle player. He founded the group known as the Smoky Mountain Boys.
