CNB_,"CNBC.    	""Squawk Box"" is a business news show that airs on CNBC on weekday mornings. The name comes from a device used in brokerage houses, a permanently open intercom that is used to communicate stock transactions."
ANO_,"ANOS.    	The Yucatán is one of Mexico's 31 states, and is located in the east of the country, on the northern tip of the Yucatán peninsula. The most widely spoken, indigenous language of Yucatán is the Yucatec Maya, one of the many Mayan languages, and a language that is also spoken in nearby Belize and in parts of Guatemala."
TR_U,TROU.    	'Trou' is short for 'trousers'.
S_O,"SLO.    	Back in Ireland the ""pavement"" is what we call the ""footpath"" here in the US (because the footpath is ""paved""!). It's very confusing when you arrive in this country from Ireland, and a little dangerous when one has been taught to ""walk on the pavement"" ..."
_ECCA,"MECCA.    	Mecca is in the Makkah province of Saudi Arabia and is the holiest city in Islam. Every year several million Muslims perform the Hajj, a holy pilgrimage to Mecca."
PE_SI,"PEPSI.    	The Pepsi-Cola formulation was developed by one Caleb Bradham who made the drink at home and sold it as 'Brad's Drink'. Bradham's aim was to provide a drink that was pleasant to taste, that would aid digestion and boost energy. Included in the formula were pepsin (a digestive enzyme) and kola nuts. These two ingredients inspired the Pepsi Cola brand name that is used today."
JE_,"JEB.    	I always thought that Jeb was an American nickname for James or Joseph but I must be wrong, because George and Barbara's son John Ellis Bush is called ""Jeb"". A kind blog reader has suggested the the name ""Jeb"" may have been chosen as JEB are the initials of John Ellis Bush."
SVE_,SVEN.    	Sven is a Scandinavian name. 'Sven' is derived from the Old Norse word for 'young man' or 'young warrior'.
SE_,"SET.    	In volleyball, each team can only touch the ball a maximum of three times before it returns to the other side of the net. The three contacts are often a bump and a set followed by a spike."
_QABA,"AQABA.    	The coastal city of Aqaba is the only seaport in the country of Jordan. The city lies at the very northern tip of the Gulf of Aqaba, which is off the Red Sea."
SAD_,"SADE.    	Sade's real name is Helen Folasade Adu. Although she was born in Nigeria, Sade grew up and lives in the UK. She was the lead vocalist for the English group Sade, and adopted the name of the band. The band's biggest hits were 'Smooth Operator' (1984) and 'The Sweetest Taboo' (1985)."
NE_L,"NEAL.    	Patricia Neal won her Best Actress Oscar relatively late in her career, for playing the middle-aged housekeeper in 1963's 'Hud'. A few years' later she was offered the role of Mrs. Robinson in 'The Graduate' but turned it down. Famously, Neal had an affair with Gary Cooper who was married at the time. She became pregnant with his child, but he persuaded her to have an abortion. Not long afterwards Neal married British writer Roald Dahl (of 'Willy Wonka' fame) and the couple had five children together before divorcing in 1983."
_OEG,"ROEG.    	The 1976 British film ""The Man Who Fell to Earth"" is perhaps most famous for starring David Bowie in the title role. The movie was directed by Nicolas Roeg, and is based on a 1963 novel of the same name written by Walter Tevis."
AT_,ATH.    	An athlete.
EVIA_,"EVIAN.    	Évian-les-Bains (or simply Évian) is in the very east of France, on the shores of Lake Geneva, directly across the lake from Lausanne, Switzerland. As you might imagine, Évian is the home of Évian mineral water, the most successful business in town. I can't stand the taste of Évian water ..."
PE_S,"PEAS.    	The Jolly Green Giant was introduced by Minnesota Valley Canning in 1925 to help sell the company's peas. He was named after one of the varieties of pea that the company sold, the ""Green Giant"". The Jolly Green Giant first appeared in a television commercial in 1953, walking through a valley with young boys running around at his feet. That first commercial proved to be so scary for younger viewers that it was immediately pulled off the air."
OTEL_O,"OTELLO.    	Giuseppe Verdi's opera ""Otello"" was first performed in 1887 at La Scala Theater in Milan. The opera is based on Shakespeare's play ""Othello"" and is considered by many to be Verdi's greatest work."
O_ELLO,"OTELLO.    	Giuseppe Verdi's opera ""Otello"" was first performed in 1887 at La Scala Theater in Milan. The opera is based on Shakespeare's play ""Othello"" and is considered by many to be Verdi's greatest work."
_RANG,"ORANG.    	Orangutans (also 'orangs') are arboreal creatures, in fact the largest arboreal animals known to man. They are native to Indonesia and Malaysia, living in the rain forests. Like most species in rain forests these days, orangutans are endangered, with only two species surviving. The word 'orangutan' is Malay, meaning 'man of the forest'."
BON_,"BONA.    	'Bona fide(s)' translates from the Latin as ""in good faith"", and is used to indicate honest intentions. It can also mean that something is authentic, like a piece of art that is represented in good faith as being genuine."
ORIOL_,"ORIOLE.    	The Baltimore Orioles are one of the eight charter teams of MLB's American League, so the franchise dates back to 1901. Prior to 1901, the team has roots in the Minor League Milwaukee Brewers, and indeed entered the American League as the Brewers. In 1902 the Brewers moved to St. Louis and became the Browns. The team didn't fare well in St. Louis, so when it finally relocated to Baltimore in the early fifties the team changed its name completely, to the Baltimore Orioles. The owners so badly wanted a fresh start that they traded 17 old Browns players with the New York Yankees. The trade didn't help the team's performance on the field in those early days, but it did help distance the new team from its past."
GL_,GLO.    	Mop & Glo is brand of floor cleaner and polish.
B_C,"BBC.    	The marvelous British Broadcasting Corporation (BBC) is mainly funded by the UK government through a television licence fee that is levied annually on all households watching TV transmissions. Currently the fee is 145 UK pounds, about 230 US dollars."
K_N,"KAN.    	Smallville, Kansas is the town on Earth in which Superman grew up (as Clark Kent). One of Clark's best friends in Smallville, and romantic interest of his youth, was Lana Lang."
IAM_,"IAMS.    	Iams dog food was produced by the animal nutritionist Paul Iams. He felt that household pets were suffering somewhat by being fed a diet of table scraps, so he developed a dry dog food that he felt was more nutritious and suitable for pet dogs. He founded the Iams company, now part of Proctor & Gamble, in 1946."
U_S,"USS.    	""Old Ironsides"" was a nickname given to the USS Constitution even though she is actually a wooden-hulled ship. The Constitution was launched in 1797 and can still be seen at sea today. She is the oldest commissioned naval vessel in the world. You can visit Old Ironsides at the Boston Navy Yard, where I had the privilege of touring her in 2011. As an old sailor, I'd say she is the best-maintained ship I've ever been on and paradoxically, she is also the oldest. Really, really beautiful ..."
SO_A,"SOYA.    	What are known as soybeans here in the US are called 'soya beans' in most other English-speaking countries. So, I drink soy milk here in America, but when I am over in Ireland I drink ""soya milk""."
PER_,PERP.    	Perpetrator (perp.)
N_CRE,"NACRE.    	Mother-of-pearl is another name for nacre. Nacre is the strong iridescent material laid down by some mollusks on the inside of their shells, and it's also what makes up pearls. The creature lays down nacre as a defensive mechanism, protecting the soft tissue of its body from the rough surface of the outer shell. Similarly, it uses nacre to encapsulate harmful debris or a parasite that penetrates the shell, and that's how a pearl is formed."
_APRI,CAPRI.    	64. Grotto color at 61-Across : BLUE
SO_I,"SOLI.    	""Soli"" (the plural of ""solo"") are pieces of music performed by one artist, whereas ""tutti"" are pieces performed by all of the artists."
_ENY,"EENY.    	""Eeny, meeny, miny, moe,"
PU_A,"PUMA.    	The mountain lion is found in much of the Americas from the Yukon in Canada right down to the southern Andes in South America. Because the mountain lion is found over such a vast area, it has many different names applied by local peoples, such as cougar and puma. In fact, the mountain lion holds the Guinness record for the animal with the most number of different names, with over 40 in English alone."
D_N,"DON.    	""The Godfather"" series of films is of course based on ""The Godfather"" novel by Mario Puzo, first published in 1969. Francis Ford Coppola worked with Puzo in partnership to adapt his novel into the screenplay for the first film, and to write the screenplays for the two sequels."
_QABA,"AQABA.    	The coastal city of Aqaba is the only seaport in the country of Jordan. The city lies at the very northern tip of the Gulf of Aqaba, which is off the Red Sea."
GUA_,"GUAM.    	Guam is a US territory in the western Pacific Ocean, the largest of the Mariana Islands. Guam is also the first territory in the United States to see the sun rise on any particular day. As such, the territory has adopted the motto, 'Where America's day begins'. During WWII, the US territory of Guam was occupied by the Japanese for 31 months until it was liberated in the Battle of Guam in July 1944. Of the 18,000 Japanese men holding the island, only 485 surrendered, so almost all perished in the invasion. One Japanese sergeant hid out on the island for an incredible 28 years, finally surrendering in 1972!"
RA_TT,"RAITT.    	Bonnie Raitt is a blues singer, originally from Burbank, California. She has one nine Grammies for her work, but she is perhaps as well known for her political activism as she is for her music. She was no fan of President George W. Bush, and she sure did show it."
SV_N,SVEN.    	Sven is a Scandinavian name. 'Sven' is derived from the Old Norse word for 'young man' or 'young warrior'.
_ILO,"SILO.    	Silo is a Spanish word that we absorbed into English, originally coming from the Greek word ""siros"" that described a pit in which one kept corn."
_ILO,"SILO.    	Silo is a Spanish word that we absorbed into English, originally coming from the Greek word ""siros"" that described a pit in which one kept corn."
JAM_,"JAMB.    	A door jamb is the vertical portion of a door frame. The term ""jamb"" comes from the French word ""jambe"" meaning ""leg""."
_TS,RTS.    	Right tackle (RT)
BAC_,"BACH.    	It is generally agreed that Johann Sebastian Bach was the greatest composer of the Baroque period, and is ranked by many as the greatest classical composer of all time. Like so many of the great composers, the extent of Bach's contribution to the repertoire wasn't fully recognized until long after his passing. He died when he was 65-years-old, in 1750. Bach's body was buried in Old St. John's Cemetery in Leipzig, and his grave went unmarked until 1894. At that time his coffin was located, removed and buried in a vault within the church. The church was destroyed in an Allied bombing raid during WWII, and so after the war the remains had to be recovered and taken to the Church of St. Thomas in Leipzig."
I_D,"IED.    	Sadly, having spent much of my life in the border areas between southern and Northern Ireland, I am all too familiar with the devastating effects of Improvised Explosive Devices (IEDs). One has to admire the bravery of soldiers who spend their careers defusing (or attempting to defuse) such devices in order to save the lives and property of others. Of course these days, IEDs are very much in the news in Iraq and Afghanistan."
LAD_,"LADE.    	The verb ""lade"" meaning ""to load"" comes from an Old English word ""hladan"". Lade also used to mean ""to draw water"" and indeed gave us our word ""ladle"". So ""lade"" and ""ladle"" are close cousins."
A_G,"ALG.    	We all remember algebraic functions from math class, don't we? So, I don't need to explain them here ..."
_AVA,"LAVA.    	Lava is a brand of soap that was introduced as a heavy-duty cleanser in 1983. Unlike like soaps that are marketed using a 'soft' image, Lava touts the inclusion of ground pumice that is intended to abrade grime off the skin. Pumice is found in certain types of lava ejected from a volcano, hence the name of the soap."
NA_E,"NAVE.    	In large, Christian churches, the nave is the main approach to the altar, where most of the faithful are seated."
_ILO,"SILO.    	There are still hundreds of Minuteman Intercontinental Ballistic Missiles (ICBMs) in service, with most of them dotted around the landscape of the plain states. I was driving through the area not so long ago and counted five missile silos and two launch control centers, just sitting there, at the side of the road."
LI_,"LIL.    	Here's yet another rapper (oh, joy!). Lil Wayne's real name is ... Dwayne Carter, Jr."
APE_,"APES.    	The gorilla is the largest primate still in existence, and is one of the nearest living species to humans. Molecular biology studies have shown that our nearest relatives are in fact the species in the genus Pan (the chimpanzee and the bonobo), which split from the human branch of the family 4-6 million years ago. Gorillas and humans diverged at a point about 7 million years ago. The term 'gorilla' derives from the Greek ""gorillai' meaning 'tribe of hairy women'."
US_A,"USNA.    	John McCain went into the US Naval Academy in 1958, following a family tradition, as his father and grandfather were both four-star admirals. The younger McCain did not achieve the same rank, retiring from the Navy as a captain in 1981, but his career development was interrupted by six years spent as a prisoner of war in North Vietnam. Regardless of politics, we can only salute out military heroes."
IB_EN,"IBSEN.    	Henrik Ibsen's play ""Peer Gynt"" is based on a Scandinavian fairy tale ""Per Gynt"". The incidental music to the play, written by Edvard Grieg, is some of the most approachable classical music every written, at least in my humble opinion ..."
_ERENA,SERENA.    	Serena Williams is the younger of the two sisters playing professional tennis. Serena has won more prize money in her career than any other female athlete.
E_TRE,"ENTRE.    	In French, something might perhaps be discussed 'entre deux' (between two) or 'entre nous' (between us)."
UR_S,"URIS.    	Leon Uris is an American writer. Uris's most famous books are ""Exodus"" and ""Trinity"", two excellent stories, in my humble opinion ..."
LEO_E,"LEONE.    	Leones are the currency of Sierra Leone. The Leone was introduced in 1964 to replace the British West African pound. The move was a practical one, as the Leone is a decimal currency and replaces the old British system of pounds, shillings and pence."
_BS,LBS.    	The unit of mass that we know today as a 'pound' is descended from the old Roman unit of weight known as a 'libra'. That 'libra' connection is why we abbreviate pound to 'lb'. The name 'pound' though comes from the Latin 'pondo' meaning 'weight'.
M_H,"MEH.    	Meh!' is one of those terms unfamiliar to me outside of crosswords. It is a modern colloquialism meaning 'I'm not great, but not bad'. A friendly reader of this blog tells me that the usage of the term increased dramatically after it started to appear regularly in ""The Simpsons"" starting in the early nineties."
_HAG,SHAG.    	A kind blog reader (below) points out that the reference here is to the shag hairstyle.
S_SH,"SASH.    	A movable (up and down) window frame is called a sash, from the French word for a frame 'châssis'. The term is also applied to that part of a door or window into which windows are set."
_RU,"CRU.    	""Cru"" is a term used in the French wine industry that means ""growth place"". So, ""cru"" is the name of the location where the grapes are grown, as opposed to the name of a specific vineyard. The terms ""premier cru"" and ""grand cru"" are also used, but the usage depends on the specific wine region. Generally it is a classification awarded to specific vineyards denoting their potential for producing great wines. 'Grand cru' is reserved for the very best vineyards, with 'premier cru' the level just below."
ANAI_,"ANAIS.    	Anaïs Nin was a French author, famous for her journals that she wrote for over sixty years from the age of 11 right up to her death. Nin also wrote highly-regarded erotica and cited D. H. Lawrence as someone from whom she drew inspiration. Nin was married to banker and artist Hugh Parker Guiler in 1923. Decades later in 1955, Nin married former actor Rupert Pole, even though she was still married to Guiler. Nin and Pole had their marriage annulled in 1966, but just for legal reasons, and they continued to live together as husband and wife until Nin passed away in 1977."
_AR,PAR.    	The following terms are routinely used in golf for scores relative to par:
B_NA,"BONA.    	'Bona fide(s)' translates from the Latin as ""in good faith"", and is used to indicate honest intentions. It can also mean that something is authentic, like a piece of art that is represented in good faith as being genuine."
A_EUT,"ALEUT.    	The Aleuts live on the Aleutian Islands of the North Pacific, and on the Commander Islands at the western end of the same island chain. The Aleutians are part of the United States, and the Commander Islands are in Russia."
T_OS,"TSO'S.    	General Tso's chicken is an American creation, often found on the menu of a Chinese restaurant. The name General Tso may be a reference to General Zuo Zongtang of the Qing Dynasty, but there is no clear link."
S_A,"SSA.    	The Social Security Administration (SSA) was set up as part of President Franklin D. Roosevelt's New Deal. The first person to receive a monthly retirement benefit was Ida May Fuller of Vermont who received her first check for the sum of $22.54 after having contributed for three years through payroll taxes. The New Deal turned out to be a good deal for Ms. Fuller, as she lived to 100 years of age and received a total benefit of almost $23,000, whereas her three years of contributions added up to just $24.75."
U_N,USN.    	Ensign is (usually) the most junior rank of commissioned officer in the armed forces. The name comes from the tradition that the junior officer would be given the task of carrying the ensign flag.
O_OS,"OTOS.    	The Otoe (also Oto) Native American tribe originated in the Great Lakes region as part of the Winnebago or Siouan tribes. The group that would become the Otoe broke away from the Winnebago and migrated southwestwards ending up in the Great Plains. In the plains the Otoe adopted a semi-nomadic lifestyle dependent on the horse, with the American bison becoming central to their diet."
B_JA,BAJA.    	Baja California is both the most northern and the most western of the Mexican states. The name translates from Spanish as 'Lower California'.
FI_,"FIN.    	In French, one might see the word 'fin' (end) at the end of 'un film' (a movie)."
DA_,"DAR.    	In order to be a member of the Daughters of the American Revolution (DAR), an applicant has to prove that she is a descendant of someone closely associated with, and supportive of, the American Revolution. The DAR maintains an online database of Revolutionary War patriots. The database is searchable, and is known as the Patriot Index."
PE_,"PER.    	'Pay-per-click' is an advertising model commonly used on the Internet. The scheme allows advertisers to place ads for free, only paying every time that a reader clicks on an ad."
EAT_,"EATS.    	'Vittles' is a variant of the word 'victuals', meaning food fit for human consumption."
LO_E,LODE.    	A lode is metal ore deposit that's found between two layers of rock or in a fissure.
HESS_,"HESSE.    	Hermann Hesse was not only a novelist, but also a poet and a painter. Hesse's best-known work is probably his 1927 novel ""Steppenwolf""."
_SSA,"OSSA.    	Mt. Ossa in Greece is located between Mt. Pelion in the south, and the famed Mt. Olympus in the north. Mount Ossa is also known as Kissavos."
KNE_,"KNEE.    	""Oh! Susanna"" is a song that was published in 1848, written by Stephen Foster. The song is often called ""Banjo on My Knee"", a mistake caused by those being some of the words of the chorus."
YOG_,YOGI.    	A yogi is a practitioner of yoga.
R_R,"RUR.    	""R.U.R."" is a play written in Czech by Karel Capek, first produced in 1921. ""R.U.R."" is a science fiction work and is remembered in part for introducing the world to the word ""robot"". The words ""automaton"" and ""android"" were already in use, but Capek gave us ""robot"" from the original Czech ""robota"" meaning ""forced labor""."
M_TH,"MOTH.    	It isn't really understood why moths are attracted to artificial lights. There is one theory that sounds plausible to me though. It is suggested that moths navigate at night by maintaining the moon (the brightest celestial object) at a fixed angle. When a moth finds a brighter light source, like an artificial light, it gets confused."
ME_S,"METS.    	The New York Mets wear blue-and-orange jerseys. The colors were chosen to represent the two departed New York teams, the Brooklyn Dodgers (blue) and the New York Giants (orange). Also, the outer two bands on the flag of New York City are blue and orange."
ME_CA,"MECCA.    	Mecca is in the Makkah province of Saudi Arabia. It was the birthplace of Muhammad and is the holiest city in Islam. Every year several million Muslims perform the Hajj, a holy pilgrimage to Mecca."
M_ET,"MOET.    	Moët & Chandon is a French winery, one of the world's largest producers of champagne. The company was founded by wine trader Claude Moët in 1743. The name was changed to Moët & Chandon in the 1830s when Pierre-Gabriel Chandon, an in-law to the Moët family, was given co-ownership. Moët & Chandon owns the famous Dom Pérignon brand name, honoring the Benedictine monk who did so much to improve the quality of champagne."
NE_L,"NEAL.    	Patricia Neal won her Best Actress Oscar relatively late in her career, for playing the middle-aged housekeeper in 1963's 'Hud'. A few years' later she was offered the role of Mrs. Robinson in 'The Graduate' but turned it down. Famously, Neal had an affair with Gary Cooper who was married at the time. She became pregnant with his child, but he persuaded her to have an abortion. Not long afterwards Neal married British writer Roald Dahl (of 'Willy Wonka' fame) and the couple had five children together before divorcing in 1983."
JA_,JAI.    	(35D. See 58-Across : ALAI)
B_CH,"BACH.    	A fugue is similar to a round in that it is a piece written for two or more voices, with themes that are introduced and taken up by different voices at different pitches. The most famous composer of fugues has to be Johann Sebastian Bach."
D_F,"DEF.    	For sure, definitely ... why couldn't they just say that?"
R_NT,"RENT.    	The commercial game of Monopoly is supposedly a remake of ""The Landlord's Game"" created in 1903 by a Quaker woman called Lizzie Phillips who used it as a tool to explain the single tax theory of American economist Henry George. The Landlord's Game was first produced commercially in 1924. The incredibly successful derivative game called Monopoly was introduced in 1933 by Charles Darrow, making him a very rich man when Parker Brothers bought the rights to the game just two years later in 1935."
_OZ,"ROZ.    	Roz Chast had her first cartoon published in ""The New Yorker"" in 1978, and has had more than 800 published since then."
SS_,"SSA.    	The Social Security Administration (SSA) publishes a list of the 1,000 most common baby names for the prior year annually, just before Mother's Day. The list is compiled using applications for Social Security cards."
ENTR_,"ENTRE.    	In French, something might perhaps be discussed 'entre deux' (between two) or 'entre nous' (between us)."
E_BE,"ELBE.    	The River Elbe rises in the Czech Republic, and travels over a thousand kilometers before emptying into the North Sea where it feeds the port of Hamburg. Just after passing over the border from the Czech Republic into Germany, the Elbe passes through the historic city of Dresden."
A_OLO,"APOLO.    	Speed-skater Apolo Ohno has won more Winter Olympics medals than any other American. Ohno also did a great job winning the 2007 season of television's ""Dancing with the Stars""."
_DEON,"ODEON.    	In Ancient Greece an odeon was like a small theater, with ""odeon"" literally meaning ""building for musical competition"". Odea were used in both Greece and Rome for entertainments such as musical shows and poetry readings."
T_SS,"TASS.    	TASS is the abbreviation used for the former news agency, the Telegraph Association of the Soviet Union (Telegrafnoye Agentstvo Sovetskovo Soyuza). When the Soviet Union dissolved in 1992, the Moscow-based agency's scope changed, along with its name. It is now known as the Information Telegraph Agency of Russia (ITAR-TASS)."
OA_,"OAK.    	The Chardonnay grape is believed to have originated in the Burgundy wine region of France. Now it's grown ""everywhere"". Drinkers of California Chardonnays seem to be particularly fond of ""oak"" flavor, so most of these wines are aged in oak barrels."
M_TH,"MOTH.    	It isn't really understood why moths are attracted to artificial lights. There is one theory that sounds plausible to me though. It is suggested that moths can navigate at night by maintaining the moon (the brightest celestial object) at a fixed angle. When a moth finds a brighter light source, like an artificial light, it gets confused."
