ID_,"IDI.    	Idi Amin received most of his military training in the British armed forces, eventually achieving the highest rank possible for a Black African in the British Colonial Army in 1959, that of Warrant Officer. On his return to Uganda Amin joined his country's military and quickly rose to the rank of Deputy Commander of the Army. During that time he was quite the athlete. He was a noted rugby player and swimmer, and for nine years held the Ugandan national light-heavyweight boxing title. By the early seventies, Amin was commander of all the armed forces of Uganda and in 1971 seized power in a military coup, displacing the country's president Milton Obote. There followed seven years of brutal rule by Amin during which it is estimated that between 100,000 and 500,000 people were murdered. Amin was ousted from power in 1979 after a war with Tanzania, and fled to Libya where he stayed for a year. He then moved to Saudi Arabia, where he was financially supported by the Saudi Royal Family for the remainder of his life. Amin died in 2003."
OE_,OED.    	43. See 37-Across : ABC
A_DA,"AIDA.    	""Aida"" is the famous opera by Giuseppe Verdi, actually based on a scenario written by French Egyptologist Auguste Mariette. Mariette also designed the costumes and stages for the opening performance. The opera was first staged in 1871 in an opera house in Cairo. In the storyline, Aida is an Ethiopian princess brought into Egypt as a slave. Radames is an Egyptian commander who falls in love with her, and then of course complications arise!"
_PF,"SPF.    	In theory, the Sun Protection Factor, is a calibrated measure of the effectiveness of a sunscreen in protecting the skin from the harmful UV rays of the sun. The idea is that if you wear a lotion with say SPF 20, then it will take 20 times as much UV radiation to cause the skin to burn with lotion on, than without it. I say, just stay out of the sun ..."
OL_E,"OLDE.    	The word ""olde"" wasn't actually used much earlier than the 1920s. ""Olde"" was introduced to give a quaint, antique feel to brand names, shop names etc."
MR_,"MRS.    	The Mrs. Fields brand of snack foods was founded in the late seventies by Debbi Fields. Fields opened her first store in Palo Alto, California."
LEN_,"LENA.    	Lena Horne was an American jazz singer, actress, dancer and civil rights activist. she passed away not long ago, on May 9, 2010. She started out her career as a nightclub singer, and then started to get some meaty acting roles in Hollywood before being blacklisted during the McCarthy Era for expressing left wing political views. One of her starring roles was in the 1943 movie ""Stormy Weather"" for which she also performed the title song."
A_OS,AMOS.    	Amos is one of the twelve minor prophets in the Hebrew Bible.
_RS,ORS.    	Operating room (OR)
E_M,"ELM.    	Draco Malfoy is one of the regular ""bad guys"" in the Harry Potter series. Malfoy is one of Potter's fellow students, the one who sneers a lot. Draco's father is Lucius Malfoy, a character who becomes more and more relevant as the storyline in the series of books progresses."
E_IS,"ELIS.    	Eli is the nickname for a graduate of Yale University, a term used in honor of the Yale benefactor Elihu Yale."
E_M,ELM.    	The Slippery Elm is a species of elm native to North America and is also known as the Red Elm. The inner bark of the slippery elm can used in a medicinal tea. Elm bark tea is said to ease a sore throat or irritated stomach.
_AL,"HAL.    	Prince Hal' is a term used for Prince Henry, the son of the title character in Shakespeare's plays 'Henry IV, Part 1' and 'Henry IV, Part 2'. Prince Hal then becomes the King in Shakespeare's 'Henry V'."
MA_,"MAO.    	Andy Warhol made a famous series of portraits of Chinese Communist leader Mao Zedong in 1973. An exhibition of Warhol's works toured China in 2012 but the images of Mao were excluded, apparently at the request of the Chinese government."
L_A,"LOA.    	Mauna Loa on the ""big island"" of Hawaii is the largest volcano on the planet (in terms of volume). The name ""Mauna Loa"" is Hawaiian for ""Long Mountain""."
R_BA,"REBA.    	Reba McEntire is a country music singer and television actress. McEntire starred in her own sitcom called ""Reba"" that aired on the WB and the CW cable channels from 2001 to 2007."
EV_,"EVE.    	According to the Book of Genesis, Adam and Eve lived in a garden ""in"" Eden, with Eden being geographically located by reference to four rivers, including the Tigris and the Euphrates. Some scholars hypothesize that Eden was located in Mesopotamia, which encompasses much of modern-day Iraq."
_MP,"AMP.    	An electric guitar, for example, needs an amplifier (amp) to take the weak signal created by the vibration of the strings and turn it into a signal powerful enough for a loudspeaker."
E_RO,"EERO.    	Eero Saarinen was a Finnish American architect, renowned in this country for his unique designs for public buildings such as Gateway Arch in St. Louis, Dulles International Airport Terminal, and the TWA building at JFK. The list of his lesser-known, but still impressive, works includes several buildings erected on academic campuses. For example, the Chapel and Kresge Auditorium on the MIT campus, the Emma Hartman Noyes House at Vassar College, the Law School building at the University of Chicago, and Yale's David S. Ingalls Rink."
_BA,"MBA.    	Columbia University is an Ivy League school in New York City. Columbia's athletic teams are called the Lions, thought to be a reference to the lion on the English coat of arms. Prior to the American Revolution, Columbia was called King's College as it was chartered by King George II in 1754."
SP_,"SPF.    	In theory, the Sun Protection Factor, is a calibrated measure of the effectiveness of a sunscreen in protecting the skin from the harmful UV rays of the sun. The idea is that if you wear a lotion with SPF say of 20, then you will need 20 times as much UV radiation to cause the skin to burn with lotion on, than without it. I say, just stay out of the sun ..."
_AO,"MAO.    	Mao Zedong was born on December 16, 1893 in the Hunan Province of China. As he was the son of a peasant farmer, his prospects for education were limited. Indeed he left school at age 13 to work on the family farm but did eventually get to secondary school in Changsa, the provincial capital. In the years following he continued his education in Beijing, and actually turned down an opportunity to study in France."
CB_,"CBS.    	The People's Choice Awards are produced by Procter & Gamble and Mark Burnett (the producer of 'Survivor'). The first awards show was in 1975, and the winners were the 'The Sting' as Favorite Picture, Barbra Streisand as Best Actress and John Wayne as Favorite Actor."
M_L,"MEL.    	Florence Jean ""Flo"" Castleberry was a waitress in the sitcom ""Alice"" which aired on CBS in the 70s and 80s. Flo got her own sitcom (called 'Flo') which had a brief run in the early 80s. I saw a few episodes of 'Alice', but that's about it. Oh, and Flo was played by Polly Holliday."
_LTA,"ALTA.    	Alta ski resort actually lies within the Salt Lake City Metropolitan Area. The first ski lift in the resort was opened way back in 1939. Today, Alta is one of only three ski resorts in the country that prohibits snowboarding (along with Deer Valley, Utah and Mad River Glen, Vermont. The ski resort of Snowbird located next to Alta has been in operation since 1971."
ING_,"INGE.    	During his career, dramatist William Inge was known as the 'Playwright of the Midwest', as many of his works were set in the American heartland and explored small town life. When Inge was 60 years old, he committed suicide by poisoning himself with carbon monoxide. He was buried in his hometown of Independence, Missouri. Inge's grave is marked with a headstone that reads simply 'Playwright'."
ALA_,"ALAI.    	Even though jai alai is often said to be the fastest sport in the world because of the speed of the ball, in fact golf balls usually get going at a greater clip. Although, as a blog reader once pointed out to me, you don't have to catch a golf ball ..."
E_O,"EGO.    	Sigmund Freud created a structural model of the human psyche, breaking it into three parts: the id, the ego, and the super-ego. The id is that part of the psyche containing the basic, instinctual drives. The ego seeks to please the id by causing realistic behavior that benefits the individual. The super-ego almost has a parental role, contradicting the id by introducing critical thinking and morals to behavioral choices."
P_RU,"PERU.    	Peru's name comes from the word ""Biru"". Back in the early 1500s, Biru was a ruler living near the Bay of San Miguel in Panama. The territory over which Biru ruled was the furthest land south in the Americas known to Europeans at that time. The Spanish conquistador Francisco Pizarro was the first European to move south of Biru's empire, and the land that he found was designated ""Peru"", a derivative of ""Biru""."
NA_,"NAS.    	Rapper Nas used to go by another stage name, Nasty Nas, and before that by his real name, Nasir bin Olu Dara Jones. Nas released his first album ""Illmatic"" in 1994, and inventively titled his fifth studio album 'Stillmatic', released in 2001. Not my cup of tea, I would say ..."
_ZI,"UZI.    	The first Uzi submachine gun was designed in the late 1940s by Major Uziel 'Uzi' Gal of the Israel Defense Forces, who gave his name to the gun."
_PS,"GPS.    	GPS stands for Global Positioning System. The modern GPS system that we use today was built by the US military who received the massive funding needed because of fears during the Cold War of the use of Intercontinental Ballistic Missiles. We civilians, all round the world, owe a lot to President Ronald Reagan because he directed the military to make GPS technology available to the public for the common good. President Reagan was moved to do so after the Soviet Union shot down KAL flight 007 carrying 269 people, just because the plane strayed accidentally into Soviet airspace."
OR_,ORS.    	Surgeons operate in Operating rooms.
ELB_,"ELBA.    	I had a lovely two-week vacation in Tuscany once, including what was supposed to be a two-night stay on the island of Elba. I had envisioned Elba as a place full of history, and maybe it is, but it is also overrun with tourists who use it as a beach getaway. We left after one day and we won't be going back again ..."
OLD_,"OLDE.    	The word ""olde"" wasn't actually used much earlier than the 1920s. ""Olde"" was introduced to give a quaint antique feel to brand names, shop names etc."
_IR,"MIR.    	The Russian Mir Space Station was a remarkably successful project, with the station still holding the record for the longest continuous manned presence in space, at just under ten years. Towards the end of the space station's life however, the years began to take their toll. There was a dangerous fire, multiple system failures, and a collision with a resupply ship. The Russian commitment to the International Space Station drained funds for repairs, so Mir was allowed to reenter the Earth's atmosphere and burn up in 2001."
_EN,"TEN.    	A hexadecimal numeral system is one based on the number 16. Such a system requires sixteen distinct symbols, six more than are needed for our base-10 system. These usually are the symbols 0-9 for the numbers 0 to 9, and A-F for the numbers 10 through 15."
_ESS,"TESS.    	'No Country for Old Men' is a 2007 thriller made by the Coen brothers that is based on a novel of the same name by Cormac McCarthy. I have to put this one on my list as I hear good things about it. It won several Oscars and stars Tommy Lee Jones, a favorite actor of mine."
A_OS,AMOS.    	Amos is one of the twelve minor prophets in the Hebrew Bible.
H_RA,"HERA.    	In Greek mythology, Hera was the wife of Zeus and was noted for her jealousy and vengeful nature, particularly against those who vied for the affections of her husband. The equivalent character in Roman mythology was Juno."
_DI,"IDI.    	Idi Amin received most of his military training in the British armed forces, eventually achieving the highest rank possible for a Black African in the British Colonial Army in 1959, that of Warrant Officer. On his return to Uganda he joined the military and quickly rose to the rank of Deputy Commander of the Army. During that time he was quite the athlete. He was a noted rugby player and swimmer, and for nine years held the Ugandan national light-heavyweight boxing title. By the early seventies Amin was commander of all the armed forces of Uganda, and in 1971 seized power in a military coup, displacing the country's president Milton Obote. There followed seven years of brutal rule by Amin during which time it is estimated that between 100,000 and 500,000 people were murdered. Amin was ousted from power in 1979 after a war with Tanzania, and fled to Libya where he stayed for a year. He then moved to Saudi Arabia, where he was financially supported by the Saudi Royal Family for the remainder of his life. He died in 2003."
LEN_,"LENO.    	Jay Leno is a car fanatic, and owns about 200 vehicles of various types. You can check them out on his website!"
A_DA,"AIDA.    	""Aida"" is a famous opera by Giuseppe Verdi, actually based on a scenario written by French Egyptologist Auguste Mariette, who also designed the costumes and stages for the opening performance. The opera was first performed in 1871 in an opera house in Cairo. In the storyline, Aida is an Ethiopian princess brought into Egypt as a slave. Radames is an Egyptian commander who falls in love with her, and then of course complications arise!"
_PR,APR.    	Annual percentage rate (APR)
_LTA,"ALTA.    	In Spanish, 'baja' is 'low' and 'alta' is 'high'."
_AO,"SAO.    	São Paulo is the largest city in Brazil. São Paulo is also the city with the highest number of helicopters in the world. This is partly driven by the horrendous traffic jams in São Paulo, but also by the wealthy having a very real fear of being kidnapped on the city's streets."
_AL,"HAL.    	In Arthur C. Clarke's ""Space Odyssey"" (famously adapted for the big screen as ""2001: A Space Odyssey"") the computer system that went rogue was called HAL 9000, or simply ""HAL"". HAL stands for Heuristically programmed ALgorithmic computer."
P_A,"PGA.    	The Professional Golfers' Association (PGA) was founded in 1916 and today has its headquarters (unsurprisingly) in Florida, where so many golfers live. Back in 1916, the PGA was based in New York City."
_RS,ORS.    	Operating room (OR)
DDA_,"D-DAY.    	The most famous D-Day in history was June 6, 1944, the date of the Normandy landings in WWII. The term ""D-Day"" is used by the military to designate the day on which a combat operations are to be launched, especially when the actual date has yet to be determined. What D stands for seems to have been lost in the mists of time although the tradition is that D just stands for ""Day"". In fact, the French have a similar term, ""Jour J"" (Day J), with a similar meaning. We also use H-Hour to denote the hour the attack is to commence."
_RCO,"ARCO.    	ARCO stands for Atlantic Richfield Company. One of ARCO's claims to fame is that it is responsible for the nation's largest Superfund site. Mining and smelting in the area around Butte, Montana polluted the region's water and soil, and ARCO have agreed to pay $187 million to help clean up the area."
LE_A,"LENA.    	The lovely Lena Olin is a Swedish actress, clearly someone who had acting in her blood. Olin's mother was the actress Britta Holmberg and her father the actor and director Stig Olin. Lena Olin had a very successful career in Sweden, often working with the great Ingmar Bergman. Olin's breakthrough international and English-speaking role was playing opposite Daniel Day-Lewis in ""The Unbearable Lightness of Being"" released in 1988. Way back in 1974, the lovely Miss Olin was crowned Miss Scandinavia in a beauty pageant for Nordic women held in Helsinki, Finland."
R_I,"RPI.    	The Rensselaer Polytechnic Institute (RPI) is a private school in Troy, New York. The university is named after its founder Stephen Van Rensselaer who set up the school in 1824. The goal of RPI has always been the ""application of science to the common purposes of life"", an objective set by the founder. Given that, the name for the school's sports teams is quite apt: the Engineers."
R_I,"ROI.    	Louis XIV is perhaps the most famous of the kings (""rois"") of France, and was known as the ""Sun King"" (le Roi Soleil""). Louis XIV was king from 1638 to 1715, a reign of over 72 years, the longest reign of any European monarch."
_ST,"DST.    	On the other side of the Atlantic, Daylight Saving Time (DST) is known as ""summer time"". The idea behind summer/daylight-savings is to move clocks forward an hour in spring (i.e. 'spring forward') and backwards in the fall (i.e. 'fall back') so that afternoons have more daylight."
IN_E,"INGE.    	Playwright William Inge had a run of success on Broadway in the early fifties. Inge's most celebrated work of that time was the play ""Picnic"", for which he was awarded a Pulitzer Prize. The original 1953 cast of ""Picnic"" included a young male actor making his debut on Broadway. His name was Paul Newman. Many of Inge's works are set in the American heartland and so he became known as the 'Playwright of the Midwest'."
R_X,"REX.    	In the excellent film ""Toy Story"", Rex is of course a tyrannosaurus, and a pretty clumsy one. He is voiced by actor Wallace Shawn, whose name is perhaps less familiar than his face. Shawn played the neighbor on ""The Cosby Show"" as well as many, many other supporting roles on TV and the big screen."
_RE,GRE.    	Passing the Graduate Record Examination is usually a requirement for entry into graduate school here in the US.
N_O,"NEO-.    	By definition, a neoconservative supports the use of American power and military to bring democracy, liberty, equality and human rights to other countries."
_SSEN,"ESSEN.    	I knew a man back in Ireland, a German national from the city of Essen. He had very sad tales to tell from the days of WWII. As a young boy he lost his (socialist) parents during the Nazi purges early in the war. In 1943 he was living with his grandmother and still attending school when he was drafted into the army along with the rest of his class (at 14 years of age). His platoon leader was his school teacher who made a point of tutoring the boys in place of military drilling. One day he was on guard duty with his class/platoon at the dam above the city, and along come the Dam Busters with their bouncing bombs. The raid was successful (from the perspective of the Allies), but he described terrible hardship faced by the people below the dam due to flooding of the farmland that surrounded the factories."
RP_,"RPI.    	The Rensselaer Polytechnic Institute (RPI) is a private school in Troy, New York. The university is named after its founder Stephen Van Rensselaer, who set up the school in 1824. The goal of RPI has always been the ""application of science to the common purposes of life"", an objective set by the founder. Given that, an apt name for the sports teams is the Engineers."
_OI,"ROI.    	Charles I was king (""roi"") of the Franks from 768 to 800. He was known as ""Charles the Great"" or ... Charlemagne."
NA_,"NAS.    	Rapper Nas used to go by another stage name Nasty Nas, and before that by his real name, Nasir bin Olu Dara Jones. He released ""Illmatic"", his first album, in 1994. Not my cup of tea, I would say ..."
U_O,"UFO.    	In 1952, the USAF revived its studies of reported sightings of unidentified flying objects (UFOs) in a program called Project Blue Book. Project Blue Book ran from 1952 until it was shut down in 1969 with the conclusion that there was no threat to national security and that there were no sightings that could not be explained within the bounds of modern scientific knowledge."
RD_,"RDA.    	Recommended Daily Allowances were introduced during WWII, and were replaced by Recommended Daily Intakes in 1997."
AP_,APO.    	Army Post Office.
NP_,"NPR.    	National Public Radio (now just called NPR) was launched in 1970, after President Johnson signed into law the Public Broadcasting Act of 1967. The intent of the act was to provide funding for radio and television broadcasting that wasn't simply driven by profit. As longtime fan of the state-funded BBC in the UK, I'd have to agree with that intent ..."
N_S,"NAS.    	Rapper Nas used to go by another stage name, Nasty Nas, and before that by his real name, Nasir bin Olu Dara Jones. Nas released his first album 'Illmatic' in 1994, and inventively titled his fifth studio album 'Stillmatic', released in 2001. Not my cup of tea, I would say ..."
ST_R,"STAR.    	Proxima Centauri is a mere 4.2 light years away from the Earth, making it the second nearest star to our planet (the Sun, of course, is nearer). The name comes from 'proxima' meaning 'nearest to' and Centauri from the constellation Centaurus to which the star belongs."
_RLE,"ERLE.    	I must have read all of the Perry Mason books when I was in college. I think they kept me sane when I was facing the pressure of exams. Author Erle Stanley Gardner was himself a lawyer, although he didn't get into the profession the easy way. Gardner went to law school, but got himself suspended after a month. So, he became a self-taught attorney and opened his own law office in Merced, California. Understandably, he gave up the law once his novels became successful."
SEG_,"SEGA.    	The Genesis is a video game console sold in the US by the Japanese company Sega. In the rest of the world, the console is sold as the Mega Drive, as Sega couldn't get the rights to the ""Mega Drive: name in the United States."
_RS,"MRS.    	The company known as Mrs. Smith's Pies was founded by Amanda Smith and her son in the 1920s. The Smiths started the company to take advantage of increasing demand for her own fruit pies that she sold at a local YMCA lunch counter in Pottstown, Pennsylvania."
ON_,"ONT.    	In the summer of 2010 I spent a very interesting afternoon watching ships make their way through the Soo Locks and Soo Canal between Lake Superior and the lower Great lakes. The name ""Soo"" comes from the US and Canadian cities on either side of the locks, both called Sault Ste. Marie. "
_RA,"SRA.    	The equivalent of 'Mrs.' in French is 'Mme.' (Madame), in Spanish is 'Sra.' (Señora) and in Portuguese is also 'Sra.' (Senhora)."
T_O,"TKO.    	Muhammad Ali and Joe Frazier had three memorable fights. The first was billed as the ""Fight of the Century"" in 1971 in Madison Square Garden, a fight between two great boxers, both of whom were undefeated up till that point. Frazier won in a unanimous decision after fifteen rounds. A couple of years later, in 1973, Frazier lost his title to George Foreman. Ali and Frazier had a non-title rematch in 1974, with Ali coming out ahead this time, also in a unanimous decision. Later that year, Ali grabbed back the the World Heavyweight Title in ""The Rumble in the Jungle"", the famous ""rope-a-dope"" fight against George Foreman. That set the stage for the third and final fight between Ali and Frazier, ""The Thrilla in Manila"". Ali won the early rounds, but Frazier made a comeback in the middle of the fight. Ali took control at the end of the bout, so much so that Frazier wasn't able to come out of his corner for the 15th and final round. He couldn't come out of his corner because both of his eyes were swollen shut, giving Ali a victory due to a technical knock out (TKO)."
RED_,"REDS.    	Bordeaux is perhaps the wine producing capital of the world. Wine has been produced in the area since the eighth century. Bordeaux has an administrative history too. During WWII, the French government relocated from Paris to the port city of Bordeaux when it became clear that Paris was soon to fall to the Germans. Soon after the capital was famously moved to Vichy while the country was under German rule."
R_I,"RPI.    	The Rensselaer Polytechnic Institute (RPI) is a private school in Troy, New York. The university is named after its founder Stephen Van Rensselaer who set up the school in 1824. The goal of RPI has always been the ""application of science to the common purposes of life"", an objective set by the founder. Given that, the name for the school's sports teams is quite apt: the Engineers."
_RS,ORS.    	Operating Rooms.
_ESS,"TESS.    	""Freaky Friday"" is a well-known children's novel, written by Mary Rodgers and published in 1972. The basic story is that one Friday, a mother and her teenage daughter have their bodies switched due to the effects of an enchated fortune cookie. Hilarity ensues! In the 2003 screen adaptation, Jamie Lee Curtis plays the mother, Dr. Tess Colman, and Lindsay Lohan the daughter, Anna."
_DA,"RDA.    	Recommended Daily Allowances were introduced during WWII, and were replaced by Recommended Daily Intakes in 1997."
LA_,"LAN.    	You may have a Local Area Network (LAN) in your house. If you've got a PC and a router or switch, likely attached to some modem, then you have a LAN."
ATL_S,"ATLAS.    	Charles Atlas's real name was Angelo Siciliano, an Italian who moved to America in his teens. The story he told, and turned into a great advertising campaign, was that as a 97-pound weakling he once had sand kicked into his face by a bully. He went on a bodybuilding regime, developed his muscles, and then marketed the concept across America. He took the name Charles Atlas after he was told that his new-found body looked like that of a statue of the Greek god Atlas sitting on top of a hotel in Coney Island."
