SEG_E,"SEGUE.    	A 'segue' is a transition from one topic to the next. ""Segue"" is an Italian word that literally means ""now follows"". It was first used in musical scores directing the performer to play into the next movement without a break."
D_HLIA,"DAHLIA.    	The Dahlia is a flowering plant native to Mexico and Central America. It was named the national flower of Mexico relatively recently, in 1963."
J_F,"JIF.    	Jif is the leading brand of peanut butter in the US, and has been since 1981. Introduced in 1958, it is now produced by Smuckers."
OI_S,"OILS.    	'The Blue Boy' is the most famous painting by English artist Thomas Gainsborough. The masterpiece can be seen in the Huntington Library in San Marino, California. When Henry Huntington purchased 'The Blue Boy' in 1921, it fetched $728,800, which was a record price for any painting up till then."
MON_,"MONA.    	Leonardo da Vinci's masterpiece that we know in English as the ""Mona Lisa"" is called ""La Gioconda"" in Italian, the language of the artist. It's also known as ""La Joconde"" by the Government of France which owns the painting and displays it in the Louvre Museum in Paris. The title comes from the name of the subject, almost certainly Lisa Gherardini, wife of Francesco del Giocondo. Giocondo was a wealthy silk merchant in Florence who commissioned the painting for the couple's new home to celebrate the birth of their second son."
_NDS,ENDS.    	Ends are football players.
KI_I,KIWI.    	The kiwi is an unusual bird in that it has a highly developed sense of smell and is the only one of our feathered friends with nostrils located at the tip of its long beak.
_ST,CST.    	Central Standard Time (CST)
OTTOMA_,"OTTOMAN.    	Osman I was the man who established the Ottoman Dynasty, with 'Ottoman' coming from the name 'Osman'. This is despite the fact that the ""Ottoman Empire"" came about with the conquest of Constantinople, and that didn't happen until almost 130 years after Osman I died."
DOT_,"DOTS.    	Dots are a brand of gum drops that were introduced to the market in 1945. Dots are produced by Tootsie Roll Industries in Chicago, at a rate of four billion dots per year."
DALE_,"DALEY.    	Richard J. Daley was the Mayor of Chicago for 21 years (1955-1976), making him the longest-serving mayor for the city in history. His son, Richard M. Daley is the current Mayor of Chicago, the second-longest serving mayor."
F_D,"FED.    	An early patent for a parking meter, dated 1928, was for a device that required the driver of the parked car to connect the battery of his or her car to the meter in order for it to operate!"
TIR_,"TIRE.    	Our verb 'to flag' meaning 'to tire' was originally used in the sense of something flapping about lazily in the wind. From this it came to mean 'to go limp, droop', and then 'to tire'."
PAT_,"PATS.    	The New England Patriots football team was founded in 1959 as the Boston Patriots. The 'Patriots' name was selected from suggestions made by football fans in Boston. The team played at several different stadiums in the Boston area for just over ten years, before moving to their current home base in Foxborough, Massachusetts. At the time of the move, the 'Boston' name was dropped and changed to 'New England'."
_ILT,"TILT.    	Tilting is the most recognized form of jousting. Jousting can involve the use of a number of different weapons, but when lances are used the competition is called ""tilting"". Jousting took place in a roped-off enclosure that was called the lists, or list field. In later medieval times, some castles and palaces had purpose-built ""tiltyards"" that were used for jousting. Do you remember where the Beach Volleyball events were held in the 2012 London Olympics? Well that was Horse Guards Parade, the former tiltyard for the Palace of Whitehall that was used in the time of King Henry VIII."
BASR_,"BASRA.    	The H. G. Wells science-fiction take ""The Shape of Things to Come"", written in 1933, predicts a global conflict (WWII) that breaks out on 1940 lasting for ten years, after which chaos reigns as no victor emerges. After worldwide plague, a benevolent dictatorship emerges, and the world moves towards a serene utopia. In time, the dictators are overthrown and peacefully retired, and the people of the Earth live happily ever after, all citizens of one, global state, with its capital in Basra in the Middle East."
_ILCO,"WILCO.    	In the world of radio telephony, 'wilco' is short for 'I understand and will comply'."
_ASER,"LASER.    	The name 'Laser Tag' is really a misnomer as lasers are rarely used in the game. The 'guns' actually send out infrared light, and not laser light, which is picked up by infrared detectors worn by the players."
_TRAIN,"A TRAIN.    	The A Train in the New York City Subway system, runs from 207th Street, through Manhattan, and over to Far Rockaway in Queens. The service lends its name to a jazz standard ""Take the A Train"", the signature tune of Duke Ellington and much sung by Ella Fitzgerald. One version of the lyrics is:"
LI_,"LIV.    	Actress and model Liv Tyler is the daughter of Steven Tyler, lead singer with Aerosmith, and Bebe Buell, a celebrated model and singer. Liv Tyler plays the Elf maiden Arwen Undómiel in Peter Jackson's 'The Lord of the Rings' trilogy."
LAT_,"LATE.    	'The Late Late Show' is a late-night (actually 'early morning') talk show aired by CBS. The show is produced by Worldwide Pants Incorporated, the production company owned by David Letterman. 'The Late Late Show' debuted in 1995 with Tom Snyder hosting. My favorite host was the very funny Scottish comedian Craig Ferguson. Ferguson came to the attention of the American viewing audience playing the office boss, Nigel Wick, on 'The Drew Carey Show'."
B_MBI,"BAMBI.    	""Bambi Meets Godzilla"" is regarded as one of the world's most respected cartoons. It's just two minutes of footage, but everyone loves it apparently."
_ANE,"BANE.    	Today we tend to use the word 'bane' to mean anathema, a source of persistent annoyance. A few centuries ago, a bane was a cause of harm or death, perhaps a deadly poison."
W_RP,"WKRP.    	The sitcom ""WKRP in Cincinnati"" was produced by MTM, the production company established by Mary Tyler Moore and her husband for the ""The Mary Tyler Moore Show"". ""WKRP"" was a successful enough show when it originally aired, but then became a blockbuster in syndication. It became MTM's most-watched program, even outstripping the original ""The Mary Tyler Moore Show""."
MAZD_,MAZDA.    	'Zoom-zoom' is a catchphrase use by the automaker Mazda. Mazda is based in the Hiroshima Prefecture in Japan. The ballpark where the Hiroshima baseball team play was for many years known as the MAZDA Zoom-Zoom Stadium.
KISM_T,"KISMET.    	Kismet' is a Turkish word, meaning fate or fortune, one's lot."
BIN_T,BINET.    	The first usable intelligence test was invented by a French psychologist named Alfred Binet. Binet collaborated with Théodore Simon and together they produced the Binet-Simon Intelligence Scale that is still in use today for IQ tests.
_AMM,"HAMM.    	Jon Hamm lived the life of a struggling actor for quite some time before he hit gold with the starring role in the AMC drama ""Mad Men"". Hamm plays the main character, advertising executive and man about town, Don Draper. I am told by my wife and female friends, that he is quite good looking. I don't see it myself ..."
M_CS,"MOCS.    	""Moc"" is short for 'moccasin' shoe."
T_K,"TEK.    	The 'Tekwar' series of science-fiction novels was co-authored by Ron Goulart and the actor William Shatner, although it's only Shatner's name that appears on the book covers. The stories center around the microchip 'drug' called 'tek' which dominates the Tekwar universe."
SUNN_,SUNNI.    	The Islamic sects of Sunni and Shia Muslims differ in the belief of who should have taken over leadership of the Muslim faithful after the death of the Prophet Muhammad. Followers of the Sunni tradition agree with the decision that the Prophet Muhammad's confidante Abu Bakr was the right choice to become the first Caliph of the Islamic nation. Followers of the Shia tradition believe that leadership should have stayed within the Prophet Muhammad's own family.
_RAM,"ARAM.    	The ancient Biblical land of Aram was named after Aram, a grandson of Noah. Aram was located in the center of modern-day Syria. Aramaic became the everyday language of Syria, Mesopotamia and Palestine."
S_NAT,"SENAT.    	The French Senate ('Sénat') meets in the beautiful Luxembourg Palace ('Palais du Luxembourg') in Paris. There are occasions when both houses of the French Parliament (the Senate and the National Assembly) meet at the Palace of Versailles. This joint session is held for the purpose of voting on revisions to the Constitution, or to listen to an address by the President."
DUE_,DUET.    	'I Got You Babe' is a duet that was released in 1965 by Sonny & Cher. The lyrics and music for the song were written by Sonny Bono himself.
EG_N,"EGON.    	Egon von Furstenberg was a Swiss fashion designer, with quite the bloodline. He belonged to the House of Furstenberg, a reigning family in Germany that dated back to the Holy Roman Empire. Having said that, he began his career as a buyer with Macy's."
CED_R,"CEDAR.    	Cedar is used for the manufacture of some wardrobes and chests as it has long been believed that the fragrant oil in the wood is a moth-repellent. However, whether or not cedar oil is actually effective at keeping moths away seems to be in doubt."
_ERC,"MERC.    	The Mercury brand of car was made by Ford from 1938 until 2011. Mercury was introduced by Henry Ford's son Edsel Ford. Mercury vehicles were positioned as being more luxurious that the regular Ford models, and more economical than Ford's high-end Lincoln models."
EXP_,"EXPO.    	San Diego's Comic-Con was founded in 1970 as the Golden State Comic Book Convention. Held over four days each summer, apparently Comic-Con is the largest show in North America."
_YR,AYR.    	Ayr is a port town on the Firth of Clyde in southwest Scotland. The celebrated poet Robert Burns was born just three miles from Ayr.
INX_,"INXS.    	INXS (pronounced 'in excess') was a rock band from Australia. The band formed in 1977 in Sydney as the Farriss Brothers, as three of the original lineups were indeed brothers."
DE_,"DEW.    	The dew point is a temperature, the temperature to which humid air must be cooled in order for water vapor to condense. We call the condensed water ""dew""."
V_TO,"VETO.    	""Veto"" comes directly from Latin and means ""I forbid"". The word was used by tribunes of Ancient Rome to indicate that they opposed measures passed by the Senate."
_HEE,"THEE.    	Members of the Religious Society of Friends are known as Friends or Quakers. The Christian sect started in England in the 1640s, led by George Fox. The principal tenet at that point was that Christians could have direct experience of Jesus Christ without the mediation of clergy, a reflection of the increasing dissatisfaction with the established church at that time. The term 'Quaker' is thought to have been used earlier in reference to foreign religious sects whose followers were given to fits of shaking during religious fervor. Somehow that term became used for members of the Religious Society of Friends."
VES_,VEST.    	SWAT is an acronym standing for Special Weapons and Tactics. The first SWAT team was pulled together in the Los Angeles Police Department in 1968.
TALES_,"TALESE.    	Nan Talese is an editor working at Doubleday. She is married to author Gay Talese, who is apparently in the process of writing a novel based on their life together."
MIAM_,"MIAMI.    	The city of Miami in Florida takes its name from the nearby Miami River, which is itself named for the Mayaimi Native American people who lived around nearby Lake Okeechobee."
BET_,BETH.    	Beth Israel Medical Center is a teaching hospital in New York City. The facility was founded in 1890 and initially provided services to Jewish immigrants in the Lower East Side tenements.
ELT_RO,"EL TORO.    	'Matador' is a Spanish word used in English for a bullfighter, although the term isn't used in the same way in Spanish. The equivalent in Spanish is ""torero"". ""Matador"" translates aptly enough as 'killer'."
SA_O,"SAGO.    	When I was growing up in Ireland I was very familiar with pearl sago, which is very similar to pearl tapioca. Pearls of sago are simply little balls of sago starch used to make breads, pancakes, biscuits, or the steamed puddings that we ate as kids. Sago comes from pith of the sago palm tree. To get at the starch the tree has to be cut down and the trunk split to reveal the pith. The pith is crushed and manipulated to make the starch available, which is then washed out of a fibrous suspension. One sago palm tree yields about 150-300 kg of starch. Personally I love the stuff, but then, I am a bit weird ..."
MOU_,"MOUE.    	The term 'moue' comes from French, and means a small grimace or a pout."
_AG,"HAG.    	A 'beldam' is an old woman, especially an ugly one. The term was originally used for a grandmother. In Old English, the prefix 'bel-' is used to express a relationship (as in 'grandmother'), and 'dam' is used in the sense of 'mother'."
N_C,"NIC.    	Nic Cage was born Nicolas Coppola. Cage is the nephew of director Francis Ford Coppola and actress Talia Shire, both of whom are his father's siblings."
PLU_O,"PLUTO.    	Pluto was discovered in 1930, and was welcomed as the ninth planet in our solar system. Pluto is relatively small in size, just one fifth of the mass of our own moon. In the seventies, astronomers began to discover more large objects in the solar system, including Eris, a ""scattered disc object"" at the outer reaches. Given that Eris is actually bigger than Pluto, and other objects really aren't that much smaller, Pluto's status as a planet was drawn into question. In 2006 there was a scientific definition for a ""planet"" agreed for the first time, resulting in Pluto being relegated to the status of ""dwarf planet"", along with Eris."
D_N,"DIN.    	It's din-din time, dinner time for the young ones."
RI_E,"RITE.    	The principal act of worship in the Roman Catholic tradition is the Mass. The term 'Mass' comes from the Late Latin word 'missa' meaning 'dismissal'. This word is used at the end of the Latin Mass in 'Ite, missa est' which translates literally as 'Go, it is the dismissal'."
RAR_GAS,"RARE GAS.    	The rare gases are better known as the noble gases, but neither term is really very accurate. Noble gas might be a better choice though, as they are all relatively nonreactive. But rare they are not. Argon, for example, is a major constituent (1%) of the air that we breathe."
_IT,LIT.    	'Blitzed' and 'lit' are slang terms for 'drunk'.
THO_,THOU.    	'G' and 'thou' are slang terms used for a 'thousand'.
LB_,"LBO.    	A leveraged buyout (LBO) is a transaction in which an investor acquires a controlling volume of stock in a company, but buys that stock with borrowed funds (hence ""leveraged""). Often the assets of the acquired company are used as collateral for the borrowed money. There is a special form of LBO known as a management buyout (MBO) in which the company's own management team purchases the controlling interest."
_MN,"RMN.    	President Richard Milhous Nixon (RMN) used 'Milhous' in his name in honor of his mother Hannah Milhous. Richard was born in a house in Yorba Linda, California. You can visit that house today as it is on the grounds of the Richard Nixon Presidential Library. It's a really interesting way to spend a few hours if you ever get to Yorba Linda ..."
_ESEY,"KESEY.    	Ken Kesey wrote the novels ""One Flew Over the Cuckoo's Nest"" and 'Sometimes a Great Notion'. Kesey was one of a group of friends who called themselves the ""Merry Pranksters"", a bunch of guys who were associated with the likes of Jack Kerouac, Allen Ginsberg and Timothy Leary, all icons of the Beat Generation."
SAL_,"SALA.    	A room (sala) is a division (división) of a house (casa), in Spanish."
SH_EK,"SHREK.    	Before ""Shrek"" was a successful movie franchise and Broadway musical, it was a children's picture book called ""Shrek!"" authored and illustrated by William Steig. The title ""Shrek!"" came from the German/Yiddish word Schreck, meaning ""fear"" or ""terror""."
LOE_S,"LOESS.    	Loess is a wind-blown accumulation of silt. ""Loess"" is German in origin and was first used to describe silt along the Rhine Valley."
G_ST,"GEST.    	Our word ""gest"" meaning a great deed or an exploit has been around since about 1300, and comes from the Old French word ""geste"" meaning the same thing. These days ""geste"" can also mean ""gesture""."
SA_,"SAP.    	'Sap' is slang for a fool, someone easily scammed. The term arose in the early 1800s in Britain when it was used in 'saphead' and 'sapskull'. All these words derive from 'sapwood', which is the soft wood found in tree trunks between the bark and the heartwood at the center."
_TORK,"STORK.    	In German and Dutch society, storks resting on the roof of a house were considered a sign of good luck. This tradition led to nursery stories that babies were brought to families by storks."
_NYA,"ANYA.    	Anya Seton was the pen name of Ann Seton, an author of historical romances from New York City. Seton's 1944 novel 'Dragonwyck' was released into theaters in 1946 and starred Gene Tierney and Walter Huston."
B_TH,"BETH.    	'Aleph' is the first letter of the Hebrew alphabet, and 'beth' the second."
U_C,"UNC.    	The University of North Carolina (UNC) at Chapel Hill started enrolling students way back in 1795, making it the oldest public university in the country (the first to enrol students)."
G_RI,"GERI.    	Geri Halliwell was called Ginger Spice because of her red hair when she was with the Spice Girls. Halliwell was quite a bit older than the rest of the group and so sometimes she was less charitably referred to as ""Old Spice""."
HOTE_,"HOTEL.    	There are several Trump International Hotel and Tower properties, in Chicago, Honolulu, New York City and Toronto."
TSEL_OT,"TS ELIOT.    	'The Hippopotamus' is a poem written by T.S. Eliot, of which the first verse is:"
AR_EN,"ARLEN.    	""That Old Black Magic"" is a song written by Harold Arlen with lyrics by Johnny Mercer. The song has been recorded by many artists over the decades, but was first released by Glenn Miller and his Orchestra in 1942."
_TCO,"ATCO.    	Atco Records is an American record label founded in 1955, taking its name from its parent, Atlantic Corporation."
_IE,"CIE.    	""Cie."" is an abbreviation used in French. 'Cie.' is short for ""compagnie"", the French word for ""company"", and is used as we would use ""Co."""
C_UZ,"CRUZ.    	US Senator Ted Cruz served as Solicitor General for the state of Texas before heading to Washington. Cruz was appointed Solicitor General in 2003 at the age of 32, making him the youngest Solicitor General in the country. Famously, Cruz is an opponent of the Affordable Care Act and made a speech in 2013 in the US Senate on the subject that lasted for 21 hours and 19 minutes. It was the fourth longest speech in the history of the Senate."
ELL_RY,"ELLERY.    	The Ellery Queen series of detective novels was somewhat unique in that Ellery Queen was the hero of the tales, and was also the pen name of the author. Actually, the 'author' was a pair of writers; two cousins from Brooklyn, New York."
TSEL_OT,"TS ELIOT.    	The author T. S. Eliot was the son of Henry Ware Eliot and Charlotte Champe Stearns, so his full name was Thomas Stearns Eliot (TSE)."
ST_R,"STIR.    	'Kerfuffle' comes from the Scottish 'curfuffle', with both words meaning 'disruption'."
_UBLE,"RUBLE.    	The ruble (also 'rouble') is the unit of currency in Russia, as well as several other countries of the former Soviet Union. One ruble is divided into one hundred kopecks."
O_DIE,"OLDIE.    	The singer Prince was born in Minneapolis, and he lives there to this day. He took his name from his father, a jazz musician who used the stage name Prince Rogers."
UVU_A,"UVULA.    	The uvula is that conical fleshy projection hanging down at the back of the soft palate. The uvula plays an important role in human speech, particularly in the making of ""guttural"" sounds. The Latin word for ""grape"" is ""uva"", so ""uvula"" is a ""little grape""."
POLI_,"POLIO.    	Future president Franklin D. Roosevelt developed polio in 1921, when he was in his late thirties. He picked up the viral disease while on vacation in Campobello Island in Canada."
_IP,"DIP.    	Guacamole is one of my favorite dishes, and is made by mashing avocados and perhaps adding the likes of tomato, onion and lime juice. The guacamole recipe dates back as early as the 16th century, to the time of the Aztecs. 'Guacamole' translates as 'avocado sauce'."
_HOU,"THOU.    	There is a superstition in the theatrical world that uttering the name 'Macbeth' in a theater will bring disaster of some sort. To avoid this, the euphemism 'the Scottish Play' is used instead."
K_LN,"KOLN.    	Cologne is the fourth largest city in Germany, and is known as 'Koln' in German."
VES_,"VEST.    	Here's another word that often catches me out. What we call a vest in the US is a waistcoat back in Ireland. And the Irish use the word ""vest"" for an undershirt."
PA_S,"PATS.    	The New England Patriots football team was founded in 1959 as the Boston Patriots. The 'Patriots' name was selected from suggestions made by football fans in Boston. The team played at several different stadiums in the Boston area for just over ten years, before moving to their current home base in Foxborough, Massachusetts. At the time of the move, the 'Boston' name was dropped and changed to 'New England'."
A_C,ACC.    	Atlantic Coast Conference (ACC)
_AD,"PAD.    	Back in the 16th century a ""pad"" was a bundle of straw to lie on, and came to mean a ""sleeping place"" in the early 1700s. The term was revitalized in the hippie era."
C_RP,"CARP.    	The word ""carp"" used to mean simply ""talk"" back in the 13th century, with its roots in the Old Norwegian ""karpa"" meaning ""to brag"". A century later the Latin word ""carpere"" meaning ""to slander"" influenced the use of ""carp"" so that it came to mean ""find fault with""."
ARPE_,ARPEL.    	The Adrien Arpel cosmetic company was founded in 1962 and sold its products across Europe. The company started selling in the US in 1968.
IRE_A,"IRENA.    	""The Faerie Queene"" is an epic poem by Edmund Spenser, one of the longest poems written in the English language."
ENT_NTE,"ENTENTE.    	An 'entente cordiale' (sometimes just 'entente') is a friendly understanding, usually between two nations. The term, which translates from French as 'cordial agreement', was first used to describe a set of agreements between the UK and France in 1904."
_DEA,"ODEA.    	In Ancient Greece an odeon (also 'odeum') was like a small theater, with ""odeon"" literally meaning a ""building for musical competition"". Odea were used in both Greece and Rome for entertainments such as musical shows and poetry readings."
_ED,GED.    	The General Educational Development (GED) tests are a battery of five tests designed to demonstrate that a student has the academic skills of someone who has graduated from an American or Canadian high school.
HOTE_,"HOTEL.    	The W chain of hotels is luxury brand owned by Starwood. Aimed at a younger market, the W properties feature modern, minimalist decor. There's also a 'trendy' use of the letter W throughout the hotels. For example, the pool is called 'the Wet', the laundry bag in each is 'the Wash' and the concierge goes by the name 'Whatever Whenever'."
OR_S,ORES.    	Metalliferous is such a lovely-sounding word. I means 'containing metal' and is a term used to describe ores rich in metal.
MO_A,"MONA.    	'Pretty Little Liars"" is a mystery drama TV series aimed at teens. It is based on a series of novels penned by Sara Shepard."
UDO_,UDON.    	Udon noodles are made from wheat-flour and are very popular in Japanese cuisine like tempura.
DENE_,"DENEB.    	Deneb is the brightest star in the constellation called Cygnus, the Swan. The name ""Deneb"" comes from the Arabic word ""dhaneb"" meaning 'tail', as it lies at the tail of the swan."
BLAN_,"BLANC.    	Mel Blanc was known as ""The Man of a Thousand Voices"". We've all heard Mel Blanc at one time or another, I am sure. His was the voice behind such cartoon characters as Bugs Bunny, Daffy Duck, Porky Pig, Tweety Bird, Woody Woodpecker, Elmer Fudd and Barney Rubble. And the words on Blanc's tombstone are ... ""That's All Folks""."
LI_O,"LILO.    	""Lilo & Stitch"" was released by Disney in 2002. Compared to other Disney feature-length cartoons, ""Lilo & Stitch"" was relatively cheaply produced, using the voices of lesser-known actors. One interesting change had to take place in the storyline during production, when Lilo was meant to fly a Jumbo Jet through downtown Honolulu in one sequence. This was replaced with a sequence using a spaceship instead, as the producers were sensitive to public sentiment after the September 11 attacks."
DIO_E,"DIODE.    	A Light Emitting Diode (LED) is a specialized form of semiconductor that when switched on releases photons (light). LEDs were used in early digital watches, and are getting more and more popular even though their use in electronic equipment is fading away. LEDs are used now as a replacement for the much less efficient tungsten light bulb. I replaced all of my tungsten Xmas lights a few years ago and saved a lot on my electricity bill."
