_LC,TLC.    	Tender loving care (TLC).
AGR_,AGRA.    	The Indian city of Agra is home to three UNESCO World Heritage Sites:
U_AL,URAL.    	Ural Airlines is based in Koltsovo International Airport in central Russia.
IDE_,"IDES.    	Julius Caesar was assassinated on the 15th (the ides) of March, 44 BC. He was attacked by a group of sixty people in the Roman Senate, and was stabbed 23 times. The first to strike a blow was Servilius Casca, who attacked Caesar from behind and stabbed him in the neck. In Shakespeare's 'Julius Caesar', Casca utters the words 'Speak, hands, for me!' just before making the fatal blow. The following line, uttered by Caesar, is more famous though, directed towards Brutus: 'Et tu, Brute?'"
U_SA,"URSA.    	The constellation called Ursa Major (Latin for ""Larger Bear"") is often just called the Big Dipper because of its resemblance to a ladle or dipper. Ursa Major also resembles a plow, and that's what we usually call the same constellation back in Ireland: the ""plough""."
ETT_,"ET TU.    	It was Shakespeare who used the words ""Et tu, Brute?"" (And you, Brutus?), in his play ""Julius Caesar"" although the phrase was around long before he penned his drama. It's not known what Julius Caesar actually said just before he was assassinated on the steps of the Senate in Rome."
AGR_,AGRA.    	The Indian city of Agra is home to three UNESCO World Heritage Sites:
O_EO,"OLEO.    	Emperor Louis Napoleon III of France announced a competition to develop a substitute for butter, a substitute that would be more accessible to the lower classes and more practical for the armed forces. In 1869, a French chemist called Hippolyte Mege-Mouries came up with something that he called oleomargarine, which was eventually manufactured under the trade name ""margarine"". The name ""oleomargarine"" also gives us our generic term ""oleo""."
EDA_,"EDAM.    	Edam cheese takes its name from the Dutch town of Edam in North Holland. The cheese is famous for its coating of red paraffin wax, a layer of protection that helps Edam travel well and prevents spoiling. You might occasionally come across an Edam cheese that is coated in black wax. The black color indicates that the underlying cheese has been aged for a minimum of 17 weeks."
_TS,ETS.    	One might speculate that an unidentified flying object (UFO) is flown by an extraterrestrial (ET).
UR_L,URAL.    	The eastern side of the Ural Mountains in Russia is generally regarded as the natural divide between the continents of Europe and Asia.
OT_,"OTT.    	At 5' 9"", Mel Ott weighed just 170 lb (I don't think he took steroids!) and yet he was the first National League player to hit over 500 home runs. Sadly, Ott died in a car accident in New Orleans in 1958 when he was only 49 years old."
U_NA,"ULNA.    	The radius and ulna are bones in the forearm. If you hold the palm of your hand up in front of you, the radius is the bone on the ""thumb-side"" of the arm, and the ulna is the bone on the ""pinkie-side""."
A_AN,"ALAN.    	Alan Rickman is a marvelous English actor, famous for playing bad guy Hans Gruber in the original ""Die Hard"" film, Severus Snape in the ""Harry Potter"" series and my personal favorite, Eamon de Valera in ""Michael Collins""."
N_AA,"NCAA.    	The National Collegiate Athletic Association (NCAA) dates back to the Presidency of Theodore Roosevelt. When his son broke his nose playing football at Harvard, President Roosevelt turned his attention to the number of serious injuries and even deaths occurring in college sports. He instigated meetings between the major educational institutions leading to the formation of the Intercollegiate Athletic Association of the United States (IAAUS) in 1906, which was given the remit of regulating college sports. The IAAUS became the NCAA in 1910."
EL_A,"ELLA.    	Memorex is now a brand of data storage products owned by Imation. Memorex started out in 1961 in Silicon Valley as a company making computer tapes, eventually adding storage disks and other media to its portfolio of products. A famous advertising campaign featured singer Ella Fitzgerald singing a note that shattered a glass. A recording of that note was then played, which also shattered the glass. The tag line to the ad became very famous: Is it live, or is it Memorex?'"
E_AM,"EDAM.    	Edam cheese takes its name from the Dutch town of Edam in North Holland. The cheese is famous for its coating of red paraffin wax, a layer of protection that helps Edam travel well and prevents spoiling. You might occasionally come across an Edam cheese that is coated in black wax. The black color indicates that the underlying cheese has been aged for a minimum of 17 weeks."
OT_E,OTOE.    	The Native American people known as the Otoe were the first tribe encountered by the Lewis and clark Expedition. The meeting took place at a point on the Missouri River that is now known as Council Bluff.
AL_E,"ALEE.    	""Alee"" is the direction away from the wind. If a sailor points into the wind, he or she is pointing ""aweather""."
IR_N,IRAN.    	The UN Security Council imposed sanctions on Iran in 2006 because Iran refused to suspend its uranium enrichment program.
OA_U,OAHU.    	The 'Iolani Palace in downtown Honolulu is unique within this country. It is the only royal palace in the US that was used as an official residence by a reigning monarch. The Kingdom of Hawaii was overthrown in 1893 so the palace was used by successive governments even after Hawaii was awarded statehood in 1959. The palace has been a public museum since 1978.
ER_,ERS.    	Emergency Rooms (ERs)
_PAL,"OPAL.    	97% of the world's opals come from Australia, so it's no surprise perhaps that the opal is the national gemstone of the country. The state of South Australia provides the bulk of the world's production, about 80%."
AVO_,"AVON.    	The River Avon that flows in the southwest of England is sometimes referred to as the Lower Avon or Bristol Avon. The extra wording is to distinguish it from a number of other River Avons in the country, including the famous one through William Shakespeare's Stratford. The Lower Avon passes through the cities of Bristol and Bath."
AL_E,"ALEE.    	""Alee"" is the direction away from the wind. If a sailor points into the wind, he or she is pointing ""aweather""."
SR_,SRI.    	'Sri' is a title of respect for a male in India.
AGE_,"AGEE.    	Jon Agee is a writer who seems to like words. He writes books for children such as 'Palindromania!', which is a celebration of palindromes. He also wrote 'Smart Feller Fart Smeller', which is filled with spoonerisms."
_MAR,"OMAR.    	The character Omar Little is played by Michael K. Williams on the HBO series called ""The Wire"". I didn't watch ""The Wire"" when it first aired but we ending up buying all five series on DVD and we watched the whole thing a couple of years ago. It's is a great drama series, and I thoroughly recommend it. Personally, I think that HBO produces some of the best dramas on American television."
SO_,"SOT.    	Alky is a slang word for alcoholic, a sot."
EN_D,"ENID.    	Enid, Oklahoma takes its name from the old railroad station around which the city developed. Back in 1889, that train stop was called Skeleton Station. An official who didn't like the name changed it to Enid Station, using a character from Alfred Lord Tennyson's ""Idylls of the King"". Maybe if he hadn't changed the name, the city of Enid would now be called Skeleton, Oklahoma! Enid has the nickname ""Queen Wheat City"" because is has a huge capacity for storing grain, the third largest grain storage capacity in the world."
O_EO,"OLEO.    	The Unilever brand of margarine that we know as Promise here in the US is sold as Becel in much of the word, including Canada. Back in the UK and ireland we call the same product Flora."
TER_,TERI.    	Teri Polo's most prominent role on the big screen was Pam Focker in 'Meet the Fockers' and its sequel. Pam is the wife of the character played by Ben Stiller.
ESS_,"ESSE.    	The Latin term ""in esse"" is used to mean ""actually existing"", and translates as ""in being""."
S_T,"SOT.    	Our word ""sot"" comes from the Old English ""sott"", meaning a fool. The word ""sot"" started to be associated with alcohol and not just foolery in the late 1500s."
_MIR,"EMIR.    	In English, emir can also be written as amir and ameer (watch out for those spellings in crosswords!)."
S_TS,"SSTS.    	The most famous supersonic transport (SST) is the retired Concorde. Concorde was developed and produced under an Anglo-French treaty by France's Aérospatiale and the UK's British Aircraft Corporation (BAC). Concordes were mainly operated by Air France and British Airways, with both companies buying the planes with substantial subsidies from the French and British governments."
I_ES,"IDES.    	Julius Caesar was assassinated on the 15th (the ides) of March, 44 BC. He was attacked by a group of sixty people in the Roman Senate, and was stabbed 23 times. The first to strike a blow was Servilius Casca, who attacked Caesar from behind and stabbed him in the neck. In Shakespeare's 'Julius Caesar', Casca utters the words 'Speak, hands, for me!' just before making the fatal blow. The following line, uttered by Caesar, is more famous though: 'Et tu, Brute?'"
NC_A,"NCAA.    	March Madness is the name given to (among others) the NCAA Men's Division 1 Basketball Championship, held in spring each year."
_EA,"SEA.    	The Arabian Sea is an arm of the Indian Ocean that lies off the south coasts of Pakistan and Iran, and is bounded in the west by Somalia, and in the east by India."
IDE_,"IDES.    	There were three important days in each month of the old Roman calendar. These days originally depended on the cycles of the moon but were eventually ""fixed"" by law. ""Kalendae"" were the first days of each month, originally the days of the new moon. ""Nonae"" (nones) were originally the days of the half moon. And ""idus"" (the ides) was originally the day of the full moon, eventually fixed at the 15th day of a month. Well, actually the ides were the 15th day of March, May, July and October. For all other months, the ides fell on the 13th. Go figure ..."
OT_E,"OTOE.    	The Otoe (also Oto) Native American tribe originated in the Great Lakes region as part of the Winnebago or Siouan tribes. The group that would become the Otoe broke away from the Winnebago and migrated southwestwards ending up in the Great Plains. In the plains the Otoe adopted a semi-nomadic lifestyle dependent on the horse, with the American bison becoming central to their diet."
_LE,"ILE.    	The island of Saint Martin is in the Caribbean. If one wants to write the island's name in French, then the spelling doesn't change, but there is a hyphen placed between the two words: Saint-Martin."
SO_,"SOL.    	The solfa syllables are: do, re, mi, fa, sol, la & ti. The solfa scale was developed from a six-note ascending scale created by Guido of Arezzo in the 11th century. He used the first verse of a Latin hymn to name the syllables of the scale:"
A_RA,"AGRA.    	The most famous mausoleum in the world has to be the Taj Mahal in Agra, India. The Taj Mahal was built after the death of the third wife of Shah Jahan, Mumtaz Mahal (hence the name of the mausoleum). The poor woman died in childbirth delivering the couple's 14th child."
_OT,"SOT.    	Our word ""sot"" comes from the Old English ""sott"", meaning a fool. The word ""sot"" started to be associated with alcohol and not just foolery in the late 1500s."
_TTU,"ET TU.    	It was Shakespeare who wrote the words ""Et tu, Brute?"" (And you, Brutus?), in his play ""Julius Caesar"" although the phrase was around long before he penned his drama. It's not known what Julius Caesar actually said just before he was assassinated on the steps of the Senate in Rome."
UR_L,"URAL.    	The Ural River rises in the Ural Mountains in Russia and flows for half its length through Russian territory until it crosses the border into Kazakhstan, finally emptying into the Caspian Sea."
_ST,"HST.    	The phrase ""passing the buck"" supposedly comes from poker. The marker that indicated whose turn it was to deal was called the buck, and it was passed from player to player. The phrase of course came to mean the passing of responsibility (or usually blame). President Harry S. Truman popularized the derivative phrase ""the buck stops here"" by placing a sign bearing those words on his desk in the Oval Office. That same sign was still on the desk when President Carter was in office."
A_ON,"AVON.    	Avon was a noted publisher of comic books and paperbacks. The company was founded in 1941, and focused on pretty low-brow literature designed for popular appeal."
_TT,"OTT.    	At 5' 9"", Mel Ott weighed just 170 lb (I don't think he took steroids!) and yet he was the first National League player to hit over 500 home runs. Sadly, Ott died in a car accident in New Orleans in 1958 when he was only 49 years old."
I_EA,"IKEA.    	I think the idea is that furniture purchased from IKEA needs to be assembled, needs some manual work. Or, one has to refer to instructions in a 'manual' to assemble the items."
_LAN,"ALAN.    	Alan Rickman is a marvelous English actor, famous for playing bad guy Hans Gruber in the original ""Die Hard"" film, Severus Snape in the ""Harry Potter"" series and my personal favorite, Eamon de Valera in ""Michael Collins""."
E_S,ETS.    	'Et' is French for 'and'.
ID_S,"IDES.    	There were three important days in each month of an old, Roman calendar. These days originally depended on the cycles of the moon, but were eventually ""fixed"" by law. Kalendae were the first day of each month, originally the day of the new moon. Nonae were originally the day of the half moon. And idus (the ides) was originally the day of the full moon, eventually fixed as the 15th day of the month. Well, the ides were the 15th day of March, May, July and October. For all other months, the ides fell on the 13th. Go figure ..."
OP_L,"OPAL.    	Here is the ""official"" list of birthstones by month, that we tend to use today:"
TE_I,TERI.    	Teri Polo's most prominent role on the big screen was Pam Focker in 'Meet the Fockers' and its sequel. Pam is the wife of the character played by Ben Stiller. Polo also played the wife of Presidential candidate Matt Santos in 'The West Wing'.
EL_A,"ELLA.    	Scat singing is a vocal improvisation found in the world of jazz. There aren't any words as such in scat singing, just random nonsense syllables made up on the spot."
OMA_,"OMAR.    	The character Omar Little is played by Michael K. Williams on the HBO series called ""The Wire"". I didn't watch ""The Wire"" when it first aired but we ending up buying all five series on DVD and we watched the whole thing a couple of years ago. It's is a great drama series, and I thoroughly recommend it. Personally, I think that HBO produces some of the best dramas on American television."
EST_E,"ESTEE.    	Estée Lauder was a very successful businesswoman, with a reputation as a great salesperson. Lauder introduced her own line of fragrances in 1953, a bath oil called ""Youth Dew"". ""Youth Dew"" was marketed as a perfume, but it was added to bathwater. All of a sudden women were pouring whole bottles of Ms. Lauder's ""perfume"" into their baths while using only a drop or two of French perfumes behind their ears. That's quite a difference in sales volume ..."
RE_,"RES.    	""Res"" is the Latin for ""thing"". ""Res"" is used in a lot of phrases in the law."
IP_,"IPO.    	IBM was founded as the Tabulating Machine Company in 1896. It changed its name to the Computing Tabulating Recording Corporation (CTR) in 1911, and was listed on the New York Stock Exchange in 1916. The name of International Business Machines was given first to the Canadian subsidiary, and then the South American subsidiary. In 1924, it was decided to adopt the International Business Machines name for the whole company. Good choice ..."
O_HU,"OAHU.    	Punchbowl Crater in Honolulu is home to the National Memorial Cemetery of the Pacific. Among those interred there is the astronaut Ellison Onizuka, killed in the Space Shuttle Challenger disaster, and Ernie Pyle, the celebrated war correspondent."
N_T,NAT.    	Nat Hentoff writes regularly on jazz and country music for 'The Wall Street Journal'.
ES_,EST.    	'Est' is the French word 'east'.
_GRA,"AGRA.    	The most famous mausoleum in the world has to be the Taj Mahal in Agra, India. The Taj Mahal was built after the death of the third wife of Shah Jahan, Mumtaz Mahal (hence the name of the mausoleum). The poor woman died in childbirth delivering the couple's 14th child."
_ST,"SST.    	The most famous Supersonic Transport (SST) was the Concorde, a plane that's no longer flying. Concorde had that famous ""droop nose"". The nose was moved to the horizontal position during flight to create the optimum aerodynamic shape thereby reducing drag. It was lowered during taxi, takeoff and landing, so that the pilot had better visibility. The need for the droop nose was driven largely by the delta-shaped wings. The delta wing necessitates a higher angle of attack at takeoff and landing than conventional wing designs, so the pilot needed the nose lowered so that he or she could see the ground."
_RS,ERS.    	Emergency Room (ER)
DE_,"DES.    	Des Plaines, Illinois is a suburb of Chicago sitting right next to O'Hare International Airport. Sadly, it was the site of a famous airliner disaster when American Airlines Flight 191 crashed just after takeoff from O'Hare in 1979. All 271 people on board perished, as two people on the ground."
S_T,"SST.    	The most famous Supersonic Transport (SST) was the Concorde, a plane that's no longer flying. Concorde had that famous ""droop nose"". The nose was moved to the horizontal position during flight to create the optimum aerodynamic shape thereby reducing drag. It was lowered during taxi, takeoff and landing, so that the pilot had better visibility. The need for the droop nose was driven largely by the delta-shaped wings. The delta wing necessitates a higher angle of attack at takeoff and landing than conventional wing designs, so the pilot needed the nose lowered so that he or she could see the ground."
R_NO,"RENO.    	Janet Reno was Attorney General of the US from 1993 to 2001. Reno was the person to hold the office second longest, and was our first female Attorney General. In 2002, Reno ran for Governor of Florida but failed to win the Democratic nomination. Thereafter she retired from public life."
_TS,ETS.    	An Unidentified Flying Object might be crewed by Extra-Terrestials.
ES_,"EST.    	'Id est' is Latin for 'that is', and is often abbreviated to 'i.e.' when used in English."
_MIR,"EMIR.    	Qatar is a sovereign state in the Middle East occupying the Qatar Peninsula, itself located in the Arabian Peninsula. Qatar lies on the Persian Gulf and shares one land border, with Saudi Arabia to the south. Qatar has more oil and gas reserves per capita of population than any other country in the world. In 2010, Qatar had the fastest growing economy in the world, driven by the petrochemical industry."
YE_,"YEN.    	The word ""yen"", meaning ""urge"", has been around in English since the very early 1900s. It comes from the earlier word ""yin"" imported from Chinese, which was used in English to describe an intense craving for opium!"
_ERI,TERI.    	Teri Polo's most prominent role on the big screen was Pam Focker in 'Meet the Fockers' and its sequel. Pam is the wife of the character played by Ben Stiller.
S_L,"SOL.    	The solfa syllables are: do, re, mi, fa, sol, la & ti."
_PO,"IPO.    	An Initial Public Offering (IPO) is the very first offer of stock for sale by a company on the open market. In other words, an IPO marks the first time that a company is traded on a public exchange. Companies have an IPO to raise capital to expand (usually)."
_OL,"SOL.    	Spain's Costa del Sol (""Coast of the Sun"") is in Andalusia in the South of Spain. It lies sandwiched between two other ""costas"", the Costa de la Luz and the Costa Tropical. The city of Malaga is on the Costa del Sol, as well as the famous European tourist destinations of Torremolinos and Marbella. The Costa del Sol was made up of sleepy little fishing villages until the 1980s when the European sunseekers descended on the region. I wouldn't recommend it for a holiday ..."
_RS,ERS.    	Emergency rooms (ERs)
ELI_,"ELIA.    	Charles Lamb published a famous collection of essays simply entitled ""Essays of Elia"". Elia was actually a clerk and co-worker of Charles Lamb, whereas Lamb was the author."
O_HA,"OSHA.    	The Occupational Safety and Health Administration (OSHA) was created in 1970 during the Nixon administration. OSHA regulates workplaces in the private sector and regulates just one government agency, namely the US Postal Service."
ST_N,"STAN.    	Stan Musial is a retired baseball player who went by the nickname ""Stan the Man"", a moniker he was awarded by the Brooklyn dodgers fans in 1946. Apparently, off the field Stan is quite the harmonica player."
_VE,"AVE.    	The street names in the US version of Monopoly are locations in or around Atlantic City, New Jersey. Many of those street names are come from the names of US states e.g. Illinois Avenue and New York Avenue. "
OD_N,"ODIN.    	In Norse mythology, Valhalla (""hall of the slain"") is a gigantic hall in the ""world"" of Asgard. Asgard and Valhalla are ruled by the god Odin, the chief Norse god."
IRA_,"IRAN.    	Argo' is a 2012 movie that is based on the true story of the rescue of six diplomats hiding out during the 1979 Iran hostage crisis. The film was directed by and stars Ben Affleck and is produced by Grant Heslov and George Clooney, the same pair who produced the excellent 'Good Night, and Good Luck'. I saw 'Argo' recently and recommend it highly, although I found the scenes of religious fervor pretty frightening ..."
IRA_,IRAN.    	The Persian Gulf is in effect an inland sea although it technically is an offshoot of the Indian Ocean. The outlet from the Persian Gulf to the Indian Ocean is one of the most famous maritime 'choke points' in the world: the Strait of Hormuz. About 20% of the world's supply of petroleum passes through the Strait of Hormuz.
MR_,"MRI.    	A CT (or ""CAT"") scan produces (via computer manipulation) a three dimensional image of the inside of an object, usually the human body. It does so by taking a series of two dimensional x-ray images while rotating the camera around the patient. The issue with CT scans is that they use x-rays, and high doses of radiation can be harmful causing damage that is cumulative over time. An MRI on the other hand (Magnetic Resonance Imaging) uses powerful magnetic fields to generate its images so there is no exposure to ionizing radiation (such as X-rays). We used MRI equipment in our chemistry labs at school, way back in the days when the technology was still called Nuclear Magnetic Resonance Imaging (NMRI). Apparently the marketing folks didn't like the term ""nuclear"" because of its association with atomic bombs, so now it's just called MRI."
_LLA,"ELLA.    	""Ella Enchanted"" is the title of a fantasy novel written by Gail Carson Levine, and published in 1997. It is a retelling of the story of Cinderella, with lots of mythical creatures added. A film adaptation was released in 2004, starring Anne Hathaway in the title role."
OP_RA,"OPERA.    	La Scala Opera House opened in 1778. It was built on the site of the church of Santa Maria della Scala, which gave the theater its name: ""Teatro alla Scala"" in Italian."
N_SA,"NASA.    	The famous headland in Florida called Cape Canaveral was named by Spanish explorers in the early 16th century. As the Cape acts as a launching station for many of NASA's rockets, when President Kennedy was assassinated in 1963 the NASA facility on nearby Merritt Island was renamed the Kennedy Space Center, and President Johnson went as far as renaming the whole of Cape Canaveral to Cape Kennedy. The name change for the cape didn't go down well in Florida though, as the headland had been called Cape Canaveral for over 400 years. So, the name was restored in 1973, and Cape Kennedy is no more."
H_T,HST.    	President Harry S. Truman once said:
ENI_,"ENID.    	Enid Blyton wrote stories for children that were very popular when I was growing up in the British Isles. Just a few months ago I purchased and reread my favorite of her stories growing up, ""The Secret Island""."
_RI,SRI.    	'Sri' is a title of respect for a male in India.
ODI_,"ODIN.    	In Norse mythology, Odin was the chief of the gods. Odin's wife Frigg was the queen of Asgard whose name gave us our English term ""Friday"" (via Anglo-Saxon). Odin's son was Thor, and his name gave us the term ""Thursday""."
E_AL,"ET AL.    	Et alii is the equivalent of et cetera, with et cetera being used in place of a list of objects, and et alii used for a list of names."
T_C,TLC.    	Tender Loving Care.
APS_,"APSE.    	The apse of a church or cathedral is a semicircular recess in an outer wall, usually with a half-dome as a roof, and often where there resides an altar. Originally, apses were used as burial places for the clergy and also for storage of important relics."
_AHU,"OAHU.    	Despite rumors to the contrary, I am pretty sure that Barack Hussein Obama II was indeed born in Hawaii. President Obama was born on August 4, 1961 at Kapi'olani Maternity & Gynecological Hospital in Honolulu, Hawaii."
ALE_,"ALEE.    	""Alee"" is the direction away from the wind. If a sailor points into the wind, he or she is pointing ""aweather""."
