_AMON,"RAMON.    	Ramón Novarro was a Mexican actor who made it big in Hollywood in the Silent Era. Novarro often played the ""Latin lover"" and was noted for his good looks. His most successful film was in the 1925 version of ""Ben-Hur"", when he caused quite a sensation by wearing very revealing costumes. Novarro was gay, something that caused him a lot of trouble in his career given the times. In 1968 he hired two young men through an agency to come to his L.A. home for sex, but the two brothers tortured Novarro for hours in the belief that he had a large sum of money in the house. Novarro choked to death on his own blood after the brutal beating, and the murderers left with just twenty dollars in cash."
_HIV,SHIV.    	'Shiv' is a slang term for a weapon crudely fashioned to resemble a knife. Mostly we hear of shivs that have been fashioned by prison inmates to do harm to others.
A_RAS,"ATRAS.    	Fortunately for crossword constructors, the Atra razor was introduced by Gillette in 1977. The Atra was sold as the Contour in some markets and its derivative products are still around today."
D_LAURA,"DR LAURA.    	According to Dr. Laura Schlessinger herself, her radio show ""preaches, teaches, and nags about morals, values and ethics."""
M_LT,"MALT.    	Malt is germinated cereal grains that have been dried. The cereal is germinated by soaking it in water, and then germination is halted by drying the grains with hot air."
MAESTR_,"MAESTRO.    	'Maestro' is often used to address a musical conductor. 'Maestro' (plural 'maestri') is the Italian word for 'master, teacher'. The plural in English is usually 'maestros'."
S_LTI,"SOLTI.    	Sir Georg Solti was a great Hungarian-British conductor, who spent 22 years as music director of the Chicago Symphony, one of many prestigious positions he held in the world of classical music and opera. Solti was awarded 31 Grammy Awards, the most won by any individual in any genre of music. I think it's kind of cool that Solti's name comprises two notes in the solfa scale: sol-ti ..."
SH_VA,"SHIVA.    	The Hindu Trinity is Brahma the creator, Vishnu the maintainer or preserver, and Shiva (also Siva) the destroyer or transformer. Shiva is a Sanskrit word meaning ""auspicious, kind, gracious""."
ARC_ER,"ARCHER.    	Sagittarius is a constellation of the zodiac, with 'sagittarius' being the Latin for 'archer'. The constellation is usually represented by a centaur (half-bull, half-man) with a bow."
BOI_E,"BOISE.    	The city of Boise is in Idaho, which has postal abbreviation 'ID'."
_RVIN,"IRVIN.    	American film director Irvin Kershner directed well-recognized films, including ""The Empire Strikes Back"" and ""RoboCop 2""."
J_SE,"JOSE.    	The Santa Clara Valley, just a few miles from me at the south of San Francisco Bay, is better known as ""Silicon Valley"". The term ""Silicon Valley"" dates back to 1971 when it was apparently first used in a weekly trade newspaper called ""Electronic News"" in articles written by journalist Don Hoefler."
REB_,"REBS.    	The Battle of Chickasaw Bayou was fought in December 1862 during the Civil War. It was the opening engagement of the Vicksburg Campaign that was later deemed to be a turning point in the war. Although the Confederate forces emerged victorious at Chickasaw Bayou, the Union forces prevailed in the end, taking Vicksburg six months later."
RHY_,"RHYS.    	""Wide Sargasso Sea"" was written by Jean Rhys and first published in 1966. It's a clever work, written as a sort of prequel to Charlotte Bronte's famous ""Jane Eyre"" which dates back to 1847."
TAMI_,"TAMIL.    	Tamils are a large ethnic group of almost 80 million people who speak Tamil as their mother tongue. Despite the large Tamil population, there is no Tamil state. The highest concentration of Tamils is in Sri Lanka, where they make up about 25% of the population."
CI_O ,"CIAO!.    	""Ciao"" is Italian for ""'bye"". ""Arrivederci"" is more formal, and translates as ""goodbye""."
DIET_ODA,"DIET SODA.    	Even though Coca-Cola Zero is in the category of ""diet soda"", the marketing folks at Coca-Cola don't like its association with the word ""diet"". The target market for the beverage is young, adult males, so it is described as ""calorie-free"" rather than ""diet"", the assumption being that males associate ""diet"" with women. Not in this house ..."
_NLY,"ONLY.    	NPR's flagship sports program is ""Only a Game "", hosted by Bill Littlefield and aired on Saturdays."
I_ADORE,"ISADORE.    	Isadore ""Issy"" Sharp is the founder and chairman of Four Season Hotels. Four Seasons is a Canadian company, headquartered in Toronto."
TY_,"TYR.    	Týr is the Norse god of single combat, victory and heroic glory."
_YE,"AYE.    	'Aye' sounds like 'I', which is a letter in the the alphabet. And (as ""Ed Z"" kindly pointed out in a comment below), the letter I isn't in the word ""aye""."
STRO_,"STROM.    	Strom Thurmond was a US Senator for the state of South Carolina for 48 years, until he stepped down in 2003. Thurmond was the oldest-serving senator in US history. He retired from his office at the age of 100-years-old, and passed away just a few months after leaving Washington."
T_TS,TKTS.    	Ticket (tkt.)
TETRI_,TETRIS.    	Tetris is a very addictive video game that was developed in the Soviet Union in 1984. The name Tetris comes from a melding of the prefix 'tetra-' (as all the game pieces have four segments) and 'tennis' (a favorite sport played by the developer). Since 2005 there have been more than 100 million copies of the game installed on cell phones alone.
HE_SON,"HENSON.    	Jim Henson may have been the most famous puppeteer in history given the success of his creation, ""The Muppets"". Sadly, Henson died unexpected in 1990 at the age of 53. He had two memorial services, one in New York City, and one in London. Both services were joyous occasions that featured many appearances by his most famous puppets."
CN_T,"CNET.    	c-net is an excellent technology website. c-net started out in 1994 as a television network specializing in technology news. The host of 'American Idol', Ryan Seacrest, started off his career as host of a c-net show."
HERB_,"HERBS.    	Summer savory is an annual herb that is used in some cuisines of the world in the same way that we tend to use sage here in the US. There is a related species called winter savory that is a little more bitter, and that is a perennial."
MAU_A,"MAUNA.    	'Mauna' is a Hawaiian word meaning 'mountain', as in Mauna Loa and Mauna Kea."
_LMST,"ELM ST.    	A Nightmare on Elm Street' is a Wes Craven slasher, horror film, released in 1984. As I don't do 'slasher' nor 'horror' I only learned recently that Johnny Depp was in the movie, his feature film debut."
REN_AL,"RENTAL.    	Zipcar is a carsharing company. Carsharing differs from car rental in that cars are available only to members, but 24 hours a day as opposed to office hours. There are other differences, including the fact that members are usually responsible for leaving cars gassed up and clean for the next user."
S_GTS,SSGTS.    	Staff sergeant (SSgt)
DR_SS,"DROSS.    	When metals are smelted, there is a scum made up of impurities that floats on the surface of the molten metal. This scum is called ""dross"" and is drawn off and discarded. The term ""dross"" then came to mean any waste or impure matter."
SN_P,"SNIP.    	The use of ""snip"" to mean an impertinent or mischievous person, is an informal one."
BROMAN_E,"BROMANCE.    	A ""bromance"" is the name given these days to a close relationship between two straight males."
TAMI_,TAMIL.    	Mulligatawny is a thick soup spiced with curry powder and nutmeg. It is an English recipe that was developed in India during the days of the Raj. The name 'mulligatawny' comes from the Tamil for 'pepper water'.
HE_MIT,HERMIT.    	Hermit's tend to shy away from company ...
_DIC,"ODIC.    	John Keats wrote a whole series of odes in 1819, including the very famous ""Ode on a Grecian Urn"", ""Ode to Psyche"" and ""Ode to a Nightingale""."
NE_SON,"NELSON.    	The Battle of Trafalgar was fought between the British Navy led by Admiral Lord Nelson, and the combined navies of France and Spain led by French Admiral Pierre-Charles Villeneuve. The engagement took place off the southwest coast of Spain near Cape Trafalgar, hence the battle's name. At the end of the day, Admiral Lord Nelson was dead, but twenty-two Franco-Spanish ships were lost without one sinking of a British vessel."
TRO_,"-TRON.    	A cyclotron accelerates charged particles (ions) using a magnetic field, usually directing the particles round and round a huge underground circular structure."
RO_ES,"ROLES.    	In William Shakespeare's 'Hamlet', Ophelia is courted by Hamlet, the man himself. Ophelia is the daughter of nobleman Polonius. She dies ..."
G_G,"GIG.    	Musicians use 'gig' to describe a job, a performance. The term originated in the early 1900s in the world of jazz."
ASTAIR_,"ASTAIRE.    	As you may well know, Fred Astaire's real name is Frederick Austerlitz. Fred was from Omaha, Nebraska, and before he made it big in movies, he was one half of a celebrated music hall act with his sister, Adele. The pair were particularly successful in the UK. Adele married into nobility in England, taking the name Lady Charles Cavendish."
BR_T,"BRET.    	Bret Boone is a retired Major League Baseball player, a second baseman. He is also a descendant of the pioneer, Daniel Boone."
O_T,"OFT.    	Walt Whitman is considered to be one of the greatest American poets, born in 1819 on Long Island, and living through the American Civil War. He was a controversial character, even during his own lifetime. One view held by him was that the works attributed to William Shakespeare were not actually written by Shakespeare, but rather by someone else, or perhaps a group of people."
_ONCO,"RONCO.    	Ronco is a company the builds and sells products mainly for the kitchen. Over the years the company has been closely associated with the '-O-Matic' suffix, especially the ""Veg-O-Matic' vegetable slicer. It is also associated with the phrase 'set it and forget it', which was used for Ronco's Showtime Rotisserie Grill."
P_LEG,"PELEG.    	The Pequod is the ship that figures in Herman Melville's classic, ""Moby Dick"". The ship is owned by a consortium of the citizens of Nantucket Island, including Captains Ahab, Bildad and Peleg."
P_EDEE,"PEE DEE.    	The Pee Dee River takes its name from the Pee Dee tribe of Native Americans from the southeast of the United States. The Pee Dee rises in the Appalachians of North Carolina, where it is known as the Yadkin River. The Pee Dee is the name for the lower section, which mainly flows through South Carolina, emptying into the Atlantic at Georgetown, SC."
ENL_I,"ENLAI.    	Zhou Enlai (also Chou En-Lai) was the first government leader of the People's Republic of China and held the office of Premier from 1949 until he died in 1976. Zhou Enlai ran the government for Communist Party Leader Mao Zedong, often striking a more conciliatory tone with the West than that of his boss. He was instrumental, for example, in setting up President Nixon's famous visit to China in 1972. Zhou Enlai died just a few months before Mao Zedong, with both deaths leading to unrest and a dramatic change in political direction for the country."
_MAN,"IMAN.    	Iman Mohamed Abdulmajid is a supermodel from Somalia who goes simply by the name ""Iman"" these days. 'Iman' is an Arabic word for 'faith'. Iman is smart cookie. Imam has a degree in Political Science and is fluent in five languages: Somali, Arabic, Italian, French and English. Iman was married to English rock star David Bowie from 1992 until his death in 2016."
PO_,"POO.    	I'd heard of ""cutesy-pie"" but never ""cutesy-poo"" ..."
W_J,"WSJ.    	'The Wall Street Journal' (WSJ) is a daily newspaper with a business bent that is published in New York City by Dow Jones & Company. The WSJ has a larger US circulation than any other newspaper, with 'USA Today' coming in second place."
STYN_,"STYNE.    	Jule Styne was an English songwriter who made a name for himself in America with a series of popular musicals. Styne wrote a number of famous songs including 'Don't Rain on My Parade' from 'Funny Girl', 'Diamonds Are a Girl's Best Friend' from 'Gentlemen Prefer Blondes', and 'Everything's Coming Up Roses' from 'Gypsy'."
A_AMSALE,"ADAM'S ALE.    	I suppose water was all that Adam had available to him to drink, so that's how the expression Adam's ale arose (I am guessing ... can't find anything definitive anywhere). It makes a nice juxtaposition with ""the demon drink""!"
AL_,"ALO.    	""Alo"" is an alternative one can use to ""hola"" when one wants to say ""hello"" in Spanish."
SA_AS,"SAGAS.    	""Saga"" is an Old Norse word for a ""story""."
S_N,SYN.    	The word 'loads' is a synonym for the word 'many'.
APLOM_,"APLOMB.    	'Aplomb' is such a lovely word, meaning confidence and assurance. It is a French word that literally means 'perpendicularity', or 'on the plumb line'. The idea is that someone with aplomb is poised, upright, balanced."
BANG_,"BANGS.    	Mamie Eisenhower's hairstyle created such a buzz around Washington that sales of ""fake bangs"" sky-rocketed, These were hair pieces that could be pinned to the head, creating bangs whenever the occasion called for it."
H_T,"HUT.    	The quarterback starts each play in football with a ""snap"". The quarterback announces to he is teammates the exact moment of the snap by calling out signals, usually including the word ""hut"", one or more times in a prearranged sequence."
_DO,UDO.    	Udo is a perennial plant native to Japan that is known taxonomically as Aralia cordata. The stems of udo are sometimes boiled up and served in miso soup.
B_TOR,"BATOR.    	The name ""Ulan Bator"" translates from Mongolian as ""the Red Hero"", and is Mongolia's capital city. Ulan Bator lies north of the Gobi Desert."
A_RAS,"ARRAS.    	The most celebrated alcove hidden by an arras is seen in Shakespeare's ""Hamlet"". In one pivotal scene, Polonius is hiding behind a tapestry listening to an argument between Hamlet and Gertrude. Hamlet hears Polonius, mistakes his identity, and stabs wildly through the cloth, killing Polonius. The name ""arras"" for such a tapestry comes from the French town of Arras which was famous for the production of fine tapestries."
BE_N,"BERN.    	Bern (or Berne) is the capital city of Switzerland. The official language of the city is German, but the language most spoken in Bern is a dialect known as Bernese German."
ERROR_,"ERRORS.    	In baseball, the line square is a summary set of statistics for the game. It is seen at every baseball stadium, and includes the number of runs scored by each team per innings, as well as the total number of hits and errors. The more comprehensive box score includes the line score, but also shows the individual performance of each player."
F_BULA,"FIBULA.    	The fibula is the calf bone, and lies beside the tibia, with both bones sitting under the femur."
LETSD_NCE,"LET'S DANCE.    	David Bowie's great hit ""Let's Dance"" was released in 1983, his only record to make it to number one on both sides of the Atlantic."
N_STEA,NESTEA.    	Nestea is a brand of iced tea made by Nestlé. 'Nestea' is a portmanteau of 'Nestlé' and 'tea'.
_AVAHO,"NAVAHO.    	There are more speakers of the Navajo (also Navaho) language than any other Native American language north of the US-Mexico border. Famously, the Navajo language was used by the ""code talkers"" in the Pacific War during WWII to send secure communications over radio. These Navajo ""coded"" messages were used in fast, tactical communications, with one bilingual Navajo speaker talking over the radio to another speaker, with the two acting as translators at either end of the conversation. The Navajo code was never broken by the Japanese."
DWA_F,"DWARF.    	In the original Brothers Grimm fairy tale ""Snow White"", the seven dwarfs were not given any names. The names were created for the 1937 classic animated film ""Snow White and the Seven Dwarfs"" from Walt Disney. The seven dwarfs are:"
_IMINI,"BIMINI.    	Bimini is the western part of the Bahamas, and the closest point to the mainland United States. Bimini was home to Ernest Hemingway from 1935-37, and while there saw an Atlantic blue marlin captured that weighed about 500 ponds, the apparent inspiration for his story ""The Old Man and the Sea"". More recently, in 1987 Senator Gary Hart's political career as derailed when photo's of him with model Donna Rice surfaced. The pictures were taken on the yacht ""Monkey Business"" in Bimini."
A_BERTA,"ALBERTA.    	Alberta (Alta.) is a big province, about the size of Texas. Alberta is named after Princess Louise Caroline Alberta, the fourth child of Queen Victoria and Prince Albert. Princess Louise also donated her name to Lake Louise, the large glacial lake in the province, now within the bounds of Banff National Park."
VI_NY,"VINNY.    	""My Cousin Vinny"" is a really fun film from 1992 starring Joe Pesci and Marisa Tomei. Would you believe that in 2008, the American Bar Association rated ""My Cousin Vinny"" as the #3 Greatest Legal Movie of all time, after ""To Kill a Mockingbird"" and ""12 Angry Man""."
M_GNA,"MAGNA.    	Gaius was a common Roman name for males. Magna is the Latin for ""great""."
ANO_IE,"ANOMIE.    	The word ""anomie"" comes to us via French from Greek. The root words are ""a-"" (without) ""nomos"" (law)."
S_W,SSW.    	Hartford is the capital of the state of Connecticut. The city is home to the headquarters of many insurance companies. As such Hartford is nicknamed the 'Insurance Capital of the World'.
R_ADEO,"ROADEO.    	""Roadeo"" is a slang term for a competitive driving competition featuring trucks and buses say, a pun on the word ""rodeo""."
ATLA_TA,"ATLANTA.    	Emory is a private school in Atlanta, with a focus on graduate research. The school was named after a Methodist Episcopal bishop called John Emory, who was very popular at the time of the school's founding in 1836."
DRAC_LA,"DRACULA.    	Bela Lugosi was a Hungarian stage and screen actor, best known for playing the title role in the 1931 film ""Dracula"", and for playing the same role on Broadway. He found himself typecast for the rest of his career, and almost always played the role of the villain, often in horror movies. When he passed away in 1956, he wife had him buried in the costume he wore playing Count Dracula on Broadway."
A_G,AUG.    	National Dog Day has been held on August 26 each year since 2004.
C_IOS,"CLIOS.    	The Clio Awards are the Oscars of the advertising world and are named after Clio, the Greek Muse of History. Clio was also the recorder of great deeds, the proclaimer and celebrator of great accomplishments and a source of inspiration and genius. The Clio Awards were first presented in 1959."
AGT_,AGTS.    	Some MBA's in the sports world make great agents I hear.
BI_OT,"BIGOT.    	'Bigot' is a French word that back in the late 1500s meant 'sanctimonious person, religious hypocrite'. We use the term today to describe someone who is biased towards his or her own group, and who is intolerant of those outside of that group."
GELAT_,"GELATO.    	Gelato is the Italian version of American ice cream, differing in that it has a lower butterfat content."
LI_RE,"LITRE.    	On the other side of the Atlantic we use the French spelling for measurements that originated in French, so 'metre' for 'meter' and 'litre' for 'liter'."
P_RIM,"PURIM.    	Purim is a festival commemorating the deliverance of the Jewish people from a plot to wipe them out by Haman the Agagite, as recorded in the Book of Esther. During the celebration of Purim, the Book of Esther (or Megillah) is read aloud, once in the evening and once the following morning. By the way, Esther is the only book in the Old Testament that doesn't mention the word ""God""."
_ARPS,"TARPS.    	Originally, tarpaulins were made from canvas covered in tar that rendered the material waterproof. The name tarpaulin comes from ""tar"" and ""palling"", with ""pall"" meaning ""heavy cloth covering""."
FIA_,"FIAT.    	A ""fiat"" is an arbitrary rule that is imposed, and is the Latin for ""let it be done""."
SEG_L,"SEGEL.    	I don't recognize the name or the films, but you might. He appeared in ""Forgetting Sarah Marshall"", ""Knocked Up"" as well as ""I Love You, Man"". On TV he appears in ""How I Met Your Mother""."
COMM_,"COMMA.    	""I, Claudius"" is a 1934 novel penned by Robert Graves, written in the form of an autobiography of Emperor Claudius of Rome. He wrote a sequel in 1935, ""Claudius the God"". Both books were adapted by the BBC into a fabulous television series that went by the name of the first book, ""I, Claudius"
D_ES,DEES.    	There are two letters D (dees) in the middle of the word 'middle'.
GO_,"GOP.    	The Republican Party has had the nickname Grand Old Party (GOP) since 1875. That said, the phrase was coined in the 'Congressional Record' as 'this gallant old party'. The moniker was changed to 'grand old party' in 1876 in an article in the 'Cincinnati Commercial'. The Republican Party's elephant mascot dates back to an 1874 cartoon drawn by Thomas Nast for 'Harper's Weekly'. The Democrat's donkey was already an established symbol. Nast drew a donkey clothed in a lion's skin scaring away the other animals. One of the scared animals was an elephant, which Nast labeled 'The Republican Vote'."
UNIT_RD,"UNITARD.    	A unitard is like a leotard, except that it has long legs and sometime long sleeves. It wouldn't be a good look for me ..."
SE_L,"SELL.    	Yep, bears on the stock market tens to sell, while the bulls buy."
CI_CE,"CIRCE.    	Circe is a minor goddess in Greek mythology, the goddess of magic. She was fond of transforming those who did not please her into animals by using magical potions."
S_ALE,"SHALE.    	Fracking' is a familiar term for 'hydraulic fracturing'. Fracking involves the injection of chemicals and sand in water at high pressure into a wellbore. This creates cracks in layers of rock deep in the earth allowing perhaps oil or natural gas to flow more freely to the surface. I know someone who works for the US Geological Surface, and he's measuring seismic activity in parts of the country where it has never been seen before. It seems that that fracking does have an impact on our environment after all ..."
YPRE_,"YPRES.    	Ypres is a Belgian city located close to the French border. In WWI, Ypres was the scene of three devastating battles that resulted in almost a million casualties, including many who suffered in gas attacks."
_EAN,"JEAN.    	Denim fabric originated in Nimes in France (""de Nime"" gave the fabric its name). The French phrase ""bleu de Genes"" meaning ""blue of Genoa"", gives use the word ""jeans"". Jeans is the name given to the denim pants, but it now used to describe ""jean"" material."
BR_AN,"BRYAN.    	William Jennings Bryan was an American politician, a noted figure in the Democratic Party, and Secretary of State under President Woodrow Wilson. He ran for the office of President three times, unsuccessfully of course. But he was a great orator, and used his skill to great effect in his campaigning. In fact, it was Bryan who created the national stumping tour, traveling around the country making hundreds of speeches, in days when the other candidates stayed at home."
_ASS,"BASS.    	Dubstep' is a type of electronic dance music that first surfaced in London, England in the nineties. I doubt there's any in my music collection ..."
M_IS,"MRIS.    	A CT Scan produces (via computer manipulation) a three dimensional image of the inside of an object, usually the human body. It does so by taking a series of two dimensional X-ray images while rotating the camera around the patient. The issue with CT Scans is the fact that they use X-rays, and high doses of radiation cause cumulative tissue damage. An MRI on the other hand (Magnetic Resonance Imaging) uses powerful magnetic fields to generate its images, so there is no exposure to ionizing radiation (like X-rays). We used MRI technology in our chemistry labs at school, back in the days when the technology was called Nuclear Magnetic Resonance Imaging. Apparently the marketing folks didn't like the term ""nuclear"" because of its association with ionizing radiation and bombs, so the ""N"" was dropped and it's now called just MRI."
EAP_E,"EA POE.    	The Poe Museum in Richmond, Virginia is housed in an old stone house built around 1740 that is the oldest original building in the city. The museum opened in 1922 and commemorates the years that Edgar Allan Poe spent living in the city."
ORE_D,OREAD.    	The Oreads were the nymphs that accompanied the goddess Artemis on her hunting expeditions.
G_M,"GEM.    	""Peach"" and ""gem"" are both words that can be used to describe a particularly good person."
RI_ER,"RISER.    	A riser is a platform that elevates a group of people above a crowd, and so is ideal for the performance of a choir."
ROB_N,"ROBIN.    	Dick Grayson is taken in by Bruce Wayne as his legal ward in the 'Batman' universe. Wayne fights crime as Batman, and Grayson assists him as Robin. Grayson's backstory is that he is the youngest of a family of acrobats. Dick witnesses his whole family being murdered by a mafia boss who is extorting money from the circus where they performed."
S_PPHO,"SAPPHO.    	In Greek mythology, the muses are the goddesses who inspire the creation of literature and the arts. The number of muses seems to be debated a lot, but the most popular view is that there are nine:"
