MEL_E,"MELEE.    	Our word 'melee' comes from the French 'mêlée', and in both languages the word means ""confused fight""."
NI_,"NIT.    	The NCAA holds two National Invitation Tournaments (NIT) each season, both being men's college basketball events."
_OHA,"DOHA.    	Doha is the capital city of the state of Qatar located on the Persian Gulf. The name ""Doha"" translates from Arabic as ""the big tree""."
HO_A,"HOYA.    	The athletic teams of Georgetown University are known as the Hoyas. The name is derived from a traditional ""cheer"" yelled out at Georgetown games, as far back as 1893: ""Hoya Saxa"". The term is a mixture of Greek and Latin, with the Greek word ""hoya"" meaning ""such"" or ""what"", and ""saxa"" translating from Latin as ""rocks"" or ""small stones"". The cheer is usually rendered into English as ""what rocks!""."
KIE_,"KIEV.    	Chicken Kiev may indeed be a Ukrainian dish, named for the capital city of Kiev. It is a boneless chicken breast rolled around garlic, herbs and butter, breaded and deep fried. It was my Dad's favorite ..."
EK_,"EKG.    	An EKG measures electrical activity in the heart. Back in Ireland, an EKG is known as an ECG (for electrocardiogram). We use the German name in the US, Elektrokardiogramm, giving us EKG. Apparently the abbreviation EKG is preferred as ECG might be confused (if poorly handwritten, I guess) with EEG, the abbreviation for an electroencephalogram, a brain scan."
POO_,"POOH.    	Alan Alexander (A.A.) Milne was an English author, best known for his delightful ""Winnie-the-Pooh"" series of books. He had only one son, Christopher Robin Milne, born in 1920. The young Milne was the inspiration for the Christopher Robin character in the Winnie-the-Pooh stories. Winnie-the-Pooh was named after Christopher Robin's real teddy bear, one he called Winnie, who in turn was named after a Canadian black bear called Winnie that the Milnes would visit in London Zoo. The original Winnie teddy bear is on display at the main branch of the New York Public Library in New York."
O_H,"OSH.    	Osh is the second largest city in the former Soviet Republic of Kyrgyzstan (after the capital Bishkek). Osh was a center of silk production and lies along the old Silk Road, the trade route that traversed Asia."
SCA_,SCAR.    	The character Zorro was created by Johnston McCulley in 1919 for a series of stories and pulp fiction. The name 'Zorro' is the secret identity of a Spanish colonial nobleman called Don Diego de la Vega. 'Zorro' is Spanish for 'fox'.
DEP_,"DEPP.    	Johnny Depp had his big break as an actor on television, in the eighties television show '21 Jump Street'. Depp's first film success came when he played the title role in 1990's 'Edward Scissorhands'. He has twice been named Sexiest Man Alive by 'People' magazine."
GO_A,"GOYA.    	Francisco Goya was a Spanish painter, often called the last of the Old Masters and the first of the moderns. Two of Goya's most famous works are ""The Nude Maja"" and ""The Clothed Maja""."
E_E,"ESE.    	Lagos is a port and the biggest city in Nigeria. Lagos used to be the country's capital, until it was replaced in that role in 1991 by Abuja, a city built for just for this purpose."
E_TREE,"ENTREE.    	Entrée of course means ""entry"" in French. An entrée can be something that helps one get a ""way in"", an interview for example perhaps helped along by a recommendation letter. In Europe, even in English-speaking countries, the entrée is the name for the ""entry"" to the meal, the first course. I found it very confusing to order meals when I first came to America!"
_AVE,"NAVE.    	In large Christian churches, the nave is the main approach to the altar, where most of the congregation are seated."
_BIS,OBIS.    	The sash worn as part of traditional Japanese dress is known as an obi. The obi can be tied in what is called a butterfly knot.
O_IS,OBIS.    	The sash worn as part of traditional Japanese dress is known as an obi. The obi can be tied in what is called a butterfly knot.
_ENT,"KENT.    	Kent State University's main campus is located in Kent, Ohio. Kent State will forever be associated with the student activism and opposition to the Vietnam War in the late sixties and early seventies. The fateful day was May 4, 1970, when members of the Ohio National Guard opened fire on students, killing four protesters and wounding nine."
_IMEE,AIMEE.    	Aimee Mann is an American rock singer and guitarist.
A_II,"ALII.    	Et alii (et al.) is the equivalent of et cetera (etc.), with et cetera being used in place of a list of objects, and et alii used for a list of names. In fact 'et al.' can stand for et alii (for a group of males, or males and females), aliae (for a group of women) and et alia (for a group of neuter nouns, or for a group of people where the intent is to retain gender-neutrality)."
SS_,SSS.    	Selective Service System (SSS)
_SS,"SSS.    	The US government maintains information on all males who are potentially subject to military conscription, using what is called the Selective Service System (SSS). In the event that a draft was held, men registered would be classified into groups to determine eligibility for service. Class 1-A registrants are those available for unrestricted military service. Other classes are 1-A-O (conscientious objector available for noncombatant service), 4-A (registrant who has completed military service) and 4-D (Minister of religion)."
_BSEN,"IBSEN.    	Henrik Ibsen was a Norwegian playwright, considered by many to be the greatest playwright since William Shakespeare. Ibsen was famous for shocking his audiences by exploring subjects that offended the sensibilities of the day (the late 1800s)."
ZI_I,"ZITI.    	Cylindrical pasta is known in general as 'penne', and there are many variants. For example, ziti is a particularly large and long tube with square-cut ends. ""Penne"" is the plural of ""penna"", the Italian for ""feather, quill""."
PELO_I,"PELOSI.    	Nancy Pelosi is a former Speaker of the House, the 60th person to hold that position. Ms. Pelosi represents a district not far from here, which covers most of San Francisco. She is the first Californian, the first Italian-American and the first woman to be Speaker of the House. As Speaker, she was also second in line, after the Vice President, to take over if President Obama could not finish his term. That made Nancy Pelosi the highest-ranking female politician in US history."
S_OT,SPOT.    	
S_ORE,"S'MORE.    	S'mores are a treat peculiar to North America, usually eaten around a campfire. A s'more consists of a roasted marshmallow and a layer of chocolate sandwiched between two graham crackers. The earliest written reference to the recipe is in a 1927 publication called ""Tramping and Trailing with the Girl Scouts"". Girl Scouts always did corner the market on cookies and the like!"
D_DO,"DODO.    	A dodo is a foolish person, and dodo is word that comes into English from the Portuguese ""doudo"". ""Doudo"" was a slang term used by Portuguese sailors for the extinct bird that we now know as the dodo."
_ILNE,"MILNE.    	Alan Alexander (A.A.) Milne was an English author, best known for his delightful ""Winnie-the-Pooh"" series of books. He had only one son, Christopher Robin Milne, born in 1920. The young Milne was the inspiration for the Christopher Robin character in the Winnie-the-Pooh stories. Winnie-the-Pooh was named after Christopher Robin's real teddy bear, one he called Winnie, who in turn was named after a Canadian black bear called Winnie that the Milnes would visit in London Zoo. The original Winnie teddy bear is on display at the main branch of the New York Public Library in New York."
S_EDE,"SUEDE.    	Blue Suede Shoes' was written and first recorded by Carl Perkins, in 1955. The idea for the song was given to him by Johnny Cash. Cash had been serving with the military in Germany and there met an airman who referred to his military regulation air shoes as 'blue suede shoes'. The idea was reinforced when Perkins heard a young man who was dancing say to his partner, 'Don't step on my suede shoes'. Perkins version of the song was very, very successful, actually 'going gold' in sales. Elvis Presley's version of course did even better."
NO_A,"NOTA.    	'Nota bene' is the Latin for ""note well"""
_ONTO,"TONTO.    	On the television version of 'The Lone Ranger', Tonto was played by the actor Jay Silverheels."
TARS_,"TARSI.    	The tarsals (also 'tarsi') are the ankle bones, equivalent to the carpals in the wrist."
TAR_I,"TARSI.    	The tarsals (also 'tarsi') are the ankle bones, equivalent to the carpals in the wrist."
DE_P,"DEPP.    	Johnny Depp had his big break as an actor on television, in the eighties television show '21 Jump Street'. Depp's first film success came when he played the title role in 1990's 'Edward Scissorhands'. He has twice been named Sexiest Man Alive by 'People' magazine. I don't see it myself ..."
ANO_,"ANOS.    	In Spanish, there are ten years (años) in a decade (una decada)."
PABS_,"PABST.    	Pabst Blue Ribbon is the most recognizable brand of beer from the Pabst Brewing Company. There appears to be some dispute over whether or not Pabst beer ever won a ""blue ribbon"" prize, but the company claims that it did so at the World's Columbian Exposition in Chicago in 1893. The beer was originally called Pabst Best Select, and then just Pabst Select. With the renaming to Blue Ribbon, the beer was sold with an actual blue ribbon tied around the neck of the bottle until it was dropped in 1916 and incorporated into the label."
CA_RA,"CAPRA.    	I can't tell you how many of Frank Capra's movies are on my list of all-time favorites. He directed such classics as 'It Happened One Night', 'Mr. Deeds Goes to Town', 'Lost Horizon', 'Mr. Smith Goes to Washington', 'Meet John Doe', 'Arsenic and Old Lace' and the holiday favorite 'It's a Wonderful Life'. Capra also did his bit during WWII, enlisting just a few days after Pearl Harbor was attacked. Given his great talent, and the fact that he enlisted at the relatively advanced age of 44, the US Army put him to work directing 11 documentary war films in the 'Why We Fight' series, for which he was awarded the Distinguished Service Medal."
STLE_,ST LEO.    	The first pope named Leo is now known as Pope Saint Leo the Great. Leo I is famous for meeting with the feared Attila the Hun and persuading him to turn back his invading force that was threatening to overrun Western Europe.
_AMA,"BAMA.    	That athletic teams of the University of Alabama are nicknamed the Crimson Tide, a reference to the team colors, crimson and white."
ZI_N,"ZION.    	Mount Zion is a hill in Jerusalem that his home to a number of important sites including King David's Tomb, the Room of the Last Supper and the Chamber of the Holocaust. The Catholic cemetery on Mount Zion is also where Oskar Schindler was buried, the German national who saved over 1,000 Jews during the Holocaust."
ENTR_E,"ENTREE.    	""Entrée"" means ""entry"" in French. An entrée can be something that helps one get 'a way in"", an interview for example perhaps helped along by a recommendation letter. In Europe, even in English-speaking countries, the entrée is the name for the ""entry"" to the meal, the first course. I found it very confusing to order meals when I first came to America!"
_ET,LET.    	An umpire might call 'let' in a game of tennis.
_IP,"RIP.    	All Saints' Day is November 1st each year. The day before All Saints' Day is All Hallows Eve, better known by the Scottish term, ""Halloween""."
RE_R,"REAR.    	'Derrière' is a French term meaning 'back part, rear'."
"_,TINA","I, TINA.    	""I, Tina"" is the 1986 autobiography of Tina Turner. The book was so successful it was adapted into a movie called ""What's Love Got to Do With It?"" The film version was released in 1993 and starring Angela Bassett as Tina Turner."
_DAS,RDAS.    	Recommended Daily Allowances (RDAs)
IP_NA,"IPANA.    	Ipana toothpaste was introduced in 1915, and was at the height of its popularity in the forties and fifties. Sales declined in the sixties and the product was withdrawn from the US market in the seventies. Bucky the Beaver was the ""spokesman"" for Ipana. Bucky Beaver's slogan was ""Brusha... Brusha... Brusha. Get the New Ipana - it's dandy for your teeth!"""
TO_H,"TOSH.    	Daniel Tosh is a stand-up comedian and host of 'Tosh.0', a video clip show on Comedy Central."
PE_OT,"PEROT.    	Henry Ross Perot graduated from the US Naval Academy in 1953, as president of his class. Ross Perot served his 4-year commitment but then resigned his commission, apparently having become somewhat disillusioned with the navy. He was ranked number 101 on the Forbes 400 List of Richest Americans in 2012, and at that time was worth about $3.5 billion."
I_M,"I AM.    	The Latin word ""sum"" translates into modern English as ""I am""."
_IP,"RIP.    	""Rip Van Winkle"" is a short story written by Washington Irving. The story was an instant hit, and was adapted for the stage just a few years after its first publication in 1819. Since then ""Rip"" has featured on the small screen, big screen and there is even an operetta."
PERO_,"PEROT.    	Ross Perot graduated from the US Naval Academy in 1953, as president of his class. Perot served his 4-year commitment but then resigned his commission, apparently having become somewhat disillusioned with the navy. He was ranked number 101 on the Forbes 400 List of Richest Americans in 2012, and at that time was worth about $3.5 billion. Back in 1992, Perot ran as an independent candidate for US president. He founded the Reform Party in 1995, and ran as the Reform Party candidate for president in 1996."
_YTE,"BYTE.    	In the world of computers, a ""bit"" is the basic unit of information. It has a value of 0 or 1. A ""byte"" is a small collection of bits (usually 8), the number of bits needed to uniquely identify a character of text. The prefix mega- stands for 10 to the power of 6, so a megabyte (meg) is 1,000,000 bytes. And the prefix giga- means 10 to the power of 9, so a gigabyte (gig) is 1,000,000,000 bytes. Well, those are the SI definitions of megabyte and kilobyte. The purists still use 2 to the power of 20 for a megabyte (i.e. 1,048,576), and 2 to the power of 30 for a gigabyte."
REN_IR,"RENOIR.    	Pierre-Auguste Renoir was a French painter, very much at the forefront of the Impressionist Movement. Renoir was a prolific artist, with several thousand works attributed to him. The largest collection of Renoirs is actually in the United States. You can see 181 of his paintings at the Barnes Foundation just outside Philadelphia."
COL_,"COLE.    	Nat King Cole's real name was Nathaniel Adams Coles. Cole made television history in 1956 when his own show debuted on NBC, a first for an African-American. Cole couldn't pick up a national sponsor, so in order to save money and possibly save the show, many guest artists worked for no fee at all - the likes of Ella Fitzgerald, Harry Belafonte and Peggy Lee. The show survived for a year, but eventually Nat King Cole had to pull the plug on it himself."
DOH_,"DOHA.    	Doha is the capital city of the state of Qatar located on the Persian Gulf. The name ""Doha"" translates from Arabic as ""the big tree""."
S_IEL,"SPIEL.    	A spiel is a lengthy speech or argument designed to persuade, perhaps a sales pitch. ""Spiel"" comes to us from German, either directly (""spiel"" is the German for ""play"") or via the Yiddish ""shpil""."
I_ODS,"IPODS.    	The iPod Nano is the successor to the iPod Mini and was introduced to the market at the end of 2005. There have been five versions of the Nano to date and the current Nano as well as playing tunes is an FM player, records voice memos, and even has a pedometer!"
GO_A,"GOYA.    	Goya Foods is headquartered in Secaucus, New Jersey. It is was founded in 1936 and today is the largest Hispanic-owned food company in the nation."
TA_S,"TARS.    	A Jack Tar, or just ""tar"", was a seaman in the days of the British Empire. The term probably arose due to a sailor's various uses of tar back then, including waterproofing his clothes and using tar in his hair to slick down his ponytail."
G_N,GEN.    	The number of books in the Bible varies depending on religious tradition. The Protestant Christian Bible has a total of 66 books: 39 in the Old Testament and 27 in the New Testament.
EVIT_,"EVITA.    	""Evita"" was the follow up musical to ""Jesus Christ Superstar"" for Andrew Lloyd Webber and Tim Rice. Both of these works were originally released as album musicals, and very successful ones at that (I remember buying them when they first came out). 'Evita' was made into a film in 1996, with Madonna playing the title role and Welsh actor Jonathan Pryce playing her husband Juan Perón."
UFO_,"UFOS.    	In 1952, the USAF revived its studies of reported sightings of unidentified flying objects (UFOs) in a program called Project Blue Book. Project Blue Book ran from 1952 until it was shut down in 1969 with the conclusion that there was no threat to national security and that there were no sightings that could not be explained within the bounds of modern scientific knowledge."
_BRAM,"ABRAM.    	President James Abram Garfield was born in Orange Township in Ohio, the youngest son of Abram Garfield. Abram had moved from New York to Ohio specifically to court his childhood sweetheart Mehitabel Ballou. When Abram arrived in Ohio, however, he found that Mehitabel had already married. Abram did manage to join the Ballou family though, as he eventually married Mehitabel's sister Eliza."
_DL,"HDL.    	HDL (high-density lipoprotein) is a compound that is used to transport fats around the body. When HDL is combined with (is transporting) cholesterol, it is often called ""good cholesterol"". This is because HDL seems to remove cholesterol from where it should not be, say on the wall of arteries, and transports it to the liver for re-use or disposal. Important stuff ..."
A_MANI,"ARMANI.    	Giorgio Armani is an Italian fashion designer, and founder of the company that bears his name since 1975. Although Armani is famous for his menswear, the company makes everything from jewelry to perfume."
ST_EO,ST LEO.    	The first pope named Leo is now known as Pope Saint Leo the Great. He is famous for having met with the feared Attila the Hun and persuading him to turn back his invading force that was threatening to overrun Western Europe.
XENO_,"XENON.    	Metal halide lamps that are called xenons don't actually rely on the incorporated xenon gas to generate light. The xenon gas is added so that the lamp comes on ""instantly"". Without the xenon, the lamp would start up rather like a street lamp, flickering and sputtering for a while before staying alight."
DEP_,"DEPP.    	Johnny Depp had his big break as an actor on television, in the eighties television show '21 Jump Street'. Depp's first film success came when he played the title role in 1990's 'Edward Scissorhands'. He has twice been named Sexiest Man Alive by 'People' magazine."
META_,"METAL.    	Lithium is an element, a soft silver-white metal."
_KOS,"TKOS.    	In boxing, a knockout (KO) is when one of the fighters can't get up from the canvas within a specified time, usually 10 seconds. This can be due to fatigue, injury, or the participant may be truly ""knocked out"". A referee, fighter or doctor may also decide to stop a fight without a physical knockout, especially if there is concern about a fighter's safety. In this case the bout is said to end with a technical knockout (TKO)."
D_NIM,"DENIM.    	Denim fabric originated in Nimes in France. The French phrase ""de Nimes"" (from Nimes) gives us the word ""denim"". Also, the French phrase ""bleu de Genes"" (blue of Genoa) gives us our word ""jeans""."
M_H,MPH.    	Miles per hour (mph)
_OHA,"DOHA.    	Doha is the capital city of the state of Qatar located on the Persian Gulf. The name ""Doha"" translates from Arabic as ""the big tree""."
CAM_L,"CAMEL.    	The advertising mascot for Camel cigarettes was officially known as ""Old Joe"", but was popularly known as ""Joe Camel"". Joe originated in the seventies, in an advertising campaign that ran only in Europe, where he sometimes was depicted wearing a French Foreign Legion cap. He was imported to the US in 1988 on the occasion of the 75th anniversary of the Camel brand. The big controversy surrounding the use of the camel character was that a 1991 study found that 5-6 year old children could recognize Joe Camel more readily than either Mickey Mouse or Fred Flintstone. Also, soon after Old Joe was introduced in the US, the Camel brand's share of the illegal market to underage smokers went up from 1% to just under 33%."
EASE_,"EASEL.    	The word ""easel"" comes from an old Dutch word meaning ""donkey"" would you believe? The idea is that an easel carries its load (an oil painting, say) just as a donkey would be made to carry a load."
ROE_,"ROEG.    	Nicolas Roeg is film director from England with quite the pedigree when it comes to association with great movies. He contributed to 1962's 'Lawrence of Arabia', and he himself directed noted films like 'Walkabout' (1972), 'Don't Look Now' (1973) and 'The Man Who Fell to Earth' (1976)."
_CHO,ECHO.    	Clever clue ...
UN_,UND.    	'Und' is the German for 'and'.
GE_SO,"GESSO.    	Gesso is the Italian word for ""chalk"", and gives it name to the powdered calcium carbonate that is used as a primer coat under artistic panel paintings. The gesso is mixed with a glue, and when applied to wood is acts as an absorbent surface for paint."
_DOPA,"L-DOPA.    	L-3,4-DihydrOxyPhenylAlanine, thankfully can be shortened to L-DOPA. Swedish scientist Arvid Carlsson won a Nobel Prize for showing that L-DOPA could be used to reduce the symptoms of Parkinson's Syndrome."
_UI,"DUI.    	In some states, there is no longer a legal difference between a DWI (Driving While Intoxicated) and a DUI (Driving Under the Influence). Other states retain that difference, so that by definition a DUI is a lesser offence than a DWI."
U_URA,"UHURA.    	Lt. Nyota Uhura is the communications officer in the original 'Star Trek' television series, played by Nichelle Nichols. The role is significant in that Uhura was one of the first African American characters to figure front and center in US television. In a 1968 episode, Kirk (played by William Shatner) and Uhura kiss, the first inter-racial kiss to be broadcast in the US. Apparently the scene was meant to be shot twice, with and without the kiss, so that network executives could later decide which version to air. William Shatner says that he deliberately ran long on the first shoot (with the kiss) and fluffed the hurried second shoot (without the kiss), so that the network would have no choice."
S_AS,"SEAS.    	A water molecule is composed of an oxygen atom with two hydrogen atoms on roughly opposite sides (about a 150-degree angle). So, sometimes the molecule is represented by 'HOH', although more usually it's 'H2O'."
_TES,"STES.    	'Sainte' (ste.) is French for 'saint', when referring to a female."
EL_E,ELBE.    	The River Elbe rises in the Czech Republic and travels over a thousand kilometers before emptying into the North Sea near the port of Hamburg in Germany.
_AT,PAT.    	A 'pat' is a 'tap'.
ATHEN_,"ATHENA.    	In Greek mythology the god Ares was the half-brother of the goddess Athena, although the two were regarded as enemies. Both deities are associated with war, with Athena representing strategic warfare whereas Ares is linked to momentary, passionate violence."
_PS,MPS.    	The Military Police (MPs) are concerned with personnel who go AWOL (Absent Without Leave).
O_OES,"OBOES.    	The oboe is perhaps my favorite of the reed instruments. The name ""oboe"" comes from the French ""hautbois"" which means ""high wood"". When you hear an orchestra tuning before a performance you'll note (pun intended!) that the oboe starts off the process by playing an ""A"". The rest of the musicians in turn tune to that oboe's ""A"". Oh, and if you want to read a fun book (almost an ""exposé"") about life playing the oboe, you might try ""Mozart in the Jungle"" by oboist Blair Tindall. Amazon Studios have made a 30-minute pilot episode of a Web-based TV show based on Tindall's book, starring the great British actor Malcolm McDowell. I can't wait to see it ..."
KI_,"KIT.    	The idiomatic expression is ""the whole kit and caboodle"". Caboodle (sometimes spelled ""kaboodle"") is an informal term for a bunch of people, or sometimes the ""the whole lot""."
EA_LS,"EARLS.    	The rank of earl has meant many different things over the centuries. In Britain today an earl ranks above a viscount but below a marquess. There is no female form for earl, so a woman with the equivalent female title is called a countess."
_ILER,OILER.    	The Persian Gulf is very nearly an inland sea although it technically is an offshoot of the Indian Ocean. The outlet from the Persian Gulf to the Indian Ocean is one of the most famous maritime 'choke points' in the world: the Strait of Hormuz. About 20% of the world's supply of petroleum passes through the Strait of Hormuz.
HA_,"HAJ.    	A Haji is the term used for someone who has made a pilgrimage to Mecca, and it is sometimes also used as a form of address for such a person. The journey itself goes by the name ""haj""."
E_OISE,"ELOISE.    	Kay Thompson wrote the ""Eloise"" series of children's books. Kay Thompson actually lived at the Plaza Hotel in New York, the setting she would choose for her ""Eloise"" stories. Eloise started out as a hit song for Thompson, a success that she parlayed into the book franchise."
