OTT_,"OTTO.    	Otto Mann drives the school bus on the TV show ""The Simpsons"". Otto is a Germanic character voiced by Harry Shearer, and his name is a play on ""Ottoman Empire"". Whenever Bart sees him, he greets Otto with the words ""Otto, man!"""
ED_,EDS.    	Editors.
E_LE,"ELLE.    	""Elle"" magazine was founded in 1945 in France and today has the highest circulation of any fashion magazine in the world. ""Elle"" is the French word for ""she"". 'Elle' is published monthly worldwide, although you can pick up a weekly edition if you live in France."
RO_,"ROO.    	Like most of the characters in A. A. Milne's 'Winnie the Pooh', Roo was inspired by on a stuffed toy belonging to Milne's son Christopher Robin."
PS_,PSI.    	Pounds per square inch (PSI) is a measure of pressure.
A_EC,"ALEC.    	Sir Alec Douglas-Home was the Prime Minister of the UK from 1963 to 1964. Nowadays the British Prime Minister is chosen from the membership of the House of Commons, and Sir Alec Douglas-Home was the last Prime Minster to be chosen from the House of Lords. He had to give up his peerage though (he was the Earl of Home) in order to take up the post."
A_ES,"ARES.    	The Greek god Ares is often referred to as the Olympian god of warfare, but originally he was regarded as the god of bloodlust and slaughter. Ares united with Aphrodite to create several gods, including Phobos, Deimos and Eros. The Roman equivalent to Ares was Mars. Ares was the son of Zeus and Hera."
_TE,RTE.    	Route (rte.)
AR_L,"ARAL.    	The Aral Sea is a great example of how man can have a devastating effect on his environment. In the early sixties the Aral Sea covered 68,000 square miles of Central Asia. Soviet Union irrigation projects drained the lake to such an extent that today the total area is less than 7,000 square miles, with 90% of the lake now completely dry. Sad ..."
IR_S,IRIS.    	The iris is the colored part of the eye with an aperture in the center that can open or close depending on the level of light hitting the eye.
S_L,"SAL.    	The song ""Fifteen Miles on the Erie Canal"" was written in 1905. The lyrics are nostalgic, and look back to the days when traffic on the canal was pulled by mules, and bemoans the introduction of the fast-moving engine-powered barges. The first line is ""I've got an old mule and her name is Sal""."
_NEA,"ONE-A.    	The US government maintains information on all males who are potentially subject to military conscription, using what is called the Selective Service System (SSS). In the event that a draft is held, men registered would be classified into groups to determine eligibility for service. Class 1-A registrants are those available for unrestricted military service. Other classes are 1-A-O (conscientious objectors available for noncombatant service), 4-A (registrants who have completed military service) and 4-D (ministers of religion)."
A_ES,"ARES.    	Harmonia was the Greek goddess of harmony and concord. According to some Greek lore, she was the daughter of Ares and Aphrodite. She is noted for the story of 'the Necklace of Harmonia'. She received the necklace as a gift at her wedding, and it brought bad luck to her and all who wore it."
A_HE,"ASHE.    	Arthur Ashe was a professional tennis player from Richmond, Virginia. In his youth he found himself having to travel great distances to play against Caucasian opponents, due to the segregation that still existed in Richmond. He was rewarded for his dedication by being selected for the 1963 US Davis Cup team, the first black player to be so honored. He still ran into trouble because of his ethnicity though, as in 1968 he was denied entry into South Africa to play in the South African Open. In 1979, Ashe suffered a heart attack and had bypass surgery. he had to have corrective surgery in 1983, and contracted HIV from blood transfusions during the surgery. He eventually passed away in 1993, due to complications from AIDS."
_SS,ESS.    	Half of the word 'us' is a letter S (ess).
RO_,"ROO.    	The name 'kangaroo' comes from the Australian Aborigine term for the animal. There's an oft-quoted story that James Cook (later Captain Cook) asked a local native the name of this remarkable looking animal, and the native responded with 'kangaroo'. The story is that the native was actually saying 'I don't understand you', but as cute as that tale is, it's just an urban myth."
SA_,"SAL.    	Sal Mineo's most famous role was that of John ""Plate"" Crawford, the kid who was in awe of the James Dean character in ""Rebel Without a Cause"". Sadly, Sal Mineo was murdered in in 1976, when he was just 37 years old. He was attacked in the alley behind his Los Angeles apartment and stabbed through the heart. An arrest was made, and it was discovered that the murderer apparently had no idea who his victim was and was just intent on robbery."
_RO,SRO.    	SRO: Standing Room Only.
_PA,"SPA.    	Jacuzzi is one of those brand names that has become so much associated with the product that it is often assumed to be a generic term. The Jacuzzi company was founded in 1915 by the seven(!) Jacuzzi brothers in Berkeley California. The brothers, who were Italian immigrants, pronounced their name ""ja-coot-si"", as one might suspect when one realizes the name is of Italian origin. The company started off by making aircraft propellers and then small aircraft, but suspended aircraft production in 1925 when one the brothers was killed in one of their planes. The family then started making hydraulic pumps, and in 1948 developed a submersible bathtub pump so that a son of one of the brothers could enjoy hydrotherapy for his rheumatoid arthritis. The ""hydrotherapy product"" took off in the fifties with some astute marketing towards ""worn-out housewives"" and the use of celebrity spokesman Jack Benny."
DR_,"DRE.    	Dr. Dre is the stage name of rapper Andre Romelle Young. Dr. Dre is known for his own singing career as well as for producing records and starting the careers of others such Snoop Dogg, Eminem and 50 Cent."
_DS,"EDS.    	I'm not sure what ""EDS"" are in the context of ""glamour"" ... maybe editors of ""Glamour"" magazine?"
A_RA,"ATRA.    	Fortunately for crossword constructors, the Atra razor was introduced by Gillette in 1977. The Atra was sold as the Contour in some markets and its derivative products are still around today."
E_S,EDS.    	Editors (eds.)
_OO,"LOO.    	When I was growing up in Ireland, a ""bathroom"" was a room that had a bath and no toilet. The separate room with the commode was called ""the toilet"" or sometimes the W.C. (the water closet). Apparently the term closet was used because in the 1800s when homeowners started installing toilets indoors they often displaced clothes and linens in a ""closet"", as a closet was the right size to take the commode. It has been suggested that the British term ""loo"" comes from Waterloo (water-closet ... water-loo), but no one seems to know for sure. Another suggestion is that the term comes from the card game of ""lanterloo"" in which the pot was called the loo!"
_RENE,"IRENE.    	Hurricane Irene caused extensive flooding as it travelled through the Caribbean, up the East Coast of the United States and into the Atlantic seaboard of Canada. The hurricane was unusual in that it came so far north up the North American coast. 55 deaths were attributed to Irene."
EN_S,ENOS.    	Enos was the son of Seth and the grandson of Adam and Eve.
SR_,SRO.    	Standing room only (SRO)
AN_A,"ANNA.    	The King and I' is a Rodgers and Hammerstein musical based on a book by Margaret Landon called 'Anna and the King of Siam' first published in 1944. Landon's book is based on a true story, told in the memoirs of Anna Leonowens. Leonowens was the governess of the children of King Mongkut of Siam in the 1860s, and she also taught the king's wives."
_NEA,"ONE-A.    	The US government maintains information on all males who are potentially subject to military conscription, using what is called the Selective Service System(SS). In the event that a draft was held, men registered would be classified into groups to determine eligibility for service. Class 1-A registrants are those available for unrestricted military service. Other classes are 1-A-O (conscientious objector available for noncombatant service), 4-A (registrant who has completed military service) and 4-D (Minister of religion)."
_TE,"UTE.    	The Ute are a group of American Indian tribes that now reside in Utah and Colorado. The Ute were not a unified group as such, but rather a loose association of nomadic groups."
R_O,"ROO.    	In Australia, male kangaroos are known by several names including bucks, boomers, jacks or old men. Females are called does, flyers, or jills. There seems to be just the one name for young kangaroos: joeys. A group of kangaroos might be called a mob, troop or court."
P_I,PSI.    	Pounds per square inch (PSI) is a measure of pressure.
_DA,"IDA.    	Lewis-Clark State College was founded in 1893, in Lewiston, Idaho."
_STS,"SSTS.    	The most famous Supersonic Transport (SST) was the Concorde, a plane that's no longer flying. Concorde had that famous ""droop nose"". The nose was moved to the horizontal position during flight to create the optimum aerodynamic shape thereby reducing drag. It was lowered during taxi, takeoff and landing, so that the pilot had better visibility. The need for the droop nose was driven largely by the delta-shaped wings. The delta wing necessitates a higher angle of attack at takeoff and landing than conventional wing designs, so the pilot needed the nose lowered so that he or she could see the ground."
E_RU,"ECRU.    	The shade of ecru is a grayish, yellowish brown. The word ""ecru"" comes from French, and means ""raw, unbleached"", and has the same roots as our word ""crude""."
ELA_,"ELAN.    	Our word ""élan"" was imported from French, in which the word has a similar meaning, ""style"" or ""flair""."
AN_A,"ANNA.    	Anna kendrick is a marvelous actress whose big break came when she played the sidekick to George Clooney's character in the very interesting 2009 film 'Up in the Air'. Kendrick can sing as well as act, and played a student a cappella singer in the 2012 movie 'Pitch Perfect'."
_TE,RTE.    	Route (rte.)
A_ES,"ARES.    	The Greek god Ares is often referred to as the Olympian god of warfare, but originally he was regarded as the god of blood-lust and slaughter. Ares united with Aphrodite to create several gods, including Phobos, Deimos and Eros."
UN_,"UNO.    	In my youth I remember being taught a great card game by a German acquaintance of mine, a game called Mau Mau. Years later I discovered that Uno is basically the same game, but played with a purpose-printed deck instead of the regular deck of playing cards that's used for Mau Mau."
_RES,"ARES.    	The Greek god Ares is often referred to as the Olympian god of warfare, but originally he was regarded as the god of bloodlust and slaughter. Ares united with Aphrodite to create several gods, including Phobos (Fear), Deimos (Terror) and Eros (Desire). The Roman equivalent to Ares was Mars. Ares was the son of Zeus and Hera."
_TARI,"ATARI.    	Space Invaders is one of my favorite video games, a classic from the good old days (not that I play video games anymore). When Space Invaders was first released in video arcades in Japan in 1978, it was so popular that it caused a shortage of 100-yen coins."
O_TO,OTTO.    	Jim Otto played professional football for the Oakland Raiders.
TSA_,"TSAR.    	The term czar (also tsar) is a Slavic word that was first used as a title by Simeon I of Bulgaria in 913 AD. ""Czar"" is derived from the word ""Caesar"", which was synonymous with ""emperor"" at that time."
SP_,SPA.    	Manicure & pedicure (mani-pedi)
ECR_,"ECRU.    	The shade of ecru is a grayish, yellowish brown. The word ""ecru"" comes from French, and means ""raw, unbleached"", and has the same roots as our word ""crude""."
D_E,"DRE.    	Dr. Dre is the stage name of rapper Andre Romelle Young. Dr. Dre is known for his own singing career as well as for producing records and starting the careers of others such Snoop Dogg, Eminem and 50 Cent."
T_O,"TAO.    	The Chinese character ""tao"" translates as ""path"", but the concept of Tao signifies the true nature of the world."
TR_,"TRE.    	""Tre"" is the Italian for ""three"", and lots of Italians watch Channel 3."
ES_,ESL.    	English as a Second Language (ESL) is sometimes referred to as English for Speakers of Other Languages (ESOL) and English as a Foreign Language (EFL).
_AS,"LAS.    	Las Cruces is the second largest city in the state of New Mexico, and is the home of New Mexico State University."
ON_A,"ONE-A.    	The US government maintains information on all males who are potentially subject to military conscription, using what is called the Selective Service System(SS). In the event that a draft was held, men registered would be classified into groups to determine eligibility for service. Class 1-A registrants are those available for unrestricted military service. Other classes are 1-A-O (conscientious objector available for noncombatant service), 4-A (registrant who has completed military service) and 4-D (Minister of religion)."
RE_,"REA.    	""The End of the Affair"" is a largely autobiographical novel by Graham Greene. There have been a couple of movie adaptions of the book, including a 1999 Neil Jordan version starring Ralph Fiennes, Julianne Moore and Stephen Rea."
UT_,UTE.    	The Utah Utes and Arizona State Sun Devils are college football teams.
ENY_,"ENYA.    	Enya's real name is Eithne Ní Bhraonáin, which can translate from Irish into Enya Brennan. Her Donegal family (in the northwest of Ireland) formed a band called Clannad, which included Enya. In 1980 Enya launched her very successful solo career, eventually becoming Ireland's best-selling solo musician. And, she sure does turn up a lot in crosswords!"
T_AR,"TSAR.    	Peter the Great was perhaps the most successful of the Romanov tsars, famous for modernizing Russia and expanding the country's sphere of influence, creating the Russian Empire. He ruled from 1682 until his death in 1725."
OMA_,OMAR.    	Omar Minaya was the General Manager for the Montreal Expos and the New York Mets.
NE_,NES.    	The acronym Super NES stands for Super Nintendo Entertainment System. Our kids probably have one somewhere ...
TR_,"TRE.    	In Italian, seven (sette) minus four (quattro) makes three (tre)."
ARL_,"ARLO.    	Arlo Guthrie is the son of Woody Guthrie. Both father and son are renowned for their singing of protest songs about social injustice. Arlo is most famous for his epic 'Alice's Restaurant Massacree', a song that lasts a full 18m 34s. In the song Guthrie tells how, after being drafted, he was rejected for service in the Vietnam War based on his criminal record. He had only one incident on his public record, a Thanksgiving Day arrest for littering and being a public nuisance when he was 18-years-old."
EN_,"ENT.    	Ents are those tree-like creatures that live in J. R. R. Tolkien's Middle-earth in his series of books ""The Lord of the Rings"". 'Ent' is an Old English word for 'giant'."
_NNA,"ANNA.    	Not only is Anna Kournikova a world class tennis player, but she is also a model. She apparently has a lot of fans because her name is one of the most commonly searched for terms on Google's search engine ..."
IR_NE,"IRENE.    	Samuel Johnson (also known as Dr. Johnson) was a British author active in the 1700s. Johnson is famous for producing a ""Dictionary of the English Language"" published in 1755. Johnson's dictionary was the standard used until the OED was published 150 years later. As a creative writer, Johnson wrote one play, called 'Irene', a work that he believed to have been his worse, and the critics apparently agreed."
_TET,"STET.    	""Stet"" is a Latin word meaning ""let it stand"". In editorial work, the typesetter is instructed to disregard any change previously marked by writing the word ""stet"" beside the change and then underscoring the change with a line of dots or dashes."
AL_E,"ALEE.    	The direction ""alee"" is the direction away from the wind. If a sailor points into the wind, he is pointing ""aweather""."
AS_E,"ASHE.    	Arthur Ashe was a professional tennis player from Richmond, Virginia. In his youth, Ashe found himself having to travel great distances to play against Caucasian opponents due to the segregation that still existed in his home state. He was rewarded for his dedication by being selected for the 1963 US Davis Cup team, the first African American player to be so honored. Ashe continued to run into trouble because of his ethnicity though, and in 1968 was denied entry into South Africa to play in the South African Open. In 1979 Ashe suffered a heart attack and had bypass surgery, with follow-up surgery four years later during which he contracted HIV from blood transfusions. Ashe passed away in 1993 due to complications from AIDS. Shortly afterwards, Ashe was posthumously awarded the Presidential Medal of Freedom by President Bill Clinton."
_SAR,"TSAR.    	I was lucky enough to visit the Moscow Kremlin as a tourist a few decades ago. The Kremlin of course sits right on Red Square, along with Saint Basil's Cathedral and the famed GUM department store. 'Kremlin' is a Russian word for 'fortress'."
NE_,NES.    	Nintendo Entertainment System (NES)
R_O,"ROO.    	Like most of the characters in A. A. Milne's ""Winnie the Pooh"", Roo was inspired by on a stuffed toy belonging to Milne's son Christopher Robin."
ASH_,"ASHE.    	Arthur Ashe was a professional tennis player from Richmond, Virginia. In his youth he found himself having to travel great distances to play against Caucasian opponents due to the segregation that still existed in his home state. He was rewarded for his dedication by being selected for the 1963 US Davis Cup team, the first African America player to be so honored. He continued to run into trouble because of his ethnicity though, and in 1968 was denied entry into South Africa to play in the South African Open. In 1979 Ashe suffered a heart attack and had bypass surgery, with follow-up surgery four years later during which he contracted HIV from blood transfusions. Ashe passed away in 1993, due to complications from AIDS. Shortly afterwards, Ashe was posthumously awarded the Presidential Medal of Freedom by President Bill Clinton."
ONE_,"ONE-A.    	The US government maintains information on all males who are potentially subject to military conscription, using what is called the Selective Service System (SSS). In the event that a draft is held, men registered would be classified into groups to determine eligibility for service. Class 1-A registrants are those available for unrestricted military service. Other classes are 1-A-O (conscientious objectors available for noncombatant service), 4-A (registrants who have completed military service) and 4-D (ministers of religion)."
_SS,"ESS.    	Slot cars are those motorized toy cars that run around on tracks picking up power from the slot in the racing surface. The first slot cars were made by the Lionel company, the manufacturer of toy trains sets. They first appeared in 1912."
_SHE,"ASHE.    	Arthur Ashe was a professional tennis player from Richmond, Virginia. In his youth, Ashe found himself having to travel great distances to play against Caucasian opponents due to the segregation that still existed in his home state. He was rewarded for his dedication by being selected for the 1963 US Davis Cup team, the first African American player to be so honored. Ashe continued to run into trouble because of his ethnicity though, and in 1968 was denied entry into South Africa to play in the South African Open. In 1979 Ashe suffered a heart attack and had bypass surgery, with follow-up surgery four years later during which he contracted HIV from blood transfusions. Ashe passed away in 1993 due to complications from AIDS. Shortly afterwards, Ashe was posthumously awarded the Presidential Medal of Freedom by President Bill Clinton."
L_O,"LOO.    	When I was growing up in Ireland, a ""bathroom"" was a room that had a bath and no toilet. The separate room with the commode was called ""the toilet"" or sometimes the W.C. (the water closet). Apparently the term closet was used because in the 1800s when homeowners started installing toilets indoors they often displaced clothes and linens in a ""closet"", as a closet was the right size to take the commode. It has been suggested that the British term ""loo"" comes from Waterloo (water-closet ... water-loo), but no one seems to know for sure. Another suggestion is that the term comes from the card game of ""lanterloo"" in which the pot was called the loo!"
D_E,"DRE.    	Dr. Dre is the stage name of rapper Andre Romelle Young. Dr. Dre is known for his own singing career as well as for producing records and starting the careers of others such Snoop Dogg, Eminem and 50 Cent."
_ER,"O'ER.    	The words ""o'er the rampart we watched"" come from ""The Star Spangled Banner"" written by Francis Scott Key. The lyrics were written first as a poem by Key, inspired when he witnessed the bombarding by the British of the American forces at Fort McHenry during the Battle of Baltimore in September 1814. The words were then set to the tune of a popular British drinking song written by John Stafford Smith called ""The Anacreontic Song"". The Anacreontic Society was a men's club in London (an elite and genteel place, not at all like a ""gentlemen's club"" in today's society here in the US)."
_TE,"RTE.    	United Parcel Service (UPS) is based in Sandy Springs, Georgia and has its own airline that operates out of Louisville, Kentucky."
_DA,"IDA.    	Ida Tarbell was a teacher, and what we would call today an ""investigative journalist"", which back in her day was known as a ""muckraker"". Her most famous work is her 1904 book ""The History of the Standard Oil Company"". This exposé was credited with hastening the breakup of John D. Rockefeller's Standard Oil in 1911."
ETT_,"ETTA.    	Etta James was best known for her beautiful rendition of the song ""At Last"". Sadly, as she disclosed in her autobiography, James lived a life that was ravaged by drug addiction leading to numerous legal and health problems. Ms. James passed away in January 2012 having suffered from leukemia."
E_S,"ESS.    	Slalom is an anglicized version of the Norwegian word ""slalam"", meaning ""skiing race""."
D_A,"DNA.    	I've always been fascinated by the fact that the DNA of living things is so very similar across different species. Human DNA is almost exactly the same for every individual (to the degree of 99.9%). However, those small differences are sufficient to distinguish one individual from another, and to determine whether or not individuals are close family relations."
ARL_,"ARLO.    	Arlo Guthrie is the son of Woody Guthrie. Both father and son are renowned for their singing of protest songs about social injustice. Arlo is most famous for his epic ""Alice's Restaurant Massacree"", a song that lasts a full 18m 34s. In the song Guthrie tells how, after being drafted, he was rejected for service in the Vietnam War based on his criminal record. He had only one incident on his public record, a Thanksgiving Day arrest for littering and being a public nuisance when he was 18-years-old."
N_S,NES.    	The acronym Super NES stands for Super Nintendo Entertainment System. The kids probably have one. I wouldn't know ...
_LEC,"ALEC.    	Alec is the oldest of the acting Baldwin brothers. I think his big break was playing Tom Clancy's Jack Ryan in ""The Hunt for Red October"", but thank goodness that role was taken over by Harrison Ford for the subsequent Jack Ryan movies. Baldwin is making a name for himself these days playing Jack Donaghy on ""30 Rock"", opposite Tina Fey."
LA_,"LAS.    	'Las Meninas' is a painting by Diego Velázquez, the name of which translates to 'The Maids of Honor'. 'Las Meninas' is the most famous painting owned by the Museo del Prado in Madrid."
TR_,"TRE.    	'I Tre Tenori' is Italian for 'The Three Tenors'. The Three Tenors were Placido Domingo, Jose Carreras and Luciano Pavarotti (RIP)."
_MA,"AMA.    	The American Medical Association was founded in 1847, at the Academy of Natural Sciences in Philadelphia. The first female member joined in 1868, but the first African American members weren't allowed to join until 1968."
RO_,"ROO.    	Like most of the characters in A. A. Milne's ""Winnie the Pooh"", Roo was inspired by on a stuffed toy belonging to Milne's son Christopher Robin."
AN_A,"ANNA.    	Peter II was the son of Peter I and Emperor of Russia. Peter II took over as Emperor on the death of Catherine I, wife of Peter I."
L_O,"LOO.    	When I was growing up in Ireland, a ""bathroom"" was a room that had a bath and no toilet. The separate room with the commode was called ""the toilet"" or sometimes the W.C. (the water closet). Apparently the term closet was used because in the 1800s when homeowners started installing toilets indoors they often displaced clothes and linens in a ""closet"", as a closet was the right size to take the commode. It has been suggested that the British term ""loo"" comes from Waterloo (water-closet ... water-loo), but no one seems to know for sure. Another suggestion is that the term comes from the card game of ""lanterloo"" in which the pot was called the loo!"
LA_,"LAS.    	'Las Meninas' is a painting by Diego Velázquez, the name of which translates to 'The Maids of Honor'. 'Las Meninas' is the most famous painting owned by the Museo del Prado in Madrid."
