NAC_E,"NACRE.    	Nacre is another name for mother-of-pearl. Nacre is the strong iridescent material laid down by some mollusks on the inside of their shells, and it's also what makes up pearls. The creature lays down nacre as a defensive mechanism, protecting the soft tissue of its body from the rough surface of the outer shell. Similarly, it uses nacre to encapsulate harmful debris or a parasite that penetrates the shell, and that's how a pearl is formed."
N_B,"NOB.    	Nob Hill is a very elevated and central location in the city of San Francisco. Because of its views of the surrounding city and environs, Nob Hill became a desirable place to live for the wealthy in the 1800s. The area is still one of San Francisco's most affluent neighborhoods and is home to upscale hotels as well as the magnificent Grace Cathedral. The name ""Nob Hill"" comes from the slang term for someone who is well-to-do, a ""nob""."
DA_,"DAR.    	Dar es Salaam is the largest city in Tanzania, and sits right on the east coast of Africa. The city's name is usually translated from Arabic as 'Haven of Peace'."
_PAA,"MPAA.    	The Motion Picture Association of America's (MPAA) film-rating system (R, PG-17, G etc.) is purely voluntary and is not backed by any law. Movie theaters agree to abide by the rules that come with the MPAA ratings in exchange for access to new movies."
CL_O,"CLEO.    	Miss Cleo was the stage name of psychic Youree Dell Harris. Miss Cleo was a spokesperson for the Psychic Readers Network, a pay-per-call service, for many years."
LET_,"LETO.    	Jared Leto is an actor and musician. In the world of music, Leto is the lead singer and rhythm guitarist for the rock band 30 Seconds to Mars. In the film world his most critically acclaimed role was that of a heroin addict in ""Requiem for a Dream"". He also appeared in ""American Psycho"", ""Panic Room"" and ""Lord of War""."
E_TO,"ESTO.    	The Latin phrase 'esto dignis' means 'be worthy' and is the motto of the Columbian Squires. This international youth fraternity is run by the Knights of Columbus and is open to Catholic boys from the ages 10 to 18. The Squires were formed in 1925, and now there's a sister organization for young ladies, the Squire Roses."
_TS,"RTS.    	In American football, linemen specialize in playing in the line of scrimmage. RT stands for Right Tackle. That's about all I know, and even that I am unsure about ..."
C_STE,"CASTE.    	Many creatures organize themselves into a social structure, a phenomenon known as ""eusociality"". Examples of such creatures would be ants, bees and wasps, where there are queens, workers and soldiers. The groups within such a hierarchical structure are known as castes. The word ""caste"" was borrowed from the class divisions in Indian society (although the word and concept was actually introduced by the Portuguese)."
E_G,EKG.    	Clever clue ...
EL_E,"ELBE.    	Towards the end of WWII in Europe the American and Soviet armies were closing in on the German troops, with the Americans coming from the west and the Soviets from the east. An important step achieved in the final plan to defeat Germany was when the two allied armies met on April 25, 1945, joining forces near Torgau in Germany, on the River Elbe."
S_O,"SLO.    	If you are interested, you can still buy Slo Pokes!"
_ADE,"LADE.    	The verb ""lade"" meaning ""to load"" comes from an Old English word ""hladan"". Lade also used to mean ""to draw water"" and indeed gave us our word ""ladle"". So ""lade"" and ""ladle"" are close cousins."
L_RAS,"LIRAS.    	The name ""lira"" is used in a number of countries for currency. It comes from the Latin word for a pound, and is derived from a British pound sterling, the value of a Troy pound of silver. The Turkish lira has been around since the mid 1870s."
ANT_N,"ANTON.    	Anton Chekhov was a Russian writer of short stories and a playwright, as well as a physician. He wrote four classic plays that are often performed all around the world, namely 'The Seagull', 'Uncle Vanya', 'Three Sisters' and 'The Cherry Orchard'. All the time Chekhov was writing, he continued to practice medicine. He is quoted as saying 'Medicine is my lawful wife, and literature is my mistress.'"
NY_,"NYC.    	Jamaica Bay is on the southwestern side of Long Island, New York. The bay is named for the town of Jamaica that is nearby. In turn, the name 'Jamaica' is a corruption of the Lenape name 'Yameco' meaning 'beaver'."
CH_C,"CHIC.    	""Chic"" is a French word meaning ""stylish""."
SO_A,"SOYA.    	What are known as soybeans here in the US are called 'soya beans' in most other English-speaking countries. So, I drink soy milk here in America, but when I am over in Ireland I drink ""soya milk""."
_EIS,"SEIS.    	In Spanish, two x three (dos x tres) equals six (seis)."
SAN_,"SANS.    	Serifs are details on the ends of characters in some typefaces. Typefaces without serifs are known as sans-serif (using the French word ""sans"" meaning ""without""). Some people say that serif fonts are easier to read on paper, whereas sans-serif fonts work better on a computer screen. I'm not so sure though ..."
Y_CA,"YMCA.    	The YMCA is a worldwide movement that has its roots in London, England. There, in 1844, the Young Men's Christian Association (YMCA) was founded with the intent of promoting Christian principles through the development of ""a healthy spirit, mind and body"". The founder, George Williams, saw the need to create YMCA facilities for young men who were flocking to the cities as the Industrial Revolution flourished. He saw that these men were frequenting taverns and brothels, and wanted to offer a more wholesome alternative."
STA_,"STAG.    	Back where I come from, bachelor parties are called stag parties, and bachelorette parties are hen parties. And in Ireland the fairer sex usually isn't welcome at a stag party, not even for entertainment purposes. We tend to focus on the drink ..."
AHOR_,"AHORA.    	Nogales (properly called 'Heroica Nogales') is a city in the Mexican State of Sonora. Nogales lies right on the Mexico-US border, opposite the city of Nogales, Arizona."
EM_LE,"EMILE.    	The sociologist Émile Durkheim is often listed with Max Weber and Karl Marx as the founders of sociology, with Durkheim cited as the 'father of sociology'."
OV_,"OVA.    	A gamete is a reproductive cell that has half the full complement of genes needed to make a normal cell. In sexual reproduction, it takes two gametes, one from each parent, to fuse into one cell which then develops into a new organism. The female gamete is the ovum, and the male the sperm."
ULCE_,"ULCER.    	Until fairly recently, a peptic ulcer was believed to be caused by undue amounts of stress in one's life. It is now known that 70-90% of all peptic ulcers are in fact associated with a particular bacterium."
POS_E,"POSSE.    	I don't think I'll ever make it into a rapper's ""posse"" ..."
O_EON,"ODEON.    	In Ancient Greece an odeon (also 'odeum') was like a small theater, with ""odeon"" literally meaning a ""building for musical competition"". Odea were used in both Greece and Rome for entertainments such as musical shows and poetry readings."
REN_IR,"RENOIR.    	Pierre-Auguste Renoir was a French painter, very much at the forefront of the Impressionist movement. Renoir was a prolific artist, with several thousand works attributed to him. The largest collection of Renoirs is actually in the United States. You can see 181 of his paintings at the Barnes Foundation just outside Philadelphia."
_STOR,"ASTOR.    	Nancy Astor (nee Langhorne) was born in the US, in Virginia. When Nancy was 26 years old she moved to England with her younger sister. In England she married an American living there, Waldorf Astor, and the couple lived a very comfortable life. Nancy Astor became very active in English politics, and eventually became the first woman elected to the British Parliament."
E_S,"EIS.    	""Eis"" is the German word for ""ice""."
AF_AC,"AFLAC.    	In 1999, Aflac (American Family Life Assurance Company) was huge in the world of insurance but it wasn't a household name, so a New York advertising agency was given the task of making the Aflac brand more memorable. One of the agency's art directors, while walking around Central Park one lunchtime, heard a duck quacking and in his mind linked it with ""Aflac"", and that duck has been ""Aflacking"" ever since ..."
P_PSI,"PEPSI.    	The Pepsi-Cola formulation was developed by one Caleb Bradham who made the drink at home and sold it as 'Brad's Drink'. Bradham's aim was to provide a drink that was pleasant to taste, that would aid digestion and boost energy. Included in the formula were pepsin (a digestive enzyme) and kola nuts. These two ingredients inspired the brand name we use today: Pepsi-Cola."
K_BE,"KOBE.    	Kobe is a city on the island of Honshu in Japan, and yes, basketball star Kobe Bryant is named after the Japanese city. The city of Kobe is perhaps most famous for its beef."
J_B,JEB.    	General Jeb Stuart fought with the Confederate States Army during the Civil War. The nickname 'Jeb' was formed from the initials of Stuart's full name: James Ewell Brown Stuart.
_LKS,"ELKS.    	The Benevolent and Protective Order of Elks (BPOE) was founded in 1868, and is a social club that has about a million members today. It started out as a group of men getting together in a ""club"" in order to get around the legal opening hours of taverns in New York City. The club took on a new role as it started to look out for poor families of members who passed away. The club now accepts African Americans as members (since the seventies) and women (since the nineties), but atheists still aren't welcome."
_WI,"DWI.    	In some states, there is no longer a legal difference between a DWI (Driving While Intoxicated) and a DUI (Driving Under the Influence). Other states retain that difference, where by definition a DUI is a lesser offence than a DWI."
_LAW,"SLAW.    	The term ""coleslaw"" is an Anglicized version of the Dutch name ""koolsla"", which in itself is a shortened form of ""Koolsalade"" meaning ""cabbage salad""."
LO_O,"LOCO.    	In Spanish, if one isn't sane (sano) one might be described as crazy (loco)."
R_NT,"RUNT.    	Back around 1500. a runt was an old or decayed tree stump, and by the early 1600s ""runt"" was being used to describe animals that were similarly old and decayed. Ultimately ""runt"" came to mean the smallest and often sickest in a litter."
IB_EN,"IBSEN.    	Henrik Ibsen was a Norwegian playwright, considered by many to be the greatest playwright since William Shakespeare. He was famous for shocking his audiences by exploring subjects that offended the sensibilities of the day (the late 1800s)."
AM/F_,"AM/FM.    	The radio spectrum is divided up into bands based on frequency. So, a ""high"" band would be a band with relatively high frequencies. FM radio falls into the band called Very High Frequency, or VHF. AM radio uses lower frequencies, and so falls into the lower bands of Low, Medium and High Frequency (LF, MF, and HF). Television signals use frequencies even higher than VHF, the Ultra High Frequency band (UHF)."
R_Z,"ROZ.    	Roz Doyle is a character in the wonderful sitcom 'Frasier'. Roz is played, very ably, by the actress Peri Gilpin."
_ETA,"FETA.    	Feta is a Greek cheese made from sheep's milk, or a mixture of sheep's and goat's milk. The cheese is salted and cured in a brine solution for several months before it is eaten."
T_OU,TROU.    	'Trou' is short for 'trousers'.
SAH_B,"SAHIB.    	""Sahib"" is most recognized as a term of address in India, where it is used in much the same way as we use ""mister"" in English."
_TS,"KTS.    	A karat (also 'carat', the spelling outside North America) is a measure of the purity of gold alloys, with 24-carat representing pure gold."
TRI_,"TRIB.    	The Chicago Tribune' was first published in 1847. The most famous edition of 'The Trib' was probably in 1948 when the headline was 'DEWEY DEFEATS TRUMAN', on the occasion of that year's presidential election. When it turned out Truman had actually won, the victor picked up the paper with the erroneous headline and posed for photographs with it ... a famous, famous photo, that must have stuck in the craw of the editor at the time."
TC_,"TCM.    	Turner Classic Movies (TCM) is one of my favorite television channels, delivering just what its name promises: classic movies."
A_ABA,"AQABA.    	The coastal city of Aqaba is the only seaport in the country of Jordan. The city lies at the very northern tip of the Gulf of Aqaba, which is off the Red Sea."
B_S,"BBS.    	A BB gun is an air pistol or rifle that shoots birdshot known as BBs. Birdshot comes in a number of different sizes, from size 9 (0.080"" in diameter) to size FF (.23""). 0.180"" diameter birdshot is size BB, which gives the airgun its name."
LIRA_,"LIRAS.    	The name ""lira"" is used in a number of countries for currency. It comes from the Latin word for a pound, and is derived from a British pound sterling, the value of a Troy pound of silver. The Turkish lira has been around since the mid 1870s."
E_EE,"E LEE.    	Robert E. Lee is of course renowned as a southern officer in the Civil War. He was a somewhat reluctant participant, in that Lee opposed the secession of his home state of Virginia from the Union. At the beginning of the war, President Lincoln invited Lee to take command of the whole Union Army, but Lee declined, choosing instead to stay loyal to his home state."
ERSAT_,"ERSATZ.    	Something described as 'ersatz' is a copy, and usually not a good one. 'Ersatz' comes from the German verb 'ersetzen' meaning 'to replace'."
_UHR,"RUHR.    	The Ruhr is a large urban area in western Germany. The area is heavily populated, and is the fifth largest urban area in the whole of Europe, after Istanbul, Moscow, London and Paris. The Ruhr became heavily industrialized due to its large deposits of coal. By 1850, the area contained nearly 300 operating coal mines. Any coal deposits remaining in the area today are too expensive to exploit."
M_U,"MSU.    	Michigan State University (MSU) is located in East Lansing, Michigan. MSU has the largest study-abroad program of any single-campus university in the US. Programs are offered on all continents of the world, including Antarctica."
_CH,"ACH.    	The exclamation ""ach!"" is usually translated into English as ""oh!"""
S_AW,"SLAW.    	The term ""coleslaw"" is an Anglicized version of the Dutch name ""koolsla"", which in itself is a shortened form of ""Koolsalade"" meaning ""cabbage salad""."
COR_A,"COREA.    	Chick Corea is an American jazz pianist. Corea is noted for his work in the area of jazz fusion, as well as for his promotion of Scientology."
E_ST,"ERST.    	Erstwhile means ""in the past"" or ""once upon a time""."
_BC,"BBC.    	The excellent sitcom ""The Office"" is set in a branch of a paper company in Scranton, Pennsylvania. If you haven't seen the original UK version starring Ricky Gervais, I do recommend you check it out. Having said that, the US cast took the show to a whole new level. Great television ..."
_PAA,MPAA.    	The Motion Picture Association of America's (MPAA) film-rating system is purely voluntary and is not backed by any law. Movie theaters agree to abide by the rules that come with the MPAA ratings in exchange for access to new movies.
_ADE,"SADE.    	The 120 Days of Sodom, or the School of Libertinism' is 1785 novel by the Marquis de Sade. Described variously as erotica and pornography, the novel wasn't published for the first time until 1904, almost a century after the passing of the author. The book's title is descriptive of the plot, in which four wealthy men seal themselves away for 120 days with a harem of 46 victims with the intent of experiencing ultimate sexual gratification."
GM_,"GMT.    	Greenwich Mean Time (GMT) is the time at the Prime Meridian, the meridian that runs through Greenwich in London."
_PODS,"IPODS.    	The iPod is Apple's signature line of portable media players. It first hit the market in 2001 in the form of a hard drive-based device now known as the iPod Classic. Later models all use flash memory, allowing a smaller form factor."
AS_T,ASST.    	A secretary is a type of assistant.
HY_NA,"HYENA.    	The spotted hyena of Sub-Saharan Africa is also known as the laughing hyena because of the sound it oftens makes, which resembles maniacal laughter."
KNE_,"KNEE.    	The stifle is a horse's ""knee"", and as such the joint on the hind leg of the animal, not the foreleg."
MBA_,"MBAS.    	The world's first MBA degree was offered by Harvard's Graduate School of Business Administration, in 1908."
_MPS,"AMPS.    	An electric guitar, for example, needs an amplifier (amp) to take the weak signal created by the vibration of the strings and turn it into a signal powerful enough for a loudspeaker."
AL_S,"ALES.    	The red triangle on the label of a bottle of Bass Ale was registered in 1875 and is UK Registered Trade Mark (TM) No: 00001, the first trade mark issued in the world."
_ASH,"NASH.    	Graham Nash is a singer-songwriter from England. Nash is famous as one of the founders of the Hollies, and as a member of the supergroup Crosby, Stills, Nash & Young."
_OONE,"BOONE.    	Daniel Boone was a pioneer and folk hero. For frontiersman Boone, the frontier was what we now call the state of Kentucky. He led the building of the Wilderness Road through the famous Cumberland Gap in the Appalachians, a route subsequently taken by hundreds of thousands of migrants into Kentucky. Boone fought in the Revolutionary War with distinction, and after the war returned to Kentucky and got himself into land speculation. He became mired in debt, forcing him to emigrate to Missouri to settle down on land that was at that time owned by the French. It was there that he spent the last decades of his life."
SAN_,"SANS.    	Serifs are details on the ends of characters in some typefaces. Typefaces without serifs are known as sans-serif, using the French word ""sans"" meaning ""without"" and 'serif' from the Dutch 'schreef' meaning 'line'. Some people say that serif fonts are easier to read on paper, whereas sans-serif fonts work better on a computer screen. I'm not so sure though ..."
PAB_T,"PABST.    	There appears to be some dispute over whether the Pabst brand of beer ever won a ""blue ribbon"" prize, but the company claims that it did so at the World's Columbian Exposition in Chicago in 1893. The beer was originally called Pabst Best Select, and then just Pabst Select. With the renaming to Blue Ribbon, the beer was sold with an actual blue ribbon tied around the neck of the bottle, until it was dropped in 1916 and incorporated into the label."
I_S,IT'S.    	For what it's worth (FWIW)
RO_O,"ROLO.    	Rolo was a hugely popular chocolate candy in Ireland when I was growing up. Rolo was introduced in the thirties in the UK, and is produced under license in the US by Hershey. I was a little disappointed when I had my first taste of the American version as the center is very hard and chewy. The recipe used on the other side of the Atlantic calls for a soft gooey center."
_CS,ACS.    	Room coolers are air conditioning units.
MOE_,"MOET.    	Moët & Chandon is a French winery, one of the world's largest producers of champagne. The company was founded by wine trader Claude Moët in 1743. The name was changed to Moët & Chandon in the 1830s when Pierre-Gabriel Chandon, an in-law to the Moët family, was given co-ownership. Moët & Chandon owns the famous Dom Pérignon brand name, honoring the Benedictine monk who did so much to improve the quality of champagne."
T_R,"TER.    	""Ter"" is the Latin word for ""three"", commonly used in the medical world on prescriptions as part of the expression ""ter in die"". ""Ter in die"" is Latin for ""three times a day"", abbreviated to ""TID"". ""Bis in die"" (BID) would be twice a day, and ""quater in die"" (QID) would be four times a day."
A_TA,"ACTA.    	Actum (plural acta) is the Latin word for ""deed"". It is used in English to describe many official records, including minutes, proceedings etc."
_ORO,"TORO.    	In a sushi restaurant, the dish called 'toro' is the fatty tissue from belly of the bluefin tuna."
AP_ES,"APSES.    	The apse of a church or cathedral is a semicircular recess in an outer wall, usually with a half-dome as a roof and often where there resides an altar. Originally, apses were used as burial places for the clergy and also for storage of important relics."
SAK_,"SAKI.    	Hector Hugh Munro was a British writer, actually born in Burma. Munro was famous for his short stories, which he published using the pen name ""Saki"". His most well-known story is ""The Open Window"", which ends with the great line ""Romance at short notice was her specialty""."
PABL_,"PABLO.    	""Tortilla Flat"" was the first of John Steinbeck's novels to become a commercial success, published in 1935. The novel was made into a film of the same name in 1942 starring Spencer Tracy and Hedy Lamarr (with Akim Tamiroff playing Pablo)."
NY_,NYC.    	Apparently the first published use of the term 'Big Apple' to describe New York City dates back to 1909. Edward Martin wrote the following in his book 'The Wayfarer in New York':
O_TS,"ORTS.    	Orts are small scraps of food left after a meal. 'Ort' comes from Middle English, and originally described scraps left by animals."
AVAT_R,"AVATAR.    	The Sanskrit word ""avatar"" describes the concept of a deity descending into the earthly life and taking on a persona. It's easy to see how in the world of ""online presences"" one might use the word avatar to describe one's online identity."
_YENA,"HYENA.    	Hyenas have the reputation of being cowardly scavengers. That said, the spotted hyena that lives in Sub-Saharan Africa actually kills about 95% of its food and a pack of spotted hyenas are capable of driving off leopards or lionesses before they can consume their kill."
LENT_,LENTO.    	A lento passage in a piece of music has a slow tempo.
R_ITT,"RAITT.    	Bonnie Raitt is a blues singer, originally from Burbank, California. She has won nine Grammies for her work, but she is perhaps as well known for her political activism as she is for her music. She was no fan of President George W. Bush, and she sure did show it."
_ELI,"DELI.    	The word ""delicatessen"" came into English from the German ""Delikatessen"" meaning ""delicious (delikat-) to eat (essen)""."
NI_,"NIT.    	The NCAA holds two National Invitation Tournaments each season, both men's college basketball events."
N_TL,NATL.    	National Basketball Association (NBA)
MP_A,"MPAA.    	The Motion Picture Association of America's (MPAA) film-rating system (PG-13, R, etc.) is purely voluntary and is not backed by any law. Movie theaters agree to abide by the rules that come with the MPAA ratings in exchange for access to new movies."
GL_,GLO.    	'Dayglo' is a registered trademark used for an ink or paint that glows when exposed to a black light in a darkened room. When Dayglo paint is viewed in daylight the colors can look particularly vivid because they respond to the UV light that is present in sunlight.
_LO,GLO.    	Mop & Glo is brand of floor cleaner and polish.
_ODE,"LODE.    	A lode is a metal ore deposit that's found between two layers of rock or in a fissure. The 'mother lode' is the principal deposit in a mine, usually of gold or silver. 'Mother lode' is probably a translation of 'veta madre', an expression used in mining in Mexico."
_XO,OXO.    	The OXO line of kitchen utensils is designed to be ergonomically superior to the average kitchen too. The intended user of OXO products is someone who doesn't have the normal range of motion or strength in the hands e.g. someone suffering from arthritis.
S_EL,"SHEL.    	Author Shel Silverstein had a varied career and did a lot more than write books. Silverstein was a poet, composer, cartoonist and screenwriter among other things. One of his successful children's books is ""The Giving Tree"", which was first published in 1964. ""The Giving Tree"" tells of a young boy who has a special relationship with a tree in a forest. The message of the book seems to be that the tree provides the little boy with everything he needs."
T_V,"TOV.    	Mazel tov is the Yiddish term for ""good luck!"". I believe that mazel tov is used in the sense that good fortune has already occurred and is being acknowledged, whereas in English our wish of ""good luck"" is for the future."
AZT_C,"AZTEC.    	Coyolxauhqui was the leader of southern star gods of Aztec mythology. Coyolxauhqui ('Face Painted with Bells' in English) ruled over her brothers, who were known as the Four Hundred Southerners."
S_TAR,"SITAR.    	The sitar has been around since the Middle Ages. The sitar is a stringed instrument that is played by plucking, and is used most often in Hindustani classical music. In the West we have been exposed to the instrument largely through the performances of Ravi Shankar and some music by George Harrison of the Beatles, a onetime student of Shankar."
_RAS,ERAS.    	Earned run average (ERA)
L_VA,"LAVA.    	Our word 'volcano' comes from 'Vulcano', the name of a volcanic island off the coast of Italy. The island's name comes from Vulcan, the Roman god of fire. The Romans believed that the island of Vulcano was the chimney of the forge belonging to the god Vulcan. The Romans also believed that the eruptions on Mount Etna in Sicily were caused by Vulcan getting angry and working his forge so hard that sparks and smoke flew out of the top of the volcano."
MOO_,"MOON.    	Artemis was an ancient Greek goddess, the equivalent of the Roman goddess Diana. Artemis was a daughter of Zeus and Leto, and the twin sister of Apollo."
