S_ANS,"STANS.    	Stan Laurel was an English comic actor (born Arthur Stanley Jefferson), who made a great career for himself in Hollywood. Laurel ended up at the Hal Roach studio directing films, intent on pursuing a career in writing and directing. However, he was a sometime actor and was asked to step in when another comic actor, Oliver Hardy, was injured and couldn't perform. Laurel and Hardy started to share a stage together during that time and when it was clear they worked so well together, their partnership was born. Oh, and the oft-quoted story that Clint Eastwood is the son of Stan Laurel ... that's just an urban myth."
HE_,"HE'S.    	""He's Just Not That Into You"" was a line of dialogue from the HBO television series ""Sex and the City"". The line was lifted and used as the title of a self-help book published in 2004. The book was adapted into a romantic comedy film released in 2009, starring an ensemble cast that included Ben Affleck, Jennifer Anniston, Drew Barrymore and Scarlett Johansson. Never saw it ..."
IT_,"-ITE.    	The island we know as Manhattan was inhabited by the Lenape Indians when the first Europeans explorers arrived in the area. According to the logbook of one of the officers on explorer Henry Hudson's yacht, the island was called ""Manna-hata"" in the local language, from which the modern name derives."
U_EP,"UTEP.    	The University of Texas at El Paso (UTEP) was founded in 1914, originally as the Texas State School of Mines and Metallurgy. To this day there is a mine shaft on the campus, and the mascot of the school's sports teams is Paydirt Pete, a prospector from the mining industry. The teams are also known as the UTEP Miners and Lady Miners."
LIO_,"LION.    	The name Sri Lanka translates from Sanskrit into English as ""venerable island"". Before 1970, Sri Lanka was known as Ceylon, a name given to the country during British rule. The lion on the country's national flag symbolizes the fight against British colonialism."
F_AU,"FRAU.    	In Germany, a 'Mr.' (Herr) is married to a 'Mrs.' (Frau), and they live together in a house (Haus)."
_RTS,"ARTS.    	'Martial arts' are various fighting traditions and systems used in combat or simply to promote physical well-being. The term ultimately derives from Latin and means 'Arts of Mars', a reference to Mars, the Roman god of war."
AM/F_,"AM/FM.    	The radio spectrum is divided into bands based on frequency. ""High band"" is composed of relatively high frequency values, and ""low band"" is composed of frequencies that are relatively low. FM radio falls into the band called Very High Frequency, or VHF. Television signals use frequencies even higher than VHF, frequencies in the Ultra High Frequency band (UHF). AM radio uses lower frequencies that fall into the relatively low bands of Low, Medium and High Frequency (LF, MF, and HF)."
IB_X,IBEX.    	Ibex is a common name for various species of mountain goat. 'Ibex' is a Latin name that was used for wild goats found in the Alps and Apennines in Europe.
R_NT,"RENT.    	The musical 'Rent' by Jonathan Larson is based on the Puccini opera 'La bohème'. 'Rent' tells the story of struggling artists and musicians living in the Lower East Side of New York, and is set against the backdrop of the AIDS epidemic. We saw 'Rent' on Broadway quite a few years ago and we were very disappointed ..."
_XIS,"AXIS.    	Before WWII, Hungary's prime minister was lobbying for an alliance between Germany, Hungary and Italy, and worked towards such a relationship that he called an ""axis"". The main Axis powers during the war of course, were Germany, Italy and Japan. However, also included in the relationship were Romania, Bulgaria and the aforementioned Hungary."
_ITRO,"NITRO.    	TNT is an abbreviation for trinitrotoluene, a substance that is sometimes referred to informally as 'nitro'. Trinitrotoluene was first produced in 1863 by the German chemist Joseph Wilbrand, who developed it for use as a yellow dye. TNT is relatively difficult to detonate so it was on the market as a dye for some years before its more explosive properties were discovered."
_IP,"RIP.    	The commonly held belief that the acronym RIP stands for the English ""rest in peace"" isn't quite correct, not completely anyway. RIP is actually an abbreviation for a Latin phrase ""requiescat in pace"", which translates to ""may he rest in peace""."
INDI_,INDIA.    	(55D. Uttar Pradesh city : AGRA)
YE_,"YEW.    	The family of trees known as yews propagate by producing a seed surrounded by soft, sweet and brightly colored aril. Birds eat the fruit and then disperse the seed in their droppings. The birds leave the seed undamaged, and so are unharmed by the potent poisons taxine and taxol that are found within the seed. The seeds are highly toxic to humans."
ENTR_E,"ENTREE.    	""Entrée"" of course means ""entry"" in French. An entrée can be something that helps one get 'an in"", an interview for example perhaps helped along by a recommendation letter. In Europe, even in English-speaking countries, the entrée is the name for the ""entry"" to the meal, the first course. I found it very confusing to order meals when I first came to America!"
_ANTO,"CANTO.    	A canto is a section of a long poem, and is a term first used by the Italian poet Dante. ""Canto"" is the Italian for ""song""."
AG_,"AGR.    	The US Department of Agriculture dates back to 1862, when it was established by then-president Abraham Lincoln."
T_T,"TOT.    	67. With 66-Across, little source of carbs : TATER"
NI_,"NIT.    	A 'beef' is a complaint or a grievance. It's not quite clear how 'beef' came to have this meaning, but one suggestion is that derives from the habit of soldiers at the end of the 1800s complaining about the quality or availability of beef in their rations."
SALA_I,"SALAMI.    	Salame (note the ""e"" at the end) is an Italian sausage that is traditionally associated with the peasant classes. The meat in the sausage is preserved with salt, and it can be hung and stored for as long as ten years. The name ""salame"" comes from ""sale"", the Italian word for salt, and ""-ame"", a suffix indicating a collective noun. Our English word ""salami"" is actually the Italian plural for ""salame""."
AN_AR,"ANWAR.    	Anwar Sadat was the third President of Egypt (succeeding President Nasser), right up to the time of his assassination in 1981. He won the Nobel Peace Prize for his role in crafting the Israel-Egypt Peace Treaty of 1978 that followed the Camp David Peace Accords. It was this move that largely led to his assassination two years later."
SEA_,"SEAS.    	The Mediterranean Sea is almost completely enclosed by land, and is connected to the Atlantic Ocean by the narrow Strait of Gibraltar. The sea takes its name from the Latin 'mediterraneus', which means 'in the middle of land'."
F_D,FAD.    	Man buns are topknots worn by men with long hair.
PS_S,PSAS.    	Public service announcement (PSA)
AVA_AR,"AVATAR.    	I went to the 3D version of ""Avatar"" when I saw it for the first time ... it really is the only way to see that movie!"
_RM,"ARM.    	An 'automatic' is a type of gun, a type of 'arm'."
A_AS,"ANAS.    	The Santa Ana winds are the very dry air currents that sweep offshore late in the year in Southern California. Because these air currents are so dry, they are noted for their influence over forest fires in the area, especially in the heat of the fall. The winds arise from a buildup of air pressure in the Great Basin that lies between the Rocky Mountains and the Sierra Nevada. Under the right conditions, that air spills over the peaks of the Sierra Nevada and basically ""falls"" down the side of the Sierra range, heading for the ocean. As the air falls it becomes drier and heats up so that relative humidity can fall to below 10% by the time it hits the coast."
Z_T,"ZIT.    	The slang term 'zit', meaning ""a pimple"", came into the language in 1966, but no one seems to know its exact derivation."
H_LA,"HULA.    	Hula is the name of the Polynesian dance, and the chant or song that the dance illustrates, that's known as the mele."
STERE_,"STEREO.    	Monophonic sound (""mono"") is sound reproduced using just one audio channel, which is usually played out of just one speaker. Stereophonic sound is reproduced using two audio channels, with the sound from each channel played out of two different speakers. The pair of stereo speakers are usually positioned apart from each other so that sound appears to come from between the two. Quadraphonic sound (4.0 surround sound) uses four audio channels with the sound played back through four speakers often positioned at the corners of the room in which one is listening."
WI_,"WIT.    	Why, but there's many a man hath more hair than wit' is a line from William Shakespeare's play 'The Comedy of Errors'."
S_LEO,ST LEO.    	The first pope named Leo is now known as Pope Saint Leo the Great. He is famous for having met with the feared Attila the Hun and persuading him to turn back his invading force that was threatening to overrun Western Europe.
N_DER,"NADER.    	Ralph Nader has run as a third-party candidate for the office of President of the United States four times now, in every election from 1996 to 2008. Nader's name was first first linked with the presidential race in 1971, when the famous Dr. Benjamin Spock offered to stand aside as candidate in the 1972 race if Nader would agree to run, but he declined."
W_S,"WIS.    	Wisconsin is named for the Wisconsin River, the longest river in the state. The famous missionary Father Jacques Marquette recorded the Algonquian name for the river as 'Meskousing'. This was modified by French explorers to 'Ouisconsin', with the first syllable pronounced just like the French word for 'yes' &#8230; 'oui&#8217;. In the early 1800s this was anglicized to 'Wisconsin'."
B_LO,"BOLO.    	I've never worn a bolo tie, and was surprised to discover that it is a relatively recent invention. The first bolo tie was apparently produced in Wickenburg, Arizona in the late 1940s by a silversmith. The bolo takes its name from the boleadora, an Argentine lariat."
OZO_E,"OZONE.    	Ozone gets its name from the Greek word ozein, meaning ""to smell"". It was given this name as ozone's formation during lightning storms was detected by the gas's distinctive smell. Famously, there is a relatively high concentration of the gas in the 'ozone layer' in the Earth's stratosphere. This ozone layer provides a vital function for animal life on the planet as it absorbs most of the sun's UV radiation. A molecule of ozone is made up of three oxygen atoms, whereas a 'normal' oxygen has just two atoms."
MELE_,"MELEE.    	Our word 'melee' comes from the French 'mêlée', and in both languages the word means ""confused fight""."
OLE_,"OLES.    	""Ole Ole Ole!"" is chanted at soccer games by many Spanish-speaking (or -shouting!) fans. I am very proud to claim that the fans of the Irish national team have adopted the chant as their own, and it can be heard practically non-stop when Ireland is playing (with some inventive melody behind it!)."
Z_T,"ZIT.    	The slang term 'zit', meaning ""a pimple"", came into the language in 1966, but no one seems to know its exact derivation."
NAV_,"NAVE.    	In large, Christian churches, the nave is the main approach to the altar, where most of the faithful are seated."
K_N,"KAN.    	In the 1939 classic movie 'The Wizard of Oz', the Kansas scenes are depicted in monochrome sepia tones. This effect is actually called out in the original book by L. Frank Baum. In 'The Wonderful Wizard of Oz', Baum describes Kansas as being 'in shades of gray', and the farmhouse in which Dorothy lives as having an 'air of grayness'. The house was also located in the middle of a prairie with grass burnt gray by harsh sun. And Dorothy&#8217;s aunt and uncle are described as 'gray with age'."
I_K,"INK.    	Octopuses and squid have the ability to release a dark pigment into the water as a means of escape. The dark pigment is called cephalopod ink (the squid and octopus belong to the class cephalopod). The dark color is created by melanin, the same substance that acts as a pigment in human skin."
OBI_,OBIS.    	The sash worn as part of traditional Japanese dress is known as an obi. The obi can be tied in what is called a butterfly knot.
_ORERO,"TORERO.    	""Toreador"" is an old Spanish word for a bullfighter, but it's a term not used any more in Spain nor in Latin America. In English we use the term ""toreador"", but in Spanish a bullfighter is a ""torero"". A female bullfighter in a 'torera'."
I_ANE,"INANE.    	'Falderal' (also 'folderal') is a nonsense word that originated in the 18th century. Aptly enough, 'folderol' means 'nonsense'."
_OSSE,FOSSE.    	'Fosse' is a musical revue that opened on Broadway in 1999 and ran for over a thousand performances. It showcases the choreography of Bob Fosse.
AI_,"AIR.    	The full name of the musical is ""Hair: The American Tribal Love-Rock Musical"". This controversy work outraged many when it was first performed in the sixties, as it attacked many aspects of life at the time. The song ""Air"" is a satirical look at pollution, sung by a character who has just come onto the stage wearing a gas max. The opening lines are ""Welcome, sulfur dioxide. Hello carbon monoxide. The air ... is everywhere"". How things have changed in fifty years, said he, satirically ..."
EVIA_,"EVIAN.    	Évian-les-Bains (or simply Évian) is in the very east of France, on the shores of Lake Geneva directly across the lake from Lausanne, Switzerland. As one might imagine, Évian is the home of Évian mineral water, the most successful business in town. Personally, I can't stand the distinctive taste of Évian water ..."
_OT,"ROT.    	Blarney is a town in County Cork in the south of Ireland. Blarney is home to Blarney Castle, and inside the castle is the legendary Blarney Stone. ""Kissing the Blarney Stone"" is a ritual engaged in by oh so many tourists (indeed, I've done it myself!), but it's not a simple process. The stone is embedded in the wall of the castle, and in order to kiss it you have to sit on the edge of the parapet and lean way backwards so that your head is some two feet below your body. There is a staff member there to help you and make sure you don't fall. The Blarney Stone has been labelled as the world's most unhygienic tourist attraction! But once you've kissed it, supposedly you are endowed with the ""gift of the gab"", the ability to talk eloquently and perhaps deceptively without offending. The term 'blarney' has come to mean flattering and deceptive talk."
_AP,"NAP.    	A 'nap' is a soft and perhaps fuzzy surface on cloth, leather, a carpet and even a tennis ball."
AC_,"ACS.    	The modern form of air conditioning that is still used today was invented by Willis Carrier in 1902. He co-founded the Carrier Engineering Corporation in New York in 1915. The Carrier Corporation eventually moved to Syracuse, New York in 1937. Beyond the world of air conditioning, the Carrier name has been associated with Syracuse University's famous Carrier Dome since it opened in 1980, and which the largest on-campus basketball stadium in the country."
REA_,"REAR.    	The rank of rear admiral is usually the lowest of the 'admiral' ranks. The term originated with the Royal Navy. In days gone by, an admiral would head up the activities of a naval squadron from the central vessel. He would be assisted by a 'vice admiral' who acted from the lead vessel. There would also be a lower-ranking admiral to command the ships at the rear of the squadron, and this was the 'rear admiral'."
_UROS,"EUROS.    	The European Union today stands at a membership of 27 states. The Euro is the official currency of only 16 of those 27 states. The list of states not using the Euro include the UK, Denmark, Sweden and Norway."
_MP,"IMP.    	HBO's 'Game of Thrones' is a fantasy television drama that is adapted from a series of novels by George R. R. Martin called 'A Song of Ice and Fire'. 'Game of Thrones' is actually filmed in and around Belfast, Northern Ireland."
SCIO_,"SCION.    	Scion comes from the old French word ""sion"" or ""cion"", meaning ""a shoot or a twig"". In botanical terms today, a scion is used in grafting two compatible plants together. In grafting, one plant is selected for its root system (the 'rootstock'), and the other plant is selected for its stems, leaves and fruit (the ""scion""). The term scion migrated naturally into the world of family history. A scion is simply a descendant, a son or a daughter and therefore a branching point in the family tree."
C_IRO,"CAIRO.    	Cairo is the capital city of Egypt. It is the largest city on the continent of Africa and is nicknamed ""The City of a Thousand Minarets"" because of its impressive skyline replete with Islamic architecture. The name ""Cairo"" is a European corruption of the city's original name in Arabic, ""Al-Qahira""."
RI_,"RIT.    	Rit. (or sometimes ritard.) is the abbreviation for ritardando, a musical direction to slow down the tempo."
W_T,"WIT.    	Aristotle was actually a student of Plato in Ancient Greece (and in turn, Plato was a student of Socrates). Aristotle's most famous student was Alexander the Great."
_SAS,PSAS.    	Public service announcement (PSA)
L_T,LET.    	A bad service in tennis might result in a 'let'.
COL_,COLE.    	Cole Hamels is a starting pitcher for the Philadelphia Phillies. Hamels is married to Heidi Strobel who was a contestant on the sixth series of the reality television show 'Survivor'.
ZO_,"ZOE.    	American actress Zoë Saldana played the Na'vi princess in 'Avatar', and Uhura in the 2009 movie 'Star Trek' (and sequels). Saldana seems to pick the right movies, as she is the only actress to have three different films in the top twenty at the box office for three consecutive weeks ('Avatar', 'The Losers' and 'Death at a Funeral')."
R_CS,"ROCS.    	The mythical roc is a huge bird of prey, reputedly able to carry off and eat elephants. The roc was said to come from the Indian subcontinent. The supposed existence of the roc was promulgated by Marco Polo in the accounts that he published of his travels through Asia."
SH_BA,"SHEBA.    	Sheba is referenced in the Bible several times. The ""Queen of Sheba"" is mentioned as someone who traveled to Jerusalem to behold the fame of King Solomon. No one knows for sure where the kingdom of Sheba was located, although there is evidence that it was actually the ancient Semitic civilization of Saba. The Sabeans lived in what today is Yemen, on the Arabian Peninsula."
LI_,"LIL.    	Rapper Lil Wayne's real name is ... Dwayne Carter, Jr."
TO_,"TOV.    	'Tov' is the Hebrew word for 'good', as in 'mozel tov', meaning 'good luck'."
_ETA,"META.    	In recent decades the prefix 'meta-' has started to be used as a standalone adjective. In this sense 'meta' means 'self-referential', describing something that refers to itself. For example, 'This sentence starts with the word 'this' and ends with the word 'this'' might be called a meta sentence. A movie that is about the making of the very same movie could also be described as meta."
_EZ,"NEZ.    	Pince-nez are eyeglasses clipped to the bridge of the nose. ""Pince-nez"" is French, translating as 'pinch the nose'."
_ELI,"DELI.    	Carnegie Deli in Midtown Manhattan opened in 1937, and is located next to Carnegie Hall. The restaurant is noted for the attitude of its waiters, who are deliberately surly. Carnegie Deli also serves up huge portions, and so the establishment's motto is apt: if you can finish your eal, we've done something wrong."
HA_,HAI.    	Yokohama is the second-most populous city in Japan. Yokohama lies on Tokyo Bay and is just a 40-minute drive from the nation's capital.
_MUT,"SMUT.    	'Smut' means 'dirt, smudge' and more recently 'pornographic material'. The term comes from the Yiddish 'schmutz', which is a slang word used in English for dirt, as in 'dirt on one's face'."
_DLER,"ADLER.    	The character Irene Adler only appeared in one of the Sherlock Holmes stories by Sir Arthur Conan Doyle. In that story, 'A Scandal in Bohemia', Holmes expresses remarkable admiration for Adler as a woman and as a foe. As a result, derivative works in the Holmes genre often feature Adler as something of a romantic interest for Sherlock."
_OSSE,POSSE.    	Our word 'posse' comes from an Anglo-Latin term from the early 15th century 'posse comitatus' meaning 'the force of the county'.
STERE_,"STEREO.    	Monophonic sound (""mono"") is sound reproduced using just one audio channel, which is usually played out of just one speaker. Stereophonic sound is reproduced using two audio channels, with the sound from each channel played out of two different speakers. The pair of stereo speakers are usually positioned apart from each other so that sound appears to come from between the two. Quadraphonic sound (4.0 surround sound) uses four audio channels with the sound played back through four speakers often positioned at the corners of the room in which one is listening."
Y_W,"YEW.    	Yew is the wood of choice for the longbow, a valued weapon in the history of England. The longbow is constructed with a core of yew heartwood (as the heartwood resists compression) that has a sheath of yew sapwood (as the sapwood resists stretching). The yew was in such demand for longbows that for centuries yew trees were in short supply in Britain and the wood had to be imported from all over Europe."
_SS,"SSS.    	The US government maintains information on all males who are potentially subject to military conscription, using what is called the Selective Service System (SSS). In the event that a draft was held, men registered would be classified into groups to determine eligibility for service. Class 1-A registrants are those available for unrestricted military service. Other classes are 1-A-O (conscientious objectors available for noncombatant service), 4-A (registrants who have completed military service) and 4-D (ministers of religion)."
ORIGAM_,ORIGAMI.    	Origami is the traditional Japanese art form of paper folding. The word 'origami' is derived from 'ori' (folding) and 'kami' (paper).
IS_AM,"ISLAM.    	In Arabic, the straight path is ""Sirat al-Mustaqim"". It can also be called the right path, or the Islamic faith."
LEN_O,LENTO.    	A lento passage is a piece of music that has a slow tempo.
R_SIE,ROSIE.    	Rosie the Riveter is a cultural icon that represented women working in factories across the country during WWII as part of the war effort. The term 'Rosie the Riveter' first appeared as the title of a 1942 song that was a national hit.
F_RO,"FARO.    	Faro is a card game, somewhat akin to Baccarat, that was popular in England and France in the 18th century. It made it to the Old West, where it became a favorite of Doc Holliday and Wyatt Earp. The origin of the name ""Faro"" is unclear. One popular theory is that Faro is a contraction of 'pharaoh' given that Egyptian motifs used to be common on playing cards of the period. There's another theory involving the usual suspects: Irish immigrants, famines ..."
B_RR,"BARR.    	The comedienne Roseanne Barr is perhaps best known as the star of her own sitcom called 'Roseanne' in which she played the character Roseanne Conner. In 2012 Barr unsuccessfully vied for the Green Party's nomination for US President. She didn't give up though, and was successful in winning the nomination of the Peace and Freedom Party. In the 2012 presidential election she earned over 60,000 votes, and placed sixth in the list of candidates."
OS_A,"OSSA.    	Mount Ossa in Greece is located between Mt. Pelion in the south, and the famed Mt. Olympus in the north. Mount Ossa is also known as Kissavos."
S_IEL,"SPIEL.    	A spiel is a lengthy speech or argument designed to persuade, like a sales pitch. ""Spiel"" comes to us from German, either directly (""spiel"" is the German for ""play"") or via the Yiddish ""shpil""."
AM/_M,"AM/FM.    	The radio spectrum is divided into bands based on frequency. ""High band"" is composed of relatively high frequency values, and ""low band"" is composed of frequencies that are relatively low. FM radio falls into the band called Very High Frequency, or VHF. Television signals use frequencies even higher than VHF, frequencies in the Ultra High Frequency band (UHF). AM radio uses lower frequencies that fall into the relatively low bands of Low, Medium and High Frequency (LF, MF, and HF)."
A_R,"AIR.    	Jacques-Yves Cousteau started off his career in the French Navy, heading for a working life in aviation. Because of a car accident, he had to abandon that objective, and instead went to sea. Famously, he invented the aqualung, and is known as the father of SCUBA diving."
SE_ENA,SERENA.    	Serena Williams is the younger of the two Williams sisters playing professional tennis. Serena has won more prize money in her career than any other female athlete.
_IP,RIP.    	Rest in peace (RIP)
E_NY,"EENY.    	Eeny, meeny, miny, moe,"
_ARI,"HARI.    	Mata Hari was a stage name. Margaretha Geertuida Zella was born in the Netherlands in 1876. After an unsuccessful and somewhat tragic marriage, Zella moved to Paris in 1903 where she struggled to make a living. By 1905 she was working as an exotic dancer, and using the name Mata Hari. She was a successful courtesan, notably moving in the various circles of high-ranking military officers. She apparently worked as a double agent, both for the French and the Germans. When she was found guilty by the French of passing information to the Germans, she was tried, found guilty and executed by firing squad in 1917, at the age of 41."
