_EO,"NEO-.    	By definition, a neoconservative supports the use of American power and military to bring democracy, liberty, equality and human rights to other countries."
_NT,"ONT.    	The Canadian province of Ontario takes its name from the Great Lake. In turn, Lake Ontario's name is thought to be derived from 'Ontari:io', a Huron word meaning 'great lake'. Ontario is home to the nation's capital of Ottawa as well as Toronto, Canada's most populous city (and the capital of the province)."
ING_,"INGE.    	William Inge's 1957 play ""The Dark at the Top of the Stairs"" won a Tony for Best Play and was made into a film in 1960."
_AN,"SAN.    	San Marino is a small enclave in northern Italy with an area of just under 25 square miles. It is the oldest sovereign state and constitutional republic in the world, and has the world's oldest constitution (dating back to 1600). What is most impressive to me is that San Marino has no national debt and a budget surplus. One can only dream ..."
_MS,EMS.    	Emergency Medical Services (EMS)
_SH,"ASH.    	When Mt. Vesuvius erupted in 79 AD, not only the Pompeii was buried by the lava flows and ash. The eruption also destroyed the towns of Stabiae, Oplontis and Herculaneum. Herculaneum was a smaller town than Pompeii, but had a wealthier population. It continues to be an important archaeological site."
_EDS,"REDS.    	The Red Scare (i.e. anti-communist sentiment) following WWII had such an effect on the populace that it even caused the Cincinnati baseball team to change its name from the Reds. The team was called the Cincinnati Redlegs from 1953-1958, as the management was fearful of losing money due to public distrust of any association with ""Reds""."
_ONA,"OONA.    	Oona O'Neill dated J. D. Salinger and Orson Welles in her teens, but ended up marrying Charlie Chaplin. She was still pretty young when she married Chaplin, much to the dismay of her famous father, the playwright Eugene O'Neill. After the marriage, Eugene disowned Oona as he was pretty upset that 54-year-old Chaplin could marry his 18-year-old daughter."
SA_,"SAO.    	São Paulo is the largest city in Brazil. It is the city with the highest number of helicopters in the world. This is partly driven by the horrendous traffic jams in São Paulo, but also by the wealthy having a very real fear of being kidnapped on the city's streets."
C_N,"CNN.    	Anderson Cooper is a respected news personality on CNN and on various shows around the dial. My favorite appearances of his, although he would call them trivial I am sure, was as host of a great reality game show called ""The Mole"" that aired in 2001."
A_TA,"ALTA.    	Alta ski resort actually lies within the Salt Lake City Metropolitan Area. The first ski lift in the resort was opened way back in 1939. Today, Alta is one of only three ski resorts in the country that prohibits snowboarding (along with Deer Valley, Utah and Mad River Glen, Vermont. The ski resort of Snowbird located next to Alta has been in operation since 1971."
STY_,"STYX.    	The River Styx of Greek mythology was the river that formed the boundary between the Earth and the Underworld (or Hades). The souls of the newly dead had to cross the River Styx in a ferry boat piloted by Charon. Traditionally, a coin would be placed in the mouths of the dead ""to pay the ferryman""."
TE_,"TEN.    	The Big Ten is the nation's oldest Division I college athletic conference and today is comprised of not ten, but twelve colleges mainly located in the Midwest. The conference was founded in 1896 and earned the name ""Big Nine"" in 1899 when Iowa and Indiana joined to bring the number of teams in the conference to nine. The conference name was changed to the Big Ten after Michigan rejoined in 1917. Right after WWII, the University of Chicago dropped out so the conference became known as the Big Nine again until 1949. The official designation of ""Big Ten"" was adopted in 1987 when the conference (once again with with a complement of ten teams) registered as a not-for-profit corporation. It was decided to keep the official name of Big Ten when Penn State joined in 1990 bringing the number of schools to the level of eleven, and even when the University of Nebraska-Lincoln joined in 2011 as the twelfth team."
NE_P,"NEAP.    	Tides are caused by the gravitational pull of the moon on the oceans. At neap tide, the smaller gravitational effect of the sun cancels out some of the moon's effect. At spring tide, the sun and the moon's gravitational forces act in concert causing more extreme movement of the oceans."
O_S,ORS.    	Operating Rooms.
AR_O,ARCO.    	'Arco' is a musical direction instructing a string player to return to normal bowing technique after a passage played using some other technique (perhaps pizzicato).
LA_,"LAN.    	You may have a Local Area Network (LAN) in your house. If you've got a PC and a router or switch, likely attached to some modem, then you have a LAN."
UP_,"UPI.    	Founded in 1958, United Press International (UPI) was one of the biggest news agencies in the world, sending out news by wire to the major newspapers. UPI ran into trouble with the change in media formats at the end of the twentieth century and lost many of its clients as the afternoon newspapers shut down due to the advent of television news. UPI, which once employed thousands, still exists today but with just a handful of employees."
IAG_,"IAGO.    	Iago is the schemer in Shakespeare's ""Othello"". Iago is a soldier who fought alongside Othello and feels hard done by, missing out on promotion. He hatches a plot designed to discredit his rival Cassio by insinuating that Cassio is having an affair with Desdemona, Othello's wife. By the end of the play it's Iago himself who is discredited and Othello (before committing suicide) apologizes to Cassio for having believed Iago's lies. Heavy stuff ..."
HA_,"HAN.    	The Han Dynasty was the second imperial dynasty of China and lasted from 206 BC to 220 AD. It came after the Qin Dynasty, and before the Three Kingdoms."
E_G,"ERG.    	An erg is a unit of energy, or mechanical work. ""Erg"" comes from the Greek word ""ergon"", meaning ""work"". A dyne is a unit of force. The name ""dyne"" comes from the Greek ""dynamis"" meaning power or force. Ergs and dynes are related to each other in that one erg is the amount of energy need to move a force of one dyne over a distance of one centimeter."
AL_A,"ALTA.    	In Spanish, 'baja' is 'low' and 'alta' is 'high'."
_ZRA,"EZRA.    	Ezra Klein is a journalist and blogger who writes for 'The Washington Post', 'Bloomberg' and 'MSNBC'. Klein's contribution at 'The Washington Post' is the most-read blog that the paper publishes."
S_N,SEN.    	Sen-Sen is a breath freshener that has been available for purchase since the late 1800s.
S_O,"SAO.    	Sao Gonçalo is the second largest city in the Brazilian state of Rio de Janeiro, after the state of capital of Rio de Janeiro."
IL_A,"ILSA.    	I love the words of one critic describing the chemistry between Bogart and Bergman in the film ""Casablanca"" ... ""she paints his face with her eyes"". Wow!"
_SH,ASH.    	Clever wording ...
_LM,"ELM.    	Dutch elm disease is a fungus devastating to all species of elm trees that is transmitted by the elm bark beetle. The disease is thought to have originated in Asia and is now rampant in Europe and North America. Even though there is a hybrid of elm known as the Dutch elm, the disease isn't named after the tree. Rather, the disease is called ""Dutch"" as it was identified in 1921 by a phytopathologist (plant pathologist) in the Netherlands."
I_O,IMO.    	In My Opinion ...
_RGO,"ARGO.    	'Argo' is a 2012 movie that is based on the true story of the rescue of six diplomats hiding out during the 1979 Iran hostage crisis, as recounted in the book 'The Master of Disguise' by Tony Mendez. The film was directed by and stars Ben Affleck and is produced by Grant Heslov and George Clooney, the same pair who produced the excellent 'Good Night, and Good Luck'."
_ESA,MESA.    	'Tenis de mesa' ('table tennis' in English) is the Spanish name for the sport of ping pong.
_OL,"LOL.    	LOL is an abbreviation used in Instant Messages and phone texting, an abbreviation of ""Laughing Out Loud""."
RO_,ROC.    	Roc-a-Fella Records was founded in 1996 ... but I really don't do hip-hop ...
RED_,"REDS.    	Médoc is an appellation for wine in the Bordeaux region of France. The area produces red wines almost exclusively, and no white wine can be labelled as ""Médoc""."
OA_,"OAS.    	The Organization of American States (OAS) has its headquarters in Washington, D.C. All the independent states in the Americas are members of the group, except Honduras which had its membership suspended after the country's 2009 coup."
S_AB,"SAAB.    	SAAB stands for Svenska Aeroplan AB, which translates into English as Swedish Aeroplane Limited. So yes, SAAB was, and still is mainly an aircraft manufacturer. If you take small hops in Europe you will often find yourself on a SAAB passenger plane. The SAAB automobile division was acquired by General Motors in the year 2000."
T_N,"TEN.    	The US ten-dollar bill features the image of Alexander Hamilton, the first US Secretary of the Treasury, on the obverse. As such, ten-dollar bills are sometimes called 'Hamiltons'. By the way, the $10 bill is the only US currency in circulation in which the portrait faces to the left. The reverse of the ten-dollar bill features the US Treasury Building."
LO_,"LOA.    	The Hawaiian expression 'Aloha nui loa' translates as 'much love, fondest regards'."
UF_,"UFO.    	The 1996 sci-fi action movie ""Independence Day"" is must-see-TV at our house on or around the 4th of July every year. The movie was supposed to come out in 1996 on July 3rd but there was so much anticipation that many theaters started screening the day before. At one point after release, ""Independence Day"" was the second-highest grossing movie in history (""Jurassic Park"" was number one at the time)."
R_A,"RIA.    	A ria is actually a drowned river valley. It is formed where the sea level has raised, and the sea has flooded a valley. As a result, a ria can be confused with a fjord. A fjord is also a drowned valley, but that valley was originally formed by glaciation and not by river erosion."
_FO,"UFO.    	Disc-shaped flying objects have been reported in the sky since the Middle Ages. In the modern era the event that launched the term ""flying saucer"" was a UFO sighting in 1947 that was covered widely in the media. Kenneth Arnold reported seeing nine unidentified flying objects in formation near Mount Rainier in Washington. In describing the objects he repeatedly used the words ""saucer"", ""disc"" and ""pie-plate"". Newspapers latched onto the terminology, and we've been seeing ""flying saucers"" ever since."
E_M,"ELM.    	Dutch elm disease is a fungus devastating to all species of elm trees that is transmitted by the elm bark beetle. The disease is thought to have originated in Asia and is now rampant in Europe and North America. Even though there is a hybrid of elm known as the Dutch elm, the disease isn't named after the tree. Rather, the disease is called ""Dutch"" as it was identified in 1921 by a phytopathologist (plant pathologist) in the Netherlands."
_WA,"TWA.    	Trans World Airlines (TWA) was a big carrier in the US, but was perhaps even more recognized for its extensive presence in Europe and the Middle East. For many years, especially after the collapse of Pan-Am, TWA was considered the unofficial flag carrier for the US. The company started in 1930, the product of a forced merger of Transcontinental Air Transport and Western Air Express. The Transcontinental and Western Air that resulted (the original meaning of the acronym TWA) was what the Postmaster General wanted, a bigger airline to which the Postal Service could award airmail contracts."
_AO,"SAO.    	Sao Jose Bay, Baía de São José in Portuguese, is in the northeastern part of Brazil."
NA_,"NAS.    	Rapper Nas used to go by another stage name, Nasty Nas, and before that by his real name, Nasir bin Olu Dara Jones. Nas released his first album ""Illmatic"" in 1994, and inventively titled his fifth studio album 'Stillmatic', released in 2001. Not my cup of tea, I would say ..."
AM_S,"AMOS.    	Wally Amos was a talent agent, one who was in the habit of taking home-baked cookies with him as an enticement to get celebrities to see him. He was urged by friends to open a cookie store (the cookies were that delicious, I guess) and this he did in Los Angeles in 1975 using the name 'Famous Amos'. The store was a smash hit and he was able build on the success by introducing his cookies into supermarkets. The brand was eventually bought up making Wally a rich man, and Famous Amos cookies are still flying off the shelf."
A_O,AMO.    	Ella giammai m'amo' is an aria from Verdi's grand opera 'Don Carlos'.
_DELE,"ADELE.    	""Die Fledermaus"" is a really lovely operetta composed by Johann Strauss II, first performed in 1874. ""Fledermaus"" is German for ""bat"" (literally ""flying mouse""). The title comes from the fact that one of the characters (Falke) was abandoned drunk, dressed as a bat, in the center of town one evening. As he was subject to ridicule, the machinations of the story are designed as revenge for Falke's humiliation."
ID_,"IDI.    	Idi Amin received most of his military training in the British armed forces, eventually achieving the highest rank possible for a Black African in the British Colonial Army in 1959, that of Warrant Officer. On his return to Uganda Amin joined his country's military and quickly rose to the rank of Deputy Commander of the Army. During that time he was quite the athlete. He was a noted rugby player and swimmer, and for nine years held the Ugandan national light-heavyweight boxing title. By the early seventies, Amin was commander of all the armed forces of Uganda and in 1971 seized power in a military coup, displacing the country's president Milton Obote. There followed seven years of brutal rule by Amin during which it is estimated that between 100,000 and 500,000 people were murdered. Amin was ousted from power in 1979 after a war with Tanzania, and fled to Libya where he stayed for a year. He then moved to Saudi Arabia, where he was financially supported by the Saudi Royal Family for the remainder of his life. Amin died in 2003."
S_GA,"SEGA.    	Sega is a Japanese video game company headquartered in Tokyo. Sega actually started out 1940 in the US as Standard Games and was located in Honolulu, Hawaii. The owners moved the operation to Tokyo in 1951 and renamed the company to Service Games. The name 'Sega' is a combination of the first two letters of the words 'Se-rvice' and 'Ga-mes'."
O_DE,"OLDE.    	The word ""olde"" wasn't actually used much earlier than the 1920s. ""Olde"" was introduced to give a quaint, antique feel to brand names, shop names etc."
_ZI,UZI.    	The first Uzi submachine gun was designed in the late 1940s by Major Uziel Gal of the Israel Defense Forces who gave his name to the gun.
H_L,"HAL.    	In Arthur C. Clarke's ""Space Odyssey"" (famously adapted for the big screen as ""2001: A Space Odyssey"") the computer system that went rogue was called HAL 9000, or simply ""HAL"". HAL stands for Heuristically programmed ALgorithmic computer. Even though, Clarke denied it, there's a good argument that can be made that the acronym HAL is a veiled reference to IBM, the big player in the world of computing at the time of the novel's publication (1968). The acronym HAL is just a one-letter shift from the initials ""IBM""."
SA_,SAN.    	The famous San Andreas Fault in California lies along the boundary between the Pacific and North American tectonic plates. The faultline was named in 1985 after a small lake just south of San Francisco called Laguna de San Andreas.
AL_I,"ALAI.    	Even though jai alai is often said to be the fastest sport in the world (because of the speed of the ball), in fact golf balls often get going at a greater clip."
_ZRA,"EZRA.    	Ezra Cornell was an associate of Samuel Morse and made his money in the telegraph business. After Ezra retired he co-founded Cornell University in Ithaca, New York. He provided a generous endowment and donated his farm as a site for the school, and was then rewarded by having the institute named after him."
_PI,"RPI.    	The Rensselaer Polytechnic Institute (RPI) is a private school in Troy, New York. The university is named after its founder Stephen Van Rensselaer who set up the school in 1824. The goal of RPI has always been the ""application of science to the common purposes of life"", an objective set by the founder. Given that, the name for the school's sports teams is quite apt: the Engineers."
AP_,"APR.    	Patriots' Day is a public holiday observed in the states of Massachusetts, Maine and Wisconsin that commemorates the Battles of Lexington and Concord, the first engagements of the Revolutionary War. The battles took place in 1775, in April, and so the holiday is observed in that same month."
H_L,"HAL.    	In Arthur C. Clarke's ""Space Odyssey"" (famously adapted for the big screen as ""2001: A Space Odyssey"") the computer system that went rogue was called HAL 9000, or simply ""HAL"". HAL stands for Heuristically programmed ALgorithmic computer. In the French version of the film, HAL's name was changed to CARL."
D_AY,"D-DAY.    	""Saving Private Ryan"" is an epic 1998 movie directed by Steven Spielberg, a real ""must see"". The D-Day invasion scenes were short over a two-month period on the southeast coast of Ireland."
AE_OP,"AESOP.    	In Aesop's fable 'The Hares and the Frogs', some hares get freaked out by the sound of leaves in the wind. As they race away en masse, they scare frogs into their own stampede, jumping as a group into a river. When the hares notice the frogs in panic, they come to their senses and stand their ground."
U_I,"UPI.    	United Press International (UPI) was one of the biggest news agencies in the world, sending out news by wire to the major newspapers. UPI ran into trouble with the change in media formats at the end of the twentieth century and lost many of its clients as the afternoon newspapers shut down due to the advent of television news. UPI, which once employed thousands, still exists but with only a handful of employees."
_RS,ORS.    	Operating Room (OR)
_TAR,"STAR.    	The Hollywood Walk of Fame is a series of sidewalks taking up 15 blocks of Hollywood Boulevard and 3 blocks of Vine Street in Hollywood. The Walk of Fame is an ever-changing monument dedicated to those who have achieved greatness in the entertainment industry, both in front of and behind the camera. The first stars installed in the sidewalk were a group of eight, officially laid in 1960. That group consisted of:"
SE_A,"SEGA.    	Sega is a Japanese video game company headquartered in Tokyo. Sega actually started out 1940 in the US as Standard Games, located in Honolulu. The owners moved the operation to Tokyo in 1951 and renamed the company to Service Games. The name 'Sega' is a combination of the first two letters of the words 'Se-rvice' and 'Ga-mes'."
_TYX,"STYX.    	The River Styx of Greek mythology was the river that formed the boundary between the Earth and the Underworld (or Hades). The souls of the newly dead had to cross the River Styx in a ferry boat piloted by Charon. Traditionally, a coin would be placed in the mouths of the dead ""to pay the ferryman""."
N_R,"NPR.    	Chicago Public Radio produces one of my wife's favorite shows, ""Wait Wait ... Don't Tell Me!"" It is indeed a fun game show. There should be more game shows of that ilk on the radio in my humble opinion ..."
OA_,"OAS.    	The Organization of American States (OAS) has its headquarters in Washington, D.C. All the independent states in the Americas are members of the group except Honduras, which had her membership suspended after the country's 2009 coup."
O_T,"ONT.    	Lake Superior is the largest of the Great Lakes, and the largest freshwater lake in the world by area. The lake was referred to by the first French explorers as 'le lac supérieur', which translates literally as 'the upper lake'. The British anglicized the name to 'Lake Superior'."
_PF,"SPF.    	In theory, the sun protection factor (SPF) is a calibrated measure of the effectiveness of a sunscreen in protecting the skin from harmful UV rays. The idea is that if you wear a lotion with say SPF 20, then it will take 20 times as much UV radiation to cause the skin to burn if using lotion, than without it. I say just stay out of the sun ..."
EM_,"EMS.    	There are two letters M in the word 'museum', one at either end."
_EBA,"REBA.    	Pee-wee's Playhouse' is a children's television show that aired from 1986 to 1990. The star was comedian Paul Reubens, playing his character Pee-wee Herman. Included in the cast was Lawrence Fishburne (who played Cowboy Curtis), Phil Hartman (who played Captain Carl) and S. Epatha Merkerson (who played Reba the Mail Lady)."
ALT_,"ALTA.    	In Spanish, 'baja' is 'low', and 'alta' is 'high'."
_LSA,"ILSA.    	Ilsa Lund was of course played by Ingrid Bergman in the 1942 movie ""Casablanca"". I love the words of one critic describing the chemistry between Bogart and Bergman in this film: ""she paints his face with her eyes"". Wow ..."
ID_,"IDI.    	Idi Amin received most of his military training in the British armed forces, eventually achieving the highest rank possible for a Black African in the British Colonial Army in 1959, that of Warrant Officer. On his return to Uganda Amin joined his country's military and quickly rose to the rank of Deputy Commander of the Army. During that time he was quite the athlete. He was a noted rugby player and swimmer, and for nine years held the Ugandan national light-heavyweight boxing title. By the early seventies, Amin was commander of all the armed forces of Uganda and in 1971 seized power in a military coup, displacing the country's president Milton Obote. There followed seven years of brutal rule by Amin during which it is estimated that between 100,000 and 500,000 people were murdered. Amin was ousted from power in 1979 after a war with Tanzania, and fled to Libya where he stayed for a year. He then moved to Saudi Arabia, where he was financially supported by the Saudi Royal Family for the remainder of his life. He died in 2003."
_VE,"EVE.    	The most famous D-Day in history was June 6, 1944, the date of the Normandy landings in WWII. The term ""D-Day"" is used by the military to designate the day on which a combat operations are to be launched, especially when the actual date has yet to be determined. What D stands for seems to have been lost in the mists of time although the tradition is that D just stands for ""Day"". In fact, the French have a similar term, ""Jour J"" (Day J), with a similar meaning. We also use H-Hour to denote the hour the attack is to commence."
AR_O,"ARNO.    	The Arno is the principal river in the Tuscany region of Italy, passing through the cities of Florence and Pisa. Famously the Arno flooded in 1966, the worst flood in the region for centuries. There were numerous deaths and extensive destruction of priceless art treasures, particularly in Florence."
AM_,"AMP.    	An electric guitar, for example, needs an amplifier to take the weak signal created by the vibration of the strings and turn it into a signal powerful enough signal a loudspeaker."
M_L,"MEL.    	For many years, the sportscaster Mel Allen was the play-by-play announcer for the New York Yankees. He was also the first host of television's 'This Week in Baseball'."
LO_,"LOL.    	In an Instant Message on AOL Messenger, one might Laugh Out Loud, but only by typing ..."
A_NO,"ARNO.    	The Ponte Vecchio is a famous bridge that spans the Arno River in Florence, Italy. The bridge dates back to medieval times, and indeed the name 'Ponte Vecchio' translates as 'Old Bridge'."
A_O,"AMO.    	Amo, amas, amat ... Latin for ""I love, you love, he/she loves""."
_MS,EMS.    	The leading letter in both 'Mork' and 'Mindy' is an M.
R_BA,"REBA.    	Reba McEntire is a country music singer and television actress. McEntire starred in her own sitcom called ""Reba"" that aired on the WB and the CW cable channels from 2001 to 2007."
UP_,"UPI.    	Founded in 1958, United Press International (UPI) was one of the biggest news agencies in the world, sending out news by wire to the major newspapers. UPI ran into trouble with the change in media formats at the end of the twentieth century and lost many of its clients as the afternoon newspapers shut down due to the advent of television news. UPI, which once employed thousands, still exists today but with just a handful of employees."
_FO,UFO.    	Unidentified flying object (UFO)
H_N,"HAN.    	The Han Dynasty was the second imperial dynasty of China and lasted from 206 BC to 220 AD. It came after the Qin Dynasty, and before the Three Kingdoms."
C_S,"CBS.    	Stephen Colbert is a political satirist who hosted his own show on Comedy Central, ""The Colbert Report"". Colbert's first love was theater, and so he studied to become an actor. He then moved into comedy, and ended up on the ""The Daily Show with Jon Stewart"". He left ""The Daily Show"" in 2005 to set up his own spinoff, ""The Colbert Report"". In his own inimitable way, Colbert likes to use a ""French"" pronunciation for the name of his show, so ""The Colbert Report"" comes out as ""The Col-bear Rep-oar"". Colbert took over the 'Late Show' when David Letterman retired."
S_E,"SHE.    	Here in North America, we tend to use the phrase 'That's what she said!"" as a punch line after an unintended double entendre. On the other side of the Atlantic, the equivalent phrase is '... said the actress to the bishop'."
