GE_E,"GERE.    	Richard Gere has played such great roles on the screen, and I find him to be a very interesting character off the screen. Gere has been studying Buddhism since 1978 and is a very visible supporter of the Dalai Lama and the people of Tibet."
AGU_,"AGUE.    	An ague is a fever, one usually associated with malaria."
_ZAR,"CZAR.    	At the second party congress of the Marxist Russian Social Democratic Labour Party in 1903, a split developed. The faction with the most support was led by Vladimir Lenin, and as they were in the majority they became known as the ""Bolsheviks"", derived from the Russian word for ""more"" or ""majority""."
NA_A,"NALA.    	In ""The Lion King"", Nala is a lioness and the childhood friend of Simba."
M_NBC,"MSNBC.    	""Hardball with Chris Matthews"" is a nightly talk-show about politics, airing on MSNBC. The show's host, Chris Matthews is a colorful character. Matthews served with the Peace Corps from 1968 to 1970, in Swaziland in Africa. He has been back to Africa since, and found himself hospitalized in 2002, suffering from malaria that he picked up on one of his trips."
OKI_,"OKIE.    	'Okies' was a derogatory term used during the Dust Bowl of the 1930s for farming families who migrated from Oklahoma (hence the name), Arkansas, Kansas and Texas in search of agricultural jobs in California. The road used by many of these migrant families was Route 66, which is also called 'Mother Road'."
RA_,"RAJ.    	The period of colonial rule by the British in South Asia from 1858 to 1947 is referred to as the British Raj. Prior to 1858, the area was ruled by a private enterprise, the British East India Company. 'Raj' is the Hindi word for 'reign'."
J_E,"JOE.    	'Joe College' is a term that was used particularly in the 1930s, a personification of the typical male college student."
_EAR,"LEAR.    	Shakespeare was inspired to write his famous drama 'King Lear' by the legend of ""Leir of Britain"", the story of a mythological Celtic king."
C_LI,CALI.    	The economy of the Colombian city of Cali really boomed in the eighties and the early nineties on the back of illegal drug trafficking.
N_M,"NAM.    	Daniel Ellsberg is a former military analyst, who famously became very disillusioned with the Vietnam War. While still working as an analyst, he made copies of classified documents related to the Johnson administration's conduct of the war. The documents, known as the Pentagon Papers, demonstrated that the administration knew early on that the Vietnam War was essentially ""unwinnable"" and that continued fighting would lead to higher numbers of casualties than was being projected in the public arena. Ellsberg ended up in court charged with espionage, but all charges were dropped when it was revealed that the Nixon administration had used illegal methods to bolster its case against the defendant."
ASP_N,"ASPEN.    	Aspen, Colorado used to be known as Ute City, with the name change taking place in 1880. Like many communities in the area, Aspen was a mining town, and in 1891 and 1892 it was at the center of the highest production of silver in the US. Nowadays of course, it's all about skiing and movie stars."
M_G,MSG.    	Message (msg.)
ART_O,"ARTOO.    	Artoo's proper name is R2-D2. R2-D2 is the smaller of the two famous droids from the ""Star Wars"" movies. British actor Kenny Baker, who stands just 3 ft 8 ins tall, has been the man inside the R2-D2 droid for all six of the ""Star Wars"" movies."
G_RE,"GERE.    	Richard Gere has played such great roles on the screen, and I find him to be a very interesting character off the screen. Gere has been studying Buddhism since 1978 and is a very visible supporter of the Dalai Lama and the people of Tibet. That said, I saw him interviewed on a British television show recently and he really came across quite badly, very full of himself."
MA_A,"MAMA.    	The wonderful 1975 musical Broadway 'Chicago' is based on a 1926 play of the same name written by a news reporter called Maurine Dallas Watkins. Watkins had been assigned to cover the murder trials of Beulah Annan and Belva Gaertner for the 'Chicago Tribune', and used the story that unfolded as the basis for her play. Annan became the character Roxie Hart, and Gaertner became Velma Kelly. I've only ever seen the 2002 movie version of 'Chicago' and never a live performance ..."
H_F,"HEF.    	Hugh Hefner is from Chicago. His first publishing job was in the military, where he worked as a writer for a US Army newspaper from 1944-46. He went to college after his military service and then worked as a copywriter for ""Esquire"" magazine. He left ""Esquire"" to found his own publication that he called ""Playboy"", which first hit the newsstands in 1953. ""Playboy"" has been around ever since."
OT_,"OTO.    	The Otoe (also Oto) Native American tribe originated in the Great Lakes region as part of the Winnebago or Siouan tribes. The group that would become the Otoe broke away from the Winnebago and migrated southwestwards ending up in the Great Plains. In the plains the Otoe adopted a semi-nomadic lifestyle dependent on the horse, with the American bison becoming central to their diet."
O_RS,"OARS.    	The coxswain of a boat is one in charge, particularly of its steering and navigation. The name is shortened to ""cox"" particularly when used for the person steering and calling out the stroke in a competition rowing boat."
_OO,"SOO.    	In the summer of 2010 I spent a very interesting afternoon watching ships make their way through the Soo Locks and Soo Canal that allow ships to travel between Lake Superior and the lower Great lakes. The name ""Soo"" comes from the US and Canadian cities on either side of the locks, both called Sault Ste. Marie."
MAG_,"MAGI.    	""Magi"" is the plural of the Latin word ""magus"", a term applied to someone who was able to read the stars. Hence, magi is commonly used with reference to the ""wise men from the East"" who followed the star and visited Jesus soon after he was born."
TA_S,"TAOS.    	Taos Ski Valley is a resort village in New Mexico, founded in 1955. About twelve families live there, making up thirty or so households and a population of about 60 people. It is said to very much resemble a Swiss village, and even includes an elected village council."
OREO_,OREOS.    	The Oreo cookie was first introduced in 1912. The Oreo was intended to be a competitor to the very similar Hydrox cookie which had debuted four years earlier. The Oreo won the resulting battle on the grocery store shelves ...
_AI,"MAI.    	The Mai Tai cocktail is strongly associated with the Polynesian islands, but the drink was supposedly invented in 1944 in Trader Vic's restaurant in Oakland, California. One recipe is 6 parts white rum, 3 parts orange curaçao, 3 parts Orgeat syrup, 1 part rock candy syrup, 2 parts fresh lime juice, all mixed with ice and then a float added of 6 parts dark rum."
_REIDA,"ORE-IDA.    	Ore-Ida frozen foods are all made with potatoes. The company is located in Oregon, just across the border from Idaho. ""Ore-Ida"" is a melding of the two state names."
ULE_,"ULEE.    	""Ulee's Gold"" is a highly respected film from 1997 in which Peter Fonda plays the title role of Ulee. Ulee's ""gold"" is the honey that Ulee produces. It is a favorite role for Peter Fonda and he has shared that playing Ulee brought into mind his father, Henry Fonda, who himself kept a couple of hives. So if you see Peter Fonda in ""Ulee's Gold"" you're witnessing some characteristics that Peter saw in his father."
OL_,OLA.    	'Olá' is both Spanish and Portuguese for 'hello'.
HANO_,"HANOI.    	Hanoi was the capital of North Vietnam, and Saigon the capital of South Vietnam. After the Vietnam War, Hanoi was made capital of the reunified state. Saigon, the larger metropolis, was renamed to Ho Chi Minh City."
_AL,"TAL.    	Mikhail Tal was truly a chess legend. Tal holds the record for the longest unbeaten streak in competition chess. And the second longest winning streak, well, that was by Tal as well."
D_I,"DEI.    	""Agnus Dei"" is Latin for ""Lamb of God"", a term used in Christian faiths for Jesus Christ, symbolizing his role as a sacrificial offering to atone for the sins of man."
HTT_,"HTTP.    	""http"" are the first letters in most Internet links. 'http' stands for HyperText Transfer Protocol."
TITH_,"TITHE.    	A tithe is a traditional payment of one tenth of a person's annual income and is usually given to a church. Tithing is a practice taught in many traditions, and according to a 2002 survey, about 3% of American adults donate 10% or more of their income to a church."
_DOR,"ODOR.    	The odor eliminating product we know today as Febreze was developed in England in the early nineties, and is now produced by Product & Gamble."
KO_,KOI.    	Koi are also called Japanese carp. Koi have been bred for decorative purposes and there are now some very brightly colored examples found in Japanese water gardens.
OAR_,"OARS.    	Rowlocks, the upside down stirrup into which you place your oars. And where I come from, ""rowlocks"" is pronounced ""rollocks""."
AS_ISI,"ASSISI.    	St. Francis founded the Franciscan religious order in Assisi in 1208. He died in 1226, and was declared a saint just two years later in 1228."
MA_A,"MAMA.    	I think the reference is to the stage play ""I Remember Mama"" by John Van Druten, first performed in 1944, and adapted for the big screen in 1948 starring Irene Dunne."
ART_O,"ARTOO.    	Artoo's proper name is R2-D2. R2-D2 is the smaller of the two famous droids from the ""Star Wars"" movies. British actor Kenny Baker, who stands just 3 ft 8 ins tall, has been the man inside the R2-D2 droid for all six of the ""Star Wars"" movies."
N_C,NSC.    	The National Security Council (NSC) was created by President Harry S. Truman in 1947. The NSC is chaired by the sitting president and meets in the White House Situation Room.
_NN,INN.    	The Comfort Inn chain is part of Choice Hotels International. I stay in Comfort Suites every so often. Not bad for the price ...
NEI_,"NEIN.    	""Nein"" is the German for ""no"", and 'ja' translates as 'yes'."
A_P,"APP.    	App Store is the platform that Apple introduced in 2008 to distribute mobile apps for the iPhone and other devices that use the iOS operating system. When a customer purchases an app from the App Store, the publisher of the app gets 70% of the purchase price, with the balance going to Apple."
AE_N,"AEON.    	Aeon is a variant spelling of ""eon"". In astronomical terms, an aeon is defined as one thousand million years."
OLA_,"OLAY.    	Oil of Olay was developed in South Africa in 1949. When Oil of Olay was introduced internationally, it was given slightly different brand names designed to appeal in the different geographies. In Ireland we know it as Oil of Ulay, for example, and in France it is Oil of Olaz."
_GI,CGI.    	Computer-generated imagery (CGI)
AG_E,"AGUE.    	An ague is a fever, one usually associated with malaria."
ION_,"IONE.    	Ione Skye is an American actress, born in Hertfordshire in England. She is best known for portraying the character Diane Court in the 1989 high school romance movie ""Say Anything ..."", starring opposite John Cusack, Skye is the daughter of the Scottish folk singer Donovan."
NEI_,"NEIN.    	""Nein"" is the German for ""no""."
MA_,MAD.    	Lewis Carroll strikes again ...
_SO,"OSO.    	In Spanish, ""osa"" is a female bear, and ""oso"" is a male."
SA_L,"SAHL.    	Mort Sahl is a Canadian-born actor and comedian who moved to the US with his family when he was a child. He became friends with John F. Kennedy, and later when Kennedy became president Sahl wrote a lot of jokes for the President's speeches, although he told a lot of Kennedy jokes in his acts. After the President was assassinated in 1963, Sahl was intensely interested in finding out who was behind the crime and even got himself deputized as a member of one of the investigating teams. He was very outspoken against the results of the Warren Commission report on the assassination, and soon found himself out of favor with the public. It took a few years for him to make his comeback, but comeback he did."
_VA,"UVA.    	The University of Virginia (UVA) was founded by Thomas Jefferson, who sat on the original Board of Visitors alongside former US Presidents James Madison and James Monroe. In fact, the original UVA campus was built on land that was once a farm belonging to President Monroe."
_GI,CGI.    	Computer-generated imagery (CGI)
_KIE,"OKIE.    	'Okies' was a derogatory term used during the Dust Bowl of the 1930s for farming families who migrated from Oklahoma (hence the name), Arkansas, Kansas and Texas in search of agricultural jobs in California. The road used by many of these migrant families was Route 66, which is also called 'Mother Road'."
M_W,"MAW.    	A maw is the term used to describe the mouth or stomach of a carnivorous animal. ""Maw"" is also used as slang for the mouth or stomach of a greedy person."
RSV_,"RSVP.    	RSVP stands for ""Répondez s'il vous plaît"", which is French for ""please, answer""."
O_US,"OPUS.    	The Latin for ""work"" is 'opus', with the plural being 'opera'."
O_O,"OTO.    	The Otoe (also Oto) Native American tribe originated in the Great Lakes region as part of the Winnebago or Siouan tribes. The group that would become the Otoe broke away from the Winnebago and migrated southwestwards ending up in the Great Plains. In the plains the Otoe adopted a semi-nomadic lifestyle dependent on the horse, with the American bison becoming central to their diet."
ASSIS_,ASSISI.    	The Italian town of Assisi is in Umbria. Assisi is famous as the birthplace of St. Francis and as the home to the Franciscan religious order. It was also the home to Saint Clare and her order of the Poor Sisters (later known as the Poor Clares).
_RIES,"ARIES.    	Aries is the first astrological sign in the Zodiac, and is named after the constellation. Your birth sign is Aries if you were born between March 21 and April 20, but if you are an Aries, you would know that!"
ER_S,ERIS.    	ERIS/SIRE
ER_S,"ERIS.    	In Greek mythology, Eris is the goddess of discord. The name ""Eris"" is derived from the Greek word for strife, and translates into Latin as ""Discordia"". In Greek her counterpart is Harmonia, and in the world of the Roman gods, Concordia. The largest dwarf planet in our solar system is called Eris, named after the goddess."
EMER_,EMERY.    	Emery is a very hard type of rock that is crushed for use as an abrasive. Emery paper is made by gluing small particles of emery to paper. Emery boards are just emery paper with a cardboard backing. And emery boards are primarily used for filing nails.
PI_,"PIA.    	""Pia mater"" is Latin, of course, and means ""tender mother"". It is the name given to the mesh-like envelope that surrounds the brain and spinal cord. The pia mater brings blood to some of the exterior parts of the brain, and provides physical support for larger blood vessels passing over the brain's surface."
N_X,"NIX.    	The use of nix as a verb, meaning ""to shoot down"" dates back to the early 1900s. Before that it was just the noun, meaning ""nothing"". This comes from the German ""nichts"", which also means ""nothing""."
E_NUI,"ENNUI.    	'Ennui' is the French word for boredom, a word that we now use in English. It's one of the few French words we've imported that we haven't anglicized and actually pronounce ""correctly""."
HE_,"HEF.    	Hugh Hefner is from Chicago. His first publishing job was in the military, where he worked as a writer for a US Army newspaper from 1944-46. He went to college after his military service and then worked as a copywriter for ""Esquire"" magazine. He left ""Esquire"" to found his own publication that he called ""Playboy"", which first hit the newsstands in 1953. ""Playboy"" has been around ever since."
RT_S,RTES.    	Route (rte.)
YENT_,"YENTA.    	Yenta (also ""Yente"") is actually a female Yiddish name. In Yiddish theater ""yenta"" came to mean a busybody."
TI_O,"TIVO.    	TiVo was introduced in 1999 and was the world's first commercially successful DVR (Digital Video Recorder). If you don't have a DVR, you might want to consider getting one. For those who enjoy television, it's very liberating ..."
OTO_LE,"O'TOOLE.    	Irish actor Peter O'Toole got his big break in movies when he played the title role in the 1962 epic film ""Laurence of Arabia"". But my favorite of his movies is much lighter fare, ""How to Steal a Million"" in which he starred opposite Audrey Hepburn."
ALP_,"ALPS.    	""Matterhorn"" is the German name for the famous Alpine peak that lies on the border between Switzerland and Italy. The Italian name for the same mountain is Monte Cervino, and the French call it Mont Cervin. ""Matterhorn"" comes from the German words Matte and Horn meaning ""meadow"" and ""peak"". Cervino and Cervin come from the Latin name for the mountain, Mons Silvius meaning ""Forest Mountain""."
T_TO,"TOTO.    	In ""The Wizard of Oz"" Toto is played by a terrier, but in the books by L. Frank Baum, Toto was just described as ""a little black dog, with long, silky hair and small black eyes that twinkled merrily on either side of his funny, wee nose""."
ASP_,"ASPS.    	The asp is a venomous snake found in the Nile region of Africa. It is so venomous that the asp was used in ancient Egypt and Greece as a means of execution. Cleopatra observed such executions noting that the venom brought on sleepiness without any painful spasms. When the great queen opted to commit suicide, the asp was therefore her chosen method."
_ESO,"PESO.    	The coin called a 'peso' is used in many Spanish-speaking countries around the world. The coin originated in Spain where the word 'peso' means 'weight'. The original peso was what we know in English as a 'piece of eight', a silver coin of a specific weight that had a nominal value of eight 'reales'."
PI_A,"PISA.    	Leonardo of Pisa was a famous and respected Italian mathematician, also known as simply 'Fibonacci'. He is remembered for writing about a number sequence (although he didn't ""discover' it) that later was given the name 'Fibonacci sequence'. He wrote about the series of numbers in his book called 'Liber Abaci', a celebrated work that introduced Arabic numerals (i.e. 0-9) to the Western world."
MAIT_I,"MAI TAI.    	The Mai Tai cocktail is strongly associated with the Polynesian islands, but the drink was supposedly invented in 1944 in Trader Vic's restaurant in Oakland, California. One recipe is 6 parts white rum, 3 parts orange curaçao, 3 parts Orgeat syrup, 1 part rock candy syrup, 2 parts fresh lime juice, all mixed with ice and then a float added of 6 parts dark rum."
AG_E,"AGUE.    	An ague is a fever, one usually associated with malaria."
M_I,"MAI.    	In French, the month of April (avril) comes before May (mai). Note that the French don't capitalize the names of months as we do in English."
E_ERT,"EBERT.    	'Behind the Phantom's Mask' is the only work of fiction published by celebrated movie critic Roger Ebert. Published in book form in 1993, the novel began as a syndicated newspaper serial."
_RMA,"ERMA.    	Erma Bombeck wrote for newspapers for about 35 years, producing more than 4,000 witty and humorous columns describing her home life in suburbia."
ITA_,"ITAL.    	Italic type leans to the right. The style is known as ""italic"" because the stylized calligraphic form of writing originated in Italy, probably in the Vatican."
AL_,"ALB.    	The alb is the white, neck-to-toe vestment worn by priests, usually with a rope cord around the waist. The term alb comes from ""albus"", the Latin word for ""white""."
AGO_A,"AGORA.    	In early Greece the 'agora' was a place of assembly. Often the assemblies held there were quite formal, perhaps for the reading of a proclamation. Later in Greek history, things became less formal as the agora evolved into a market place. Our contemporary word 'agoraphobia' comes from these agorae, in the sense that an agoraphobe has a fear of open spaces, a fear of 'public meeting places'."
CI_O,"CIAO.    	""Ciao"" is the Italian for ""'bye"". ""Arrivederci"" is more formal, and translates better as ""goodbye""."
TAO_,"TAOS.    	Taos Ski Valley is a resort village in New Mexico, founded in 1955. About twelve families live there, making up thirty or so households and a population of about 60 people. It is said to very much resemble a Swiss village, and even includes an elected village council."
T_A,TBA.    	To be advised (TBA)
_GLOO,"IGLOO.    	The Inuit word for ""house"" is ""iglu"", which we usually write as ""igloo"". The Greenlandic (yes, that's a language) word for ""house"" is very similar: namely ""igdlo""."
EP_,"EPI-.    	EpiPen is a brand name of epinephrine auto-injector. An EpiPen delivers a measured dose of epinephrine, usually for the treatment of an allergic reaction."
AERI_,AERIE.    	An aerie is the nest of an eagle.
O_E,"-OSE.    	'Saccharide' is an alternative name for 'carbohydrates'. Monosaccharides and disaccharides are mainly sugars, and the term 'saccharide' comes from the Greek 'sákkharon' meaning 'sugar'."
NE_,NEC.    	NEC is the name that the Nippon Electric Company chose for itself outside of Japan after a re-branding exercise in 1983.
_BA,TBA.    	To be advised (TBA)
_KIE,"OKIE.    	'Okies' was a derogatory term used during the Dust Bowl of the 1930s for farming families who migrated from Oklahoma (hence the name), Arkansas, Kansas and Texas in search of agricultural jobs in California. The road used by many of these migrant families was Route 66, which is also called 'Mother Road'."
TO_U,"TOFU.    	Sukiyaki is a Japanese soup/stew prepared and served in a 'nabemono', a Japanese hot pot."
ELIZ_,"ELIZA.    	'On the Street Where You Live"" is a song by Frederick Loewe and Alan Jay Lerner that featured in their musical 'My Fair Lady'. The 'you' in the title is the character Eliza Doolittle."
RO_E,"ROME.    	The title of the celebrated 1960 Federico Fellini film ""La Dolce Vita"" translates from Italian as ""The Good Life"". There is a character in the film called Paparazzo who is a news photographer. It is this character who gives us our word ""Paparazzi"", a term used for photographers who make careers out of taking candid shots of celebrities."
IO_IC,"IONIC.    	The Ionic was one of the three classical orders of architecture, the others being the Doric and the Corinthian. An Ionic column is relatively ornate. It usually has grooves running up and down its length and at the top there is a ""scroll"" design called a ""volute"". The scroll motif makes Ionic columns popular for the design of academic buildings. The term 'Ionic' means 'pertaining to Ionia', with Ionia being an ancient territory that is located in modern-day Turkey."
ER_,"ERI.    	The aria ""Eri tu"" is from Verdi's opera ""Un ballo in maschera"" (A Masked Ball). The opera tells the story of the assassination of King Gustav III of Sweden during a masked ball."
M_T,"MIT.    	The Massachusetts Institute of Technology moved into its magnificent mile-long campus on the Cambridge side of the Charles River in 1906. The campus was built largely with funds donated by George Eastman, the founder of the Eastman Kodak Company."
ER_ICA,"EROICA.    	Beethoven originally dedicated his ""Eroica"", Symphony No. 3, to Napoleon Bonaparte. Beethoven admired the principles of the French Revolution, and as such respected Bonaparte who was ""born"" out of the uprising. When Napoleon declared himself Emperor, however, Beethoven (and much of Europe) saw this as a betrayal to the ideals of the revolution, so he changed the name of his new symphony from ""Bonaparte"" to ""Eroica"", meaning ""heroic"" or ""valiant""."
SE_B,"SERB.    	The Dinar is the official currency in many countries, such as Iraq and Serbia. The Gold Dinar dates back to the early days of Islam, with the name deriving from the Roman currency called ""denarius"" meaning ""ten times"" (as it was originally a coin worth ten asses)."
B_TS,"BLTS.    	The BLT (bacon, lettuce and tomato) is the second most popular sandwich in the US, after the plain old ham sandwich."
OTE_I,OTERI.    	Cheri Oteri was the SNL cast member who regularly appeared with Will Farrell in the skit featuring a pair of Spartan cheerleaders.
NI_,NIE.    	Friedrich Nietzsche was a German philosopher. Not my cup of tea ...
R_O,"RKO.    	The RKO Pictures studio was formed when RCA (RADIO Corporation of America) bought the KEITH-Albee-ORPHEUM theaters (and Joe Kennedy's Film Booking Offices of America). The RKO acronym then comes from the words 'Radio', 'Keith' and 'Orpheum'."
TERES_,"TERESA.    	Mother Teresa was born in Albania in 1910, when she was known as Agnes Gonxha Bojaxhiu (""Gonxha"" means ""little flower"" in Albanian). She left home at the age of 18 and joined the Sisters of Loreto, and headed to Loreto Abbey in Rathfarnham in Dublin, Ireland in order to learn English. Her goal was to teach in India, and English was the language used for instruction by the nuns. After Mother Teresa passed away in 1997, she was beatified by Pope John Paul II, a step on the road to canonization. In order for her to be beatified there had to be documented evidence of a miracle that was performed due to the intercession of Mother Teresa. The miracle in question was the healing of a tumor in the abdomen of a woman due to the application of locket containing a picture of Mother Teresa. Documentation of a second miracle is required for her to be declared a saint."
_BA,TBA.    	Something not yet on the schedule (sked) is to be advised (TBA)
SOF_,"SOFA.    	""Sofa"" is a Turkish word, meaning ""bench""."
AN_L,"ANAL.    	Our use of the word 'anal' is an abbreviated form of 'anal-retentive', a term derived from Freudian psychology."
