_TARR,"STARR.    	Ringo Starr's real name is Richard Starkey. Before he joined the Beatles (replacing drummer Pete Best), Starkey played with the Raving Texans. It was with the Raving Texans that he adopted the name ""Ringo Starr"", because he wore a lot of rings and he thought it sounded ""cowboyish"". Back then his drum solos were billed as ""Starr Time""."
IRA_,"IRAS.    	I have to tell you, when I first came to the US from Ireland, it was pretty confusing seeing big signs along the freeway touting contributions to the IRA! Back in Ireland, that was pretty illegal (where IRA means the Irish Republican Army)."
_NE,"-ENE.    	An alkene is an organic compound made up of carbon and hydrogen atoms. It differs from an alkane in that it has at least one C=C double bond. The simplest alkene is the gas ethylene, a major raw material used in the manufacture of plastics (like polyethylene)."
MA_RI,"MAORI.    	The Māori are the indigenous people of New Zealand. They are eastern Polynesian in origin and began arriving in New Zealand relatively recently, starting some time in the late 13th century. The word ""māori"" simply means ""normal"", distinguishing the mortal human being from spiritual entities."
_RC,"ARC.    	A shooting star is what we call the visible path of a meteoroid as is it enters the earth's atmosphere. Almost all meteoroids burn up, but if one is large enough to survive and reach the ground, we call it a meteorite. The word 'meteor' comes from the Greek 'meteōros' meaning 'high in the air'."
I_OD,"IZOD.    	Jack Izod was a tailor of some repute over in England, producing shirts for King George V as well as other members of the Royal Family. As Izod was about to retire, he was approached for the use of his name by an American clothing manufacturer based in New York. The brand Izod of London was introduced to America in 1938."
E_HER,"ETHER.    	Ethers are a whole class of organic compounds, but in the vernacular 'ether' is specifically diethyl ether. Diethyl ether was once very popular as a general anesthetic."
_ES,"SES.    	'Ses' is the French word for 'his', 'her' or 'its', when referring to a group of items."
AU_I,"AUDI.    	The Audi name has an interesting history. The Horch company was founded by August Horch in 1909 but soon after, Horch was forced out of his own business. He set up a new company and continued to use his own name as a brand. The old company sued him for using the Horch name so a meeting was held to choose something new. Horch's young son was studying Latin in the room where the meeting was taking place. He pointed out that ""Horch"" was German for ""hear"", and he suggested ""Audi"" as a replacement, the Latin for ""listen""."
TR_S,"TRES.    	In Spanish, tres (three) comes after dos (two)."
_RSON,"ORSON.    	Orson Bean is an actor, perhaps best known for his appearances on television game shows in the sixties, seventies and eighties. His most famous game show role was that of a panelist on ""To Tell the Truth"". Interestingly, Bean (real name Dallas Burrows) is a first cousin, twice removed, of President Calvin Coolidge."
SS_S,"SSNS.    	A Social Security number (SSN) is divided into three parts i.e AAA-GG-SSSS, Originally, the Area Number (AAA) was the code for the office that issued the card. Since 1973, the Area Number reflects the ZIP code from which the application was made. The GG in the SSN is the Group Number, and the SSSS in the number is the Serial Number. However, this is all moot, as since 2011 SSN's are assigned randomly."
SOH_,"SOHO.    	TriBeCa is a clever little acronym that expands into ""TRI-angle BE-low CA-nal Street. The name was developed by local residents who basically copied the technique used by residents of the neighboring area of SoHo, which is short for SO-uth of HO-uston Street."
_TR,"LTR.    	Like so many things it seems, our paper sizes here in North America don't conform with the standards in the rest of the world. ISO standard sizes used elsewhere have some logic behind them in that the ratio of width to length is usually one to the square root of two. This mathematical relationship means that when you cut a piece of paper in two each half preserves the aspect ratio of the original, which can be useful in making reduced or enlarged copies of documents. Our standard size of ""letter"" (8.5 x 11 inches) was determined in 1980 by the Reagan administration to be the official paper size for the US government. Prior to this, the ""legal"" size (8.5 x 14 inches) had been the standard, since 1921."
IRA_,"IRAS.    	On the income tax form 1040, one must report contributions to one's Individual Retirement Account (IRA)."
RN_,RNS.    	One might find a registered nurse (RN) or a medical doctor (MD) in an emergency room (ER).
US_A,"USDA.    	The US Department of Agriculture dates back to 1862, when it was established by then-president Abraham Lincoln. Notably, Lincoln referred to the USDA as the ""people's department"", reflecting the agrarian basis of our economy back then."
EV_N,"EVAN.    	Evan Hunter was the adopted name of Salvatore Albert Lombino, an author and screenwriter from New York City. Hunter had a pen name that was perhaps more famous, namely Ed McBain. As McBain he wrote a successful string of crime novels starting in 1956. As Evan Hunter, he is perhaps most famous for his 1954 novel 'The Blackboard Jungle', which was made into a successful film the following year."
OMAN_,"OMANI.    	Muscat is the capital of Oman, and lies on the northeast coast of the state on the Gulf of Oman, a branch of the Persian Gulf."
COA_I,"COATI.    	A coati is a member of the raccoon family and is also known as the Brazilian aardvark, or the snookum bear. The coati is native to Central and South America, but can be found in the southwest of the Untied States."
FL_,"FLO.    	Florence Jean ""Flo"" Castleberry was a waitress in the sitcom ""Alice"" which aired on CBS in the 70s and 80s. Flo got her own sitcom (called 'Flo') which had a brief run in the early 80s. I saw a few episodes of 'Alice', but that's about it. Oh, and Flo was played by Polly Holiday."
SL_ET,"SLEET.    	Apparently ""sleet"" is a term used to describe two weather conditions. One is a shower of ice pellets, smaller than hail, and the second is a mixture of rain and snow, with the snow melting as it falls. It's the second definition that I have always used ..."
ES_D,ESTD.    	Established (estd.)
O_AV,"OLAV.    	Of the many kings of Norway named Olaf/Olav (and there have been five), Olaf II is perhaps the most celebrated as he was canonized and made patron saint of the country. Olaf II was king from 1015 to 1028 and was known as ""Olaf the Big"" (or Olaf the Fat) during his reign. Today he is more commonly referred to as ""Olaf the Holy"". After Olaf died he was given the title of Rex Perpetuus Norvegiae, which is Latin for 'Norway's Eternal King'."
OSAK_,"OSAKA.    	Godzilla is a Japanese invention. The first in a very long series of films was released way back in 1954. The original name in Japanese was ""Gojira"", but this was changed to Godzilla for audiences outside of Japan. ""Gojira"" is a combination of ""gorira"" and ""kujira"", the Japanese words for gorilla and whale, apt because Godzilla is a big ape-like creature that came out of the deep."
EW_K,"EWOK.    	The Ewoks are creatures who live on the moon of Endor, first appearing in ""Star Wars Episode VI: Return of the Jedi"". They're the cute and cuddly little guys that look like teddy bears."
U_B,"USB.    	Universal Serial Bus (USB) is an industry standard dealing with how computers and electronic devices connect and communicate, and deal with electrical power through those connections."
M_CE,"MACE.    	Mace is actually a brand name, originally introduced by Lake Erie Chemical when they started to manufacture ""Chemical Mace"", with the name being a play on the club-like weapon from days of old. Mace was originally a form of tear gas, but Mace today uses a formula that is actually a pepper spray, a different formulation."
_GEE,OGEE.    	An ogee is like an s-curve. Specifically it is a curve consisting of two arcs that curve in opposite directions (like an S) but both ends of the curve end up parallel to each other (which is not necessarily true for an S).
D_HL,"DAHL.    	Roald Dahl's name is Norwegian. Dahl's parents were from Norway, although Dahl himself was Welsh. Dahl became one of the most successful authors of the twentieth century. Two of his most famous titles are ""James and the Giant Peach"" and ""Charlie and the Chocolate Factory""."
U_O,"USO.    	The United Service Organization (USO) was founded in 1941 at the request of FDR ""to handle the on-leave recreation of the men in the armed forces"". A USO tour is undertaken by a troupe of entertainers, many of whom are big-name celebrities. A USO tour usually includes troop locations in combat zones."
EPSO_,"EPSOM.    	The Surrey town of Epsom in England is most famous for its racecourse (Epsom Downs), at which is run the Epsom Derby every year, one of the three races that make up the English Triple Crown. We also come across Epsom salt from time to time. Epsom salt is magnesium sulfate, originally prepared by boiling down mineral waters. Epsom was indeed a spa town at one time."
D_E,"DIE.    	The spots on a die are actually called ""pips"". As we all know, the numbers 1 through 6 are represented on each side of a a die, with the numbers placed so that the sum of the opposite sides of a die is always 7 (so 1 opposite 6, 2 opposite 5, and 3 opposite 4). The oldest known dice were found as part of a backgammon set in Iran, a game that was 5,000 years old!"
O_ANI,"OMANI.    	Oman lies on the southeast coast of the Arabian Peninsula and is neighbored by the OAE, Saudi Arabia and Yemen."
E_TS,EMTS.    	Emergency medical technician (EMT)
EC_N,ECON.    	Economics (econ.)
I_AO,"ISAO.    	Isao Aoki is one of Japan's greatest golfers, now playing on the senior circuit. Aoki's best finish in a major tournament was runner-up to Jack Nicklaus in the 1980 US Open."
PIT_,"PITA.    	Pita is a lovely bread in Middle-Eastern and Mediterranean cuisines. Pita is usually round, and has a ""pocket"" in the center. The pocket is created by steam that puffs up the dough during cooking leaving a void when the bread cools. The pockets were a big hit in the seventies when someone came up with the idea of using them for fillings hence creating pita sandwiches or ""pita pockets""."
T_OP,T-TOP.    	A T-top is a car roof that has removable panels on either side of a rigid bar that runs down the center of the car above the driver.
EC_N,ECON.    	Growth Theory is a subject in the field of economics ...
_TR,"LTR.    	Like so many things, our paper sizes here in North America don't conform with the standards in the rest of the world. ISO standard sizes used elsewhere have some logic behind them, in that the ratio of width to length is usually one to the square root of two. This mathematical relationship means that when you cut a piece of paper in two, each half preserves the aspect ratio of the original, which can be useful in making reduced or enlarged copies of documents. Our standard sizes of ""letter"" (8.5 x 11 inches) was determined in 1980 by the Reagan administration to be the official paper size for the US government. Prior to this, the ""legal"" size (8.5 x 14 inches) had been set as the standard,&nbsp;in 1921."
RN_,RNS.    	Registered nurses (RNs)
_STD,ESTD.    	Established (estd.)
O_S,"OPS.    	Short for ""photo opportunities""."
_IMO,"LIMO.    	The word ""limousine"" actually derives from the French city of Limoges. The area around Limoges is called the Limousin, and it gave its name to a cloak hood worn by local shepherds. In early motor cars, a driver would sit outside in the weather, while the passengers would sit in the covered compartment. The driver would often wear a limousin-style protective hood, giving raise to that type of transportation being called a ""limousine"". Well, that's how the story goes anyway ..."
OR_ON,"ORSON.    	Orson Welles is perhaps best-remembered in the world of film for his role in 1941's 'Citizen Kane'. In the world of radio, Welles is known for 1938's famous broadcast of 'The War of the Worlds', a broadcast that convinced many listeners that the Earth was indeed being invaded by aliens."
_OM,"ROM.    	CD-ROM stands for ""compact disc read only memory"". The name indicates that you can read information from the disc (like a standard music CD for example), but you cannot write to it. You can also buy a CD-RW, which stands for ""compact disc - rewritable"", with which you can read data and also write over it multiple times using a suitable CD drive."
IRA_,IRAS.    	Individual retirement account (IRA)
T_ES,"TRES.    	No matter what the language, and in this case it is Spanish, the cube root of 27 is 3."
S_S,STS.    	Streets (sts.)
_IS,"DIS.    	'Dis' is a slang term meaning 'insult' that originated in the eighties. It is a shortened form of ""disrespect' or ""dismiss""."
_PIA,"APIA.    	Apia is the capital city, in fact the only ""city"", of the Pacific island nation of Samoa. The harbor of Apia is famous for a very foolish incident in 1889 involving seven ships from Germany, the US and Britain. A typhoon was approaching so the safest thing to do was to head for open water away from land, but no nation would move its ships for fear of losing face in front of the others. Six of the vessels were lost in the typhoon as a result and 200 American and German sailors perished. The British cruiser HMS Calliope barely managed to escape from the harbor and rode out the storm safely."
AP_A,"APIA.    	Apia is the capital city, and in fact the only city, of the Pacific island-nation of Samoa. The harbor of Apia is famous for a very foolish incident in 1889 involving seven ships from Germany, the US and Britain. A typhoon was approaching so the safest thing to do was to head for open water away from land, but no nation would move its ships for fear of losing face in front of the others. Six of the vessels were lost in the typhoon as a result and 200 American and German sailors perished. The British cruiser HMS Calliope barely managed to escape from the harbor and rode out the storm safely."
A_N,"AYN.    	Ayn Rand was a Russian-American novelist born Alisa Rosenbaum. Her two best known works are her novels ""The Fountainhead"" published in 1943 and ""Atlas Shrugged"" in 1957. Back in 1951, Ayn Rand moved from Los Angeles to New York City. Soon after, she gathered a group of admirers around her with whom she discussed philosophy and shared drafts of her magnum opus, ""Atlas Shrugged"". This group called itself ""The Collective"", and one of the ""founding members"" was future Federal Reserve chairman, Alan Greenspan."
G_A,"GSA.    	The US Government's General Services Administration (GSA), as the name suggests, provides general services to other federal agencies. So for example, the GSA manages office space for the other agencies, and transportation."
_FT,"EFT.    	Newts wouldn't be my favorite animals in the world. They are found all over the world, living on land or in the water depending on the species, but always associated with water, even if it is only for breeding. Newts metamorphose through three distinct developmental stages during their lives. They start of as larvae in water, fertilized eggs that often cling to aquatic plants, unlike the eggs of frogs and toads which float freely. The eggs hatch into tadpoles, the first developmental form of the newt. After living some months as tadpoles swimming around in the water, they undergo metamorphosis, sprouting legs and replacing their external gills with lungs. At this juvenile stage they are known as efts, and leave the water to live on land. A more gradual transition takes place then, as the eft takes on the lizard-like appearance of the adult newt."
DA_L,"DAHL.    	Roald Dahl's name is Norwegian. Dahl's parents were from Norway although Dahl himself was Welsh. Dahl became one of the most successful authors of the twentieth century. A couple of his most famous titles are ""James and the Giant Peach"" and ""Charlie and the Chocolate Factory""."
ERNS_,"ERNST.    	Max Ernst was a painter and sculptor, a pioneer in the Dada movement and Surrealism. Ernst was born near Cologne in Germany in 1891 and he was called up to fight in WWI, as were most young German men at that time. In his autobiography he writes ""Max Ernst died the 1st of August, 1914"" a statement about his experiences in the war. In reality, Ernst died in 1976 having lived to the ripe old age of 85."
USD_,"USDA.    	The US Department of Agriculture dates back to 1862, when it was established by then-president Abraham Lincoln. Notably, Lincoln referred to the USDA as the ""people's department"", reflecting the agrarian basis to the economy back then. The Food safety and Inspection Service is an agency within the USDA tasked with ensuring that the supply of meat, poultry and eggs is safe."
IR_NI,"IRANI.    	Qom (also Qum) is a city in Iran located about 100 miles southwest of Tehran. Qom is a holy city in the Shi'a Islam tradition, and a pilgrimage destination."
ALIC_,"ALICE.    	Woody Allen's 1990 movie called ""Alice"" is largely a remake of a Frederico Fellini film, ""Juliet of the Spirits"". ""Alice"" stars Mia Farrow in the title role, a New York housewife who ends up having an affair under the influence of herbs supplied by an Asian herbalist. The she feels guilty, then she becomes invisible, then I decide not to rent this movie ..."
ETHE_,"ETHER.    	Ethernet is the name given to a standardized configuration of local area networks (LANs). An ethernet cable is that one that has a connector on the end that looks like a regular telephone connector, but is about twice as wide. Ethernet dates back to the mid seventies, when it was developed by the Xerox Corporation."
L_R,LTR.    	One places a letter (ltr.) in an envelope (env.).
SC_T,"SCOT.    	The phrase 'scot-free' means 'free from punishment, restraint or obligation'. The term derives from the Old English 'scotfreo' meaning 'exempt from royal tax', with 'scot' being a royal tax."
FL_,FLO.    	Flo is a perky character featured in ads for Progressive Insurance. Flo is played by comedienne and actress Stephanie Courtney.
IO_,"IOS.    	The Cyclades are a Greek group of islands in Aegean lying southeast of the Greek mainland. There are about 200 islands in the group, almost all of which are the peaks of a submerged mountain range. Ios is one of the larger islands, 11 miles long and 6 miles wide."
_ACO,"WACO.    	In recent years, the city of Waco, Texas is perhaps most famous as the site of a siege and shootout between ATF agents and members of the Protestant sect known as the Branch Davidians. Shortly after ATF agents tried to execute a search warrant, shots were fired and at the end of the fight six people inside the Branch Davidian compound were dead, as were four agents. A fifty-day siege ensued at the end of which a final assault resulted in members of the community setting fire to the compound. Only nine people walked away from that fire. 50 adults and 25 children perished."
IL_AD,"ILIAD.    	Achilles is a Greek mythological figure, the main protagonist of Homer's ""Iliad"". Supposedly when Achilles was born his mother attempted to make him immortal by dipping him into the River Styx. As he was held by the heel as he was immersed, this became the only vulnerable point on his body. Years later he was killed when a poisoned arrow struck him in the heel, shot by Paris."
EB_N,"EBON.    	Ebony is another word for the color black (often shortened to ""ebon"" in poetry). Ebony is a dark black wood that is very dense, one of the few types of wood that sinks in water. Ebony has been in high demand so the species of trees yielding the wood are now considered threatened. It is in such short supply that unscrupulous vendors have been known to darken lighter woods with shoe polish in order to look like ebony, so be warned ..."
ASIA_,"ASIAN.    	The Cork-tree is a genus of tree with a corky bark that is native to east and northeast Asia. The Cork-tree's bark isn't sufficiently thick for use in commercial cork production. Most cork comes from the cork oak, a tree that is native to southwest Europe and northwest Africa."
A_F,"ATF.    	The Bureau of Alcohol, Tobacco, Firearms and Explosives (ATF) is today part of the Department of Justice (DOJ). The ATF has its roots in the Department of Treasury dating back to 1886 when it was known as the Bureau of Prohibition. ""Explosives"" was added to the ATF's name when the bureau was moved under the Department of Justice (DOJ) as part of the reorganization called for in the Homeland Security Act of 2002."
E_ON,"ECON.    	The Peace Prize is the most famous of the five prizes bequeathed by Alfred Nobel. The others are for Physics, Chemistry, Physiology or Medicine, and Literature. There is also a Nobel Prize in Economics that is awarded along with the original five, but it is funded separately and is awarded ""in memory of Alfred Nobel"". Four of the prizes are awarded by Swedish organizations (Alfred Nobel was a Swede) and so the award ceremonies take place in Stockholm. The Peace Prize is awarded by the Norwegian Nobel Committee, and that award is presented in Oslo."
_UNE,"RUNE.    	A rune is a character in an alphabet, believed to have mysterious powers."
_LAR,"ALAR.    	The chemical name for Alar, a plant growth regulator and color enhancer, is daminozide. It was primarily used on apples but was withdrawn from the market when it was linked to cancer."
OLI_,"OLIN.    	Lena Olin is a Swedish actress, first discovered by Ingmar Bergman. As well as appearing in ""Chocolat"" in 2000, she won an Emmy in 2003 for Best Supporting actress in the TV show ""Alias""."
EF_,"EFT.    	Newts wouldn't be my favorite animals in the world. They are found all over the world, living on land or in the water depending on the species, but always associated with water, even if it is only for breeding. Newts metamorphose through three distinct developmental stages during their lives. They start of as larvae in water, fertilized eggs that often cling to aquatic plants, unlike the eggs of frogs and toads which float freely. The eggs hatch into tadpoles, the first developmental form of the newt. After living some months as tadpoles swimming around in the water, they undergo metamorphosis, sprouting legs and replacing their external gills with lungs. At this juvenile stage they are known as efts, and leave the water to live on land. A more gradual transition takes place then, as the eft takes on the lizard-like appearance of the adult newt."
AN_O,"ANNO.    	The designations Anno Domini (AD) and Before Christ (BC) are found in the Julian and Gregorian calendars. The dividing point between AD and BC is the year of the conception of Jesus, with AD 1 following 1 BC, without a year ""0"" in between. The AD/BC scheme dates back to AD 525, and gained wide acceptance soon after AD 800. Nowadays, a modified version has become popular, with CE (Common/Christian Era) used to replace AD, and BCE (Before the Common/Christian Era) replacing BC."
_WOK,"EWOK.    	The Ewoks are creatures who live on the moon of Endor, first appearing in ""Star Wars Episode VI: Return of the Jedi"". They're the cute and cuddly little guys that look like teddy bears."
WAC_,"WACO.    	Remember Ken Starr of Whitewater fame? Starr is now President of Baylor University in Waco, Texas."
EC_N,ECON.    	Economics.
IR_S,IRAS.    	Individual Retirement Account (IRA)
LT_,LTR.    	Letter (ltr.)
S_NS,SSNS.    	Social Security Number (SSN)
COA_I,"COATI.    	A coati is a member of the raccoon family, and is also known as the Brazilian aardvark, or the snookum bear. They are native to Central and South America, but can be found in the southwest of the Untied States."
I_EM,"ITEM.    	An unmarried couple known to be involved with each other might appear in the gossip columns. This appearance as ""an item"" in the papers, led to the use of ""item"" to refer to such a couple, but only since the very early seventies."
IRA_I,"IRANI.    	Most of the Kurdish people live in a region known as Kurdistan, which stretches into parts of Iran, Syria, Turkey as well as northern Iraq."
IP_D,"IPAD.    	The very exciting iPad isn't Apple's first foray into the world of tablet computing. Apple created great buzz by introducing the Newton MessagePad way back in 1993. This innovative machine was fraught with problems and really died a very slow death, finally being withdrawn from the market in 1998."
ACE_,"ACER.    	I owned several Acer laptops, which are for my money the most reliable machine at the best price. Acer is a Taiwanese company that I used to visit a lot when I was in the electronics business. I was very impressed with the company's dedication to quality, and haven't been let down since."
ARLE_,"ARLES.    	'Sunflowers' was the name of two series of paintings by Vincent van Gogh. In the first series, the flowers are lying on the ground and in the second more famous series, painted in Arles, the flowers are in a vase. Famously, a Japanese insurance magnate purchased 'Still Life: Vase with Fifteen Sunflowers' in 1987 in an auction, paying just under $40 million. This price outstripped the previous record price paid for a work of art by a wide, wide margin, one that stood at $12 million."
AXE_,AXEL.    	An Axel is a forward take-off jump in figure skating. It was first performed by Norwegian Axel Paulsen at the 1882 World Figure Skating championships.
