LINU_,"LINUS.    	In Charles Schulz's fabulous comic strip 'Peanuts', Charlie Brown is friends with at least three members of the van Pelt family. Most famously there is Lucy van Pelt, who bosses everyone around, particularly Charlie. Then there is Linus, Lucy's younger brother, the character who always has his security blanket at hand. Lastly there is an even younger brother, Rerun van Pelt. Rerun is constantly hiding under his bed, trying to avoid going to school."
TCEL_,"T CELL.    	T cells are a group of white blood cells that are essential components of the body's immune system. T cells are so called because they mature in the thymus, a specialized organ found in the chest."
_IN,ZIN.    	Zinfandel is one of my favorite red wine varietals. It amazes me that the rich and heavy red Zinfandel comes from the same grape as does the sweet White Zinfandel.
RA_S,"RAES.    	John Rae was a Scottish explorer, who took on the task of searching for the ill-fated Franklin Expedition of 1845. The Franklin Expedition was itself searching for the elusive Northwest Passage through the Arctic Ocean connecting the Atlantic to the Pacific. John Rae created much controversy back in England when he reported evidence of cannibalism among the ill-fated Franklin explorers."
IRV_N,"IRVIN.    	Michael Irvin played football for the Dallas Cowboys. I don't follow American Football (forgive me!) but did see Irvin on ""Dancing with the Stars"" on television, and he acquitted himself quite well."
KI_,"KIR.    	Kir is a French cocktail, made by adding a teaspoon or so of creme de cassis (blackcurrant liqueur) to a glass, and then topping it off with white wine. The drink is named after Felix Kir, the Mayor of Dijon in Burgundy, who used to offer the drink to his guests. My wife (expensive tastes!) is particularly fond of a variant called a Kir Royale, in which the white wine is replaced with champagne."
LIMO_,"LIMOS.    	The word ""limousine"" actually derives from the French city of Limoges. The area around Limoges is called the Limousin, and it gave its name to a cloak hood worn by local shepherds. In early motor cars, a driver would sit outside in the weather while the passengers would sit in the covered compartment. The driver would often wear a limousin-style protective hood, giving rise to that type of transportation being called a ""limousine"". Well, that's how the story goes anyway ..."
MINI_,MINIS.    	Mary Quant introduced what we now know as the miniskirt in 1965.
_ANTU,"BANTU.    	Gumbo is a type of stew or soup that originated in Louisiana. The primary ingredient can be meat or fish, but to be true gumbo it must include the ""holy trinity"" of vegetables, namely celery, bell peppers and onion. Okra used to be a requirement but this is no longer the case. In fact, okra gave the dish its name, as the vernacular word for the African vegetable is ""okingumbo', from the Bantu language spoken by many of the slaves brought to America."
AMOROS_,"AMOROSO.    	Amoroso is the Italian word for ""lovingly"" and is used as a musical direction on a score."
VE_L,"VEAL.    	The dish named 'piccata' originated in Italy, with the traditional meat used being veal. Whatever meat used is sliced and flattened with a tenderizer, seasoned, dredged in flour and browned in a pan. The juices from the pan are the base for the sauce, to which are added lemon juice, white wine, shallots, caper and butter."
DUA_,DUAL.    	39. See 43-Across : CARB
ARSE_IO,"ARSENIO.    	Arsenio Hall got his big break with his role in ""Coming to America"" with Eddie Murphy in 1988. The following year he started hosting ""The Arsenio Hall Show"", which ran until 1994. He had a loyal group of fans that had the habit of almost ""barking"" while pumping their fists in the air. The move became so popular it extended far beyond the influences of Arsenio, and to this day can be seen performed as a mark of appreciation. Not by me, mind you ..."
EE_,"E'ER.    	Henry Wadsworth Longfellow was famous for his own work of course, like 'Paul Revere's Ride' and 'The Song of Hiawatha', but he was also the first American to translate Dante's epic poem, the 'Divine Comedy'."
_EW,MEW.    	Cats might be mewing if they are hungry.
STRE_,"STREP.    	Streptococcus bacteria multiply and divide along a single axis so that they form linked chains. That behavior gives the genus of bacteria its name, as 'streptos' is Greek for 'easily twisted, like a chain'. I had to battle with streptococcal pharyngitis (strep throat) twice in the past few years and it was not at all pleasant, I must say. Another species of streptococcus is responsible for that terrible 'flesh-eating' infection that makes the news from time to time."
NAMI_,"NAMIB.    	The Namib Desert is in Namibia, as one might expect, and and also stretches into part of Angola. It is thought to be the oldest desert in the world, having been arid for over 55 million years."
I_HTAR,"ISHTAR.    	I guess ""Ishtar"" did bomb, 'cause I've never heard of it. It stars Warren Beatty and Dustin Hoffman as lounge singers working in Morocco! There's a Cold War plot, and thank goodness, it's a comedy. It's so bad apparently, that it never even made it to DVD."
MCA_,MCAT.    	Medical College Admission Test (MCAT)
_EAL,VEAL.    	'Osso' is the Italian word for bone as in the name of the dish Osso Buco: braised veal shanks.
L_MP,"LAMP.    	The archetypal Tiffany lamp is made up of pieces of colored, leaded glass, with a copper foil bonding the pieces together, and a solder applied over the foil. The effect resembles a stained glass window."
DO_EMI,DO RE MI.    	Do re mi is a slang term for cash.
MAE_TRO,"MAESTRO.    	'Maestro' is often used to address a musical conductor. 'Maestro' (plural 'maestri') is the Italian word for 'master, teacher'. The plural in English is usually 'maestros'."
AXL_OSE,"AXL ROSE.    	Axl Rose is the lead vocalist of the American rock band, Guns N' Roses."
THEU_,"THE UN.    	The land on which the UN sits may be in Manhattan, but it is considered to be international territory. That territory is bounded on one side by First Avenue, and the East River on the other."
S_EINS,"STEINS.    	A stein is a type of beer glass. The term is German in origin, and is short for 'Steinkrug' meaning 'stone jug'. 'Stein' is the German for 'stone'."
_NES,"ENES.    	An alkene is an organic compound made up of carbon and hydrogen atoms. It differs from an alkane by having at least one C=C double bond. The simplest alkene is the gas, ethylene, a major raw material in the manufacture of plastics (like polyethylene)."
HE_NA,"HENNA.    	Henna has been used for centuries as a dye, not just for leather and wool, but also for the hair and skin. In modern days, henna is also used for temporary tattoos."
AME_S,"AMENS.    	""Amen"", meaning ""so be it"" came into English from Latin, although the word is of Hebrew origin."
BON_OVI,"BON JOVI.    	Jon Bon Jovi was born John Francis Bongiovi, Jr., and he is the leader of the band that took his name, Bon Jovi."
PRI_,"PRIX.    	On a restaurant menu, items that are ""à la carte"" are priced and ordered separately. A menu marked ""table d'hôte"" (also called ""prix fixe"") is a fixed-price menu with limited choice."
D_DGE,"DODGE.    	James Arness played the role of Matt Dillon, the Marshall of Dodge City, on ""Gunsmoke"" for twenty years. If you count the occasions when he reprised the role for specials, he actually performed as Matt Dillon over five decades. And, did you know that Peter Graves, the actor who played Jim Phelps on ""Mission: Impossible"", his real name was Peter Arness? He and James were brothers."
G_STO,"GUSTO.    	'Gusto' is an Italian word meaning 'taste'. We use it in English in the phrase 'with gusto', with great enjoyment."
J_DD,"JUDD.    	Judd Apatow is best known for producing the TV series ""Freaks and Geeks"" and ""Undeclared""."
UEL_,"UELE.    	The Uele River is a tributary to the Ubangi River, and is found in the Democratic Republic of the Congo. The Uele is the 5th longest river in Africa."
TI_I,TITI.    	Titis are monkeys found in much of South America. Totis have tails that are a little bit longer than the length of their heads and bodies.
PU_NTE,"PUENTE.    	Puente is the Spanish word for ""bridge""."
WS_,"WSJ.    	'The Wall Street Journal' (WSJ) is a daily newspaper with a business bent that is published in New York City by Dow Jones & Company. The WSJ has a larger US circulation than any other newspaper, with 'USA Today' coming in a close second place."
M_I?,MOI?.    	'Moi' is the French word for 'me'.
UNIC_F,"UNICEF.    	The United Nations Children's Fund is known by the acronym UNICEF because the organization's original name when it was founded in 1946 was the United Nations International Children's Emergency Fund. The original focus of the fund was to provide relief to children in countries that had been devastated by WWII. UNICEF is supported by contributions from governments, but also by individual donors. One of the more successful programs for collecting private donations is the Trick-or-Treat UNICEF box that has been a tradition here in North America since 1950."
FL_ER,"FLEER.    	The Fleer Corporation was founded in 1885, and was the first company to successfully manufacture bubblegum (how I wish they hadn't!)."
_ALLOT,BALLOT.    	SECRET BALLOT
BO_CO,"BOSCO.    	Bosco Chocolate Syrup is produced in New Jersey, and first hit store shelves in 1928."
AT_LIER,"ATELIER.    	An atelier is an artist's studio, with ""atelier"" being the French word for ""studio"" or ""workshop""."
TE_PE,TEMPE.    	Tempe is a city in the metropolitan area of Phoenix. The city is named for the Vale of Tempe in Greece.
_OP,"BOP.    	'Bop' is a shortened form of 'bebop', a jazz style that dates back to the early 1940s."
_ENA,"RENA.    	Rena Sofer came to prominence as an actor in daytime television, most notably playing Lois Cerullo on 'General Hospital'. Sofer's love interest on the show was played by Wally Kurth, and the online romance led to the pair walking down the aisle in real life in 1995 (although they divorced two years later)."
_SGARD,"ASGARD.    	In Norse mythology, Valhalla (""hall of the slain"") is a gigantic hall in the ""world"" of Asgard. Asgard and Valhalla are ruled by the god Odin, the chief Norse god."
CRIB_,"CRIBS.    	A crib is a plagiarism, most commonly the copying of an answer in an examination."
C_ANG,"CHANG.    	Michael Chang is a former American professional tennis player, best remembered for his win at the 1989 French Open at the age of 17 years."
SW_T,"SWIT.    	Loretta Swit started playing ""Hot Lips"" Houlihan on ""M*A*S*H"" in 1972. She and Alan Alda were the only actors who appeared in both the pilot and the series finale. Swit has written a book on needlepoint, would you believe? It's called ""A Needlepoint Scrapbook""."
O_NO,"OENO-.    	In Greek mythology, Oeno was the goddess of wine, giving us ""oen-"" as a prefix meaning ""wine"". For example, oenology is the study of wine and an oenophile is a wine-lover."
D_AW,"DRAW.    	Go Fish a very simple card game, usually played by children."
D_LLAS,"DALLAS.    	Miss Ellie was the matriarch of the famed Ewing family, around which the TV series ""Dallas"" was written. For most of the series, Miss Ellie was played by Barbara Bel Geddes, and once in a TV movie of Dallas by Molly Hagan. Barbara Bel Geddes left the show in 1984, and was replaced by the much more famous Donna Reed. When Bel Geddes decided to return to the show the following year, Donna Reed was fired, much to her chagrin, and a law suit ensued."
_AGUE,"HAGUE.    	The Hague Tribunal is a United Nations body set up to prosecute war crimes committed during the wars in former Yugoslavia. The court was set up in the Hague in the Netherlands in 1993, and is still going strong today. The court does have a limited life, and has nothing to do with the International Criminal Court, not the International Court of Justice, both of which are also based in the Hague."
COS_AS,"COSTAS.    	Bob Costas has been a sportscaster for NBC since the early eighties. Costas has a son called Keith. Just before his son was born, Costas made (as a joke) a bet with Minnesota Twins center fielder Kirkby Puckett that if he was batting over .350 by the time the child was born, he would name the baby ""Kirkby"". Well, Puckett won the bet, but the actual name chosen was Keith Michael Costas. When Puckett reminded Costas of the agreement, the birth certificate was changed to Keith Michael Kirkby Costas. My wife would have killed me ..."
TAM_,TAMP.    	'To tamp' means to pack down tightly by tapping. 'Tamp' was originally used to specifically describe the action of packing down sand or dirt around an explosive prior to detonation.
AFL_T,"A-FLAT.    	Frederic Chopin was a Polish composer, who spent most of his life in France. Chopin was most famous for his piano works in the Romantic style. Chopin was a sickly man, though, and died quite young at 39. For many of his final years he had a celebrated and tempestuous relationship with the French author George Sand (the nom de plume of the Baroness Dudevant). Those years with Sand may have been turbulent, but they were very productive in musical terms."
O_B,"ORB.    	An orb and cross ('globus cruciger') has been used as a Christian symbol of authority since Medieval times. The cross sits atop the globe, indicating Christ's authority over the world. When the orb is held in the hand of a king or queen, this indicates the authority invested in the earthly ruler."
AMN_O,"AMNIO.    	Amniocentesis ('amnio' for short) is the prenatal test which involves the removal of a small amount of the amniotic fluid surrounding the fetus using a hypodermic needle. The fluid naturally contains some fetal cells, the DNA of which can then be tested to determine the sex of the child and to check for the presence of genetic abnormalities."
B_X,"BOX.    	'Pugilism', another word for 'boxing', comes from the Latin 'pugil' meaning 'boxer'. In turn, 'pugil' derives from 'pugnus', the word for 'fist'."
SUSI_,"SUSIE.    	""Wake Up, Little Susie"" is a song most famously associated with the Everly Brothers, as it was a hit for the duo in 1957. ""Wake Up, Little Susie"" is, or at least used to be, the favorite song of President George W. Bush."
_IMEON,"SIMEON.    	The Hebrew Bible states that the Israelites are descended from Jacob, and that his twelve sons are the patriarchs of the 12 tribes of Israel. Simeon was Jacob's second oldest son."
MA_WEST,"MAE WEST.    	Comic actress Mae West can be quoted so easily, as she had so many great lines delivered so well. Here are a few:"
ANG_R,ANGER.    	The Ancient Roman poet Horace wrote:
CA_E,CASE.    	A docket is the official summary of proceedings in a court of law. The term is sometimes uses (informally) to refer a court's calendar of cases.
WE_SEL,"WEASEL.    	""Pop! Goes the Weasel"" is an English nursery rhyme, and a relatively young one that probably dates back only to the mid-1800s. No one really knows for certain the significance of the ""pop"" and the ""weasel""."
L_KE,LAKE.    	24. See 45-Across : CHAD
MYER_,"MYERS.    	Fort Myers is a city on the Gulf Coast of Florida. The city was built on the site of the old Fort Myers, a fort built by the US Army as a base of operations against the Seminole Native Americans."
T_SLAS,"TESLAS.    	Tesla Motors starting building out a network of fast-charging stations to facilitate longer journeys of their vehicles. Known as Tesla Supercharger stations, there are over 600 such locations around the world as of 2016. These network is arranged into 'corridors', in order to match potential traffic patterns. The first corridor was a route connecting San Francisco, Lake Tahoe, Los Angeles and Las Vegas."
_AE,"DAE.    	Daniel Dae Kim is an American actor who is famous for playing Jin-Soo Kwon on ""Lost"". Kim now plays one of the leads on the CBS remake of ""Hawaii Five-O"", portraying the character Chin Ho Kelly."
M_C,MIC.    	A microphone is a bit of audio-visual equipment.
C_NGA,"CONGA.    	The conga line is a dance that originated as a Cuban carnival march. It became popular in the US starting in the thirties. The dance is apparently named after the Congo region of Africa, and it was originated by slaves who were brought from there to Cuba."
SA_,"SAG.    	The Screen Actor's Guild is a labor union with over 200,000 members these days. The SAG was formed back in 1933, at a time when Hollywood stars were really being exploited by the big movie studios, especially the younger, more inexperienced performers. Early supporters of the Guild included famous names like Humphrey Bogart and James Cagney (you could imagine them in a negotiation!). Past presidents of SAG have also been big names, such as Eddie Cantor, James Cagney, Ronald Reagan, Howard Keel, Charlton Heston, Ed Asner and Melissa Gilbert."
ELL_,"ELLY.    	""For Better or for Worse"" is a comic strip drawn by Lynn Johnson, that ran from 1979 to 2008. The strip didn't really stop in 2008 as such, as the original storyline just started over again, with newly drawn artwork. Interesting idea ..."
_VONNE,"EVONNE.    	Evonne Goolagong was an outstanding Australian tennis player who was at the pinnacle of her success in seventies and early eighties. Her colorful family name, Goolagong, came from her Aboriginal father who worked for much of his life as an itinerant sheep shearer. I remember seeing Goolagong play back then, and I always thought that she was so elegant and such a lady on the court ..."
ENSL_R,ENSLER.    	Eve Ensler is a playwright whose most famous work is 'The Vagina Monologues'. When Ensler was only 23 years of age she adopted a 15 year old boy. We are familiar with that boy on the big screen these days: actor Dylan McDermott.
OT_O,"OTHO.    	AD 69 was a year of civil war in ancient Rome. The unrest started with the death of emperor Nero in AD 68, after which followed the brief rule of Galba, of Otho, of Vitellius, and of Vespasian all in the same year. As a result, AD 69 became known as the Year of the Four Emperors."
EPHED_A,EPHEDRA.    	Ephedra is a plant extract used in traditional Chinese medicine for the treatment of asthma and hay fever. Ephedra was banned by the FDA in 2004 as its use has been linked to many fatalities.
AR_ADIA,"ARCADIA.    	Pan was the god of shepherds in Greek mythology, and lived in the rustic surroundings of Arcadia."
STE_GEL,"STENGEL.    	Casey Stengel was a professional baseball player, playing from 1912-1925, and managing from 1934-1965. Stengel was born in Kansas City. He had German heritage, and so was called ""Dutch"" for much of his early life. As he acquired fame on the baseball field, he was given the nickname ""Casey"", largely because he came from Kansas City (""KC"") and also because of the popularity of the poem ""Casey at the Bat"". He was a smart and erudite guy when it came to baseball, so sportswriters tended to call him ""The Old Professor""."
LIS_S,"LISPS.    	Daffy Duck first appeared on the screen in ""Porky's Duck Hunt"" in 1937. In the original cartoon, Daffy was just meant to have a small role, but he was a big hit as he had so much sass. Even back then, Daffy was voiced by the ubiquitous Mel Blanc."
MO_ET,"MOTET.    	A motet is a simple musical composition based on a sacred text, usually sung without an accompaniment. The term ""motet"" is a diminutive of the French for ""word"" ... ""mot""."
DE_ALI,"DENALI.    	I was surprised to learn that there is a Denali State Park, as well as the Denali National Park. The two are located adjacent to each other (which makes sense!). The State Park is undeveloped for all practical purposes, with just a few campgrounds and trail-heads. Denali means ""the high one"" in the native Athabaskan language, and is now the name used for Mount McKinley."
_GS,"AGS.    	Loretta Lynch is the current Attorney General of the US, having assumed office in April of 2015. Lynch is the first African-American woman to hold the post, and only the second woman (Janet Reno was the first). "
ACUT_,"ACUTE.    	In geometry, there are several classes of angles:"
DEBUS_Y,"DEBUSSY.    	The great French composer Claude Debussy, composed a piece called ""L'Enfant Prodigue"" (The Prodigal Son) quite early in his life, and it premiered in 1884. The work is described as a cantata in one act (a one-act opera in effect), and it earned him the Prix de Rome and a scholarship to the Academis des Baux-Arts allowing him to continue his studies. The prize included a four-year residence at the French Academy in Rome. But, Debussy was far from inspired by his stay in Rome, had no liking for Italian opera, and lacked the inspiration to compose. He was steadfast in his desire to ""go his own way"", and thank goodness he won out in the end!"
C_SABA,"CASABA.    	A casaba is type of honeydew melon. The casaba takes its name from the Turkish city of Kasaba, from where the fruit was imported into America in the late 1800s."
_CMES,"ACMES.    	The ""acme"" is the highest point coming from the Greek ""akme"", which has the same meaning."
MADA_,MADAM.    	Madam' is sometimes shortened to 'ma'am'.
IMHI_,"I'M HIP.    	The word ""hip"" meaning ""informed"" is just a a variant of the word ""hep"", which has the same meaning. Both terms probably originated as slang first used in the African American community."
_LUB,"CLUB.    	The club sandwich is a double-decker affair with three layers of bread and two layers of filling. This style of sandwich has been around since the end of the 19th century, and some say it was invented at an exclusive gambling ""club"" in Saratoga Springs, New York."
AB_E,"ABBE.    	Abbe is the French word for an abbot, although it has been used in France for all young clergymen since the middle of the 16th century."
AGGIE_,"AGGIES.    	Texas A&M is the seventh largest university in the country, and was the first public, higher education institute when it accepted its first students in 1876. The full name of the school was the Agricultural and Mechanical College of Texas, and its primary mission used to be the education of males in the techniques of farming and military warfare. That's quite a combination! Because of the agricultural connection, the college's sports teams use the moniker ""Aggies""."
_EOLIAN,"AEOLIAN.    	Aeolus was the ruler of the winds in Greek mythology, and he gave his name to the adjective ""aeolian"" (also 'aeolic, eolic') meaning ""windblown"", something produced or carried by the wind. For example, an aeolian harp is a fascinating instrument; a box with a sounding board and strings that is ""played"" by the wind as it blows."
SAGA_,"SAGAS.    	As almost everyone knows, the original ""soap operas"" were radio dramas back in the fifties. Given the structure of society back then, the daytime broadcasts were aimed at housewives working in the home. For some reason, the sponsors of those radio shows, and the television shows that followed, were soap manufacturers, like Procter & Gamble, Colgate-Palmolive and Lever Brothers. And that's how the soap opera got its nickname."
ME_,MED.    	'Scrip' is an informal term for a prescription.
W_SABI,"WASABI.    	Sometimes called Japanese horseradish, wasabi is a root used as a condiment in Japanese cooking. The taste of wasabi is more like mustard than a hot pepper in that the vapors that create the 'hotness' stimulate the nasal passages rather than the tongue. Personally, I love the stuff ..."
JA_,JAX.    	The Jacksonville Jaguars have been in the NFL since 1995.
CO_GI,"CORGI.    	The Welsh corgi is a herding dog that originated in Britain, with two recognized breeds: the Pembroke and Cardigan. Corgis aren't speedy enough to do their job by running around livestock like collies, and instead nip at the heels."
_IEN,"RIEN.    	Nantes is a beautiful city located on the delta of the Loire, Erdre and Sèvre rivers. It has the well deserved nickname of 'The Venice of the West'. I had the privilege of visiting Nantes a couple of times on business, and I can attest that it really is a charming city ..."
ADAGI_,"ADAGIO.    	An adagio is a piece of music with a slow tempo. The ""adagio"" marking on the score is an instruction to play the piece slowly and in a stately manner. The word adagio is Latin for ""at ease""."
GO_NA,"GONNA.    	""Never Gonna Dance"" opened on Broadway relatively recently, in 2003, even though it features the music of Jerome Kern (long since passed away, in 1945). The musical was based on teh 1936 movie ""Swing Time"", starring Fred Astaire and Ginger Rogers."
RATIT_,RATITE.    	Ratites are species of birds that cannot fly. Ratites are different physiologically than other birds in that they have nowhere on their sternum to attach the muscles needed for flight.
TRIS_AN,"TRISTAN.    	""Tristan und Isolde"" is an epic opera by Richard Wagner (Wagner ... not one of my favorites!). Many see it as the first serious move away from the traditional harmony and tonality of the classical and romantic eras. I say, he shouldn't have bothered ..."
A_MES,"ACMES.    	The ""acme"" is the highest point coming from the Greek ""akme"", which has the same meaning."
PA_UA,"PADUA.    	Padua is a city in northern Italy, and was chosen by William Shakespeare as the setting for ""The Taming of the Shrew"". The play is one of his earliest romantic comedies."
