MA_,"MAS.    	""No mas!"" translates from Spanish as ""no more!""."
T_E,"TOE.    	'Turf toe' is a sports injury associated with play on artificial turf or any other surface without much give. Turf toe is a sprain of the ligaments around one or more toe joints, particularly the big toe. The medical term for the injury is 'metatarsophalangeal joint sprain'."
M_I,"MAI.    	In French, many flowers (fleurs) bloom in May (mai)."
L_A,"LGA.    	The accepted three big airports serving New York City are John F. Kennedy (JFK), La Guardia (LGA) and Newark (EWR)."
ROM_,"ROME.    	'The Bicycle Thief"" is 1948 Italian film that was adapted from the novel 'Bicycle Thieves' by Luigi Bartolini. 'The Bicycle Thief"" is widely lauded as one of the greatest films ever to be made. It was directed by Vittorio De Sica."
Y_NTA,"YENTA.    	Yenta (also ""Yente"") is actually a female Yiddish name. In Yiddish theater ""yenta"" came to mean a busybody."
PA_,"PAP.    	One meaning of ""pap"" is soft or semi-liquid food for babies and small children. ""Pap"" comes into English via French, from the Latin word used by children for ""food"". In the 1500s, ""pap"" also came to mean ""an over-simplified"" idea. This gives us a usage that's common today, describing literature or perhaps TV programming that lacks real value or substance. Hands up those who think there's a lot of pap out there, especially on television ..."
OKI_,"OKIE.    	John Steinbeck's 'The Grapes of Wrath' is set during the Great Depression. The novel tells the story of the Joad family from Oklahoma, farmers who had to leave their home and head for California due to economic hardship."
EGG_,"EGGO.    	Eggo is the brand name of a line of frozen waffles made by Kellogg's. When they were introduced in the 1930s, the name ""Eggo"" was chosen to promote the ""egginess"" of the batter. ""Eggo"" replaced the original name chosen, which was ""Froffles"", created by melding ""frozen"" and ""waffles""."
NI_,"NIE.    	'Nie' is the German word for ""never""."
_IKE,"NIKE.    	Nike was the Greek goddess of victory, often referred to as the Winged Goddess of Victory. The athletic shoe company Nike uses the 'Nike swoosh' as its logo, which is based on the goddess's wing."
MA_,MAW.    	A maw is the term used to describe the mouth or stomach of a carnivorous animal. It has become a slang term for the mouth or stomach of a greedy person.
UV_,"UVA.    	The University of Virginia (UVA) was founded by Thomas Jefferson, who sat on the original Board of Visitors alongside former US Presidents James Madison and James Monroe. In fact, the original UVA campus was built on land that was once a farm belonging to President Monroe."
HT_P,"HTTP.    	""http"" are the first letters in most Internet link addresses. 'http' stands for HyperText Transfer Protocol."
IS_RE,"ISERE.    	The Isère river gives its name to the French Department of Isère, located partly in the French Alps. In turn, Isère gave its name to a somewhat famous ship called the Isère, which in 1885 delivered the Statue of Liberty from France to America in 214 shipping crates."
AN_,ANS.    	Answer (ans.)
S_SA,SOSA.    	Sammy Sosa was firmly in the public eye in 1998 when he and Mark McGwire were vying to be the first to surpass the home run record held by Roger Maris. McGwire fell out of public favor due to stories of steroid abuse (stories which he later admitted were true) while Sosa fell out of favor when he was found to be using a corked bat in a 2003 game.
C_A,"CHA.    	The cha-cha-cha is a Latin dance with origins in Cuba, where it was introduced by composer Enrique Jorrin in 1953."
_PCA,"SPCA.    	Unlike in other countries, there is no ""umbrella"" society in the US for the prevention of cruelty to animals. Rather, there are independent organizations set up all over the nation using the name SPCA. You probably have one nearby. There is an American Society for the Prevention of Cruelty to Animals which was originally intended to operate across the country, but really it is focuses its efforts in New York City."
_LSIE,"ELSIE.    	Elsie is a Scottish name, a diminuitive of Elizabeth."
YOG_,"YOGA.    	""Asana"" is a Sanskrit word literally meaning ""sitting down"". The asanas are the poses that a practitioner of yoga assumes. The most famous is the lotus position, the cross-legged pose called ""padmasana""."
N_KE,"NIKE.    	Nike was the Greek goddess of victory, often referred to as the Winged Goddess of Victory. The athletic shoe company Nike uses the 'Nike swoosh' as its logo, which is based on the goddess's wing."
AER_E,"AERIE.    	An aerie is the nest of an eagle, and is also known as an 'eyrie'."
LO_I,"LONI.    	Loni Anderson's most-remembered role was Jennifer Marlowe on the sitcom ""WKRP in Cincinnati"". Anderson has been married four times, most famously to actor Burt Reynolds from 1988 to 1993."
AGU_,"AGUE.    	An ague is a fever, one usually associated with malaria."
O_OOLE,"O'TOOLE.    	The Stunt Man' is a 1980 film that tells the story of a fugitive hiding out as a stunt double on a movie set. The movie was received well by the critics and was nominated for three Academy Awards. 'The Stunt Man' isn't well known in the US though, largely due to some poor distribution. As leading actor Peter O'Toole said, 'The film wasn't released, it escaped.'"
SIN_,"SINE.    	A sine wave is a mathematical function that describes a simple, smooth, repetitive oscillation. The sine wave is found right throughout the natural world. Ocean waves, light waves and sound waves all have a sine wave pattern."
O_IE,"OBIE.    	The Obies are the ""Off-Broadway Theater Awards"". The Obies are presented annually and the recipients are chosen by ""The Village Voice"" newspaper."
DA_,"DAM.    	The Three Gorges region along the Yangtze River in China is known for its spectacular scenery. The area is attracting a lot of attention in recent years because of the ongoing project to build a hydroelectric dam that will undoubtedly change the ecology and appearance of the land both upriver and downriver. The dam itself is completed, and is the biggest electricity-generating plant in the world, although not all generators are on line yet. The total capacity is expected to be 22.5 GW."
T_TO,"TOTO.    	Toto is Dorothy's dog in the film 'The Wizard of Oz'. Toto was played by a dog called Terry, but Terry's name was soon changed to Toto in real life, due to the success of the film."
_IA,"PIA.    	""Pia mater"" is Latin, and means ""tender mother"". It is the name given to the mesh-like envelope that surrounds the brain and spinal cord. The pia mater brings blood to some of the exterior parts of the brain, and provides physical support for larger blood vessels passing over the brain's surface."
NI_,"NIX.    	The use of nix as a verb, meaning ""to shoot down"", dates back to the early 1900s. Before that ""nix"" was just a noun meaning ""nothing"". It comes from the German ""nichts"", which also means ""nothing""."
K_I,KOI.    	Koi are also called Japanese carp. They have been bred for decorative purposes and there are now some very brightly colored koi found in Japanese water gardens.
SAH_,"SAHL.    	Mort Sahl is a Canadian-born actor and comedian, who moved to the US with his family when he was a child. He became friends with John F. Kennedy, and later when Kennedy became president, Sahl wrote a lot of jokes for the President's speeches, although he told a lot of Kennedy jokes in his acts. After the President was assassinated in 1963, Sahl was intensely interested in finding out who was behind the crime and even got himself deputized as a member of one of the investigating teams. He was very outspoken against the results of the Warren Commission report on the assassination, and soon found himself out of favor with the public. It took a few years for him to make his comeback, but comeback he did."
EBER_,"EBERT.    	Friedrich Ebert was President of Germany from 1919 until he passed away in 1925. He was the first person to hold the office, which was created under the Weimar constitution that officially governed the country from 1919 until 1945. Ebert was a pivotal figure in the German Revolution at the end of WWI that led to the Weimar Republic."
AF_A,"AFTA.    	Afta Lotion is a brand name of after shave lotion, belonging to Colgate-Palmolive."
_IT,"MIT.    	""Good Will Hunting"" was the movie that gave both Matt Damon and Ben Affleck their big break in films, and deservedly so. Affleck and Damon are actually distant cousins who lived two blocks from each other in Cambridge, Massachusetts where the pair spent their teen years. The two friends wrote the film's screenplay and of course took starring roles, alongside Robin Williams and Minnie Driver. Affleck and Damon won an Academy Award for the screenplay. What a great success story, eh?"
UL_E,"ULEE.    	""Ulee's Gold"" is a highly respected film from 1997 in which Peter Fonda plays the title role of Ulee. Ulee's ""gold"" is the honey that Ulee produces. It is a favorite role for Peter Fonda and he has shared that playing Ulee brought to mind his father, Henry Fonda, who himself kept a couple of hives. So if you see Peter Fonda in ""Ulee's Gold"" you're witnessing some characteristics that Peter saw in his father."
IR_Q,"IRAQ.    	ISIS is an extremist Sunni rebel group, with the acronym standing for the Islamic State of Iraq and Syria. The organization is also referred to as ISIL, standing for the Islamic State of Iraq and the Levant, or simply IS, for the Islamic State."
_MAS,"AMAS.    	""Amo, amas, amat: ... ""I love, you love, he/she/it loves"", in Latin."
D_I,"DEI.    	Dei Gratia' is Latin for 'By the Grace of God'. The term is used in the name of a monarch who is said to be ruling by divine right. For example, the full title of the UK's Queen is 'Elizabeth II, by the Grace of God, of the United Kingdom of Great Britain and Northern Ireland and of Her other Realms and Territories Queen, Head of the Commonwealth, Defender of the Faith'."
YOD_,"YODA.    	Yoda is one of the most beloved characters in the ""Star Wars"" series of films. Yoda's voice was provided by the great modern-day puppeteer Frank Oz of ""Muppets"" fame."
AS_S,"ASPS.    	The asp is a venomous snake found in the Nile region of Africa. It is so venomous that the asp was used in ancient Egypt and Greece as a means of execution. Cleopatra observed such executions noting that the venom brought on sleepiness without any painful spasms. When the great queen opted to commit suicide, the asp was therefore her chosen method."
_EAR,"LEAR.    	Laughable Lyrics' is Edward Lear's fourth book of nonsense poems, first published in 1877."
L_C,"LUC.    	Sir Patrick Stewart is most famous perhaps for playing Captain Jean-Luc Picard in 'Star Trek: The Next Generation'. Stewart's Hollywood career became so successful that he moved from the UK to Los Angeles, but he returned to his homeland in 2004. He stated at the time he was homesick, and wanted to get back to playing roles in the theater."
A_TS,ANTS.    	Myrmecology is the study of ants. The term derives from the Greek 'myrmex' meaning 'ant'.
_AI,"MAI.    	The Mai Tai cocktail is strongly associated with the Polynesian islands, but the drink was supposedly invented in 1944 in Trader Vic's restaurant in Oakland, California. One recipe is 6 parts white rum, 3 parts orange curaçao, 3 parts Orgeat syrup, 1 part rock candy syrup, 2 parts fresh lime juice, all mixed with ice and then a float added of 6 parts dark rum."
_TNO,"AT NO.    	The atomic number (at. no.) of oxygen (O) is 8, and of nitrogen (N) is 7."
SP_S,"SPAS.    	Baden-Baden is located in the southwest of German in the Black Forest, very close to the border with France. The natural springs of Baden-Baden were greatly prized by the Ancient Romans who used the town as a spa. Baden-Baden became very popular with the aristocracy in the 1800s when visitors included Queen Victoria, as well as the composers Berlioz and Brahms, and the writer Dostoevsky. The town's reputation earned it the nickname of the ""European Summer Capital"". The town was originally called just Baden in the Middle Ages, and the name was officially changed to Baden-Baden in 1931. Baden-Baden is short for ""the town of Baden in the state of Baden""."
OR_OS,"OREOS.    	Apparently Oreo Ice Cream flavors were introduced relatively recently, in 2010."
OS_,"OSO.    	In Spanish, ""osa"" is a female bear, and ""oso"" is a male."
BR_R,"BR'ER.    	Br'er Rabbit and Br'er Fox are characters in the Uncle Remus stories, written by Joel Chandler Harris. His stories are adaptations of African American folk tales that he collected across the South. The ""Br'er"" of course stands for ""brother""."
_SE,"-OSE.    	The sugar we consume as ""table sugar"" is mainly sucrose that is extracted from sugar cane and sugar beet. We also consume lactose, naturally occurring in milk, and fructose, naturally occurring in fruit. But most of the sugar we eat or drink tends to be prepared commercially, the most famous being high-fructose corn syrup, which is glucose that is industrially processed into a glucose/fructose mix. Don't get me started on the politics of food ..."
E_MA,"ERMA.    	Erma Bombeck wrote for newspapers for about 35 years, producing more than 4,000 witty and humorous columns describing her home life in suburbia."
Y_NTA,"YENTA.    	Yenta (also ""Yente"") is actually a female Yiddish name. In Yiddish theater ""yenta"" came to mean a busybody."
AE_EID,"AENEID.    	""The Aeneid"" is Virgil's epic poem that tells of the journey of Aeneas, a Trojan who traveled to Italy to become the ancestor of all Romans. 'The Aeneid' begins with the words 'Arma virumque cano ...', which translates as 'I sing of arms and of a man ...'"
B_TS,"BLTS.    	The BLT (bacon, lettuce and tomato) is the second most popular sandwich in the US, after the plain old ham sandwich."
EB_RT,"EBERT.    	Roger Ebert co-hosted a succession of film review television programs for over 23 years, most famously with Gene Siskel until Siskel passed away in 1999. Siskel and Ebert famously gave their thumbs up or thumbs down to the movies they reviewed."
P_T,"PST.    	San Francisco (SF) is on Pacific Standard Time (PST), except during daylight saving time (DST)."
DA_,"DAM.    	Glen Canyon Dam is the second largest dam on the Colorado River, and is located at Page, Arizona. The Dam was built to flood Glen Canyon, creating what we now know as Lake Powell."
CG_,CGI.    	Computer-generated imagery (CGI)
_RTOO,"ARTOO.    	Artoo's proper name is R2-D2. R2-D2 is the smaller of the two famous droids from the ""Star Wars"" movies. British actor Kenny Baker, who stood just 3 ft 8 ins tall, was the man inside the R2-D2 droid for the first six of the ""Star Wars"" movies."
ORE_S,"OREOS.    	There's a smartphone app featuring the Oreo cookie. It's a game in which one twists Oreo cookies apart, 'licks' the cream from the center and then dunks the remainder of the cookie in a glass of milk."
UBO_T,"U-BOAT.    	U-boat stands for the German ""Unterseeboot"" (undersea boat). U-boats were primarily used in WWII to enforce a blockade against enemy commercial shipping, with a main objective being to cut off the supplies being transported to the Britain from British colonies and the US. The fight for control of the supply routes became known as the Battle of the Atlantic."
S_LO,"ST LO.    	Saint-Lô is a town in Normandy that was occupied by Germany in 1940. Saint-Lo stood at a strategic crossroads and so there was intense fighting there during the Normandy invasion of 1944. After a prolonged bombardment, very little of the town was left standing."
ANDE_,"ANDES.    	The Andes is the longest continuous chain of mountains in the world, running right down the length of the west coast of South America for about 4,300 miles. The highest peak in the range is Mt. Aconcagua, at an elevation of 22,841 feet. Interestingly, the peak of Mt. Chimborazo in Ecuador is the furthest point on the Earth's surface from the center of the planet. That's because of the equatorial ""bulge"" around the Earth's ""waist""."
_ANI,RANI.    	A ranee (also spelled rani) is the female equivalent of a raja in India.
A_TA,AFTA.    	Afta Lotion is a brand name belong to Colgate-Palmolive.
_DSELS,"EDSELS.    	It was Henry Ford's son Edsel who gave his name to the Edsel brand of automobile, a name that has become synonymous with ""failure""."
_ONA,"RONA.    	Rona Jaffe was an American novelist perhaps most famous for two of her books, ""The Best of Everything"" and ""Mazes and Monsters"". ""The Best of Everything"" was published in 1958 and has been compared with the HBO television series ""Sex and the City"" as it depicts women in the working world. ""Mazes and Monsters"" was published in 1981 and explores a role-playing game similar to Dungeons & Dragons and the impact it has on players."
MENS_,"MENSA.    	If you ever learned Latin, ""mensa"" was probably taught to you in lesson one as it's the word commonly used as an example of a first declension noun. Mensa means ""table"". The Mensa organization, for folks with high IQs, was set up in Oxford, England back in 1946. To become a member you have to have an IQ that is in the top 2% of the population."
T_NO,"TINO.    	First baseman Tino Martinez has retired from Major League Baseball. Martinez played for a number of teams including the Mariners, Yankees, Cardinals and Devil Rays. Martinez was born and raised in Tampa, Florida and as a boy he worked in his father's cigar factory."
SCA_,"SCAT.    	""To vamoose"" is to ""to leave"", and comes from the Spanish ""vamos"" meaning ""let us go""."
SA_L,"SAHL.    	Mort Sahl is a Canadian-born actor and comedian who moved to the US with his family when he was a child. Sahl became friends with John F. Kennedy. When Kennedy became president, Sahl wrote a lot of jokes for the President's speeches, although he also told a lot of Kennedy jokes in his acts. After the President was assassinated in 1963, Sahl was intensely interested in finding out who was behind the crime and even got himself deputized as a member of one of the investigating teams. He was very outspoken against the results of the Warren Commission report on the assassination, and soon found himself out of favor with the public. It took a few years for him to make his comeback, but come back he did."
S_O,"SHO.    	""Nurse Jackie"" is a comedy-drama series centered on an emergency room nurse at a hospital in New York City. The lead character is played by Edie Falco, who also played Tony Soprano's wife on the 'The Sopranos'."
L_I,"LAI.    	The My Lai Massacre took place in the Vietnamese village of that name in March, 1968. After an investigation it was determined that at least 347 unarmed civilians, mostly women, children and elderly people, were murdered by a unit of US soldiers. It was also revealed that gang rapes and torture took place during the massacre. At least three servicemen tried to halt the killing, but they were vastly outnumbered by those participating. About two years after the massacre, 26 men were charged with crimes, but only one man was convicted. William Calley was found guilty of murder and sentenced to life imprisonment and hard labor. President Nixon stepped in the day after Calley was sentenced and ordered him transferred from Leavenworth prison and placed under house arrest pending appeal. On appeal the life sentence was reduced to 20 years, and this was further cut to 10 years as an act of clemency by the Secretary of the Army. Calley was released after serving three years in total."
O_O,"OSO.    	In Spanish, ""osa"" is a female bear, and ""oso"" is a male."
A_OCO,AMOCO.    	Amoco is an abbreviation for the American Oil Company. Amoco was the first oil company to introduce gasoline tanker trucks and drive-through filling stations. I wonder did they know what they were starting ...?
_ST,"PST.    	On the other side of the Atlantic, Daylight Saving Time (DST) is known as ""summer time"". The idea behind summer/daylight-savings is to move clocks forward an hour in spring and backwards in the fall, so that afternoons have more daylight."
MA_,"MAW.    	'Maw' is a term used to describe the mouth or stomach of a carnivorous animal. ""Maw"" is also used as slang for the mouth or stomach of a greedy person."
E_R,"EUR.    	Ukraine is a large country in Eastern Europe, a Soviet Republic before the dissolution of the USSR. In English we often call the country 'the Ukraine', but I am told this isn't appropriate."
O_TAWA,OTTAWA.    	Ottawa is the second largest city in the Province of Ontario (after Toronto) and is the capital city of Canada. The name 'Ottawa' comes from an Algonquin word 'adawe' which means 'to trade'.
T_THE,"TITHE.    	A tithe is a traditional payment of one tenth of a person's annual income and is usually given to a church. Tithing is a practice taught in many traditions, and according to a 2002 survey, about 3% of American adults donate 10% or more of their income to a church."
_AJ,"RAJ.    	The period of colonial rule by the British in South Asia from 1858 to 1947 is referred to as the British Raj. Prior to 1858, the area was ruled by a private enterprise, the British East India Company. 'Raj' is the Hindi word for 'reign'."
BE_A,"BETA.    	In the world of software development, the first tested issue of a new program is usually called the ""alpha"" version. It is expected to have a lot of bugs that need to be fixed, so the alpha release is usually distributed to a small number of testers. After the reported bugs have been eliminated, the refined version is called a ""beta"" and is released to a wider audience, but with the program clearly labeled as ""beta"". The users generally check functionality and report further bugs that are encountered. The beta version feeds into a release candidate, the version that is tested just prior to the software being sold into the market, bug-free ... yeah, right ..."
A_COT,"ASCOT.    	An Ascot tie is that horrible looking (I think!) wide tie that narrows at the neck, which these days is only really worn at weddings. The tie takes its name from the Royal Ascot horse race at which punters still turn up in formal wear at Ascot Racecourse in England."
A_TS,"ANTS.    	The full name of the English author known as H. G. Wells was Herbert George Wells. Wells is particularly well known for his works of science fiction, including 'The War of the Worlds', 'The Time Machine', 'The Invisible Man' and 'The Island of Doctor Moreau'. He was a prolific author, and a prolific lover as well. While married to one of his former students with whom he had two sons, he also had a child with writer Amber Reeves, and another child with author Rebecca West."
E_IZA,"ELIZA.    	Eliza Doolittle is Professor Henry Higgins' speech student in George Bernard Shaw's ""Pygmalion"". Of course ""Pygmalion"" was adapted by Lerner and Loewe to become the Broadway musical ""My Fair Lady"". The musical spun off the wonderful 1964 film of the same name starring Audrey Hepburn and Rex Harrison. To cockney Eliza Doolittle, Professor Henry Higgins was ""'Enry 'Iggins""."
E_Y,"EDY.    	Dreyers' ice cream sells its products under the name Dreyers in the Western United States, and Edy's in the Eastern states. The company's founders were William Dryer and Joseph Edy."
_EE,VEE.    	The leading letter in the word 'village' is a letter V (vee).
_ETRI,"PETRI.    	Julius Richard Petri was a German bacteriologist and was the man after whom the Petri dish is named. The petri dish can have an agar gel on the bottom which acts a nutrient source for the specimen being grown and studied, in which case the dish plus agar is referred to as an ""agar plate""."
ES_,ESC.    	67. See 65-Down : KEY
O_OOLE,"O'TOOLE.    	Irish actor Peter O'Toole got his big break in movies when he played the title role in the 1962 epic film ""Lawrence of Arabia"". But my favorite of O'Toole's movies is much lighter fare: ""How to Steal a Million"" in which he stars opposite Audrey Hepburn."
N_C,NSC.    	The National Security Council (NSC) was created by President Harry S. Truman in 1947. The NSC is chaired by the sitting president and meets in the White House Situation Room.
N_LO,"NOLO.    	""Nolo contendere"" is a legal term that translates from Latin as ""I do not wish to contend"". It's the plea of ""no contest"" and is an alternative to ""guilty"" or ""not guilty"", meaning that one doesn't admit guilt but nor does one dispute the charge."
EGG_,"EGGO.    	Eggo is the brand name of a line of frozen waffles made by Kellogg's. When they were introduced in the 1930s, the name ""Eggo"" was chosen to promote the ""egginess"" of the batter. ""Eggo"" replaced the original name chosen, which was ""Froffles"", created by melding ""frozen"" and ""waffles""."
ES_ER,"ESTER.    	Esters are very common chemicals. The smaller, low-molecular weight esters are usually pleasant smelling and are often found in perfumes. At the other end of the scale, the higher-molecular weight nitroglycerin is a nitrate ester and is very explosive, and polyester is a huge molecule, a type of plastic."
_ANOI,"HANOI.    	Hanoi was the capital of North Vietnam, and Saigon the capital of South Vietnam. After the Vietnam War, Hanoi was made capital of the reunified state. Saigon, the larger metropolis, was renamed to Ho Chi Minh City. Hanoi is located in the delta of the Red River, and is just over 50 miles from the Gulf of Tonkin in the South China Sea."
BR_R,"BR'ER.    	Br'er Rabbit and Br'er Fox are characters in the Uncle Remus stories, written by Joel Chandler Harris. The Uncle Remus stories are adaptations of African American folktales that Harris collected across the Southern States. ""Br'er"" of course stands for ""brother""."
