_KTS,"TKTS.    	The 'TKTS' booths sell discount theater tickets, notably in Times Square in New York and in the West End of London."
UGG_,"UGGS.    	Uggs are sheepskin boots that originated in Australia and New Zealand. Uggs have sheepskin fleece on the inside for comfort and insulation, with a tanned leather surface on the outside for durability. Ugg is a generic term down under, although it's a brand name here in the US."
ULN_S,"ULNAS.    	The radius and ulna are bones in the forearm. If you hold the palm of your hand up in front of you, the radius is the bone on the ""thumb-side"" of the arm, and the ulna is the bone on the ""pinkie-side""."
IMD_,"IMDB.    	The website called the Internet Movie Database (IMDb) was launched in 1990, and is now owned by Amazon.com. It's a great site for answering question one has about movies and actors."
ID_,"IDE.    	The -ide suffix is used for anions e.g the chlorine anion is called chloride, sulfur is sulfide."
SHAL_,"SHALE.    	Shale oil can be extracted from oil shale (!), although the extraction process is more expensive than that used to produce crude oil."
G_RM,GERM.    	The germ of a cereal (like wheat and oat) is the reproductive part that germinates and grows into a new plant. A whole grain has three main parts:
T_REE,"THREE.    	The fairy tale of 'The Three Little Pigs' has been around for centuries, although it first appeared in print in the 1840s. One little pig built a house using straw and another built one using wood. The cleverest little pig built its house using bricks."
_DE,"IDE.    	The -ide suffix is used for anions e.g the chlorine anion is called chloride, sulfur is sulfide."
ATE_IER,"ATELIER.    	An atelier is an artist's studio, as ""atelier"" is the French word for ""studio"" or ""workshop""."
_OAD,"GOAD.    	""Goad"" is of course a verb meaning to give pointed encouragement, but it is also the noun describing said stimulus."
TR_IS,"TROIS.    	In French, one (un) plus two (deux) equals three (trois)."
_EHRIG,"GEHRIG.    	Baseball legend Lou Gehrig was known as a powerhouse. He was a big hitter and just kept on playing. Gehrig broke the record for the most consecutive number of games played, and he stills holds the record for the most career grand slams. His durability earned him the nickname 'The Iron Horse'. Sadly, he died in 1941 at 37-years-old suffering from amyotrophic lateral sclerosis (ALS), an illness we now call 'Lou Gehrig's Disease'. The New Yankees retired the number four on 4th of July 1939 in his honor, making Lou Gehrig the first baseball player to have a number retired."
GRET_L,"GRETEL.    	Hansel and Gretel' is a Germanic fairy tale found in the collection of the Brothers Grimm. It tells of two siblings, Hansel and Gretel, the children of a woodcutter. The youngsters are abandoned in a forest at the behest of an evil stepmother. Clever Hansel hears of the plan and leaves a trail of pebbles so that he and his sister can find their way home, which they do. But the children are abandoned again and this time leave a trail of breadcrumbs. Unfortunately, the crumbs are eaten by birds and so the children do indeed become lost. But eventually they do all live happily ever after ..."
UOM_,"UOMO.    	""L'Uomo Vogue"" is a men's version of ""Vogue"" magazine published in Italy."
DES_,DESC.    	Descendant
_NTA,ANTA.    	An anta is a post or pillar on either side of the entrance to a Greek temple.
_RILS,"ARILS.    	The casing called the aril, which surrounds may seeds, may be quite fleshy. This fruit-like characteristic makes it desirable as a food and aids in the dispersion of the seeds."
CHE_K,CHECK.    	
A_TI,"ACT I.    	William Shakespeare's ""The Tempest"" tells the story of Prospero, who removed from the throne of Milan and banished to a deserted island along with his daughter, Miranda. Prospero learns sorcery on the island, and eventually conjures up a tempest that drives those who usurped his throne (in particular his own brother, Antonio) onto the shores of the island."
M_TT,"MOTT.    	Lucretia Coffin Mott (what a name!) was an American Quaker, and an advocate for women's rights. She has been called the first American ""feminist"". Mott's first job was teaching in the Quaker school in which she was educated. There she learned that her salary was to be one third of that paid to the males with the same job (she married one of the male teachers!). That injustice initiated her interest in women's rights."
ZE_OG,"ZERO-G.    	The force of gravity that we all feel is referred to as 'one G'. As gravity is a actually an accelerating force, acceleration is measured relative to that force of gravity. So, if we are sitting in a vehicle that accelerates at 3G, then we are experiencing a force that is three times that which we feel from the gravitational pull of the earth. Zero-G is weightlessness that is experienced when in space, outside the influence of the earth's gravity."
_PAIN,"SPAIN.    	The Philippines was claimed for Spain by the Portuguese explorer Ferdinand Magellan when he discovered the islands in 1521. The Philippines remained in Spanish hands until the Spanish-American War of 1898 reached the Philippines. The Philippine revolutionary leader, took advantage of the War and declared independence, but when the Treaty of Paris was signed ending the conflict, the US ""bought"" the Philippines for $20 million. Understandably, the Philippine rebels didn't like this idea, starting the Philippine-American War which ended with the US forcibly taking control and ruling until the Japanese invasion in WWII."
_USTO,"GUSTO.    	'Gusto' is an Italian word meaning 'taste'. We use it in English in the phrase 'with gusto', with great enjoyment."
PO_E,"POLE.    	Pope John Paul II led the Catholic Church from 1978 until 2005, a period of over 26 years. That made him the second longest serving Pope in history, after Pius IX who reigned for over 31 years in the mid 1800s. Paradoxically, John Paul II's predecessor was John Paul I who only ruled for 33 days. John Paul II was a native of Poland, and was the first non-Italian Pope to lead the church since 1523. His birth name was Karol Wojtyla."
EMA_L,"EMAIL.    	AOL was a leading Internet Service Provider (ISP) in the 1980s and 1990s. The company does still provide dial-up access to the Internet for some subscribers, but most users now access AOL using faster, non-AOL ISPs."
_ION,"SION.    	The Priory of Sion is presented in the preface of Dan Brown's novel ""The Da Vinci Code"" as a secret society that did in fact exist. However, there is a lot of evidence that the priory was an invention, created in forged documents in the sixties. Regardless, Dan Brown's book is a really enjoyable read, in my humble opinion ..."
POEM_,POEMS.    	The American journalist and poet Joyce Kilmer is primarily known for his 1913 poem titled 'Trees'. The original text of the poem is:
CF_S,CFOS.    	Chief Financial Officer (CFO)
TRE_,"TREO.    	The Treo is a smartphone that was originally developed by a company called Handspring. Handspring was bought by Palm Inc. Subsequently, the Treo was phased out and replaced by the Palm Pre."
EYE_,"EYES.    	The concepts that underpin the technology of contact lenses date back to Leonardo Da Vinci. Although Da Vinci didn't propose the development of the contact lens, he did write about correcting vision by submerging the eye in a bowl of water. Over a hundred years later, René Descartes made a somewhat impractical suggestion, but along the right lines, of using a glass tube filled with liquid that could be placed in contact with the eye to correct vision. The first real contact lenses were developed by Adolf Gaston Eugen Fick, a German ophthalmologist, in 1887."
BO_T,"BOLT.    	A bolt of cloth is a roll of defined length, usually collected directly from the loom."
ME_W,"MEOW.    	The Persian is that long-haired cat with the squashed in muzzle. The breed takes its name from its place of origin, Persia (Iran)."
_NASSIS,"ONASSIS.    	Jackie Kennedy Onassis was born into a privileged family, the daughter of a Wall Street stock broker, John Vernou Bouvier III. Ms. Bouvier moved in the same social circles as the Kennedy clan, and first met the then-US Representative John Kennedy at a dinner party hosted by mutual friends. After she saw her husband assassinated, and her brother-in-law Bobby Kennedy, she declared that she feared for the life of her children as they bore the Kennedy name. She left the country, eventually meeting and marrying Aristotle Onassis. Reportedly she was very satisfied that the Greek shipping magnate was able to provide privacy and security for her children."
P_IR,"PAIR.    	In poker, any pair is better than ace-high."
_CTI,ACT I.    	In Act I of William Shakespeare's 'Julius Caesar' a soothsayer warns the doomed emperor to 'beware the Ides of March'. Caesar ignores the prophesy and is of course killed on the steps of the Capitol by a group of conspirators on that very day.
NSYN_,"NSYNC.    	NSYNC was a boy band from Orlando, Florida that was formed in 1995. The name of the group came from a comment by the mother of band member Justin Timberlake, who said the boys voices sounded 'in sync'. But, it's also true that the letters of the name NSYNC are the last letters of the given names of the five band members:"
CH_U,CHOU.    	(47. See 69-Down : ENLAI)
_AHRE,"MAHRE.    	Phil Mahre is one of the great alpine ski racers, a native of Yakima, Washington. Phil's twin brother Steve was also a skier on the World Cup circuit."
EDN_S,"EDNAS.    	Edna Best was an English actress, probably best known for playing the mother in Alfred Hitchcock's 1934 film 'The Man Who Knew Too Much'."
ATE_IER,"ATELIER.    	An atelier is an artist's studio, as ""atelier"" is the French word for ""studio"" or ""workshop""."
_ALESA,"WALESA.    	Lech Walesa used to be an electrician in the Gdansk Shipyards in Poland. He was active in the trade union movement in the days when unions were not welcome behind the Iron Curtain. His efforts resulted in the founding of Solidarity, the first independent trade union in Soviet controlled territory. For his work, Walesa was awarded the Nobel Peace Prize in 1983, and in 1990 he became the first democratically elected President of Poland. He has lost support in Poland in recent years, but is a very popular booking on the international speaking circuit."
P_S,"PXS.    	A PX is a Post Exchange, a retail store operating on a US Army Base. The equivalent on an Air Force Base is a Base Exchange (BX). At a Navy installation it's a Navy Exchange (NEX), at a Marine Corps installation it's a Marine Corps Exchange (MCX) and at a Coast Guard Installation it's a CGX."
D_ARF,"DWARF.    	The story ""Tom Thumb"" was originally published in 1621, making it the first fairy tale ever printed in English."
A_KI,"AOKI.    	Isao Aoki is one of Japan's greatest golfers, now playing on the senior circuit. His best finish in a major tournament was runner-up to Jack Nicklaus in the 1980 US Open."
EM_,"EMB.    	An envoy works at an embassy and is a representative of a government, someone ranking below an ambassador. The name comes from the concept of the envoy being a ""messenger"" from his or her government. ""Envoyer"" is the French word for ""to send""."
_RU,"DRU.    	Dru Hill is an R&B singing group from Baltimore, Maryland. Dru Hill was formed in 1992, and is still going strong today. The name 'Dru Hill' comes from Druid Hill Park which is found on the west side of Baltimore."
SERA_ES,"SERAPES.    	A ranchero is one employed on a ranch, and has Spanish roots. A Mexican ranchero might be dressed in a serape."
S_IT,"SWIT.    	Loretta Swit started playing ""Hot Lips"" Houlihan on ""M*A*S*H"" in 1972. She and Alan Alda were the only actors who appeared in both the pilot and the series finale. Swit has written a book on needlepoint, would you believe? It's called ""A Needlepoint Scrapbook"" if you want to go look for it!"
CO_DS,"COEDS.    	Ole Miss is the nickname for the University of Mississippi. The name ""Ole Miss"" dates back to 1897, the first year a student yearbook was published. The graduating class held a competition to name the yearbook, and ""Ole Miss"" emerged as the winner. The name stuck to the yearbook, and also to the school itself."
USOT_UR,"USO TOUR.    	The United Service Organization was founded in 1941 at the request of FDR, ""to handle the on-leave recreation of the men in the armed forces"". A USO tour is a tour by a troupe of entertainers, many celebrities, to troop locations, often including combat zones."
NO_O,NO-NO.    	The word 'taboo' was introduced into English by Captain Cook in his book 'A Voyage to the Pacific Ocean'. Cook described 'tabu' (likely imitative of a Tongan word that he had heard) as something that was both consecrated and forbidden.
_ANTS,"PANTS.    	The term ""fly"" is used to describe the flap covering the buttons or zipper in the front of a pair of pants. Before ""fly"" was used for pants, it was the name given to a tent flap."
CAF_,"CAFE.    	A pousse-café is such an elegant cocktail, made by layering the ingredient liquids on top of each other resulting in a spectacular and colorful 'striped' drink. The secret is to add the densest liquor first, then adding the less dense layers on top. I've had one, and it looks a lot better than it tastes."
_HIG,"WHIG.    	The Whig Party (in the US) operated from 1833 to 1856, as the opposition party to the Democrats. One of the tenets of the Whig Party was the supremacy of Congress over the Executive branch. Prominent members of the party included Presidents Zachary Taylor and John Tyler."
DIE_,"DIET.    	A Diet was the general assembly of the estates of the former Holy Roman Empire. The most famous of these assemblies was the Diet of Worms, a meeting that took place in the small town of Worms on the Rhine River in Germany. The main item on the agenda was discussion about 95 theses of Martin Luther. Luther was summoned to the meeting, and found to be guilty of heresy."
_OSE,"JOSE.    	No way, José!"
ESPA_OL,"ESPANOL.    	Catalán is a Romance language spoken in parts of Spain, along with the official Spanish language (Espanol)."
HOL_,"HOLD.    	Muzak is a proprietary name for piped music, apparently a blend of the words ""music"" and ""Kodak"". The Muzak system was developed way back in 1922 and first used in workplaces."
DOO_,"DOOM.    	Mount Doom is a volcano in Middle-earth, the universe created by J. R. R. Tolkien for his ""Lord of the Rings"" trilogy."
UNI_EF,"UNICEF.    	The United Nations Children's Fund is known by the acronym UNICEF because the organization's original name when it was founded in 1946 was the United Nations International Children's Emergency Fund. The original focus of the fund was to provide relief to children in countries that had been devastated by WWII. UNICEF is supported by contributions from governments, but also by individual donors. One of the more successful programs for collecting private donations is the Trick-or-Treat UNICEF box that has been a tradition here in North America since 1950."
F_S,"FAS.    	The solfa syllables are: do, re, mi, fa, sol, la & ti."
O_ENAME,"ONE NAME.    	The singer Rihanna was born and grew up on the island of Barbados and moved to the US when she was 16-years-old to pursue a singing career. 'Rihanna' is her stage name, as she was born Robyn Rihanna Fenty. The name 'Rihanna' is derived from the Welsh name 'Rhiannon'."
CR_ET,"CRUET.    	A cruet is a small glass bottle for holding a condiment or perhaps a dressing. The word ""cruet"" comes from the Old French word for an earthen pot."
SSGT_,SSGTS.    	Staff sergeant (SSgt)
C_NK,"CONK.    	To bop and to conk are verbs meaning to strike, especially on the head. Where I grew up, ""conk"" was also slang for a nose."
XRA_,"X-RAY.    	Superman was sent to Earth in a rocket as a child by his parents who were living on the doomed planet of Krypton. On Earth he was discovered by the Kents, farmers who lived near the fictional town of Smallville. The Kents raised the infant as their own, giving him the name Clark."
RAY_N,"RAYON.    	Rayon is a little unusual in the textile industry, in that it is not truly a synthetic fiber, but nor can it be called a natural fiber. It is produced from naturally occurring cellulose that is dissolved and then reformed into fibers."
G_Y,"GAY.    	Lesbian, gay, bisexual and transgender (LGBT)"
O_LAS,OLLAS.    	An olla is a traditional clay pot used for the making of stews.
GUN_,"GUNN.    	Robert Louis Stevenson's most celebrated work I'd say is ""Treasure Island"", originally written as a series for a children's magazine in 1881. I remember it as the first ""real"" novel I read as a youngster."
_IKEN,"AIKEN.    	""Ushant"" is an autobiographical novel written by Conrad Aiken, first published in 1952. Aiken won many awards during his life, and was the first Georgia-born author to win a Pulitzer, in 1930."
GDA_,"G'DAY.    	Victoria is the most densely populated state in Australia, with most inhabitants living in the state capital of Melbourne. Just like the Australian state of Queensland, Victoria was named for Queen Victoria, the British monarch at the time the state was founded."
TEA_GAS,TEAR GAS.    	What great wording for a clue ...
S_PAUL,"ST PAUL.    	Concordia University is a liberal arts school in St. Paul, Minnesota, founded in 1893. It was originally founded as a college for prospective Lutheran ministers."
AC_TEN,"ACE-TEN.    	The game of 'twenty-one' was first referred to in a book by Cervantes, the author famous for writing 'Don Quixote'. He called the game 'ventiuna' (Spanish for 'twenty-one'). Cervantes wrote his story just after the year 1600, so the game has been around at least since then. Twenty-one came to the US but it wasn't all that popular so bonus payments were introduced to create more interest. One of the more attractive bonuses was a ten-to-one payout to a player who was dealt an ace of spades and a black jack. This bonus led to the game adopting the moniker 'Blackjack'."
AVOC_T,"AVOCET.    	The avocet is found in warm climates, usually in saline wetlands where it uses its upcurved bill to sweep from side-to-side in water searching for aquatic insects on which it feeds."
SI_IAN,"SIMIAN.    	The most widely distributed genus of primates on the planet is Homo, a genus containing only one species, man (Home sapiens). The second most populous genus of primates is Macaca, the Old World monkeys known familiarly as macaques. Macaques can be found all across Asia, from Japan to Afghanistan, as well as in North Africa. Some of the most famous macaques live in a colony on the Rock of Gibraltar in the Mediterranean."
G_LAG,"GULAG.    	The Gulag was a government agency in the Soviet Union that administered forced labor camps. The term 'gulag' was used for the camps themselves, especially when used for political dissidents. 'GULag' is actually an acronym standing for the Russian 'Chief Administration of Corrective Labor Camps and Colonies'."
M_DAL,"MEDAL.    	In the Ancient Olympic Games, the winner of an event was awarded an olive wreath. When the games were revived in 1896, the winners were originally given a silver medal and an olive branch, with runners-up receiving a bronze medal and a laurel branch. The tradition of giving gold, silver and bronze medals began at the 1904 Summer Olympic Games held in St. Louis, Missouri."
_IPS,"NIPS.    	I guess to ""nip"" is to edge out, to beat by a small margin."
T_ERRA,"TIERRA.    	Tierra del Fuego is an archipelago off the southern tip of South America, which includes Cape Horn. Tierro del Fuego was discovered by the Portuguese explorer Ferdinand Magellan. He saw native fires on land as he passed by, and originally called the location ""Land of Smoke"", but this was later changed to ""Land of Fire"", ""Tierra del Fuego"" in Spanish."
_VAST ,"AVAST!.    	""Avast"" is a nautical term used to tell someone to stop or desist from what they are doing. The word comes from the Dutch ""hou vast"" meaning ""hold fast""."
DAM_,DAMS.    	Beavers build dams so that they can live in and around the slower and deeper water that builds up above the dam. This deeper water provides more protection for the beavers from predators such as bears. Beavers are nocturnal animals and do all their construction work at night.
F_ORA,"FLORA.    	The fauna is the animal life of a particular region, and the flora is that region's plant life. The term 'fauna' comes from the Roman goddess of earth and fertility who was called Fauna. Flora was the Roman goddess of plants, flowers and fertility."
PR_,PRO.    	The MacBook Pro is the high-end model in Apple's MacBook family of portable computers.
RAN_E,RANEE.    	A Ranee (also spelled Rani) is the female equivalent of a Raja in India.
CAL_FORNIAGIRLS,"CALIFORNIA GIRLS.    	""California Girls"" was released in 1965 by the Beach Boys, and reached number three in the ""Billboard"" charts. Twenty years later David Lee Roth recorded a very successful cover version of the song, and it reached exactly the same spot in the charts, number three."
Y_MAHA,"YAMAHA.    	The Japanese company Yamaha started out way back in 1888 as a manufacturer of pianos and reed organs. Even though the company has diversified since then, Yamaha's logo still reflects it musical roots. Even on Yamaha motorcycles you can see a logo made up of three intersecting tuning forks."
ARS_NIO,"ARSENIO.    	Arsenio Hall got his big break with his role in ""Coming to America"" with Eddie Murphy in 1988. The following year he started hosting ""The Arsenio Hall Show"", which ran until 1994. He had a loyal group of fans in the audience that had the habit of almost ""barking"" while pumping their fists in the air. The raucous move became so popular it extended far beyond the influences of Arsenio, and to this day it is still used as a mark of appreciation in some arenas. Not by me, mind you ..."
R_MP,"RCMP.    	The Royal Canadian Mounted Police (the Mounties; RCMP) is an unusual police force in that it provides all policing for the whole country. It works on the national level, right down to the municipal level. The distinctive RCMP uniform of red serge tunic, blue pants with a yellow stripe, stetson hat etc. is known internally as ""Review Order"". The red uniform dates back to the days of the North-West Mounted Police, one of the forerunners to the mounties that were formed in 1920 through the merger of existing forces."
A_THEM,"ANTHEM.    	The lyrics of 'The Star-Spangled Banner' were written first as a poem by Francis Scott Key, inspired by the bombarding by the British of the American forces at Fort McHenry that he witnessed during the Battle of Baltimore in September 1814. The words were then set to the tune of a popular British drinking song penned by John Stafford Smith called 'The Anacreontic Song', with the Anacreontic Society being a men's club in London."
GEE_,"GEEK.    	The original 'geek' was a sideshow performer, perhaps at a circus. We use the term today for someone regarded as foolish or clumsy, but also for someone who is technically driven and expert, but socially inept."
COTT_,"COTTA.    	The name 'terra cotta' comes to us from Latin via Italian and means 'baked earth'. Terra cotta is a ceramic made from clay which is left unglazed. Maybe the most famous work in terra cotta is the Terracotta Army, the enormous collection of life-size figures that was buried with the Qin Shi Huang, the First Emperor of China around 210 BC. I had the privilege of seeing some of this collection when it toured the US a few years ago, and just the few pieces on display were so very impressive."
EN_RME,"ENORME.    	""Enorme"" is the French word for ""big"" or ""enormous""."
_OTE,"TOTE.    	Parimutuel betting is a system in which the bookmaker is guaranteed a pre-determined profit. In the system, all bets are pooled, taxes and house profit are removed, and the payoff is made with the resulting pool. In some parts of the world the parimutuel system is referred to as the Tote (as indeed it is in Ireland)."
IS_POD,"ISOPOD.    	Isopods are small crustaceans (meaning they have exoskeletons), with seven pairs of legs. Examples would be woodlice and pill bugs. The name ""isopod"" comes from the Greek ""iso"" (same) and ""pod"" (foot)."
_ETHS,"SETHS.    	Seth Rogen is a Canadian comedian who got a lot of credit for his supporting role in ""The 40-Year-Old Virgin"". That led to him being cast as the lead in the 1970 film ""Knocked Up"". I am afraid that I haven't seen either movie ..."
_OPHAT,"TOP HAT.    	Planters is the company with the Mr. Peanut icon. Mr. Peanut was the invention of a first grader called Antonion Gentile, a young man who won a design contest in 1916. Remarkable legacy, I'd say ..."
LUL_S,LULUS.    	Humdingers and lulus are things that are quite extraordinary and remarkable.
RICC_,"RICCI.    	Christina Ricci is an American actress who found fame on the big screen at an early age, play the very young Wednesday Addams in the 1991 movie version of ""The Addams Family""."
_HIV,SHIV.    	'Shiv' is a slang term for a weapon crudely fashioned to resemble a knife. Mostly we hear of shivs that have been fashioned by prison inmates to do harm to others.
CA_F,CALF.    	'Dogie' is cowboy slang for a motherless calf in a herd.
COR_NA,CORONA.    	Corona is the top selling imported beer in the United States.
