NE_D,"NERD.    	If you ever had to learn Latin, as did I, ""mensa"" was probably taught to you in Lesson One as it's the word commonly used as an example of a first declension noun. Mensa means ""table"". The Mensa organization for folks with high IQs was set up in Oxford, England back in 1946. To become a member, one is required to have an IQ that is in the top 2% of the population."
MAG_,"MAGI.    	Magi is the plural of the Latin word ""magus"", a term applied to someone who was able to read the stars. Hence, magi is commonly used with reference to the ""wise men from the East"" who followed the star and visited Jesus just after he was born."
_CU,ICU.    	ICU Intensive Care Unit (ICU)
UP_,"UPC.    	UPC stands for Universal Price Code or Universal Product Code. The first UPC-marked item to get scanned in a store was on June 26, 1974 at 08:01 a.m. at Marsh's supermarket in Troy, Ohio. It was a 10-pack of Wrigley's Juicy Fruit chewing gum ..."
EM_RY,EMERY.    	Emery is a very hard type of rock that is crushed for use as an abrasive. Emery paper is made by gluing small particles of emery to paper. Emery boards are just emery paper with a cardboard backing. And emery boards are primarily used for filing nails.
OP_D,"OP-ED.    	Op-Ed is an abbreviation for ""opposite the editorial page"". Op-Eds started in ""The New York Evening World"" in 1921 when the page opposite the editorials was used for articles written by a named guest writer, someone independent of the editorial board."
OL_ ,"OLE!.    	""Toreador"" is an old Spanish word for a bullfighter, but it's a term not used any more in Spain nor in Latin America. In English we use the term ""toreador"", but in Spanish a bullfighter is a ""torero"". A female bullfighter in a 'torera'."
_HAI,"CHAI.    	Chai is a drink made from spiced black tea, honey and milk, with ""chai"" being the Hindi word for ""tea"". We often called tea ""a cup of char"" growing up in Ireland, with ""char"" being our slang word for tea, derived from ""chai""."
DAN_E,DANTE.    	Dante Alighieri (usually just 'Dante') was an Italian poet of the Middle Ages. Dante's 'Divine Comedy' is widely considered to be the greatest literary work ever written in the Italian language.
LLAM_,"LLAMA.    	The wool from a llama is much softer than that from a sheep, and it is also free from lanolin."
PAP_,"PAPA.    	Josef Haydn was an Austrian composer, often called the ""Father of the Symphony"" due to his prolific output of symphonies that helped define the form. Haydn was also the father figure among ""the big three"" composers of the Classical Period: Haydn, Mozart and Beethoven. Hayden was a good friend to Mozart, and a teacher of Beethoven."
_LFA,"ALFA.    	The 'Alfa' in Alfa Romeo is actually an acronym, standing for Anonima Lombarda Fabbrica Automobili (""Lombard Automobile Factory, Public Company""). ALFA was an enterprise founded in 1909 and which was taken over by Nicola Romeo in 1915. In 1920 the company name was changed to Alfa Romeo."
A_B,"ALB.    	The alb is the white, neck-to-toe vestment worn by priests, usually with a rope cord around the waist. The term alb comes from ""albus"", the Latin word for ""white""."
SIR_,"SIRI.    	Siri is software application that works with Apple's iOS operating system. 'Siri' is an acronym standing for Speech Interpretation and Recognition Interface. You've probably seen the ads on television, with folks talking to their iPhones asking for information and responding with a voice. I hear that Google is a little scared by Siri, as Siri is non-visual. There's no need to touch a screen or a keyboard to work with Siri, no opportunity to click on one of Google's ads! By the way, voice-over artist Susan Bennett recently revealed herself as the female American voice of Siri. The British version of Siri is called Daniel, and the Australian version is called Karen."
RE_D,REED.    	Our modern bassoon first appeared in the 1800s and has had a place in the concert orchestra ever since.
_RTA,SRTA.    	Señorita (Srta.) is Spanish and mademoiselle (Mlle.) is French for 'Miss'.
MEI_,"MEIR.    	Golda Meir was known as the ""Iron Lady"" when she was Prime Minister of Israel, long before the term came to be associated with British Prime Minister Margaret Thatcher. Golda Meir was born Golda Mabovitch in Kiev (in modern-day Ukraine), and when she was a young girl she moved with her family to the United States and settled in Milwaukee. As a teenager she relocated to Denver where she met and married Morris Meyerson, at the age of 19. She and her husband joined a kibbutz in Palestine in 1921, when she was in her twenties. She had been active in politics in the US, and continued her political work in Palestine. She was very influential during WWII, and played a leading role in negotiations after the war leading to the setting up of the state of Israel. By the time she was called on to lead the country, she had already retired, citing exhaustion and ill health. But serve she did, and led Israel during turbulent times (e.g. the massacre at the Munich Olympics, the Yom Kippur War). She eventually resigned in 1974, saying that was what the people wanted."
_UNE,"RUNE.    	A rune is a character in an alphabet that is believed to have mysterious powers. In Norse mythology, the runic alphabet was said to have a divine origin."
_RROL,"ERROL.    	Errol Flynn was born 1909 in Tasmania, Australia where he was raised. In his twenties, Flynn lived in the UK where he pursued his acting career. Around the same time he starred in an Australian film ""In the Wake of the Bounty"" and then appeared in a British film ""Murder at Monte Carlo"". It was in the latter film that he was noticed by Warner Brothers who brought him to America. Flynn's non-American heritage shone through even while he was living the American dream in California. He regularly played cricket, along with his friend David Niven, in the Hollywood Cricket Club."
DR_O,"DR NO.    	""Dr. No"" may have been the first film in the wildly successful James Bond franchise, but it was the sixth novel in the series of books penned by Ian Fleming. Fleming was inspired to write the story after reading the Fu Manchu tales by Sax Rohmer. If you've read the Rohmer books or seen the films, you'll recognize the similarities between the characters Dr. No and Fu Manchu."
O_L,"OIL.    	Alberta is a big province, about the size of Texas. Alberta is named after Princess Louise Caroline Alberta, the fourth child of Queen Victoria and Prince Albert. Princess Louise also donated her name to Lake Louise, the large glacial lake in the province, now within the bounds of Banff National Park."
_KE,"EKE.    	To ""eke out"" means to ""make something go further or last longer"". For example, you could eke out your income by cutting back on expenses. I always have a problem with the commonly cited definition of 'eke out' as 'barely get by'. Close but no cigar, I say ..."
OR_IDA,"ORE-IDA.    	Ore-Ida frozen foods are all made with potatoes. The company is located in Oregon, just across the border from Idaho. The Ore-Ida name is a melding of the two state names."
AJ_X,"AJAX.    	Sophocles was one of three ancient Greek tragedians whose work has survived. The first of these was Aeschylus, the second Sophocles, and the third Euripides. Sophocles is believed to have written 123 plays, the most famous of which are ""Antigone"" and ""Oedipus the King""."
HT_,"HTS.    	During the American Revolutionary War, the Continental Army built a fortification at the northern end of Manhattan that the troops named Fort Washington. The fort fell to the British in 1776 after a bloody battle, and was held by British forces until the end of the war. The surrounding area subsequently adopted the name of the fort and has been called Washington Heights ever since."
MA_,"MAC.    	""Bub"" is American slang, a term used to address males, and is possibly a variation of bud."
_PC,"UPC.    	The person behind the counter at the store might scan the Universal Price Code. The first UPC marked item to get scanned at the front of store was on June 26, 1974, at 08:01 a.m. at Marsh's supermarket in Troy, Ohio. It was a 10-pack of Wrigley's Juicy Fruit chewing gum ..."
_BA,TBA.    	To be advised.
CHE_,"CHER.    	Chaz Bono is the only child of the singers Sonny and Cher (although they both have children from other marriages). Chaz was named Chastity Sun Bono at birth and told her parents at the age of 18 that she was a lesbian. More recently Bono underwent gender reassignment surgery, and Chastity has legally changed his name to Chaz."
NIN_,"NINE.    	The world's first television commercial aired on July 1, 1941 before a baseball game between the Brooklyn Dodgers and the Philadelphia Phillies. It was aired on the New York station WNBT, and Bulova paid $9 to have their products promoted."
ONE_,ONES.    	Binary code uses only the digits '0' and '1'.
ERRO_,"ERROL.    	Errol Morris is a film director, best known for his excellent 2003 documentary 'The Fog of War: Eleven Lessons from the Life of Robert S. McNamara'."
R_J,"RAJ.    	""A Passage to India"" is a wonderful novel by E. M. Forster set in the days of the British Raj. There are two excellent adaptations for the screen that I would recommend. There's a BBC television version from 1965 starring a wonderful cast including Virginia McKenna and Cyril Cusack. There is also an Oscar-winning movie version from 1984 with Alec Guinness and Peggy Ashcroft. Forster had first-hand knowledge of life during the Raj, having worked in India during the twenties."
SI_M,SIAM.    	Siam was the official name of Thailand up to 1939 (and from 1945 to 1949).
N_C,NEC.    	NEC is the name that the Nippon Electric Company chose for itself outside of Japan after a re-branding exercise in 1983.
RE_D,"REED.    	Reed College in Portland is known for many things, including ownership of the world's only nuclear reactor that is primarily run by students!"
_LL,"ALL.    	The Wimbledon Championships of tennis are held at the All England Lawn Tennis and Croquet Club located in Wimbledon, a district of London. The Wimbledon Championships started in 1877, and are still played on grass."
_ERF,"NERF.    	Nerf is the name given to the soft material used in a whole series of toys designed for ""safe"" play indoors. The Nerf product is used to make darts, balls and ammunition for toy guns. ""NERF"" is an acronym, standing for Non-Expanding Recreational Foam."
_RROL,"ERROL.    	Errol Flynn was born 1909 in Tasmania, Australia where he was raised. In his twenties, Flynn lived in the UK where he pursued his acting career. Around the same time he starred in an Australian film ""In the Wake of the Bounty"" and then appeared in a British film ""Murder at Monte Carlo"". It was in the latter film that he was noticed by Warner Brothers who brought him to America. Flynn's non-American heritage shone through even while he was living the American dream in California. He regularly played cricket, along with his friend David Niven, in the Hollywood Cricket Club."
SKA_,"SKAT.    	When I was a teenager in Ireland, I had a friend with a German father. The father taught us the game of Skat, and what a great game it is. Skat originated in Germany in the 1800s and is to this day the most popular game in the country. I haven't played it in decades, but would love to play it again ..."
AR_E,"ARNE.    	Thomas Arne was an English composer from London. Arne wrote some iconic compositions including 'Rule, Britannia!' He also wrote a version of 'God Save the King' that became the British national anthem."
N_C,NEC.    	NEC is the name that the Nippon Electric Company chose for itself outside of Japan after a re-branding exercise in 1983.
_OMA,"MOMA.    	The founding of the Museum of Modern Art (MoMA) in New York City was very much driven by Abby Aldrich Rockefeller, the wife of John D. Rockefeller, son of the oil magnate. Working with two friends, Abby managed to get the museum opened in 1929, just nine days after the Wall Street Crash. The MoMA's sculpture garden bears the name of Abby Aldrich Rockefeller, and has done so since 1949."
RE_,"REE.    	Ree Drummond is a food writer and blogger. Drummond's blog 'The Pioneer Woman' recounts her daily life on her family's working ranch outside of Pawhuska, Oklahoma."
_POD,"IPOD.    	The iPod is Apple's signature line of portable media players. It first hit the market in 2001 in the form of a hard drive-based device now known as the iPod Classic. Later models all use flash memory, allowing a smaller form factor."
EC_AT,"ECLAT.    	Éclat can mean a brilliant show of success, or the applause or accolade that one receives. The word derives from the French ""éclater"" meaning ""to splinter, burst out""."
_ONA,"IONA.    	Although the small island of Iona lies just off the west coast of Scotland, it was the site of a monastery built in the Middle Ages by a monk from Ireland, Colm Cille (also known as Columba). Colm Cille and his followers were sent into exile from the Irish mainland and settled in Iona, as at that time it was part of an Irish kingdom. This monastery in Iona expanded its influence over the decades, founding other institutions all over Ireland and Great Britain. It is believed that the famous Book of Kells may have been written, or at least started, at the monastery on Iona."
I_U,ICU.    	Intensive Care Unit (ICU)
A_B,"ALB.    	The alb is the white, neck-to-toe vestment worn by priests, usually with a rope cord around the waist. The term alb comes from ""albus"", the Latin word for ""white""."
E_F,"ELF.    	A brownie is an elfen figure in Scottish and English folklore. Brownies are purported to live in houses, helping with work around the house, but only at night when they can't be seen. Believers might leave small items of food for the brownies, to encourage them to help out."
A_ORA,"AGORA.    	In early Greece the ""agora"" was a place of assembly. Often the assemblies held there were quite formal, perhaps for the reading of a proclamation. Later in Greek history, things became less formal as the agora evolved into a market place. Our contemporary word ""agoraphobia"" comes from these agorae, in the sense that an agoraphobe has a fear of open spaces, a fear of ""public meeting places""."
_LFA,"ALFA.    	The 'Alfa' in Alfa Romeo is actually an acronym, standing for Anonima Lombarda Fabbrica Automobili (""Lombard Automobile Factory, Public Company""), an enterprise founded in 1909. The company was taken over by Nicola Romeo in 1915, and in 1920 the company name was changed to Alfa Romeo."
_HARE,"O'HARE.    	Chicago's O'Hare International is the busiest airport in the world in terms of takeoffs and landings. The original airport was constructed on the site between 1942 and 1943, and was used by the Douglas Aircraft Company for the manufacture of planes during WWII. Before the factory and airport were built, there was a community in the area called Orchard Place, so the airport was called Orchard Place Airport/Douglas Field. This name is the derivation of the airport's current location identifier: ORD (OR-chard D-ouglas). Orchard Place Airport was renamed to O'Hare International in 1949 in honor of Lieutenant Commander Butch O'Hare who grew up in Chicago. O'Hare was the US Navy's first flying ace and a Medal of Honor recipient in WWII."
C_A,"CHA.    	The cha-cha-cha is a Latin dance with origins in Cuba, where it was introduced by composer Enrique Jorrin in 1953."
_BA,TBA.    	To Be Advised.
OLE_,"OLEG.    	Oleg Cassini, the French-born American fashion designer has had two big names particularly associated with his designs. In the sixties he designed the state wardrobe for First Lady Jacqueline Kennedy, and he was also the exclusive designer for Hollywood's Gene Tierney, Cassini's second wife."
_EL,"REL.    	The Constitution of the United States was adopted on September 17, 1787. There have been 27 amendments to the constitution, the first ten of which are collectively called the Bill of Rights. In essence the Bill of Rights limits the power of the Federal Government, and protects the rights of individuals. For example, the First Amendment states:"
TIN_,"TINO.    	Tino Martinez has retired from Major League Baseball, but played first base for a number of teams including the Mariners, Yankees and Cardinals and Devil Rays. Martinez was born and raised in Tampa, Florida, and worked as a boy in his father's cigar factory."
OT_,"OTO.    	The Otoe (also Oto) Native American tribe originated in the Great Lakes region as part of the Winnebago or Siouan tribes. The group that would become the Otoe broke away from the Winnebago and migrated southwestwards ending up in the Great Plains. In the plains the Otoe adopted a semi-nomadic lifestyle dependent on the horse, with the American bison becoming central to their diet."
AMO_O,AMOCO.    	Amoco is an abbreviation for the American Oil Company. Amoco was the first oil company to introduce gasoline tanker trucks and drive-through filling stations. I wonder did they know what they were starting ...?
I_LOO,IGLOO.    	Fabulous clue!
AR_BA,"ARUBA.    	Aruba is one of the so-called ABC Islands. The ABC Islands is the nickname given to the three westernmost islands of the Leeward Antilles in the Caribbean. The nickname comes from the first letters of the island names: Aruba, Bonaire and Curaçao. All three of the ABC Islands are part of the Kingdom of the Netherlands."
P_E,"PIE.    	Buster Keaton was a comic actor, most famous for his work during the silent era. Keaton starred in and co-directed the 1926 silent comedy 'The General', lauded by many as the greatest movie of all time."
EN_LA,"ENOLA.    	The Enola Gay was the B-29 that dropped the first atomic bomb, on Hiroshima in August 1945. Enola Gay was the name of the mother of pilot Col. Paul W. Tibbets, Jr."
_NES,"ONES.    	The commercial game of Monopoly is supposedly a remake of ""The Landlord's Game"" created in 1903 by a Quaker woman called Lizzie Phillips. Phillips used her game as a tool to explain the single tax theory of American economist Henry George. The Landlord's Game was first produced commercially in 1924. The incredibly successful derivative game called Monopoly was introduced in 1933 by Charles Darrow, who became a very rich man when Parker Brothers bought the rights to the game just two years later in 1935."
IRO_,IRON.    	A wood is an alternative club to an iron on a golf course.
OREI_A,"ORE-IDA.    	Ore-Ida frozen foods are all made with potatoes. The company is located in Oregon, just across the border from Idaho. ""Ore-Ida"" is a melding of the two state names."
EL_E,"ELIE.    	Elie Siegmeister was a composer from New York City. Siegmeister wrote classical works, and frequently used jazz, blues and American folk themes and rhythms."
_KES,"UKES.    	The ukulele originated in the 1800s, and mimicked a small guitar brought to the Hawaiian Islands by Portuguese immigrants."
GA_,"GAT.    	'Gat' is the slang term for the Gatling gun, the precursor to the modern machine gun. The Gatling gun was invented by Dr. Richard J. Gatling in 1861. Apparently he was inspired to invent it so that one man could do as much damage as a hundred, thereby reducing the size of armies and diminishing the suffering caused by war. Go figure ..."
NER_,"NERD.    	""If I Ran the Zoo"" is a book written by Dr. Seuss and published in 1950. Apparently this book is famous for using the word ""nerd"", the first time it had been seen in print."
_ARP,"TARP.    	Originally, tarpaulins were made from canvas covered in tar that rendered the material waterproof. The name tarpaulin comes from ""tar"" and ""palling"", with ""pall"" meaning ""heavy cloth covering""."
EBOL_,"EBOLA.    	The Ebola virus causes a very nasty form of hemorrhagic fever. The name of the virus comes from the site of the first known outbreak, in a mission hospital in the Ebola River Valley in the Democratic Republic of the Congo. The disease is transmitted from human to human by exposure to bodily fluids. In nature, the main carrier of Ebola is the fruit bat."
DE_,"DEM.    	On political maps, red states are Republican and blue states Democrat. The designation of red and blue states is a very recent concept, only introduced in the 2000 presidential election by TV journalist, the late Tim Russert. In retrospect, the choice of colors is surprising, as in other democracies around the world red is usually used to describe left-leaning socialist parties (the reds under the bed!), and blue is used for conservative right-wing parties."
MOO_,"MOOT.    	To moot' is to bring up as a subject for discussion or debate. So, something that is moot is open to debate. Something that is no longer moot, is no longer worth debating. We don't seem to be able get that right ..."
COA_I,"COATI.    	A coati is a member of the raccoon family and is also known as the Brazilian aardvark, or the snookum bear. The coati is native to Central and South America, but can also be found in the southwest of the United States."
_GLI,"UGLI.    	The ugli fruit is a hybrid of an orange and a tangerine, first discovered growing wild in Jamaica where most ugli fruit comes from today. 'UGLI' is a trademark name that is a variant of 'ugly', a nod to the fruits unsightly wrinkled rind."
S_TA,"SRTA.    	Señorita (Srta.) is Spanish, and mademoiselle (Mlle.), is French for 'Miss'."
NS_C,"NSEC.    	'Nanosecond' is more correctly abbreviated to ""ns"", and really is a tiny amount of time ... one billionth of a second. "
DANT_,"DANTE.    	La Vita Nuova' is a text by Italian poet Dante Alighieri comprising both prose and verse. It recounts the author's love for Beatrice, describing in 42 chapters the history of that love from the first time he saw her when they were children, right up his mourning after her death. 'La Vita Nuova' translates into English from Italian as 'The New Life'."
AL_BI,"ALIBI.    	""Alibi"" is the Latin word for ""elsewhere"" as in, ""I claim that I was 'elsewhere' when the crime was committed ... I have an 'alibi'""."
RE_,REL.    	Hinduism is a religion (REL).
_BC,"NBC.    	NBC has had a number of different logos in the history of the company, including the famous peacock with which we are familiar today. The first peacock logo was introduced in the early days of color television and was designed to illustrate how wonderful color television would be, so go buy one! (NBC was owned by RCA, and they had a vested interest in sales of color television sets)."
_LAMA,"LLAMA.    	The wool from a llama is much softer than that from a sheep, and it is also free from lanolin."
NE_D,NERD.    	A 'mathlete' is someone who competes in mathematics competitions.
OI_,"OIL.    	'The Starry Night' is a Van Gogh masterpiece depicting what the artist could see from the window of his room in a sanitarium near the village of Saint-Rémy-de-Provence. I am somewhat ashamed to note that one reason I know this painting so well is that I put together a 2,000-piece jigsaw puzzle last Christmas depicting 'The Starry Night'."
_EAL,"TEAL.    	The beautiful color of teal takes it name from the duck called a ""teal"", which has dark, greenish-blue (teal) markings on its head and wings."
DAI_,"DAIS.    	Ultimately our word ""dais"" comes from the Latin ""discus"" meaning a ""disk-shaped object"". ""Discus"" morphed into the Old French word ""dais"" meaning a table or platform, before being absorbed into English. So, we end up with both ""dais"" and ""discus"", from the same root, via two different roots, having two different meanings."
ORE_S,"OREOS.    	The Oreo was the biggest selling cookie in the 20th century, and almost 500 billion of them have been produced since they were introduced in 1912 by Nabisco. In those early days the creme filling was made with pork fat, but today vegetable oils are used instead. If you take a bite out of an Oreo sold outside of America you might notice a difference from the homegrown cookie, as coconut oil is added to give a different taste."
UG_I,"UGLI.    	The ugli fruit is a hybrid of an orange and a tangerine, first discovered growing wild in Jamaica where most ugli fruit comes from today."
A_ODE,"ANODE.    	The two terminals of a battery are called the anode and the cathode. Electrons travel from the anode to the cathode, creating an electric current."
_TO,"OTO.    	The Otoe (also Oto) Native American tribe originated in the Great Lakes region as part of the Winnebago or Siouan tribes. The group that would become the Otoe broke away from the Winnebago and migrated southwestwards ending up in the Great Plains. In the plains the Otoe adopted a semi-nomadic lifestyle centered on the horse, with the American bison becoming central to their diet."
_MUS,"EMUS.    	The emu has had a tough time in Australia since man settled there. There was even an ""Emu War"" in Western Australia in 1932 when migrating emus competed with livestock for water and food. Soldiers were sent in and used machine guns in an unsuccessful attempt to drive off the ""invading force"". The emus were clever, breaking their usual formations and adopting guerrilla tactics, operating as smaller units. After 50 days of ""war"", the military withdrew. Subsequent requests for military help for the farmers were ignored. The emus had emerged victorious ..."
_KES,"UKES.    	The ukulele originated in the 1800s and mimicked a small guitar brought to the Hawaiian Islands by Portuguese immigrants. The more pricey ukuleles are made from koa, a Hawiaian wood."
