DA_E,"DAAE.    	I'm a bit jaded with big, stage musicals I must admit, but I will always have time for Andrew Lloyd Weber's masterpiece ""The Phantom of the Opera"". It is the longest running musical in the history of Broadway, and deservedly so. And now there is a sequel, which I would dearly love to see, so let's hope it gets over here soon. ""Love Never Dies"" opened in the West End in London in March 2010, but the opening in the US has been delayed while Lloyd Weber recovers from surgery for prostate cancer."
BO_D,"BOND.    	'GoldenEye' was the first film in the 'James Bond' series of movies to feature Pierce Brosnan as the lead. The title is a nod to the author of the 'James Bond' novels, Ian Fleming. Fleming had worked for British Naval Intelligence during the war, and on Operation Goldeneye in particular. Fleming also used Goldeneye as the name for his estate in Jamaica."
G_S,"GES.    	The General Electric Company is usually referred to simply as 'GE'. One of the precursor companies to GE was Edison General Electric, founded in 1890 by the inventor Thomas Edison. What we know today as GE was formed two years later when Edison merged his company with Charles Coffin's Thomson-Houston Electric Company. In 1896, GE was selected as one of the 12 companies listed on the newly formed Dow Jones Industrial Average. GE is the only one of the original 12 that is still on that list. I spent over ten years with GE at the beginning of my working career, and in fact it was GE that asked me to transfer to the US back in the 1980s ..."
C_IP,"CRIP.    	The Crips are a street gang here in the US, with origins in Los Angeles going back to 1969. It is believed that the Crips have up to 35,000 members today across the country, and there is even a presence in the US military, both here and abroad. The main rivals of the Crips are the Bloods."
BORI_,"BORIS.    	Boris Godunuv was the Tsar of Russia from 1598 to 1605. He is perhaps better known these days because of the artistic works that are based on his life. Alexander Pushkin wrote the play ""Boris Godunov"", partially using Shakespeare's ""Macbeth"" to structure the storyline of Godunov's life. Modest Mussorgsky then wrote a famous opera ""Boris Godunov"", based on the Pushkin play."
L_HAIM,"L'CHAIM.    	""L'Chaim"" is a Hebrew toast meaning ""to life"", as ""chai"" is the Hebrew word for ""life""."
SE_F,"SELF.    	""Self"" is a magazine for women published by Conde Nast, a publication focused mainly on health and well-being."
_IRBUS,"AIRBUS.    	Airbus is an aircraft manufacturer based in Blagnac, France just outside Toulouse. Airbus produces about half of the world's jetliners. The company built the first fly-by-wire aircraft (the A320) and also builds the world's largest airliner (the A380)."
DI_,"DIT.    	Dahs and dits are the sound equivalents of dashes and dots of Morse Code. Samuel Morse didn't invent Morse code, but it took his name because it was invented for use on the electric telegraph invented by him."
_TTY,"ATTY.    	Abraham Lincoln served as a prairie lawyer for many years, meaning that twice a year he traveled from town-to-town for ten weeks at a time. He worked a lot on disputes involving the operation of river barges under railway bridges, and argued a case before the US Supreme Court involving a canal boat that sank after hitting a bridge. His exposure to river vessels led to him designing a device for buoying vessels over shallow shoals. He was awarded a patent for his design in 1849, making Lincoln the only US president to hold a patent."
WE_,"WEE.    	The word ""lilliputian"" meaning ""wee"" or ""very small"", comes from Jonathan's Swift's ""Gulliver's Travels"". Lilliput and Blefuscu are two island nations that are inhabited by tiny people who are under six inches tall."
_RETES,"ARETES.    	An arete is ridge of rock forming the border between to parallel valleys that have been formed by glaciation. If this ridge is rounded, it is called a ""col"". However, if it is ""sharpened"", with rock falling way with successive freezing and thawing, then it is called an ""arete"". Arete is the French word for ""fishbone""."
_PANO,"SPANO.    	Joe Spano's most famous role was perhaps that of Lt. Henry Goldblume on ""Hill Street Blues"". In ""Apollo 13"" he played an unnamed NASA director. On NCIS he plays FBI agent Tobias Fornell."
EM_,EMP.    	Emperor (emp.)
CA_RIS,"CAPRIS.    	Capri pants first became popular on the island of Capri, apparently. They were invented in Europe in 1948, but only became stylish in the US in the sixties. Mary Tyler Moore often wore Capri pants on 'The Dick Van Dyke Show' and to some extent she sparked a fashion trend. After a lull in the seventies and eighties there was a resurgence in sales after Uma Thurman wore them (and danced in them) in 'Pulp Fiction'. Can't stand the look of them myself ..."
SES_,SESS.    	Session (sess.)
ASTE_S,"ASTERS.    	Goldilocks is a relatively rare type of aster, native to south-eastern Europe."
DIN_R,"DINAR.    	The Dinar is the official currency in many countries, such as Iraq and Bahrain. The Gold Dinar dates back to the early days of Islam, with the name deriving from the Roman currency called ""denarius"" meaning ""ten times"" (as it was originally a coin worth ten asses)."
AKI_AS,"AKITAS.    	The Akita breed of dog is named for its point of origin, the Akita Prefecture in Japan. When Helen Keller visited Japan in 1937, she asked for and was given an Akita breed of dog, with the name of Kamikaze-go. Sadly, the dog died within a year from distemper. The following year the Japanese government officially presented Keller with a replacement dog. Supposedly Keller's dogs were the first members of the breed to be introduced into the US."
LOT_,"LOTI.    	Pierre Loti was a French writer, and also an officer in the French Navy."
DW_EB,"DWEEB.    	Dweeb is a relatively recent American slang that came out of college life in the late sixties. Dweeb, squarepants, nerd, they're all not-nice terms that mean the same thing: someone excessively studious and socially inept."
A_HD,ADHD.    	The 'official' name for the condition we sometimes still refer to as 'attention deficit disorder' (ADD) is 'attention-deficit hyperactivity disorder' (ADHD).
MA_NA,"MANNA.    	According to the Book of Exodus, manna was a food eaten by the Israelites as they traveled out of Egypt. It ""fell"" to Earth during the night six days a week, and was gathered in the morning before it had time to melt."
YAK_MA,"YAKIMA.    	The city and county of Yakima lie southeast of Mount Ranier in the state of Washington. The Yakima Valley is recognized as one of the best apple-producing regions in the world, and it also produces three quarters of all the hops grown in the US."
AG_IE,"AGGIE.    	Texas A&M is the seventh largest university in the country, and was the first public higher education institute when it accepted its first students in 1876."
R_E,"RHE.    	On baseball scoreboards we'll see the letters RHE, standing for Runs, Hits and Errors."
B_HAN,"BEHAN.    	Brendan Behan was an Irish writer and playwright. His most famous work is probably ""Borstal Boy"", an autobiographical novel. Borstal is a term used in the British Isles for juvenile detention. Behan was quite a character, famous for being a heavy drinker (""a drinker with a writing problem"", as he described himself). The drink eventually put him in an early grave, at 41 years. I used to walk to school in Dublin right past the pub where he spent many hours every day."
HO_T,"HOYT.    	Hoyt Wilhelm was a Major league pitcher. Hoyt had a long career, making his final appearance (for the LA Dodgers) in 1972, just shy of his 50th birthday."
_GIF ,"TGIF!.    	""Thank God It's Friday"" (TGIF) is a relatively new expression that apparently originated in Akron, Ohio. It was a catchphrase used first by disk jockey Jerry Healy of WAKR in the early seventies. That said, one blog reader wrote me to say that he had been using the phrase in the fifties."
_DELPHI,"ADELPHI.    	Adelphi University is located in Garden City, New York on Long Island. The university started out as Adelphi Academy in Brooklyn in 1863. By 1929 the academy had moved to Garden City and was a woman's college. It reverted to co-education after WWII when it admitted many students under the GI Bill."
CAM_,"CAMO.    	Our term 'camouflage' evolved directly from a Parisian slang term 'camoufler' meaning 'to disguise'. The term was first used in WWI, although the British navy at that time preferred the expression 'dazzle-painting' as it applied to the pattern applied to the hulls of ships."
A_MCO,"AAMCO.    	AAMCO is named after one of the two founders, Anthony A. Martino (AAM). The company was founded in 1963 in Philadelphia, and opened its first franchise in Newark that same year. There are now about 800 franchises, and AAMCO is the largest chain in the world specializing in automotive transmissions."
FY_,FYI.    	For Your Information.
BRYA_,"BRYAN.    	William Jennings Bryan was an American politician, a noted figure in the Democratic Party, and Secretary of State under President Woodrow Wilson. He ran for the office of President three times, unsuccessfully of course. But he was a great orator, and used his skill to great effect in his campaigning. In fact, it was Bryan who created the national stumping tour, traveling around the country making hundreds of speeches, in days when the other candidates stayed at home."
DO_S,DOCS.    	Documentaries.
_ALEB,"CALEB.    	According to the Bible, after fleeing Egypt the Hebrews were led by Moses to the promised land of Canaan. Outside Canaan, Moses sent twelve spies into Canaan (one from each of the Twelve Tribes) to report on what awaited them. Ten spies returned with exaggerated stories of giants who would kill the Hebrew army if it entered Canaan. Two spies, Caleb and Joshuah, came back with valid reports, that the Hebrews could inhabit Canaan. As a result of the false reports from the ten spies, the Hebrews did not enter Canaan but instead wandered the desert for another forty years, before they finally took up residence in the promised land. At the end of the forty years, Caleb and Joshua were the only adults that survived the forty-year journey, a reward from God for their obedience."
_PL,CPL.    	One answering to a sergeant might be a corporal. 
IS_TAR,"ISHTAR.    	I guess ""Ishtar"" did bomb, 'cause I've never heard of it. It stars Warren Beatty and Dustin Hoffman as lounge singers working in Morocco! There's a Cold War plot, and thank goodness, it's a comedy. It's so bad apparently, that it never even made it to DVD."
_LEC,"ELEC.    	The commercial game of Monopoly is supposedly a remake of ""The Landlord's Game"" created in 1903 by a Quaker woman called Lizzie Phillips who used it as a tool to explain the single tax theory of American economist Henry George. The Landlord's Game was first produced commercially in 1924. The incredibly successful derivative game called Monopoly was introduced in 1933 by Charles Darrow, and he became quite a rich man when Parker Brothers bought the rights to the game just two years later in 1935."
B_UT,"BRUT.    	Sparkling wines can be classified according to sweetness. These classifications are, from dryest to sweetest:"
SEED_,"SEEDY.    	What we call kiwifruit today used to be called a Chinese gooseberry. Marketing folks in the fifties decided to call it a 'melonette', and then New Zealand producers adopted the name 'kiwifruit'."
IS_TOPES,"ISOTOPES.    	Carbon-14 is a radioactive isotope of carbon that is found in nature in small amounts, and is used to in the technique known as radiocarbon dating, a relatively accurate way of determining the age of something up about 60,000 years old. Uranium-235 is also found in nature, again in tiny amounts. When uranium is ""enriched"" it is processed so that the concentration of uranium-235 is increased from trace levels to perhaps over 50%, making what is called ""weapons grade"" uranium, that can be used in nuclear weapons."
SIV_,"SIVA.    	The Hindu Trinity is composed of Brahma the creator, Vishnu the maintainer or preserver, and Shiva (also Siva) the destroyer or transformer. Shiva is a Sanskrit word meaning ""auspicious, kind, gracious""."
_WOS,"TWOS.    	The US two-dollar bill features a portrait of Thomas Jefferson. The bill was introduced in 1862, and withdrawn in 1966. It was reintroduced in 1976, and is still legal tender. That said, there are relatively few two-dollar bills in circulation. Some people even hold that possession of a two-dollar bill is bad luck."
AR_ICLE,"ARTICLE.    	""Time"" is the biggest-selling weekly, news magazine in the world, although newsstand sales are declining as more and more of its readership moves online. When it was first published in 1923, by Briton Hadden and Henry Luce, it was the first weekly news magazine in the country."
OV_M,"OVUM.    	The Fallopian tubes leading from the ovaries of female mammals in the uterus. The tubes are named for the 16th-century Italian anatomist Gabriello Fallopio, who was the first to describe them."
MADEI_A,"MADEIRA.    	Madeira is an Portuguese owned archipelago that lies to the southwest of mainland Portugal. Madeira is famous for its wine, which is a fortified beverage (as is port, sherry and Marsala wine)."
_MPAS,"AMPAS.    	The Academy of Motion Picture Arts and Sciences (AMPAS) is the organization that gives the annual Academy Awards also known as the ""Oscars"". The root of the name ""Oscar"" is hotly debated, but what is agreed is that the award was officially named ""Oscar"" in 1939."
PERS_,"PER SE.    	""Per se"" is a Latin phrase that translates as ""by itself"". We use ""per se"" pretty literally, meaning ""in itself, intrinsically""."
EN_ARTA,"ENCARTA.    	Microsoft badly wanted to get into the online encyclopedia business in the eighties, and approached the biggest and the best, ""Encyclopaedia Britannica"". ""Britannica"" declined, fearing that an online version would damage their print sales. ""Britannica"" had to sell eventually, but not to Microsoft, as the inevitable decline in print sales happened anyway. So Microsoft made a deal with ""Funk & Wagnalls"" and started publishing ""Encarta"" in disk form in the early nineties. Usage of Encarta grew until along came Wikipedia. Encarta was discontinued at the end of 2009."
MOZAR_,"MOZART.    	""La Clemenza di Tito"" (The Clemency of Titus) is an opera seria (serious opera, as opposed to comic opera) that Mozart completed not long before he died."
REN_S,"RENTS.    	The commercial game of Monopoly is supposedly a remake of a game called ""The Landlord's Game"" created in 1903 by a Quaker woman called Lizzie Phillips who created it as a tool to explain the single tax theory of American economist Henry George. The Landlord's Game was actually produced commercially in 1924. The incredibly successful derivative game called Monopoly was introduced in 1933 by Charles Darrow, making him a very rich man when Parker Brothers bought the rights to the game just two years later in 1935."
_ISCO,"DISCO.    	Discotheques first appeared during WWII in Occupied France. American-style music (like jazz and jitterbug dances) was banned by the Nazis, so French natives met in underground clubs that they called discotheques where records were often played on just a single turntable. After the war, these clubs came out into the open. One famous Paris discotheque was called 'Whiskey a Gogo'. In that Paris disco, non-stop music was played using two turntables next to a dance-floor, and this concept spread around the world."
_DEMA,"EDEMA.    	Both animals and plants can suffer from edema, a swelling cause by excessive accumulation of fluid."
_CTV,SCTV.    	'Second City Television' (SCTV) is a sketch show that was produced in Canada from 1976 to 1984.
HO_P,HOOP.    	HOOP/POOH
AS_ES,"ASHES.    	In the Christian tradition, the first day in the season of Lent is called Ash Wednesday. On Ash Wednesday, Palm Crosses from the prior year's Palm Sunday are burned. The resulting ashes are mixed with sacred oil and then used to anoint worshipers on the forehead with the shape of a cross."
GI_,"GIG.    	Musicians use 'gig' to describe a job, a performance. The term originated in the early 1900s in the world of jazz."
_TTS,ATTS.    	Attorneys are often trying to settle out of court.
B_ER,"BOER.    	Boer is the Dutch and Afrikaans word for ""farmer"", a word that was used to describe the Dutch-speaking people who settled parts of South Africa during the 1700s. Many of the settlers left the Cape and founded the Orange Free State, an independent republic located between the Orange and Vaal rivers. The Boers made this move largely to get out from under British rule."
RENOI_S,"RENOIRS.    	Pierre-Auguste Renoir was a French painter, very much at the forefront of the Impressionist Movement. Renoir was a prolific artist, with several thousand works attributed to him. The largest collection of Renoirs is actually in the United States. You can see 181 of his paintings at the Barnes Foundation just outside Philadelphia."
_RMY,"ARMY.    	The current recruiting slogan used by the US Army is ""Army Strong"". This replaced ""Army of One"" in 2006. ""Be All You Can Be"" was the army's slogan for more than twenty years and was adopted in 1980."
_ENL,"GENL.    	In the US Army, a five-star general officer is known as a General of the Army, the rank immediately above that of a ""general"". The rank of General of the Army is reserved for use in time of war. The last person to hold the rank of General of the Army was Omar Bradley."
R_ONE,"ROONE.    	Roone Arledge was an executive at ABC. He made a name for himself in sports broadcasting, and then took over ABC News in 1977, a position he held until his death in 2002."
APAC_E,APACHE.    	The 4-bladed Apache helicopter was introduced in 1975 as a replacement for the 2-bladed Cobra.
_EG,KEG.    	The Miller Brewing Company was founded by Frederick Miller in 1855 in Milwaukee. Miller is now in a joint venture with Coors.
E_IKA,"ERIKA.    	Actress Erika Christensen is probably best known for playing a young cocaine addict in the film 'Traffic' (2000), and the youngest daughter of the Braverman family on the TV show 'Parenthood'."
S_ANO,"SPANO.    	Joe Spano's most famous role was perhaps that of Lt. Henry Goldblume on ""Hill Street Blues"". In ""Apollo 13"" he played an unnamed NASA director."
LANDA_,"LANDAU.    	A landau was a 4-wheeled, horse-drawn carriage. It was quite sophisticated, with metal springs for a comfortable ride, and the smaller version (a lanaulet) had a top that could fold down. Landaus were so called as they were first produced in the German city of Landau."
AMELI_,"AMELIE.    	Amélie' is a 2001 French film, a romantic comedy about a shy waitress in Montmartre, Paris played by Audrey Tautou (who also played the female lead in 'The Da Vinci Code'). The movie was originally released under the French title, 'Le Fabuleux Destin d'Amélie Poulain' ('The Fabulous Destiny of Amélie Poulain')."
LOR_X,"LORAX.    	""The Lorax"" is a children's book written by Dr. Seuss. It is an allegorical work questioning the problems created by industrialization, and in particular its impact on the environment. At one point in the story, the Lorax 'speaks for the trees, for the trees have no tongues'. 'The Lorax' was adapted into an animated film that was released in 2012, with Danny DeVito voicing the title character."
ANT_,"ANTI.    	Pinging is also known as ""engine knocking"". It is a metallic sound, created when not all of the fuel-air mixture is detonated by the spark plug, with some of it detonated late in the cycle. The late detonation causes the knocking/pinging sound. Additives (anti-knock agents) in gasoline can help reduce the chances of pinging."
HI_,HIT.    	That would be in baseball.
TRE_S,TREYS.    	A trey of clubs is a name for the three of clubs in a deck of cards. The name trey can also be used for a domino with three pips.
R_NIS,RANIS.    	A ranee (also spelled rani) is the female equivalent of a raja in India.
SWI_,"SWIT.    	Loretta Swit started playing ""Hot Lips"" Houlihan on ""M*A*S*H"" in 1972. She and Alan Alda were the only actors who appeared in both the pilot and the series finale. Swit has written a book on needlepoint, would you believe? It's called ""A Needlepoint Scrapbook""."
_YOTO,"KYOTO.    	The Kyoto Protocol is designed to fight global warming and was adopted on 11 December 1997 in Kyoto, Japan. Almost 200 states have since signed the protocol and have committed to achieving the year 2012 targets laid down in the document. The most notable signature absent on the document is of course one representing the United States, as we are responsible for over one third of the greenhouse gases emitted across the world. The other significant polluters that have not ratified the agreement are China, India and Brazil."
C_REENS,"CAREENS.    	""Careen"" dates back to 1590 when it meant ""to turn a ship on its side, exposing the keel"". The word evolved from the Middle French word ""carene"" meaning ""keel"". Our modern usage, meaning to lean or tilt, only dates back as far as the 1880s. Careen should not be confused with ""career"", a verb meaning to move rapidly. One has to ""career"" from side-to -side in order to ""careen""."
E_REM,"EFREM.    	I used to watch ""77 Sunset Strip"" as a lid growing up in Ireland. It is an American show that ran from 1958 to 1964. Two of the central characters are former government secret agents, now working as private detectives. Efrem Zimbalist, Jr. played Stu Bailey, and Roger Smith played Jeff Spencer. And who can forget Kookie, played by Edd Byrnes."
M_PLE,"MAPLE.    	The sugar maple is the state tree of New York, Vermont, West Virginia and Wisconsin. It is also the primary source of maple syrup."
FRA_CE,"FRANCE.    	Champagne is a historic province in the northeast of France, famous of course for its sparkling white wine."
SHIR_,SHIRR.    	Shirring is a decorative technique used when sewing a garment. I don't understand it ...
N_CE,"NICE.    	The French city of Nice is on the Mediterranean coast in the southeast of the country. Although Nice is only the fifth most populous city in France, it is home to the busiest airport outside of Paris. That's because of all the tourists flocking to the French Riviera."
ER_SE,"EROSE.    	An edge that is ""erose"" is irregularly notched or indented."
_UL,"CUL.    	Even though ""cul-de-sac"" can indeed mean ""bottom of the bag"" in French, the term cul-de-sac is of English origin (the use of ""cul"" in French is actually quite rude). The term was introduced in aristocratic circles at a time when it was considered very fashionable to speak French. Dead-end streets in France are usually signposted with just a symbol and no accompanying words, but if words are included they are ""voie sans issue"", meaning ""way without exit""."
S_GT,SSGT.    	Staff Sergeant is a rank of Non-Commissioned Officer in the army.
DOGST_R,"DOG STAR.    	When you look up at the night sky, the brightest star you can see is Sirius. It appears so bright to us because it is relatively close to the Earth. Sirius is commonly known as the ""Dog Star"", because it can be seen in the constellation Canis Major, the ""Big Dog""."
_FC,"CFC.    	ChloroFluoroCarbons were the propellants that used to be in aerosols. They make their way up into the ozone layer and trigger a chain reaction that converts ozone (O3) into regular oxygen (O2). Regular O2 is good stuff, but we need O3 to absorb harmful UV radiation raining down on us. CFC ... not good stuff ..."
R_S,RVS.    	Recreational vehicle (RV)
ANEMON_,"ANEMONE.    	The name ""anemone"" means ""daughter of the wind"" in Greek, and at one time it was believed that the wind was what actually caused the flower to bloom. The sea anemone is named for the terrestrial plant even though it isn't a plant at all. The sea anemone is a predatory animal found on the ocean floor."
SAG_L,"SAGAL.    	Katey Sagal played Peggy Bundy on ""Married ... with Children"". Later she took over as star of the show ""8 Simple Rules"" in the middle of its run, when John Ritter passed away unexpectedly in 2003. More recently, Sagal appeared on the FX drama 'Sons of Anarchy'. In 2004, she married Kurt Sutter who created the 'Sons of Anarchy' series."
O_ZIE,"OZZIE.    	Ozzie Newsome is a former professional footballer who played his whole career with the Cleveland Browns. In fact, Newsome never missed one game in the whole of his 13-years with the NFL."
M_LC,"MEL C.    	Sporty Spice is called Mel C, to differentiate her from fellow Spice Girl Mel B (Scary Spice). Mel C was born Melanie Jayne Chisholm. She is the third most successful UK co-writer in terms of UK number ones. she is in good company, as Lennon and McCartney and in the one and two slots."
AS_ES,"ASHES.    	The phoenix is a fabulous bird of Greek mythology, which can also be found in the mythologies of Persia, Egypt and China. The phoenix is a fire spirit, which lives from 500 to 1000 years. At the end of its lifespan is builds a nest for itself (a pyre) and self-ignites, burning itself and the nest, creating a pile of ashes. A young phoenix arises from the ashes and the cycle starts all over again."
ARSEN_C,"ARSENIC.    	Arsenic is element #33 in the periodic table, and has the chemical symbol 'As'. Because of arsenic's toxicity, it was very commonly used in pesticides. These compounds are getting banned over time, but it seems there is a long way to go. Arsenic in aquifers continues to be a problem around the world, including here in the US. China has introduced limits to the amounts of arsenic permitted in food as well as water, mainly as the Chinese staple rice is particularly good at accumulating arsenic from groundwater."
