_NT,ANT.    	'A Bug's Life' is a 1998 animated feature film from Pixar. The storyline is based on the film 'The Seven Samurai' and the fable of 'The Ant and the Grasshopper'.
OA_U,"OAHU.    	O'ahu has been called ""The Gathering Place"", although the word ""O'ahu"" has no translation in Hawaiian. It seems that O'ahu is simply the name of the island. One story is that it is named after the son of the Polynesian navigator that first found the islands. The island is made up of two volcanoes, Wai'anae and Ko'olau, joined together by a broad valley, the O'ahu Plain."
E_IA,"ELIA.    	""The Praise of Chimney Sweepers"" is an essay, published in a collection simply entitled ""Essays of Elia"". Elia was actually a clerk, and a co-worker of Charles Lamb. Lamb was the author."
A_ON,"AVON.    	The character Omar Little is played by Michael K. Williams on the HBO series called ""The Wire"". I didn't watch ""The Wire"" when it first aired but we ending up buying all five series on DVD and we watched the whole thing a couple of years ago. It's is a great drama series, and I thoroughly recommend it. Personally, I think that HBO produces some of the best dramas on American television."
_LNA,"ULNA.    	The humerus is the long bone in the upper arm. The bones in the forearm are the radius and ulna. 'Ulna' is the Latin word for 'elbow', and 'radius' is Latin for 'ray'."
_NID,"ENID.    	Enid, Oklahoma takes its name from the old railroad station around which the city developed. Back in 1889, that train stop was called Skeleton Station. An official who didn't like the name changed it to Enid Station, using a character from Alfred Lord Tennyson's ""Idylls of the King"". Maybe if he hadn't changed the name, the city of Enid would now be called Skeleton, Oklahoma! Enid has the nickname ""Queen Wheat City"" because is has a huge capacity for storing grain, the third largest grain storage capacity in the world."
Y_N,"YEN.    	The Korean Won, the Chinese Yuan, and the Japanese Yen (all of which are Asian currencies) take their names from the Chinese written character that represents ""round shape""."
IR_N,"IRAN.    	Argo' is a 2012 movie that is based on the true story of the rescue of six diplomats hiding out during the 1979 Iran hostage crisis. The film was directed by and stars Ben Affleck and is produced by Grant Heslov and George Clooney, the same pair who produced the excellent 'Good Night, and Good Luck'. I saw 'Argo' recently and recommend it highly, although I found the scenes of religious fervor pretty frightening ..."
_HIO,OHIO.    	What's round on the sides (the letters 'O') and high in the middle (HI).
ES_EE,"ESTEE.    	Estée Lauder was a very successful businesswoman, with a reputation as a great salesperson. Lauder introduced her own line of fragrances in 1953, a bath oil called ""Youth Dew"". ""Youth Dew"" was marketed as a perfume, but it was added to bathwater. All of a sudden women were pouring whole bottles of Ms. Lauder's ""perfume"" into their baths while using only a drop or two of French perfumes behind their ears. That's quite a difference in sales volume ..."
O_IN,"ODIN.    	Sleipnir is an eight-legged horse of Norse mythology, the steed that was ridden by Odin."
OT_E,OTOE.    	The Native American people known as the Otoe were the first tribe encountered by the Lewis and clark Expedition. The meeting took place at a point on the Missouri River that is now known as Council Bluff.
E_AL,"ET AL.    	Et alii (et al.) is the equivalent of et cetera (etc.), with et cetera being used in place of a list of objects, and et alii used for a list of names. In fact 'et al.' can stand for et alii (for a group of males, or males and females), aliae (for a group of women) and et alia (for a group of neuter nouns, or for a group of people where the intent is to retain gender-neutrality)."
O_AL,"OPAL.    	An opal is often described as having a milky iridescence, known as ""opalescence""."
N_AA,NCAA.    	ESPNU (ESPN Universities) is a sports channel focused on college athletics.
_ER,"O'ER.    	The words ""o'er the land of the free"" come from ""The Star Spangled Banner"" written by Francis Scott Key. The lyrics were written first as a poem by Key, inspired by witnessing the bombardment by the British of the American forces at Fort McHenry during the Battle of Baltimore in September 1814. The words were then set to the tune of a popular British drinking song penned by John Stafford Smith called ""The Anacreontic Song"", with the Anacreontic Society being a men's club in London."
E_TU,"ET TU.    	It was Shakespeare who popularized the words ""Et tu, Brute?"" (And you, Brutus?), in his play ""Julius Caesar"", although the phrase had been around long before he penned his drama. It's not known what Julius Caesar actually said in real life just before he was assassinated on the steps of the Senate in Rome."
A_EE,"AGEE.    	James Agee was a noted American film critic and screenwriter. Agee wrote an autobiographical novel ""A Death in the Family"" that won him his Pulitzer in 1958, albeit posthumously. He was also one of the screenwriters for the 1951 classic movie 'The African Queen'."
E_IA,"ELIA.    	Elia Kazan won Oscars for best director in 1948 for ""Gentleman's Agreement"" and in 1955 for ""On The Waterfront"". In 1999 Kazan was given an Academy Lifetime Achievement Award. He also directed 'East of Eden', which introduced James Dean to movie audiences, and 'Splendor in the Grass' that included Warren Beatty in his debut role."
T_RI,"TERI.    	Teri Hatcher's most famous role these days is the Susan Mayer character in ""Desperate Housewives"". I've never seen more than a few minutes of ""Housewives"" but I do know Teri Hatcher as a Bond girl, as she appeared in ""Tomorrow Never Dies""."
STA_,"STAN.    	Stan Lee did just about everything at Marvel Comics over the years, from writing to being president and chairman of the board. If you like superhero movies based on the characters from Marvel Comics, then you could spend a few hours trying to spot Stan Lee in those films as he has a penchant for making cameo appearances. Lee can be spotted in 'X-Men' (2000), 'Spider-Man' (2002), 'Hulk' (2003), 'Fantastic Four' (2005), 'Iron Man' (2008) and many other films."
_SIA,"ASIA.    	The magnificent Himalaya range of mountains in Asia takes its name from the Sanskrit for 'abode of snow'. Geographically, the Himalayas separate the Indian subcontinent from the Tibetan Plateau to the north."
ES_,"EST.    	The use of ""ballpark"" as an estimate only dates back to the space program, and was first used around 1960. The idea was that the area in which a returning spacecraft was expected to splash down was something broad but had predictable dimensions."
A_EE,"ALEE.    	""Alee"" is the direction away from the wind. If a sailor points into the wind, he or she is pointing ""aweather""."
_LLA,"ELLA.    	Ella Fitzgerald, the ""First Lady of Song"", had a hard and tough upbringing. She was raised by her mother alone in Yonkers, New York. Her mother died while Ella was still a schoolgirl, and subsequently she became less interested in her education. She fell in with a bad crowd, even working as a lookout for a bordello and as a Mafia numbers runner. She ended up in reform school, from which she escaped, finding herself homeless and living on the streets for a while. Somehow she managed to get herself a spot singing in the Apollo Theater in Harlem. From there her career took off, and as the say, the rest is history."
U_NA,ULNA.    	The radial notch is at the elbow end of the ulna.
AGR_,"AGRA.    	The most famous mausoleum in the world has to be the Taj Mahal in Agra, India. The Taj Mahal was built after the death of the third wife of Shah Jahan, Mumtaz Mahal (hence the name of the mausoleum). The poor woman died in childbirth delivering the couple's 14th child."
O_HA,"OSHA.    	The Occupational Safety and Health Administration (OSHA) was created in 1970 during the Nixon administration. OSHA regulates workplaces in the private sector and regulates just one government agency, namely the US Postal Service."
RO_,"ROE.    	Roe is the name given to fish eggs or the ovaries of a fish laden with eggs. When the roe develop into fish, the fish may swim around in schools."
SR_,SRI.    	'Sri' is a title of respect for a male in India.
TL_,"TLC.    	""Here Comes Honey Boo Boo"" is a reality show about a child beauty pageant contest called Honey Boo Boo Thompson, and her family. ""Here Comes Honey Boo Boo"" is actually a spinoff show of another reality show called 'Toddlers & Tiaras' that follows the families of a whole host of child beauty pageant contestants. Honey Boo Boo's mother peps up her daughter before appearing in a pageant by giving her 'Go Go Juice', a mixture of Red Bull and Mountain Dew."
_DNA,"EDNA.    	Edna St. Vincent Millay was an American poet and playwright, the third woman to receive the Pulitzer Prize for Poetry (in 1923 for ""The Ballad of the Harp-Weaver""). As well as for her work, Millay was noted for the open arrangement that she and her husband had in their marriage. Millay took many lovers, including the poet George Dillon for whom she wrote a number of sonnets."
_TAN,"STAN.    	The suffix '-stan' in many place names is Persian for 'place of'. One example is 'Pakistan', the Place of the Pure. 'Pakistan' is a relatively recent name, first coined in 1933. It comes from the acronym PAKSTAN, standing for Punjab - Afghan Province - Kashmir - Sind - BaluchisTAN, all regions in the north of India. The 'I' was added to Pakistan to make it easier to pronounce, and to fit the translation 'Land of the Pure'."
U_L,URL.    	Internet addresses are Uniform Resource Locators (URLs).
_RI,"SRI.    	The name Sri Lanka translates from Sanskrit into English as ""venerable island"". Before 1970, Sri Lanka was known as Ceylon, a name given to the country during British rule."
_RAN,"IRAN.    	Mount Damavand is a volcano in Iran, located about 40 miles northeast of Tehran near the southern coast of the Caspian Sea. Mount Damavand is the highest peak in the country, and highest volcano in the whole of Asia."
_RAN,"IRAN.    	The last Shah of Iran was Mohammed-Reza Shah Pahlavi, as he was overthrown in the revolution led by the Ayatollah Khomeini in 1979. The post-revolution government sought the extradition of the Shah back to Iran while he was in the United States seeking medical care (he had cancer). His prolonged stay in the United States, recovering from surgery, caused some unrest back in Iran and resentment towards the United States. Some say that this resentment precipitated the storming of the US Embassy in Tehran and the resulting hostage crisis."
S_A,"SEA.    	""Finding Nemo"" is a 2003 animated blockbuster from Pixar. The film was the winner of the Oscar that year for Best Animated Feature. Believe it or not, ""Finding Nemo"" is the best-selling DVD of all time and, until 2010's ""Toy Story 3"", it was the highest-grossing, G-rated movie at the box office."
N_T,NAT.    	The Confessions of Nat Turner is a 1976 novel by William Styron.
APS_,"APSE.    	The apse of a church or cathedral is a semicircular recess in an outer wall, usually with a half dome as a roof, and often where there resides an altar. Originally, apses were used as burial places for the clergy and also for important relics."
ALA_,"ALAN.    	Alan Turing was an English mathematician. He was deservedly well-respected for his code-breaking work during WWII at Bletchley Park in England. However, despite his contributions to cracking the German Enigma code and other crucial work, Turing was prosecuted for homosexuality in 1952. He agreed to chemical castration, treatment with female hormones, and two years later he committed suicide by taking cyanide. Turing's life story is told in the 2014 film 'The Imitation Game' with Benedict Cumberbatch playing the lead. I thoroughly enjoyed that film ..."
OE_,"O'ER.    	The words ""o'er the ramparts we watched"" come from ""The Star Spangled Banner"" written by Francis Scott Key."
_TTU,"ET TU.    	It was Shakespeare who popularized the words ""Et tu, Brute?"" (And you, Brutus?), in his play ""Julius Caesar"", although the phrase had been around long before he penned his drama. It's not known what Julius Caesar actually said in real life just before he was assassinated on the steps of the Senate in Rome."
URA_,URAL.    	The eastern side of the Ural Mountains in Russia is generally regarded as the natural divide between the continents of Europe and Asia.
T_T,"TET.    	The full name for the new year holiday in Vietnam is Tet Nguyen Dan, meaning ""Feast of the First Morning"". Tet usually falls on the same day as Chinese New Year."
NA_,"NAT.    	Nat King Cole's real name was Nathaniel Adams Coles. Cole made television history in 1956 when his own show debuted on NBC, a first for an African-American. Cole couldn't pick up a national sponsor, so in order to save money and possibly save the show, many guest artists worked for no fee at all &#8211; the likes of Ella Fitzgerald, Harry Belafonte and Peggy Lee. The show survived for a year, but eventually Nat King Cole had to pull the plug on it himself."
O_EO,"OLEO.    	Emperor Louis Napoleon III of France announced a competition to develop a substitute for butter, a substitute that would be more accessible to the lower classes and more practical for the armed forces. In 1869, a French chemist called Hippolyte Mege-Mouries came up with something that he called oleomargarine, which was eventually manufactured under the trade name ""margarine"". The name ""oleomargarine"" also gives us our generic term ""oleo""."
O_HU,"OAHU.    	""From Here to Eternity"" is a 1953 film adaptation of a James Jones novel of the same name. The main characters in the story are three soldiers stationed in Hawaii in the days prior to the attack on Pearl Harbor. The soldiers are played by Burt Lancaster, Montgomery Clift and Frank Sinatra. Deborah Kerr and Donna Reed play the love interests. The film (and novel) title is a quotation from the 1892 poem 'Gentlemen-Rankers' by Rudyard Kipling:"
NC_A,NCAA.    	National Collegiate Athletic Association (NCAA)
_RI,"MRI.    	A CT Scan produces (via computer manipulation) a three dimensional image of the inside of an object, usually the human body. It does so by taking a series of two dimensional x-ray images while rotating the camera around the patient. The issue with CT Scans is that they use x-rays, and high doses on radiation can be harmful, and is cumulative. An MRI on the other hand (Magnetic Resonance Imaging) uses powerful magnetic fields to generate its images, so there is no exposure to ionizing radiation (like X-rays). We used MRI technology in our chemistry labs at school, back in the days when the technology was called Nuclear Magnetic Resonance Imaging. Apparently the marketing folks didn't like the term ""nuclear"" because of its association with ionizing radiation and bombs, so it's now called just MRI."
N_T,"NAT.    	Nat King Cole's real name was Nathaniel Adams Coles. Cole made television history in 1956 when his own show debuted on NBC, a first for an African-American. Cole couldn't pick up a national sponsor, so in order to save money and possibly save the show, many guest artists worked for no fee at all - the likes of Ella Fitzgerald, Harry Belafonte and Peggy Lee. The show survived for a year, but eventually Nat King Cole had to pull the plug on it himself."
_LC,TLC.    	Toddlers & Tiaras' is a reality show aired by TLC that follows contestants in child beauty pageants. Not my cup of tea ...
I_E,"ILE.    	Île-de-France (literally ""Island of France"") isn't an island at all. It is the name given to the most populous of France's 26 administrative regions. Île-de-France is roughly equivalent to the Paris metropolitan area."
ES_E,"ESSE.    	'Esse' is the Latin for 'to be'. 'Sum' means 'I am' and 'erat' means 'he, she was'."
O_IN,"ODIN.    	In Norse mythology, Odin was the chief of the gods. Odin's wife Frigg was the queen of Asgard whose name gave us our English term ""Friday"" (via Anglo-Saxon). Odin's son was Thor, and his name gave us the term ""Thursday""."
OT_,"OTT.    	At 5' 9"", Mel Ott weighed just 170 lb (I don't think he took steroids!) and yet he was the first National League player to hit over 500 home runs. Sadly, Ott died in a car accident in New Orleans in 1958 when he was only 49 years old."
S_I,SRI.    	'Guru' is a Hindi word meaning 'teacher' or 'priest'.
YE_,"YEN.    	Kobe is a city on the island of Honshu in Japan, and yes, basketball star Kobe Bryant is named after the Japanese city."
R_S,RES.    	Resolution (res.)
ES_,EST.    	Estimate (est.)
_LIA,"ELIA.    	Elia Kazan won Oscars for best director in 1948 for ""Gentleman's Agreement"" and in 1955 for ""On The Waterfront"". In 1999 Kazan was given an Academy Lifetime Achievement Award. He also directed 'East of Eden', which introduced James Dean to movie audiences, and 'Splendor in the Grass' that included Warren Beatty in his debut role."
A_A,AKA.    	Also known as (a.k.a.)
A_E,"AVE.    	Madison Avenue became the center of advertising in the US in the twenties, and serves as the backdrop to the great TV drama 'Mad Men'. There aren't many advertising agencies left on Madison Avenue these days though, as most have moved to other parts of New York City. The street takes its name from Madison Square, which is bounded on one side by Madison Avenue. The square in turn takes its name from James Madison, the fourth President of the United States."
OM_R,"OMAR.    	Omar Khayyam was a Persian with many talents. He was a poet as well as an important mathematician, astronomer and physician. A selection of his poems were translated by one Edward Fitzgerald in a collection called ""Rubaiyat of Omar Khayyam""."
OSH_,"OSHA.    	The Occupational Safety and Health Administration (OSHA) was created in 1970 during the Nixon administration. OSHA regulates workplaces in the private sector, and regulates just one government agency, namely the US Postal Service."
OAH_,"OAHU.    	Hanauma Bay is located east of Honolulu on the coast of Oahu. In Hawaiian 'hana' means bay and 'uma' means curve, so the locals usually refer to the area as simply Hanauma, as the word 'Bay' is extraneous."
D_S,"DES.    	The French word 'des' translates as 'of the', or 'some'."
_PO,"IPO.    	An Initial Public Offering (IPO) is the very first offer of stock for sale by a company on the open market. In other words, an IPO marks the first time that a company is traded on a public exchange. Companies have an IPO to raise capital to expand (usually)."
O_ERA,"OPERA.    	The first Grammy Awards Ceremony was held in 1959 and focused on recognizing outstanding achievement in the recording industry. The idea of a Grammy Award came up when recording executives were working on the Hollywood Walk of Fame project in the fifties. These executives concluded that there were many people in the recording industry deserving of accolades but who would probably never make it to the Walk of Fame. As a result, they founded the National Academy of Recording Arts and Sciences. The Academy considered naming the award the 'Eddies' after Thomas Edison, but then opted for 'Grammy' after Edison's invention: the gramophone."
ENI_,"ENID.    	""Idylls of the King"" is a cycle of twelve poems by Alfred, Lord Tennyson, that retell the tale of King Arthur. The sixth of the twelve ""idylls"" is the story of Geraint and Enid."
_RS,ERS.    	Emergency rooms (ERs)
_RL,URL.    	Internet addresses (like NYTCrossword.com and LAXCrossword.com) are more correctly called Uniform Resource Locators (URLs).
UR_,URL.    	Internet addresses (like NYTCrossword.com and LAXCrossword.com) are more correctly called Uniform Resource Locators (URLs).
AGR_,"AGRA.    	The brilliant film ""Slumdog Millionaire"" is a screen adaptation of a 2005 novel by Indian author Vikas Swarup. This low-budget movie won eight Oscars in 2008. I reckon it turned a profit ..."
OT_E,"OTOE.    	The Otoe (also Oto) Native American tribe originated in the Great Lakes region as part of the Winnebago or Siouan tribes. The group that would become the Otoe broke away from the Winnebago and migrated southwestwards ending up in the Great Plains. In the plains the Otoe adopted a semi-nomadic lifestyle dependent on the horse, with the American bison becoming central to their diet."
_LNA,"ULNA.    	The humerus is the long bone in the upper arm. The bones in the forearm are the radius and ulna. 'Ulna' is the Latin word for 'elbow', and 'radius' is Latin for 'ray'."
O_IO,OHIO.    	Ohio (OH)
_RI,"MRI.    	A CT (or ""CAT"") scan produces (via computer manipulation) a three dimensional image of the inside of an object, usually the human body. It does so by taking a series of two dimensional x-ray images while rotating the camera around the patient. The issue with CT scans is that they use x-rays, and high doses of radiation can be harmful causing damage that is cumulative over time. An MRI on the other hand (Magnetic Resonance Imaging), uses powerful magnetic fields to generate its images so there is no exposure to ionizing radiation (such as X-rays). We used MRI equipment in our chemistry labs at school, way back in the days when the technology was still called Nuclear Magnetic Resonance Imaging (NMRI). Apparently the marketing folks didn't like the term ""nuclear"" because of its association with atomic bombs, so now it's just called MRI."
ET_,ETS.    	Extraterrestrial (ET)
OPER_,"OPERA.    	The original soap operas were radio dramas back in the fifties. Given the structure of society back then, the daytime broadcasts were aimed at housewives working in the home. For some reason the sponsors of those radio shows, and the television shows that followed, were soap manufacturers like Procter & Gamble, Colgate-Palmolive and Lever Brothers. And that's how the ""soap"" opera got its name ..."
_OL,SOL.    	Sol was the Roman god personifying the sun.
ER_,ERS.    	A person with a gunshot wound might get the lead (bullet) taken out in an Emergency Room (ER).
TE_I,"TERI.    	Teri Hatcher's most famous role these days is the Susan Mayer character in ""Desperate Housewives"". I've never seen more than a few minutes of ""Housewives"" but I do know Teri Hatcher as a Bond girl, as she appeared in ""Tomorrow Never Dies""."
IL_,"ILE.    	In French, an island (île) is a piece of ground (terre) in the sea (mer)."
_RI,SRI.    	'Sri' is a title of respect for a male in India.
AL_N,"ALAN.    	Alan Bean is a former astronaut. Bean was the fourth man to walk on the moon, roaming the moon's surface with Pete Conrad as part of the Apollo 12 mission. Bean resigned from NASA in 1981 and turned to painting. He is the only artist in the world to have incorporated real moon dust into his works."
_KEA,"IKEA.    	IKEA was founded by Ingvar Kamprad in 1943 when he was just 17-years-old! IKEA is an acronym that stands for Ingvar Kamprad Elmtaryd Agunnaryd (don't forget now!). Elmtaryd was the name of the farm where Ingvar Kamprad grew up, and Agunnaryd is his home parish in Sweden."
_TOE,"OTOE.    	The Otoe (also Oto) Native American tribe originated in the Great Lakes region as part of the Winnebago or Siouan tribes. The group that would become the Otoe broke away from the Winnebago and migrated southwestwards ending up in the Great Plains. In the plains the Otoe adopted a semi-nomadic lifestyle dependent on the horse, with the American bison becoming central to their diet."
M_I,"MRI.    	MRI scans can be daunting for many people as they usually involve the patient lying inside a tube with the imaging magnet surrounding the body. Additionally, the scan can take up to 40 minutes in some cases. There are some open MRI scanners available that help prevent a feeling of claustrophobia. However, the image produced by open scanners are of lower quality as they operate at lower magnetic fields."
O_IO,"OHIO.    	The city of Louisville, Kentucky was a chartered as a town in 1780 and was named in honor of King Louis XVI of France as French soldiers were aiding Americans in the Revolutionary War that was raging at that time."
A_E,"AVE.    	'Ave' is a Latin word meaning 'hail' as in 'Ave Maria', which translates as 'Hail Mary'. 'Ave' can also be used to mean 'goodbye'."
E_LA,"ELLA.    	Ella Fitzgerald, the ""First Lady of Song"", had a hard and tough upbringing. She was raised by her mother alone in Yonkers, New York. Her mother died while Ella was still a schoolgirl, and subsequently she became less interested in school. She fell in with a bad crowd, even working as a lookout for a bordello and a Mafia numbers runner. She ended up in reform school, from which she escaped, finding herself homeless and living on the streets for a while. Somehow she managed to get herself a spot singing in the Apollo Theater in Harlem. From there her career took off, and as they say, the rest is history."
S_T,"SST.    	The most famous supersonic transport (SST) is the retired Concorde. Concorde was developed and produced under an Anglo-French treaty by France's Aérospatiale and the UK's British Aircraft Corporation (BAC). Concordes were mainly operated by Air France and British Airways, with both companies buying the planes with substantial subsidies from the French and British governments."
_TOE,"OTOE.    	The Otoe (also Oto) Native American tribe originated in the Great Lakes region as part of the Winnebago or Siouan tribes. The group that would become the Otoe broke away from the Winnebago and migrated southwestwards ending up in the Great Plains. In the plains the Otoe adopted a semi-nomadic lifestyle dependent on the horse, with the American bison becoming central to their diet."
