T_TER,"TATER.    	Apparently, a baseball has long been referred to as a potato, or a ""tater"". In the seventies, a long ball started to be called a ""long tater"", and from this a home run became a ""tater""."
_AG,"HAG.    	""Hag"" is a shortened form of the Old English word ""haegtesse"" meaning, ""witch""."
_OTEL,HOTEL.    	The first Radisson hotel opened in 1909 in Minneapolis. The hotel name was chosen in honor of the 17th-century French explorer Pierre-Esprit Radisson.
MIL_,"MILO.    	Milo Minderbinder is the mess officer in Joseph Heller's 1961 novel ""Catch-22"". In the 1970 film adaptation of the book, the Minderbinder character is played by Jon Voight."
_ORELEI,"LORELEI.    	The 1925 novel 'Gentlemen Prefer Blondes' was written by screenwriter and author Anita Loos. 'Gentlemen Prefer Blondes' was originally published as a series of short stories in 'Harper's Bazaar'. The heroine of the story was Lorelei Lee, a 'flapper' who was less interested in marriage than she was in collecting expensive gifts from her many gentleman admirers."
_AP,DAP.    	'To dap' is to skip or bounce across the surface of the water. Dapping is also the name given to the fishing technique of letting a baited hook fall gently onto the water's surface.
PAR_E,"PAREE.    	""Who Said Gay Paree?"" is a song from the Cole Porter musical ""Can-Can""."
O_IES,"OBIES.    	The Obies are the ""Off-Broadway Theater Awards"". The Obies are presented annually and the recipients are chosen by ""The Village Voice"" newspaper."
OC_,OCS.    	Officer Candidate School (OCS)
N_TTI,"NITTI.    	Frank Nitti was one of the top henchmen working for Al Capone. Unlike American-born Capone, Nitti was actually from Italy and was born near the city of Salerno. When Capone was eventually put away for 11 years for tax evasion, Nitti was convicted of the same crime. Nitti was only imprisoned for 18 months, and when released he was labelled as the new head of Capone's Chicago Outfit. However the truth seems to be that he was just a frontman, with others making the decisions."
_HOS,"RHOS.    	Rho is the Greek letter that looks just like our Roman letter ""p""."
TRIAG_,"TRIAGE.    	""Triage"" is the process of prioritizing patients for treatment, especially on a battlefield. The term ""triage"" is French and means ""a sorting""."
_RAM,"ARAM.    	Aram Khachaturian was a Soviet-Armenian composer who created many works that were influenced by Armenian culture. Khachaturian's most famous piece of music is the frenetic ""Saber Dance"" from the ballet ""Gayane"". My favorite composition though is the ""Adagio of Spartacus and Phrygia"". It was used as the theme for a BBC drama called ""The Onedin Line"" and will always evoke for me images of tall ships and vast oceans."
E_LER,"EELER.    	Conger eels can grow to be very, very large, perhaps up to 10 feet in length."
O_AL,ORAL.    	'The Pill' is more correctly called 'the combined oral contraceptive pill'. The formulation is a combination of an estrogen called estradiol and a progestogen called progestin.
CRU_,"CRUZ.    	Victor Cruz plays football for the New York Giants as a wide receiver. Before turning pro, Cruz played for UMass."
DEF_E,"DEFOE.    	In Daniel Defoe's 1719 novel 'Robinson Crusoe', the castaway encounters a companion that Crusoe calls 'Friday', because the two first met on that day. Friday soon becomes his willing servant. This character is the source of our terms 'Man Friday' and 'Girl Friday', which are used to describe a particularly competent and loyal assistant."
O_O,"ODO-.    	An odometer measures distance traveled. The word derives from the Greek ""hodos"" meaning ""path"" and ""metron"" meaning ""measure""."
RA_EGAS,"RARE GAS.    	The rare gases are better known as the noble gases, but neither term is really very accurate. Noble gas might be a better choice though, as they are all relatively nonreactive. But rare they are not. Argon, for example, is a major constituent (1%) of the air that we breathe. The noble gases are the elements on the very right of the periodic table of the elements.."
_AG,"RAG.    	'Grease monkey' is a slang term for a mechanic, a term we've been using since the late twenties."
TH_,"THY.    	The Lord's Prayer is a central prayer in Christian religions, and is found in two places in the New Testament. In the version in the Gospel of Matthew the last line of the prayer is ""deliver from evil"". In the Gospel of Luke the last line is ""lead us not into temptation"". The last words of the prayer as it most often said today are:"
ZA_RE,"ZAIRE.    	The African nation once called Zaire is a neighbor of Rwanda. The genocide and war in Rwanda spilled over into Zaire in 1996, with the conflict escalating into what is now called the First Congo War. As part of the war's fallout there was a regime change, and in 1997 Zaire became the Democratic Republic of Congo."
E_K,"ECK.    	During the Protestant Reformation in the 16th and 17th centuries, as Martin Luther was attacking the policies of the Catholic Church, Johann Eck was one of the leading defenders of Catholicism. The two had public debates, with Luther generally coming out ahead."
V_N,"VON.    	Diane von Fürstenberg (DVF) is a fashion designer from Brussels, now based in the US. Born Diane Halfin, she was Princess Diane of Fürstenberg from 1969 until 1972 while married to Prince Egon of Fürstenberg."
ALV_,"ALVA.    	Thomas Alva Edison was nicknamed ""The Wizard of Menlo Park"" by a newspaper reporter, a name that stuck. He was indeed a wizard, in the sense that he was such a prolific inventor. The Menlo Park part of the moniker recognizes the location of his first research lab, in Menlo Park, New Jersey."
T_TI,"TATI.    	Jacques Tati was a very famous filmmaker in France. ""Mon Oncle"" is an Oscar-winning film that Tati released in 1958."
A_WT,"AT WT.    	The atomic weight (at. wt.) of an element is the mass of one atom of the element, relative to the mass of an atom of carbon (which is assumed to have an atomic weight of 12)."
U_S,"UPS.    	United Parcel Service (UPS) is based in Sandy Springs, Georgia and has its own airline that operates out of Louisville, Kentucky."
ROGE_,"ROGER.    	The term 'roger', meaning 'yes' or 'acknowledged', comes from the world of radiotelephony. The British military used a phonetic alphabet in the fifties that included ""Roger"" to represent the letter 'R'. As such, it became customary to say 'Roger' when acknowledging a message, with R (Roger) standing for 'received'."
ALC_A,"ALCOA.    	The Aluminum Corporation of America (ALCOA) is the largest producer of aluminum in the United States. The company was founded in 1888 in Pittsburgh, Pennsylvania where its headquarters are to this day."
ANNE_,"ANNE'S.    	Auntie Anne's is a chain of pretzel bakeries that was founded in 1988. The chain started out as a simple stand in a farmer's market in Downingtown, Pennsylvania. There are now almost 900 outlets in about a dozen countries."
_AG,"RAG.    	""Tabloid"" is the trademarked name (owned by Burroughs, Wellcome and Co,) for a ""small tablet of medicine"", a name that goes back to 1884. The word ""tabloid"" had entered into general use to mean a compressed form of anything, and by the early 1900s was used in ""tabloid journalism"", applied to newspapers that had short, condensed articles and stories printed on smaller sheets of paper."
EFIL_,"E-FILE.    	E-file: that's what I'll be doing with my tax return in a week or so, I hope ..."
TAT_R,"TATER.    	Ore-Ida's founders came up with the idea for Tater Tots when they were deciding what to do with residual cuts of potato. They chopped up the leftovers, added flour and seasoning, and extruded the mix through a large hole making a sausage that they cut into small cylinders. We eat 70 million pounds of this extruded potato every year!"
_LANC,"BLANC.    	In French, most 'lait et riz' (milk and rice) is 'blanc' (white)."
T_SON,TYSON.    	The boxer Mike Tyson has said some pretty graphic things about his opponents. For example:
HA_DEL,"HANDEL.    	George Frideric Handel was the King of the Oratorio. Handel's most famous oratorio is ""Messiah"", which had its debut performance in Dublin, Ireland back in 1742."
RU_H,"RUTH.    	Baseball legend George Herman Ruth, Jr. had several nicknames, the best known being 'Babe'. He was also called 'the Bambino' and 'the Sultan of Swat'."
ANKAR_,"ANKARA.    	Ankara is the second largest city in Turkey, after Istanbul (formerly Constantinople). After WWI, the Ottoman Empire had been defeated and the Allies occupied the Ottoman capital of Istanbul. The victors planned to break up most of Turkey, leaving native Turks just part of their country for their own. In the inevitable War of Independence that followed, the Turkish Nationalists used Ankara as their base. When the Nationalists emerged victorious, they declared Ankara the new capital of Turkey."
S_AM,"SHAM.    	A 'sham' is something that is imitation, fake. In the world of bed linens a sham is also imitation and fake, in the sense that it is a decorative cover designed to cover up a regular pillow used for sleeping."
I_S,ISS.    	Issue (Iss.)
_IT,"LIT.    	The word ""souse"" dates back to the 14th century and means ""to pickle, steep in vinegar"". In the early 1600s the usage was applied to someone ""pickled"" in booze, a drunkard."
UN_,"UNC.    	The University of North Carolina (UNC) at Chapel Hill started enrolling students way back in 1795, making it the oldest public university in the country (the first to enrol students)."
_UIS,"LUIS.    	Luis Suárez is soccer player on the Barcelona football team, as well as the Uruguay national team. As well as having a reputation as great soccer striker, Suárez is known for biting at least three of his opponents on the field (believe it or not!)."
VE_T,"VEST.    	Here's another word that often catches me out. What we call a 'vest' in the US is a waistcoat back in Ireland. And the Irish use the word ""vest"" for an undershirt."
NINE_,"NINES.    	There's an urban myth that the standard number of holes on a golf course is 18 because it takes 18 shots to polish off a fifth of scotch whisky. However, the truth is that the standard number of holes in the Old Course at St. Andrews in Scotland happened to settle down over time at 18, and that standard was adopted all around the world."
PA_,"PAD.    	Back in the 16th century a ""pad"" was a bundle of straw to lie on, and came to mean a ""sleeping place"" in the early 1700s. The term was revitalized in the hippie era."
_ECH,"TECH.    	The Santa Clara Valley, just a few miles from me at the south of San Francisco Bay, is better known as ""Silicon Valley"". The term ""Silicon Valley"" dates back to 1971 when it was apparently first used in a weekly trade newspaper called ""Electronic News"" in articles written by journalist Don Hoefler."
_OT,"BOT.    	Alan Turing created the Turing test in 1950 as a way of checking a machine's ability to exhibit intelligent behavior indistinguishable from a human. The essence of the test is an evaluation of a text conversation between machine and human. The evaluation is carried out by someone who only knows that one of the conversants is a machine, but not which one is which."
_HOU,"THOU.    	'G', 'G-note' and 'thou' are slang terms used for a thousand dollars."
E_ALII,"ET ALII.    	Et alii (et al.) is the equivalent of et cetera (etc.), with et cetera being used in place of a list of objects, and et alii used for a list of names. In fact ""et al."" can stand for et alii (for a group of males, or males and females), aliae (for a group of women) and et alia (for a group of neuter nouns, or for a group of people where the intent is to retain gender-neutrality)."
PISA_,"PISAN.    	Galileo Galilei may be the most famous son of the city of Pisa in Italy and was considered by many to have been the father of modern science. In the world of physics, Galileo postulated that objects of different masses would fall at the same rate provided they did so in a vacuum (so there was no air resistance). There is a story that he dropped two balls of different masses from the top of the Leaning Tower of Pisa to demonstrate this, but this probably never happened. Centuries later, Astronaut David Scott performed Galileo's proposed experiment when he dropped a hammer and feather on the moon during the Apollo 15 mission and we all saw the objects hit the moon surface, at exactly the same time."
_VEL,"EVEL.    	Daredevil Evel Knievel contracted hepatitis C from the many blood transfusions that he needed after injuries incurred during stunts. He had to have a liver transplant as a result, but his health declined after that. He eventually passed away in 2007."
_RI,"CRI.    	The French phrase ""dernier cri"" translates literally as ""the latest cry or scream"", but is used to denote the latest fashion."
SAL_,"SALA.    	A room (sala) is a division (división) of a house (casa), in Spanish."
ROI_,"ROIS.    	In French, a king and queen (roi et reine) are members of the nobility (noblesse)."
P_TS,"PATS.    	The New England Patriots football team was founded in 1959 as the Boston Patriots. The 'Patriots' name was selected from suggestions made by football fans in Boston. The team played at several different stadiums in the Boston area for just over ten years, before moving to their current home base in Foxborough, Massachusetts. At the time of the move, the 'Boston' name was dropped and changed to 'New England'."
E_LIS,"ELLIS.    	Bret Easton Ellis wrote a trio of novels that were made into very successful movies: ""Less Than Zero"" (1987, starring Andrew McCarthy), ""American Psycho"" (2000, starring Christian Bale) and ""The Rules of Attraction"" (2002, starring James van der Beek)."
TR_M,"TRAM.    	Walt Disney came up with the idea of building Disneyland after visiting other theme parks with his daughters in the thirties and forties. He started building the park at Anaheim, California in 1954, and the facility opened just one year and one day later. The total cost of construction was $17 million. Opening day did not go smoothly, largely because over 28,000 people visited the park compared to the 11,000 people expected at the invitation-only event. The opening day went so badly that for years Disney executives referred to it as 'Black Sunday'."
E_ISON,"EDISON.    	Edison has a patent for a ""Speaking Machine"", which was actually the first phonograph. He demonstrated the viability of the device in 1878. Its key components were a stylus that picked up ""sound"" from a rotating, phonograph cylinder."
_ERDS,"NERDS.    	The Willy Wonka Candy Company brand is owned by Nestle, and operates using licensed materials from the Roald Dahl book ""Charlie & the Chocolate Factory"". Nerdsis a name on a whole line of candy's produced within the brand's portfolio."
IM_,"I ME.    	'""I Me Wed"" is a 2007 TV movie, a romantic comedy starring Isabel Arden who decides to actually marry herself!"
MORE_,"MOREL.    	The morel is that genus of mushroom with the honeycomb-like structure on the cap. They're highly prized, especially in French cuisine. Morels should never be eaten raw as they are toxic, with the toxins being removed by thorough cooking."
_YD,"CYD.    	Actress Cyd Charisse was famous for her dancing ability and the many roles she played opposite Fred Astaire and Gene Kelly. Charisse carved out a career based on dance despite the fact that she suffered from polio as a child. In fact, she took up ballet at the age of twelve to help build up her strength as she recovered from the disease."
ISA_AH,"ISAIAH.    	The Book of Isaiah is part of the Hebrew Bible and the Christian Old Testament. Isaiah is not mentioned in the Qur'an, but many Muslim scholars consider Isaiah a prophet. Isaiah is widely regarded as the most eloquent of the prophets, earning him the moniker 'Shakespeare of the Prophets'."
DA_,"DAP.    	The dap is a form of handshake, nowadays often a complicated and showy routine of fist-bumps, slaps and shakes. Some say that ""dap"" is an acronym standing for ""Dignity And Pride""."
_OY,"TOY.    	Although hoops have been used as toys throughout history, the 'hula hoop' was invented in 1958 by Richard Knerr and Arthur Melin, and marketed by Wham-O."
L_RVA,"LARVA.    	The larva is an intermediate stage in the development of an insect. All four stages are embryo, larva, pupa and imago."
UR_,"URU.    	The official name of Uruguay is the Oriental Republic of Uruguay, reflecting the nation's location on the eastern coast of South America. It is a relatively small country, the second-smallest on the continent, after Suriname. In 2009, Uruguay became the first country in the world to provide a free laptop and Internet access to every child. Now there's a thought ..."
ORS_NO,"ORSINO.    	Viola is the main character in Shakespeare's ""Twelfth Night"". Viola is shipwrecked at the beginning of the play in a land ruled by the Duke Orsino. Viola disguises herself as a boy and works for Orsino as a page, and complications ensue ..."
D_P,DIP.    	'Salsa' is simply the Spanish for 'sauce'.
CE_LO,"CELLO.    	Pablo Casals was a wonderful cellist, from Catalonia in Spain. He lived at the time of the Franco regime in Spain, and as a supporter of the Spanish Republican Government he placed himself in self-imposed exile in 1938, vowing not to return home until democracy had been restored. He never again set foot on Spanish soil, and died in Puerto Rico in 1973."
_ID,"AID.    	Band-Aid' is a brand name owned by Johnson & Johnson, although like many popular brands 'band-aid' has become the generic term for an adhesive bandage, at least here in North America. The generic term we use in the British Isles for the same product is 'plaster' ..."
AL_A,"ALVA.    	Thomas Alva Edison (TAE) was nicknamed 'The Wizard of Menlo Park' by a newspaper reporter, a name that stuck. He was indeed a wizard, in the sense that he was such a prolific inventor. The Menlo Park part of the moniker recognizes the location of his first research lab, in Menlo Park, New Jersey."
_GB,KGB.    	The Komitet gosudarstvennoy bezopasnosti (KGB) was the national security agency of the Soviet Union until 1991. The KGB was dissolved after the agency's chairman led a failed attempt at a coup d'état designed to depose President Mikhail Gorbachev.
D_AN,"DEAN.    	Our use of 'dean' to describe an administrative officer in an educational institution dates back to the 1570s. The term comes via the Old French 'deien' from the Latin 'decanus', which was the name for the head of a group of ten monks in a monastery, and earlier still, the name for the commander of ten soldiers. So ultimately, 'dean' comes from the Greek 'deka' meaning 'ten'."
_LAM,"ELAM.    	The ancient civilization of Elam was located east of Mesopotamia, in what is modern-day southwest Iran."
_EER,"JEER.    	Not so much here in America, but over in the British Isles ""blowing a raspberry"" is a way of insulting someone (I think it's called ""a Bronx cheer"" in the US). The verb ""to razz"" comes from a shortened form of ""raspberry""."
TH_,"THY.    	The Lord's Prayer is a central prayer in Christian religions, and is found in two places in the New Testament. In the version in the Gospel of Matthew the last line of the prayer is ""deliver from evil"". In the Gospel of Luke the last line is ""lead us not into temptation"". The last words of the prayer as it most often said today are:"
RAV_,"RAVE.    	As you might imagine, I've never been to a rave, and don't have one upcoming in my diary. And as raves often start at 2 a.m. then I'm unlikely ever to experience one. A rave is generally an all-night party featuring loud, electronically-synthesized music usually played by a DJ as opposed to a live band."
_DON,UDON.    	Udon noodles are made from wheat flour and are very popular in Japanese cuisine like tempura.
I_E,"IN E.    	""Caro nome"" ('Dearest name') is an aria from Verdi's opera ""Rigoletto""."
KEA_U,"KEANU.    	Keanu Reeves is a Canadian actor whose most celebrated roles were a metalhead in ""Bill & Ted's Excellent Adventure"" (1989), a cop in ""Speed"" (1994) and the protagonist Neo in ""The Matrix"" series of films. Although Reeves is a Canadian national, he was born in Beirut, Lebanon. Reeves has some Hawaiian descent, and the name ""Keanu"" is Hawaiian for ""the coldness""."
BO_,"BOL.    	Historically, from the Middle Ages, the main source of tin in the world was the mines of Cornwall in the south of England. This changed in the 1800s with the discovery of the ""tin belt"" in Bolivia. Today Bolivia is the fourth largest miner and producer of tin in the world, after Indonesia, China and Peru. There hasn't been any mining of any metals in Cornwall since 2007."
TOBE_,"TOBEY.    	The actor Tobey Maguire is most associated with the role of Spider-Man these days. I'm not much into comic book hero films, but I do kind of enjoy the understated way that Maguire takes on 'Spidey'. Maguire has appeared in other hit films, like 'Pleasantville' (1998), 'The Cider House Rules' (1999) and 'Seabiscuit' (2003). Off the screen, he is big into poker and it's said that he has won over $10 million playing poker in Hollywood."
ABE_M,"ABEAM.    	The beam is the widest part of a vessel, and something pointed out as lying abeam is something that it is 90 degrees from a line through the bow and the stern, in other words, off to the right or the left."
TR_T,"TROT.    	Our use of the word 'derby' to mean a race started in 1780 with the English Derby horse race, which was founded then by the 12th Earl of Derby. Ultimately, the term 'derby' derives from the old English shire of 'Deorby', a word meaning 'deer village'."
E_ES,"ERES.    	We have a big event across Europe every year called the Eurovision Song Contest. Each nation enters one song in competition with each other, and then voters across the whole continent decide on the winner. That's how ABBA got their big break when they won in 1974 with ""Waterloo"". In 1972, Spain's entry was ""Eres tu"" (the Spanish for ""You Are"") sung by the band Mocedades. ""Eres tu"" came second in the competition, but should have won in my humble opinion."
EASTMA_,"EASTMAN.    	George Eastman founded the Eastman Kodak Company, named after the Kodak camera that he had invented four years earlier. He came up with the name of Kodak after careful consideration. Firstly he was a big fan of the letter ""K"", calling is ""string, incisive"". He also wanted a word that short, easy to pronounce and difficult to mispronounce, and a word that was clearly unique with no prior associations. Kodak fit the bill for Eastman."
UPT_N,"UPTON.    	Upton Sinclair was a prolific American author, with almost 100 books to his name. Sinclair's most famous work is probably 'The Jungle', a 1906 novel about the meat packing industry. Revelations in ""The Jungle"" contributed to the Meat Inspection Act being passed by Congress a few months after the book was published. Sinclair also wrote 'Oil', published in 1927, which was the basis of the 2007 film 'There Will Be Blood' that stars Daniel Day-Lewis."
IP_S,"IPOS.    	An Initial Public Offering (IPO) is the very first offer of stock for sale by a company on the open market. In other words, an IPO marks the first time that a company is traded on a public exchange. Companies have an IPO to raise capital to expand (usually)."
_ARTH,"EARTH.    	Google Earth is a program that maps the Earth by superimposing satellite images and aerial photographs. Google acquired the technology when it purchased Keyhole, Inc in 2004. Keyhole had been partially funded by the CIA."
ATES_,"A-TEST.    	The testing of US nuclear weapons by the US at Bikini Atoll in the middle of 1946 went by the codename ""Operation Crossroads"". The tests used A-bombs and were designed to measure the effect of blasts on navy vessels. There were three tests planned, but the third had to be cancelled as the Navy couldn't decontaminate the ships used in the second test."
ORA_LE,"ORACLE.    	In Ancient Greece and Rome, an oracle was someone believed inspired by the gods to give wise counsel. The word ""oracle"" derives from the Latin ""orare"" meaning ""to speak"", which is the same root for our word ""orator""."
P_CE,"PACE.    	The marathon is run over 26 miles and 385 yards, and of course commemorates the legendary messenger-run by Pheidippides from the site of the Battle of Marathon back to Athens. The actual distance run today was decided in 1921, and matches the length of the modern-day Marathon-Athens highway."
P_OM,PROM.    	I guess the prom king and prom queen make up the royal court.
_IMI,"JIMI.    	Many of his contemporaries regarded Jimi Hendrix as the greatest electric guitarist in the history of rock music. Hendrix was from Seattle and didn't really have a really stellar start to his working life. He failed to finish high school and fell foul of the law by getting caught in stolen cars, twice. The courts gave him the option of the army or two years in prison. Hendrix chose the former and soon found himself in the famous 101st Airborne. In the army, his less-than-disciplined ways helped him (as he would have seen it) because his superiors successfully petitioned to get him discharged after serving only one year of his two-year requirement, just to get him out of their hair."
GI_A,GINA.    	Gina Gershon is an American actress. Gershon has played a lesbian on screen a number of times and has become somewhat of a gay icon.
_ASE,"LASE.    	The term 'laser' comes is an acronym, 'Light Amplification by Stimulated Emission of Radiation' (LASER). It has been pointed out that a more precise name for laser technology is 'Light Oscillation by Stimulated Emission of Radiation', but the resulting acronym isn't quite so appealing, namely LOSER ..."
