"""Honest"" president.   		3 letters","ABE.    	Abraham Lincoln was born in a one-room log cabin in Hardin County, Kentucky making him the first president born in the West. His formal education was limited to a year and a half of schooling, but fortunately for us, Lincoln was an avid reader and educated himself over the years. Even though he was from a rural area, he avoided hunting and fishing because he did not like to kill animals even for food."
"""Exodus"" hero ___ Ben Canaan.   		3 letters","ARI.    	""Exodus"" is a wonderful novel written by American writer Leon Uris, first published in 1947. The hero of the piece is Ari Ben Canaan, played by Paul Newman in the 1960 film adaptation directed by Otto Preminger."
Sporting weapon.   		4 letters,"EPEE.    	The épée that is used in today's sport fencing is derived from the old French dueling sword. In fact, the the sport of épée fencing is very similar to the dualing of the 19th century. The word 'épée' translates from French as 'sword'."
Porter's cousin.   		3 letters,"ALE.    	Porter is a dark beer that originated in London in the 1700s and is named for the street and river porters with whom it was very popular. Porter is a well-hopped beer made using brown malt, which gives it the dark color."
Maiden name preceder.   		3 letters,"NEE.    	""Née"" is the French word for ""born"" when referring to a female. The male equivalent is ""né""."
Musician Yoko.   		3 letters,"ONO.    	Yoko Ono was born into a prosperous Japanese family, and is actually a descendant of one of the emperors of Japan. Her father moved around the world for work, and she lived the first few years of her life in San Francisco. The family returned to Japan, before moving on to New York, Hanoi and back to Japan just before WWII, in time to live through the great fire-bombing of Tokyo in 1945. Immediately after the war the family was far from prosperous. While Yoko's father was being held in a prison camp in Vietnam, her mother had to resort to begging and bartering to feed her children. When her father was repatriated, life started to return to normal and Yoko was able to attend university. She was the first woman to be accepted into the philosophy program of Gakushuin University."
Means of changing one's mind.   		3 letters,"LSD.    	LSD (colloquially known as 'acid') is short for lysergic acid diethylamide. A Swiss chemist called Albert Hofmann first synthesized LSD in 1938 in a research project looking for medically efficacious ergot alkaloids. It wasn't until some five years later when Hofmann ingested some of the drug accidentally that its psychedelic properties were discovered. Trippy, man ..."
Santa ___.   		3 letters,"ANA.    	Santa Ana is the county seat of Orange County, California and takes its name from the Santa Ana River that runs through the city. The Santa Ana winds are the very dry air currents that sweep offshore late in the year in Southern California. Because these air currents are so dry, they are noted for their influence over forest fires in the area, especially in the heat of the fall. The winds arise from a buildup of air pressure in the Great Basin that lies between the Rocky Mountains and the Sierra Nevada. Under the right conditions, that air spills over the peaks of the Sierra Nevada and basically ""falls"" down the side of the Sierra range, heading for the ocean. As the air falls it becomes drier and heats up, so that relative humidity can fall to below 10% by the time it hits the coast."
Legal borders?.   		3 letters,ELS.    	The 'borders' of the word 'legal' (the outside letters) are letters L (els).
High rollers.   		3 letters,ELS.    	Elevated railroad (el)
Sport with automated scoring.   		4 letters,"EPEE.    	The French word for sword is ""épée"". In competitive fencing the épée is connected to a system that records an electrical signal when legal contact is made on an opponent's body."
Atlanta-based cable inits.   		3 letters,"TNT.    	TNT stands for Turner Network Television. It made a big splash in the eighties when it started to broadcast old MGM movies that had been ""colorized"", not something that was a big hit with the public. In recent years, the TNT programming lineup is governed by the tag-line ""We Know Drama"", and includes shows like ""Judging Amy"", ""ER"" and ""Cold Case""."
"It may be represented by ""XXX"" in the funnies.   		3 letters","ALE.    	In a comic strip, a bottle of beer often has a label marked 'XXX'."
New England's Cape ___.   		3 letters,"ANN.    	Cape Ann is 30 miles north of Boston, and is the northernmost edge of Massachusetts Bay. The Cape was first mapped by the explorer John Smith. Early in his adventurous life Smith had been captured and enslaved by the Ottoman Empire. His ""owner"" in his days of slavery was a woman called Tragabigzanda, and apparently the slave and owner fell in love. What we know today as Cape Ann, Smith originally called Cape Tragabigzanda, in memory of the woman."
"Menotti's ""Lullaby,"" for one.   		4 letters","ARIA.    	""The Consul"" is an opera by Gian Carlo Menotti. The ""Lullaby"" from Act II of ""The Consul"" is one of the highlights of the work, an emotional and moving interlude. ""The Consul"" earned Menotti the Pulitzer Prize in Music in 1950."
Burgundy season.   		3 letters,"ETE.    	In French, the season of 'été' (summer) starts in 'juin' (June)."
Neon frame?.   		3 letters,"ENS.    	The letter N can be found at either end of 'neon', framing the word."
Summer Olympics event.   		4 letters,"EPEE.    	The épée that is used in today's sport fencing is derived from the old French dueling sword. In fact, the the sport of épée fencing is very similar to the dualing of the 19th century. The word 'épée' translates from French as 'sword'."
California's Santa ___ River.   		3 letters,ANA.    	The Santa Ana River rises in the San Bernardino Mountains and empties into the Pacific Ocean 96 miles downstream. The Santa Ana is the largest river in Southern California.
"Drug ingested in ""Easy Rider"".   		3 letters","LSD.    	""Easy Rider"" is a 1969 movie about two bikers traversing the American Southwest and the South. The bikers are famously played by Peter Fonda and Dennis Hopper, who also co-wrote the screenplay. Fonda produced the film and Hopper directed."
Tour de France season.   		3 letters,ETE.    	One might spend the summer (été) under the sun (le soleil) in Paris.
Cause of a trip.   		3 letters,"LSD.    	LSD (colloquially known as 'acid') is short for lysergic acid diethylamide. A Swiss chemist called Albert Hofmann first synthesized LSD in 1938 in a research project looking for medically efficacious ergot alkaloids. It wasn't until some five years later when Hofmann ingested some of the drug accidentally that its psychedelic properties were discovered. Trippy, man ..."
Ginger ___ (soft drink).   		3 letters,"ALE.    	The brand most closely associated with ginger ale is Canada Dry. ""Canada Dry Pale Ginger Ale"" was first formulated in 1904 by a Canadian chemist called John McLoughlin from Ontario. Prohibition in the United States helped sales of the drink as it was particularly effective in masking the taste of illegally-produced homemade liquor."
Olympic archer.   		4 letters,"EROS.    	As always seem to be the case, the Greek gods Eros and Aphrodite have overlapping spheres of influence. Aphrodite was the goddess of love between a man and a woman, but Eros was the god who stirred the passions of the male."
Juillet et août.   		3 letters,"ETE.    	'Août' is the French for August, and 'juillet' is French for July (note that the name of months aren't capitalized in French). Both are months in the season of 'été' (summer)."
Season after printemps.   		3 letters,"ETE.    	In French, spring (printemps) is followed by summer (été)."
"Sketch show that launched 40-Across's career, in short.   		3 letters","SNL.    	NBC first aired a form of ""Saturday Night Live"" in 1975, under the title ""NBC's Saturday Night"". The show was actually created to give Johnny Carson some time off from ""The Tonight Show"". Back then ""The Tonight Show"" had a weekend episode, and Carson convinced NBC to pull the Saturday or Sunday recordings off the air and hold them for subsequent weeknights in which Carson needed a break. NBC turned to Lorne Michaels and asked him to pull together a variety show to fill the vacant slot, and he came up with what we now call ""Saturday Night Live""."
Mrs.   		3 letters,"ANN.    	Ann Davies knew Mitt Romney way back in elementary school, and the pair started dating when Ann was 16 and were married in 1968 when she was 19 years old. Ann Romney was diagnosed with multiple sclerosis in 1998, and she has been very active with the National Multiple Sclerosis Society."
"Dvorák's ""O Silver Moon,"" for one.   		4 letters","ARIA.    	'O Silver Moon' is an aria from 'Rusalka'. 'Rusalka' is an opera by Czech composer Antonín Dvořák. In Slavic mythology, a 'Rusalka' is a water sprite."
Arctic explorer John.   		3 letters,"RAE.    	John Rae was a Scottish explorer, who took on the task of searching for the ill-fated Franklin Expedition of 1845. The Franklin Expedition was itself searching for the elusive Northwest Passage through the Arctic Ocean connecting the Atlantic to the Pacific. John Rae created much controversy back in England when he reported evidence of cannibalism among the ill-fated Franklin explorers."
"Telesthesia, for example.   		3 letters",ESP.    	Telesthesia is a type of extrasensory perception (ESP) that operates over long distances. Someone who is purported to have such a gift has a sensibility to sights an sounds that beyond the range of the sense organs.
February 14th figure.   		4 letters,"EROS.    	Saint Valentine's Day was introduced by Pope Gelasius I in 496 AD to honor various martyrs with the name Valentine. However, the saint's' day was dropped by the Roman Catholic church in 1969, by Pope Paul VI. Try telling that to Hallmark though ..."
Genesis place.   		4 letters,"EDEN.    	According to the Book of Genesis, Adam and Eve lived in a garden ""in"" Eden, with Eden being geographically located by reference to four rivers including the Tigris and the Euphrates. Some scholars hypothesize that Eden was located in Mesopotamia, which encompasses much of modern-day Iraq."
See 11-Down.   		3 letters,SNL.    	'Saturday Night Live' (SNL)
Buster of rock.   		3 letters,TNT.    	TNT might be used bust (blow up) rock.
"Cardinals' home, on scoreboards.   		3 letters","ARI.    	The Arizona Cardinals were founded in 1898 as the Chicago Cardinals. That makes the Cardinals the oldest, continuously-run professional football team in the whole country."
Yoko who married John.   		3 letters,"ONO.    	John Lennon and Yoko Ono had a very public honeymoon in a hotels in Amsterdam and then Montreal, when they staged their famous ""bed-in"" for peace. In answering questions from reporters Lennon found himself often repeating the words ""give peace a chance"". While still in bed, he composed his famous song ""Give Peace a Chance"" and even made the original recording of the song in the Montreal hotel room, with reporters present, and with a whole bunch of friends. The song was released later in 1969 and became a smash hit."
Thrilla in Manila winner.   		3 letters,"ALI.    	Cassius Marcellus Clay, Jr. was born in 1942 in Louisville, Kentucky, changing his name to Muhammad Ali when he converted to Islam in 1964. Who can forget Muhammad Ali lighting the Olympic flame for the 1996 games in Atlanta? Ali was presented with a gold medal during those '96 Games, a replacement for the medal he won at the 1960 Olympics. He had thrown the original into the Ohio River as a gesture of disgust after being refused service at a ""whites only"" restaurant."
Org.   		3 letters,"NRA.    	The Eddie Eagle program was introduced by the National Rifle Association and is designed to train children to avoid causing harm if they encounter a firearm. The basic mantra of the program is 'Stop, don't touch, run away, tell a grown-up'."
When Paris is burning?.   		3 letters,"ETE.    	Ete is French word for the season of ""summer"". The reference here to Paris burning is a play on the title of a successful 1990 documentary film called ""Paris is Burning"", a film about the gay and trans-gender Ball Competitions of New York city."
Loop transports.   		3 letters,"ELS.    	The Chicago ""L"" is the second largest rapid transit system in the US, with the New York City Subway being the largest. The ""L"" is also the second oldest, again with the New York Subway system having the honor of being around the longest. Note that the official nickname for the system is the ""L"" (originally short for ""elevated railroad""), although the term ""El"" is also in common use (especially in crosswords as ""ELS""). The L is managed by the Chicago Transit Authority (CTA)."
Santa ___.   		3 letters,"ANA.    	Santa Ana is the county seat of Orange County, California and takes its name from the Santa Ana River that runs through the city."
Movie heroine Norma ___ Webster.   		3 letters,"RAE.    	""Norma Rae"" is a 1979 movie starring Sally Field as Norma Rae Webster in a tale of union activities in a textile factory in Alabama. The film is based on the true story of Crystal Lee Sutton told in a 1975 book called ""Crystal Lee, a Woman of Inheritance""."
Winged figure of myth.   		4 letters,"EROS.    	Eros was the Greek god of love, the Greek counterpart of the Roman god Cupid."
1813's Battle of Lake ___.   		4 letters,ERIE.    	The Battle of Lake Erie was fought during the War of 1812 just off the Ohio coast. The outcome of the action was a defeat for the British and control of Lake Erie for the remainder of the war.
Name-dropper's word?.   		3 letters,"NEE.    	""Née"" is the French word for ""born"" when referring to a female. The male equivalent is ""né""."
"Green monitor, for short?.   		3 letters",EPA.    	Environmental Protection Agency (EPA)
Place of bliss.   		4 letters,"EDEN.    	According to the Book Of Genesis, Adam and Eve lived in a garden ""in"" Eden, with Eden being geographically located by reference to four rivers, including the Tigris and the Euphrates. Some scholars hypothesize that Eden was located in Mesopotamia, which encompasses much of modern-day Iraq."
New York State's ___ Canal.   		4 letters,"ERIE.    	The Erie Canal runs from Albany to Buffalo in the state of New York. What the canal does is allow shipping to proceed from New York Harbor right up the Hudson River, through the canal, and into the Great Lakes. When it was opened in 1825 the Erie Canal had immediate impact on the economy of New York City and locations along its route. It was the first means of ""cheap"" transportation from a port on the Atlantic seaboard into the interior of the United States. Arguably it was the most important factor contributing to the growth of New York City over competing ports such as Baltimore and Philadelphia. It was largely because of the Erie Canal that New York became such an economic powerhouse, earning it the nickname of the Empire State."
"NBC offering, briefly.   		3 letters","SNL.    	NBC first aired a form of ""Saturday Night Live"" (SNL) in 1975 under the title ""NBC's Saturday Night"". The show was actually created to give Johnny Carson some time off from ""The Tonight Show"". Back then ""The Tonight Show"" had a weekend episode, and Carson convinced NBC to pull the Saturday or Sunday recordings off the air and hold them for subsequent weeknights in which Carson needed a break. NBC turned to Lorne Michaels and asked him to put together a variety show to fill the vacant slot, and he came up with what we now call ""Saturday Night Live""."
"""That Night in ___"" (1941 film).   		3 letters","RIO.    	'That Night in Rio' is a 1941 musical comedy starring Alice Faye, Carmen Miranda and Don Ameche."
Abbr.   		3 letters,STE.    	Suite (ste.)
Transfer ___.   		3 letters,"RNA.    	Ribonucleic Acid (RNA) is an essential catalyst in the manufacture of proteins in the body. The genetic code in DNA determines the sequence of amino acids that make up each protein. That sequence is read in DNA by messenger RNA, and amino acids are delivered for protein manufacture in the correct sequence by what is called transfer RNA. The amino acids are then formed into proteins by ribosomal RNA."
Ostrich's cousin.   		3 letters,"EMU.    	The emu has had a tough time in Australia since man settled there. There was even an ""Emu War"" in Western Australia in 1932 when migrating emus competed with livestock for water and food. Soldiers were sent in and used machine guns in an unsuccessful attempt to drive off the ""invading force"". The emus were clever, breaking their usual formation and adopting guerrilla tactics, operating as smaller units. After 50 days of ""war"", the military withdrew. Subsequent requests by farmers for military help were ignored. The emus had emerged victorious ..."
HBO's ___ G.   		3 letters,"ALI.    	Ali G is a fictional character created by British comedian Sacha Baron Cohen. Baron Cohen achieved international fame playing another of his personae, Borat, the protagonist in the 2006 movie ""Borat: Cultural Learnings of America for Make Benefit Glorious Nation of Kazakhstan""."
"Golfer nicknamed ""The Big Easy"".   		3 letters","ELS.    	Ernie Els is a South African golfer. Els a big guy but he has an easy fluid golf swing that has earned him the nickname ""The Big Easy"". He is a former World No. 1 and won four majors: the US Open (1994 & 1997) and the British Open (2002 & 2012)."
Mackerel variety on Hawaiian menus.   		3 letters,ONO.    	Ono is the name given in Hawaii to the fish better known as the wahoo.
Love god.   		4 letters,"EROS.    	Eros, the Greek god of love, was also known as Amor."
Born as.   		3 letters,"NEE.    	""Née"" is the French word for ""born"", when referring to a female. The male equivalent is ""né""."
___ Accords.   		4 letters,"OSLO.    	The Oslo Accords grew out of secret negotiations between the Palestinian Liberation Organization (PLO) and Israel in a residence in Oslo in the early nineties. The delegates shared the same house while they conducted 14 meetings. While eating all their meals together at the same table, the negotiators came to respect one another and apparently friendships developed."
Freud's libido.   		4 letters,"EROS.    	Libido is a term first popularized by Sigmund Freud. His usage was more general than is understood today, as he used libido to describe all instinctive energy that arose in the subconscious. Freud believed that we humans are driven by two desires, the desire for life (the libido, or Eros) and the desire for death (Thanatos). Personally, I don't think so ..."
Bath suds?.   		3 letters,ALE.    	Suds (beer) in Bath (a city in England) might be ale.
"Composer who co-created ""Oblique Strategies"".   		3 letters","ENO.    	The musician Brian Eno co-created 'Oblique Strategies' in 1975. We're not talking about a musical album here, but rather a deck of printed cards. Each card contains a cryptic remark that is designed to encourage lateral thinking, the idea being to break a creative block. Examples of phrases on the cards are:"
Singer Yoko.   		3 letters,"ONO.    	Yoko Ono was born into a prosperous Japanese family, and is actually a descendant of one of the Emperors of Japan. Her father moved around the world for work, so she lived the first few years of her life in San Francisco. The family returned to Japan, then moved onto New York, Hanoi and back to Japan just before WWII. Yoko was living in Tokyo at the time of the great fire-bombing of 1945. Immediately after the war, the family was far from prosperous. While her father was being held in a concentration camp in Vietnam, Yoko's mother had to resort to begging and bartering to feed her children. But, when her father returned, life started to return to normal. Yoko was able to attend university, the first woman to be accepted into the philosophy program of Gakushuin Univeristy."
Las Vegas casino opened in 2009.   		4 letters,ARIA.    	Aria is one of the newer casinos on the Las Vegas Strip. 'Popular Mechanics' magazine described Aria as 'the most technologically-advanced hotel ever built'.
Subj.   		3 letters,ETA.    	Estimated time of arrival (ETA)
Hellenic character.   		3 letters,"ETA.    	Eta is the seventh letter of the Greek (Hellenic) alphabet, and is a forerunner of our Latin character ""H""."
"Projection in the air, for short.   		3 letters",ETA.    	Expected time of arrival (ETA)
Wile E.   		3 letters,"TNT.    	TNT is an abbreviation for trinitrotoluene. Trinitrotoluene was first produced in 1863 by the German chemist Joseph Wilbrand, who developed it for use as a yellow dye. TNT is relatively difficult to detonate so it was on the market as a dye for some years before its more explosive properties were discovered."
Summer Olympics host after London.   		3 letters,"RIO.    	Even though the 2016 Olympic Games is a 'summer' competition, it will be held in Rio de Janeiro in the winter. As Rio is in the southern hemisphere, the planned date of the opening of 5th August 2016 falls in the local season of winter. The 2016 games will also be first to be held in South America, and the first to be hosted by a Portuguese-speaking country."
"""Warszawa"" instrumentalist.   		3 letters","ENO.    	'Warszawa' is a song written by David Bowie and Brian Eno, released in 1977. 'Warszawa' is the Polish word for 'Warsaw'."
Org.   		3 letters,EPA.    	Environmental Protection Agency (EPA)
Formerly.   		3 letters,"NEE.    	""Née"" is the French word for ""born"" when referring to a female. The male equivalent is ""né""."
Inventor Whitney.   		3 letters,ELI.    	The inventor Eli Whitney is a best known for inventing the cotton gin. Whitney also came up with the important concept of 'interchangeable parts'. Parts that are interchangeable can be swapped out of equipment or perhaps used in related designs.
Pennsylvania port.   		4 letters,"ERIE.    	Erie is a city in the very north of Pennsylvania, right on the southern shore of Lake Erie. The city takes its name from the Erie Native American tribe that resided in the area."
Pistol PAC-ers?.   		3 letters,"NRA.    	The National Rifle Association (NRA) used the slogan 'I'll give you my gun when you pry it from my cold, dead hands'. These words became quite famous when they were used at an NRA convention in 2000 by Charlton Heston, who was then president of the NRA. Heston ended a speech he made with the words 'From my cold, dead hands!' while holding up into the air a replica of a Sharps rifle."
Bird with calf muscles.   		3 letters,"EMU.    	Emu eggs are very large, with a thick shell that is dark-green in color. One emu egg weighs about the same as a dozen chicken eggs."
Fencing option.   		4 letters,"EPEE.    	There are three fencing events in the modern Olympics, distinguished by the weapon used:"
Expected hr.   		3 letters,ETA.    	Estimated time of arrival (ETA)
"""___ Baba and the 40 Thieves"".   		3 letters","ALI.    	In the folk tale 'Ali Baba and the Forty Thieves', the title character is a poor woodcutter who discovers the magic words 'Open Sesame' that open the thieves' den."
World capital half of which consists of forest.   		4 letters,"OSLO.    	Oslo is the capital of Norway. The city of Oslo burns trash to fuel half of its buildings, including all of its schools. The problem faced by the city is that it doesn't generate enough trash. So, Oslo imports trash from Sweden, England and Ireland, and is now looking to import some American trash too. Oslo is also a large city with a relatively small population. As a result, about two-thirds of the city's land area comprises protected forest, hills and lakes."
Org.   		3 letters,IRA.    	'Óglaigh na hÉireann' translates from Irish as 'soldiers of Ireland'.
"Psychic power, informally.   		3 letters",ESP.    	Extrasensory perception (ESP)
It has many famous alums.   		3 letters,"SNL.    	The list of successful alums of 'Saturday Night Live' (SNL) includes, to name but a few:"
Agent of psychedelic therapy.   		3 letters,"LSD.    	LSD (colloquially known as 'acid') is short for lysergic acid diethylamide. A Swiss chemist called Albert Hofmann first synthesized LSD in 1938 in a research project looking for medically efficacious ergot alkaloids. It wasn't until some five years later when Hofmann ingested some of the drug accidentally that its psychedelic properties were discovered. Trippy, man ..."
Singer Corinne Bailey ___.   		3 letters,RAE.    	Corinne Bailey Rae is a British singer from Yorkshire.
Norway's capital.   		4 letters,"OSLO.    	Oslo is an ancient city, founded around 1048. The medieval city was destroyed by fire in 1624 and was rebuilt by the Danish-Norwegian King Christian IV and renamed Christiana. In 1877, there was an official change of the name's spelling to Kristiana, and then more recently in 1925 the name was restored to the original Oslo. Things have gone full circle, as the center of Oslo, the area that would have been contained by the original medieval walls, has recently been renamed Christiana."
Formerly.   		3 letters,"NEE.    	""Née"" is the French word for ""born"" when referring to a female. The male equivalent is ""né""."
