"Some ""CSI"" figs.   		3 letters",DAS.    	District Attorney (DA)
"Not reacting to pain, say.   		5 letters","STOIC.    	Zeno of Citium was a Greek philosophers famous for teaching at the Stoa Poikile, the ""Painted Porch"", located on the north side of the Ancient Agora of Athens. Because of the location of his classes, his philosophy became known as stoicism (from ""stoa""). And yes, we get our adjective ""stoic"" from the same root."
Dale's partner.   		3 letters,"ROY.    	Cowboy actor and singer Roy Rogers' real name was Leonard Franklin Slye, and his nickname was ""King of the Cowboys"". Roy Rogers married Dale Evans in 1947. Evans' nickname was ""Queen of the West""."
Navajo's neighbor in Arizona.   		4 letters,"HOPI.    	The Hopi nation live on a reservation that actually resides within the much larger Navajo reservation, in Arizona."
"Editors' marks meaning ""put back in"".   		5 letters","STETS.    	""Stet"" is the Latin word meaning ""let it stand"". In editorial work, the typesetter is instructed to disregard any change previously marked by writing the word ""stet"" beside the change and then underscoring the change with a line of dots (or dashes)."
Expanse south of Ulan Bator.   		4 letters,"GOBI.    	The name ""Ulan Bator"" translates from Mongolian as ""the Red Hero"", and is Mongolia's capital city. The city was named in recognition of Mongolia's national hero, Damdin Sukhbaatar, who fought side-by-side with the Soviet Red Army in liberating the country from a White Russian warlord and the Chinese. Ulan Bator lies north of the Gobi Desert."
Candy in a dispenser.   		3 letters,"PEZ.    	PEZ is an Austrian brand name for a particular candy sold in a mechanical dispenser. Famously, PEZ dispensers have molded 'heads', and have become very collectible over the years. The list of heads includes historical figures like Betsy Ross and Paul Revere, characters from 'Star Wars' and 'Star Trek', and even British royalty like the Duke and Duchess of Cambridge ('William and Kate'). The name PEZ comes from the first, middle and last letters of ""Pfefferminz"", the German word for ""peppermint""."
"""Swans Reflecting Elephants"" artist.   		4 letters","DALI.    	Swans Reflecting Elephants' is a painting that Salvador Dali completed in 1937. The title is somewhat self-explanatory. The scene features some swans on a lake, along with their reflections. In the reflection the swans take on the appearance of elephants, with the swans' necks becoming elephant trunks and wings becoming ears."
Backwoods parent.   		3 letters,MAW.    	I guess that's Maw and Paw ...
Testing stage.   		4 letters,"BETA.    	In the world of software development, the first tested issue of a new program is usually called the ""alpha"" version. Expected to have a lot of bugs that need to be fixed, the alpha release is usually distributed to a small number of testers. After reported bugs have been eliminated, the refined version is called a ""beta"" and is released to a wider audience, but with the program clearly labeled as ""beta"". The users generally check functionality and report further bugs that are encountered. The beta version feeds into a release candidate, the version that is tested just prior to the software being sold into the market, bug-free. Yeah, right ..."
Submarine sandwich.   		4 letters,"HERO.    	""Hero"" is another name for a submarine sandwich. The hero originated in New York City in the 1800s among Italian immigrants who wanted an Italian sandwich that reminded them of home. The name ""hero"" was coined in the 1930s, supposedly by a food critic in the ""New York Herald Tribune"" when he wrote that ""one had to be a hero"" to finish the gigantic sandwich. Hero is a prevalent term to this day in New York City, reserved for a submarine sandwich with an Italian flavor."
"""My Baby No ___ Aqui"" (Garth Brooks song).   		4 letters","ESTA.    	Country singer Garth Brooks retired from recording and performing in 2001, and then came out of retirement in 2009. You can go see him perform at the Encore Hotel and Casino on the Las Vegas Strip."
Internet address starter.   		4 letters,"HTTP.    	""http"" are the first letters in most Internet links. 'http' stands for HyperText Transfer Protocol."
___ Paese cheese.   		3 letters,"BEL.    	Bel Paese is a mild Italian cheese invented in the 1906. The name ""bel paese"" means beautiful country in Italian, and is taken from the title of a book written by Antonio Stoppani."
Pasta topper.   		5 letters,"PESTO.    	Pesto gets its name from the Latin word for ""crush"". The word ""pestle"", as in mortar and pestle, is derived from the same Latin root."
Smoked deli purchase.   		3 letters,"LOX.    	Lox is a cured salmon fillet, finely sliced. The term ""lox"" comes into English via Yiddish, and derives from the German word for salmon, namely 'Lachs'."
Actress Anderson.   		4 letters,"LONI.    	Loni Anderson's most-remembered role was Jennifer Marlowe on the sitcom ""WKRP in Cincinnati"". Anderson has been married four times, most famously to actor Burt Reynolds from 1988 to 1993."
"Omaha Beach craft, for short.   		3 letters","LST.    	LST stands for Landing Ship, Tank. LSTs were the large vessels used mainly in WWII that had doors at either ends, from which tanks and other vehicles could roll off and onto beaches. The design concept persists to this day in the huge fleet of commercial roll-on/roll-off ferries, all inspired by the LST."
Singer/songwriter Amos.   		4 letters,"TORI.    	Tori Amos is an American pianist and singer. She started playing the piano at two years old, and was composing piano pieces by age five. She was playing in piano bars (chaperoned by her father) when she was 14. I'm going to have to find some of her music (I lead such a sheltered life ...)!"
"In Tahitian it means ""good"".   		7 letters","MAI TAI.    	The Mai Tai cocktail is strongly associated with the Polynesian islands, but the drink was supposedly invented in 1944 in Trader Vic's restaurant in Oakland, California. One recipe is 6 parts white rum, 3 parts orange curaçao, 3 parts Orgeat syrup, 1 part rock candy syrup, 2 parts fresh lime juice, all mixed with ice and then a float added of 6 parts dark rum. ""Maita'i"" is the Tahitian word for ""good""."
Target audience of Maxim.   		3 letters,"MEN.    	""Maxim"" is an international men's magazine featuring revealing photo spreads (non-nude in the US) of female celebrities and models."
"Pet care specialists, for short.   		4 letters","SPCA.    	Unlike in most developed countries, there is no ""umbrella"" organization in the US with the goal of preventing cruelty to animals. Instead there are independent organizations set up all over the nation using the name SPCA. Having said that, there is an organization called the American Society for the Prevention of Cruelty to Animals (ASPCA) that was originally intended to operate across the country, but really it now focuses its efforts in New York City."
Exercise with a portmanteau name.   		6 letters,"TAE BO.    	Tae Bo isn't an ancient martial art, and rather was developed as a form of aerobic exercise in the 1990s. The discipline was introduced by taekwondo expert Billy Blanks who gave it the name Tae Bo, a melding of ""taekwondo"" and ""boxing""."
Pros in power: Abbr..   		3 letters,EES.    	Electrical Engineers (EEs).
"""What, me worry?"" magazine.   		3 letters","MAD.    	""Mad"" magazine has been around since 1952, although back then it was more of a comic book than a magazine. The original founder and editor was Harvey Kurtzman and in order to convince him to stay, the publisher changed the format to a magazine in 1955. That's when the publication really took off in terms of popularity."
Sumac with a wide range.   		3 letters,"YMA.    	Yma Sumac was a Peruvian soprano, with a notable vocal range of five octaves."
"Nick of ""The Deep"".   		5 letters","NOLTE.    	The actor Nick Nolte got his first big break playing opposite Jacqueline Bisset and Robert Shaw in 'The Deep', released in 1976. Prior to that he had worked as a model, and in fact appeared in a magazine advertisement for Clairol in 1972 alongside fellow model, Sigourney Weaver."
Politico Palin.   		5 letters,"SARAH.    	When John McCain selected Sarah Palin as candidate for Vice President in the 2008 presidential election, she became the first Alaskan to go on the national ticket for a major party. She also became the first woman nominated for Vice President by the Republicans."
___ Rabbit.   		5 letters,"BR'ER.    	Br'er Rabbit and Br'er Fox are characters in the Uncle Remus stories, written by Joel Chandler Harris. The Uncle Remus stories are adaptations of African American folktales that Harris collected across the Southern States. ""Br'er"" is an abbreviated form of ""brother""."
Beaver's construction.   		3 letters,DAM.    	Beavers build dams so that they can live in and around the slower and deeper water that builds up above the dam. This deeper water provides more protection for the beavers from predators such as bears. Beavers are nocturnal animals and do all their construction work at night.
Tulsa sch.   		3 letters,"ORU.    	Oral Roberts University is a private school in Tulsa, Oklahoma. It was founded relatively recently, in 1963, by the late evangelist Oral Roberts."
Brewer's oven.   		4 letters,"OAST.    	An oast is a kiln used for drying hops as part of the brewing process. Such a structure might also be called an ""oast house""."
"Tesla, e.g.   		4 letters","SERB.    	Nikola Tesla was born in Serbia, but later moved to the US. Tesla's work on mechanical and electrical engineering was crucial to the development of alternating current technology, the same technology that is used by equipment at the backbone of modern power generation and distribution systems."
"""Will it play in ___?"".   		6 letters","PEORIA.    	The phrase, 'Will it play in Peoria?' is used to mean, 'Will it appeal to the mainstream?' It is believed that the expression originated as a corruption of, 'We shall play in Peoria', a line used by characters in the 1890 novel ""Five Hundred Dollars"" by Horatio Alger, Jr."
"Any singer of ""Hotel California"".   		5 letters","EAGLE.    	""Hotel California"" is the title song from a 1997 album released by the Eagles. The song is allegorical in nature, and tells of a luxury hotel where one can check in, but never check out. The hotel is a symbol for the California music industry of the seventies that destroyed so many people who were trapped by it. There is an unrelated Hotel California in San Francisco, my favorite of the city's ""boutique"" and reasonable priced places to stay."
"Black-and-white transmissions, briefly?.   		4 letters",APBS.    	An All Points Bulletin (APB) is a broadcast from one US law enforcement agency to another.
"Words With Friends, e.g.   		3 letters","APP.    	'Words With Friends' is a word game application that can be played on smartphones and other electronic devices. 'Words With Friends' is basically Scrabble under a different name, I hear."
Veto.   		3 letters,"NIX.    	The use of 'nix' as a verb, meaning 'to shoot down', dates back to the early 1900s. Before that 'nix' was just a noun meaning 'nothing'. 'Nix' comes from the German 'nichts', which also means 'nothing'."
Alma mater for Benjamin Netanyahu.   		3 letters,"MIT.    	Benjamin 'Bibi' Netanyahu has been the Prime Minister of Israel since 2009. Netanyahu is the only leader of the country to date who was born in the state of Israel. After graduating high school, he served in the Israeli special forces and participated in several combat missions, and was wounded on multiple occasions. After leaving the army in 1972, Netanyahu studied at MIT in the US, earning bachelors degree in architecture and a masters degree in business."
Living or dead follower.   		3 letters,"END.    	The idiom 'the living end' means 'outrageous' as in 'Oh, you are the living end!'"
Global economic oversight org.   		3 letters,"IMF.    	The International Monetary Fund (IMF) was established at the end of 1945 with 29 major economies supporting and funding an effort to stabilize economies across the globe after WWII. Headquartered in Washington, D.C., today the IMF has 187 member countries."
Oxford or loafer.   		4 letters,"SHOE.    	An oxford is a type of lace-up shoe that originated not in Oxford, but actually in Scotland and Ireland."
Nautical record.   		3 letters,"LOG.    	The word ""logbook"" dates back to the days when the captain of a ship kept a daily record of the vessel's speed, progress etc. using a ""log"". A log was a wooden float on a knotted line that was dropped overboard to measure speed through the water."
Lothario.   		4 letters,"ROUE.    	ROUE is a lovely word, I think, describing a less then lovely man. He could otherwise be described as a cad, someone of loose morals. It comes from the French word ""rouer"" meaning ""to break on a wheel"". This describes the ancient form of capital punishment where a poor soul was lashed to a wheel and then beaten to death with cudgels and bars. I guess the suggestion is that a ROUE with his loose morals deserves such a punishment."
"Time-honored Irish cleric, for short.   		6 letters","ST PAT.    	There is a fair amount known about St. Patrick, some of which comes from two letters written in his own hand. He lived in the fifth century, but was not born in Ireland. He was first brought to Ireland at about 16 years of age from his native Britain, by Irish raiders who made him a slave for six years. He managed to escape and return home where he studied and entered the Church. He returned to Ireland as a bishop and a missionary and there lived out the rest of his life. There seems to be good evidence that he died on March 17th, although the year is less clear. The stories about shamrock and snakes, I am afraid they are the stuff of legend."
"""Mad Men"" channel.   		3 letters","AMC.    	AMC, formerly known as American Movie Classics, is one of my favorite television channels. Although the channel's focus has shifted from airing classic movies to including other programming, there's still a lot of quality output. AMC's flagship show is 'Mad Men'."
Actress Turner.   		4 letters,"LANA.    	Lana Turner started work as a Hollywood actress at a very young age, signing up with MGM at only sixteen. Early in her career she earned the nickname ""The Sweater Girl"" after wearing a pretty tight sweater in the film ""They Won't Forget"", her film debut. She married eight times, to seven different husbands, the first of which was bandleader Artie Shaw. Shaw and Turner eloped and married on their very first date, when the young actress was just nineteen years old. After divorcing Shaw she married restaurateur Joseph Crane, but had the marriage annulled when she found out that Crane was still married to his first wife. The two had a daughter together, and so remarried when Crane's divorce was finalized. Cheryl Crane was the daughter from the marriage to Joseph, and she lived with Turner after her parents split up. When Cheryl was 14-years-old, her mother was romantically involved with a shady character named Johnny Stompanato. One evening Cheryl found her mother engaged in a violent argument with Stompanato, and Cheryl became so scared that she pulled out a gun and killed him in what was deemed to be justifiable homicide. Turner's last marriage was to a nightclub hypnotist, Ronald Pellar, and that union lasted just six months as Pellar disappeared one day with a lot of Turner's money and jewelry. Years later Turner said, ""My goal was to have one husband and seven children, but it turned out to be the other way around."""
Spanish bear.   		3 letters,"OSO.    	In Spanish, 'osa' is a female bear, and 'oso' is a male. An 'oso' might be found in 'un zoológico' (a zoo)."
Jazz trumpeter Baker.   		4 letters,"CHET.    	The famous jazz trumpeter Chet Baker was noted for his heroin addiction, a problem that nearly put an end to his performing career. He managed a comeback in the late seventies, mainly appearing and recording in Europe. But he never kicked the drug habit, and was found dead one day after falling from his hotel room window in Amsterdam."
Jimmy who works with Lois Lane.   		5 letters,"OLSEN.    	In the Superman stories, Jimmy Olsen is a cub photographer who works on the ""Daily Planet"" newspaper with Clark Kent and Lois Lane."
Follower of Zeno.   		5 letters,"STOIC.    	Zeno of Citium was a Greek philosopher famous for teaching at the Stoa Poikile (Painted Porch) located on the north side of the Ancient Agora of Athens. Because of the location of his classes, his philosophy became known as stoicism (from ""stoa"" meaning ""porch""). And yes, we get our adjective ""stoic"" from the same root."
Reason for a February thank-you speech.   		5 letters,"OSCAR.    	The Academy of Motion Picture Arts and Sciences (AMPAS) is the organization that gives the annual Academy Awards also known as the ""Oscars"". The root of the name ""Oscar"" is hotly debated, but what is agreed is that the award was officially named ""Oscar"" in 1939. The first Academy Awards were presented at a brunch in 1929 with an audience of just 29 people. It's a slightly bigger event these days ..."
Word written on the Saudi flag.   		5 letters,"ALLAH.    	The flag of Saudi Arabia has a green background on which there is a white sword, and above the sword an inscription in white lettering. The inscription is the Islamic declaration of faith, and translates as ""There is no God but Allah and Muhammad is the messenger of Allah"". Manufacturing the flag is a little tricky as it has two different sides, so that the writing reads correctly (from right-to-left) on both sides. Also, the sword which lies horizontally under the inscription, it has to point away from the flagpole on both sides. If you think about it, each side is therefore a different design."
"Parade honoree, familiarly.   		6 letters","ST PAT.    	There is a fair amount known about St. Patrick, some of which comes from two letters written in his own hand. St. Patrick lived in the fifth century, but was not born in Ireland. He was first brought to Ireland at about 16 years of age from his native Britain, by Irish raiders who made him a slave for six years. Patrick managed to escape and returned to his homeland where he studied and entered the Church. He went back to Ireland as a bishop and a missionary and there lived out the rest of his life. There seems to be good evidence that he died on March 17th (now celebrated annually as St. Patrick's Day), although the year is less clear. The stories about shamrock and snakes, I am afraid they are the stuff of legend."
Shakespearean king.   		4 letters,"LEAR.    	Shakespeare was inspired to write his famous drama 'King Lear' by the legend of ""Leir of Britain"", the story of a mythological Celtic king."
Nonmusical Abba.   		4 letters,"EBAN.    	Abba Eban was an Israeli diplomat and politician, born Aubrey Solomon Meir Eban in Cape Town. While working at the United Nations after WWII he changed his name to ""Abba"", the Hebrew word for ""father"", reportedly as he could see himself as the father of the nation of Israel."
Indian state known for its tea.   		5 letters,"ASSAM.    	Assam is a state in the very northeast of India, just south of the Himalayas. Assam is noted for its tea as well as its silk."
Metal waste.   		4 letters,"SLAG.    	The better lead ores are processed in a blast furnace, to extract the metal. The ""waste"" from this process is called ""slag"". Slag does contain some lead and it can be processed further in a ""slag furnace"" to extract the residual metal. Slag furnaces also accept poorer lead ores as a raw material."
Refuse at a mill.   		4 letters,"SLAG.    	The better lead ores are processed in a blast furnace, to extract the metal. The ""waste"" from this process is called ""slag"". Slag does contain some lead, and it can be processed further in a ""slag furnace"" to extract the residual metal. Slag furnaces also take poorer lead ores as a raw material."
The dark side.   		3 letters,"YIN.    	The yin and the yang can be explained using many different metaphors. In one, as the sun shines on a mountain, the side in the shade is the yin, and the bright side is the yang."
French pronoun.   		3 letters,"TOI.    	'Toi' is the French word for 'you', when talking to someone with whom you are familiar."
Not moved much.   		5 letters,"STOIC.    	Zeno of Citium was a Greek philosopher noted for teaching at the Stoa Poikile, the ""Painted Porch"", located on the north side of the famous Ancient Agora of Athens. Because of the location of his classes, his philosophy became known as stoicism (from ""stoa""). And yes, we get our adjective ""stoic"" from the same root."
Magnum ___.   		4 letters,"OPUS.    	'Magnum opus' is a Latin term meaning 'great work'. The magnum opus of a writer or composer perhaps, is his or her greatest work."
Funnywoman Silverman.   		5 letters,"SARAH.    	Sarah Silverman is a comedian, but also a singer and actress. Her material is very ""edgy"", as she takes on social taboos such as racism, sexism and religion. She had a celebrity boyfriend for five years ... as she dated Jimmy Kimmel starting in 2002, soon after his divorce from his first wife."
One who's left holding the bag?.   		4 letters,"HOBO.    	No one seems to know for sure how the term ""hobo"" originated, although there are lots of colorful theories. My favorite is that ""hobo"" comes from the first letters in the words ""ho-meward bo-und"", but it doesn't seem very plausible. Hobos differed from ""tramps"" and ""bums"", in that ""bums"" refused to work, ""tramps"" worked when they had to, while ""hobos"" traveled in search of work."
Limbo need.   		3 letters,"BAR.    	The limbo dance originated on the island of Trinidad in the Caribbean. The name ""limbo"" is an alteration of our word ""limber"", which isn't surprising given what one has to do to get under that bar!"
Baseball great Campanella.   		3 letters,"ROY.    	Roy Campanella was a Major League Baseball player considered by many to have been one of the greatest catchers the game has ever seen. Campanella played for the Brooklyn Dodgers in the forties and fifties and was a pioneer in breaking the color barrier as he started out playing in the Negro Leagues. Sadly, he was paralyzed in a car accident when in his late thirties and so his career was tragically cut short."
Pro ___.   		3 letters,"TEM.    	Pro tempore can be abbreviated to ""pro tem"" or ""p.t."" It is a Latin phrase which best translates as ""for the time being"". It is used to describe a person who is acting for another, usually a superior."
Ship of 1492.   		4 letters,"NINA.    	The ship used by Christopher Columbus that we know as the Niña was actually the nickname of a ship actually called the Santa Clara. The nickname 'Niña' probably came from the name of her owner, Juan Niña of Moguer."
Kind of dye.   		3 letters,"AZO.    	Azo compounds have very vivid colors and so are used to make dyes, especially dyes with the colors red, orange and yellow."
___ buco.   		4 letters,OSSO.    	'Osso' is the Italian word for bone as in the name of the dish Osso Buco: braised veal shanks.
___ lily.   		4 letters,"SEGO.    	The Sego Lily is the state flower of Utah, and is a perennial plant found throughout the Western United States."
Garlicky mayonnaise.   		5 letters,"AIOLI.    	To the purist (especially in Provence in the South of France), aioli is prepared just by grinding garlic with olive oil. However, other ingredients are often added to mix, particularly egg yolks."
The Warta's outlet.   		4 letters,"ODER.    	The Warta is the third longest river in Poland. The Warta river basin was at the heart of original Poland, when the Slavic tribe called the Polans inhabited the basin from the 8th century."
Port.   		3 letters,"EUR.    	Portugal is the most westerly country in Europe, located in the west of the Iberian Peninsula alongside Spain. The name 'Portugal' comes from the Latin name for Porto, the country's second largest city: 'Portus Cale'. Portugal was a far-reaching power in the 15th and 16th centuries, at the center of the world's first truly global empire. A legacy of the Portuguese Empire is that today there are more than 240 million Portuguese speakers across the world."
"Danish kroner, topologically speaking.   		4 letters","TORI.    	""Krone"" translates in English as ""crown"", and was the name given to coins that bore the image of the monarch. Today, the krone is the name given to the currency of Norway and of Denmark. Some of the Norwegian and Danish kroner have holes in the middle, giving them a ""doughnut"" or ""torus"" shape."
"""L'Amour avec ___"" (French love song).   		3 letters","TOI.    	""L'Amour avec toi"" ... ""Love with you"""
Some univ.   		3 letters,TAS.    	Teaching Assistants (TAs)
First name among exotica singers.   		3 letters,"YMA.    	Yma Sumac was a Peruvian soprano, Sumac had a notable vocal range of five octaves."
"""Shoo-be-doo-be-doo-wop,"" e.g.   		4 letters","SCAT.    	Scat singing is a vocal improvisation found in the world of jazz. There aren't any words as such in scat singing, just random nonsense syllables made up on the spot."
Hall's partner in pop music.   		5 letters,"OATES.    	Daryl Hall & John Oates are a pop music duo, most successful in the late seventies and early eighties. They had six number one hits, including the 1982 release ""Maneater""."
Pro ___.   		4 letters,"RATA.    	""Pro rata"" is a Latin phrase meaning ""in proportion""."
Tulsa sch.   		3 letters,"ORU.    	Oral Roberts University is a private school in Tulsa, Oklahoma. It was founded relatively recently, in 1963, by the late evangelist Oral Roberts."
