Connection letters.   		3 letters,"DSL.    	DSL originally stood for Digital Subscriber Loop, but is now accepted to mean (Asymmetric) Digital Subscriber Line. DSL is the technology that allows Internet service be delivered down the same telephone line as voice service, by separating the two into different frequency signals."
"Band with the 2008 album ""Accelerate"".   		3 letters","REM.    	The band's name, R.E.M., apparently has nothing to do with Rapid Eye Movement (the stage of sleep when one dreams) as is widely assumed. Apparently is means absolutely nothing."
Zion's site.   		4 letters,"UTAH.    	To me, the most spectacular feature of Zion National Park, in southwestern Utah, is the magnificent Zion Canyon. The canyon cuts through red Navajo sandstone and is a truly beautiful sight."
Important info for people with connections.   		4 letters,ETAS.    	Expected time of arrival (ETA)
"Ness of ""The Untouchables"".   		5 letters","ELIOT.    	Eliot Ness was the Treasury agent charged with the task of bringing down the notorious Chicago gangster, Al Capone. When he took on the job in 1930, Chicago law-enforcement agents were renowned for being corrupt, for being on the take. Ness hand-picked 50 prohibition agents he thought he could rely on, later reducing that to a cadre of 15 and ultimately just 11 trusted men. That 11 earned the nickname ""The Untouchables""."
"Opposite of spring, tidewise.   		4 letters","NEAP.    	Tides of course are caused by the gravitational pull of the moon on the oceans. At neap tide, the smaller gravitational effect of the sun cancels out some of the moon's effect. At spring tides, the sun and the moon's gravities act in concert causing more extreme movement of the oceans."
One carrying a toon?.   		3 letters,"CEL.    	In the world of animation, a cel is a transparent sheet on which objects and characters are drawn. In the first half of the 20th century the sheet was actually made of celluloid, giving the ""cel"" its name."
Job ad abbr.   		3 letters,EEO.    	Equal Opportunity Employment is a term that has been around since 1964 when the Equal Employment Commission was set up by the Civil Rights Act.
"Ticklish ""Sesame Street"" character.   		4 letters","ELMO.    	The man behind/under the character Elmo on 'Sesame Street' is Kevin Clash. If you want to learn more about Elmo and Clash, you can watch the 2011 documentary 'Being Elmo: A Puppeteer's Journey'."
Dr.   		4 letters,"ELSA.    	Elsa Schneider was the femme fatale of the movie, a character who seduced both Indiana Jones and his father. She was played by Alison Doody, an Irish actress. Ms. Doody is very much against taking roles with nudity, and famously turned down the lead in ""Basic Instinct"", the role taken by Sharon Stone."
QB stats.   		3 letters,"TDS.    	In football, the goal of the quarterback (QB) is to score touchdowns (TDs)."
Singer Barry.   		3 letters,"LEN.    	Len Barry is a retired singer, originally the front man for a group called the Dovells, formed by friends in high school. After recording a number of hits with the Dovells, Barry had a successful solo career."
Justice Dept.   		3 letters,DEA.    	Drug Enforcement Administration (DEA)
Cousin of a zebra.   		3 letters,"ASS.    	The name 'zebra' comes from an old Portuguese word 'zevra' meaning 'wild ass'. Studies of zebra embryos show that zebras are basically black in color, with white stripes that develop with growth. Before this finding, it was believed they were white, with black stripes."
"Donkey Kong, for one.   		3 letters","APE.    	The first video game featuring the ape called Donkey Kong was created in 1981. That first 'Donkey Kong' game also introduced the world to the character known as 'Mario', four years before 'Super Mario Bros' became such a big hit."
Lummox.   		3 letters,"ASS.    	The word ""lummox"" comes from East Anglian slang (northeast of London). The term is probably a contraction of ""lumbering ox""."
"Football six-pointers, for short.   		3 letters",TDS.    	Touchdowns (TDs)
___ chi.   		3 letters,"TAI.    	More properly called tai chi chuan, tai chi is a martial art mostly practiced to improve overall health and increase longevity."
___ tide.   		4 letters,"NEAP.    	Neap tides are when the difference between the height of the water at high tide and low tide is relatively small. Spring tide is the opposite, with a big swing in the height of the water. Tides of course are caused by the gravitational pull of the moon on the oceans. At neap tide, the lesser gravitational effect of the sun cancels out some of the moon's effect. At spring tides, the sun and the moon's gravities act in concert causing more extreme movement of the oceans."
One who has a hunch.   		4 letters,"IGOR.    	Igor has been the assistant to Dracula, Frankenstein and Young Frankenstein among others. Igor is almost invariably portrayed as a hunchback."
Dictator's start.   		5 letters,"IN RE.    	When dictating a memorandum, one might start with ""in re""."
Org.   		3 letters,DEA.    	(11D. See 26-Across : MULES)
Detoxing woe.   		3 letters,"DTS.    	The episodes of delirium that can accompany withdrawal from alcohol are called Delirium Tremens (the DTs). The literal translation of this Latin phrase is ""trembling madness""."
Skin pic?.   		3 letters,"TAT.    	The word ""tattoo"" was first used in English in the writings of the famous English explorer Captain Cook. In his descriptions of the indelible marks adorning the skin of Polynesian natives, he anglicized the Tahitian word ""tatau"" into our ""tattoo""."
Seasons in Lyon.   		4 letters,ETES.    	One might spend the summer (été) under the sun (le soleil) in French-speaking countries.
Site of cataracts.   		4 letters,NILE.    	The Cataracts of the Nile are a series of six shallows along the river between Aswan in the north and Khartoum in the south. The flow in the cataracts ranges from relatively smooth to whitewater rapids.
Badlands formation.   		4 letters,"MESA.    	What's the difference between a butte and a mesa, I hear you cry! Both are hills with flat tops, but a mesa has a top that is wider than it is tall. A butte is a much narrower formation, taller than it is wide. Now we know ..."
Tuna type.   		3 letters,"AHI.    	Yellowfin tuna is usually marketed as ""ahi"", its Hawaiian name. Yellowfin tuna is one big fish, often weighing over 300 pounds."
"Body art, in slang.   		3 letters","TAT.    	The word ""tattoo"" (often shortened to 'tat') was first used in English in the writings of the famous English explorer Captain Cook. In his descriptions of the indelible marks adorning the skin of Polynesian natives, Cook anglicized the Tahitian word ""tatau"" into our ""tattoo""."
Tour de France times.   		4 letters,ETES.    	One might spend the summer (été) under the sun (le soleil) in France.
Jimmy Carter's middle name.   		4 letters,"EARL.    	President Jimmy Carter is a graduate of the US Naval Academy. Carter served in the Navy on surface ships and submarines, and chose to pursue a career in the submarine service as he was interested in nuclear power and believed it had a great future in submarine design. As a result, he became an expert in nuclear propulsion. In 1952, the Navy sent the young Carter to the Chalk River Laboratories in Canada to lead the US effort to shutdown the reactor after an accident and partial meltdown of a reactor core. He and his team had to be lowered into the leaking reactor core for mechanical disassembly, staying there for only seconds at a time to minimise exposure to radiation. Decades later as US President, it was this experience that influenced Carter's decision not to complete the development of the neutron bomb."
Philosopher ___-tzu.   		3 letters,LAO.    	Lao Tse (also Lao-Tzu) was a central figure in the development of the religion/philosophy of Taoism.
___ of Sandwich.   		4 letters,"EARL.    	Meats placed between slices of bread was first called a sandwich in the 18th century, named after the Fourth Earl of Sandwich. The Earl was fond of eating ""sandwiches"" while playing cards at his club."
Job listing abbr.   		3 letters,EEO.    	Equal Employment Opportunity (EEO) is a term that has been around since 1964 when the Equal Employment Commission was set up by the Civil Rights Act.
New corp.   		3 letters,"MBA.    	The world's first MBA degree was offered by Harvard's Graduate School of Business Administration, in 1908."
Wood of the Rolling Stones.   		3 letters,"RON.    	Ronnie Wood is one of the Rolling Stones. The Stones were formed in 1962, and Wood joined in 1975. Prior to his stint with the Stones, Wood was a member of the Jeff Beck Group as well as the Faces."
Multinational coin.   		4 letters,"EURO.    	The European Union (EU) today stands at a membership of 27 states. The Euro is the official currency of only 16 of the 27. The list of states in the EU that don't use the Euro includes the UK, Denmark, Sweden and Norway."
"Robert of ""Quincy, M.E."".   		3 letters","ITO.    	Robert Ito is an actor from Canada who is perhaps best known for play forensic lab technician Sam Fujiyama on the TV show 'Quincy, M.E.'"
Genesis brother.   		4 letters,"ABEL.    	The story of Cain and Abel not only appears in the Bible, it also features in the Qur'an. In the Muslim account the brothers are named Kabil and Habil."
Mélange.   		4 letters,"OLIO.    	'Olio' is a term meaning a hodgepodge or a mixture, coming from the mixed stew of the same name. The stew in turn takes its name from the Spanish ""olla"", the clay pot used for cooking."
"""I think you overshared,"" briefly.   		3 letters",TMI.    	Too Much Information!
"Still frame of Mickey, maybe.   		3 letters","CEL.    	In the world of animation, a cel is a transparent sheet on which objects and characters are drawn. In the first half of the 20th century the sheet was actually made of celluloid, giving the ""cel"" its name."
Merrie Melodies sheepdog.   		3 letters,"SAM.    	The Old English Sheepdog is the dog that seems to have hair everywhere. I always remember Sam Sheepdog from the Looney Tunes and Merrie Melodies cartoons, stoically guarding his flock."
"One of the 40 in a farmer's ""back 40"".   		4 letters","ACRE.    	In the Public Land Survey System, land right across the country is divided into townships and sections. A section is roughly equivalent to a square mile, 640 acres. It became the practice to refer to quarter-quarter divisions of a section, with a quarter of a quarter of a section being equal to 40 acres (check the math!). From this sprung phrases like 'lower 40' (nominally the lowest elevation 40 acres on a property) and the 'back 40' (nominally a 40 acre parcel that was undeveloped on a property, 'out the back')."
"""Tin"" body part.   		3 letters","EAR.    	An inability to be able to distinguish between two notes could lead to someone being told they had a ""tin ear""."
"TurboTax alternative, for short.   		3 letters",CPA.    	Certified public accountant (CPA)
Actress Farrow.   		3 letters,"MIA.    	Mia Farrow is an energetic, award-winning actress who really hasn't looked back in her career since her first leading role, in ""Rosemary's Baby"" back in 1968. Farrow's on-screen celebrity is matched by the interest created by her personal life. Her first husband was Frank Sinatra, and the couple had a wedding in 1966 that received a lot of attention partly due to the couple's age difference (she was 21, he was 50). Farrow's second husband was almost as famous, the magnificent musician André Previn. Farrow then moved in with Woody Allen, a relationship that famously fell apart when Farrow discovered that Allen was having a sexual relationship with Soon-Yi, one of the adopted daughters from her marriage with André Previn."
Wall St.   		3 letters,"MBA.    	The world's first MBA degree was offered by Harvard's Graduate School of Business Administration, in 1908."
"Brother of Malcolm on ""Malcolm in the Middle"".   		5 letters","REESE.    	I've never actually sat down and watched the TV comedy ""Malcolm in the Middle"". It ran on Fox from 2000 to 2006. Malcolm was played by Frankie Muniz, who gave up acting to pursue a career in motor racing. Malcolm's brother, Reese, was played by Justin Berfield."
Man's name that sounds noble.   		4 letters,"ERLE.    	In the ranking of nobles, an earl comes above a viscount and below a marquess. The rank of earl is used in the British peerage system and is equivalent to the rank of count in other countries. Other British ranks have female forms (e.g. marquess and marchioness, viscount and viscountess), but there isn't a female word for the rank of earl. A female given the same rank as an earl is known simply as a countess."
An original member of the Star Alliance.   		3 letters,"SAS.    	SAS is a founding member of the Star Alliance, the industry's first airline alliance, created in 1997. The American founding representative is United Airlines."
Traffic-stopping org.   		3 letters,DEA.    	Drug Enforcement Administration (DEA)
Garment under a blouse.   		3 letters,"BRA.    	The word ""brassière"" is of course French in origin, but it isn't the word the French use for a ""bra"". In France what we call a bra is known as a ""soutien-gorge"", translating to ""held under the neck"". The word ""brassière"" is indeed used in France but there it describes a baby's undershirt, a lifebelt or a harness. ""Brassière"" comes from the Old French word for an ""arm protector"" in a military uniform (""bras"" is the French for ""arm""). Later ""brassière"" came to mean ""breastplate"" and from there the word was used for a type of woman's corset. The word jumped into English around 1900."
Monomaniacal mariner.   		4 letters,"AHAB.    	Captain Ahab is the obsessed and far from friendly captain of the Pequod in Herman Melville's ""Moby-Dick"". The role of Captain Ahab was played by Gregory Peck in the 1956 John Huston film adaptation. Patrick Stewart played Ahab in a 1998 miniseries in which Peck made another appearance, as Father Mapple."
"""Spring forward"" hrs.   		3 letters","DST.    	On the other side of the Atlantic, Daylight Saving Time (DST) is known as ""summer time"". The idea behind summer/daylight-savings is to move clocks forward an hour in spring and backwards in the fall, so that afternoons have more daylight."
Nativity scene beast.   		3 letters,"ASS.    	In the Christian tradition, a nativity scene (also 'crèche') is a display of representing the the scene of the birth of Jesus. Nativity scenes might be subjects for paintings, for example, although the term is usually used for seasonal displays associated with the Christmas season."
"Vardalos of ""My Big Fat Greek Wedding"".   		3 letters","NIA.    	Not only was the delightful Nia Vardalos the star of the 2002 hit movie ""My Big Fat Greek Wedding"", she also wrote the screenplay. The film never made it to number one at the box office, but it still pulled in more money than any other movie in history not to make it to number one. That record I think reflects that the film wasn't a blockbuster but rather a so-called ""sleeper hit"", a movie that people went to see based on referrals from friends. The big fat mistake came when a spin-off TV show was launched, ""My Big Fat Greek Life"". It ran for only 7 episodes."
"Poet who wrote ""This is the way the world ends / Not with a bang but a whimper"".   		5 letters","ELIOT.    	""This is the way the world ends / Not with a bang but a whimper"" are lines from T.S. Eliot's 1925 poem 'The Hollow Men'. The last two lines of ""The Hollow Men"" are oft-quoted:"
"Part of the conjugation of ""être"".   		4 letters","ETES.    	The French for 'to be' is 'être', and for 'you are' is 'vous êtes'."
"Its national anthem is ""Amhrán na bhFiann"".   		4 letters","EIRE.    	Amhrán na bhFiann' is Irish for 'The Soldiers' Song', and is the name of the Irish national anthem. I got this one pretty quickly ..."
"Rehab problem, for short.   		3 letters","DTS.    	The episodes of delirium that can accompany withdrawal from alcohol are called Delirium Tremens (the DTs). The literal translation of this Latin phrase is ""trembling madness""."
Internet connection inits.   		3 letters,"DSL.    	The acronym 'DSL' originally stood for Digital Subscriber Loop, but is now accepted to mean (Asymmetric) Digital Subscriber Line. DSL is the technology that allows Internet service be delivered down the same telephone line as voice service, by separating the two into different frequency signals."
Rebel in a beret.   		3 letters,"CHE.    	Ernesto ""Che"" Guevara was born in Argentina, and in 1948 he started to study medicine at the University of Buenos Aires. While at school he satisfied his need to ""see the world"" by taking two long journeys around South America, the story of which are told in Guevara's memoir later published as ""The Motorcycle Diaries"". While travelling, Guevara was moved by the plight of the people he saw and their working conditions and what he viewed as capitalistic exploitation. In Mexico City he met brothers Raul and Fidel Castro and was persuaded to join their cause, the overthrow of the US-backed government in Cuba. He rose to second-in-command among the Cuban insurgents, and when Castro came to power Guevara was influential in repelling the Bay of Pigs Invasion and bringing Soviet nuclear missiles to the island. Guevara left Cuba in 1965 to continue his work as a revolutionary. He was captured by Bolivian forces in 1967, and was executed. Fidel Castro led the public mourning of Guevara's death, and soon the revolutionary was an icon for many left-wing movements around the world."
Horror film assistant with a Russian name.   		4 letters,"IGOR.    	Igor has been the assistant to Dracula, Frankenstein and Young Frankenstein among others. Igor is almost invariably portrayed as a hunchback."
Winnie-the-Pooh's Hundred ___ Wood.   		4 letters,"ACRE.    	Hundred Acre Wood is where Winnie the Pooh lives with his friends. According to a map illustrating the books by A. A. Milne, Hundred Acre Wood is part of a larger forest, with Owl's house sitting right at the center."
Sashimi selection.   		3 letters,"AHI.    	Yellowfin tuna is usually marketed as ""ahi"", its Hawaiian name. Yellowfin tuna is one big fish, often weighing over 300 pounds."
"Its HQ are in Austria, which isn't a member.   		4 letters","OPEC.    	The OPEC cartel was formerly established in 1960, and has been headquartered in Vienna since 1965."
Way up.   		5 letters,"T-BAR.    	A T-bar is a type of ski lift in which the skiers are pulled up the hill in pairs, with each pair standing (not sitting!) either side of T-shaped metal bar. The bar is placed behind the thighs, pulling along the skiers as they remain standing on their skis (hopefully!). There's also a J-bar, a similar device, but with each J-shaped bar used by one skier at a time."
Indonesia joined it in 1962 ...   		4 letters,"OPEC.    	OPEC was created in 1960, with Indonesia joining the organization in 1962. Indonesia left OPEC in 2008 as the country was no longer able to meet the assigned production quota and had actually become a net importer of oil."
Female George.   		5 letters,"ELIOT.    	George Eliot was the pen name of English novelist Mary Anne Evans. As one might think, Evans chose a male pen name in order that her work might be best appreciated in the Victorian era. Eliot wrote seven novels including 'Adam Bede' (1859), 'The Mill on the Floss' (1860), 'Silas Marner' (1861) and 'Middlemarch' (1871-72)."
Q-Tip target.   		3 letters,"EAR.    	Cotton swabs were originally marketed under the name ""Baby Gays"", but this was changed in 1926 to ""Q-Tips"", with the Q standing for ""quality""."
Setting for a classic Agatha Christie mystery.   		4 letters,"NILE.    	Agatha Christie wrote a very successful crime novel called ""Death on the Nile"" that was first published in 1937. That novel had started off life as a play, which was was never performed, one that Christie called ""Moon on the Nile"". Christie then adapted the novel back into a play again calling it ""Murder on the Nile"", which opened in London in 1946."
Stooge with bangs.   		3 letters,"MOE.    	If you've seen a few of the films starring ""The Three Stooges"" you'll have noticed that the line up changed over the years. The original trio was made up of Moe and Shemp Howard (two brothers) and Larry Fine (a good friend of the Howards). This line up was usually known as ""Moe, Larry and Shemp"". Then Curly Howard replaced his brother when Shemp quit the act, creating the most famous trio, ""Moe, Larry And Curly"". Shemp returned when Curly had a debilitating stroke in 1946, and Shemp stayed with the troupe until he died in 1955. Shemp was replaced by Joe Besser, and then ""Curly-Joe"" DeRita. When Larry Fine had a stroke in 1970, it effectively marked the end of the act."
Frame from a drawer.   		3 letters,"CEL.    	In the world of animation, a cel is a transparent sheet on which objects and characters are drawn. In the first half of the 20th century the sheet was actually made of celluloid, giving the ""cel"" its name."
"About, on a memo.   		5 letters","IN RE.    	The term ""in re"" is actually Latin, derived from ""in"" (in) and ""res"" (thing, matter). It literally means ""in the matter"", and is used as ""in regard to"", or ""in the matter of""."
Org.   		3 letters,DEA.    	The Drug Enforcement Administration was set up in 1973 under the Nixon administration.
Memo starter.   		5 letters,"IN RE.    	The term ""in re"" is Latin, derived from ""in"" (in) and ""res"" (thing, matter). ""In re"" literally means ""in the matter"", and is used to mean ""in regard to"", or ""in the matter of""."
Tuna variety.   		3 letters,"AHI.    	Yellowfin and bigeye tuna are usually marketed as ""ahi"", the Hawaiian name. They are both big fish, with yellowfish tuna often weighing over 300 pounds, and bigeye tuna getting up to 400 pounds."
"""___ Bop"" (1984 hit).   		3 letters","SHE.    	'She Bop' is a hit song released by Cyndi Lauper in 1984. The song was considered controversial because of the sexual nature of the lyrics. In fact, Lauper claims that she recorded the vocal track while she was naked."
Apropos of.   		5 letters,"IN RE.    	The term ""in re"" is Latin, derived from ""in"" (in) and ""res"" (thing, matter). ""In re"" literally means ""in the matter"", and is used in place of ""in regard to"", or ""in the matter of""."
Latvian capital.   		4 letters,"EURO.    	Euro coins are issued by all the participating European states. The reverse side is a common design used by all countries, whereas the obverse is a design specific to each nation. For example, the one euro coin issued by Malta features the Maltese Cross. That Maltese euro is legal tender right across the eurozone. Of course the Irish euro features a harp."
Lush development?.   		3 letters,"DTS.    	The episodes of delirium that can accompany withdrawal from alcohol are called Delirium Tremens (the DTs). The literal translation of this Latin phrase is ""trembling madness""."
Borodin's prince.   		4 letters,"IGOR.    	'Prince Igor' is an opera by the Russian composer, Alexander Borodin. Borodin died before he had finished 'Prince Igor', so it was completed by Nikolai Rimsky-Korsakov and Alexander Glazunov. Music from 'Prince Igor' and other Borodin works was used in the American musical 'Kismet'."
"""Suis"" is part of its conjugation.   		4 letters","ETRE.    	The French for 'to be' is 'être', and for 'I am' is 'je suis'."
Carrier with a Copenhagen hub.   		3 letters,"SAS.    	SAS was formerly known as Scandinavian Airlines System and is the flag carrier of three countries: Denmark, Norway and Sweden. SAS is based at Stockholm Arlanda Airport located just north of the Swedish capital."
Optima maker.   		3 letters,KIA.    	The Kia Optima was sold for a while in Canada and Europe as the Kia Magentis.
Ne plus ultra.   		4 letters,"ACME.    	""Ne plus ultra"" is French for ""no more beyond"" and means just that in English, the high-point."
Third man.   		4 letters,"ABEL.    	According to the Bible's Book of Genesis, Adam was the first man. Adam's sons Cain and Abel were the second and third men respectively."
"Witherspoon of ""Legally Blonde"".   		5 letters",REESE.    	Reese is not actually Ms. Witherspoon's given name. She started out life as Laura Jeanne Witherspoon. Reese is her mother's maiden name.
Sioux adversary.   		5 letters,"OMAHA.    	The Omaha Nation was one of the most welcoming of the Native American tribes, never resisting the influx of European explorers and traders. They even fought alongside Union troops during the American Civil War, and have stood by the US people ever since. Regardless, the Omaha people lost most of their land, and now reside on the Omaha Reservation in northeastern Nebraska and western Iowa."
Popular sashimi tuna.   		3 letters,"AHI.    	Yellowfin tuna is usually marketed as ""ahi"", its Hawaiian name. Yellowfin tuna is one big fish, often weighing over 300 pounds."
Job listing inits.   		3 letters,EEO.    	Equal Employment Opportunity (EEO) is a term that has been around since 1964 when the Equal Employment Commission was set up by the Civil Rights Act.
Hammer site.   		3 letters,"EAR.    	The middle ear is the portion of the ear immediately behind the eardrum. The middle ear contains three small bones called the ossicles, the three smallest bones in the human body. The ossicles' job is to transmit sound from the outer ear to the inner ear. The shape of the bones gives rise to their common names: the hammer, anvil and stirrup."
What framed Roger Rabbit?.   		3 letters,"CEL.    	In the world of animation, a cel is a transparent sheet on which objects and characters are drawn. In the first half of the 20th century the sheet was actually made of celluloid, giving the ""cel"" its name."
