Carrier to Oslo.   		3 letters,"SAS.    	SAS, formerly known as Scandinavian Airlines System, is the flag carrier of three countries: Denmark, Norway and Sweden."
"What some bombs result in, in brief.   		3 letters","TDS.    	In American football, a 'bomb' is a long forward pass."
Flying Cloud maker.   		3 letters,"REO.    	The REO Motor Company was founded by Ransom E. Olds (hence the name REO). The company made cars, trucks and buses, and was in business from 1905 to 1975 in Lansing, Michigan."
Fictional corporation that made a jet-propelled unicycle.   		4 letters,"ACME.    	The Acme Corporation is a fictional company used mainly by Looney Tunes, and within the Looney Tunes empire it was used mostly in the ""Road Runner"" cartoons. Wile E. Coyote was always receiving a new piece of gear from Acme designed to finally capture the Road Runner, but the equipment always led to his downfall instead."
Cable alternative.   		3 letters,"DSL.    	The acronym 'DSL' originally stood for Digital Subscriber Loop, but is now accepted to mean (Asymmetric) Digital Subscriber Line. DSL is the technology that allows Internet service be delivered down the same telephone line as voice service, by separating the two into different frequency signals."
"Band with the 1991 hit ""Shiny Happy People"".   		3 letters","REM.    	R.E.M. was a rock band from Athens, Georgia formed in 1980. The name 'R.E.M.' was chosen randomly from a dictionary, apparently."
Flight board abbr..   		3 letters,ARR.    	Arrival (arr.)
"Who said ""The revolution is not an apple that falls when it is ripe.   		3 letters","CHE.    	Ernesto ""Che"" Guevara was born in Argentina, and in 1948 he started to study medicine at the University of Buenos Aires. While at school he satisfied his need to ""see the world"" by taking two long journeys around South America, the story of which are told in Guevara's memoir later published as ""The Motorcycle Diaries"". While travelling, Guevara was moved by the plight of the people he saw and their working conditions and what he viewed as capitalistic exploitation. In Mexico City he met brothers Raul and Fidel Castro and was persuaded to join their cause, the overthrow of the US-backed government in Cuba. He rose to second-in-command among the Cuban insurgents, and when Castro came to power Guevara was influential in repelling the Bay of Pigs Invasion and bringing Soviet nuclear missiles to the island. Guevara left Cuba in 1965 to continue his work as a revolutionary. He was captured by Bolivian forces in 1967, and was executed. Fidel Castro led the public mourning of Guevara's death, and soon the revolutionary was an icon for many left-wing movements around the world."
"Wino's affliction, for short.   		3 letters","DTS.    	The episodes of delirium that can accompany withdrawal from alcohol are called Delirium Tremens (the DTs). The literal translation of this Latin phrase is ""trembling madness""."
Peak.   		4 letters,"ACME.    	The ""acme"" is the highest point, coming from the Greek word ""akme"" which has the same meaning."
Israeli seaport.   		4 letters,"ACRE.    	Acre is a port city in northern Israel, on Haifa Bay."
Genesis victim.   		4 letters,"ABEL.    	The story of Cain and Abel not only appears in the Bible. It also features in the Qur'an, where the brothers are named Kabil and Habil."
Burlesque garment.   		3 letters,"BRA.    	'Burlesque' came into English from French, although the word is rooted in the Italian 'burla', the word for a joke, or mockery. A burlesque is work of literature, drama or music that is intended to amuse and cause laughter. Burlesques in the US took on a variety show format and were popular in the US from the 1860s. Over time, the variety acts started to include female striptease, and the term 'burlesque' has come to be mainly associated with such entertainment."
Uncle ___.   		3 letters,"SAM.    	The Uncle Sam personification of the United States was first used during the War of 1812. The 'Uncle Sam' term was so widely accepted that even the Germans used it during WWII, choosing the code word ""Samland"" for ""America"" in intelligence communiques."
One skilled in CPR.   		3 letters,"EMT.    	Cardiopulmonary resuscitation (CPR) used to involve the simultaneous compression of the chest to pump blood using the heart, and artificial respiration by blowing air into the lungs. Nowadays emergency services are placing more emphasis on the heart compressions, and less on the artificial respiration."
"Big brother's victim, once.   		4 letters","ABEL.    	In the story of Cain and Abel in the Book of Genesis, Cain murders his brother Abel. Subsequently, God asks Cain, 'Where is Abel thy brother?' Cain replies, 'I do not know. Am I my brother's keeper?'"
Mishmash.   		4 letters,"OLIO.    	'Olio' is a term meaning a hodgepodge or a mixture, coming from the mixed stew of the same name. The stew in turn takes its name from the Spanish ""olla"", the clay pot used for cooking."
"Hand-held organizer, briefly.   		3 letters","PDA.    	A device like perhaps an iPhone, Droid, or Treo can be termed a Personal Digital Assistant (PDA)."
Gerald Ford's birthplace.   		5 letters,"OMAHA.    	President Gerald Ford was well known for his athletic prowess. He was the star football player both in his high school and later at the University of Michigan. After graduation, President Ford received two offers to play in the NFL, from the Detroit Lions and the Green Bay Packers. He turned down both teams opting instead to take a coaching position at Yale giving him the opportunity to apply to Yale Law School. But young Mr. Ford's plan backfired as Yale Law School turned him down because of his full-time commitment to sports, coaching football, boxing and teaching JV cheer-leading. It took three years for President Ford to make it into Yale Law School, but he finally got there, in 1938."
"When planes are due in, for short.   		4 letters",ETAS.    	Estimated time of arrival (ETA)
Auto loan inits.   		3 letters,APR.    	APR: Annual Percentage Rate.
Finnair alternative.   		3 letters,"SAS.    	SAS was formerly known as Scandinavian Airlines System and is the flag carrier of three countries: Denmark, Norway and Sweden."
Reqmt.   		4 letters,LSAT.    	The Law School Admission Test (LSAT) has been around since 1948.
Stravinsky or Sikorsky.   		4 letters,"IGOR.    	The classical composer Igor Stravinsky's most famous works were completed relatively early in his career, when he was quite young. His three ballets ""The Firebird"", ""Petrushka"" and ""The Rite of Spring"" were published in 1910-1913, when Stravinsky was in his early thirties."
"""The Power to Surprise"" sloganeer.   		3 letters","KIA.    	Kia Motors is the second largest manufacturer of cars in South Korea, behind Hyundai (and Hyundai is a part owner in Kia now). In recent years, Kia has focused on sales into Europe, and has been remarkably successful."
"Gridiron scores, for short.   		3 letters",TDS.    	Touchdowns (TDs)
Admiral Zumwalt.   		4 letters,"ELMO.    	When Elmo Zumwalt was made Rear Admiral during the Vietnam War, he was put in command of the famous flotilla of Swift Boats that patrolled coasts, harbors and rivers. In 1970, he was made Chief of Naval Operations, and at 49 years of age, he was the youngest man to hold that post. His tenure at Chief of Naval Operations was noted for the progress he made in easing racial tension in the service, and promoting gender equality."
Pierce portrayer.   		4 letters,"ALDA.    	Hawkeye Pierce is the lead character in the 'M*A*S*H' novel, movie and TV series. Hawkeye was originally portrayed by Donald Sutherland in the film, and then by Alan Alda in the television show. Pierce is the only character appearing in all 250 episodes of the groundbreaking TV series."
"Alan of ""The Aviator"".   		4 letters","ALDA.    	Alan Alda has had a great television career, especially of course on ""M*A*S*H"". Alda won his first Emmy in 1972, for playing Hawkeye Pierce on ""M*A*S*H"". He won his most recent Emmy in 2006 for his portrayal of Presidential candidate Arnold Vinick in 'The West Wing'. When it comes to the big screen, my favorite of Alda's movies is the 1978 romantic comedy ""Same Time, Next Year"" in which he starred opposite Ellen Burstyn."
___ tide.   		4 letters,"NEAP.    	Tides are caused by the gravitational pull of the moon on the oceans. At neap tide, the smaller gravitational effect of the sun cancels out some of the moon's effect. At spring tide, the sun and the moon's gravitational forces act in concert causing more extreme movement of the oceans."
Actress Vardalos.   		3 letters,"NIA.    	Not only is the delightful Nia Vardalos the star of the 2002 hit movie ""My Big Fat Greek Wedding"", she also wrote the screenplay. The film never made it to number one at the box office, but it still pulled in more money than any other movie in history that didn't make it to number one. That record I think reflects the fact that the film wasn't a blockbuster but rather a so-called ""sleeper hit"", a movie that people went to see based on referrals from friends. The big fat mistake came when a spin-off TV show was launched called ""My Big Fat Greek Life"". It ran for only 7 episodes."
"Word missing twice in the Beatles' ""___ Said ___ Said"".   		3 letters","SHE.    	She Said She Said' is a song attributed to Lennon-McCartney, although it was actually written by Lennon. In fact, McCartney didn't even play or sing in the original recording 1996 recording, a track on the ""Revolver"" album."
"Here, to Henri.   		3 letters",ICI.    	'Ici' is French for 'here'.
Southeast Asian language.   		3 letters,"LAO.    	Lao, the language of Laos, does not use spaces between words (or periods!), although this is apparently changing. Spaces are used between sentences and clauses."
Fish on many a sashimi platter.   		3 letters,"AHI.    	Yellowfin tuna is usually marketed as ""ahi"", its Hawaiian name. Yellowfin tuna is one big fish, often weighing over 300 pounds."
"Reason for some averted looks, for short.   		3 letters",PDA.    	PDA is an abbreviation for 'public display of affection'.
Civil War inits.   		3 letters,CSA.    	The Confederate States of America (CSA) set up government in 1861 just before Abraham Lincoln took office. Jefferson Davis was selected as President of the CSA at its formation and retained the post for the life of the government.
Captain of fiction.   		4 letters,"NEMO.    	In the 1954 movie version of ""20,000 Leagues Under the Sea"", Captain Nemo goes down with his ship. In the novel by Jules Verne the fate of Nemo and his crew isn't quite so cut and dry, although the inference is perhaps that they did indeed head for Davy Jones' Locker."
"Witherspoon of ""Wild"".   		5 letters",REESE.    	Reese is not actually actress Witherspoon's given name. She started out life as Laura Jeanne Witherspoon. Reese is her mother's maiden name.
Badlands feature.   		4 letters,"MESA.    	""Mesa"" is the Spanish for ""table"" and is of course is how we get the term ""mesa"" that describes a geographic feature. ""What's the difference between a butte and a mesa?"" I hear you cry! Both are hills with flat tops, but a mesa has a top that is wider than it is tall. A butte is a much narrower formation, taller than it is wide. Now we know ..."
Possible IV pusher.   		3 letters,EMT.    	An Emergency Medical Technician on occasion has to push an intravenous needle into a patient's vein.
Fair-hiring inits.   		3 letters,"EEO.    	Equal Employment Opportunity (EEO) is a term that has been around since 1964 when the Equal Employment Opportunity Commission (EEOC) was set up by the Civil Rights Act. Title VII of the Act prohibits employers from discriminating against employees on the basis of sex, race, color, national origin or religion."
"Goals of some drives, for short.   		3 letters",TDS.    	Touchdowns (TDs)
Former pres.   		3 letters,CSA.    	The Confederate States of America (CSA) set up government in 1861 just before Abraham Lincoln took office. Jefferson Davis was selected as President of the CSA at its formation and retained the post for the life of the government.
"Smith who sang the theme for ""Spectre"".   		3 letters","SAM.    	Sam Smith is a singer from London. I think that the only thing I've heard of his is the theme song from the 2015 James Bond movie 'Spectre', which is called 'Writing's on the Wall'."
"""The Situation Room"" airer.   		3 letters","CNN.    	""The Situation Room"" is a CNN news show aired in the afternoons, and hosted by Wolf Blitzer. I'm not a big fan, to be honest ..."
Grp.   		4 letters,"OPEC.    	The Organization of the Petroleum Exporting Countries (OPEC) was founded in 1960 at a conference held in Baghdad, Iraq that was attended by Iraq, Kuwait, Iran, Saudi Arabia and Venezuela. Nine more countries joined the alliance soon after, and OPEC set up headquarters in Geneva, Switzerland and then Vienna, Austria in 1965. The basic aim of OPEC was to wrench control of oil prices from the oil companies and to put it in the hands of the sovereign states that own the natural resource."
The Wizard of ___ (nickname of Warren Buffett).   		5 letters,"OMAHA.    	Warren Buffett is one of my heroes, a man with the nickname 'Wizard of Omaha'. Despite being one of the wealthiest men in the world, he lives a relatively frugal and modest life. Buffett also has a very Jeffersonian attitude towards the role his wealth plays within his family. He has set up his estate so that his children get enough money to be independent, but the vast majority of his assets are going to charity, both before and after he dies."
Scores by RBs and WRs.   		3 letters,"TDS.    	In football, running backs (RBs) and wide receivers (WRs) often score touchdowns (TDs)."
Open courts.   		5 letters,"ATRIA.    	In modern architecture an atrium is a large open space, often in the center of a building and extending upwards to the roof. The original atrium was an open court in the center of an Ancient Roman house. One could access most of the enclosed rooms of the house from the atrium."
"Bit of body art, for short.   		3 letters","TAT.    	The word ""tattoo"" was first used in English in the writings of the famous English explorer Captain Cook. In his descriptions of the indelible marks adorning the skin of Polynesian natives, he anglicized the Tahitian word ""tatau"" into our ""tattoo""."
Geographical formation whose name is Spanish for 9-Down.   		4 letters,"MESA.    	""Mesa"" is the Spanish for ""table"" and is of course is how we get the term ""mesa"" that describes a geographic feature."
Wife of Albert Einstein.   		4 letters,"ELSA.    	Einstein was Elsa's family name after she married Einstein, and also beforehand. Elsa and Albert were first cousins."
Raison d'___.   		4 letters,"ETRE.    	""Raison d'être"" is a French phrase meaning ""reason for existence""."
"Witherspoon of ""Legally Blonde"".   		5 letters",REESE.    	Reese is not actually actress Witherspoon's given name. She started out life as Laura Jeanne Witherspoon. Reese is her mother's maiden name.
Cartel acronym.   		4 letters,"OPEC.    	The OPEC cartel (the Organization of the Petroleum Exporting Countries) was formally established in 1960 and has been headquartered in Vienna since 1965. The US is actually the third largest oil producer in the world (after Russia and Saudi Arabia). One reason America isn't in OPEC, even though we are a big producer, is that we import a lot more than we export. But you probably knew that already ..."
Today preceder.   		3 letters,"USA.    	The title of widest circulation of any American newspaper is an honor competed for by ""The Wall Street Journal"" and ""USA Today"", with each paper selling about 2 million copies daily (including online subscribers). ""USA Today"" was launched in 1982."
___ Records.   		3 letters,"EMI.    	EMI was a British music company, with the acronym originally standing for Electric and Musical Industries."
Automaker that started as a bicycle company.   		3 letters,"KIA.    	Kia Motors is the second largest manufacturer of cars in South Korea, behind Hyundai (and Hyundai is a part owner in Kia now). Kia is the oldest car company in the country, and was founded in 1944 as a manufacturer of steel tubing and bicycle parts. The company introduced a line of bicycles in 1951, motorcycles in 1957, trucks in 1962 and cars in 1974."
Ne plus ultra.   		4 letters,"ACME.    	""Ne plus ultra"" is French for ""no more beyond"" and means just that in English, the high-point."
Farm unit.   		4 letters,"ACRE.    	At one time, an acre was defined as the amount of land a yoke of oxen could plow in a day. This was more precisely defined as a strip of land one furlong long (660 feet) and one chain wide (66 feet). The word ""furlong"" is actually derived from the Old English words meaning ""furrow long"", the length of the furrow plowed by the oxen."
London-based record label.   		3 letters,"EMI.    	EMI is a British music company, with the acronym originally standing for Electric and Musical Industries."
"Long of Showtime's ""House of Lies"".   		3 letters","NIA.    	Nia Long is an American actress, probably best known for playing Will Smith's sometime girlfriend and fiancee Lisa Wilkes on the TV show ""The Fresh Prince of Bel Air""."
Quod ___ faciendum.   		4 letters,"ERAT.    	'Quod erat faciendum' (QEF) is similar to the phrase 'quod erat demonstrandum' (QED), both of which were used by Euclid in his theorems. 'Quod erat faciendum' means 'what was to have been done', and is used at the end of a proposition that was not intended as a proof, but rather as a construction."
Southeast Asian tongue.   		3 letters,"LAO.    	The Lao people are an ethnic group found mainly in Laos, but who also have a significant presence in Thailand, Cambodia and Vietnam."
Southeast Asian language.   		3 letters,"LAO.    	The official name for the country of Laos is the Lao People's Democratic Republic. In the Lao language, the country's name is ""Meuang Lao"". The French ruled Laos as part of French Indochina, having united three separate Lao kingdoms. As there was a plural of ""Lao"" entities united into one, the French added the ""S"" and so today we tend to use ""Laos"" instead of ""Lao""."
Mai ___.   		3 letters,"TAI.    	The Mai Tai cocktail is strongly associated with the Polynesian islands, but the drink was supposedly invented in 1944 in Trader Vic's restaurant in Oakland, California. One recipe is 6 parts white rum, 3 parts orange curaçao, 3 parts Orgeat syrup, 1 part rock candy syrup, 2 parts fresh lime juice, all mixed with ice and then a float added of 6 parts dark rum."
"Actor Ed who voiced Carl Fredricksen in ""Up"".   		5 letters","ASNER.    	""Up"" is the tenth movie released by Pixar studios, featuring wonderful animation as we have come to expect from Pixar. The film earned itself two Academy Awards. The main voice actor is Ed Asner, whose animated persona as Carl Fredricksen was created to resemble Spencer Tracy, as Tracy appeared in his last film, 'Guess Who's Coming to Dinner'."
Way up a slope.   		5 letters,"T-BAR.    	A T-bar is a type of ski lift in which the skiers are pulled up the hill in pairs, with each pair sitting either side of T-shaped metal bar. The bar is placed behind the thighs, pulling along the skier who remains standing on his/her skis (hopefully!). There's also a J-bar, a similar device, but with each J-shaped bar used by one skier at a time."
Ed of Hollywood.   		5 letters,"ASNER.    	Ed Asner is most famous for playing the irascible but lovable Lou Grant on ""The Mary Tyler Moore Show"" and the spin-off drama ""Lou Grant"". Off-screen Asner is noted for his political activism. He served two terms as president of the Screen Actors Guild, and was very involved in the 1980 SAG strike. When ""Lou Grant"" was cancelled in in 1982, despite decent ratings, there was a lot of talk that the cancellation was a move by the network against Asner personally. In fact, one of Anser's activist colleagues, Howard Hesseman (who played Johnny Fever) found that his show, ""WKRP in Cincinnati"" was also cancelled, on the very same day."
"The ""E"" of Q.E.D.   		4 letters","ERAT.    	QED is used at the end of a mathematical proof or a philosophical argument. The QED acronym stands for the Latin ""quod erat demonstrandum"" meaning ""that which was to be demonstrated""."
Candy man.   		5 letters,"REESE.    	Reese's Peanut Butter Cups were invented by Harry Burnett ""H.B."" Reese. Peanut Butter Cups were originally called penny cups, reflecting the price at which they were sold. The inflation took over ..."
Carrier in the Star Alliance.   		3 letters,"SAS.    	SAS (Scandinavian Airlines System) is a founding member of the Star Alliance, the first airline alliance, created in 1997. The American founding representative is United Airlines."
Candy pioneer H.   		5 letters,"REESE.    	Reese's Peanut Butter Cups were invented by Harry Burnett ""H.B."" Reese. Peanut Butter Cups were originally called penny cups, reflecting the price at which they were sold. Then inflation took over, and maybe that's why they were broken into smaller 'pieces' ..."
Smorgasbord.   		4 letters,"OLIO.    	Olio is a term meaning a hodgepodge or a mixture, coming from the mixed stew of the same name. The stew in turn takes its name from the Spanish ""olla"", the clay pot used for cooking."
First name of an Oscar-nominated actress of 1957.   		4 letters,ELSA.    	Elsa Lanchester was an English actress who made her life and career in Hollywood. Lanchester's husband was the actor Charles Laughton.
H.M.S.   		3 letters,"HER.    	The ship prefix 'HMS' is used by the warships of the Royal Navy, and stands for 'Her/His Majesty's Ship/Submarine'. The prefix 'RMS' is used by ships of the merchant navy, and stands for 'Royal Mail Ship/Steamer'."
Plot element?.   		4 letters,"ACRE.    	At one time, an acre was defined as the amount of land a yoke of oxen could plow in a day. Eventually, this was more precisely delineated as a strip of land one furlong long (660 feet) and one chain wide (66 feet). The word ""furlong"" is actually derived from the Old English words meaning ""furrow long"", the length of the furrow plowed by the oxen."
"Vardalos of ""My Big Fat Greek Wedding"".   		3 letters","NIA.    	Not only is the delightful Nia Vardalos the star of the 2002 hit movie ""My Big Fat Greek Wedding"", she also wrote the screenplay. The film never made it to number one at the box office, but it still pulled in more money than any other movie in history that didn't make it to number one. That record I think reflects the fact that the film wasn't a blockbuster but rather a so-called ""sleeper hit"", a movie that people went to see based on referrals from friends. The big fat mistake came when a spin-off TV show was launched, ""My Big Fat Greek Life"". It ran for only 7 episodes."
Canon offering.   		3 letters,"EOS.    	In Greek mythology, Eos is the goddess of the dawn who lived at the edge of the ocean. Eos would wake each morning to welcome her brother Helios the sun. The Roman equivalent of Eos is Aurora."
"""Cheers"" bartender.   		3 letters","SAM.    	On the sitcom ""Cheers"", barman Sam Malone was played by Ted Danson. Malone was a retired relief pitcher for the Boston Red Sox, and a recovering alcoholic. Great show ..."
It includes an analytical reasoning sect.   		4 letters,LSAT.    	The Law School Admission Test (LSAT) has been around since 1948.
Volkswagen model starting in 2006.   		3 letters,EOS.    	Volkswagen introduced the EOS in 2006 as the successor to the Golf Cabriolet.
Capitol Records' parent co.   		3 letters,"EMI.    	EMI is a British music company, with the acronym originally standing for Electric and Musical Industries."
French/Belgian river.   		4 letters,"YSER.    	The Yser is a river that originates in northern France and flows through Belgium into the North Sea. The Yser is often associated with WWI as it figured in a major battle early in the conflict. In the first three months of the war, the German Army pushed almost completely through Belgium, inflicting heavy losses on the Belgian Army as the defenders were forced to fight a fast-moving rearguard action. The Germans were intent on pushing right through Belgium and across France in a ""race to the sea"". But the Belgians, with the help of their Allies, decided to make a final stand at the Yser Canal in an effort to prevent the Germans reaching the French ports of Calais and Dunkirk. The 22-mile long defensive line was chosen at the Yser because the river and canal system could be flooded to create a barrier that might be defended. The plan was successful and the front was ""stabilized"". As we now know, millions of lives were lost over the coming years with very little movement of that battle line."
Lanchester of film.   		4 letters,ELSA.    	Elsa Lanchester was an English actress who made her life and career in Hollywood. Lanchester's husband was the actor Charles Laughton.
Literary Jane.   		4 letters,"EYRE.    	""Jane Eyre"" is of course the novel written by Charlotte Brontë, under the pen name Currer Bell. Over the years, I've shared here on my blogs that the ""Jane Eyre"" story line is a little too dark and Gothic for my taste, but a very persuasive blog reader convinced me to look more at the romantic side of the story and give it a second chance. I watched a wonderful 4-hour television adaptation of the novel made by the BBC a while back and I have to say that because I was focused on the relationship between Jane and Rochester, I was able to push past the Gothic influences (that depress me) so I really enjoyed the story. I thoroughly recommend the 2006 BBC adaptation to fans of the novel."
