Film canine.   		4 letters,"ASTA.    	Asta was the wonderful little dog in the superb movie ""The Thin Man"" starring William Powell and Myrna Loy (as Nick and Nora Charles). In the original story by Dashiell Hammett, Asta was a female Schnauzer, but on screen Asta was played by a wire-haired fox terrier called ""Skippy"". Skippy was also the dog in ""Bringing up Baby"" with Cary Grant and Katherine Hepburn, the one who kept stealing the dinosaur bone. Skippy retired in 1939, so Asta was played by other dogs in the remainder of ""The Thin Man"" films."
"""No drama"" president.   		5 letters","OBAMA.    	President Obama's presidential campaign was noted for being cautious and meticulous, earning him the nickname 'No Drama Obama'."
Cry at the World Cup.   		3 letters,"OLE.    	The next three FIFA World Cup tournaments (soccer) will be hosted by Brazil (2014), Russia (2018) and Qatar (2022)."
Watson of the Harry Potter films.   		4 letters,"EMMA.    	Emma Watson is the English actress famous for playing Hermione Granger in the 'Harry Potter' movies. Watson is continuing her education while pursuing her acting career, and studied at Brown University in Providence, Rhode Island."
"""___ go bragh!"".   		4 letters","ERIN.    	'Erin go bragh!' is an anglicization of an Irish phrase 'Éirinn go Brách!', which translates as 'Ireland Forever!'"
Music genre of the Mighty Mighty Bosstones.   		3 letters,"SKA.    	Ska originated in Jamaica in the late fifties, and was the precursor to reggae music. No one has a really definitive etymology of the term ""ska"", but it is likely to be imitative of some sound."
Pre-coll.   		4 letters,"ELHI.    	""Elhi"" is an informal word used to describe anything related to schooling from grades 1 through 12, i.e. elementary through high school."
"Pre-coll., in education.   		4 letters","ELHI.    	""Elhi"" is an informal word used to describe anything related to schooling from grades 1 through 12, i.e. elementary through high school."
___ Dome (old Colts home).   		3 letters,"RCA.    	The RCA Dome was probably better known as the Hoosier dome, home to the Indianapolis Colts from 1984-2007. It was torn down in 2008, but the inflated roof was put to good use afterwards. The material was re-purposed by local artisans, creating wallets, messenger bags etc. These can still be purchased, with proceeds going to charity."
Art Deco icon.   		4 letters,"ERTE.    	Erté was the pseudonym of French artist (Russian born) Romain de Tirtoff. Erté is the French pronunciation of his initials ""R.T."""
"""The Lord of the Rings"" creature.   		3 letters","ORC.    	According to Tolkien, Orcs are small humanoids that live in his fantasy world of Middle-earth. They are very ugly and dirty, and are fond of eating human flesh."
"Poehler of ""Parks and Recreation"".   		3 letters","AMY.    	Amy Poehler was a cast member on ""Saturday Night Live"" from 2001 to 2008, notable for appearing in many great sketches, including those where she played Hillary Clinton opposite Tina Fey's Sarah Palin. Poehler also starred with Fey in the 2008 movie ""Baby Mama"", and now has her own show on NBC called ""Parks and Recreation""."
Org.   		3 letters,"NBA.    	Basketball is truly an American sport. It was created in 1891 by a James Naismith at the YMCA in Springfield, Massachusetts. His goal was to create something active and interesting for his students in the gym. The first ""hoops"" were actually peach baskets, with the bottoms of the baskets intact. When a player got the ball into the ""net"", someone had to clamber up and get the ball back out again in order to continue the game!"
"Morales of HBO's ""The Brink"".   		4 letters","ESAI.    	The actor Esai Morales is best known for his role in the 1987 movie ""La Bamba"", which depicted the life of Ritchie Valens and his half-brother Bob Morales (played by Esai)."
"Wheels-up announcement, briefly.   		3 letters",ETD.    	Estimated Time of Departure (ETD).
Dress in Delhi.   		4 letters,"SARI.    	The item of clothing called a ""sari"" (also ""saree"") is a strip of cloth, as one might imagine, unusual perhaps in that is unstitched along the whole of its length. The strip of cloth can range from four to nine meters long (that's a lot of material!). The sari is usually wrapped around the waist, then draped over the shoulder leaving the midriff bare. I must say, it can be a beautiful item of clothing."
Canaries locale: Abbr..   		3 letters,"ATL.    	The Canary Islands are located off the northwest coast of Africa. The islands aren&#8217;t  named for the canary bird and in fact the bird is named for the islands. The Canary Islands name comes from the Latin 'Canariae Insulae' which translates as 'Island of the Dogs', the original name for the biggest island now called Gran Canaria. In the days of Ancient Rome the island was noted as a home to a large number of very large dogs."
Lao-___.   		3 letters,TSE.    	Lao Tse (also Lao-Tzu) was a central figure in the development of the religion/philosophy of Taoism.
"""Garfield"" dog.   		4 letters","ODIE.    	Odie is Garfield's best friend and is a slobbery beagle, a character in Jim Davis's comic strip named 'Garfield'."
Requiem Mass word.   		4 letters,"IRAE.    	""Dies Irae"" is Latin for ""Day of Wrath"". It is the name of a famous melody in Gregorian Chant, one that is often used as part of the Roman Catholic Requiem Mass."
"""Farewell, Françoise"".   		5 letters","ADIEU.    	""Adieu"" is the French for ""goodbye"" or ""farewell"", from ""à Dieu"" meaning ""to God"". The plural of 'adieu' is 'adieux'."
Enero through diciembre.   		3 letters,"ANO.    	In Spanish, a year (año) starts in January (Enero) and ends in December (Diciembre)."
Mayo is in it.   		3 letters,"ANO.    	In Spain, as well in the English-speaking world, May (Mayo) is a month in the year (ano)."
"Secretary on ""The Office"".   		4 letters","ERIN.    	When Pam gave up her spot at the reception desk in the US version of the hit sitcom ""The Office"", it was taken over by Kelly Erin Hannon. Erin, as she is known, is played by Ellie Kemper. Kemper had auditioned for the sitcom ""Parks and Recreation"" but didn't get the part. However, she did get a call back to play on ""The Office"". I think it's a great show, and the addition of the character called Erin adds a lot ..."
"Subject of the 2002 book ""The Perfect Store"".   		4 letters","EBAY.    	eBay is an auction site with a twist. If you don't want to enter into an auction to purchase an item, there's a ""Buy It Now"" price. Agree to pay it, and the item is yours!"
N.B.A.   		6 letters,"O'NEAL.    	Shaquille O'Neal is one of the heaviest players ever to have played in the NBA (weighing in at around 325 pounds). Yep, he's a big guy: 7 foot 1 inch tall, and size 22 shoes."
"Mont Blanc, e.g.   		3 letters","ALP.    	Mont Blanc is the highest mountain in the Alps. The name ""Mont Blanc"" translates from French into ""white mountain"". The mountain lies on the border between France and Italy, and it has been generally accepted for decades that the summit lies within French territory. However, there have been official claims that the summit does in fact fall within the borders of Italy."
Brand of literature.   		5 letters,"ETHAN.    	Nathaniel Hawthorne wrote the short story ""Ethan Brand - A Chapter from an Abortive Romance"", in 1850."
"""The Thin Man"" pooch.   		4 letters","ASTA.    	Asta is the wonderful little dog in the superb ""The Thin Man"" series of films starring William Powell and Myrna Loy (as Nick and Nora Charles). In the original story by Dashiell Hammett, Asta was a female Schnauzer, but on screen Asta was played by a wire-haired fox terrier called ""Skippy"". Skippy was also the dog in ""Bringing up Baby"" with Cary Grant and Katharine Hepburn, the one who kept stealing the dinosaur bone. Skippy retired in 1939, so Asta was played by other dogs in the remainder of ""The Thin Man"" films."
"""Man of Steel"" actress Adams.   		3 letters","AMY.    	Amy Adams is an American actress. My favorite film of hers so far is the outstanding ""Julie & Julia"" in which she acted alongside Meryl Streep. I highly recommend this truly delightful movie."
Noah's escape.   		3 letters,"ARK.    	The term 'ark', when used with reference to Noah, is a translation of the Hebrew word 'tebah'. The word 'tebah' is also used in the Bible for the basket in which Moses was placed by his mother when she floated him down the Nile. It seems that the word 'tebah' doesn't mean 'boat' and nor does it mean 'basket'. Rather, a more appropriate translation is 'life-preserver' or 'life-saver'. So, Noah's ark was Noah's life-preserver during the flood."
When a plane is due to take off: Abbr..   		3 letters,ETD.    	Expected time of departure (ETD)
Zenith competitor.   		3 letters,"RCA.    	During WWI, the US government actively discouraged the loss of certain technologies to other countries, including allies. The developing wireless technologies were considered to be particularly important by the army and navy. The government prevented the General Electric Company from selling equipment to the British Marconi Company, and instead facilitated the purchase by GE of the American Marconi subsidiary. This purchase led to GE forming the Radio Corporation of America that we know today as RCA."
Couples' getaway?.   		3 letters,"ARK.    	Genesis 6:19-20 states that Noah was instructed to take two animals of every kind into the ark. Later, in Genesis 7:2-3 Noah was instructed to take on board ""every clean animal by sevens ... male and female, to keep offspring alive on the face of all the earth"". Apparently ""extras"" (7 rather than 2) were needed for ritual sacrifice."
Jamaican genre.   		3 letters,"SKA.    	Ska originated in Jamaica in the late fifties and was the precursor to reggae music. No one has a really definitive etymology of the term ""ska"", but it is likely to be imitative of some sound."
China's Lao-___.   		3 letters,TSE.    	Lao Tse (also Lao-Tzu) was a central figure in the development of the religion/philosophy of Taoism.
Art Deco icon.   		4 letters,"ERTE.    	Erté was the pseudonym of French artist (Russian born) Romain de Tirtoff. Erté is the French pronunciation of his initials ""R.T."""
St.   		4 letters,"ERIN.    	The Latin word for Ireland is Hibernia. Erin is an anglicized version of ""Eire"", the Irish word for Ireland (actually it corresponds to Eirinn, the dative case of Eire)."
Big inits.   		3 letters,"STP.    	STP motor oil takes its name from ""Scientifically Treated Petroleum""."
H.   		4 letters,"ELOI.    	In the 1895 novel by H. G. Wells called ""The Time Machine"", there are two races that the hero encounter in his travels into the future. The Eloi are the 'beautiful people' who live on the planet's surface. The Morlocks are a race of cannibals living underground who use the Eloi as food."
Common URL ending.   		3 letters,EDU.    	Internet addresses (like NYTCrossword.com and LAXCrossword.com) are more correctly called Uniform Resource Locators (URLs).
Ship that was double-booked?.   		3 letters,"ARK.    	Genesis 6:19-20 states that Noah was instructed to take two animals of every kind into the ark. Later, in Genesis 7:2-3 Noah was instructed to take on board ""every clean animal by sevens ... male and female, to keep offspring alive on the face of all the earth"". Apparently ""extras"" (7 rather than 2) were needed for ritual sacrifice."
URL ender.   		3 letters,EDU.    	The .edu domain was one of the six original generic top-level domains specified. The complete original list is:
Elusive legend.   		4 letters,"YETI.    	A yeti is a beast of legend, also called an abominable snowman. ""Yeti"" is a Tibetan term, and the beast is fabled to live in the Himalayan regions of Nepal and Tibet. Our equivalent legend in North America is that of Bigfoot, also known as Sasquatch. The study of animals whose existence have not yet been substantiated is called cryptozoology."
___-Cat.   		3 letters,"SNO.    	The brand name Sno-Cat is owned by the Tucker company. All ""snowcats"" are tracked vehicles built to work in snow, famously used in expeditions to the polar regions. The modern Sno-Cat from Tucker differs from its competitors in that it has four, independently-mounted tracks."
"Scott of ""Parks and Recreation"".   		4 letters","ADAM.    	Adam Scott is an actor from Santa Cruz, California who is best known for playing Ben Wyatt on the hit sitcom 'Parks and Recreation'."
Place for an île.   		3 letters,"MER.    	The French would find ""une ile"" (an island) in ""la mer"" (the sea)."
"""___ / Had 'em"" (classic two-line poem about fleas).   		4 letters","ADAM.    	Some say that the world's shortest poem is titled 'Fleas', and the full text is:"
"""Bonanza"" brother.   		4 letters","ADAM.    	On the TV show 'Bonanza', the character named Adam was one one of the Cartwright sons, the others being Hoss and Little Joe. Adam was played by actor Pernell Roberts."
___ Guevara.   		3 letters,"CHE.    	Ernesto ""Che"" Guevara was born in Argentina, and in 1948 started to study medicine at the University of Buenos Aries. While at school he satisfied his need to ""see the world"" by taking two long journeys around South America, the story of which are told in Guevara's memoir later published as ""The Motorcycle Diaries"". While travelling, Guevara was moved by the plight of the people he saw and their working conditions and what he viewed as capitalistic exploitation. He dropped out of medical school and became involved in social reform in Guatemala. In Mexico City he met brothers Raul and Fidel Castro and was persuaded to join their cause, the overthrow of the US-backed government in Cuba. He rose to second-in-command among the Cuban insurgents, and when Castro came to power Guevara was influential in repelling the Bay of Pigs Invasion and bringing Soviet nuclear missiles to the island. Guevara left Cuba in 1965 to continue his work as a revolutionary. He was captured by Bolivian forces in 1967, and was executed. Fidel Castro led the public mourning of Guevara's death, and soon the revolutionary was an icon for many left-wing movements around the world."
Iowa State locale.   		4 letters,"AMES.    	Iowa State University of Science and Technology (ISU) is located in Ames, Iowa. Among many other notable events, ISU created the country's first school of veterinary medicine, in 1879. The sports teams of ISU are known as the Cyclones."
"""The Lord of the Rings"" baddie.   		3 letters","ORC.    	Orcs are mythical humanoid creatures that appear in the writings of J. R. R. Tolkien. Since Tolkien's use of orcs, they have also been featured in other fantasy fiction and in fantasy games."
Abominable Snowman.   		4 letters,"YETI.    	A yeti is a beast of legend, also called an abominable snowman. ""Yeti"" is a Tibetan term, and the beast is fabled to live in the Himalayan regions of Nepal and Tibet. Our equivalent legend in North America is that of Bigfoot, also known as Sasquatch. The study of animals whose existence have not yet been substantiated is called cryptozoology."
"Wynken, Blynken and Nod, e.g.   		4 letters","TRIO.    	Wynken, Blynken and Nod' is a children's poem written by Eugene Field, first published in 1889. The original title of the work was 'Dutch Lullaby'."
"Web site with a ""Buy It Now"" option.   		4 letters","EBAY.    	eBay is an auction site with a twist. If you don't want to enter into an auction to purchase an item, there's a ""Buy It Now"" price. Agree to pay it, and the item is yours!"
Old name for Tokyo.   		3 letters,"EDO.    	Edo is the former name of the Japanese city of Tokyo. Edo was the seat of the Tokugawa shogunate, a feudal regime that ruled from 1603 until 1868. The shogun lived in the magnificent Edo castle. Some parts of the original castle remain and today's Tokyo Imperial Palace, the residence of the Emperor of Japan, was built on its grounds."
Onetime NBC parent.   		3 letters,"RCA.    	The National Broadcasting Company (NBC) has had a number of different logos in its history, including the famous peacock with which we are familiar today. The first peacock logo was introduced in the early days of color television and was designed to illustrate how wonderful color television would be, so go buy one! (NBC was owned by RCA, and so had a vested interest in sales of color television sets)."
Budget alternative.   		5 letters,"ALAMO.    	The third largest car rental company right now is Alamo, a relative newcomer founded in 1974. Alamo made inroads (pun intended!) into the market by popularizing the idea of ""unlimited mileage""."
"To be, to Brigitte.   		4 letters","ETRE.    	Etre is the French word for ""to be""."
"Adams of ""American Hustle"".   		3 letters","AMY.    	Amy Adams is an American actress. although she was actually born in Vicenza, Italy. My favorite film of hers so far is the outstanding ""Julie & Julia"" in which she acted alongside Meryl Streep. I highly recommend this truly delightful movie."
One of filmdom's Coen brothers.   		5 letters,"ETHAN.    	I think it's great to see two brothers working together and being so successful. Joel and Ethan Coen are two movie producers and directors who both live in New York City. They do love the movie-making business and they even married ""insiders"". Ethan's wife is film editor Tricia Cooke, and Joel is married to one of my favorite actresses, the lovely Frances McDormand."
Typical end of a professor's address?.   		3 letters,EDU.    	The .edu domain was one of the six original generic top-level domains specified. The complete original list is:
Genre for the band Sublime.   		3 letters,"SKA.    	Ska originated in Jamaica in the late fifties and was the precursor to reggae music. No one has a really definitive etymology of the term ""ska"", but it is likely to be imitative of some sound."
What you might arrive two hrs.   		3 letters,ETD.    	Estimated time of departure (ETD)
One of Frank's wives.   		3 letters,"AVA.    	Ava Gardner is noted for her association with some big movies, but also for her association with some big names when it came to the men in her life. In the world of film, she appeared in the likes of 'Mogambo' (1953), 'On the Beach' (1959), 'The Night of the Iguana' (1964) and 'Earthquake' (1974). The men in her life included husbands Mickey Rooney, Artie Shaw and Frank Sinatra. After her marriages had failed (and perhaps before!) she had long-term relationships with Howard Hughes and bullfighter Luis Miguel Dominguin whom she met through her friend Ernest Hemingway."
___-Caps (movie snacks).   		3 letters,"SNO.    	Sno-Caps are a brand of candy usually only available in movie theaters. Sno-caps have been around since the twenties, would you believe?"
"""Feliz ___ Nuevo!"".   		3 letters","ANO.    	In Spanish, one says 'Feliz Año Nuevo!' (Happy New Year!) each 'enero' (January)."
Like Mars.   		3 letters,"RED.    	The surface of the planet Mars has a very high iron oxide content, so Mars is red because it is rusty!"
"Gran Paradiso, e.g.   		3 letters","ALP.    	Gran Paradiso is a mountain in the Graian Alps in southern Europe. Mont Blanc is the highest peak in the Alps and is located nearby, straddling the border between France and Italy. Gran Paradiso is the highest mountain that lies totally within the territory of Italy."
Artist whose moniker is the pronunciation of his initials.   		4 letters,"ERTE.    	Erte was the pseudonym of French artist (Russian born) Romain de Tirtoff. Erte is the French pronunciation of his initials ""R.T."""
Ziegfeld Follies costumer.   		4 letters,"ERTE.    	Erté was the pseudonym of French (Russian born) artist and designer Romain de Tirtoff. Erté is the French pronunciation of his initials ""R.T."" Erté's diverse portfolio of work included costumes and sets for the 'Ziegfeld Follies' of 1923, as well as productions of the Parisian cabaret show 'Folies Bergère'."
"___ Taylor, old sitcom character.   		4 letters","OPIE.    	Ron Howard sure has come a long way since playing Opie Taylor on ""The Andy Griffith Show"". Howard has directed some fabulous movies, including favorites of mine like ""Apollo 13"", ""A Beautiful Mind"" and ""The Da Vinci Code"". And today, ""Opie"" is a grandfather ..."
"Taylor on ""The Andy Griffith Show"".   		4 letters","OPIE.    	Ron Howard sure has come a long way since playing Opie Taylor on ""The Andy Griffith Show"". Howard has directed some fabulous movies, including favorites of mine like ""Apollo 13"", ""A Beautiful Mind"" and ""The Da Vinci Code"". And today, ""Opie"" is a grandfather ..."
Director Lee.   		3 letters,"ANG.    	Taiwanese director Ang Lee sure has directed a mixed bag of films, mixed in terms of genre but not in terms of quality. He was at the helm for such classics as ""Sense & Sensibility"" (my personal favorite), ""Crouching Tiger, Hidden Dragon"", ""Hulk"", ""Brokeback Mountain"" and ""Life of Pi""."
Yemen seaport.   		4 letters,"ADEN.    	Aden is a seaport in Yemen, located on the Gulf of Aden by the eastern approach to the Red Sea. Aden has a long history of British rule, from 1838 until a very messy withdrawal in 1967. A native of Aden is known as an Adeni. Some believe that Cain and Abel are buried in the city."
"""Dies ___"".   		4 letters","IRAE.    	""Dies Irae"" is Latin for ""Day of Wrath"". It is the name of a famous melody in Gregorian Chant, one that is often used as part of the Roman Catholic Requiem Mass."
Humanoid monster of myth.   		3 letters,"ORC.    	Orcs are mythical humanoid creatures that appear in the writings of J. R. R. Tolkien. Since Tolkien's use of orcs, they have also been featured in other fantasy fiction and in fantasy games."
Allen in history.   		5 letters,"ETHAN.    	Ethan Allen was one of the founders of the state of Vermont. He was also a hero in the American Revolutionary War, famous for leading (along with Benedict Arnold) the small band of men that captured Fort Ticonderoga. And yes, the Ethan Allan store and furniture line is named for Ethan Allen the patriot."
Watson who played Hermione Granger.   		4 letters,"EMMA.    	Emma Watson is the English actress famous for playing Hermione Granger in the 'Harry Potter' series of movies. Watson continued her education while pursuing her acting career and studied at Brown University in Providence, Rhode Island."
Future atty.'s challenge.   		4 letters,LSAT.    	The Law School Admission Test has been around since 1948.
Color TV pioneer.   		3 letters,"RCA.    	During WWI, the US government actively discouraged the loss of certain technologies to other countries, including allies. The developing wireless technologies were considered to be particularly important by the army and navy. The government prevented the General Electric Company from selling equipment to the British Marconi Company, and instead facilitated the purchase by GE of the American Marconi subsidiary. This purchase led to GE forming the Radio Corporation of America that we know today as RCA."
Resident of Oman or Yemen.   		4 letters,"ARAB.    	Oman lies on the southeast coast of the Arabian Peninsula and is neighbored by the OAE, Saudi Arabia and Yemen. Oman is a monarchy, and the official name of the state is the Sultanate of Oman. All of the country's legislative, executive and judiciary power resides with the hereditary sultan."
Stadium support?.   		3 letters,"OLE.    	""Ole Ole Ole!"" is chanted at soccer games by many Spanish-speaking (or -shouting) fans. I am very proud to claim that the fans of the Irish national team have adopted the chant as their own, and it can be heard practically non-stop when Ireland is playing (with some inventive melody behind it!)."
Place for une île.   		3 letters,"MER.    	The French would find ""une ile"" (an island) in ""la mer"" (the sea)."
Cousteau's milieu.   		3 letters,"MER.    	Jacques Cousteau made a career at sea (""mer"" in French)."
Muse of poetry.   		5 letters,"ERATO.    	In Greek mythology, the muses are the goddesses who inspire the creation of literature and the arts. The number of muses is a subject of debate at times, but the most popular view is that there are nine:"
Apple variety.   		4 letters,"IMAC.    	The iMac is a desktop computer platform from Apple introduced in 1998. One of the main features of the iMac is an ""all-in-one"" design, with the computer console and monitor integrated. The iMac also came in a range of colors, that Apple marketed as 'flavors', such strawberry, blueberry and lime."
View from Lake Como.   		3 letters,"ALP.    	Lake Como is a glacial lake in Lombardy in Italy. Lake Como has long been a retreat for the rich and famous. Lakeside homes there are owned by Madonna, George Clooney, Gianni Versace, Sylvester Stallone and Richard Branson."
Market for Jap.   		3 letters,"TSE.    	The Tokyo Stock Exchange (TSE) is the third largest stock exchange in the world, after New York and London."
Poetic member of a Greek nonet.   		5 letters,"ERATO.    	In Greek mythology, the muses are the goddesses who inspire the creation of literature and the arts. The number of muses is a subject of debate at times, but the most popular view is that there are nine:"
Island greeting.   		5 letters,"ALOHA.    	The Hawaiian word ""Aloha"" has many meanings in English: affection, love, peace, compassion and mercy. More recently ""aloha"" has come to mean ""hello"" and ""goodbye"", but only since the mid-1800s."
"Lou's ""La Bamba"" co-star.   		4 letters","ESAI.    	Esai Morales is best known for his role in the 1987 movie ""La Bamba"". The film depicted the life of Ritchie Valens (played by Lou Diamond Phillips) and his half-brother Bob Morales (played by Morales)."
Part of a krone.   		3 letters,ORE.    	The Norwegian and Danish krone are divided into 100 öres.
