The Bruins' Bobby.   		3 letters,"ORR.    	Bobby Orr is regarded as one of the greatest hockey players of all time. By the time he retired in 1978 he had undergone over a dozen knee surgeries. At 31 years of age, he concluded that he just couldn't skate anymore. Reportedly, he was even having trouble walking."
___ Spumante.   		4 letters,ASTI.    	Asti is in the Piedmont region of northwest Italy. The region is perhaps most famous for its Asti Spumante sparkling white wine.
Animal on the Michigan flag.   		3 letters,"ELK.    	The Michigan State Flag is made up of the state's coat of arms on a dark blue background. The coat of arms consists of a shield, supported on the left by an elk, and on the right by a moose."
Son of Isaac.   		4 letters,"ESAU.    	Esau was the twin brother of Jacob, the founder of the Israelites. When their mother, Rebekah, gave birth to the twins ""the first emerged red and hairy all over (Esau), with his heel grasped by the hand of the second to come out (Jacob)"". As Esau was the first born, he was entitled to inherit his father's wealth (it was his ""birthright""). Instead, Esau sold his birthright to Jacob for the price of a ""mess of pottage"" (a meal of lentils)."
Ancient South American.   		4 letters,"INCA.    	The Inca Empire was known as the Tawantinsuyu, which translates as 'land of the four quarters'. The Inca Empire was a federal organization having a central government that sat above four 'suyu' or 'quarters', four administrative regions."
Cantor of Congress.   		4 letters,"ERIC.    	Eric Cantor is a US Representative from Virginia, and has been the House Majority Leader since 2011."
Org.   		3 letters,"IRS.    	The IRS logo has to be one of the most poorly-designed logos used by the US government. The main components are a branch, scales and eagle ... but ... you have to look very closely to make out those features."
Many a numerator.   		3 letters,"ONE.    	In a fraction, the number above the line is the numerator, and the number below the line is the denominator. A common numerator is the number one, as in &#189;, &#188;, &#8531; etc."
Last Julio-Claudian emperor.   		4 letters,"NERO.    	The Julio-Claudian dynasty was made up of the first five Roman Emperors: Augustus, Tiberius, Caligula, Claudius and Nero. All five emperors were members of either the Julius family, the Claudius family or both. The dynasty collapsed when Nero committed suicide in 68 AD."
2012 Seth MacFarlane comedy.   		3 letters,"TED.    	'Ted' is a movie written, directed, produced and starring Seth MacFarlane. In the story, MacFarlane voices a teddy bear who is the best friend of a character played by Mark Wahlberg."
"""Fiddling"" Roman emperor.   		4 letters","NERO.    	The brand name Reebok was adopted as the new company name for Foster Shoes of the UK in 1960. The name Reebok (more commonly 'Rhebok') is an Afrikaans word for an antelope, and comes from the term ""roe buck""."
"Word before ""Happy New Year!"".   		3 letters","ONE.    	Three, two, one ... Happy New Year!"
Itsy-bitsy bit.   		4 letters,"IOTA.    	Iota is the ninth letter in the Greek alphabet. We use it to portray something very small, as it is the smallest letter in the alphabet."
"___ Préval, twice-elected president of Haiti.   		4 letters","RENE.    	René Préval is a politician who served as President of Haiti from 1996 to 2001, and again from 2006 to 2011."
CBS forensic drama.   		3 letters,"CSI.    	The TV show ""CSI"" gets a lot of criticism from law enforcement agencies for its unrealistic portrayal of the procedures and science of criminal investigation. I don't care though, as I just think it's fun television. The original ""CSI"" set in Las Vegas seems to have ""gone off the boil"", but the addition of Sela Ward to the cast of ""CSI: NY"" has really, really raised the level of the sister show set in New York City."
CBS's Moonves.   		3 letters,"LES.    	Leslie Moonves had many senior positions in the television industry, especially with CBS and Viacom. Early in his career he was an actor and played tough guy roles on ""Cannon"" and ""The Six Million Dollar Man"". Moonves is the great-nephew of David Ben-Gurion, the first Prime Minister of Israel, and he is married to TV news personality Julie Chen."
British poet laureate Carol ___ Duffy.   		3 letters,ANN.    	Carol Ann Duffy is a poet and playwright from Scotland. Duffy is the current poet laureate in Britain and is the first Scot to hold the position as well as the first openly gay person to be so honored.
Kennedy aide Sorensen.   		3 letters,"TED.    	Ted Sorensen was John F. Kennedy's speech-writer, and he wrote a biography about the President called ""Kennedy"". President Kennedy once referred to Sorensen as his 'intellectual blood bank'."
Sparkling Italian export.   		4 letters,"ASTI.    	Asti is a sparkling white wine from the Piedmont region of Italy, and is named for the town of Asti around which the wine is produced. The wine used to be called Asti Spumante, and it had a very bad reputation as a 'poor man's champagne'. The 'Spumante' was dropped in a marketing attempt at rebranding associated with a reduction in the amount of residual sugar in the wine."
Ocean predator with giant jaws.   		4 letters,"ORCA.    	The taxonomic name for the killer whale is Orcinus orca. The use of the name ""orca"", rather than ""killer whale"", is becoming more and more common. The Latin word ""Orcinus"" means ""belonging to Orcus"", with Orcus being the name for the Kingdom of the Dead."
Retired Steeler Taylor.   		3 letters,IKE.    	Ike Taylor is a retired NFL cornerback who spent his entire professional career with the Pittsburgh Steelers. Taylor took a job as an analyst with the NFL Network after he quit the game.
Japanese sash.   		3 letters,OBI.    	The sash worn as part of traditional Japanese dress is known as an obi. The obi can be tied in what is called a butterfly knot.
Confucian principle.   		3 letters,"TAO.    	The Chinese character ""tao"" translates as ""path"", but the concept of Tao signifies the true nature of the world."
Lawyers' org.   		3 letters,"ABA.    	The American Bar Association was founded back in 1878, and is a voluntary association for lawyers and law students. The main focus of the ABA is setting academic standards for law schools, and setting ethical codes for the profession."
Italian wine area.   		4 letters,ASTI.    	Asti is in the Piedmont region of northwest Italy. The region is perhaps most famous for its Asti Spumante sparkling white wine.
1967 Calder Trophy winner at age 18.   		3 letters,"ORR.    	Bobby Orr is regarded as one of the greatest hockey players of all time. By the time he retired in 1978 he had undergone over a dozen knee surgeries. At 31 years of age, he concluded that he just couldn't skate anymore. Reportedly, he was even having trouble walking ..."
Machu Picchu resident.   		4 letters,"INCA.    	Machu Picchu is known as ""The Lost City of the Incas"", and it can be visited on a mountain ridge in Peru, 50 miles northwest of the city of Cuzco in the southeast of the country. The name Machu Picchu means ""old peak""."
CBS spinoff that ran for 10 seasons.   		3 letters,"CSI.    	I quite enjoy the 'CSI' franchise of television shows, except 'CSI: Miami'. I find the lead character played by David Caruso to be extremely annoying. The show was cancelled in 2012. No loss ..."
"Missing name in the tongue twister ""I saw ___ sawing wood ..."".   		4 letters",ESAU.    	The whole text of the Esau Wood tongue twister is (all together now!):
Traditional keikogi accessory.   		3 letters,OBI.    	The sash worn as part of traditional Japanese dress is known as an obi. The obi can be tied in what is called a butterfly knot.
Lacoste of tennis.   		4 letters,"RENE.    	René Lacoste was a French tennis player who went into the clothing business, and came up with a more comfortable shirt that players could use. This became known as a 'tennis shirt'. When it was adopted for use in the sport of polo, the shirts also became known as 'polo shirts'. And then the 'golf shirt' is basically the same thing."
Smidgen.   		4 letters,"IOTA.    	Iota is the ninth letter in the Greek alphabet. We use it to portray something very small, as it is the smallest of all Greek letters."
Biblical twin.   		4 letters,ESAU.    	(31D. Biblical twin : JACOB)
"""___ on a Grecian Urn"".   		3 letters",ODE.    	Here's the first verse of the poem 'Ode on a Grecian Urn' by John Keats:
Rock genre.   		3 letters,"EMO.    	The musical genre of ""emo"" originated in Washington D.C. in the 80s, and takes its name from ""emotional hardcore"". Not my cup of tea ..."
"William Collins's ""___ to Evening"".   		3 letters",ODE.    	William Collins was an 18th-century English poet who is perhaps most famous for writing lyrical odes.
Fleming who created James Bond.   		3 letters,"IAN.    	Ian Fleming is most famous for writing the 'James Bond' series of spy novels. You might also know that he wrote the children's story 'Chitty Chitty Bang Bang', which was made into a cute movie released in 1968 and even a stage musical that opened in 2002."
Captain Hook's alma mater.   		4 letters,"ETON.    	Captain Hook is the bad guy in 'Peter Pan', the famous play by J. M. Barrie. Hook is Peter Pan's sworn enemy, as Pan cut off Hook's hand causing it to be replaced by a 'hook'. It is implied in the play that Hook attended Eton College, just outside London. Hook's last words are 'Floreat Etona', which is Eton College's motto."
Monarchy since the 1740s.   		4 letters,"OMAN.    	Oman is lies on the southeast coast of the Arabian Peninsula, neighbored by the OAE, Saudi Arabia and Yemen. The city of Muscat, with its strategic location, has a history of invasion and unrest. Centuries of occupation by the Persians ended in 1507 when the Portuguese took the city in a bloody attack. The Portuguese held Muscat for much of the next century until finally ousted by local Omani forces in 1648. A Yemeni tribe invaded the area in 1741 and set up a monarchy that has been in place ever since."
Tiny bit.   		4 letters,"IOTA.    	Iota is the ninth letter in the Greek alphabet. We use it to portray something very small, as it is the smallest of all Greek letters."
Animal that bugles.   		3 letters,"ELK.    	Male elk are called bulls, and females are known as cows. Bull elk are known for their very loud screaming, which is called bugling. Cow elk are attracted to bulls that bugle more often and most loudly."
"Aix-___-Bains, France.   		3 letters",LES.    	Aix-les-Bains is an old Roman spa town in Eastern France.
"""Burn Notice"" grp.   		3 letters","CIA.    	Burn Notice"" is an action drama TV series that originally aired from 2007 to 2013 on the USA Network. The show's title refer to 'burn notices' issued by intelligence agencies, a document that discredits a source or agent that has become unreliable."
"___ Stark, ""Game of Thrones"" protagonist.   		3 letters","NED.    	Ned Stark is the protagonist in George R. R. Martin's fantasy novel 'A Game of Thrones', although his character doesn't exactly come out on top by the end of the story. Stark is played by actor Sean Bean in the HBO television adaptation of the novel."
Country whose name sounds like a Jamaican exclamation.   		4 letters,"OMAN.    	Oman lies on the southeast coast of the Arabian Peninsula and is neighbored by the UAE, Saudi Arabia and Yemen. The capital city of Muscat has a strategic location on the Gulf of Oman and has a history of invasion and unrest. Centuries of occupation by the Persians ended in 1507 when the Portuguese took the city in a bloody attack. The Portuguese held Muscat for much of the next one hundred years until finally ousted by local Omani forces in 1648. A Yemeni tribe invaded the area in 1741 and set up a monarchy that has been in place ever since."
___ États-Unis.   		3 letters,LES.    	'Les États-Unis d'Amérique' is what French speakers call 'the United States of America'.
"""___ Miz"".   		3 letters","LES.    	The 1980 musical ""Les Miserables"" is an adaptation of the 1862 novel of the same name by Victor Hugo. It opened in London in 1985, and is the longest running musical in the history of London's West End. My wife and I saw ""Les Miz"" in the Queen's Theatre in London quite a few years ago, but were only able to get tickets in the very back row. The theater seating is very steep, so the back row of the balcony is very high over the stage. One of the big events in the story is the building of a street barricade, over which the rebels fight. At the height we were seated we could see the stagehands behind the barricade, sitting drinking Coke, even having a cigarette. On cue they would get up and catch a dropped rifle, or an actor that had been shot. It was pretty comical. I didn't really enjoy the show that much, to be honest. Some great songs, but the storyline just didn't seem to hang together for me."
Rihanna's first #1 Billboard single.   		3 letters,SOS.    	The singer Rihanna was born and grew up on the island of Barbados and moved to the US when she was 16-years-old to pursue a singing career.
Liquid in the 8-Down.   		3 letters,EAU.    	(8. See 52-Across : SEINE)
Golfer Woosnam.   		3 letters,"IAN.    	I've always thought Ian Woosnam to be the most unlikely-looking of golfers. He is just over 5' 4' tall and yet is noted as a very powerful hitter of the ball. Woosnam is a Welshman, and was ranked the world's number one golfer for most of 1991."
Moscato d'___ (Italian wine).   		4 letters,ASTI.    	Asti is in the Piedmont region of northwestern Italy. It is perhaps most famous for its Asti Spumante sparkling white wine. Moscato d'Asti is produced from the same grape (Moscato Bianco) but is a much sweeter wine with a lower alcohol content. It is usually served as a dessert wine.
Pie ___ mode.   		4 letters,"A LA.    	In French, ""à la mode"" simply means ""fashionable"". In America, the term has also come to describe a way of serving pie, usually with ice cream, or as I recall from when I lived in Upstate New York, with cheese."
___ mode.   		4 letters,"A LA.    	In French, ""à la mode"" simply means ""fashionable"". In America, the term has come to describe a way of serving pie, usually with ice cream, or as I recall from when I lived in Upstate New York, with cheese."
Country singer Church.   		4 letters,"ERIC.    	Eric Church is a country singer/songwriter from Granite Falls, North Carolina. In fact, Church's second album is called 'Carolina'."
Guitarist Clapton.   		4 letters,"ERIC.    	Can you believe that Eric Clapton only had one chart-topper in the US? In 1974 he released a cover version of the Bob Marley classic ""I Shot the Sheriff"", and ended up selling more copies of that song than Bob Marley did himself."
Early eight-bit computer maker.   		5 letters,"ATARI.    	At one point, the electronics and video game manufacturer Atari was the fastest growing company in US history. However, Atari never really recovered from the video game industry crash of 1983."
John Maynard Keynes's alma mater.   		4 letters,ETON.    	John Maynard Keynes was a British economist. Keynes argued that a country's economy could and should be managed by fiscal and monetary policy in order to mitigate the effects of inevitable recessions and depressions.
Gift on a string.   		3 letters,"LEI.    	""Lei"" is the Hawaiian word for ""garland, wreath"", although in more general terms a ""lei"" is any series of objects strung together as an adornment intended to be worn."
"Estonia, once: Abbr..   		3 letters","SSR.    	Estonia is one of the former Soviet Socialist Republics (SSRs) and is located in Northern Europe on the Baltic Sea, due south of Finland. Estonia has been overrun and ruled by various empires over the centuries. The country did enjoy a few years of freedom at the beginning of the 20th century after a war of independence against the Russian Empire. However, Estonia was occupied again during WWII, first by the Russians and then by the Germans, and then reoccupied by the Soviets in 1944. Estonia has flourished as an independent country again since the collapse of the USSR in 1991. "
Asteroids game maker.   		5 letters,"ATARI.    	I remember being really addicted to the Atari video arcade game called 'Asteroids' back in the early eighties. Apparently I wasn't the only one, as 'Asteroids' turned out to be Atari's best selling game of all time."
Boston Garden legend.   		3 letters,"ORR.    	Bobby Orr is regarded as one of the greatest hockey players of all time. By the time he retired in 1978 he had undergone over a dozen knee surgeries. At 31 years of age, he concluded that he just couldn't skate anymore. Reportedly, he was even having trouble walking ..."
Literary title character with a palindromic name.   		3 letters,"ADA.    	I think the reference here is to the 1969 novel by Vladimir Nabokov. ""Ada"". The story is about a man called Van Veen who, when 14 years old, meets for the first time his cousin, 11-year-old Ada. The two cousins eventually have an affair, only to discover later that they are in fact brother and sister."
Jules Verne harpooner ___ Land.   		3 letters,"NED.    	Ned Land was one of the protagonists in Jules Verne's classic ""20,000 Leagues Under the Sea"". In the famous movie adaptation from 1955, Ned Land was played by Kirk Douglas."
Owner of Moviefone.   		3 letters,"AOL.    	Moviefone is a movie listing service, available by telephone in many parts of the country."
CBS drama with multiple spinoffs.   		3 letters,"CSI.    	The 'CSI' franchise of TV shows has been tremendously successful, but seems to be winding down. 'CSI: Miami' (the 'worst' of the franchise, I think) was cancelled in 2012 after ten seasons. 'CSI: NY' (the 'best' of the franchise) was cancelled in 2013 after nine seasons. The original 'CSI: Crime Scene Investigation', set in Las Vegas, is still going strong and has been doing so since 2000."
Kabuki sash.   		3 letters,"OBI.    	An obi is a sash worn in from dress in Japan, both by men and women, although there tend to be many different ornate versions for women."
Rock genre.   		3 letters,"EMO.    	The musical genre of ""emo"" originated in Washington D.C. in the 80s, and takes its name from ""emotional hardcore"". Not my cup of tea ..."
It's found on the toe of a boot.   		4 letters,"OMAN.    	The Arabian Peninsula is shaped like a boot, with the Sultanate of Oman occupying the toe of that boot."
Their empire was the Land of the Four Quarters.   		4 letters,"INCA.    	The Inca Empire was known as the Tawantinsuyu, which translates as 'land of the four quarters'. The Inca Empire was a federal organization having a central government that sat above four 'suyu' or 'quarters', four administrative regions."
Bond girl player Green.   		3 letters,"EVA.    	Despite the English sounding name, Eva Green is a French actress. She played Bond girl Vesper Lynd in the 2006 movie ""Casino Royale"", opposite Daniel Craig."
Law grp.   		3 letters,"ABA.    	The American Bar Association was founded back in 1878, and is a voluntary association for lawyers and law students. The main focus of the ABA is setting academic standards for law schools, and setting ethical codes for the profession."
Org.   		3 letters,"IRS.    	The Internal Revenue Service (IRS) was set up during the Civil War to raise money to cover war expenses. Prior to the introduction of income tax in 1862, the government was funded by levies on trade and property."
Jazz/blues singer Cassidy.   		3 letters,"EVA.    	Eva Cassidy was a singer and guitarist who sang many genres of music including jazz, blues, gospel, country and pop. Cassidy was from the East Coast of the US, but was extremely popular in the UK and Ireland. Sadly, she passed away in 1996 when she was just 33 years old."
Three-time N.H.L.   		3 letters,"ORR.    	Bobby Orr is regarded as one of the greatest hockey players of all time. By the time he retired in 1978 he had undergone over a dozen knee surgeries. At 31 years of age, he concluded that he just couldn't skate anymore. Reportedly, he was even having trouble walking ..."
"___ Blair, George Orwell's real name.   		4 letters","ERIC.    	George Orwell was the pen name of Eric Arthur Blair, the famous British author of the classics ""Nineteen Eighty-Four"" and ""Animal Farm""."
Modern music genre.   		3 letters,"EMO.    	The musical genre of ""emo"" originated in Washington D.C. in the 80s, and takes its name from ""emotional hardcore"". Not my cup of tea ..."
"Crack team, for short?.   		3 letters","NSA.    	The National Security Agency (NSA) was set up in 1952 by President Truman, a replacement for the Armed Forces Security Agency that had existed in the Department of Defense since 1949. The NSA has always been clouded in secrecy and even the 1952 letter from President Truman that established the agency was kept under wraps from the public for over a generation. I really like the organization's nickname ... 'No Such Agency'."
Face on a coin of A.D.   		4 letters,"NERO.    	The emperor Nero had quite the family life. When Nero was just 16-years-old he married his stepsister, Claudia Octavia. He also had his mother and step-brother executed."
Geisha's accessory.   		3 letters,"OBI.    	An obi is a sash worn in some formal of dress in Japan, both by men and women, although the styles for women tend to be more ornate."
Hush-hush org.   		3 letters,CIA.    	The Central Intelligence Agency (CIA) is the successor to the Office of Strategic Services (OSS) formed during WWII. The CIA was chartered by the National Security Act of 1947.
"""___ Girls,"" 1957 musical comedy.   		3 letters",LES.    	'Les Girls' is a 1957 MGM musical that was scored by Cole Porter. Stars of the film are Gene Kelly and Mitzi Gaynor.
"400-pound calf, perhaps.   		4 letters","ORCA.    	The taxonomic name for the killer whale is Orcinus orca. The use of the name ""orca"", rather than ""killer whale"", is becoming more and more common. The Latin word ""Orcinus"" means ""belonging to Orcus"", with Orcus being the name for the Kingdom of the Dead."
Nabokov novel.   		3 letters,"ADA.    	""Ada"" is a 1969 novel by Vladimir Nabokov. The story takes place in the 1800s on Antiterra, an Earth-like planet that has a history similar to ours but with interesting differences. For example, there is a United States, but the country covers all of North and South America. What we call eastern Canada is a French-speaking province called ""Canady"", and western Canada is a Russian-speaking province called ""Estody"". The storyline is about a man called Van Veen who, when 14 years old, meets for the first time his cousin, 11-year-old Ada. The two cousins eventually have an affair, only to discover later that they are in fact brother and sister."
Pie ___ mode.   		4 letters,"A LA.    	In French, ""à la mode"" simply means ""fashionable"". In America, the term has come to describe a way of serving pie, usually with ice cream, or as I recall from when I lived in Upstate New York, with cheese."
"DiCaprio, to friends.   		3 letters","LEO.    	Hollywood star Leonardo DiCaprio is from Los Angeles, California. DiCaprio's mother was visiting a museum in Italy when she was pregnant and felt the first kick of her unborn child. At the moment of that first kick, Mama DiCaprio was looking at a painting by Leonardo da Vinci, and so named her son Leonardo."
E-mail inits.   		3 letters,"AOL.    	Founded as Quantum Computer Services in 1983 the company changed its name in 1989 to America Online. As America Online went international, the acronym AOL was used in order to shake off the ""America-centric"" sound to the name. During the heady days of AOL's success the company could not keep up with the growing number of subscribers, so people trying to connect often encountered busy signals. That's when users referred to AOL as ""Always Off-Line""."
"Main character on ""How I Met Your Mother"".   		3 letters","TED.    	'How I Met Your Mother' is a sitcom that CBS has been airing since 2005. The main character is Ted Mosby, played by Josh Radnor. Mosby is also the narrator for the show looking back from the year 2030 (the live action is set in the present). As narrator, the older Mosby character is voiced by Bob Saget."
2011 Grammy-winning song by Jay-Z and Kanye West.   		4 letters,"OTIS.    	Jay-Z, as well as being a successful and very rich rap artist, is married to singer Beyonce."
Treat since 1912.   		4 letters,OREO.    	The Oreo cookie was introduced in 1912. The Oreo was intended to be a competitor to the very similar Hydrox cookie which had debuted four years earlier. The Oreo won the resulting battle on the grocery store shelves ...
Mike and ___ (candy).   		3 letters,IKE.    	Mike and Ike is a brandname of fruit-flavored candy made by Just Born starting in 1940. Just Born launched quite a clever marketing campaign in 2012 asserting that Mike and Ike had 'split up due to creative differences'. The campaign involved production of two different boxes for the candy showing one or the other name scratched out. Clever ...
___ talk.   		3 letters,"TED.    	The acronym TED stands for Technology Entertainment and Design. TED is a set of conferences held around the world by a non-profit group called the Sapling Foundation. The conference subjects are varied, and the meetings are often led by big names such as Bill Clinton, Al Gore, Bill Gates and Jane Goodall. The Sapling Foundation then makes recordings of the conferences available for free online with the intent of disseminating the ideas globally. These conferences are known as 'TED talks'."
