P.T.A. interest: Abbr..   		4 letters,EDUC.    	Parent-Teacher Association (PTA)
1953 Leslie Caron musical.   		4 letters,"LILI.    	'Lili' is 1953 musical film starring Leslie Caron in the title role, a naive French orphan girl. A famous song from the movie is 'Hi-Lili, Hi-Lo'."
Valletta is its capital.   		5 letters,"MALTA.    	The island state of Malta is relatively small, but its large number of inhabitants makes it one of the most densely populated countries in Europe. Malta's strategic location has made it a prized possession for the conquering empires of the world. Most recently it was part of the British Empire and was an important fleet headquarters. Malta played a crucial role for the Allies during WWII as it was located very close to the Axis shipping lanes in the Mediterranean. The Siege of Malta lasted from 1940 to 1942, a prolonged attack by the Italians and Germans on the RAF and Royal Navy, and the people of Malta. When the siege was lifted, King George VI awarded the George Cross to the people of Malta collectively in recognition of their heroism and devotion to the Allied cause. The George Cross can still be seen on the Maltese flag, even though Britain granted Malta independence in 1964."
Hymn.   		5 letters,"PAEAN.    	A paean is a poem or song that expresses triumph or thanksgiving. 'Paean' comes from the ancient Greek 'paian' meaning ""song of triumph'."
"Greenlanders, by citizenship.   		5 letters","DANES.    	Greenland is the largest island in the world. Geographically, Greenland is part of the continent of North America, but culturally and politically is considered part of Europe. The island became a Danish colony in 1815, and joined the European Economic Community (EEC) with Denmark. Greenland withdrew from the EEC after a referendum in 1983. Since 2009, Greenland has been relatively autonomous, with the Danish government retaining control of foreign affairs, defence and the judicial system."
Architectural style named after a British royal family.   		5 letters,"TUDOR.    	The Wars of the Roses was a series of civil wars fought for the throne of England between the rival Houses of Lancaster and York. Ultimately the Lancastrians emerged victorious after Henry Tudor defeated King Richard III at the Battle of Bosworth Field. Henry was crowned King Henry VII, and so began the Tudor dynasty. Henry Tudor united the rival houses by marrying his cousin Elizabeth of York. Henry VII had a relatively long reign of 23 years that lasted until his death, after which his son succeeded to the throne as Henry VIII, continuing the relatively short-lived Tudor dynasty. Henry VIII ruled from 1509 until his death in 1547. Henry VIII was the last male to lead the the House of Tudor, as his daughter Queen Elizabeth I died without issue. When Elizabeth died, the Scottish King James VI succeeded to the throne as James I of England and Ireland. James I was the first English monarch of the House of Stuart."
Common cotton swab.   		5 letters,"Q-TIP.    	Cotton swabs were originally marketed under the name ""Baby Gays"", but this was changed in 1926 to ""Q-Tips"", with the Q standing for ""quality""."
African land whose capital is N'Djamena.   		4 letters,"CHAD.    	The landlocked African country called Chad takes its name from the second largest wetland on the continent, which is known as Lake Chad."
First lady Barbara's Russian counterpart.   		5 letters,RAISA.    	Raisa Gorbachova was the wife of Soviet leader Mikhail Gorbachev. There's no doubt that Raisa's charm and personality helped her husband as he worked to change the image of the Soviet Union.
Co.   		3 letters,"DHL.    	Back in the sixties, Larry Hillblom was making pocket money as a Berkeley law student by doing courier runs between San Francisco and Los Angeles. After law school, Hillblom decided to parlay his experience into his own business and set up a courier service flying bills of lading ahead of freight from San Francisco to Honolulu. He brought in two buddies, Adrian Dalsey and Robert Lynn, as partners and the three were soon hopping on and off commercial flights and gradually making more and more money. And DHL was born ... D (for Dalsey) H (for Hillblom) L (for Lynn)."
New York City theater where CinemaScope debuted.   		4 letters,"ROXY.    	The original Roxy Theater was opened in 1927 in New York City, designed to be the biggest and best ""motion picture palace"" of the day. The first theater operator was a professional, Samuel Rothafel. As part of the deal to entice him to take the job, the owners offered to name the theater after him. As Rothafel's nickname was Roxy, that's the name the owners used."
Furniture designer Charles.   		5 letters,"EAMES.    	Charles and Ray Eames were a husband-wife team of furniture designers. One of the more famous of their designs is the Eames lounge chair that comes with an ottoman. This trendy piece of furniture featured in a late episode of the television show 'Frasier'. In the show, Frasier's Dad remarks that the Eames chair is so comfortable that he might have gotten rid of his tatty old recliner a long time ago."
Maurice Chevalier musical.   		4 letters,"GIGI.    	In the lovely musical film ""Gigi"", released in 1958, the title song is sung by Louis Jourdan who plays Gaston. My favorite number though, has to be ""Thank Heaven for Little Girls"" sung by Maurice Chevalier. Many say that 'Gigi' is the last in the long line of great MGM musicals. It won a record 9 Academy Awards, a record that only lasted one year. Twelve months later 'Ben Hur' won 11 Oscars. In the 1958 film, Gigi was played by the lovely Leslie Caron. A few years earlier, 'Gigi' was a successful stage play on Broadway. Chosen for the title role on stage was the then-unknown Audrey Hepburn."
"Moriarty, to Holmes.   		3 letters","FOE.    	Professor James Moriarty was the main villain who crossed swords with Sir Arthur Conan Doyle's' 'Sherlock Holmes'. Moriarty is always cropping up in Sherlock Holmes television and radio plays and in movies, but if you go back to the original stories he isn't around very much. He only turns up directly in two of the narratives, and was primarily introduced by Conan Doyle in order to 'kill off' Sherlock Holmes in a brawl at the top of the Reichenbach Falls in Switzerland. Both Holmes and Moriarty fell to their deaths. Well ... public pressure on the author caused Conan Doyle to resurrect Holmes in 'The Hound of the Baskervilles'."
Bell town in a Longfellow poem.   		4 letters,"ATRI.    	Henry Wadsworth Longfellow wrote ""The Sicilian's Tale; The Bell of Atri"", a narrative poem set in the small town of Atri in the Abruzzo region of Italy."
65-Across's title: Abbr..   		3 letters,DET.    	Detective (Det.)
Classic computer game set on an island.   		4 letters,"MYST.    	In the days when I played the occasional video game, the best of the bunch was undoubtedly 'Myst'. It is a game full of puzzles with the player wandering through a beautifully-designed (for its day) interactive world."
Bearded ___ (reedling).   		3 letters,"TIT.    	The Bearded Tit is more usually known as the Bearded Reedling. The bird doesn't actually have a ""beard"", although the male has black marks around the bill that resemble a mustache."
"""Cosmos"" subj.   		4 letters",ASTR.    	Astronomy (astr.)
Neighbor of four Great Lakes.   		7 letters,ONTARIO.    	The Canadian province of Ontario is bordered by five US states:
Beatles record label.   		5 letters,"APPLE.    	The Beatles founded their own record label in 1968, Apple Records. When singles were released, the A-side had the image of a Granny Smith apple on the label, with the B-side label showing the midsection of the same apple cut in half. Cute ..."
Indian ___.   		5 letters,"OCEAN.    	The Indian Ocean is the third largest of the world's oceans, and was named for the country of India that forms much of its northern boundary."
Morning hrs.   		3 letters,"AMS.    	The 12-hour clock has been around a long time, and was even used in sundial format in Ancient Egypt. Our use of AM and PM dates back to Roman times, with AM standing for Ante Meridiem (before noon) and PM standing for Post Meridiem (after noon). However, the Romans originally used the AM concept a little differently, by counting backwards from noon. So, 2AM to the Romans would be two hours before noon, or 10AM as we would call it today."
"Sloth, for one.   		3 letters",SIN.    	The cardinal sins of Christian ethics are also known as the seven deadly sins. The seven deadly sins are:
Many Astounding Stories cover subjects.   		6 letters,"ALIENS.    	The science fiction magazine called 'Astounding Stories' was first published in 1930. It has been renamed a few times but is still around today, issued under the title 'Analog Science Fiction and Fact'."
Last name of three Indianapolis 500 winners.   		5 letters,"UNSER.    	The Unser family seems to have racing cars in its blood. Al Unser, Sr. won the Indy 500 on four occasions. Al's brother Jerry was the first of the Unsers to compete at Indianapolis. Al's other brother Bobby, won the Indy three times. Al's son, Al Junior, won the Indy twice. Al Junior's son is also a racing driver who competes at the Indy Speedway."
Best-selling PC game before The Sims.   		4 letters,"MYST.    	In the days when I played the occasional video game, the best of the bunch was undoubtedly 'Myst'. It is a game full of puzzles with the player wandering through a beautifully-designed (for its day) interactive world."
Atlantic or Pacific.   		5 letters,OCEAN.    	The earliest known mention of the name 'Atlantic' for the world's second-largest ocean was in Ancient Greece. The Greeks called the ocean 'the Sea of Atlas' or 'Atlantis thalassa'.
"Mary Lincoln, nee ___.   		4 letters","TODD.    	Mary Todd moved in the best of the social circles in Springfield, Illinois and there met the successful lawyer, Abraham Lincoln. The path to their marriage wasn't exactly smooth, as the engagement was broken once but reinstated, with the couple eventually marrying in 1842."
"TV's ""Oscars"".   		5 letters","EMMYS.    	The Emmy Awards are the television equivalent of the Oscars in the world of film, the Grammy Awards in music and the Tony Awards for the stage. Emmy Awards are presented throughout the year, depending on the sector of television being honored. The most famous of these ceremonies are the Primetime Emmy Awards and the Daytime Emmy Awards. The distinctive name of ""Emmy"" is a softened version of the word ""immy"", the nickname given to the video camera tubes found in old television cameras."
Fabled mountain dwellers.   		5 letters,"YETIS.    	A yeti is a beast of legend, also called an abominable snowman. ""Yeti"" is a Tibetan term, and the beast is fabled to live in the Himalayan regions of Nepal and Tibet. Our equivalent legend in North America is that of Bigfoot, also known as Sasquatch. The study of animals whose existence have not yet been substantiated is called cryptozoology."
This-and-that dish.   		4 letters,"HASH.    	""Hash"", meaning a dish of beef and vegetables mashed together, is a very American term and one that really surprised me when I first came across it. ""Hash"" just seems like such an unappetizing item, but I soon found out how delicious it was. The name ""hash"" in this context comes from the French ""hacher"" meaning ""to chop"". Back in the early 1900s the dish called ""hashed browned potatoes"" was developed, which quickly morphed into ""hash browns"". From there the likes of corned beef hash was introduced."
Game in which pieces can be forked.   		5 letters,"CHESS.    	In the game of chess, a 'fork' is a tactic in which a piece attacks two or more opposing pieces at the same time."
Back of a 45 record.   		6 letters,"B-SIDE.    	The first vinyl records designed to play at 33 1/3 rpm were introduced by RCA Victor in 1931, but were discontinued due to quality problems. The first Long Play (LP) 33 1/3 rpm disc was introduced by Columbia Records many years later in 1948, with RCA Victor following up with a 45 rpm ""single"" the following year, in 1949."
"Like the sky, in France.   		4 letters",BLEU.    	'Bleu' is French for 'blue'.
Literary contemporary of Addison.   		6 letters,"STEELE.    	Richard Steele was an Irish writer, the co-founder of the magazine 'The Spectator' along with Joseph Addison. Steele also founded 'The Tatler' magazine, for which he wrote 188 essays."
Welsh word that starts a noted college name.   		4 letters,"BRYN.    	I used to live not far from Bryn-mawr (also ""Brynmwar"") in Wales, the town with the highest elevation in the country. Appropriately enough, ""bryn mawr"" is Welsh for ""big hill"". There is also a Bryn Mawr in Pennsylvania (note the different capitalization) that is named after its Welsh counterpart. At the Pennsylvania location there's a Bryn Mawr college, a private women's school that was the first American university to offer graduate degrees to women."
Certain cetaceans.   		5 letters,"ORCAS.    	The taxonomic name for the killer whale is Orcinus orca. The use of the name ""orca"", rather than ""killer whale"", is becoming more and more common. The Latin word ""Orcinus"" means ""belonging to Orcus"", with Orcus being the name for the Kingdom of the Dead."
Drum kit part.   		6 letters,"HI-HAT.    	In a drum kit, a hi-hat is that pairing of cymbals that sits on a stand and is played by using a foot pedal. The top cymbal is raised and lowered by the foot, hence creating a crashing sound."
Twin Cities suburb.   		5 letters,"EDINA.    	Edina, Minnesota lies just southwest of Minneapolis. The town takes its name from Edinburgh, the capital city of Scotland. It was suggested by a Scottish mill owner at the time a new village was being set up in 1888."
Mother and wife of Uranus.   		4 letters,"GAEA.    	The Greek goddess personifying the earth was Gaea (meaning ""land"" or ""earth"" in Greek). The Roman equivalent goddess was Terra Mater, ""Mother Earth"". Gaea was the wife of Uranus (Father Sky). Gaea and Uranus were the parents of the twelve Titans."
"Richard of ""A Summer Place"".   		4 letters","EGAN.    	Richard Egan was an actor from San Francisco. One of Egan's more famous roles was playing Elvis Presley's older brother in 'Love Me Tender'. Rod Serling eventually chose to narrate his epic 'The Twilight Zone' series himself, but his first choice for narrator had been Richard Egan. It was perhaps lucky that Egan couldn't do the 'The Twilight Zone' gig due to other contractual obligations, as Serling's commentary added so much to the show."
No-show in Hubbard's cupboard.   		4 letters,BONE.    	The English nursery rhyme 'Old Mother Hubbard' was first printed in 1805:
One having a simple existence.   		6 letters,"AMOEBA.    	An ameba (or ""amoeba"", as we spell it back in Ireland) is a single-celled microorganism. The name comes from the Greek ""amoibe"", meaning change. The name is quite apt, as the cell changes shape readily as the ameba moves, eats and reproduces."
Ethylene ___.   		5 letters,OXIDE.    	Ethylene oxide is a colorless gas with mildly sweet odor that is very flammable. It is used as an important raw material in the manufacture of many industrial chemicals.
Beelike.   		5 letters,APIAN.    	Something described as 'apian' is related to bees. 'Apis' is the Latin for 'bee'.
Trig functions.   		5 letters,"SINES.    	The most familiar trigonometric functions are sine, cosine and tangent (abbreviated to 'sin, cos and tan'). Each of these is a ratio, a ratio of two sides of a right-angled triangle. The 'reciprocal' of these three functions are secant, cosecant and cotangent. The reciprocal functions are simply the inverted ratios, the inverted sine, cosine and tangent. These inverted ratios should not be confused with the 'inverse' trigonometric functions e.g. arcsine, arccosine and arctangent. These inverse functions are the reverse of the sine, cosine and tangent. For example, the arctangent can be read as 'What angle is equivalent to the following ratio of opposite over adjacent?'"
"""Tiny Bubbles"" singer.   		6 letters","DON HO.    	The singer and entertainer Don Ho apparently had a pretty liberal arrangement with his wife. When Ho was touring with his two backing singers, Patti Swallie and Elizabeth Guevara, all three of them shared a room together. He had two children with each of his roommates, giving a total of ten kids including the six he had with his wife. The arrangement was quite open, it seems, with all ten kids visiting each other regularly. To each his own ..."
Film.   		4 letters,CINE.    	'Cine' is the French for 'cinema'.
"Hoppy quaff, for short.   		3 letters","IPA.    	India Pale Ale (IPA) is a style of beer that originated in England. The beer was originally intended for transportation from England to India, hence the name."
Letter-shaped fastener.   		5 letters,T-NUT.    	A T-nut is so called because it has a t-shape when viewed from the side.
Econ.   		3 letters,"GNP.    	A country's Gross National Product (GNP) is the value of all services and products produced by its residents in a particular year. GNP includes all production wherever it is in the world, as long as the business is owned by residents of the country concerned. Gross Domestic Product (GDP) is different, and is the value of all services and goods produced within the borders of the country for that year."
Order to attack.   		7 letters,"SIC 'EM.    	'Sic 'em' is an attack order given to a dog, instructing the animal to growl, bark or even bite. The term dates back to the 1830s, with ""sic"" being a variation of ""seek""."
"Friend of Homer on ""The Simpsons"".   		4 letters","CARL.    	Carl Carlson is a friend of Homer's on ""The Simpsons"", and one of his co-workers at the Springfield Nuclear Power Plant. Carl is voiced by actor Hank Azaria."
Notable watchmakers.   		5 letters,"SWISS.    	The third largest group of exported goods from Switzerland is watches (after chemicals and machines/electronics). Over half the watches made in the world are made by Swiss companies such as Omega, Swatch, Rolex and TAG Heuer."
Big piece of cabbage.   		6 letters,"C-NOTE.    	Lettuce, cabbage, kale, dough and moola (also moolah) are all slang terms for money."
Shakespeare's Claudius and others.   		5 letters,"DANES.    	In William Shakespeare's ""Hamlet"", Hamlet's nemesis is King Claudius, his father's brother. It's felt that Shakespeare chose the name ""Claudius"" as in those days the Roman Emperor Claudius was considered to be the archetype of an evil ruler."
One side of the pH scale.   		5 letters,"ACIDS.    	As we all recall from chemistry class, a pH of 7 is considered neutral, and water is the primary example of a substance with a pH equal to seven. Anything less than 7 is an acid, and anything above 7 is a base."
"Pain relief brand with early ""hammers in the head"" ads.   		6 letters","ANACIN.    	Anacin is a pain reliever, with aspirin and caffeine as active ingredients."
"___ Barzini, ""The Godfather"" don.   		6 letters","EMILIO.    	Emilio Barzini (aka 'the Wolf') is the main antagonist in Mario Puzo's 'The Godfather'. In the film adaptation, Barzini is played by actor Richard Conte."
"Brennan of ""Private Benjamin"".   		6 letters",EILEEN.    	The actress Eileen Brennan was best known for her portrayal of the commanding officer in 'Private Benjamin'. I also remember her playing the brothel madam in the great 1973 movie 'The Sting'.
Milan's La ___.   		5 letters,"SCALA.    	The La Scala Opera House opened in 1778. It was built on the site of the church of Santa Maria della Scala, which gave the theater its name: ""Teatro alla Scala"" in Italian."
Cube ...   		4 letters,"DICE.    	As we all know, the numbers on dice are arranged so that the opposite faces add up to seven. Given this arrangement, the numbers 1, 2 and 3 all meet at a common vertex. Now, there are two ways of arranging the 1, 2 and 3 around the common vertex, a so called right-handed die (clockwise 1-2-3) or a left-handed die (counterclockwise 1-2-3). Traditionally, dice used in Western cultures are right-handed, whereas Chinese dice are left-handed. Quite interesting ..."
Reagan confidant.   		5 letters,"MEESE.    	Ed Meese was born in Oakland, California just down the road here and spent 24 years in the office of the Treasurer of Alameda County, the county in which I live. After military service, Meese earned himself a law degree at UC Berkeley. Later, as Chief of Staff for President Reagan, he was instrumental in a famous decision to crack down on student protesters at Berkeley which resulted in one protester dying and a two-week occupation of the city by the California National Guard."
Brunch option.   		5 letters,CREPE.    	'Crêpe' is the French word for 'pancake'.
"Smith graduate, e.g.   		6 letters","ALUMNA.    	An ""alumnus"" (plural ... alumni) is a graduate or former student of a school or college. The female form is ""alumna"" (plural ... alumnae). The term comes into English from Latin, in which alumnus means foster-son or pupil. 'Alum' is an informal term used for either an alumna or an alumnus."
Part of E.T.S.: Abbr..   		4 letters,"EDUC.    	The Educational Testing Service (ETS) was founded in 1947, and produces standardized tests for students from kindergarten through college. Perhaps most famously, ETS operates the SAT testing process."
Day laborers.   		5 letters,PEONS.    	A peon is a lowly worker with no real control over his/her working conditions. The word comes into English from Spanish where it has the same meaning.
Delhi cheese?.   		4 letters,RAJA.    	A raja might be described as a big cheese in India.
"""Gigi"" composer.   		5 letters","LOEWE.    	Frederick Loewe was a composer best known for his collaborations with the lyricist Alan Jay Lerner, the most famous of which were 'My Fair Lady', 'Gigi' and 'Camelot'."
"The ""O"" in P.L.O.: Abbr..   		3 letters","ORG.    	The Palestine Liberation Organization (PLO) was founded in 1964. The PLO&#8217;s early stated goal was the liberation of Palestine, with Palestine defined as the geographic entity that existed under the terms of the British Mandate granted by the League of Nations back in 1923. The PLO is recognized as the sole legitimate representative of the Palestinian people by over one hundred countries, and was granted observer status (i.e. no voting rights) at the United Nations in 1974. "
Like some workers.   		5 letters,APIAN.    	Something 'apian' is related to bees. 'Apis' is the Latin for 'bee'.
"Chippendales dancer, e.g.   		6 letters","ADONIS.    	In Greek mythology, Adonis is a beautiful young god loved by Aphrodite. Adonis dies in a hunting accident (gored by a boar), but not before he gives Aphrodite a child. Adonis was originally a Phoenician god ""absorbed"" into Greek lore (Phoenicia is modern day Lebanon). The child born of Adonis to Aphrodite was called Beroe, after which is named Beirut, the capital city of Lebanon. We also use the term 'adonis' to mean 'beautiful male'."
___ knife.   		6 letters,"X-ACTO.    	The X-Acto knife was invented in the thirties by a Polish immigrant, although his intention was to come up with a scalpel for surgeons. The knife couldn't cut it as a scalpel though (pun intended!), because it was difficult to clean. The inventor's brother-in law suggested it be used as a craft knife, and it is still around today."
Dark green?.   		5 letters,"LUCRE.    	Our word 'lucre' meaning 'money, profits' comes from the Latin 'lucrum' meaning the same thing."
Apples since 1998.   		5 letters,"IMACS.    	The iMac is a desktop computer platform from Apple introduced in 1998. One of the main features of the iMac is an ""all-in-one"" design, with the computer console and monitor integrated. The iMac also came in a range of colors, that Apple marketed as 'flavors', such strawberry, blueberry and lime."
Weather forecasting aid.   		5 letters,"RADAR.    	Scientists have been using radio waves to detect the presence of objects since the late 1800s, but it was the demands of WWII that accelerated the practical application of the technology. The British called their system RDF standing for Range and Direction Finding. The system used by the US Navy was called Radio Detection And Ranging, which was shortened to the acronym RADAR."
Boxers Muhammad and Laila.   		4 letters,"ALIS.    	Cassius Marcellus Clay, Jr. was born in 1942 in Louisville, Kentucky. Clay changed his name to Muhammad Ali when he converted to Islam in 1964. Who can forget Muhammad Ali lighting the Olympic flame for the 1996 games in Atlanta? Ali was presented with a gold medal during those '96 Games, a replacement for the medal he won at the 1960 Olympics. He had thrown the original into the Ohio River as a gesture of disgust after being refused service at a ""whites only"" restaurant."
"""Right You Are, Mr.   		4 letters","MOTO.    	The mysterious Mr. Moto is a Japanese secret agent who appears in six novels by American author, John P. Marquand. Mr. Moto was famously played by Peter Lorre in a series of eight films released in the 1930s."
"""Come on down!"" announcer Johnny.   		5 letters","OLSON.    	Johnny Olson was the announcer on ""The Price is Right"" from day one in 1972, until he passed away in 1985."
Certain protozoan.   		6 letters,"AMOEBA.    	An ameba (or ""amoeba"", as we spell it back in Ireland) is a single-celled microorganism. The name comes from the Greek ""amoibe"", meaning change. The name is quite apt, as the cell changes shape readily as the ameba moves, eats and reproduces."
Plant used in herbal remedies.   		5 letters,SENNA.    	Sennas are used as purgatives and laxatives.
Something it's not good to go to.   		3 letters,"POT.    	The phrase 'go to pot', meaning fall into ruin, has been around since the 1500s when it really meant 'go to (the) pot', to be chopped up and boiled for food."
