"Some ""CSI"" figs.   		3 letters",DAS.    	District Attorney (DA)
Geological feature on a Utah license plate.   		4 letters,"ARCH.    	Some Utah licence plates feature an image of Delicate Arch, a natural sandstone arch located in Arches National Park near Moab, Utah."
1998 Sarah McLachlan hit.   		4 letters,"ADIA.    	Sarah McLachlan is singer/songwriter from Halifax, Nova Scotia who lives in Vancouver. In 1997, McLachlan married Ashwin Sood, the drummer in her band. Apparently the 1998 hit song ""Adia"", that she co-wrote and recorded, was intended as an apology to her best friend ... for stealing her ex-boyfriend and then marrying him!"
Certain util.   		3 letters,EES.    	Electrical Engineers (EEs).
Bird that is no more.   		3 letters,"MOA.    	Moas were flightless birds native to New Zealand, and are now extinct. The fate of the Moa is a great example of the detrimental effect that humans can have on animal populations. The Maoris arrived in New Zealand about 1300 AD, upsetting the balance of the ecosystem. The Moa were hunted to extinction within 200 years, which in turn caused the extinction of the Haast's Eagle, the Moa's only predator prior to the arrival of man."
Indian royal.   		4 letters,RANI.    	Raja' (also 'rajah') is word derived from Sanskrit that is used particularly in India for a monarch or princely ruler. The female form is 'rani' (also 'ranee') and is used for a raja's wife.
"""O Sole ___"".   		3 letters","MIO.    	""'O sole mio"" is a famous Italian song from Naples, written in 1898. The lyrics are usually sung in the original Neapolitan, as opposed to Italian. The title translates from Neapolitan into ""My Sun"" (and not into ""O, My Sun"" as one might expect). It's a love song of course, sung by a young man declaring that there is a sun brighter than that in the sky, the sun that is his lover's face. Awww ..."
1965 civil rights march site.   		5 letters,"SELMA.    	The Bloody Sunday march took place between Selma and Montgomery, Alabama on 7 March 1965. The 600 marchers involved were protesting the intimidation of African-Americans registering to vote. When the marchers reached Dallas County, Alabama they encountered a line of state troopers reinforced by white males who had been deputized that morning to help keep the peace. Violence broke out with 17 marchers ending up in hospital, one nearly dying. Because the disturbance was widely covered by television cameras, the civil rights movement picked up a lot of support that day."
Overseas drama.   		3 letters,"NOH.    	Noh is a form of musical drama in Japan that has been around since the 14th century. Many of the Noh performers are masked, allowing all the roles to be played by men, both male and female parts."
Former Chevy subcompact.   		4 letters,"AVEO.    	The Chevrolet Aveo is a subcompact automobile that has been around since 2002. The Aveo is manufactured by GM Daewoo, the GM subsidiary in South Korea. Although the Aveo name is still used in some markets, here in North America the Aveo has been sold as the Chevrolet Sonic since 2012. By the way, GM Daewoo is the third largest manufacturer of automobiles in South Korea, after Hyundai and Kia."
Actress Sommer.   		4 letters,"ELKE.    	Elke Sommer is a German-born actress who was at the height of her success on the silver screen in the sixties. She won a Golden Globe as Most Promising Newcomer Actress for her role opposite Paul Newman in 1964's ""The Prize"". She also sings and has released several albums. Now she focuses on painting, producing artwork that is strongly influenced by Marc Chagall."
___ Rabbit.   		5 letters,"BR'ER.    	Br'er Rabbit and Br'er Fox are characters in the Uncle Remus stories, written by Joel Chandler Harris. The Uncle Remus stories are adaptations of African American folktales that Harris collected across the Southern States. ""Br'er"" is an abbreviated form of ""brother""."
W.W.   		6 letters,"U-BOAT.    	'U-boat' stands for the German 'Unterseeboot' (undersea boat). Notably, a U-boat sank the RMS Lusitania in 1915, an event that helped propel the US into WWI."
Low-pH substance.   		4 letters,"ACID.    	As we all recall from chemistry class, a pH of 7 is considered neutral. Anything less than 7 is an acid, and anything above 7 is a base."
Fifth Avenue landmark.   		4 letters,"SAKS.    	Saks Fifth Avenue is a high-end specialty store that competes with the likes of Bloomingdales and Nieman Marcus. The original Saks & Company business was founded by Andrew Saks in 1867, and the first Saks Fifth Avenue store was opened on Fifth Avenue in New York City in 1924. There are now Saks Fifth Avenue stores in many major cities in the US, as well in several locations worldwide."
Indy racer Luyendyk.   		4 letters,"ARIE.    	Arie Luyendyk is a racing driver from the Netherlands, winner of the Indianapolis 500 on two occasions. Luyendyk's son, also called Arie, is following in his father's footsteps and is also an auto racer."
Stiff-upper-lip sort.   		5 letters,"STOIC.    	Zeno of Citium was a Greek philosopher who was famous for teaching at the Stoa Poikile, the ""Painted Porch"", located on the north side of the famous Ancient Agora of Athens. Because of the location of his classes, his philosophy became known as stoicism (from ""stoa""). And yes, we get our adjective ""stoic"" from the same root."
Spanish prefix with líneas.   		5 letters,AERO-.    	The Spanish 'aerolíneas' translates as 'airlines'.
"Droids, e.g.   		4 letters","PDAS.    	The Droid is the smartphone from Motorola, noted for running Google's Android operating system."
Funny Caesar.   		3 letters,"SID.    	Sid Caesar achieved fame in the fifties on TV's ""Your Show of Shows"", but to be honest, I know him mainly from the fun film version of the musical ""Grease"", in which he played Coach Calhoun."
Tip for a writer.   		3 letters,"NIB.    	""Nib"" is a Scottish variant of the Old English word ""neb"", with both meaning the beak of a bird. This usage of ""nib"" as a beak dates back to the 14th century, with ""nib"" meaning the tip of a pen or quill coming a little later, in the early 1600s."
One may be involved in phone tapping.   		3 letters,APP.    	One needs to tap the screen in order to use some smartphone apps.
Nevada/Arizona's Hoover ___.   		3 letters,"DAM.    	When the magnificent Hoover Dam was completed in 1936 it was the largest hydroelectric plant in the world, as well as being the world's largest concrete structure. The edifice was originally known as Boulder Dam, due to its location near Boulder City, Nevada. The dam was eventually named after Herbert Hoover for his role in having the dam built when he was Secretary of Commerce, and his later support as US President. There was a formal dedication ceremony held in September 1935 when President Franklin D. Roosevelt was in the area, when only work on the powerhouse was incomplete. President Roosevelt managed to make his dedication speech without once referring to the name of his former opponent President Hoover. When the dam was finally put into service in 1936, the project was two years ahead of schedule. Those were the days ..."
Dim sum additive.   		3 letters,"MSG.    	Monosodium glutamate (MSG) is the sodium salt of a naturally-occurring,non-essential amino acid called glutamic acid. It is used widely as a flavor enhancer, particularly in many Asian cuisines. Whether or not it is harmful seems to be still under debate. I say that something produced in a test tube shouldn't be in our food ..."
Yogi's utterances.   		3 letters,"OMS.    	'Om' is a sacred mystic word from the Hindu tradition. 'Om' is sometimes used as a mantra, a focus for the mind in meditation."
One of the Nereids in Greek myth.   		4 letters,"IONE.    	In Greek mythology, Nereus and Doris had fifty daughters, and these were called the sea nymphs or nereids. The nereids often hung around with Poseidon and were generally very helpful creatures to sailors in distress. Mainly they were to be found in the Aegean, where they lived with their father in a cave in the deep. Some of the more notable names of the nereids were: Agave, Asia, Calypso, Doris, Erato, Eunice and Ione."
Coral ring.   		5 letters,"ATOLL.    	An atoll is a coral island that is shaped in a ring and enclosing a lagoon. There is still some debate as to how an atoll forms, but a theory proposed by Charles Darwin while on his famous voyage aboard HMS Beagle still holds sway. Basically an atoll was once a volcanic island that had subsided and fallen into the sea. The coastline of the island is home to coral growth which persists even as the island continues to subside internal to the circling coral reef."
Memphis deity.   		4 letters,"ISIS.    	Isis was the ancient Egyptian goddess of fertility, as well as the protector of the dead and the goddess of children."
Numbered musical work.   		4 letters,"OPUS.    	The Latin for ""work"" is 'opus', with the plural being 'opera'."
Blu-___ Disc.   		3 letters,"RAY.    	A Blu-ray disc looks just like a standard DVD or CD, but it has a lot more capacity for data storage making it an ideal medium for high-definition movies. The name ""Blu-ray"" comes from the ""blue laser"" used to read the disc, unlike a standard DVD player that uses a ""red laser""."
Yang's go-with.   		3 letters,"YIN.    	The yin and the yang can be explained using many different metaphors. In one, as the sun shines on a mountain, the side in the shade is the yin, and the side in the light is the yang. The yin is also regarded as the feminine side, and the yang the masculine."
"""Swans Reflecting Elephants"" painter.   		4 letters","DALI.    	Swans Reflecting Elephants' is a painting that Salvador Dali completed in 1937. The title is somewhat self-explanatory. The scene features some swans on a lake, along with their reflections. In the reflection the swans take on the appearance of elephants, with the swans' necks becoming elephant trunks and wings becoming ears."
"___ Rapee, longtime Radio City Music Hall conductor.   		4 letters","ERNO.    	Ernö Rapée was an American conductor who was born in Budapest, Hungary. Most famously, Rapée was the head conductor of the Radio City Symphony Orchestra from 1932 to 1945. The Radio City Symphony Orchestra's performances were regularly heard by millions of radio listeners for decades."
Old-hat.   		5 letters,"PASSE.    	'Passé' is a French word, meaning ""past, faded""."
Illinois home of Caterpillar.   		6 letters,"PEORIA.    	Peoria is the oldest European settlement in the state of Illinois, having been settled by the French in 1680. The city is famous for being cited as 'the average American city'."
Some concerned with 5-Downs: Abbr..   		3 letters,EES.    	Electrical Engineers (EEs).
"Steve Martin's ""King ___"".   		3 letters","TUT.    	Comedian Steve Martin wrote the comic song ""King Tut"" himself, and it appeared on his 1978 album ""Wild and Crazy Guy"". The song was later released as a single, and made it as high as number 17 in the charts. Some of the song's success might have been due to the fervor surrounding the exhibition of the real King Tut's tomb artifacts that was touring the country at the time."
Eponym in the frozen food aisle.   		3 letters,"EDY.    	Dreyer's ice cream sells its products under the name Dreyers in the Western United States, and Edy's in the Eastern states. The company's founders were William Dryer and Joseph Edy."
Exxon product.   		3 letters,"GAS.    	The Exxon Corporation was a descendant of John D. Rockefeller's Standard Oil Company. Exxon merged with Mobil (yet another descendant of Standard Oil) in 1999, forming ExxonMobil."
Worker on a 43-Across.   		4 letters,SERF.    	(43. Workplace for a 23-Down : FIEF)
Pro ___.   		4 letters,"RATA.    	""Pro rata"" is a Latin phrase meaning ""in proportion""."
Kind of dye.   		3 letters,"AZO.    	Azo compounds have very vivid colors and so are used to make dyes, especially dyes with the colors red, orange and yellow. The term 'azo' comes from the French word 'azote' meaning 'nitrogen'. French chemist Lavoisier coined the term 'azote' from the Greek word 'azotos' meaning 'lifeless'. He used this name as in pure nitrogen/azote animals die and flames are snuffed out (due to a lack of oxygen)."
Japanese drama.   		3 letters,"NOH.    	Noh is a form of musical drama in Japan that has been around since the 14th century. Many of the Noh performers are masked, allowing all the roles to be played by men, both male and female parts."
Org.   		3 letters,"FBI.    	""The Sting"" ... what a great film! It did of course star Paul Newman and Robert Redford, still riding the wave of success from their collaboration in ""Butch Cassidy and the Sundance Kid"". The ""Sting"" also had the same director as their prior hit, George Roy Hill."
Author Turgenev.   		4 letters,IVAN.    	Ivan Turgenev was a Russian novelist and playwright. Turgenev's most famous works are a collections of short stories called 'A Sportsman's Sketches' (1852) and the novel 'Fathers and Sons' (1862).
Khrushchev's impromptu gavel.   		4 letters,"SHOE.    	Nikita Kruschev only ever made two visits to the United States. He turned up here in September 1960 without an invitation, by appointing himself head of the USSR delegation to the United Nations. The US responded to his unannounced visit by limiting his travel to the island of Manhattan and visits to a Soviet-owned estate on Long Island. During one of the debates at the UN, Krushchev became outraged at a statement made by the Filipino delegate who charged the Soviets with being two-faced by decrying colonialism while forcibly dominating and occupying Eastern Europe. Kruschev demanded the right to reply immediately, and when the Filipino delegate refused to yield, the Soviet leader famously took off his shoe and began to pound it on is desk."
Keystone's place.   		4 letters,"ARCH.    	The keystone of an arch is the last piece put in position, the placement of which allows the arch to bear weight. The keystone sits right at the apex."
Bank fig.   		3 letters,INT.    	Interest (int.)
"""Little ___' Pea"".   		4 letters","SWEE.    	Originally Popeye used the nickname ""Swee'pea"" to address his girlfriend Olive Oyl. Then along comes a baby, found on Popeye's doorstep. Popeye adopts the little guy and raises him, calling him ""Swee'Pea""."
Emmy-nominated sitcom of the early 1970s.   		5 letters,ARNIE.    	'Arnie' is a sitcom from the seventies that starred Herschel Bernardi as a blue-collar worker promoted to the executive offices. It never really made it though.
Division of geology.   		4 letters,"AEON.    	Geological time is divided into a number of units of varying lengths. These are, starting from the largest:"
"Prosecutors, briefly.   		3 letters",DAS.    	District Attorney (DA)
Focus of some high-profile 1970s lawsuits.   		5 letters,"PINTO.    	The Pinto is a small car that was made by the Ford company from 1971 to 1980. The Pinto was of course named for the type of horse. Allegations were made in 1997 that the neck of the car's fuel tank could easily break off in a collision leading to a deadly fire. However, the allegations were never really shown to be valid."
Trash can dweller.   		5 letters,"OSCAR.    	Oscar the Grouch is the Muppet that lives in a garbage can. Oscar's persona comes from various sources. He is named after Oscar Brand who was one of the board members of the Children's Television Workshop, the backers for Sesame Street as the Muppets were being developed in the sixties. Oscar's personality was inspired by an angry waiter that once served Jim Henson (father of the Muppets). And the voice was modeled on a grumpy New York cab driver encountered one day by Caroll Spinney, the puppeteer who brings Oscar to life."
Record label abbr..   		3 letters,"BMI.    	ASCAP (the American Society of Composers, Authors and Publishers) collects licence fees for musicians and distributes royalties to composers whose works have been performed. BMI (Broadcast Music Incorporated) provides the same service."
Pro ___.   		3 letters,"TEM.    	Pro tempore can be abbreviated to ""pro tem"" or ""p.t."" It is a Latin phrase which best translates as ""for the time being"". It is used to describe a person who is acting for another, usually a superior."
It's almost nothing.   		3 letters,SOU.    	A sou is an old French coin.
"Sonata, e.g.   		4 letters","OPUS.    	The term ""sonata"" comes from the Latin and Italian word ""sonare"" meaning ""to sound"". A sonata is a piece of music that is played, as opposed to a cantata (from Latin and Italian ""cantare"" meaning ""to sing""), a piece of music that is sung."
Pier grp.   		3 letters,ILA.    	The International Longshoremen's Association (ILA).
"PC's ""brain"".   		3 letters","CPU.    	The Central Processing Unit is the main component on the ""motherboard"" of a computer. The CPU is the part of the computer that carries out most of the functions required by a program. Nowadays you can get CPUs in everything from cars to telephones."
Indy 500 winner Luyendyk.   		4 letters,"ARIE.    	Arie Luyendyk is a racing driver from the Netherlands, winner of the Indianapolis 500 on two occasions. Luyendyk's son, also called Arie, is following in his father's footsteps and is also an auto racer."
King ___.   		3 letters,"TUT.    	King Tut is a name commonly used for the Egyptian pharaoh Tutankhamen. Tutankhamen may not have been the most significant of the pharaohs, but he is the most famous. This is largely because of the discovery of his nearly intact tomb in 1922. Prior to this, Egyptian tombs had routinely been ravaged by grave robbers. The magnificent burial mask is one of the most recognizable of all Egyptian artifacts."
Grown-up eft.   		4 letters,"NEWT.    	Newts wouldn't be my favorite animals. They are found all over the world, living on land or in the water depending on the species, but always associated with water even if it is only for breeding. Newts metamorphose through three distinct developmental stages during their lives. They start off as larvae in water, fertilized eggs that often cling to aquatic plants, unlike the eggs of frogs and toads which float freely. The eggs hatch into tadpoles, the first developmental form of the newt. After living some months as tadpoles swimming around in the water, they undergo metamorphosis, sprouting legs and replacing their external gills with lungs. At this juvenile stage they are known as efts, and leave the water to live on land. A more gradual transition takes place then, as the eft takes on the lizard-like appearance of the adult newt."
___' Pea.   		4 letters,"SWEE.    	Originally Popeye used the nickname ""Swee'pea"" to address his girlfriend Olive Oyl. Then along comes a baby, found on Popeye's doorstep. Popeye adopts the little guy and raises him, calling him ""Swee'Pea""."
C.I.A.   		4 letters,"LEON.    	Leon Panetta was Chief of Staff under President Clinton, and took over as CIA Director in 2009. Panetta has long been interested in protecting the world's oceans. As an example, he wrote the legislation that created the Monterrey Bay National Marine Sanctuary."
Symphony that premiered 4/7/1805.   		6 letters,"EROICA.    	Beethoven originally dedicated his Symphony No. 3 to Napoleon Bonaparte. Beethoven admired the principles of the French Revolution and as such respected Bonaparte who was ""born"" out of the uprising. When Napoleon declared himself Emperor, Beethoven (and much of Europe) saw this as a betrayal to the ideals of the revolution so he changed the name of his new symphony from ""Bonaparte"" to ""Eroica"", meaning ""heroic"" or ""valiant""."
Businesswoman/philanthropist ___ Heinz Kerry.   		6 letters,"TERESA.    	Teresa Heinz is an heiress to the Heinz family fortune, that largely came from the Heinz food company. Teresa Heinz is married to Secretary of State John Kerry."
Bygone British gun.   		4 letters,"STEN.    	The STEN gun is an iconic armament that was used by the British military. The name STEN is an acronym. The S and the T comes from the name of the gun's designers, Shepherd and Turpin. The EN comes from the Enfield brand name, which in turn comes from the Enfield location where the guns were manufactured for the Royal Small Arms Factory, an enterprise owned by the British government."
Okla.   		3 letters,"ORU.    	Oral Roberts University is a private school in Tulsa, Oklahoma. It was founded relatively recently, in 1963, by the late evangelist Oral Roberts."
Big mouth.   		3 letters,"MAW.    	'Maw' is a term used to describe the mouth or stomach of a carnivorous animal. ""Maw"" is also used as slang for the mouth or stomach of a greedy person."
Meal with the Four Questions.   		5 letters,"SEDER.    	The Passover Seder is a ritual feast that marks the beginning of the Jewish Passover holiday, celebrating the liberation of the Israelites from slavery in Egypt. One of the traditions at the meal is that the youngest child at the table asks ""The Four Questions"", all relating to why this night is different from all other nights in the year:"
Musical Hall of fame collaborator?.   		5 letters,"OATES.    	Daryl Hall & John Oates are a pop music duo, most successful in the late seventies and early eighties. They had six number one hits, including the 1982 release ""Maneater""."
Israel's first U.N.   		4 letters,"EBAN.    	Abba Eban was an Israeli diplomat and politician, born Aubrey Solomon Meir Eban in Cape Town, South Africa. While working at the United Nations after WWII he changed his name to ""Abba"", the Hebrew word for ""father"", reportedly as he could see himself as the father of the nation of Israel."
One may get a pass.   		3 letters,END.    	Football stuff ...
33 1/3 r.p.m.   		3 letters,"LPS.    	The first vinyl records designed to play at 33 1/3 rpm were introduced by RCA Victor in 1931, but were discontinued due to quality problems. The first Long Play (LP) 33 1/3 rpm disc was introduced by Columbia Records many years later in 1948, with RCA Victor following up with a 45 rpm ""single"" the following year, in 1949."
Dots in la mer.   		4 letters,"ILES.    	In French, 'îles' (islands) are dots in 'la mer' (the sea)."
Sch.   		3 letters,"ORU.    	Oral Roberts University (ORU) is a private school in Tulsa, Oklahoma. ORU was founded relatively recently, in 1963 by the late evangelist Oral Roberts."
Abba of Israel.   		4 letters,"EBAN.    	Abba Eban was an Israeli diplomat and politician, born Aubrey Solomon Meir Eban in Cape Town. While working at the United Nations after WWII he changed his name to ""Abba"", the Hebrew word for ""father"", apparently as he could see himself as the father of the nation of Israel."
"""Cómo ___?"".   		4 letters","ESTA.    	""Come esta usted?"" is the more formal way of asking, ""how are you?"" in Spanish."
"Texter's ""However ..."".   		4 letters",OTOH.    	On the other hand (OTOH)
Barker in a basket.   		4 letters,"TOTO.    	Toto is Dorothy's dog in the film 'The Wizard of Oz'. Toto was played by a dog called Terry, but Terry's name was soon changed to Toto in real life, due to the success of the film."
Island west of Maui.   		5 letters,"LANAI.    	Lanai is the sixth largest of the Hawaiian Islands. Lanai was first spotted by Europeans just a few days after Captain Cook was killed on the Big Island of Hawaii in 1779. In 1922, the Hawaiian Pineapple Company bought the whole island of Lanai and turned most of it into the world's largest pineapple plantation. Since then, Lanai has been known as ""The Pineapple Island""."
"Heart of a computer, for short.   		3 letters","CPU.    	The Central Processing Unit (CPU) is the main component on the ""motherboard"" of a computer. The CPU is the part of the computer that carries out most of the functions required by a program. Nowadays you can get CPUs in everything from cars to telephones."
U.S.   		4 letters,"NOME.    	Nome, Alaska has over 3,500 residents, the majority of whom are Native American. The next largest ethnic group in Nome is the white population."
Rose of rock.   		3 letters,"AXL.    	Axl Rose is the lead vocalist of the American rock band, Guns N' Roses."
Mexican coin.   		4 letters,"PESO.    	The coin called a 'peso' is used in many Spanish-speaking countries around the world. The coin originated in Spain where the word 'peso' means 'weight'. The original peso was what we know in English as a 'piece of eight', a silver coin of a specific weight that had a nominal value of eight 'reales'."
Tulsa sch.   		3 letters,"ORU.    	Oral Roberts University (ORU) is a private school in Tulsa, Oklahoma. ORU was founded relatively recently, in 1963 by the late televangelist Oral Roberts. The campus includes a Prayer Tower at its center, a spectacular glass and steel structure designed by architect Frank Wallace. The tower includes an observation deck, and is a popular tourist attraction."
"Umbrella holder, maybe.   		7 letters","MAI TAI.    	The Mai Tai cocktail is strongly associated with the Polynesian islands, but the drink was supposedly invented in 1944 in Trader Vic's restaurant in Oakland, California. One recipe is 6 parts white rum, 3 parts orange curaçao, 3 parts Orgeat syrup, 1 part rock candy syrup, 2 parts fresh lime juice, all mixed with ice and then a float added of 6 parts dark rum."
It flows through Gainsborough.   		5 letters,"TRENT.    	Gainsborough is town on the River Trent in Lincolnshire, England. The alleged story about King Canute demonstrating his lack of divine power by being unable to turn back the tide, that was supposed to have taken place in the tidal waters of the River Trent at Gainsborough."
