English princess.   		4 letters,"ANNE.    	Anne, Princess Royalwas born in 1950 and is the only daughter of British Queen Elizabeth II. Princess Anne has been in the public spotlight for many things, including her success as an equestrian. Princess Anne was the first member of the British Royal Family to have competed in an Olympic Games. Her daughter Zara Philips continued the tradition and competed as a member of the British equestrian team in the 2012 Olympic Games. Zara's medal was presented to her by her own mother, Princess Anne."
Nabokov's longest novel.   		3 letters,"ADA.    	The reference here is to the 1969 novel by Vladimir Nabokov called ""Ada"". The story takes place in the 1800s on Antiterra, an Earth-like planet that has a history similar to ours but with interesting differences. For example, there is a United States, but the country covers all of North and South America. What we call eastern Canada is a French-speaking province called ""Canady"", and western Canada is a Russian-speaking province ""Estody"". The plot-line is about a man called Van Veen who, when 14 years old, meets for the first time his cousin, 11-year-old Ada. The two cousins eventually have an affair, only to discover later that they are in fact brother and sister."
Souvenir sometimes made with shells.   		3 letters,"LEI.    	""Lei"" is the Hawaiian word for ""garland, wreath"", although in more general terms a ""lei"" is any series of objects strung together as an adornment for the body."
Predator of seals.   		4 letters,"ORCA.    	The taxonomic name for the killer whale is Orcinus orca. The use of the name ""orca"", rather than ""killer whale"", is becoming more and more common. The Latin word ""Orcinus"" means ""belonging to Orcus"", with Orcus being the name for the Kingdom of the Dead."
Mimicking.   		4 letters,A LA.    	The phrase 'in the style of' can be translated in 'alla' in Italian and 'à la' in French.
Actress Thurman.   		3 letters,"UMA.    	Robert Thurman was the first westerner to be ordained a Tibetan Buddhist monk. Robert raised his children in the Tibetan Buddhist tradition and called his daughter ""Uma"" as it is a phonetic spelling of the Buddhist name ""Dbuma""."
Dashed ID.   		3 letters,"SSN.    	A Social Security number (SSN) is divided into three parts i.e AAA-GG-SSSS, Originally, the Area Number (AAA) was the code for the office that issued the card. Since 1973, the Area Number reflects the ZIP code from which the application was made. The GG in the SSN is the Group Number, and the SSSS in the number is the Serial Number. However, this is all moot, as since 2011 SSN's are assigned randomly."
Sea menace.   		4 letters,"ORCA.    	The taxonomic name for the killer whale is Orcinus orca. The use of the name ""orca"", rather than ""killer whale"", is becoming more and more common. The Latin word ""Orcinus"" means ""belonging to Orcus"", with Orcus being the name for the Kingdom of the Dead."
Sen.   		3 letters,"TED.    	US Senator Ted Cruz served as Solicitor General for the state of Texas before heading to Washington. Cruz was appointed Solicitor General in 2003 at the age of 32, making him the youngest Solicitor General in the country. Famously, Cruz is an opponent of the Affordable Care Act and made a speech in 2013 in the US Senate on the subject that lasted for 21 hours and 19 minutes. It was the fourth longest speech in the history of the Senate."
Place for vino.   		4 letters,ASTI.    	Asti is in the Piedmont region of northwest Italy. The region is perhaps most famous for its Asti Spumante sparkling white wine.
"With 25-Down, women's fashion designer.   		4 letters",ANNE.    	(25D. See 56-Across : KLEIN)
"""___ Justes"" (Albert Camus play).   		3 letters","LES.    	The 1949 Albert Camus play called 'Les Justes' has a title that is usually translated as 'The Just Assassins', although a more literal meaning would be 'The Just' or 'The Righteous'."
Clapton of rock.   		4 letters,"ERIC.    	Can you believe that Eric Clapton only had one chart-topper in the US? In 1974 he released a cover version of the Bob Marley classic ""I Shot the Sheriff"", and ended up selling more copies of the song than Bob Marley did himself."
Italian wine province.   		4 letters,ASTI.    	Asti is in the Piedmont region of northwestern Italy. It is perhaps most famous for its Asti Spumante sparkling white wine.
Castaway's message.   		3 letters,"SOS.    	The combination of three dots - three dashes - three dots, is a Morse signal first introduced by the German government as a standard distress call in 1905. The sequence is remembered as the letters SOS (three dots - pause - three dashes - pause - three dots), although in the emergency signal there is no pause between the dots and dashes, so SOS is in effect only a mnemonic. Similarly, the phrases ""Save Our Souls"" and ""Save Our Ship"" are also mnemonics, introduced after the ""SOS"" signal was adopted."
Holder of a cabinet position.   		4 letters,"ERIC.    	Eric Holder is the Attorney General of the United States, and is the first African American to hold the position. Holder was close to President Obama during the presidential campaign. Holder was the campaign's legal advisor and was also one of the three members on the Obama vice-presidential selection committee, which of course opted for Vice-President Joe Biden."
Actress Thurman.   		3 letters,"UMA.    	Uma Thurman's father, Robert Thurman, was the first westerner to be ordained a Tibetan Buddhist monk. He raised his children in the Tibetan Buddhist tradition, and called his daughter ""Uma"" as it is a phonetic spelling of the Buddhist name, Dbuma."
___ Claire.   		3 letters,"EAU.    	Eau Claire translates from French to English as ""clear water"". There are locations all over Canada and the United State with the name Eau Claire."
Grp.   		3 letters,"NSA.    	The National Security Agency (NSA) was set up in 1952 by President Truman, a replacement for the Armed Forces Security Agency that had existed in the Department of Defense since 1949. The NSA has always been clouded in secrecy and even the 1952 letter from President Truman that established the agency was kept under wraps from the public for over a generation. I really like the organization's nickname ... ""No Such Agency""."
"*Rihanna, 2006.   		3 letters","SOS.    	""SOS"" is a dance-pop song released by Rihanna in 2006."
Owner of MapQuest and Moviefone.   		3 letters,"AOL.    	MapQuest is a very popular Internet site, one that provides driving directions and maps. MapQuest has been owned by AOL since 2000. One nice feature of MapQuest is a page where gas prices are recorded by users, allowing others to find the lowest price in their area."
"""Little"" name in 1960s pop.   		3 letters","EVA.    	Carole King and her longtime partner Gerry Goffin have been writing hit songs since the early sixties. Carole and Gerry had a babysitter, one Eva Narcissus Boyd, who was always bopping around the house in an unusual dance style. They wrote a song about her dance and they called it ""The Loco-Motion"". Then they gave it to the babysitter to record. Ms. Boyd chose as a stage name a character in ""Uncle Tom's Cabin"" called Little Eva ..."
Org.   		3 letters,"CIA.    	""The Bourne Identity"" is a great spy novel written by Robert Ludlum, and first published in 1980. It has been ranked as the second best spy novel of all time, just behind the even more enjoyable ""The Spy Who Came in from the Cold"" by John le Carre. I'll agree with that sentiment. Ludlum wrote two sequels, and all three parts of the Bourne Trilogy have been made into very successful movies now, starring Matt Damon in the title role. Ludlum died before he could write more than three novels featuring Jason Bourne, but five more titles in the series have been published, written by Eric Van Lustbader. I must check them out ..."
"McKellen of ""The Hobbit"".   		3 letters","IAN.    	Sir Ian McKellen is a marvelous English actor, someone who is comfortable playing anything from Macbeth on stage to Magneto in an 'X-Men' movie. On the big screen, McKellen is very famous for playing Gandalf in ""The Lord of Rings"". In the UK Sir Ian is noted for being at the forefront of the campaign for equal rights for gay people, a role he has enthusiastically embraced since the eighties."
School for an English prince.   		4 letters,"ETON.    	The world-famous Eton College is just a brisk walk from Windsor Castle, which itself is just outside London. Eton is noted for producing many British leaders including David Cameron who took power in the last UK general election. The list of Old Etonians also includes Princes William and Harry, the Duke of Wellington, George Orwell, and the creator of James Bond, Ian Fleming (as well as 007 himself as described in the Fleming novels)."
Video game pioneer.   		5 letters,"ATARI.    	At one point Atari was the fastest growing company in US history, but the company never really recovered from the video game crash of 1983."
Smidgen.   		4 letters,"IOTA.    	Iota is the ninth letter in the Greek alphabet. We use the word ""iota"" to portray something very small as it is the smallest of all Greek letters."
Sushi bar order.   		3 letters,"EEL.    	Sushi is a Japanese dish that has as its primary ingredient cooked, vinegared rice. The rice is usually topped with something, most often fish, and can be served in seaweed rolls. If you want raw fish by itself, then you have to order ""sashimi""."
Wine region of Italy.   		4 letters,ASTI.    	Asti is in the Piedmont region of northwestern Italy. It is perhaps most famous for its Asti Spumante sparkling white wine.
Large deer.   		3 letters,"ELK.    	The elk (also known as the wapiti) is the one of the largest species of deer in the world, with only the moose being bigger. Early European settlers were familiar with the smaller red deer back in their homelands, so when they saw the 'huge' wapiti they assumed it was a moose, and incorrectly gave it the European name for a moose, namely 'elk'. The more correct name for the beast is 'wapiti', which means 'white rump' in Shawnee. It's all very confusing ..."
Actress Thurman.   		3 letters,"UMA.    	Uma Thurman's father, Robert Thurman, was the first westerner to be ordained a Tibetan Buddhist monk. He raised his children in the Tibetan Buddhist tradition, and gave his daughter Uma her name as it is a phonetic spelling of the Buddhist name, Dbuma."
Death on the Nile creator?.   		3 letters,"ASP.    	A clever misdirection, pointing us towards the Agatha Christie novel 'Death on the Nile'."
Lift innovator.   		4 letters,"OTIS.    	Elevators (simple hoists) had been around for a long time. What Otis did was come up with the ""safety elevator"". He showcased his design at the 1853 World's Fair in New York. He would stand on an elevated platform in front of onlookers and order his assistant to cut the single rope holding up the platform. His safety system kicked in when the platform had only fallen a few inches, amazing the crowd. After this display at the fair, the orders came rolling in."
Plea at sea.   		3 letters,"SOS.    	The combination of three dots - three dashes - three dots, is a Morse signal first introduced by the German government as a standard distress call in 1905. The sequence is remembered as the letters SOS (three dots - pause - three dashes - pause - three dots), although in the emergency signal there is no pause between the dots and dashes, so SOS is in effect a mnemonic. Similarly, the phrases ""Save Our Souls"" and ""Save Our Ship"" are also mnemonics, introduced after the ""SOS"" signal was adopted."
"DiCaprio, in tabloids.   		3 letters","LEO.    	Hollywood star Leonardo DiCaprio is from Los Angeles, California. DiCaprio's mother was visiting a museum in Italy when she was pregnant and felt the first kick of her unborn child. At the moment of that first kick, Mama DiCaprio was looking at a painting by Leonardo da Vinci, and so named her son Leonardo."
Conductor Leibowitz.   		4 letters,"RENE.    	René Leibowitz was a French composer who had been born in Warsaw, Poland. Liebowitz studied with Maurice Ravel in Paris in the 1930s, but then studied with Anton Webern and became part of the Second Viennese School and embraced the concept of atonality. Not my cup of tea ..."
Nine-digit ID.   		3 letters,"SSN.    	A Social Security number (SSN) is divided into three parts i.e AAA-GG-SSSS, Originally, the Area Number (AAA) was the code for the office that issued the card. Since 1973, the Area Number reflects the ZIP code from which the application was made. The GG in the SSN is the Group Number, and the SSSS in the number is the Serial Number. However, this is all moot, as since 2011 SSN's are assigned randomly."
Product first released by the National Biscuit Company in 1912.   		4 letters,"OREO.    	The Oreo was the best-selling cookie in the 20th century, and almost 500 billion of them have been sold since they were introduced in 1912 by Nabisco. In those early days the creme filling was made with pork fat, but today vegetable oils are used instead. If you take a bite out of an Oreo sold outside of America you might notice a difference from the homegrown cookie, as coconut oil is added in the overseas version to give a different taste."
Diarist Frank.   		4 letters,"ANNE.    	Anne Frank has to be one of the most famous victims of the Holocaust. This is largely because the story of this young girl lives on in her widely published diary, and in adaptations of the diary for stage and screen. Anne Frank was a German until she lost her nationality in 1941 when the Nazis came to power. By this time she was living with her family in Amsterdam, as the Franks chose to flee Germany in 1933. When the Germans occupied the Netherlands, the family went into hiding in the attic of Otto Frank's office building (Otto was Anne's father). There the family hid for two whole years until they were betrayed. The family was split up, and Anne and her sister died from typhus in a concentration camp in 1945."
Grp.   		3 letters,"ELO.    	ELO of course stands for the Electric Light Orchestra, a symphonic rock group from the north of England. Their manager was Don Arden, father of Sharon Osbourne (wife of Ozzy)."
"Newsman Baxter on ""The Mary Tyler Moore Show"".   		3 letters","TED.    	Ted Baxter was the pompous and shallow TV newsman on 'The Mary Tyler Moore Show', played by the actor Ted Knight. Baxter was always concerned that he was going to lose his job, so in a nice twist in the storyline Baxter was the only character not to be laid off from the newsroom in the final episode of the show."
Football Hall-of-Famer Dickerson.   		4 letters,"ERIC.    	Eric Dickerson is a former NFL running back. Dickerson holds the single-season rushing record, a record that he set back in 1984."
"Water, in Waterloo.   		3 letters",EAU.    	Waterloo is a small municipality in Belgium. The name 'Waterloo' originated with the Dutch and is probably an anglicization of 'wet clearing in a forest'. The town is famous for the Battle of Waterloo that took place nearby in 1815.
IM pioneer.   		3 letters,"AOL.    	Even though instant messaging had been around since the 1960s, it was AOL who popularized the term 'instant message' in the eighties and nineties."
Symbol of Tut's power.   		3 letters,ASP.    	The venomous snake called an asp was a symbol of royalty in Ancient Egypt.
Lat.   		3 letters,SSR.    	Latvia is one of the former Soviet Socialist Republics. People from Latvia are called Letts.
"Adopted ""South Park"" sibling.   		3 letters",IKE.    	South Park' is an adult-oriented cartoon series on Comedy Central. I don't do 'South Park' ...
"Thurman of ""Pulp Fiction"".   		3 letters","UMA.    	Robert Thurman was the first westerner to be ordained a Tibetan Buddhist monk. Robert raised his children in the Tibetan Buddhist tradition and called his daughter ""Uma"" as it is a phonetic spelling of the Buddhist name ""Dbuma""."
Poetic paean.   		3 letters,"ODE.    	A paean is a poem or song that expresses triumph or thanksgiving. 'Paean' comes from the ancient Greek 'paian' meaning ""song of triumph'."
"""Benevolent"" club member.   		3 letters","ELK.    	The Benevolent and Protective Order of Elks (BPOE) was founded in 1868, and is a social club that has about a million members today. It started out as a group of men getting together in a ""club"" in order to get around the legal opening hours of taverns in New York City. The club took on a new role as it started to look out for poor families of members who passed away. The club now accepts African Americans as members (since the seventies) and women (since the nineties), but atheists still aren't welcome."
Bubbly source.   		4 letters,ASTI.    	Asti is in the Piedmont region of northwest Italy. The region is perhaps most famous for its Asti Spumante sparkling white wine.
Ice cream flavor.   		4 letters,"OREO.    	Apparently Oreo Ice Cream flavors were introduced relatively recently, in 2010."
Electric ___.   		3 letters,"EEL.    	Electrophorus electricus is the biological name for the electric eel. Despite its name, the electric ""eel"" isn't an eel at all, but rather what is called a knifefish, a fish with an elongated body that is related to the catfish. The electric eel has three pairs of organs along its abdomen, each capable of generating an electric discharge. The shock can go as high as 500 volts with 1 ampere of current (that's 500 watts), and that could perhaps kill a human."
"""Livin' Thing"" rock grp.   		3 letters","ELO.    	The Electric Light Orchestra (ELO) is a symphonic rock group from the north of England. The band's manager was Don Arden, father of Sharon Osbourne (wife of Ozzy)."
"""I Like ___"" ('50s political slogan).   		3 letters","IKE.    	There doesn't seem to be any good reason why President Eisenhower was called ""Ike"". However, it is known that the nickname dates back to his childhood as his parents called him ""Ike"" as well as 'Dwight'."
Part of a pod.   		4 letters,"ORCA.    	A group of whales is referred to as a pod, or a gam."
Eastern path.   		3 letters,"TAO.    	The Chinese character ""tao"" translates as ""path"", but the concept of Tao signifies the true nature of the world."
Arabian Peninsula land.   		4 letters,"OMAN.    	Oman lies on the southeast coast of the Arabian Peninsula and is neighbored by the UAE, Saudi Arabia and Yemen. The capital city of Muscat has a strategic location on the Gulf of Oman and has a history of invasion and unrest. Centuries of occupation by the Persians ended in 1507 when the Portuguese took the city in a bloody attack. The Portuguese held Muscat for much of the next one hundred years until finally being ousted by local Omani forces in 1648. A Yemeni tribe invaded the area in 1741 and set up a monarchy that has been in place in Oman ever since."
Org.   		3 letters,"ADA.    	The American Dental Association is the largest and oldest national dental association in the world. Today it is based in Chicago, but the association was founded in Niagara Falls, New York in 1859. The ADA started out as a group of 26 dentists, and it now has more than 152,000 members."
Wordsworth work.   		3 letters,"ODE.    	The great English poet William Wordsworth is intrinsically linked with the Lake District in the north of England, where he lived from much of his life. The Lake District is a beautiful part of the country, and I've been fortunate enough to visit Dove Cottage in Grasmere a couple of times, where Wordsworth lived with his wife Dorothy ..."
Uplifting feet?.   		3 letters,"ODE.    	In poetry, a 'foot' is the natural unit of stressed and unstressed syllables which make up the work. For example, an iambic foot consists of an unstressed syllable, followed by a stressed syllable."
"""Hairy man"" in Genesis.   		4 letters","ESAU.    	Esau was the twin brother of Jacob, the founder of the Israelites. When their mother Rebekah gave birth to the twins ""the first emerged red and hairy all over (Esau), with his heel grasped by the hand of the second to come out (Jacob)"". As Esau was the first born, he was entitled to inherit his father's wealth (it was his ""birthright""). Instead, Esau sold his birthright to Jacob for the price of a ""mess of pottage"" (a meal of lentils)."
Rice on a shelf.   		4 letters,ANNE.    	What a cleverly worded clue ... an Anne Rice book might be on your bookshelf.
Muscat is its capital.   		4 letters,"OMAN.    	Muscat is the capital of Oman, and lies on the northeast coast of the state on the Gulf of Oman, a branch of the Persian Gulf."
Eastern sultanate.   		4 letters,"OMAN.    	Oman lies on the southeast coast of the Arabian Peninsula, neighbored by the OAE, Saudi Arabia and Yemen. Oman is a Sultanate, headed by a hereditary sultan. The current head of state is Qaboos bin Said Al Said. He rules with the help of an elected advisory council (instituted in the early nineties), but here are no legal political parties."
"TV series with ""NY,"" ""Miami"" and ""Cyber"" spinoffs.   		3 letters","CSI.    	The 'CSI' franchise of TV shows has been tremendously successful, but seems to be winding down. 'CSI: Miami' (the 'worst' of the franchise, I think) was cancelled in 2012 after ten seasons. 'CSI: NY' (the 'best' of the franchise) was cancelled in 2013 after nine seasons. The original 'CSI: Crime Scene Investigation', set in Las Vegas, hung in there until 2015 when it ended with a two-hour TV movie. The youngest show in the series is 'CSI: Cyber', and it's still on the air."
"With 42-Across, bogey?.   		3 letters",ONE.    	42. See 34-Across and 45-Across : PAR
Way of the East.   		3 letters,"TAO.    	The Chinese character ""tao"" translates as ""path"", but the concept of Tao signifies the true nature of the world."
Homer's neighbor.   		3 letters,NED.    	Ned Flanders lives next door to Homer on TV's 'The Simpsons'. Ned is voiced by actor Harry Shearer and has been around since the very first episode aired in 1989.
Like.   		4 letters,A LA.    	The phrase 'in the style of' can be translated in 'alla' in Italian and 'à la' in French.
"Thurman of ""Pulp Fiction"".   		3 letters","UMA.    	Robert Thurman was the first westerner to be ordained a Tibetan Buddhist monk. Robert raised his children in the Tibetan Buddhist tradition and called his daughter ""Uma"" as it is a phonetic spelling of the Buddhist name ""Dbuma"". Uma's big break in movies came with her starring role in Quentin Tarantino's 1994 hit 'Pulp Fiction'. My favorite Uma Thurman film is the wonderful 1996 romantic comedy 'The Truth About Cats and Dogs'."
It was retired by the Yankees in 1986.   		3 letters,"ONE.    	The New York Yankees retired the uniform with the number 1 in 1986, the number worn by second baseman and manager Billy Martin."
William who invented the steam shovel.   		4 letters,"OTIS.    	William Otis invented the steam shovel, a precursor to our modern excavator or digger. The patent for the invention was issued in 1839. William was a cousin of Elisha Otis, the inventor of a safety device that prevents elevators from falling."
"Janeane's co-star in ""The Truth About Cats & Dogs"".   		3 letters","UMA.    	""The Truth About Cats & Dogs"" is one of my favorite movies of all time, and Janeane Garofalo one of my favorite actresses. You just have to see this one, a romantic comedy involving mistaken identity. The ""sexy"" role is played by Uma Thurman, but the real gal to get in this movie is Janeane."
One of a geog.   		3 letters,"SSR.    	The former Soviet Union (USSR) was created in 1922, not long after the Russian Revolution of 1917 that overthrew the Tsar. Geographically, the new Soviet Union was roughly equivalent to the old Russian Empire, and was comprised of fifteen Soviet Socialist Republics (SSRs)."
1040 datum: Abbr..   		3 letters,"SSN.    	Form 1040 was originally created just for tax returns for the years 1913, 1914 and 1915, but it just would not go away ..."
Piece of kabuki costumery.   		3 letters,OBI.    	The sash worn as part of traditional Japanese dress is known as an obi. The obi can be tied in what is called a butterfly knot.
Writer Fleming.   		3 letters,"IAN.    	Ian Fleming is most famous of course for writing the ""James Bond"" series of spy novels. You might also know that he wrote the children's story ""Chitty Chitty Bang Bang"", made into a cute movie released in 1968, and even a stage musical that opened in 2002."
Lacoste of tennis.   		4 letters,"RENE.    	René Lacoste was a French tennis player known for being very tenacious on court. This tenacity earned him the nickname 'the Crocodile'. When he went into the clothing business, specializing in tennis apparel, his Lacoste brand became famous for its green crocodile logo."
Hairy son of Isaac.   		4 letters,"ESAU.    	Esau was the twin brother of Jacob, the founder of the Israelites. When their mother Rebekah gave birth to the twins ""the first emerged red and hairy all over (Esau), with his heel grasped by the hand of the second to come out (Jacob)"". As Esau was the first born, he was entitled to inherit his father's wealth (it was his ""birthright""). Instead, Esau sold his birthright to Jacob for the price of a ""mess of pottage"" (a meal of lentils)."
Tyrannical Roman emperor.   		4 letters,"NERO.    	The Great Fire of Rome raged for five and a half days in 64 AD. Of the fourteen districts of Rome, three were completely destroyed, and seven more suffered serious damage. The emperor at the time was of course Nero, although reports that he fiddled, played his lyre or sang while the city burned; those accounts are probably not true. In fact, Nero was staying outside of Rome when the fire started, and rushed home on hearing the news. He organized a massive relief effort, throwing open his own home to give shelter to many of the citizens who were left living on the street."
