Leaving word.   		5 letters,"ADIEU.    	""Adieu"" is the French for ""goodbye"" or ""farewell"", from ""à Dieu"" meaning ""to God"". The plural of 'adieu' is 'adieux'."
Kind of sax.   		4 letters,"ALTO.    	The saxophone was invented by Belgian, Adolphe Sax. Sax developed lip cancer at one point in his life, and one has to wonder if that was related to his saxophone playing (I am sure not!). I had the privilege of visiting Sax's grave in the Cemetery of Montmartre in Paris a few years ago."
Ginnie ___.   		3 letters,"MAE.    	Ginnie Mae is the familiar nickname for the Government National Mortgage Association (GNMA), a government-owned corporation created in 1968 with the objective of promoting home ownership. The 'Ginnie Mae' nickname is derived from the GNMA acronym."
1996 Gwyneth Paltrow title role.   		4 letters,"EMMA.    	One of the more famous screen adaptations of Jane Austen's ""Emma"" is an excellent 1996 Miramax production starring the wonderful Gwyneth Paltrow in the title role. Also worth mentioning is the outstanding performance by Toni Collette as Emma's protégé, Harriet Smith."
___ Mountain (Pennsylvania ski resort).   		3 letters,"SNO.    	Snö Mountain is a ski resort in Scranton, Pennsylvania, in the Pocono region."
First name of 2012's Best Director.   		3 letters,"ANG.    	Taiwanese director Ang Lee sure has directed a mixed bag of films, mixed in terms of genre but not in terms of quality. He was at the helm for such classics as ""Sense & Sensibility"" (my personal favorite), ""Crouching Tiger, Hidden Dragon"", ""Hulk"", ""Brokeback Mountain"" and ""Life of Pi""."
"""Selma"" director DuVernay.   		3 letters","AVA.    	Ava DuVernay is a filmmaker who became the first African American woman to win the Best Director Prize at the Sundance Film Festival, a feat she achieved in 2012 for her feature film 'Middle of Nowhere'. 'Middle of Nowhere' tells the story of a woman who drops out of medical school to focus on husband when he is sentenced to 8 years in prison. DuVernay also directed the 2014 film 'Selma', which was centered on the 1965 voting rights marches from Selma to Montgomery, Alabama."
President with a Nobel Prize.   		5 letters,"OBAMA.    	President Barack Obama won the 2009 Nobel Peace Prize, becoming the fourth US president to be so honored. President Obama is the only one of the four to have been awarded the prize during his first year of office. The Nobel committee gave the award citing President Obama's work towards a new climate in international relations, particularly in reaching out to the Muslim world."
Cheer for a torero.   		3 letters,"OLE.    	""Toreador"" is an old Spanish word for a bullfighter, but it's a term not used any more in Spain nor in Latin America. In English we use the term ""toreador"", but in Spanish a bullfighter is a ""torero"". A female bullfighter in a 'torera'."
Subject of a 1773 Act of Parliament.   		3 letters,"TEA.    	The famous destruction of tea in Boston Harbor to protest against the Tax Act took place on December 16, 1773. The action was referred to as the 'destruction of the tea' for decades, and it wasn't until 1834 that the term 'Boston Tea Party' first appeared in print."
Nestlé ___ Caps.   		3 letters,"SNO.    	Sno-Caps are a brand of candy usually only available in movie theaters. Sno-caps have been around since the 1920s, would you believe?"
Culture medium.   		4 letters,"AGAR.    	Agar is a jelly extracted from seaweed that has many uses. It is found in Japanese desserts, and can also be used as a food thickener or even as a laxative, and it is the most common medium used for growing bacteria in Petri dishes."
Academic e-mail address ender.   		3 letters,EDU.    	The .edu domain was one of the seven first generic top-level domains specified. The complete original list is:
Food thickener.   		4 letters,"AGAR.    	Agar is a jelly extracted from seaweed, with many uses. It is found in Japanese desserts, can be used as a laxative, as a food thickener, and is the most common growth medium used for growing bacteria in petri dishes."
Old name for Tokyo.   		3 letters,"EDO.    	Edo is the former name of the Japanese city of Tokyo. Edo was the seat of the Tokugawa shogunate, a feudal regime that ruled from 1603 until 1868. The shogun lived in the magnificent Edo castle. Some parts of the original castle remain and today's Tokyo Imperial Palace, the residence of the Emperor of Japan, was built on its grounds."
Director Howard.   		3 letters,"RON.    	Ron Howard sure has come a long way since playing Opie on ""The Andy Griffith Show"". He has directed some fabulous movies, including favorites of mine like ""Apollo 13"", ""A Beautiful Mind"" and ""The Da Vinci Code"". And now Opie is even a grandfather ..."
Draft org.   		3 letters,"NBA.    	The National Basketball Association (NBA) was founded in 1946 as the Basketball Association of America. The NBA name was adopted in 1949. Of the four major sports leagues in North America, the NBA has the highest average annual salary per player."
___ Party (modern political group).   		3 letters,"TEA.    	The Tea Party Caucus in the US Congress is chaired by Minnesota Representative Michele Bachmann. The stated focus for the caucus is fiscal responsibility and limited government, while adhering to the groups interpretation of the US Constitution. Top contributors to the caucus are health professionals, retirees, the real estate industry as well as oil and gas interests."
"""Dies ___"".   		4 letters","IRAE.    	Dies Irae is Latin for ""Day of Wrath"". It is the name of a famous melody in Gregorian Chant, and is often used as part of the Roman Catholic Requiem Mass."
Muse of poetry.   		5 letters,"ERATO.    	In Greek mythology, Erato was the Muse of Lyric Poetry."
Year in Madrid.   		3 letters,ANO.    	Madrid is the largest city in Spain and the capital. Madrid is located very close to the geographical center of the country. It is the third-largest city in the European Union (after London and Paris). People from Madrid called themselves Madrileños.
Dollar competitor.   		5 letters,"ALAMO.    	The third largest car rental company right now is Alamo, a relative newcomer founded in 1974. Alamo made inroads (pun intended!) into the market by popularizing the idea of ""unlimited mileage""."
"Basse-Californie, e.g.   		4 letters","ETAT.    	In French, Baja California (Basse-Californie) is a state (état) in Mexico."
Eve's man.   		4 letters,"ADAM.    	According to the Bible, Eve was created as Adam's companion by God, creating her from Adam's rib."
Ten Commandments keeper.   		3 letters,"ARK.    	According to the Book of Exodus, the stone tablets on which the Ten Commandments are inscribed were placed in a chest called the Ark of the Covenant. The Ark was built according to instructions given by God to Moses on Mount Sinai."
Eve's man.   		4 letters,"ADAM.    	Eve is named as the wife of Adam in the Hebrew Bible and Christian Old Testament. However, Adam's wife is not specifically named in the Qur'an."
Airline to the Holy Land.   		5 letters,EL AL.    	El Al Israel Airlines is the flag carrier of Israel. The term 'el al' translates from Hebrew as 'to the skies'.
Allen in history.   		5 letters,"ETHAN.    	Ethan Allen was one of the founders of the state of Vermont. Allen was also a hero in the American Revolutionary War, famous for leading (along with Benedict Arnold) the small band of men that captured Fort Ticonderoga. And yes, the Ethan Allen store and furniture line is named for Ethan Allen the patriot."
Ministre d'___.   		4 letters,"ETAT.    	""Ministre d'État"" is French for ""Minister of State"". A Minister of State is not the equivalent of the US Secretary of State, as one might perhaps presume. In most countries, a minister of state is the name given to any junior minister, one reporting to a cabinet minister."
"""Dies ___"".   		4 letters","IRAE.    	""Dies Irae"" is Latin for ""Day of Wrath"". It is the name of a famous melody in Gregorian Chant, one that is often used as part of the Roman Catholic Requiem Mass."
Place for une île.   		3 letters,"MER.    	The French would find ""une ile"" (an island) in ""la mer"" (the sea)."
Ham preserver?.   		3 letters,"ARK.    	Ham was the son of Noah. According to the Bible, Ham and his wife, Ne'elatama'uk, were aboard the ark."
Sch.   		3 letters,PTA.    	The Parent Teacher Association supports schools.
"Main role on ""My Big Fat Greek Life"".   		3 letters","NIA.    	""My Big Fat Greek Life"" was a sitcom spin-off of the brilliant 2002 movie ""My Big Fat Greek Wedding"". Nia Vardalos was very much behind the film and the TV show, and played Nia Portokalos on TV. The TV show didn't go down well though, and only ran for a few episodes."
"Tokyo, formerly.   		3 letters","EDO.    	Edo is the former name of the Japanese city of Tokyo. Edo was the seat of the Tokugawa shogunate, a feudal regime that ruled from 1603 until 1868. The shogun lived in the magnificent Edo castle. Some parts of the original castle remain and today's Tokyo Imperial Palace, the residence of the Emperor of Japan, was built on its grounds."
"West of ""Batman"".   		4 letters","ADAM.    	Adam West is the actor who played the title role in the sixties TV series 'Batman'. These days you might hear West as the voice of a character called 'Adam West' on the animated show 'Family Guy'. Back in 1970, West was offered the role of James Bond in the movie 'Diamonds are Forever', but he turned it down!"
H.   		4 letters,"ELOI.    	In the 1895 novel by H. G. Wells ""The Time Machine"", there were two races that he encountered in his travels into the future. The Eloi were the beautiful people, that lived on the planet's surface, while the Morlocks were basically a slave race living underground."
Educ.   		4 letters,"ELHI.    	""Elhi"" is an informal word used to describe anything related to schooling from grades 1 through 12, i.e. elementary through high school."
Humanoid cryptid.   		4 letters,"YETI.    	A cryptid is a creature or plant that isn't recognized by the scientific community, but who existence has been suggested."
"Group whose last Top 40 hit was ""When All Is Said and Done"".   		4 letters","ABBA.    	I am an unapologetic fan of ABBA's music. ABBA was of course the Swedish group who topped the charts in the seventies and eighties. The name ABBA is an acronym formed from the first letters of the given names of each of the band members, namely: Agnetha, Benny, Bjorn and Anni-Frid."
Time's second African-American Person of the Year.   		5 letters,"OBAMA.    	The first African American to be named as 'Time' magazine's Person of the Year was Dr. Martin Luther King, Jr., for 1963. The second was President Barack Obama, for 2012."
"""As You Like It"" servant.   		4 letters","ADAM.    	""As You Like It"" is one of Shakespeare's comedies, the tale of Rosalind fleeing from her Uncle's court, along with her cousin, Celia and the court jester, Touchstone. Adam is a relatively minor role, a faithful old servant of Orlando. The interesting thing about the role of Adam though is that some people think that Shakespeare himself played the role in some performances. The play is perhaps most memorable for its oft-wuoted speach that starts with ""All the world's a stage,"
Jim Davis cartoon dog.   		4 letters,"ODIE.    	Odie is Garfield's best friend, and is a slobbery beagle."
Home for clover lovers.   		4 letters,"EIRE.    	Well ... we Irish folk don't love all clover, just the variety known as shamrock."
Noted 1983 graduate of Columbia.   		5 letters,OBAMA.    	There are only two US Presidents who have two degrees from Ivy League schools. The first is President George W. Bush. President Bush holds a BA from Yale and an MBA from Harvard. The second is President Barack Obama. President Obama holds a BA in political science from Columbia and a JD from Harvard Law School.
Prey of the Morlocks.   		4 letters,"ELOI.    	In the 1895 novel by H. G. Wells called ""The Time Machine"", there are two races that the hero encounter in his travels into the future. The Eloi are the 'beautiful people' who live on the planet's surface. The Morlocks are a race of cannibals living underground who use the Eloi as food."
"""The Time Machine"" race.   		4 letters","ELOI.    	In the 1895 novel by H. G. Wells called ""The Time Machine"", there were two races that the hero encountered in his travels into the future. The Eloi are the 'beautiful people' who live on the planet's surface, while the Morlocks are a race of cannibals living underground who use the Eloi as food."
"All the way through 12th grade, informally.   		4 letters","ELHI.    	""Elhi"" is an informal word used to describe anything related to schooling from grades 1 through 12, i.e. elementary through high school."
1960s TV's Cousin ___.   		3 letters,"ITT.    	In the television sitcom ""The Addams Family"", the family had a frequent visitor called Cousin Itt. Itt is a short man with long hair that runs from his head to the floor. Cousin Itt was played by Italian actor Felix Silla."
First name of Dickens's Little Dorrit.   		3 letters,"AMY.    	'Little Dorrit' is a novel by Charles Dickens, a satirical work that takes potshots at the government and society of the day."
"Hoagy Carmichael's ""___ Buttermilk Sky"".   		3 letters","OLE.    	Hoagy Carmichael's was born Hoagland Howard Carmichael. Carmichael's remarkable first name was given to him in honor of a circus troupe called ""The Hoaglands"" who stayed at the Carmichael house during his mother's pregnancy. Now that, that's a story ..."
Poet Lazarus.   		4 letters,"EMMA.    	Emma Lazarus was a poet from New York City who is best known as the author of an 1883 sonnet 'The New Colossus'. 'The New Colossus' sits on a bronze plaque inside the pedestal of the Statue of Liberty, a fitting location given that the title refers to Lady Liberty."
Maker of fuel additives.   		3 letters,STP.    	STP motor oil takes its name from Scientifically Treated Petroleum.
"Basketball player who starred in ""Kazaam"".   		6 letters","O'NEAL.    	Shaquille O'Neal is one of the heaviest players ever to have played in the NBA (weighing in at around 325 pounds). Yep, he's a big guy ... 7 foot 1 inch tall."
Like cardinals.   		3 letters,RED.    	Cardinal red is a vivid shade that takes its name from the cassocks worn by Roman Catholic cardinals. The bird known as a cardinal takes its name from the color.
Indian attire.   		4 letters,"SARI.    	The item of clothing called a ""sari"" (also ""saree"") is a strip of cloth, as one might imagine, unusual perhaps in that is unstitched along the whole of its length. The strip of cloth can range from four to nine meters long (that's a lot of material!). The sari is usually wrapped around the waist, then draped over the shoulder leaving the midriff bare. I must say, it can be a beautiful item of clothing."
San Antonio mission.   		5 letters,"ALAMO.    	The famous Alamo in San Antonio, Texas was originally known as Mission San Antonio de Valero. The mission was founded in 1718 and was the first mission established in the city. The Battle of the Alamo took place in 1836, a thirteen-day siege by the Mexican Army led by President General Antonio Lopez de Santa Anna. Only two people defending the Alamo Mission survived the onslaught. One month later, the Texian army got its revenge by attacking and defeating the Mexican Army in the Battle of San Jacinto. During the surprise attack on Santa Anna's camp, many of the Texian soldiers were heard to cry ""Remember the Alamo!""."
"""Tickle Me"" doll.   		4 letters","ELMO.    	Tickle Me Elmo was a sensational fad in the late nineties, with stores raising prices dramatically above the recommended retail price to take advantage of demand. Reportedly, prices as high as $1500 were paid at the height of the craze. The toy's manufacturer, Tyco, originally planned to market the ""tickle"" toy as Tickle Me Tasmanian Devil (after the ""Looney Tunes"" character), but then went with ""Elmo"" after they bought the rights to use ""Sesame Street"" names."
Bye line?.   		5 letters,"ADIEU.    	""Adieu"" is the French for ""goodbye"" or ""farewell"", from ""à Dieu"" meaning ""to God"". The plural of 'adieu' is 'adieux'."
N.B.A.   		3 letters,RON.    	Ron Artest is a professional basketball player with the Los Angeles Lakers. Artest won the award for NBA Defensive Player of the Year in 2004.
Giant of legend.   		4 letters,"YETI.    	A yeti is a beast of legend, also called an abominable snowman. ""Yeti"" is a Tibetan term, and the beast is fabled to live in the Himalayan regions of Nepal and Tibet. Our equivalent legend in North America is that of Bigfoot, also known as Sasquatch. The study of animals whose existence have not yet been substantiated is called cryptozoology."
Org.   		3 letters,"NBA.    	LeBron James plays basketball for the Miami Heat. James seems to be in demand for the covers of magazines. He became the first African American man to adorn the front cover of ""Vogue"" in March 2008. That made him only the third male to make the ""Vogue"" cover, following Richard Gere and George Clooney."
"7'1"" former N.B.A.   		6 letters","O'NEAL.    	Shaquille O'Neal is one of the heaviest players ever to have played in the NBA (weighing in at around 325 pounds). Yep, he's a big guy ... 7 foot 1 inch tall. He is also the oldest player active in the NBA today, around 40 years old."
Austen novel.   		4 letters,"EMMA.    	""Emma"" is just a wonderful novel by Jane Austen, first published in 1815. I had the privilege a few years ago of attending the premier of ""Emma"", a delightful musical adaptation for the stage. If you ever get the chance to see it, I highly recommend it ..."
Precursor of rocksteady.   		3 letters,"SKA.    	Ska originated in Jamaica in the late fifties and was the precursor to reggae music. No one has a really definitive etymology of the term ""ska"", but it is likely to be imitative of some sound."
"Man from Oman, e.g.   		4 letters","ARAB.    	Oman lies on the southeast coast of the Arabian Peninsula, neighbored by the OAE, Saudi Arabia and Yemen. The capital city of Muscat has a strategic location on the Gulf of Oman, and has a history of invasion and unrest. Centuries of occupation by the Persians ended in 1507 when the Portuguese took the city in a bloody attack. The Portuguese held Muscat for much of the next century until finally ousted by local Omani forces in 1648. A Yemeni tribe invaded the area in 1741 and set up a monarchy that has been in place ever since."
Cara ___ (Italian term of endearment).   		3 letters,"MIA.    	""Cara mia"" is the Italian for ""my beloved""."
"Weena's race, in fiction.   		4 letters","ELOI.    	In the 1895 novel by H. G. Wells called ""The Time Machine"", there are two races that the hero encounter in his travels into the future. The Eloi are the 'beautiful people' who live on the planet's surface. The Morlocks are a race of cannibals living underground who use the Eloi as food."
"Morales of ""Caprica"".   		4 letters","ESAI.    	Esai Morales is best known for his role in the 1987 movie ""La Bamba"", which depicted the life of Ritchie Valens and his half-brother Bob Morales (played by Esai)."
A choli may be worn under this.   		4 letters,"SARI.    	In the sari costume worn by women, the choli is the blouse-like garment that leaves the midriff bare."
"Either co-star of ""Paper Moon"".   		6 letters",O'NEAL.    	Father and daughter Ryan and Tatum O'Neal starred in the 1973 comedy 'Paper Moon'.
It may be bid in the end.   		5 letters,"ADIEU.    	""Adieu"" is the French for ""goodbye"" or ""farewell"", from ""à Dieu"" meaning ""to God""."
Home to Iowa State.   		4 letters,"AMES.    	Iowa State University of Science and Technology (ISU) is located in Ames, Iowa. Among many other notable events, ISU created the country's first school of veterinary medicine, in 1879. The sports teams of ISU are known as the Cyclones."
"""Buy it new.   		4 letters","EBAY.    	eBay is an auction site with a twist. If you don't want to enter into an auction to purchase an item, there's a ""Buy It Now"" price. Agree to pay it, and the item is yours!"
"Like Mao's ""little"" book.   		3 letters","RED.    	During China's Cultural Revolution, the Communist Party published a book of statements and writings from Chairman Mao Zedong. Here in the West the publication is usually referred to as 'The Little Red Book'."
Young Darth Vader's nickname.   		3 letters,"ANI.    	Anakin 'Ani' Skywalker is the principal character in all six of the ""Star Wars"" movies. His progress chronologically through the series of films is:"
"""Dies ___"".   		4 letters","IRAE.    	""Dies Irae"" is Latin for ""Day of Wrath"". It is the name of a famous melody in Gregorian Chant, one that is often used as part of the Roman Catholic Requiem Mass."
Woman in a choir.   		4 letters,"ALTO.    	In choral music, an alto is the second-highest voice in a four-part chorus made up of soprano, contr(alto), tenor and bass. The word ""alto"" describes the vocal range, that of the deepest female singing-voice, whereas the term ""contralto"" describes more than just the alto range, but also its quality and timbre. An adult male's voice (not a boy's) with the same range as an alto is called a ""countertenor""."
Artist's alias with an accent.   		4 letters,"ERTE.    	Erté was the pseudonym of French artist (Russian born) Romain de Tirtoff. Erté is the French pronunciation of his initials ""R.T."""
Crumpet's go-with.   		3 letters,"TEA.    	I do love a nice crumpet. They are made from flour and yeast, with baking soda added to make the characteristic holes in the surface. Served hot, with butter melted into the holes, nothing better ..."
"Bauxite, e.g.   		3 letters","ORE.    	Bauxite is an aluminum ore. It takes its name from the absolutely beautiful village of Les Baux in southern France, the home of the geologist who first recognized that the mineral was a useful source of the metal."
Comic strip dog with a long tongue.   		4 letters,"ODIE.    	Odie is Garfield's best friend and is a slobbery beagle, a character in Jim Davis's comic strip."
Animal house?.   		3 letters,"ARK.    	The term 'ark', when used with reference to Noah, is a translation of the Hebrew word 'tebah'. The word 'tebah' is also used in the Bible for the basket in which Moses was placed by his mother when she floated him down the Nile. It seems that the word 'tebah' doesn't mean 'boat' and nor does it mean 'basket'. Rather, a more appropriate translation is 'life-preserver' or 'life-saver'. So, Noah's ark was Noah's life-preserver during the flood."
Bassist Cook of Creedence Clearwater Revival.   		3 letters,STU.    	The rock band Creedence Clearwater Revival formed in the sixties. The name was chosen from:
Flight board abbr..   		3 letters,ETD.    	Estimated time of departure (ETD)
"""Fernando"" band.   		4 letters","ABBA.    	'Fernando' was a 1976 hit for ABBA, a followup to their smash hit 'Dancing Queen'. 'Fernando' was originally released as a solo single by one the ABBA band members: Anni-Frid Lyngstad."
Coup d'___.   		4 letters,"ETAT.    	A coup d'etat (often just ""coup"") is the sudden overthrow of a government, and comes from the French ""stroke of state""."
It might accompany a wave in Waikiki.   		5 letters,ALOHA.    	One might wave one's hand while saying 'aloha!' in Hawaii.
Start of a conclusion.   		4 letters,"ERGO.    	""Ergo"" is the Latin word for ""hence, therefore""."
Race in an H.   		4 letters,"ELOI.    	In the 1895 novel by H. G. Wells called ""The Time Machine"", there are two races that the hero encounter in his travels into the future. The Eloi are the 'beautiful people' who live on the planet's surface. The Morlocks are a race of cannibals living underground who use the Eloi as food."
___ Balls.   		3 letters,"SNO.    	The Hostess cakes called Sno Balls are usually pink in color, although in its original form each packet of two cakes contained one white and one pink. Around Halloween you can buy Sno Balls in the form of Scary Cakes and Glo Balls that are colored orange and green. and on St. Paddy's Day there's a green one available. Yoo hoo!"
One of the Eastern elite.   		3 letters,"AGA.    	""Aga"" (also ""agha"") is a title that was used by both civil and military officials in the Ottoman Empire."
Japan's ___ Castle.   		3 letters,"EDO.    	Edo is the former name of the Japanese city of Tokyo. Edo was the seat of the Tokugawa shogunate, a feudal regime that ruled from 1603 until 1868. The shogun lived in the magnificent Edo Castle. Some parts of the original castle remain and today's Tokyo Imperial Palace, the residence of the Emperor of Japan, was built on its grounds."
François's farewell.   		5 letters,"ADIEU.    	""Adieu"" is the French for ""goodbye"", or ""farewell"", from ""a Dieu"" meaning ""to God""."
Source of iron.   		3 letters,"ORE.    	Iron ore comes in a number of different forms, like magnetite (the most magnetic of all minerals) and hematite (the most commonly exploited iron ore)."
Bridge four-pointer.   		3 letters,ACE.    	Bridge players routinely assess the value of their hands by giving points to certain cards:
Half of a TV duo.   		5 letters,"ERNIE.    	I've always believed that the ""Sesame Street"" characters Bert and Ernie were named after two roles played in the Christmas classic ""It's a Wonderful Life"". In the movie, the policeman's name is Bert and his taxi-driving buddy is named Ernie. However, the ""Sesame Street"" folks have stated that the use of the same names is just a coincidence."
