Sandwich man?.   		4 letters,"EARL.    	Meats placed between slices of bread was first called a sandwich in the 18th century, named after the Fourth Earl of Sandwich. The Earl was fond of eating ""sandwiches"" while playing cards at his club."
"""60 Minutes"" correspondent Logan.   		4 letters","LARA.    	Lara Logan is a South African newswoman, currently the Chief Foreign Affairs Correspondent for CBS News."
Abu Simbel's waterway.   		4 letters,"NILE.    	Abu Simbel is a location in southern Egypt, the site of two temples carved out of a mountainside. The two rock temples had to be relocated to Abu Simbel in 1968 to save them from being submerged in the water above the Aswan High Dam that was being built across the Nile River."
Rio maker.   		3 letters,KIA.    	Kia have making the subcompact model called a Rio since 2000.
"Springsteen's ""Born in the ___"".   		3 letters","USA.    	'Born in the USA' is a 1984 song (and album) written and recorded by Bruce Springsteen. The song was written three years earlier as the title song for a movie, but was never used. That film ultimately was released as 'Light of Day' starring Michael j. Fox. The original intention was for Springsteen to star in the film himself."
"""Bad Girls"" rapper.   		3 letters",MIA.    	M.I.A. is the stage name of British rap artist Maya Arulpragasam.
"Kind of provider, for short.   		3 letters","DSL.    	An Internet Service Provider (ISP) is just what the name indicates, a company that provides its customers with access to the Internet. One way that ISPs differentiate themselves from each other is in the way in which end users are connected to the ISP's network. So, there are cable ISPs, DSL ISPs, dial-up ISPs and satellite ISPs."
"Surfing option, for short.   		3 letters","DSL.    	DSL originally stood for Digital Subscriber Loop, but is now accepted to mean (Asymmetric) Digital Subscriber Line. DSL is the technology that allows Internet service be delivered down the same telephone line as voice service, by separating the two into different frequency signals."
Radiation dosage.   		3 letters,"REM.    	The contemporary standard radiation dosage unit is the 'roentgen equivalent in man', abbreviated to 'rem'."
Salt Lake City's state.   		4 letters,"UTAH.    	Salt Lake City was of course founded by Brigham Young, in 1847. The city takes its name from the Great Salt Lake on which it sits, and indeed was known as ""Great Salt Lake City"" up until 1868."
Replacement for the franc and mark.   		4 letters,"EURO.    	The European Union (EU) today stands at a membership of 27 states. The Euro is the official currency of only 16 of the 27. The list of states in the EU that don't use the Euro includes the UK, Denmark and Sweden."
Radiation unit.   		3 letters,"REM.    	The contemporary standard radiation dosage unit is the roentgen equivalent in man, abbreviated to 'rem'."
Sister of Helios.   		3 letters,"EOS.    	In Greek mythology, Eos is the goddess of the dawn who lived at the edge of the ocean. Eos would wake each morning to welcome her brother Helios the sun. The Roman equivalent of Eos is Aurora."
Place for a hammer and stirrup.   		3 letters,"EAR.    	The middle ear is the portion of the ear immediately behind the eardrum. The middle ear contains three small bones called the ossicles, the three smallest bones in the human body. The ossicles' job is to transmit sound from the outer ear to the inner ear. The shape of the bones gives rise to their common names: the hammer, anvil and stirrup."
Memo opener.   		5 letters,"IN RE.    	The term ""in re"" is Latin, derived from ""in"" (in) and ""res"" (thing, matter). ""In re"" literally means ""in the matter"", and is used to mean ""in regard to"", or ""in the matter of""."
Dr.   		4 letters,"IGOR.    	Igor has been the assistant to Dracula, Frankenstein and Young Frankenstein among others. Igor is almost invariably portrayed as a hunchback."
"Bit of body art, informally.   		3 letters","TAT.    	The word ""tattoo"" was first used in English in the writings of the famous English explorer Captain Cook. In his descriptions of the indelible marks adorning the skin of Polynesian natives, Cook anglicized the Tahitian word ""tatau"" into our ""tattoo""."
One piece of a two-piece.   		3 letters,"BRA.    	The word ""brassière"" is of course French in origin, but it isn't the word the French use for a ""bra"". In France what we call a bra is known as a ""soutien-gorge"", translating to ""held under the neck"". The word ""brassière"" is indeed used in France but there it describes a baby's undershirt, a lifebelt or a harness. ""Brassière"" comes from the Old French word for an ""arm protector"" in a military uniform (""bras"" is the French for ""arm""). Later ""brassière"" came to mean ""breast plate"" and from there was used for a type of woman's corset. The word jumped into English around 1900."
Texas patriot Houston.   		3 letters,"SAM.    	Sam Houston was the first President of the Republic of Texas, a US Senator for Texas, as well as governor of the state. Houston was also governor of Tennessee in his earlier life and is the only person in US history to have been governor of two different states. The city of Houston is of course named for Sam, and the city boasts a statue of Houston that's the largest free-standing statue of any American."
Home of Sunset and Paradise.   		4 letters,"UTAH.    	Sunset is a city in Utah located about 25 miles north of Salt Lake City. The city was named by a group of ladies in 1916, who were impressed by the beauty of a colorful sunset over the nearby Great Salt Lake."
Rank below a marquis.   		4 letters,"EARL.    	In the ranking of nobles, an earl comes above a viscount and below a marquess. The rank of earl is used in the British peerage system and is equivalent to the rank of count in other countries. Other British ranks have female forms (e.g. marquess and marchioness, viscount and viscountess), but there isn't a female word for the rank of earl. A female given the same rank as an earl is known simply as a countess."
Reason for a semiannual shift: Abbr..   		3 letters,"DST.    	On the other side of the Atlantic, Daylight Saving Time (DST) is known as ""summer time"". The idea behind summer/daylight-savings is to move clocks forward an hour in spring and backwards in the fall so that afternoons have more daylight."
"Making out on the subway, e.g., for short.   		3 letters",PDA.    	PDA is an abbreviation for 'public display of affection'.
Group defeated in '65.   		3 letters,"CSA.    	The Confederated States of America conceded defeat on November 6, 1865."
"Wand (Dawn) representer, in myth.   		3 letters","EOS.    	In Greek mythology, Eos is the goddess of the dawn who lived at the edge of the ocean. Eos would wake each morning to welcome her brother Helios the sun. The Roman equivalent of Eos is Aurora."
Long in Hollywood.   		3 letters,"NIA.    	Nia Long is an American actress, probably best known for playing Will Smith's sometime girlfriend and fiancee Lisa Wilkes on the TV show ""The Fresh Prince of Bel Air""."
About.   		5 letters,"IN RE.    	The term ""in re"" is Latin, derived from ""in"" (in) and ""res"" (thing, matter). ""In re"" literally means ""in the matter"", and is used to mean ""in regard to"", or ""in the matter of""."
Mai ___.   		3 letters,"TAI.    	The Mai Tai cocktail is strongly associated with the Polynesian islands, but the drink was supposedly invented in 1944 in Trader Vic's restaurant in Oakland, California. One recipe is 6 parts white rum, 3 parts orange curaçao, 3 parts Orgeat syrup, 1 part rock candy syrup, 2 parts fresh lime juice, all mixed with ice and then a float added of 6 parts dark rum."
Sailors' saint.   		4 letters,"ELMO.    	St. Elmo is the patron saint of sailors. He lends his name to the electrostatic weather phenomenon (often seen at sea) known as St. Elmo's fire. The ""fire"" is actually a plasma discharge caused by air ionizing at the end of a pointed object (like the mast of a ship), something often observed during electrical storms."
"B-school grad, perhaps.   		3 letters",CPA.    	A certified public accountant (CPA) might graduate from a business school (B-school).
Carrier with a hub in Copenhagen.   		3 letters,"SAS.    	SAS, formerly known as Scandinavian Airlines System, is the flag carrier of three countries: Denmark, Norway and Sweden."
"Steered (Deseret) , today.   		4 letters","UTAH.    	When Mormon pioneers were settling what is today the state of Utah, they referred to the area as Deseret, a word that means 'beehive' according to the Book of Mormon. Today Utah is known as the Beehive State and there is a beehive symbol on the Utah state flag."
Broadband letters.   		3 letters,"DSL.    	DSL originally stood for Digital Subscriber Loop, but is now accepted to mean (Asymmetric) Digital Subscriber Line. DSL is the technology that allows Internet service be delivered down the same telephone line as voice service, by separating the two into different frequency signals."
Salt flats location.   		4 letters,UTAH.    	The largest salt pan located near the Great Salt Lake is the famous Bonneville Salt Flats. There is an area in the Flats called the Bonneville Speedway that is devoted to motor sports and is noted as a venue for numerous land speed records.
Org.   		3 letters,DEA.    	The Drug Enforcement Administration (DEA) was set up in 1973 while President Nixon was in office.
U2's homeland.   		4 letters,"EIRE.    	Irish singer Bono is a Dubliner, born Paul David Hewson. As a youth, Hewson was given the nickname ""Bono Vox"" by a friend, a Latin expression meaning ""good voice"", and so the singer has been known as Bono since the late seventies. His band's first name was ""Feedback"", later changed to ""The Hype"". The band members searched for yet another name and chose U2 from a list of six names suggested by a friend. They picked U2 because it was the name they disliked least ..."
Top piece.   		3 letters,"BRA.    	The word ""brassière"" is of course French in origin, but it isn't the word the French use for a ""bra"". In France what we call a bra is a ""soutien-gorge"", translating to ""held under the neck"". The word ""brassière"" is indeed used in France but there it describes a baby's undershirt, a lifebelt or a harness. ""Brassière"" comes from the Old French word for an ""arm protector"" in a military uniform (""bras"" is the French for ""arm""). Later ""brassière"" came to mean ""breast plate"" and from there was used for a type of woman's corset. The word jumped into English around 1900."
___ Today.   		3 letters,"USA.    	The title of widest circulation of any American newspaper is an honor competed for by ""The Wall Street Journal"" and ""USA Today"", with each paper selling about 2 million copies each day (including online subscribers). ""USA Today"" was launched in 1982."
Key on the far left of a keyboard.   		3 letters,"TAB.    	Like most features on our computer keyboards, the tab key is a hangover from the days of typewriters. When using a typewriter, making entries into a table was very tedious, involving lots of tapping on the space bar and the backspace key. So a lever was added to typewriters that allowed the operator to ""jump"" across the page to positions that could be set by hand. Later this lever was simplified to a tab key which could be depressed, causing the carriage to jump to the next tab stop in much the same way that the modern tab key works on a computer."
"Scores of Vikings, for short.   		3 letters",TDS.    	Touchdowns (TDs)
Ex-governor Spitzer of New York.   		5 letters,ELIOT.    	Eliot Spitzer was the Governor of New York for just over a year before he resigned when it surfaced that he had been a client of a prostitution ring.
Plot element?.   		4 letters,"ACRE.    	At one time, an acre was defined as the amount of land a yoke of oxen could plow in a day. This was more precisely defined as a strip of land one furlong long (660 feet) and one chain wide (66 feet). The word ""furlong"" is actually derived from the Old English words meaning ""furrow-long"", the length of the furrow plowed by the oxen."
Quinceañera invitee.   		3 letters,"TIA.    	In Spanish, a 'tia' (aunt) is a member of 'la familia' (the family)."
CPR specialist.   		3 letters,EMT.    	Emergency medical technician (EMT).
"Bigeye, on some menus.   		3 letters","AHI.    	Yellowfin and bigeye tuna are usually marketed as ""ahi"", the Hawaiian name. They are both big fish, with yellowfish tuna often weighing over 300 pounds, and bigeye tuna getting up to 400 pounds."
One with a pretty strong hunch?.   		4 letters,"IGOR.    	Igor has been the assistant to Dracula, Frankenstein and Young Frankenstein among others. Igor is almost invariably portrayed as a hunchback."
Ryder Cup side.   		3 letters,"USA.    	The Ryder Cup trophy was donated to the game of golf by Samuel Ryder, an English entrepreneur. Ryder made his money selling garden seeds in small packets. He only took up golf when he was in his fifties but became quite the enthusiast and eventually donated the trophy in 1927, when it was valued at 100 guineas."
Architect Saarinen.   		4 letters,"EERO.    	Eero Saarinen was a Finnish American architect, renowned in this country for his unique designs for public buildings such as Gateway Arch in St. Louis, Dulles International Airport Terminal, and the TWA building at JFK. The list of his lesser-known, but still impressive, works includes several buildings erected on academic campuses. For example, the Chapel and Kresge Auditorium on the MIT campus, the Emma Hartman Noyes House at Vassar College, the Law School building at the University of Chicago, and Yale's David S. Ingalls Rink."
Nordic flier.   		3 letters,"SAS.    	SAS was formerly known as Scandinavian Airlines System and is the flag carrier of three countries: Denmark, Norway and Sweden."
Northern French river.   		4 letters,"YSER.    	The Yser originates in northern France and flows though Belgium into the North Sea. The Yser name is oft associated with WWI as it figured in a major battle early in the conflict. In the first three months of the war, the German Army pushed almost completely through Belgium, inflicting heavy losses on the Belgian Army as the defenders were forced to fight a fast-moving rearguard action. The Germans were intent on pushing right through Belgium, across France in a ""race to the sea"". But the Belgians, with the help of its Allies, decided to make a final stand at the Yser Canal in an effort to prevent the Germans reaching the French ports of Calais and Dunkirk. The 22-mile long defensive line was chosen at the Yser because the river and canal system could be flooded to create a barrier that might be defended. The plan was successful, and the front was ""stabilized"". As we now know, millions of lives were lost over the coming years with very little movement of that battle line."
"Witherspoon who played 11-Down in ""Walk the Line"".   		5 letters","REESE.    	(11D. Wife portrayed in 2005's ""Walk the Line"" : JUNE CARTER)"
Canon offering.   		3 letters,"EOS.    	I've been using Canon EOS cameras for decades now, and have nothing but good things to say about the cameras and the lenses. The EOS name stands for Electro-Optical System, and was chosen because it evokes the name of Eos, the Titan goddess of dawn from Greek mythology."
Sports anchor Berman.   		3 letters,"LEN.    	Len Berman is a former sports journalist on WNBC, NBC's flagship station located in New York City."
"Rescue squad member, for short.   		3 letters",EMT.    	Emergency medical technician (EMT)
Keyboard key.   		3 letters,"TAB.    	Like most features on our computer keyboards, the tab key is a hangover from the days of typewriters. When using a typewriter, making entries into a table was very tedious as it involved lots of tapping on the spacebar and backspace key. So, a lever was added to typewriters that allowed the operator to ""jump"" across the page to positions that could be set by hand. Later this was simplified to a tab key, which could be depressed causing the carriage to jump to the next tab stop in much the same way that the modern tab key works on a computer."
Where Union Pacific is headquartered.   		5 letters,"OMAHA.    	The Union Pacific Railroad is the largest railroad in the US. Union Pacific operates over 8.000 locomotives, and all of that rolling stock operates west of Chicago and New Orleans."
Luau accompaniment.   		3 letters,UKE.    	The ukulele originated in the 1800s and mimicked a small guitar brought to the Hawaiian Islands by Portuguese immigrants.
"Source of the word ""trousers"".   		4 letters","ERSE.    	There are actually three Erse languages. Irish, Manx (spoken on the Isle of Man) and Scots Gaelic. In their own tongues, these would be Gaeilge (in Ireland), Gaelg (on the Isle of Man) and Gaidhlig (in Scotland)."
"Balancing expert, in brief?.   		3 letters",CPA.    	Certified Public Accountant (CPA)
"Logan of ""60 Minutes"".   		4 letters","LARA.    	Lara Logan is a South African newswoman, and is currently the Chief Foreign Affairs Correspondent for CBS News. CBS placed Logan on a forced leave of absence at the end of 2013 for comments that she made about the US Government's culpability in the Benghazi attack and for inaccuracies in her reporting of the story."
Peeples or Vardalos.   		3 letters,"NIA.    	Actress Nia Peeples played the character Nicole Chapman in the TV series ""Fame""."
Contemporary of Ngaio.   		4 letters,"ERLE.    	Dame Ngaio Marsh was a New Zealand crime writer. She is known as one of the four original ""Queens of Crime"", namely: Dorothy L. Sayers, Margery Allingham, Agatha Christie, and Marsh. All her novels feature her hero, a British CID detective, Roderick Alleyn."
___ tide.   		4 letters,"NEAP.    	Tides of course are caused by the gravitational pull of the moon on the oceans. At neap tide, the smaller gravitational effect of the sun cancels out some of the moon's effect. At spring tide, the sun and the moon's gravitational forces act in concert causing more extreme movement of the oceans."
"First song on ""More of the Monkees"".   		3 letters","SHE.    	The Monkees pop group was assembled in 1966 specifically for a planned television series called 'The Monkees'. The show aired from 1966 to 1968, and the band continued to perform in concerts until 1970. 20 years after the band was formed, there was a revival in interest for both the show and the band's music, so the Monkees got together for several reunion tours. The lead singer of the group was Englishman Davy Jones, who passed away in February 2012."
Heart chambers.   		5 letters,"ATRIA.    	The heart has four chambers. The two upper chambers (the atria) accept deoxygenated blood from the body and oxygenated blood from the lungs. The atria squeeze the blood into the two lower chambers of the heart (the ventricles), 'priming' the pump, as it were. One ventricle pumps deoxygenated blood to the lungs, and the other pumps oxygenated blood to the rest of the body."
"""Vous êtes ___"".   		3 letters","ICI.    	""Vous êtes ici"" are important words to know when navigating your way around Paris. They mean ""You are here"", and you'll often see them on maps in the street."
When clocks are set ahead: Abbr..   		3 letters,"DST.    	On the other side of the Atlantic Daylight Saving Time is known as ""summer time"". The idea is to move clocks forward an hour in spring and backwards in the fall, so that afternoons have more daylight."
"___ Aarnio, innovative furniture designer.   		4 letters","EERO.    	Eero Aarnio is a Finnish interior designer, perhaps most famous for creating those round, plastic chairs that hung from the ceiling and were very fashionable in the sixties. It was sort of like sitting inside a big ball."
Writer ___ Stanley Gardner.   		4 letters,"ERLE.    	I must have read all of the Perry Mason books when I was in college. I think they kept me sane when I was facing the pressure of exams. Author Erle Stanley Gardner was himself a lawyer, although he didn't get into the profession the easy way. Gardner went to law school, but got himself suspended after a month. So, he became a self-taught attorney and opened his own law office in Merced, California. Understandably, he gave up the law once his novels became successful."
Jewelry designer Peretti.   		4 letters,"ELSA.    	Elsa Peretti is a native of Florence, Italy who has been designing jewelry and related items for the top fashion houses in New York since the sixties."
Composer Stravinsky.   		4 letters,"IGOR.    	The composer Igor Stravinsky's most famous works were completed relatively early in his career, when he was quite young. His three ballets ""The Firebird"", ""Petrushka"" and ""The Rite of Spring"" were published in 1910-1913, when Stravinsky was in his early thirties."
'Tis the season.   		4 letters,"NOEL.    	The music for the Christmas song 'Deck the Halls' is a traditional Welsh tune that dates back to the 16th century. The same tune was used by Mozart for a violin and piano duet. The lyrics with which we are familiar (other than the 'tra-la-la') are American in origin, and were recorded in 19th century. ''Tis the season to be jolly ...'"
Proof-ending word.   		4 letters,"ERAT.    	QED is used at the end of a mathematical proof or a philosophical argument. The QED acronym stands for the Latin ""quod erat demonstrandum"" meaning ""that which was to be demonstrated""."
Div.   		3 letters,DEA.    	Drug Enforcement Administration (DEA)
"Deseret, today.   		4 letters","UTAH.    	When Mormon pioneers were settling what is today the state of Utah, they referred to the area as Deseret, a word that means 'beehive' according to the Book of Mormon. Today Utah is known as the Beehive State and there is a beehive symbol on the Utah state flag."
"Drying-out woe, for short.   		3 letters","DTS.    	The episodes of delirium that can accompany withdrawal from alcohol are called Delirium Tremens (the DTs). The literal translation of this Latin phrase is ""trembling madness""."
Actress ___ Flynn Boyle.   		4 letters,"LARA.    	The actress Lara Flynn Boyle plays Donna Hayward on 'Twin Peaks', and the Helen Gamble on 'The Practice'."
Cartoon frame.   		3 letters,"CEL.    	In the world of animation, a cel is a transparent sheet on which objects and characters are drawn. In the first half of the 20th century the sheet was actually made of celluloid, giving the ""cel"" its name."
Wall St.   		3 letters,MBA.    	New York's famous 'Wall Street' was originally named by the Dutch as 'de Waal Straat'.
Photographer/writer Arlene.   		4 letters,"ALDA.    	Arlene Alda is a photographer and writer from the Bronx, New York. Born Arlene Weiss, she is the wife of actor Alan Alda."
"One who reasons by deduction, for short?.   		3 letters",CPA.    	Certified public accountant (CPA)
Gardner of mystery.   		4 letters,"ERLE.    	I must have read all of the Perry Mason books when I was in college. I think they kept me sane when the pressure was on. Creator Erle Stanley Gardner was himself a lawyer, although he didn't get into the profession the easy way. He went to law school, but got himself suspended after a month. So, he became a self-taught attorney and opened his own law office in Merced, California. Understandably, he gave up the law once his novels became successful."
"Cable alternative, for short.   		3 letters","DSL.    	DSL originally stood for Digital Subscriber Loop, but is now accepted to mean (Asymmetric) Digital Subscriber Line. DSL is the technology that allows Internet service be delivered down the same telephone line as voice service, by separating the two into different frequency signals."
Lotus-laden waterway.   		4 letters,NILE.    	The blue lotus is a water lily that is also known as the sacred lily of the Nile.
1950s-'70s senator Ervin.   		3 letters,"SAM.    	San Ervin was a Democratic Senator from North Carolina, serving from 1954 until 1974. Senator Ervin worked on two notable committees during his term. He helped bring down Senator Joseph McCarthy in 1954, and he helped investigate the Watergate scandal that brought down President Richard Nixon."
"Pride of Lions, for short?.   		3 letters",TDS.    	Touchdowns (TDs)
"""Plaid"" and ""spunk"" derive from it.   		4 letters","ERSE.    	There are actually three Erse languages. Irish, Manx (spoken on the Isle of Man) and Scots Gaelic. In their own tongues, these would be Gaeilge (in Ireland), Gaelg (on the Isle of Man) and Gaidhlig (in Scotland)."
Business bigwig Blavatnik.   		3 letters,"LEN.    	Len Blavatnik is an American businessman who was born in Odessa, Ukraine but who now lives in London. In 1986, Blavatnik founded Access Industries, a US-based industrial group that is headquartered in New York. One of Access's subsidiaries is the Warner Music Group. Blavatnik was listed as the fourth-richest person in the UK in 2014."
"Terminal announcements, for short.   		4 letters",ETAS.    	Expected time of arrival (ETA)
Tijuana table.   		4 letters,"MESA.    	""Mesa"" is the Spanish for ""table"". ""Mesa"" of course is how we get the name ""mesa"", a geographic feature."
___ Stanley Gardner.   		4 letters,"ERLE.    	I must have read all of the Perry Mason books when I was in college. I think they kept me sane when the pressure was on. Erle Stanley Gardner was himself a lawyer, although he didn't get into the profession the easy way. He went to law school, but was suspended after a month. so, he became a self-taught attorney and opened his own law office in Merced, California. He gave up the law though, once his novels became successful."
