Femme canonisée: Abbr..   		3 letters,"STE.    	In French, a woman (femme) becomes a saint (sainte ... ste.) by being canonized (canonisée)."
Actress ___ Dawn Chong.   		3 letters,"RAE.    	The actress Rae Dawn Chong is the daughter of Tommy Chong, of ""Cheech and Chong"" fame. Rae Dawn appeared in quite a few films in the eighties and nineties, including ""The Color Purple"" and ""Commando""."
Bibliographic suffix.   		3 letters,"ANA.    	An ana (or plural anas) is a collection, including literature, that represent the character of a particular place or a person. Ana can be used as a noun, or as a suffix."
Casting source for some H'wood comedies.   		3 letters,"SNL.    	NBC first aired a form of ""Saturday Night Live"" (SNL) in 1975 under the title ""NBC's Saturday Night"". The show was actually created to give Johnny Carson some time off from ""The Tonight Show"". Back then ""The Tonight Show"" had a weekend episode, and Carson convinced NBC to pull the Saturday or Sunday recordings off the air and hold them for subsequent weeknights in which Carson needed a break. NBC turned to Lorne Michaels and asked him to put together a variety show to fill the vacant slot, and he came up with what we now call ""Saturday Night Live""."
Demolitionist's aid.   		3 letters,"TNT.    	TNT is an abbreviation for Trinitrotoluene. The explosive chemical was first produced by the German chemist Joseph Wilbrand in 1863, thinking he had produced a yellow dye. TNT is relatively difficult to detonate, so it was marketed as a dye for some years before its more explosive properties were discovered."
Collaborator on several David Bowie albums.   		3 letters,"ENO.    	Brian Eno is a musician, composer and record producer from England who first achieved fame as the synthesiser player with Roxy Music. As a producer, Eno has worked with David Bowie, Devo and U2."
Outback runner.   		3 letters,"EMU.    	The emu has had a tough time in Australia since man settled there. There was even an ""Emu War"" in Western Australia in 1932 when migrating emus competed with livestock for water and food. Soldiers were sent in and used machine guns in an unsuccessful attempt to drive off the ""invading force"". The emus were clever, breaking their usual formation and adopting guerrilla tactics, operating as smaller units. After 50 days of ""war"", the military withdrew. Subsequent requests by farmers for military help were ignored. The emus had emerged victorious ..."
Author Levin.   		3 letters,"IRA.    	As well as writing novels, Ira Levin was a dramatist and a songwriter. Levin's first novel was ""A Kiss Before Dying"", and his most famous work was ""Rosemary's Baby"" which became a Hollywood hit. His best known play is ""Deathtrap"", a production that is often seen in local theater (I've seen it a couple of times around here). ""Deathtrap"" was also was a successful movie, starring Michael Caine and Christopher Reeve. My favorite of Levin novels though are ""The Boys from Brazil"" and ""The Stepford Wives""."
Heat-seeking grp.?.   		3 letters,NRA.    	'Heat' is slang for a firearm.
Ballantine product.   		3 letters,"ALE.    	Peter Ballantine was a Scotsman who moved to the United States, founding his brewery in in Newark, New Jersey in 1849. Ballantine was very successful in its day, the third largest brewery in the country in the fifties, when it was the television sponsor of the new York Yankees. However, sales eventually declined and it had to close its doors in the sixties. The brand names are now owned by the Pabst Brewing Company, and apparently the beer sold under the label today bears no resemblance to the beer made by the Scotsman. If you're a fan of the TV show ""Frasier"" you will probably recall that Frasier's Dad drank Ballantine beer all the time."
Ring king.   		3 letters,"ALI.    	Cassius Marcellus Clay, Jr. was born in 1942 in Louisville, Kentucky. Clay changed his name to Muhammad Ali when he converted to Islam in 1964. Who can forget Muhammad Ali lighting the Olympic flame for the 1996 games in Atlanta? Ali was presented with a gold medal during those '96 Games, a replacement for the medal he won at the 1960 Olympics. He had thrown the original into the Ohio River as a gesture of disgust after being refused service at a ""whites only"" restaurant."
"""Aladdin"" prince.   		3 letters","ALI.    	The Disney animated feature ""Aladdin"" was released in 1992 and is one of the best features to come out of the studio, in my opinion, largely due to the great performance by Robin Williams who voiced the Genie. ""Aladdin"" was the most successful film of 1992, earning over $500 million worldwide, an unusual feat for an animated movie."
New Haven student.   		3 letters,"ELI.    	Eli is the nickname for a graduate of Yale University, a term used in honor of the Yale benefactor Elihu Yale."
"""Walking on Thin Ice"" singer.   		3 letters","ONO.    	Yoko Ono was born into a prosperous Japanese family, and is actually a descendant of one of the emperors of Japan. Her father moved around the world for work, and she lived the first few years of her life in San Francisco. The family returned to Japan, before moving on to New York, Hanoi, and back to Japan just before WWII, in time to live through the great fire-bombing of Tokyo in 1945. Immediately after the war, the family was far from prosperous. While Yoko's father was being held in a prison camp in Vietnam, her mother had to resort to begging and bartering to feed her children. When her father returned, life started to return to normal, and Yoko was able to attend university, and was the first woman to be accepted into the philosophy program of Gakushuin University."
Canal of song.   		4 letters,"ERIE.    	The song ""Fifteen Miles on the Erie Canal"" was written in 1905. The lyrics are nostalgic, and look back to the days when traffic on the canal was pulled by mules, bemoaning the introduction of the fast-moving engine-powered barges. The first line is ""I've got an old mule and her name is Sal""."
"AC/DC single with the lyric ""watch me explode"".   		3 letters","TNT.    	The Heavy Metal band known as AC/DC was formed by two brothers Malcolm and Angus Young in Australia. The group is usually called ""Acca Dacca"" down under."
European capital on a fjord.   		4 letters,"OSLO.    	Oslo is the capital of Norway. The city of Oslo burns trash to fuel half of its buildings, including all of its schools. The problem faced by the city is that it doesn't generate enough trash. So, Oslo imports trash from Sweden, England and Ireland, and is now looking to import some American trash too."
Prez on a fiver.   		3 letters,"ABE.    	The US five-dollar bill is often called an 'Abe', as President Lincoln's portrait is on the front. An Abe is also referred to as a 'fin', a term that has been used for a five-pound note in Britain since 1868."
There are three in an inning.   		3 letters,ENS.    	There are three letters N in the word 'inning'.
Grp.   		3 letters,"NRA.    	The NRA is the National Rifle Association, an organization that has been around since 1871. The group has had some celebrity presidents, including US President Ulysses S. Grant. It's often said that the NRA is the most powerful lobbying group in Washington."
"Savings plan, for short.   		3 letters",IRA.    	Individual retirement account (IRA)
Summer in France.   		3 letters,ETE.    	One might spend the summer (été) under the sun (le soleil) in France.
Santa ___ winds.   		3 letters,"ANA.    	The Santa Ana winds are the very dry air currents that sweep offshore late in the year in Southern California. Because these air currents are so dry, they are noted for their influence over forest fires in the area, especially in the heat of the fall. The winds arise from a buildup of air pressure in the Great Basin that lies between the Rocky Mountains and the Sierra Nevada. Under the right conditions, that air spills over the peaks of the Sierra Nevada and basically ""falls"" down the side of the Sierra range, heading for the ocean. As the air falls it becomes drier and heats up so that relative humidity can fall to below 10% by the time it hits the coast."
"Gate posting, for short.   		3 letters",ETA.    	Estimated time of arrival (ETA)
Sustainable practices grp.   		3 letters,EPA.    	Environmental protection agency (EPA)
"Presenter of many a spoof, for short.   		3 letters",SNL.    	'Saturday Night Live' (SNL)
"Ayaan Hirsi ___, author of ""Infidel"".   		3 letters",ALI.    	Ayaan Hirsi Ali is a Dutch-American activist and author who was born in Somalia. One of Ali's most notable campaigns is the opposition to female genital mutilation.
Blaster.   		3 letters,"TNT.    	TNT is an abbreviation for TriNitroToluene. The explosive chemical was first produced by the German chemist Joseph Wilbrand in 1863, who used it as a yellow dye. TNT is relatively difficult to detonate, so it was marketed as a dye for some years before its more explosive properties were discovered."
"D-backs, on scoreboards.   		3 letters","ARI.    	The Arizona Diamondbacks joined Major League Baseball's National League in 1998. By winning the World Series in 2001, the Diamondbacks became the fastest expansion team to do so in Major League history."
Brian who produced U2.   		3 letters,"ENO.    	Brian Eno is a musician, composer and record producer from England who first achieved fame as the synthesiser player with Roxy Music. As a producer, Eno has worked with David Bowie, Devo and U2."
Org.   		3 letters,EPA.    	The Environmental Protection Agency (EPA) was set up during the Nixon administration and began operation at the end of 1970.
"D-backs, in box scores.   		3 letters","ARI.    	The Arizona Diamondbacks joined Major League Baseball's National League in 1998. By winning the World Series in 2001, the Diamondbacks became the fastest expansion team to do so in Major League history."
Gun rights org.   		3 letters,NRA.    	National Rifle Association (NRA)
Cupid's Greek counterpart.   		4 letters,"EROS.    	As always seem to be the case, the Greek gods Eros and Aphrodite have overlapping spheres of influence. Aphrodite was the goddess of love between a man and a woman, but Eros was the god who stirred the passions of the male."
"Chase Field team, on scoreboards.   		3 letters","ARI.    	The Arizona Diamondbacks joined Major League Baseball's National League in 1998. By winning the World Series in 2001, the Diamondbacks became the fastest expansion team to do so in Major League history."
One of the Great Lakes.   		4 letters,"ERIE.    	Lake Erie is the fourth largest of the five Great Lakes by area (Lake Ontario is the smallest). The lake takes its name from the Erie tribe of Native Americans that used to live along its southern shore. Erie is the smallest of the Great Lakes by volume and the shallowest, something for which nearby residents must be quite grateful. Being relatively shallow, much of Erie freezes over part way through most winters putting an end to most of the lake effect snow that falls in the snow belt extending from the lake's edge."
"Grandpa on ""The Simpsons"".   		3 letters","ABE.    	Grampa Abe Simpson is voiced by Dan Castellaneta, the same actor who provides the voice for Homer."
Acid.   		3 letters,"LSD.    	LSD is short for LySergic acid Diethylamide. A Swiss chemist called Albert Hofmann first synthesized LSD in 1938 in a research project looking for medically efficacious ergot alkaloids. But it wasn't until some five years later when Hofmann ingested some of the drug accidentally that its psychedelic properties were discovered. Trippy, man ..."
Bird with two sets of eyelids.   		3 letters,"EMU.    	An emu has one set of eyelids to blink with, keeping the eyeball moist. The second set is used to keep out dust."
"1970s political cause, for short.   		3 letters","ERA.    	The Equal Rights Amendment (ERA) was written by the American suffragist leader, Alice Paul. Although Paul was successful in her campaign to get passage of the 19th Amendment to the US Constitution (guaranteeing voting rights regardless of sex), her 1923 Equal Rights Amendment didn't make it to the Senate floor until 1972. The amendment was passed by the Senate, and then headed to the state legislatures for the required ratification. 38 states had to approve the legislation for the amendment to be adopted, but only 35 states voted in favor before the deadline. So the amendment is still pending, although about half of the fifty states have adopted the ERA into their state constitutions."
Avant-garde composer Brian.   		3 letters,"ENO.    	Brian Eno started out his musical career with Roxy Music. However, his most oft played composition (by far!) is Microsoft's ""start-up jingle"", the 6-second sound you hear when the Windows operating system starts up."
Hoppy brew.   		3 letters,ALE.    	The foodstuff that we call 'hops' are actually the female flower of the hop plant. The main use of hops is to add flavor to beer. The town in which I live here in California used to be home to the largest hop farm in the whole world. Most of the harvested hops were exported all the way to the breweries of London where they could fetch the best price.
It's associated with Chris Rock and 30 Rock.   		3 letters,SNL.    	Saturday Night Live (SNL)
"One of the four seasons, in France.   		3 letters",ETE.    	One might spend the summer (été) under the sun (le soleil) in France.
Three-sided weapon.   		4 letters,"EPEE.    	The sword known as an épée has a three-sided blade. The épée is similar to a foil and sabre, both of which are also thrusting weapons. However, the foil and saber have rectangular cross-sections."
Lake between Ohio and Ontario.   		4 letters,"ERIE.    	Lake Erie is the fourth largest of the five Great Lakes (Lake Ontario is the smallest). The lake takes its name from the Erie tribe of Native Americans that used to live along its southern shore. Erie is the shallowest of the Great Lakes, something for which nearby residents must be quite grateful. Being relatively shallow, Erie freezes over part way through most winters putting an end to the lake effect snow that falls in the snow belt extending from the lake's edge."
"Exotic ""Now, Voyager"" setting.   		3 letters","RIO.    	The 1942 movie 'Now, Voyager' stars Bette Davis, Paul Henreid and Claude Rains. The film is based on a novel of the same name by Olive Higgins Prouty. Prouty got the title of her book from the Walt Whitman poem 'The Untold Want':"
"When a flight is due in, for short.   		3 letters",ETA.    	Estimated time of arrival (ETA)
Arrow-shooting Greek god.   		4 letters,"EROS.    	Eros was the Greek god of love, the Greek counterpart of the Roman god Cupid."
Source of 13-Down eggs.   		3 letters,"EMU.    	Emu eggs are very large, with a thick shell that is dark-green in color. One emu egg weighs about the same as a dozen chicken eggs."
Cousin of the cassowary.   		3 letters,"EMU.    	The cassowary is a large, flightless bird found mainly in New Guinea. One species of cassowary is the third tallest bird on the planet, second only to the ostrich and the emu."
Explosive initials.   		3 letters,"TNT.    	'TNT' is an abbreviation for trinitrotoluene. Trinitrotoluene was first produced in 1863 by the German chemist Joseph Wilbrand, who developed it for use as a yellow dye. TNT is relatively difficult to detonate so it was on the market as a dye for some years before its more explosive properties were discovered."
Put-in-Bay's lake.   		4 letters,"ERIE.    	Put-in-Bay, Ohio is a village on South Bass Island in Lake Erie. The village's name comes from the old name for the harbor around which a settlement developed, namely 'Pudding Bay'. The Pudding Bay name was likely chosen as the bay is shaped like a pudding sack. Put-in-Bay is home to Crystal Cave, the world's largest geode."
Canonized woman of Fr.   		3 letters,"STE.    	'Sainte' (ste.) is French for 'saint', when referring to a female."
Org.   		3 letters,NRA.    	National Rifle Association (NRA)
Not the longest dashes.   		3 letters,"ENS.    	In typography, there are em dashes and en dashes. The em dash is about the width of an ""m"" character, and an en dash about half that, the width of an ""n' character. An en dash is used, for example, to separate numbers designating a range, as in 5-10 years."
It serves a duel purpose.   		4 letters,"EPEE.    	The French word for sword is ""épée"". In competitive fencing the épée is connected to a system that records an electrical signal when legal contact is made on an opponent's body."
"""Weekend Update"" show, for short.   		3 letters","SNL.    	NBC first aired a form of ""Saturday Night Live"" in 1975, under the title ""NBC's Saturday Night"". The show was actually created to give Johnny Carson some time off from ""The Tonight Show"". Back then ""The Tonight Show"" had a weekend episode, and Carson convinced NBC to pull the Saturday or Sunday recordings off the air and hold them for subsequent weeknights in which Carson needed a break. NBC turned to Lorne Michaels and asked him to pull together a variety show to fill the vacant slot, and he come up with what we now call ""Saturday Night Live""."
Previously named.   		3 letters,"NEE.    	""Née"" is the French word for ""born"" when referring to a female. The male equivalent is ""né""."
Molecule involved in protein synthesis.   		3 letters,RNA.    	Ribonucleic Acid (RNA) is an essential catalyst in the manufacture of proteins in the body. The genetic code in DNA determines the sequence of amino acids that make up each protein. Amino acids are delivered in the correct sequence by what is called transfer RNA and then formed into proteins by ribosomal RNA.
'60s trip inducer.   		3 letters,"LSD.    	LSD (colloquially known as 'acid') is short for lysergic acid diethylamide. A Swiss chemist called Albert Hofmann first synthesized LSD in 1938 in a research project looking for medically efficacious ergot alkaloids. It wasn't until some five years later when Hofmann ingested some of the drug accidentally that its psychedelic properties were discovered. Trippy, man ..."
Good name for an investor?.   		3 letters,"IRA.    	I have to tell you, when I first came to the US from Ireland, it was pretty confusing seeing big signs along the freeway advocating IRA contributions. Back in Ireland, that was pretty illegal (where IRA stands for the outlawed Irish Republican Army!)."
Munch Museum's locale.   		4 letters,"OSLO.    	Edvard Munch was a Norwegian expressionist, most famous for his painting ""The Scream"", painted in 1893. What a wonderful work that is, a true representation of expressionism. The Munch Museum in Oslo is dedicated to his work and life. In 2004, two of Munch's paintings, ""The Scream"" and ""Madonna"", were stolen from the Munch Museum by armed robbers who subdued the museum guards. The paintings were missing for two years, but recovered in 2006."
Chapter seven?.   		3 letters,"ETA.    	I guess the reference is to a chapter of a Greek fraternity, with eta being the seventh letter of the Greek alphabet."
Locale painted on the Sistine Chapel ceiling.   		4 letters,"EDEN.    	The Sistine Chapel, in the Pope's residence in Rome, takes its name from Pope Sixtus IV who was responsible for restoring the old Capella Magna in the 15th century. It was about a century later (1508-1512) that Michelangelo painted the ceiling of the Sistine Chapel under the patronage of Pope Julius II."
Sam Adams product.   		3 letters,"ALE.    	Sam Adams beers are named in honor of the American patriot who played a role in the American Revolution and the Boston Tea Party. Samuel Adams came from a family associated the brewing industry, mainly involved in the production of malt."
P.D.Q.   		4 letters,"ARIA.    	P.D.Q. Bach is an alter ego used by musical satirist Peter Schickele. Schickele creates works that he bills as compositions written by P.D.Q. Bach, the 'only forgotten son' of Johann Sebastien Bach."
Greek vowel.   		3 letters,"ETA.    	Eta is the seventh letter of the Greek alphabet, and is a forerunner of our Latin character ""H"". Originally denoting a consonant, eta was used as a long vowel in Ancient Greek."
Singer Carly ___ Jepsen.   		3 letters,"RAE.    	Carly Rae Jepsen is a singer/songwriter from Mission, British Columbia. Jepsen got her start on TV's 'Canadian Idol' when she placed third in the show's fifth season."
"Mind reader's skill, for short.   		3 letters",ESP.    	Extrasensory perception (ESP)
1982 double-platinum Duran Duran album.   		3 letters,"RIO.    	Duran Duran is a New Wave band from Birmingham in England. Duran Duran's success was partially driven by some well-received MTV music videos in the 1980s. The band also worked hard on their image and paid a lot of money for very fashionable clothes in which they performed. As a result, one of Duran Duran's nicknames is 'the prettiest boys in rock'."
Summer in Somme.   		3 letters,"ETE.    	The Somme is a department in the very north of France, in the Picardy region. The Somme is famous as the site of devastating battles during WWI."
"""Starpeace"" recorder, 1985.   		3 letters","ONO.    	""Starpeace"" is a concept album recorded by Yoko Ono in 1985. The project was designed as a message of peace, and a statement of opposition to the ""Star Wars"" missile defense system championed by President Reagan."
"___ Gold, agent on ""Entourage"".   		3 letters","ARI.    	Ari Gold is a fictional character in the HBO series ""Entourage"". ""Entourage"" tells the story of a rising film star, Vincent Chase, a native of New York but now learning to handle himself in Hollywood. Vincent's Hollywood agent is Ari Gold, played by Jeremy Piven."
Half of nine?.   		3 letters,ENS.    	Half of the letters in the word 'nine' are Ns (ens).
Piece at the Met.   		4 letters,"ARIA.    	The Metropolitan Opera (the Met) of New York City is the largest classical music organization in the country, presenting about 220 performances each and every year. Founded in 1880, the Met is renowned for using technology to expand its audiences. Performances have been broadcast live on radio since 1931, and on television since 1977. And since 2006 you can go see a live performance from New York in high definition on the big screen, at a movie theater near you ..."
"""Float like a butterfly, sting like a bee"" boxer.   		3 letters",ALI.    	Muhammad Ali first used his famous catchphrase 'float like a butterfly and sting like a bee' before his world title fight against Sonny Liston in 1964. Back then Ali still went by his birth name of Cassius Clay.
Progressive ___.   		3 letters,"ERA.    	The Progressive movement had the goal of eliminating corruption in government in the US. The movement gave its name to the Progressive Era that lasted from the 1890s to the 1920s. Journalists who investigated and exposed corruption were given the name 'muckrakers'. The term 'muckraker' was popularized by President Theodore Roosevelt when he referred to 'the Man with the Muck-rake', a character in John Bunyan's allegory 'The Pilgrim's Progress'."
H.   		3 letters,"ETA.    	Eta is the seventh letter of the Greek alphabet, and is a forerunner of our Latin character ""H""."
Dystopia's opposite.   		4 letters,EDEN.    	A dystopia is an imaginary community in which the residents live unhappily and in fear. 'Dystopia' is the opposite of 'utopia'. One example of such a society is that described by George Orwell in 'Nineteen Eighty-Four'.
"Brady Campaign opposer, for short.   		3 letters","NRA.    	The Brady Handgun Violence Prevention Act (usually referred to as 'the Brady Bill') was enacted in 1993 and signed into law by President Bill Clinton. The law instituted federal background checks for anyone wishing to purchase a firearm. The legislation is named for Jim Brady, Ronald Reagan's press secretary who was paralysed for life when John Hinckley, Jr. attempted to assassinate the president. Brady passed away in August 2014. The death was ruled a homicide, that he had died from the gunshot wound he received thirty-three years earlier."
Genetic material.   		3 letters,"RNA.    	Ribonucleic Acid (RNA) is an essential catalyst in the manufacture of proteins in the body. The genetic code in DNA determines the sequence of amino acids that make up each protein. That sequence is read in DNA by messenger RNA, and amino acids are delivered for protein manufacture in the correct sequence by what is called transfer RNA. The amino acids are then formed into proteins by ribosomal RNA."
2016 Olympics site.   		3 letters,"RIO.    	Rio de Janeiro is the second largest city in Brazil (after São Paulo). 'Rio de Janeiro' translates as 'January River'. The name reflects the discovery of the bay on which Rio sits, on New Year's Day in 1502."
Hoppy drink.   		3 letters,ALE.    	The foodstuff that we call 'hops' are actually the female flower of the hop plant. The main use of hops is to add flavor to beer. The town in which I live here in California used to be home to the largest hop farm in the whole world. Most of the harvested hops were exported all the way to the breweries of London where they could fetch the best price.
Winged Greek god.   		4 letters,"EROS.    	As always seem to be the case, the Greek gods Eros and Aphrodite have overlapping spheres of influence. Aphrodite was the goddess of love between a man and a woman, but Eros was the god who stirred the passions of the male."
