Source of bubbly.   		4 letters,ASTI.    	Asti is in the Piedmont region of northwestern Italy. It is perhaps most famous for its Asti Spumante sparkling white wine.
"Louis Malle's ""___ Amants"".   		3 letters","LES.    	'Les Amants' ('The Lovers') is a 1958 French movie directed by Louis Malle when he was just 25 years old. The film was a great success in France but when it was first shown here in the US, a theater manager was actually convicted of distributing obscene material."
"""Gattaca"" actress Thurman.   		3 letters","UMA.    	'Gattaca' is a science fiction movie starring Ethan Hawke and Uma Thurman that was released in 1997. Set in the not-too-distant future, the film describes a society in which potential children are preselected so that they inherit the most desirable traits from their parents. The title 'Gattaca' is the space agency featured in the storyline. I saw this one relatively recently, and found it very absorbing ..."
Ancient Peruvian.   		4 letters,"INCA.    	The Inca people emerged as a tribe around the 12th century, in what today is southern Peru. The Incas developed a vast empire over the next 300 years, extending along most of the western side of South America. The Empire fell to the Spanish, finally dissolving in 1572 with the execution of Tupac Amaru, the last Incan Emperor."
"""Shine a Little Love"" rock grp.   		3 letters","ELO.    	ELO of course stands for the Electric Light Orchestra, a symphonic rock group from the north of England. Their manager was Don Arden, father of Sharon Osbourne (wife of Ozzy)."
"""Help!"".   		3 letters","SOS.    	The combination of three dots - three dashes - three dots, is a Morse signal first introduced by the German government as a standard distress call in 1905. The sequence is remembered as the letters SOS (three dots - pause - three dashes - pause - three dots), although in the emergency signal there is no pause between the dots and dashes, so SOS is in effect only a mnemonic. Similarly, the phrases ""Save Our Souls"" and ""Save Our Ship"" are also mnemonics, introduced after the ""SOS"" signal was adopted."
007 creator Fleming.   		3 letters,"IAN.    	Ian Fleming is most famous of course for writing the ""James Bond"" series of spy novels. You might also know that he wrote the children's story ""Chitty Chitty Bang Bang"", which was made into a cute movie released in 1968 and even a stage musical that opened in 2002."
Letter after 11-Down.   		4 letters,IOTA.    	(11D. Letter before 23-Across : THETA)
Attorney's org.   		3 letters,"ABA.    	The American Bar Association was founded back in 1878, and is a voluntary association for lawyers and law students. The main focus of the ABA is setting academic standards for law schools, and setting ethical codes for the profession."
"""Spamalot"" writer Idle.   		4 letters","ERIC.    	Eric Idle was one of the founding members of the Monty Python team. Idle was very much the musician of the bunch, and is an accomplished guitarist. If you've seen the Monty Python film ""The Life of Brian"", you might remember the closing number, ""Always Look on the Bright Side of Life"". It was sung by Idle, and was indeed written by him. The song made it to number 3 in the UK charts in 1991."
"John, abroad.   		3 letters","IAN.    	The name 'John' translates into Scottish as 'Ian', and into Irish as 'Seán'."
Cuzco native.   		4 letters,"INCA.    	Manco Capac was the head of the Incan Kingdom of Cusco (also Cuzco). He introduced what we might call some sensible laws, including abolishing human sacrifice, and outlawing marriage to one's sister. However, through a loophole in the law,as he managed to marry his own sister and had a son with her who became his successor."
Mayberry town drunk.   		4 letters,"OTIS.    	Otis Campbell is the town drunk on the sitcom 'The Andy Griffith Show', and was played by actor Hal Smith. The Campbell character was dropped in the late sixties as sponsors became concerned about being associated with heavy drinking."
Nancy Drew's beau.   		3 letters,"NED.    	I loved the Nancy Drew mysteries as a kid (I know, as a boy I ""shouldn't"" have been reading them!). They were written by a number of ghost writers, but the character was introduced by Edward Stratemeyer in 1930. Nancy Drew's boyfriend was Ned Nickerson, a college student from Emerson."
Elevator pioneer Elisha.   		4 letters,"OTIS.    	Elevators (simple hoists) have been around for a long time. What Elisha Otis did was come up with the ""safety elevator"", a design that he showcased at the 1853 World's Fair in New York. At the Fair, Otis would stand on an elevated platform in front of onlookers and order his assistant to cut the single rope holding up the platform. His safety system kicked in when the platform had only fallen a few inches, amazing the crowd. After this demonstration, the orders came rolling in."
Aunt of Prince William.   		4 letters,"ANNE.    	Anne, Princess Royal was born in 1950 and is the only daughter of British Queen Elizabeth II. Princess Anne has been in the public spotlight for many things, including her success as an equestrian. Princess Anne was the first member of the British Royal Family to have competed in an Olympic Games. Her daughter Zara Phillips continued the tradition and competed as a member of the British equestrian team in the 2012 Olympic Games. Zara's medal was presented to her by her own mother, Princess Anne."
Wager of war against Parthia.   		4 letters,"NERO.    	The Roman emperor Nero had quite the family life. When Nero was just 16-years-old he married his stepsister, Claudia Octavia. He also had his mother and step-brother executed."
Actress Thurman.   		3 letters,"UMA.    	Robert Thurman was the first westerner to be ordained a Tibetan Buddhist monk. Robert raised his children in the Tibetan Buddhist tradition and called his daughter ""Uma"" as it is a phonetic spelling of the Buddhist name ""Dbuma"". Uma's big break in movies came with her starring role in Quentin Tarantino's 1994 hit 'Pulp Fiction'. My favorite Uma Thurman film is the wonderful 1996 romantic comedy 'The Truth About Cats and Dogs'."
"""Eternally nameless"" thing, in Eastern religion.   		3 letters","TAO.    	The Chinese character ""tao"" translates as ""path"", but the concept of Tao signifies the true nature of the world."
Antlered animal.   		3 letters,"ELK.    	The elk (also known as wapiti) is the one of the largest species of deer in the world, with only the moose being bigger. Early European settlers were used to seeing the smaller red deer back in their homelands, so when they saw the ""huge"" wapiti they assumed it was a moose, and gave it the European name for a moose, namely ""elk"". The more correct term then is ""wapiti"", the Shawnee name for the animal, which means ""white rump"". Very confusing ..."
Shark eater.   		4 letters,"ORCA.    	The taxonomic name for the killer whale is Orcinus orca. The use of the name ""orca"", rather than ""killer whale"", is becoming more and more common. The Latin word ""Orcinus"" means ""belonging to Orcus"", with Orcus being the name for the Kingdom of the Dead."
"Mendes of ""Hitch"".   		3 letters","EVA.    	Eva Mendes play the female lead in the movie ""Hitch"" opposite Will Smith."
Constellation near Ursa Major.   		3 letters,"LEO.    	The constellation called Leo can be said to resemble a lion. Others say that it resembles a bent coat hanger. 'Leo' is the Latin for 'lion', but I'm not sure what the Latin is for 'coat hanger' ..."
"Beatty of ""Superman"".   		3 letters","NED.    	Ned Beatty is probably best remembered for the rather disturbing ""squeal like a pig"" scene in the movie ""Deliverance"". He also earned an Academy Award nomination for Best Supporting Actor for his performance in the 1976 movie 'Network'."
FICA fig.   		3 letters,"SSN.    	The main purpose of a Social Security Number (SSN) is to track individuals for the purposes of taxation, although given its ubiquitous use, it is looking more and more like an ""identity number"" to me. The social security number system was introduced in 1936. Prior to 1986, an SSN was required only for persons with substantial income so many children under 14 had no number assigned. For some years the IRS had a concern that a lot of people were claiming children on their tax returns who did not actually exist. So, from 1986 onward, it is a requirement to get an SSN for any dependents over the age of 5. Sure enough, in 1987 seven million dependents ""disappeared""."
Barbera d'___ (red wine).   		4 letters,"ASTI.    	Barbera d'Asti is a red wine from Italy. Barbera d'Asti is produced not only in the famed Asti wine region of northern Italy, but also in neighboring Alexandria."
Number that's its own square.   		3 letters,ONE.    	1 x 1 = 1
"""___ to Joy"".   		3 letters","ODE.    	""Ode to Joy"" is a poem written in 1785 by German poet Friedrich Schiller. Ludwig van Beethoven gave the poem great notoriety when he used it in his Ninth ""Choral"" Symphony that was first performed in 1824."
Arabian Peninsula land.   		4 letters,"OMAN.    	The Arabian Peninsula (also 'Arabia') is part of Western Asia that is located just north-east of Africa. The peninsula is bordered to the west by the Red Sea, to the northeast by the Persian Gulf, and to the southeast by the Indian Ocean. Most of the Arabian Peninsula is taken up by Saudi Arabia, but also included are Kuwait, Bahrain, Qatar, the United Arab Emirates, Oman and Yemen."
Word on a dollar.   		3 letters,"ONE.    	George Washington didn't appear on the first one-dollar bill. Instead, the bills printed from 1862 to 1869 featured Salmon P. Chase, the Secretary of the Treasury who served under Abraham Lincoln."
"Sash in ""Madama Butterfly"".   		3 letters","OBI.    	Puccini's ""Madama Butterfly"" is the most-performed opera in the US. The opera that we see today is actually the second version that Puccini produced. The original version was first staged in 1904 at La Scala in Milan where it received a very poor reception. Puccini reworked the piece, breaking the second act into two new acts and making some other significant changes. The opera was relaunched a few months later and it was a resounding success."
Sweater letter.   		3 letters,"RHO.    	Rho is the Greek letter that looks just like our Roman letter ""p""."
Certain ancient mummy.   		4 letters,"INCA.    	The three Children of Llullaillaco are three mummified remains of Incan children, sacrificed about 500 years ago. The bodies were not preserved artificially, bit rather by the dry and cold conditions in which they were abandoned, high up on the side of the volcano Llullaillaco on the border of Argentina and Chile."
Possible cause of paralysis.   		3 letters,"ASP.    	The asp is a venomous snake found in the Nile region of Africa. It is so venomous that the asp was used in ancient Egypt and Greece as a means of execution. Cleopatra observed such executions noting that the venom brought on sleepiness without any painful spasms. When the great queen opted to commit suicide, the asp was therefore her chosen method."
Luau neckwear.   		3 letters,"LEI.    	""Lei"" is the Hawaiian word for ""garland, wreath"", although in more general terms a ""lei"" is any series of objects strung together as an adornment for the body."
"Actress Mendes of ""2 Fast 2 Furious"".   		3 letters","EVA.    	I best know the actress Eva Mendes as the female lead in the movie ""Hitch"", playing opposite Will Smith. Mendes was known off the screen for dating actor Ryan Gosling from 2011 to 2013."
Like.   		4 letters,A LA.    	The phrase 'in the style of' can be translated in 'alla' in Italian and 'à la' in French.
___ Air (Taiwanese carrier).   		3 letters,"EVA.    	EVA Airlines is an international airline based Taipei, Taiwan that was founded in 1989. The intended name for the company was Evergreen Airways, but this was changed to EVA to avoid a potential conflict with another business."
Presidential nickname.   		3 letters,"IKE.    	There doesn't seem to be any good reason why President Eisenhower was called ""Ike"". However, it is known that the nickname dates back to his childhood as his parents called him ""Ike"" as well as 'Dwight'."
"""I, Claudius"" figure.   		4 letters","NERO.    	""I, Claudius"" is a 1934 novel penned by Robert Graves, written in the form of an autobiography of Emperor Claudius of Rome. Graves wrote a sequel in 1935 called ""Claudius the God"". Both books were adapted by the BBC into a fabulous television series that went by the name of the first book ""I, Claudius""."
Old White House moniker.   		3 letters,IKE.    	'I Like Ike' was a political slogan that originated with the grassroots movement to get Dwight D. Eisenhower to run for president in the 1952 presidential election.
Teensy bit.   		4 letters,"IOTA.    	Iota is the ninth letter in the Greek alphabet. We use the word ""iota"" to portray something very small as it is the smallest of all Greek letters."
English institution since 1440.   		4 letters,"ETON.    	The world-famous Eton College is just a brisk walk from Windsor Castle, which itself is just outside London. Eton is noted for producing many British leaders including David Cameron who took power in the last UK general election. The list of Old Etonians also includes Princes William and Harry, the Duke of Wellington, George Orwell, and the creator of James Bond, Ian Fleming (as well as 007 himself as described in the Fleming novels)."
Funny Philips.   		3 letters,"EMO.    	Emo Philips is a stand-up comedian from Chicago. He's had a long and successful career, and listed on his resume is a small part in the 1992 hit movie ""Meet the Parents"", as well his role of executive producer for that very same film. I'd say that made him a few pennies ..."
Org.   		3 letters,ABA.    	American Bar Association(ABA)
Birthright seller in the Bible.   		4 letters,"ESAU.    	Esau was the twin brother of Jacob, the founder of the Israelites. When their mother Rebekah gave birth to the twins ""the first emerged red and hairy all over (Esau), with his heel grasped by the hand of the second to come out (Jacob)"". As Esau was the first born, he was entitled to inherit his father's wealth (it was his ""birthright""). Instead, Esau sold his birthright to Jacob for the price of a ""mess of pottage"" (a meal of lentils)."
Muscat's land.   		4 letters,"OMAN.    	Oman lies on the southeast coast of the Arabian Peninsula, neighbored by the OAE, Saudi Arabia and Yemen. The capital city of Muscat has a strategic location on the Gulf of Oman, and has a history of invasion and unrest. Centuries of occupation by the Persians ended in 1507 when the Portuguese took the city in a bloody attack. The Portuguese held Muscat for much of the next century until finally ousted by local Omani forces in 1648. A Yemeni tribe invaded the area in 1741 and set up a monarchy that has been in place ever since."
Subj.   		3 letters,"CIA.    	I found Steve Coll's book 'Ghost Wars' to be a fascinating account of the CIA's work in Afghanistan. It covers the history of CIA operations from the days of the Soviet invasion of the country right up to September 11, 2001."
Frank writing in a diary.   		4 letters,"ANNE.    	Anne Frank has to be one of the most famous victims of the Holocaust. This is largely because the story of this young girl lives on in her widely published diary, and in adaptations of the diary for stage and screen. Anne Frank was a German until she lost her nationality in 1941 when the Nazis came to power. By this time, she was living with her family in Amsterdam, as the Franks chose to flee Germany in 1933. When the Germans occupied the Netherlands, the family went into hiding in the attic of Otto Frank's office building (Otto was Anne's father). There the family hid for two whole years, until they were betrayed. The family was split up, and Anne and her sister died from typhus in a concentration camp in 1945."
Alt-rock genre.   		3 letters,"EMO.    	The musical genre of ""emo"" originated in Washington D.C. in the 80s, and takes its name from ""emotional hardcore"". Not my cup of tea ..."
"___ Caovilla, maker of high-end women's shoes.   		4 letters","RENE.    	I have no interest in shoes, but I found it interesting that in 2007 Harrods hired a live cobra to sit in a display protecting some ruby, diamond and sapphire encrusted sandals designed and launched by Rene Caovilla."
Brother of Jacob.   		4 letters,"ESAU.    	Esau was the twin brother of Jacob, the founder of the Israelites. When their mother Rebekah gave birth to the twins ""the first emerged red and hairy all over (Esau), with his heel grasped by the hand of the second to come out (Jacob)"". As Esau was the first born, he was entitled to inherit his father's wealth (it was his ""birthright""). Instead, Esau sold his birthright to Jacob for the price of a ""mess of pottage"" (a meal of lentils)."
Dr.   		3 letters,"ABA.    	The American Basketball Association (ABA) merged with the National Basketball Association (NBA) in 1976. The ABA used a ball with the colors red, white and blue. The NBA uses a more traditional orange ball."
Tiny bit.   		4 letters,"IOTA.    	Iota is the ninth letter in the Greek alphabet. We use the word ""iota"" to portray something very small as it is the smallest of all Greek letters."
Eggs ___ Suisse.   		4 letters,"A LA.    	Eggs à la Suisse is a recipe date back at least to the mid-1800s. The eggs are prepared with Gruyère cheese, double cream and spices."
"""Last Train to London"" grp.   		3 letters","ELO.    	ELO of course stands for the Electric Light Orchestra, a symphonic rock group from the north of England. Their manager was Don Arden, father of Sharon Osbourne (wife of Ozzy)."
MGM symbol.   		3 letters,"LEO.    	There has be a lion in the logo of the MGM studio and its predecessors, dating back to 1924. The original lion was an Irishman (!), a lion name Slats who was born in Dublin Zoo in 1919. However, it wasn't until lion Jackie took over from Slats, in 1928, that the roar was heard, as the era of silent movies was coming to an end. The current lion is called Leo, and he has been around since 1957."
European smoker.   		4 letters,"ETNA.    	Mt. Etna is the largest of three active volcanoes in Italy. Mt Etna is about 2 1/2 times the height of its equally famous sister, Mt. Vesuvius."
Boston Garden legend.   		3 letters,"ORR.    	Bobby Orr is regarded as one of the greatest hockey players of all time. By the time he retired in 1978 he had undergone over a dozen knee surgeries. At 31 years of age, he concluded that he just couldn't skate anymore. Reportedly, he was even having trouble walking ..."
One of the Gabors.   		3 letters,"EVA.    	Eva Gabor was the youngest of the Gabor sisters, all three of whom were celebrated Hollywood actresses and socialites (her siblings were Zsa-Zsa and Magda). The Gabor sisters were born in Budapest and immigrated to the United States separately, with Eva being the first to arrive. Eva broke into movies, but her most famous role was on the TV sitcom ""Green Acres"" in which she played the lovely character Lisa Douglas opposite Eddie Albert. One of Eva's claims to fame is the unwitting promotion of the game called ""Twister"", the sales of which were languishing in 1996. In an appearance on ""The Tonight Show"" she got on all fours and played the game with Johnny Carson. Sales took off immediately, and Twister became a huge hit."
Punk rock subgenre.   		3 letters,"EMO.    	The musical genre of ""emo"" originated in Washington D.C. in the 80s, and takes its name from ""emotional hardcore"". 'Emo' is also the name given to the associated subculture. Not my cup of tea ..."
Like.   		4 letters,A LA.    	The term 'in the style of' can be translated in 'alla' in Italian and 'à la' in French.
___ mode.   		4 letters,"A LA.    	In French, a la mode simply means ""fashionable"". In America it has come to describe a way of serving pie, usually with ice cream, or as I recall when I lived in Upstate New York, with cheese."
Cleopatra's killer.   		3 letters,"ASP.    	The asp is a venomous snake found in the Nile region of Africa. It is so venomous that the asp was used in ancient Egypt and Greece as a means of execution. Cleopatra observed such executions noting that the venom brought on sleepiness without any painful spasms. When the great queen opted to commit suicide, the asp was therefore her chosen method."
FICA fig.   		3 letters,SSN.    	That Federal Insurance Contributions Act tax (FICA) was introduced in the 1930s as part of the New Deal.
Île surrounder.   		3 letters,"EAU.    	In French, an island (île) is a piece of ground (terre) surrounded by water (eau)."
Alt-rock genre.   		3 letters,"EMO.    	Emo originated in Washington D.C. in the 80s, and takes its name from ""emotional hardcore"". Not my cup of tea ..."
Dashboard Confessional's genre.   		3 letters,"EMO.    	Dashboard Confessional is an emo band from Boca Raton, Florida."
Like.   		4 letters,A LA.    	The phrase 'in the style of' can be translated in 'alla' in Italian and 'à la' in French.
Hit CBS series beginning in 2004.   		3 letters,"CSI.    	The TV show ""CSI"" gets a lot of criticism from law enforcement agencies for its unrealistic portrayal of the procedures and science of criminal investigation. I don't care though, as I just think it's a fun show to watch. The original ""CSI"" set in Las Vegas seems to have ""gone off the boil"" lately, but the addition of Sela Ward to the cast of ""CSI: NY"" has really, really raised the level of the sister show set in New York City."
Old White House nickname.   		3 letters,"IKE.    	President Eisenhower was born in Denison, Texas and given the name David Dwight Eisenhower, but by the time he made it to the White House he was going by the name Dwight D. Eisenhower. Growing up, his family called him Dwight, and when ""Ike"" enrolled in West Point he himself reversed the order of his given names."
"World Factbook publisher, for short.   		3 letters","CIA.    	'The World Factbook' is a publication produced by the CIA. It is intended primarily for use by government employees but, as it is in the public domain, it is now used by just about anyone. The first edition of 'Factbook' came out in 1962 and, as it was classified, it had limited distribution. It was decided to make 'Factbook' public in 1975, and it has been freely available on the World Wide Web since 1994."
"""South Park"" boy.   		3 letters",IKE.    	South Park' is an adult-oriented cartoon series on Comedy Central. I don't do 'South Park' ...
Politico Cruz.   		3 letters,"TED.    	US Senator Ted Cruz served as Solicitor General for the state of Texas before heading to Washington. Cruz was appointed Solicitor General in 2003 at the age of 32, making him the youngest Solicitor General in the country. Famously, Cruz is an opponent of the Affordable Care Act and made a speech in 2013 in the US Senate on the subject that lasted for 21 hours and 19 minutes. It was the fourth longest speech in the history of the Senate."
Native encountered by Pizarro.   		4 letters,"INCA.    	The Inca people emerged as a tribe around the 12th century, in what today is southern Peru. The Incas developed a vast empire over the next 300 years, extending along most of the western side of South America. The Empire of course fell to the Spanish, finally dissolving in 1572 with the execution of Tupac Amaru, the last Incan Emperor."
1969 Nabokov novel.   		3 letters,"ADA.    	The reference here is to the 1969 novel by Vladimir Nabokov called ""Ada"". The story takes place in the 1800s on Antiterra, an Earth-like planet that has a history similar to ours but with interesting differences. For example, there is a United States, but the country covers all of North and South America. What we call eastern Canada is a French-speaking province called ""Canady"", and western Canada is a Russian-speaking province ""Estody"". The plot-line is about a man called Van Veen who, when 14 years old, meets for the first time his cousin, 11-year-old Ada. The two cousins eventually have an affair, only to discover later that they are in fact brother and sister."
___ de Nil (pale yellowish green).   		3 letters,EAU.    	The color known as 'eau de nil' is a pale yellowish green. The name translates from French as 'water of the Nile'.
"Unisex name meaning ""born again"".   		4 letters","RENE.    	'René' and 'Renée' are French for the adjective 'reborn', when applied to masculine and feminine nouns."
Actor Auberjonois.   		4 letters,"RENE.    	René Auberjonois is an American actor. Auberjonois' most famous role on the big screen was Father Mulcahy in the movie ""M*A*S*H""."
What bateaux move across.   		3 letters,"EAU.    	In French, boats (bateaux) move across water (eau)."
Banff wildlife.   		3 letters,"ELK.    	Banff National Park in Alberta, Canada is located high in the Canadian Rockies and is a popular tourist destination. The town of Banff and the surrounding park were given their name in 1884 by then president of the Canadian Pacific Railway, George Stephen. He named Banff for his birthplace of Banffshire in Scotland."
It may be boiled in Bordeaux.   		3 letters,EAU.    	One might boil water (eau) in Bordeaux in France.
"Byelorussia, e.g.: Abbr..   		3 letters",SSR.    	The country that we now know as Belarus was called the Byelorussian Soviet Socialist Republic in the days of the Soviet Union.
