Palm phone.   		4 letters,"TREO.    	The Treo is a smartphone that was originally developed by a company called Handspring. Handspring was bought by Palm Inc, and Palm continues to develop and sell the Treo line, although the 2009 Palm Pre seems to be pushing aside the Treo brand name."
Letters from a short person?.   		3 letters,"IOU.    	If a person is ""short"" and can't pay up, he or she might write out an I.O.U. (I Owe You)."
Greeting of respect.   		6 letters,"SALAAM.    	The word ""salaam"" is an Anglicized spelling of the Arabic word for ""peace"". It can mean an act of deference, in particular a very low bow."
Author Robert ___ Butler.   		4 letters,"OLEN.    	Robert Olen Butler is an American writer of fiction. He won a Pulitzer in 1995 for his collection of short stories called ""A Good Scent from a Strange Mountain"". Each of the stories in the book tells of a different Vietnamese immigrant living in Louisiana."
First name on the Supreme Court.   		5 letters,"SONIA.    	In a 2001 speech addressing the need for stronger representation of the Hispanic community in the judiciary, future Supreme Court Justice Sotomayor made the remark:"
"Lou who sang ""You'll Never Find Another Love Like Mine"".   		5 letters","RAWLS.    	Lou Rawls was an American soul and blues singer known for his smooth vocal style. With his singing career well on the way, Rawls was asked to sing ""The Star Spangled Banner"" in 1977 at a Muhammad Ali fight in Madison Square Garden. This performance led to him being asked to sing the anthem many, many times in the coming years with his last rendition being at a World Series game in 2005. Rawls passed away in January of the following year."
Unstressed vowel symbol.   		5 letters,"SCHWA.    	A 'schwa' is an unstressed and toneless vowel found in a number of languages including English. Examples from our language are the 'a' in 'about', the 'e' in 'taken', and the 'i' in pencil."
"One may look both ways, briefly.   		3 letters","PED.    	When I was growing up, a pedestrian learned to look right, look left, and look right again before stepping into traffic to cross a road. I guess over here that is reversed, seeing as we drive on the other side of the road."
Largish musical group.   		5 letters,NONET.    	A nonet is group composed of nine instruments or voices.
"Shoulder muscles, briefly.   		5 letters","DELTS.    	The deltoid muscle is actually a group of muscles, the ones that cover the shoulder and create the roundness under the skin. The deltoid muscle is triangular in shape, resembling the Greek letter delta, hence the name."
"Foe of 130-Across, at birth.   		6 letters","KAL-EL.    	130. Lex Luthor alter ego, once : ATOM MAN"
Bike brand.   		6 letters,"YAMAHA.    	The Japanese company Yamaha, started out way back in 1888 as a manufacturer of piano and reed organs. Even though the company has diversified since then, Yamaha's logo still reflects it musical roots. Even on Yamaha motorcycles you can see a logo made up of three intersecting tuning forks."
Agenda's beginning or end.   		5 letters,"SCHWA.    	A 'schwa' is an unstressed and toneless vowel found in a number of languages including English. Examples from our language are the 'a' in 'about', the 'e' in 'taken' and the 'i' in pencil."
Colorless sort.   		6 letters,"ALBINO.    	'Albino', meaning an organism lacking normal pigmentation, comes from 'albus' Latin for 'white'."
TV host who inspired Neil deGrasse Tyson.   		5 letters,"SAGAN.    	Carl Sagan was a brilliant astrophysicist and a great communicator. Sagan was famous for presenting obscure concepts about the cosmos in such a way that we mere mortals could appreciate. He also wrote the novel ""Contact"" which was adapted into a fascinating 1997 film of the same name starring Jodie Foster."
Photo finish.   		5 letters,"MATTE.    	I bet you don't know the relationship between ""matte"" and alcohol! Well ""matte"", meaning flat and lusterless, comes from the Old French word ""mat"" meaning beaten down and withered, which in turn comes from the Latin ""maddus"", the word for being ""maudlin with drink"". Sometimes I wonder about these derivations ..."
"Having two or three kids in a family, nowadays.   		4 letters","NORM.    	The Total Fertility Rate (TFR) is the total number of children born to the average woman (approximately). In the early fifties, the TFR for the world was 4.9, whereas today it is down to 2.6. That's quite a shift. Here in the US the TFR was as low as 2.0 in the late thirties, and climbed to a high of 3.7 in the late fifties, and is now down to about 2.0 again."
Actress Sofer.   		4 letters,"RENA.    	Rena Sofer came to prominence as an actor in daytime television, most notably playing Lois Cerullo on ""General Hospital"". Her love interest on the show was played by Wally Kurth, and the online romance led to the pair walking down the aisle in real life in 1995 (although they divorced two years later)."
"Mitt Romney and others, once.   		4 letters","CEOS.    	Mitt Romney was born Willard Mitt Romney in 1947 in Detroit, Michigan. Romney's parents named him after J. Willard Marriott (the hotel magnate) who was the father's best friend, and after Milton 'Mitt' Romney who was the father's cousin and quarterback for the Chicago Bears."
Birthstone that was the name of a Hitchcock film.   		5 letters,"TOPAZ.    	Topaz' is a Hitchcock film released in 1969. 'Topaz' is a Cold War spy story based on the book of the same name by the great Leon Uris. This film is a little unusual for a Hitchcock work as it doesn't feature a big Hollywood name, and it wasn't particularly well received at the box office."
Island capital of 2.6 million.   		6 letters,"TAIPEI.    	""Taipei City"" translates from Chinese as ""Northern Taiwan City"" and indeed is situated at the northern tip of the island of Taiwan."
The majority of people live here.   		7 letters,"EURASIA.    	Eurasia covers 36% of the land mass on the planet, and is home to 71% of its population."
Part of A.M.A.: Abbr..   		4 letters,AMER.    	American Medical Association (AMA)
Indian tongue.   		5 letters,"TAMIL.    	Tamil is the main language spoken by the Tamil people of the subcontinent of India. Tamil is described as one of the greatest and oldest classical languages in the world, with Tamil literature having been around for over 2,000 years."
Philosopher Mo-___.   		3 letters,TZE.    	Mozi (also Mo-Tze) was a Chinese philosopher whose positions were often in conflict with Confucianism.
Penury.   		4 letters,"NEED.    	Penury is extreme poverty or need, from the Latin ""penuria"" meaning ""want""."
Old Fords.   		4 letters,"LTDS.    	There has been a lot of speculation about what the acronym LTD stands for in the car model ""Ford LTD"". Many say it stands for Luxury Trim Decor, and others that it is an abbreviation for ""limited"". Well, it turns out that LTD was chosen as just three meaningless letters that sound good together."
Braga of Hollywood.   		5 letters,"SONIA.    	Sonia Braga achieved fame in here native Brazil playing the title role in the movie ""Gabriela"". There followed roles in American films such as ""Kiss of the Spider Woman"" and ""The Milagro Beanfield War"". She has also played in the Portuguese version of ""Desperate Housewives""."
"Prescriptions, for short.   		3 letters","RXS.    	There seems to some uncertainty about the origin of the symbol ""Rx"", used for a medical prescription. One explanation is that it comes from the astrological sign for Jupiter, a symbol put on prescriptions to invoke Jupiter's blessing to help the patient recover."
iPhone capability.   		5 letters,"EMAIL.    	Apple started selling the iPhone at 6 pm local time on June 29, 2007, with hundreds of customers lined up outside stores all over the world. Not me. I use a pay-as-you-go phone from T-Mobile, that cost me less than $45 for the whole of last year for calls and text (including many to Ireland) ..."
Work by 16-Across.   		10 letters,ODE TO JOY.    	(16. Composer of 20-Across : BEETHOVEN)
Mars atmosphere features.   		5 letters,"CIRRI.    	The Martian atmosphere contains large cirrus clouds made up of water-ice. These high, wispy clouds were photographed by the Opportunity rover in 2004."
"With 64-Across, 1-/66-Across movie of 2005.   		5 letters",MATCH.    	64. See 9-Across : POINT
Singer Lou.   		5 letters,"RAWLS.    	Lou Rawls was an American soul and blues singer known for his smooth vocal style. With his singing career well on the way, Rawls was asked to sing ""The Star Spangled Banner"" in 1977 at a Muhammad Ali fight in Madison Square Garden. This performance led to him being asked to sing the anthem many, many times in the coming years with his last rendition being at a World Series game in 2005. Rawls passed away in January of the following year."
"Hayek of ""Frida"".   		5 letters","SALMA.    	Salma Hayek is a Mexican actress. Hayek was the first Mexican national to be nominated for a Best Actress Oscar, for her portrayal of artist Frida Kahlo in the 2002 movie ""Frida""."
What hoity-toity people put on.   		4 letters,"AIRS.    	Believe it or not, the word ""hoity-toity"" has been in the English language since the 1660s, but back then it meant ""riotous behavior"". It began to mean ""haughty"" in the late 1800s, simply because the two terms sounded familiar."
Former Israeli P.M.   		4 letters,"EHUD.    	Ehud Olmert took over as Acting Prime Minister after Ariel Sharon suffered a severe stroke early in 2006. He then led his party to victory in a general election held later that same year. He held Israel's highest office in his own right until 2009, when he had to step down facing allegations of corruption."
"Winter reading, say.   		5 letters","TEENS.    	In the winter, temperatures can get down into the teens."
Dictionary abbr..   		3 letters,VAR.    	Dictionaries list variants of words.
"""60 Minutes"" pundit Andy.   		6 letters","ROONEY.    	Andy Rooney began his career in newspapers during WWII working for ""Stars and Stripes"" in London. He had some memorable experiences during the war, including flying on the first American bombing raid over Germany. He was also one of the first American journalists to visit the German concentration camps as they were liberated. He started his ""A Few Minutes with Andy Rooney"" on CBS's ""60 Minutes"" way back in 1978, and so has been on our screens for over 40 years. He's a cool, cool guy ..."
East Coast b-ball powerhouse.   		5 letters,"UCONN.    	The University of Connecticut was founded in 1881 as the Storrs Agricultural School, taking its name from two brothers, the Storrs, who donated the land and provided initial funding."
"Daniel ___ Kim of ""Lost"".   		3 letters","DAE.    	Daniel Dae Kim is an American actor, famous for playing Jin-Soo Kwon on ""Lost"". He now plays one of the leads on the CBS remake of ""Hawaii Five-O"", portraying the character Chin Ho Kelly."
1972 Bill Withers hit.   		6 letters,"USE ME.    	Bill Withers was working as an assembly operator while he was trying to make a name for himself in the music industry. Even as Withers found success with his glorious 1971 single ""Ain't No Sunshine"", he held onto his day job, worried that the music industry was unpredictable."
O.T.   		3 letters,"NEH.    	In the Hebrew Bible the Book of Ezra was originally combined with the Book of Nehemiah, with the two being separated in the early days of the Christian Era."
Vintner's need.   		5 letters,YEAST.    	Vinters make wine by fermenting crushed grapes with yeast.
"16-Across concern, briefly.   		6 letters","H-BOMB.    	The first test of a hydrogen bomb was in 1954 at Bikini Atoll in the Marshall Islands. It may have been a technical success, but it was an environmental disaster, largely because the actual yield of 15 megatons was unexpected (the military anticipated only 4-6 megatons). The resulting nuclear fallout caused many deaths, and led to birth defects in generations to come."
Silas of the Continental Congress.   		5 letters,"DEANE.    	Silas Deane was a member of the Continental Congress. When Deane was dispatched to Paris by the Congress, he became America's first foreign diplomat. His amazing story is told in Joel Richard Paul's book ""Unlikely Allies""."
Asian holidays.   		4 letters,"TETS.    	The full name for the New Year holiday in Vietnam is Tet Nguyen Dan, meaning ""Feast of the First Morning"". Tet usually falls on the same day as Chinese New Year."
Lacking luster.   		5 letters,"MATTE.    	What's the relationship between ""matte"" and alcohol? Well, ""matte"" meaning flat and lusterless, comes from the Old French word ""mat"" meaning beaten down and withered, which in turn comes from the Latin ""maddus"", the word for being ""maudlin with drink"". Sometimes I wonder about these derivations ..."
One of the Mario Brothers.   		5 letters,"LUIGI.    	Mario Bros. started out as an arcade game back in 1983, developed by Nintendo. The more famous of the two brothers, Mario, had already appeared in an earlier arcade game called ""Donkey Kong"". Mario was given a brother called Luigi, and the pair have been around ever since. In the game, Mario and Luigi are Italian American plumbers from New York City."
"""Whatever Lola Wants,"" e.g.   		5 letters","TANGO.    	""Whatever Lola Wants"" is a song from the musical ""Damn Yankees"". ""Damn Yankees"" is actually yet another version of the classic German legend of ""Faust"", set in Washington, D.C. in the fifties. The show was written by Richard Adler and Jerry Ross, a production that turned out to be a very successful follow-up to their prior hit, ""The Pajama Game"". The future was looking really rosy for Adler and Ross but, sadly, Jerry Ross died of an obstructive lung disease only a few weeks after ""Damn Yankees"" opened on Broadway in 1955. He was just 29 years old."
Football team with a blue horseshoe on its helmet.   		5 letters,"COLTS.    	The Indianapolis Colts professional football team has been in Indiana since 1984. The team traces its roots back to the Dayton Triangles, one of the founding members of the NFL created in 1913. The Dayton Triangles relocated and became the Brooklyn Dodgers in 1930, and then the Brooklyn Tigers in 1944. The team merged with the Boston Yanks in 1945, playing in Boston. The Yanks were moved to New York in 1949, and then to Dallas in 1952 as the Dallas Texans. The Texan franchise moved to Baltimore in 1953, forming the Colts. The Colts made their last move, to Indianapolis, in 1984. Whew!"
Cellulose fiber brand.   		5 letters,ARNEL.    	Arnel is a brand name of an acetate textile.
Gossipy sorts.   		6 letters,"YENTAS.    	Yenta (also ""Yente"") is actually a female Yiddish name. In Yiddish theater ""yenta"" came to mean a busybody, gossip."
Golden ___ Bridge.   		4 letters,"GATE.    	The Golden Gate is the opening of San Francisco Bay into the Pacific Ocean. The bridge that spans the Golden Gate was opened in 1937, and at the time was the longest suspension bridge in the world. One of the most eerie things about the Golden Gate Bridge is that is the most popular place in the whole world to commit suicide. Steps have been taken to reduce the number of suicides, including suicide hotline telephones placed along the walkway, but still there is one suicide every two weeks on average throughout the year. There are plans to place a purpose built net below the bridge as a deterrent."
Newbie's resource.   		3 letters,FAQ.    	Most websites have a page listing answers to Frequently Asked Questions (FAQ). There is a link to the NYTCrossword's blog's FAQ page at the top right of every page.
"President who said ""I'm an idealist without illusions"".   		7 letters","KENNEDY.    	I couldn't find the context of this quote by President Kennedy, but I do know it came from the era when Ted Sorensen served as his speech writer and policy advisor."
"Author of the ""Mostly Ghostly"" book series.   		5 letters",STINE.    	The author R. L. Stine is sometimes referred to as the Stephen King of children's literature as he writes horror stories for young people.
Home entertainment centerpiece.   		7 letters,CONSOLE.    	
Expensive fur.   		5 letters,"SABLE.    	Sables are small mammals about two feet long, found right across northern Europe and northern Asia. The sable's pelt is highly prized in the fur trade. It is unique among furs in that it feels smooth no matter which direction it is stroked."
Fearsome dino.   		5 letters,"T REX.    	The Tyrannosaurus rex (usually written T. rex) was a spectacular looking dinosaur. 'Tyrannosaurus' comes from the Greek words 'tyrannos' (tyrant) and 'sauros' (lizard), and the 'rex' is of course Latin for 'king'. They were big boys, measuring 42 feet long and 13 feet tall at the hips, and weighing 7.5 tons."
"Frequent party planner, for short.   		4 letters",FRAT.    	Fraternity parties ... Toga! Toga! Toga!
Phoenix setting?.   		5 letters,"ASHES.    	The phoenix is a fabulous bird of Greek mythology, which can also be found in the mythologies of Persia, Egypt and China. The phoenix is a fire spirit, which lives from 500 to 1000 years. At the end of its lifespan is builds a nest for itself (a pyre) and self-ignites, burning itself and the nest, creating a pile of ashes. A young phoenix arises from the ashes and the cycle starts all over again."
Fly on a line.   		8 letters,PARASAIL.    	Parasailing is hanging below a tethered parachute that is towed by a boat.
Yellowish shade.   		5 letters,"OCHRE.    	Ochre is often spelled ""ocher"" in the US (it's ochre where I come from). Ocher is a light, yellowy brown color, although variations of the pigment are possible, such as red ocher and purple ocher."
Feminine org.   		4 letters,"YWCA.    	The Young Women's Christian Association was founded in the late 1800s about 50 years after the YMCA, although the two organizations have always been independent of each other. Having said that, some local YWCA and YMCA organizations have amalgamated and often share facilities. Like the YMCA, the YWCA movement has its roots in England, but its headquarters is now in Geneva, Switzerland. It is quite the organization, the largest women's group in the whole world."
Chard or cab alternative.   		3 letters,ZIN.    	Zinfandel is my favorite red wine varietal. It amazes me that the rich and heavy red Zinfandel comes from the same grape as does the sweet White Zinfandel.
"Superstate in Orwell's ""1984"".   		7 letters","EURASIA.    	The action in George Orwell's 1949 novel ""Nineteen Eighty-Four"" takes place in the intercontinental super-state of Oceania. Orwell created two other super-states, Eurasia and Eastasia."
"Turnarounds, slangily.   		4 letters",UIES.    	U-turns.
D.C.   		3 letters,"RFK.    	Robert F. Kennedy Memorial Stadium was opened in 1961 as the District of Columbia Stadium, and is actually owned by the District of Columbia. The stadium was renamed in 1969, a few months after Robert Kennedy was assassinated. Kennedy had been instrumental the racial integration of the Washington Redskins who played in the stadium for 36 seasons. As Attorney General, Kennedy threatened to oust the Redskins from the federally-owned stadium unless the team agreed to sign African American players."
"""___ and Let Die"" (Paul McCartney hit).   		4 letters","LIVE.    	""Live and Let Die"" was the first rock and roll song to be used as the theme for a James Bond movie. It was written by Paul and Linda McCartney for the 1973 movie of the same name, starring Roger Moore as 007. The song was nominated for the Best Original Song Oscar that year, but lost out to the theme from ""The Way We Were""."
One-___ (old ball game).   		5 letters,"O'CAT.    	One o'cat, or more properly ""one old cat"", is an abbreviated form of baseball with a home plate and just one base."
Transmission repair chain.   		5 letters,"AAMCO.    	AAMCO is named after one of the two founders, Anthony A. Martino (AAM). The company was founded in 1963 in Philadelphia, and opened its first franchise in Newark that same year. There are now about 800 franchises, and AAMCO is the largest transmission chain in the world."
Prefix with polar or cameral.   		4 letters,"UNI-.    	A unicameral legislature is one that has one house or chamber. One example of such an arrangement is the government of Israel, which has one chamber known as the Knesset. 'Camera' is the Latin for 'chamber'."
"""___ You"" (1955 Platters hit).   		4 letters","ONLY.    	The 1955 hit by the Platters is more completely called ""Only You (and You Alone)""."
Madame Tussaud's first name.   		5 letters,"MARIE.    	Marie Tussaud was a wax sculptor from France. Some of her early work was very gruesome as she lived through the French Revolution. She would take the decapitated heads of executed citizens and use them to make death masks which were then paraded through the streets. She eventually moved to London, taking with her a vast collection of wax models made by her and her father. She opened a museum to display the works, and the Madame Tussaud's wax museum is a major attraction in the city to this day."
Sch.   		3 letters,"ISU.    	Iowa State University of Science and Technology (ISU) is located in Ames, Iowa. Among many other notable events, ISU created the country's first school of veterinary medicine, in 1879."
Wraps around the subcontinent.   		5 letters,"SARIS.    	The item of clothing called a ""sari"" (also ""saree"") is a strip of cloth, as one might imagine, unusual perhaps in that is unstitched along the whole of its length. The strip of cloth can range from four to nine meters long (that's a lot of material!). The sari is usually wrapped around the waist, then draped over the shoulder leaving the midriff bare. I must say, it can be a beautiful item of clothing."
"Drain cleaner, chemically.   		4 letters","NAOH.    	Caustic soda is sometimes called lye. Chemically, caustic soda it is sodium hydroxide (NaOH). It's nasty stuff, a white solid in its pure form. When you add it to water it generates an awful lot of heat, a property that is taken advantage of in using lye as a drain cleaner."
Triangular traffic sign.   		5 letters,"YIELD.    	When something is different in America than it is in the UK, the Irish way tends to be the same as the British way (spelling, driving, rules of the road etc.). But in Ireland we have Yield signs, just like in America, whereas in the UK such signs say ""Give Way"". Just a little bit of trivia ..."
"""Do the Right Thing"" pizzeria.   		5 letters","SAL'S.    	""Do the Right Thing"" is a Spike Lee movie, released in 1989. Much of the action in the film is centered on a local pizzeria called ""Sal's"" owned by Italian-American Salvatore Frangione (played by Danny Aiello)."
Legis.   		4 letters,SESS.    	A session is a legislative period.
Fairy tale girl.   		6 letters,"GRETEL.    	""Hansel and Gretel"" is a Germanic fairy tale found in the collection of the Brothers Grimm. It tells of two siblings, Hansel and Gretel, the children of a woodcutter. The youngsters are abandoned in a forest at the behest of an evil stepmother. Clever Hansel hears of the plan and leaves a trail of pebbles so that he and his sister can find their way home, which they do. But the children are abandoned again and this time leave a trail of breadcrumbs. Unfortunately, the crumbs are eaten by birds and so the children do indeed become lost. But eventually they do all live happily ever after ..."
Einstein's birthplace.   		3 letters,"ULM.    	Albert Einstein was born in Ulm on March 14th 1879. His parents were Hermann and Pauline Einstein. Hermann moved his family to Munich, where he set up a company to manufacture electrical equipment, along with his brother. Ulm is in the south of Germany, and sits on the River Danube. It is famous for being home to the tallest church in the world, Ulm Minster, a Gothic building with a steeple that is 530ft tall, with 768 steps to climb. Quite a workout, I'd say ..."
___ sponte (of its own accord).   		3 letters,SUA.    	'Sua sponte' is a Latin term meaning 'of their own accord'. In the law it describes the action of say a judge who acts on his or her own initiative without a request from the parties in a case.
O.   		5 letters,"ALIAS.    	William Sydney Porter wrote under the name O. Henry. He was famous for short stories that were witty, had clever wordplay, and usually ending ""with a twist""."
Japanese police dogs.   		6 letters,"AKITAS.    	The Akita breed of dog is named for its point of origin, the Akita Prefecture in Japan. When Helen Keller visited Japan in 1937, she asked for and was given an Akita breed of dog, with the name of Kamikaze-go. Sadly, the dog died within a year from distemper. The following year the Japanese government officially presented Keller with a replacement dog. Supposedly Keller's dogs were the first members of the breed to be introduced into the US."
Shinto shrine entrance.   		5 letters,"TORII.    	A torii is a very traditional Japanese gate, often seen at the entrance to a Shinto shrine."
Jewish holiday in Adar.   		5 letters,"PURIM.    	Purim is a Jewish festival commemorating the deliverance of the Jewish people from a plot to wipe them out by Haman the Agagite, as recorded in the Book of Esther. During the celebration of Purim, the book is read aloud, once in the evening, and once the following morning. By the way, Esther is the only book in the Old Testament that doesn't mention God."
Neighbor of Montana.   		7 letters,"ALBERTA.    	Alberta is a big province, about the size of Texas. Alberta is named after Princess Louise Caroline Alberta, the fourth child of Queen Victoria and Prince Albert. Princess Louise also donated her name to Lake Louise, the large glacial lake in the province, in Banff National Park."
