"Group featured in ""Mamma Mia!"".   		4 letters","ABBA.    	The hit musical 'Mamma Mia!' was written to showcase the songs of ABBA. I'm a big fan of ABBA's music, so I've seen this show a couple of times and just love it. 'Mamma Mia!' is such a big hit on the stage that on any given day there are at least seven performances going on somewhere in the world. There is a really interesting film version of the show that was released in 2008. I think the female lead Meryl Streep is wonderful in the movie, but the male leads ... not so much! By the way, one can tell the difference between 'Mamma Mia' the ABBA song and 'Mamma Mia!' the musical, by noting the difference in the punctuation in the titles."
Reggae precursor.   		3 letters,"SKA.    	Ska originated in Jamaica in the late fifties and was the precursor to reggae music. No one has a really definitive etymology of the term ""ska"", but it is likely to be imitative of some sound."
"The Stooges, e.g.   		4 letters","TRIO.    	If you've seen a few of the films starring ""The Three Stooges"" you'll have noticed that the line up changed over the years. The original trio was made up of Moe and Shemp Howard (two brothers), and Larry Fine (a good friend of the Howards). This line up was usually known as ""Moe, Larry and Shemp"". Then Curly Howard replaced his brother when Shemp quit the act, creating the most famous trio, ""Moe, Larry And Curly"". Shemp returned when Curly had a debilitating stroke in 1946, and he stayed with the troupe until he died in 1955. Shemp was replaced by Joe Besser, and then ""Curly-Joe"" DeRita. When Larry had a stroke in 1970, it effectively marked the end of the act."
"""Ooky"" family cousin.   		3 letters","ITT.    	In the television sitcom ""The Addams Family"", the family had a frequent visitor called Cousin Itt. Itt is a short man with long hair that runs from his head to the floor. Cousin Itt was played by Italian actor Felix Silla."
Cheer for a toreador.   		3 letters,"OLE.    	""Toreador"" is an old Spanish word for a bullfighter, but it's a term not used any more in Spain nor in Latin America. In English we use the term ""toreador"", but in Spanish a bullfighter is a ""torero""."
"K-12, in education.   		4 letters","ELHI.    	""Elhi"" is an informal word used to describe anything related to schooling from grades 1 through 12, i.e. elementary through high school."
"Old ""There's no step 3!"" sloganeer.   		4 letters","IMAC.    	The iMac is a desktop computer platform from Apple introduced in 1998. One of the main features of the iMac is an ""all-in-one"" design, with the computer console and monitor integrated. The iMac also came in a range of colors, that Apple marketed as 'flavors', such strawberry, blueberry and lime. When the iMac was introduced, the marketing folks emphasised the computer's ease of setup. In a commercial starring actor Jeff Goldblum, it was pointed out that only two steps were needed to connect to the Internet. Goldblum then uttered the famous line 'There's no step 3!"""
K-12.   		4 letters,"ELHI.    	""Elhi"" is an informal word used to describe anything related to schooling from grades 1 through 12, i.e. elementary through high school."
52 semanas.   		3 letters,"ANO.    	A year (ano) is made up of 52 weeks (semanas), in Spanish, and in English for that matter ..."
"""Dies ___"" (hymn).   		4 letters","IRAE.    	""Dies Irae"" is Latin for ""Day of Wrath"" and is the name of a famous melody in Gregorian Chant, one that is often used as part of the Roman Catholic Requiem Mass."
Often-kicked comics canine.   		4 letters,"ODIE.    	Odie is Garfield's best friend and is a slobbery beagle, a character in Jim Davis's comic strip."
Lyric muse.   		5 letters,"ERATO.    	In Greek mythology, the muses are the goddesses who inspire the creation of literature and the arts. The number of muses is a subject of debate at times, but the most popular view is that there are nine:"
Ending for all Facebook logins until late '05.   		3 letters,"EDU.    	Prior to 2005, what we know today as Facebook was known as 'The Facebook'. All of the users of TheFacebook.com back then were university students. The name changed to Facebook in 2005 when the company purchased the doman name Facebook.com, for $200,000."
"The Magi, e.g.   		4 letters","TRIO.    	'Magi' is the plural of the Latin word 'magus', a term applied to someone who was able to read the stars. Hence, magi is commonly used with reference to the 'wise men from the East' who followed the star and visited Jesus soon after he was born."
Palindromic girl's name.   		3 letters,AVA.    	The three most famous palindromes in English have to be:
Cousin ___ of 1960s TV.   		3 letters,"ITT.    	In the television sitcom ""The Addams Family"", the family had a frequent visitor called Cousin Itt. Itt is a short man, with long hair that runs from his head to the floor. Itt was played by Italian actor Felix Silla."
Delhi dress.   		4 letters,"SARI.    	The item of clothing called a ""sari"" (also ""saree"") is a strip of cloth, as one might imagine, unusual perhaps in that is unstitched along the whole of its length. The strip of cloth can range from four to nine meters long (that's a lot of material!). The sari is usually wrapped around the waist, then draped over the shoulder leaving the midriff bare. I must say, it can be a beautiful item of clothing."
Alan who played Hawkeye.   		4 letters,"ALDA.    	Alan Alda won Emmy's for directing, acting and writing in ""M*A*S*H"". He played Hawkeye Pierce on the show, the character played by Donald Sutherland in the movie."
Honolulu hello.   		5 letters,"ALOHA.    	Honolulu is the largest city in Hawaii, and the state capital. Located on the island of Oahu, the name 'Honolulu' translates from Hawaiian as 'place of shelter, calm port, sheltered bay'."
HI hi.   		5 letters,"ALOHA.    	The Hawaiian word ""Aloha"" has many meanings in English: affection, love, peace, compassion and mercy. More recently ""aloha"" has come to mean ""hello"" and ""goodbye"", but only since the mid-1800s."
Romain de Tirtoff's pseudonym.   		4 letters,"ERTE.    	Erté was the pseudonym of French artist (Russian born) Romain de Tirtoff. Erté is the French pronunciation of his initials ""R.T."""
"""M*A*S*H"" star.   		4 letters","ALDA.    	Alan Alda won Emmys for directing, acting and writing in ""M*A*S*H"". He played Hawkeye Pierce on the show, the character played by Donald Sutherland in the movie."
"Card that may be ""in the hole"".   		3 letters","ACE.    	In community card poker (poker in which some cards are dealt face up and shared by the players), the cards that are dealt face down to each individual are known as ""hole cards"". It is usually advantageous to have a high card like an ace ""in the hole"". Hence, we have the phrase ""to have an ace in the hole"" meaning to have a hidden advantage in a situation. The phrase ""ace up one's sleeve"" means the same thing today, however, that phrase is derived from someone flouting the rules!"
"The ""A"" in NATO: Abbr..   		3 letters","ATL.    	NATO is the North Atlantic Treaty Organization (or OTAN in French, l'Oganisation du Traite de l'Atlantique Nord). NATO was founded not long after WWII in 1949, and is headquartered in Brussels, Belgium. The first NATO Secretary General was Lord Ismay, Winston Churchill's chief military assistant during WWII. Famously he said the goal of NATO was ""to keep the Russians out, the Americans in, and the Germans down."""
"""Trainwreck"" star Schumer.   		3 letters","AMY.    	Amy Schumer is a stand-up comedian, and an alumna of the reality TV show 'Last Comic Standing', in which she placed fourth. Schumer now has her own comedy series 'Inside Amy Schumer', which airs on Comedy Central. Amy is a first cousin once removed of Chuck Schumer, the senior US Senator from New York."
Big-screen canine.   		4 letters,"ASTA.    	Asta was the wonderful little dog in the superb movie ""The Thin Man"" starring William Powell and Myrna Loy. In the original story by Dashiell Hammett, Asta was a female Schnauzer, but on screen Asta was played by a wire-haired fox terrier called ""Skippy"". Skippy was also the dog in ""Bringing up Baby"" with Cary Grant and Katherine Hepburn, the one who kept stealing the dinosaur bone. Skippy retired in 1939, so Asta was played by other dogs in the remainder of ""The Thin Man"" films."
"""Rugrats"" dad.   		3 letters",STU.    	'Rugrats' is a cartoon show that aired on Nickelodeon.
Actor Ryan.   		6 letters,"O'NEAL.    	Actor Ryan O'Neal got his big break in the sixties on television. He appeared in the prime-time soap opera 'Peyton Place', opposite fellow newcomer Mia Farrow. Then in 1970 he landed a starring role in the hit movie 'Love Story', which established him in Hollywood. O'Neal was an amateur boxer before he turned to acting, and established a respectable record Golden Gloves competitions. These days, O'Neal has a recurring role on the TV show 'Bones', playing the title character's father."
"Jungfrau, e.g.   		3 letters",ALP.    	The Jungfrau is a peak in the Bernese Alps in Switzerland. 'Jungfrau' translates from German as 'maiden' or 'virgin'.
"Cream, for example.   		4 letters","TRIO.    	Cream were a ""supergroup"" from Britain, meaning the band was comprised of musicians from other successful groups. The band's members were Eric Clapton, Jack Bruce and Ginger Baker."
U.S.   		5 letters,"OBAMA.    	President Obama's mother's full name was Stanley Ann Durham. She worked as an anthropologist, having earned a Ph. D. at the University of Hawaii. Ann met her first husband, Barack Obama, Sr. in a Russian Language class, and the two were married in 1961."
"""Mamma Mia"" group.   		4 letters","ABBA.    	I am an unapologetic fan of ABBA's music. ABBA was of course the Swedish group that topped the charts in the seventies and eighties. The name ABBA is an acronym formed from the first letters of the given names of each of the band members, namely: Agnetha, Benny, Bjorn and Anni-Frid."
"Adams of ""The Fighter"".   		3 letters","AMY.    	Amy Adams is an American actress. My favorite film of hers so far is the outstanding ""Julie & Julia"" in which she acted alongside Meryl Streep. I highly recommend this truly delightful movie."
Horse of a sort.   		4 letters,"ARAB.    	The Arab (or Arabian) breed of horse takes its name from its original home, the Arabian Peninsula. Like any animal that humans have over-bred though, the horse falls prey to genetic diseases, some of which are fatal, and some of which require the horse to be euthanized."
Hi in HI.   		5 letters,"ALOHA.    	The Hawaiian word ""Aloha"" has many meanings in English: affection, love, peace, compassion and mercy. More recently ""aloha"" has come to mean ""hello"" and ""goodbye"", but only since the mid-1800s."
"""The Thin Man"" dog.   		4 letters","ASTA.    	Asta is the wonderful little dog in the superb movie ""The Thin Man"" starring William Powell and Myrna Loy (as Nick and Nora Charles). In the original story by Dashiell Hammett, Asta was a female Schnauzer, but on screen Asta was played by a wire-haired fox terrier called ""Skippy"". Skippy was also the dog in ""Bringing up Baby"" with Cary Grant and Katharine Hepburn, the one who kept stealing the dinosaur bone. Skippy retired in 1939, so Asta was played by other dogs in the remainder of ""The Thin Man"" films."
Madame Bovary.   		4 letters,"EMMA.    	""Madame Bovary"" is the most famous novel written by Gustave Flaubert. The title character is a doctor's wife named Emma Bovary, who lives a luxurious life beyond her means and has many adulterous affairs. The novel had a rousing reception, first being attacked by public prosecutors as obscenity, which I am sure later helped it to become a bestseller."
Airline to Ben Gurion.   		5 letters,EL AL.    	El Al Israel Airlines is the flag carrier of Israel. The term 'el al' translates from Hebrew as 'to the skies' or 'skyward'.
1985 Oscars co-host with Fonda and Williams.   		4 letters,"ALDA.    	The first Academy Awards Ceremony was held in 1929, hosted by Douglas Fairbanks and William deMille. The 58th Academy Awards Ceremony, held in 1986, was co-hosted by Alan Alda, Jane Fonda and Robin Williams."
Legend of climbing expeditions.   		4 letters,"YETI.    	A yeti is a beast of legend, also called an abominable snowman. ""Yeti"" is a Tibetan term, and the beast is fabled to live in the Himalayan regions of Nepal and Tibet. Our equivalent legend in North America is that of Bigfoot, also known as Sasquatch. The study of animals whose existence have not yet been substantiated is called cryptozoology."
"Debussy's ""La ___"".   		3 letters","MER.    	""La Mer"" is a lovely group of three symphonic sketches for orchestra by the French composer Claude Debussy. Listen to it, and you can feel yourself at the ocean. ""La Mer"" is French for ""The Sea""."
French goodbye.   		5 letters,"ADIEU.    	""Adieu"" is the French for ""goodbye"" or ""farewell"", from ""à Dieu"" meaning ""to God"". The plural of 'adieu' is 'adieux'."
Anthony's XM Radio partner.   		4 letters,"OPIE.    	The Opie & Anthony Show' is a talk show broadcast on XM and Sirius satellite radio. Hosts of the show are Opie Hughes and Anthony Cumia. I've turned into a bit of grouch in my old age, and I must admit that I find broadcasts like 'The Opie & Anthony Show' very puerile and offensive. Past features in the show include 'Whip 'em Out Wednesdays', 'Voyeur Bus' and 'T&A with O&A'. You get the idea ..."
Shul fixture.   		3 letters,"ARK.    	The Torah ark is found in a synagogue, and is the ornamental container in which are stored the Torah scrolls."
Mayberry kid.   		4 letters,"OPIE.    	Opie Taylor is the character played by Ron Howard on 'The Andy Griffith Show'. Opie lives with widowed father Andy Taylor (played by Andy Griffith) and his great-aunt Beatrice 'Aunt Bee' Taylor (played by Frances Bavier. Ron Howard first played the role in 1960 in the pilot show, when he was just 5 years old. Howard sure has come a long way since playing Opie Taylor. He has directed some fabulous movies including favorites of mine like ""Apollo 13"", ""A Beautiful Mind"" and ""The Da Vinci Code""."
Director Lee.   		3 letters,"ANG.    	Taiwanese director Ang Lee sure has directed a mixed bag of films, mixed in terms of genre but not in terms of quality. He was at the helm for such classics as ""Sense & Sensibility"" (my personal favorite), ""Crouching Tiger, Hidden Dragon"", ""Hulk"", ""Brokeback Mountain"" and ""Life of Pi""."
"Cream, e.g.   		4 letters","TRIO.    	Cream were a rock trio from Britain that made it big in the sixties. The three members of Cream were guitarists Jack Bruce and Eric Clapton (who both went to extraordinarily successful solo careers), and drummer Ginger Baker."
Apple variety.   		4 letters,"IMAC.    	The iMac is a desktop computer platform from Apple introduced in 1998. One of the main features of the iMac is an ""all-in-one"" design, with the computer console and monitor integrated. The iMac also came in a range of colors, that Apple marketed as 'flavors', such strawberry, blueberry and lime."
Leprechaun's home.   		4 letters,"ERIN.    	""Éire"", is the Irish word for ""Ireland"". ""Erin"" is an anglicized version of ""Éire"" and actually corresponds to ""Éirinn"", the dative case of ""Éire""."
Zenith competitor.   		3 letters,"RCA.    	During WWI, the US government actively discouraged the loss of certain technologies to other countries, including allies. The developing wireless technologies were considered to be particularly important by the army and navy. The government prevented the General Electric Company from selling equipment to the British Marconi Company, and instead facilitated the purchase by GE of the American Marconi subsidiary. This purchase led to GE forming the Radio Corporation of America that we know today as RCA."
Early Beatle Sutcliffe.   		3 letters,"STU.    	Stu Sutcliffe was one of the original four members of the Silver Beatles, along with Lennon, McCartney and Harrison. Sutcliffe apparently came up with name ""Beatles"" along with John Lennon, as a homage to their hero Buddy Holly who was backed by the ""Crickets"". By all reports, Sutcliffe wasn't a very talented musician, and was more interested in painting. He went with the group to Hamburg, more than once, but he eventually left the Beatles and went back to art school, actually studying for a while at the Hamburg College of Art. In 1962, in Hamburg, he collapsed with blinding headaches. He died in the ambulance on the way to hospital, his death attributed to cerebral paralysis."
Waikiki welcome.   		5 letters,"ALOHA.    	Waikiki is a neighborhood of Honolulu, home to the famous Waikiki Beach. The name ""Waikiki"" means ""spouting fresh water"" in Hawaiian."
"The Rice Krispies mascots, e.g.   		4 letters","TRIO.    	Snap, Crackle and Pop are three elves employed as the mascots for Kellogg's Rice Krispies. The trio first appeared in an ad campaign in 1933, although the phrase ""snap, crackle and pop"" had been used for the cereal for some time in radio ads. By the way, the elves are selling ""Rice Bubbles"" in Australia, and the elves have different names in other parts of the world (like ""Cric!, Crac! and Croc! in Quebec)."
Black bird.   		3 letters,"ANI.    	The tropical bird called the ani is related to the cuckoo, although it doesn't go around robbing other birds' nests like a cuckoo does!"
Comics canine.   		4 letters,"ODIE.    	Odie is Garfield's best friend and is a slobbery beagle, a character in Jim Davis's comic strip."
Fabled monster in English literature.   		3 letters,"ORC.    	Orcs are mythical humanoid creatures that appear in the writings of J. R. R. Tolkien. Since Tolkien's use of orcs, they have also been featured in other fantasy fiction and in fantasy games."
"Gran Paradiso, e.g.   		3 letters","ALP.    	Gran Paradiso is a mountain in the Graian Alps in southern Europe. Mont Blanc is the highest peak in the Alps and is located nearby, straddling the border between France and Italy. Gran Paradiso is the highest mountain that lies totally within the territory of Italy."
Actress Gardner.   		3 letters,"AVA.    	Ava Gardner is noted for her association with some big movies, but also for her association with some big names when it came to the men in her life. In the world of film, she appeared in the likes of ""Mogambo"" (1953), ""On the Beach"" (1959), ""The Night of the Iguana"" (1964) and ""Earthquake"" (1974). The men in her life included husbands Mickey Rooney, Artie Shaw and Frank Sinatra. After her marriages had failed (and perhaps before!) she had long term relationships with Howard Hughes and bullfighter Luis Miguel Dominguin whom she met through her friend Ernest Hemingway."
First daughter of 1977-81.   		3 letters,"AMY.    	Amy Carter is the only daughter of President Jimmy Carter. She is the youngest child, and has three older brothers. After growing up in the White House, Amy Carter turned to political activism and was very vocal on US policy towards South African apartheid and Central America. She was arrested at a 1987 demonstration, but was later acquitted. Today she has a close relationship with her father, and is on the board of counselors of the Carter Center. In 1995 she provided the illustrations for her father's book for children, ""The Little Baby Snoogle-Fleejer""."
Tarmac fig.   		3 letters,ETD.    	Estimated Time of Departure (ETD).
"""Chiquitita"" group.   		4 letters","ABBA.    	I am unashamed in my love of ABBA's music. ""Chiquitita"" translates into ""little girl"", I think, in Sapanish. It was released in English, and became a great hit. ABBA don't speak Spanish, but they managed to put together a Spanish version anyway."
"Debussy's ""La ___"".   		3 letters","MER.    	""La Mer"" is a lovely group of three symphonic sketches for orchestra by the French composer Claude Debussy. Listen to it, and you can feel yourself at the ocean. ""La Mer"" is French for ""The Sea""."
Chef's thickening agent.   		4 letters,"AGAR.    	Agar (also 'agar-agar') is a jelly extracted from seaweed that has many uses. Agar is found in Japanese desserts, and can also be used as a food thickener or even as a laxative. In the world of science it is the most common medium used for growing bacteria in Petri dishes."
State in French.   		4 letters,"ETAT.    	In French, a state (état) is a political division."
World Series of Poker champion ___ Ungar.   		3 letters,"STU.    	Many followers of the game believe that Stu Ungar was the best ever player of Texas hold 'em. Ungar won about $30 million playing cards during his life, yet he died penniless. He was found dead in a Las Vegas motel room in 1998 having passed away from heart failure at 45 years of age, brought on by years of drug abuse."
Mao ___-tung.   		3 letters,"TSE.    	Mao Zedong (also 'Mao Tse-tung') was born on December 16, 1893 in the Hunan Province of China. As Mao was the son of a peasant farmer, his prospects for education were limited. Indeed he left school at age 13 to work on the family farm but did eventually get to secondary school in Changsha, the provincial capital. In the years following, Mao continued his education in Beijing and actually turned down an opportunity to study in France."
Its inaugural flight was from Geneva to Tel Aviv.   		5 letters,"EL AL.    	El Al Israel Airlines is the flag carrier of Israel. The term 'el al' translates from Hebrew as 'to the skies'. The company started operations in 1948, with a flight from Geneva to Tel Aviv."
"With 91-Across, 1976 album with a palindromic title.   		3 letters",OLE.    	(91. See 27-Across : ELO)
Food thickener.   		4 letters,"AGAR.    	Agar (also 'agar-agar') is a jelly extracted from seaweed that has many uses. Agar is found in Japanese desserts, and can also be used as a food thickener or even as a laxative. In the world of science it is the most common medium used for growing bacteria in Petri dishes."
Singer DiFranco.   		3 letters,"ANI.    	Ani DiFranco is a folk-rock singer and songwriter. DiFranco has also been labeled a ""feminist icon"", and in 2006 won the ""Woman of Courage Award"" from National Organization of Women."
"Sea, to Cousteau.   		3 letters","MER.    	Jacques-Yves Cousteau started off his career in the French Navy, heading towards a working life in aviation. Because of a car accident, he had to abandon his first career choice and instead went to sea. Famously, he invented the aqualung (Self Contained Underwater Breathing Apparatus - SCUBA), and is known as the father of SCUBA diving."
Mideast port.   		4 letters,"ADEN.    	Aden is a seaport in Yemen, located on the Gulf of Aden by the eastern approach to the Red Sea. Aden has a long history of British rule, from 1838 until a very messy withdrawal in 1967. Someone from the seaport of Aden is known as an Adeni."
Cyrillic letter between kha and che.   		3 letters,"TSE.    	The Cyrillic alphabet is a writing system that dates back to the First Bulgarian Empire in the 10th century AD. Cyrillic is the alphabet used in Slavic languages, including Russian. When Bulgaria was admitted to the European Union in 2007, Cyrillic became the third official alphabet of the EU, alongside the Latin and Greek alphabets."
Scandinavian coin.   		3 letters,"ORE.    	The Swedish Krona is divided into 100 öres, a term derived from the Latin 'aureus' meaning 'gold'."
End of a professor's address.   		3 letters,EDU.    	The .edu domain was one of the six original generic top-level domains specified. The complete original list is:
___ Straw Poll.   		4 letters,"AMES.    	The city of Ames, Iowa is famous for holding the Ames Straw Poll in advance of most presidential elections. The poll in question is used to gauge the level of support for two or more Republican candidates, although non-Republicans are allowed to cast a vote. To vote one has to be an Iowa resident and one must buy a ticket to the fundraising dinner at which the vote is taken. The event gets a lot of coverage, so it boosts the local economy as journalists hit the town. It is a very successful fundraiser for the Republican Party in Iowa as well, but the usefulness of the straw poll in predicting the eventual winner of the nomination is less clear. There have been six straw polls since 1979, and just 2 out of 6 times the poll winner went on to capture the party's nomination."
Traitor Aldrich.   		4 letters,"AMES.    	Aldrich Ames worked for the CIA until he was convicted in 1994 of spying for the Soviet Union. Prior to identifying Ames as a spy, the CIA was highly concerned at the high rate of disappearance of their own agents behind the Iron Curtain and they struggled for years to find the mole that they assumed must be working within their own ranks. After he was finally arrested, the CIA was criticized for not having identified Ames sooner, particularly as he was living an extravagant lifestyle relative to his apparent means. Ames is serving a life sentence in the US Penitentiary in Allentown, Pennsylvania."
Springfield resident Disco ___.   		3 letters,"STU.    	On television's ""The Simpsons"", the character of Disco Stu is voiced by Hank Azaria, although Stu was voiced for a while by Phil Hartman. Disco Stu is described as ""a black, wrinkly John Travolta""."
Flight board abbr..   		3 letters,ETD.    	Estimated time of departure (ETD)
