Chicken of the Sea product.   		4 letters,TUNA.    	The Chicken of the Sea brand of tuna is named for a phrase once used by fishermen for the 'meat' from white albacore tuna.
Due x tre.   		3 letters,"SEI.    	In Italian, 'due' (two) times 'tre' (three) is 'sei' (six)."
"With 34-Across, slag furnace input.   		4 letters",LEAD.    	34. See 46-Down : ORE
Orbital high point.   		6 letters,"APOGEE.    	In the celestial world, an apsis is a point in an orbit when the orbiting body is at its greatest, or least, distance from it's center of orbit. The farthest and closest points of orbit are known as the apogee and perigee, when talking about bodies orbiting the Earth. The farthest and closest points for bodies orbiting the sun are known as the aphelion and perihelion."
"Priory in ""The Da Vinci Code"".   		4 letters","SION.    	The Priory of Sion is presented in the preface of Dan Brown's ""The Da Vinci Code"", as a secret society that did in fact exist. However, there is a lot of evidence that the priory was an invention, created in forged documents in the sixties. Regardless, Dan Brown's book is a really enjoyable read."
Hanes competitor.   		3 letters,"BVD.    	The men's underwear known as BVDs are made by the Bradley, Voorhees & Day. The company was started in 1876 to make bustles for women, and is named for its founders."
Rembrandt van ___.   		3 letters,"RYN.    	The celebrated Dutch painter's full name was Rembrandt Harmenszoon van Rijn (sometimes Ryn). He is perhaps most appreciated for his portraits, and left the world a remarkable collection of self-portraits."
"Garamond, e.g.   		4 letters","FONT.    	The Garamond group of typefaces is named after Parisian publisher Claude Garamond. He was a leading designer of type in the 1500s, and is credited with the introduction of the apostrophe, accent and cedilla into the French language."
Norse war god.   		3 letters,"TYR.    	Týr is the Norse god of single combat, victory and heroic glory."
Rays' div.   		7 letters,"AL EAST.    	The Tampa Bay Rays is a relatively ""young"" franchise, being formed in 1998. The initial name of the franchise was the Tampa Bay Devil Rays. and while known as the Devil Rays the team finished last in the league in almost every year. The name was changed to the Tampa Bay Rays in 2008, and I am told the Rays started into a streak of winning seasons soon after."
"Drooping, as a rabbit's ears.   		4 letters","ALOP.    	I had to go to one of my two huge volumes of the OED to find the definition of ""alop"". It means ""lop-sided"". A lovely word, I think, but amazing that it seems to have avoided the Internet!"
Nonchalant.   		5 letters,"BLASE.    	'Blasé', meaning 'nonchalant, bored from overindulgence' comes from the French verb 'blaser', meaning ""to satiate""."
"""Sesame Street"" character with a unibrow.   		4 letters","BERT.    	I've always believed that the ""Sesame Street"" characters Bert and Ernie were named after two roles played in the Christmas classic ""It's a Wonderful Life"". In the movie, the policeman's name is Bert, and his taxi driving buddy is named Ernie. However, the ""Sesame Street"" folks have stated that the use of the same names is just a coincidence."
"Elvis's ""___ Lost You"".   		4 letters",I'VE.    	Elvis Presley recorded the song 'I've Lost You' in 1970.
Mine entrance.   		4 letters,"ADIT.    	An adit is specific type of mine access, a horizontal shaft that extends into the mine. This can be compared with the more traditional vertical shaft that is used for access into most mines. Adits make sense when the ore is located inside a mountain or hill, as opposed to ""underground"", allowing the mine entrance to be on the valley floor."
Norepinephrine producer.   		7 letters,"ADRENAL.    	Norepinephrine is a hormone produced in an adrenal gland, sometimes called simply 'an adrenal'."
France's ___ Antoinette.   		5 letters,"MARIE.    	Marie Antoinette was the wife of Louis XVI, the last king of France. She was the fifteenth of sixteen children born to the Empress Maria Theresa of Austria. The marriage to Louis, Marie Antoinette's second cousin once removed, was arranged while the two were very young. The prospective bride was ""handed over"" to the French at a border crossing in 1770, and two weeks later she was married to the future king. Marie Antoinette was just 14 years of age, and Louis only a year her senior."
Country music pioneer Ernest.   		4 letters,"TUBB.    	Ernest Tubb was nicknamed ""The Texas Troubadour"". His most successful was song was ""Walking the Floor Over You"", and he also recorded ""Blue Christmas"" some ten years or so before Elvis made his famous version. In the sixties he had a hit duet with new kid on the block, Loretta Lynn, called ""Sweet Thang""."
"Caustic soda, symbolically.   		4 letters","NAOH.    	Caustic soda is sometimes called lye. Chemically it is sodium hydroxide (NaOH). It's nasty stuff, a white solid in its pure form. When you add it to water it generates an awful lot of heat, a property that is taken advantage of in using lye as a drain cleaner."
Kind of pass.   		6 letters,"EURAIL.    	In my days as a student, the way to backpack around Europe was using a Europass. Nowadays that is known as a Eurail pass. The Eurail pass gives you access to most trains (and some shipping lines) right across the continent."
"Kitt who sang ""Santa Baby"".   		6 letters","EARTHA.    	Eartha Kitt sure did have a unique voice and singing style. Her rendition of ""Santa Baby"" has to be one of the most distinctive and memorable recordings in the popular repertoire. Some of you will no doubt remember her playing Cat Woman on the final series of the TV show ""Batman""."
___ Observatory.   		5 letters,"NAVAL.    	The official residence of the VP of the United States is at Number One Observatory Circle, in the grounds of the Naval Observatory. The house was built in 1893 for the use of the superintendent of the observatory. In 1974 it was taken over by Act of Congress for use as the VP's official residence. The move was partly a matter of economics as the cost of providing security for the Vice President at his own residence was becoming prohibitive. Reportedly, there was an underground bunker build below the house after the 9/11 attacks."
"Oberon of ""Wuthering Heights"".   		5 letters","MERLE.    	Merle Oberon was a wonderful British actress. At the height of her Hollywood career she was involved in a traffic accident that left her with permanent facial scars. The marks were so disfiguring that it was believed that Oberon would never appear on screen again. But she persevered and, with the help of some creative lighting on set, two years after the accident she filmed her most memorable role, playing Cathy in 1939's ""Wuthering Heights""."
"""___ Gold"".   		6 letters","ULEE'S.    	""Ulee's Gold"" is a highly respected film from 1997, in which Peter Fonda plays the title role of Ulee. Ulee's ""gold"" is the honey that Ulee produced. It is a favorite role for Peter Fonda, and he has shared that the role brought into mind his father, Henry Fonda, who himself kept a couple of hives. So if you see Peter Fonda in ""Ulee's Gold"", you're witnessing some characteristics that Peter saw in his father."
Ralph ___ Emerson.   		5 letters,WALDO.    	Ralph Waldo Emerson was an essayist and poet who was active in the mid-1800s. Most of the essays that Emerson wrote were composed originally as lectures and then revised for print.
Hip '60s types.   		4 letters,"MODS.    	Mod is short for modernist, and describes a subculture that originated in London in the late fifties. Young men who called themselves mods tended to wear tailored suits, listen to pop music and drive around on Italian motor scooters. Mods came into conflict with another subculture that emerged at the same time in the UK, the rockers. Rockers were into rock and roll music, and drove motor cycles. I remember as a young kid in school having to declare myself as either a mod or a rocker. I don't think our ""gangs"" back then were quite the same as they are today though ..."
"""The Creation"" composer.   		5 letters","HAYDN.    	'The Creation' is an oratorio by the great composer Joseph Haydn, written between 1796 and 1798. Many consider it to be his magnum opus. Haydn was a deeply religious man (he wrote the words 'Praise to God' at the end of every composition) and spent more time working on 'The Creation' than any other single work. He was inspired to write ""The Creation"" after spending time in England and hearing the oratorios of Handel."
Dweller along the Mandeb Strait.   		6 letters,"YEMENI.    	The Bab-el-Mandeb is a strait lying between Yemen in the Middle East and Eritrea and and Djibouti in the Horn of Africa. Also known as Mandeb Strait, 'Bab-el-Mandeb' translates as 'Gate of Tears'. The somewhat terrifying name is a reference to the dangers of navigating the narrow strait."
Actor Mike.   		5 letters,"MYERS.    	Mike Myers does do a great British accent, witness his performance in the madcap ""Austin Powers"" movies. He has an advantage though, as both his parents are British, living in Canada."
Fictional woodcutter's daughter.   		6 letters,"GRETEL.    	Hansel and Gretel is a Germanic fairy tale found in the collection of the Brothers Grimm. It tells of Hansel and Gretel, the children of a woodcutter, who are abandoned in a forest at the behest of an evil stepmother. Clever Hansel hears of the plan, and leaves a trail of pebbles so that he and his sister find their way home. But the children are abandoned again, and this time leave a trail of breadcrumbs. Unfortunately, the crumbs are eaten by birds, so the children do indeed become lost. But, eventually things work out and they all live happily ever after ..."
One of the Alis.   		5 letters,"LAILA.    	Laila Ali is the daughter of the great Muhammad Ali, and is a very capable boxer in her own right. She's not a bad dancer either, coming in third place in the fourth season of ""Dancing with the Stars""."
Dance accompanied by castanets.   		6 letters,"BOLERO.    	The name ""bolero"" is used to describe slow-tempo Latin music, and can be both a dance and a song."
Draw of some bars.   		7 letters,"KARAOKE.    	Kara-te, means ""open hand"", and Kara-oke, means ""open orchestra""."
"Awesome, in slang.   		3 letters","ILL.    	""Ill"" is hip-hop slang, meaning sublime, singularly creative. Not how I use the word ""ill"" ..."
Cottonwoods.   		6 letters,ALAMOS.    	'Alamo' is Spanish for 'cottonwood'.
Article for Lil Wayne.   		3 letters,THA.    	I guess 'tha' is slang for 'the' in the world of rap ...
"Relationship in the 2009 film ""I Love You, Man"".   		8 letters","BROMANCE.    	A ""bromance"" is the name given these days to a close relationship between two straight males."
Capital of Iceland?.   		6 letters,"LONG I.    	The first letter of the word ""Iceland"" is a long I."
Gung-ho.   		4 letters,"AVID.    	""Kung ho"" is a Chinese expression meaning ""work together, cooperate"". The anglicized version ""gung ho"" was adopted by a Major Evans Carlson as an expression of combined spirit for his 2nd Marine Raider Battalion during WWII. From there the term spread throughout the Marine Corps and back to America where it persists to this day."
Capital city formerly behind the Iron Curtain.   		6 letters,"TIRANE.    	Tirane is the capital city of Albania and has been so since 1920. The city was seized by the Nazis in WWII but was liberated in 1944, at which point the Communists seized power. The Communists were ousted in the elections of 1992 leaving a void that led to much bloodshedd and an eventual EU military mission, led by Italy, to stabilize the capital and the rest of the country. Today things have become so calm that Albania is a member of NATO."
___ acid.   		5 letters,"OLEIC.    	Oleic Acid is a fatty acid, found in many animal and plants sources but most notably in olives. 'Oleic' means 'derived from the olive'."
"""Howards End"" role.   		4 letters","EVIE.    	""Howards End"" was written by E. M. Forster. Emma Thompson won an Oscar for her part in the excellent 1992 film adaptation."
Marsh sights.   		6 letters,EGRETS.    	At one time the egret species was in danger of extinction due to hunting driven by the demand for plumes for hats.
Game in which all pieces have four components.   		6 letters,"TETRIS.    	Tetris is a very addictive video game, developed in the Soviet Union in 1984. The name Tetris comes from a melding of the prefix 'tetra-', as all the game pieces have four segments, and 'tennis', a favorite sport played by the developer. Since 2005 there have been more than 100 million copies of the game installed on cell phones alone."
"Chaim Potok's ""My Name Is Asher ___"".   		3 letters","LEV.    	""My Name Is Asher Lev"" is a novel by Rabbi Chaim Potok, first published in 1972. The story follows the experiences of Asher Lev, a Hasidic Jewish boy in New York City. His story continues in the sequel ""The Gift of Asher Lev""."
Drizzling clouds.   		6 letters,"STRATI.    	Stratus clouds (plural 'strati') are very common, and as they are wider than they are tall and flat along the bottom, we might just see them as haze in a featureless sky above us. Stratus clouds are basically the same as fog, but above the ground. Indeed, many stratus clouds are formed when morning fog lifts into the air as the ground heats up."
"""Tell ___ Mama"" (2009 Norah Jones song).   		3 letters","YER.    	The beguiling Norah Jones is one of my favorite singers. She is the daughter of sitar virtuoso Ravi Shankar. If you haven't heard her ""Come Away with Me"", you haven't lived ..."
One cubic meter.   		5 letters,"STERE.    	'Stere' is a metric measure, although it is not part of the modern metric system. Nowadays the stere is used as a measure for firewood, and is equal to one cubic meter."
Caucus call.   		3 letters,AYE.    	A 'caucus' is a meeting of supporters of a particular political group. It is believed that the term was first used in the original North American colonies.
Kind of index.   		4 letters,"HEAT.    	The heat index combines air temperature and relative humidity, an attempt to measure the relative temperature that is actually perceived by a person. The idea is that temperatures are perceived by us as being higher if accompanied by high humidity. This is because when humidity is high the body finds it more difficult to cool itself by perspiring."
Jockey's whip.   		4 letters,"CROP.    	A crop is a type of whip, one without a long lash."
Fish related to the stingray.   		5 letters,SKATE.    	Skates (formally 'Rajidae') are a family of fish in the superorder of rays (formally 'batoidea'). Skates look very similar to stingrays but they lack stinging spines.
Attack from above.   		6 letters,"STRAFE.    	We've been using 'strafe' to mean an attack on a ground position from low-flying aircraft since WWII. Prior to that, the word was used by British soldiers to mean any form of attack. It was picked up from the German word for 'punish' as it was used in 'Gott strafe England' meaning, 'May God punish England'."
Inner ear?.   		3 letters,COB.    	A cob is part of an ear of corn.
It's frequently punched on a keypad.   		3 letters,PIN.    	Personal Identification Number.
Charge.   		7 letters,"ARRAIGN.    	In the law, to arraign someone is to call a person before a court to answer charges that have been brought."
King surnamed Tryggvason.   		6 letters,"OLAF I.    	It is believed that the Norwegian King Olaf I led the conversion of the Vikings to Christianity and built the first church in the country (in 995 CE). Olaf was actually married to an Irishwoman, albeit a woman from a Viking family. Queen Gyda was the sister of the King of Dublin, Olaf Cuaran."
Thwarter of HAL.   		4 letters,"DAVE.    	In the movie '2001: A Space Odyssey', Dr. David Bowman ('Dave') goes up against the spacecraft computer known as 'HAL'."
"Dance to Donna Summer's ""Last Dance,"" e.g.   		5 letters","DISCO.    	Donna Summer is known as ""The Queen of Disco"", with great hits like ""Love to Love You, Baby"", ""I Feel Love"" and ""Hot Stuff"". In the late sixties and early seventies, LaDonna Gaines (her real name) lived and worked in Germany. There she met and married an Austrian actor called Helmuth Sommer. They divorced not long after the marriage, but Donna kept his family name, just changing the ""o"" to ""u"" to give her the stage name of ""Donna Summer""."
Vietnam's ___ Dinh Diem.   		3 letters,"NGO.    	When France withdrew from French Indochina in the mid-fifties, Ngo Dinh Diem led the movement to create the Republic of Vietnam. In what was regarded as a fraudulent referendum, the new country of Vietnam was formed and in 1955 Diem declared himself its first president. His rule was far from peaceful, and he was assassinated by rivals in 1963."
"The Beatles' ""___ Got a Feeling"".   		4 letters","I'VE.    	""I've Got a Feeling"" is a song from the Beatles 1970 album ""Let It Be"", and was one of the songs that they played in their famous impromptu rooftop concert, the last time they ever played together in public."
"Partner of 40-Down, traffic-wise.   		3 letters","HIT.    	(40. Partner of 53-Across, traffic-wise : RUN)"
Sci-fi phaser setting.   		4 letters,"STUN.    	A MASER is a device that was around long before LASERs came into the public consciousness. A MASER (Microwave Amplification by Stimulated Emission of Radiation) is similar to a LASER, but microwaves are emitted rather than light waves. When the storyline for ""Star Trek"" was being developed, the writers introduced a weapon called a ""phaser"", with the name ""phaser"" derived from PHoton mASER."
Supreme Court justice nominated by Reagan.   		6 letters,"SCALIA.    	Antonin Scalia was appointed to the Supreme Court by President Reagan in 1986, and as such is now the longest serving member of the court."
Trigonometric ratio.   		6 letters,"SECANT.    	The secant (sec, for short) is the ratio of the hypotenuse of a triangle to its adjacent side, and is the reciprocal of the cosine, as we all remember from school ..."
Notorious investor.   		6 letters,"RAIDER.    	The business strategy known as ""corporate raiding"" really is pretty ruthless and short sighted (excuse my being judgmental). The idea is to buy a large interest in a corporation, sometimes ""stealthily"", by buying up a significant number of voting shares. Then the raider uses the power of the voting rights to convince other voters to change the way the company is run, purely to increase the share price in the relatively short term. The changes often involve replacement of the management team, downsizing and even liquidation of the company, all for short term personal gain."
Raiser of horses?.   		5 letters,"TURBO.    	A turbocharger is a device that is designed to extract more power out of an internal combustion engine. It does so by increasing the pressure of the air entering the intake. The pressure increase comes from the use of a compressor, which is cleverly powered by the engine's own exhaust gases."
"Him, to Henri.   		3 letters","LUI.    	In French, 'lui' is the word for ""him"" and 'elle' is the word for ""her""."
1986 Indy 500 winner.   		5 letters,"RAHAL.    	Bobby Rahal is an auto racing driver and team owner. He won the 1986 Indianapolis 500 as a driver, and won the 2004 Indianapolis 500 as a team owner (the driver was Buddy Rice)."
"""The Charge of the Light Brigade"" war zone.   		6 letters","CRIMEA.    	Considering that the Crimea was the site of the Charge of the Light Brigade as well as the Yalta conference towards the end of World War II, I am ashamed to say that until recently I could not pinpoint the Crimea on a map. I'm even more ashamed to say that I didn't realize it is an extremely distinctively shaped peninsula, lying south of the Ukraine and jutting out into the Black Sea. Well, now I know ..."
"""___ Gold"".   		6 letters","ULEE'S.    	""Ulee's Gold"" is a highly respected film from 1997 in which Peter Fonda plays the title role of Ulee. Ulee's ""gold"" is the honey that Ulee produces. It is a favorite role for Peter Fonda and he has shared that playing Ulee brought into mind his father, Henry Fonda, who himself kept a couple of hives. So if you see Peter Fonda in ""Ulee's Gold"" you're witnessing some characteristics that Peter saw in his father."
Vaccine pioneer.   		5 letters,"SABIN.    	Albert Sabin developed the oral polio vaccine. Sabin's vaccine was a ""live"", controlled vaccine. The equally famous Salk vaccine was a ""killed"" vaccine."
Red ___.   		3 letters,"SOX.    	The Boston Red Sox is one of the most successful Major League Baseball teams and so commands a large attendance, but only when on the road. The relatively small capacity of Boston's Fenway Park, the team's home since 1912, has dictated that every game the Red Sox has played there has been a sell out since May of 2003."
Historic town on the Vire.   		5 letters,"ST-LO.    	Saint-Lo is a town in Normandy that was occupied by Germany in 1940. Saint-Lo stood at a strategic crossroads, and so there was intense fighting there during the Normandy invasion of 1944. After the bombardment, very little of the town was left standing."
Major Calif.-to-Fla.   		5 letters,"I-TEN.    	I-10 is the most southerly of the interstate routes that crosses from the Atlantic to the Pacific. I-10 stretches from Santa Monica, California to Jacksonville, Florida."
"Simon & Garfunkel's ""El Condor ___"".   		4 letters","PASA.    	'El Cóndor Pasa' is a song from Peru, the best-known Peruvian song in the world, almost certainly. It was written in 1913, and famously covered by Simon & Garfunkel on their 'Bridge Over Troubled Water' album in 1970. 'El Cóndor Pasa' translates from Spanish as 'The Condor Flies By'."
"Peter of ""Casablanca"".   		5 letters","LORRE.    	The marvelous actor Peter Lorre was born in what is now modern-day Slovakia. His real name was Laszlo Lowenstein. He started acting in Vienna, when he was quite young, only 17 years old. When Hitler came to power, the Jewish Lowenstein headed to Paris, then London, eventually ending up in Hollywood. He found himself typecast as the wicked foreigner in American movies, but I think he sneered and snarled his way to the bank."
Calif.   		7 letters,"EAST LA.    	'Stand and Deliver' is a 1988 drama film based on the true story of Jaime Escalante, a high school teacher in East LA."
"""Don Giovanni"" aria ""Dalla ___ pace"".   		3 letters","SUA.    	""Dalla sua pace"" translates to ""On her peace"", and is sung by don Ottavio, the tenor lead in Mozart's ""Don Giovanni""."
"""The Mod Squad"" role.   		4 letters","LINC.    	The 1999 movie ""The Mod Squad"" was an adaptation of the television show of the same name. The part of Lincoln Hayes was played by Omar Epps."
"Wooley with the 1958 #1 hit ""The Purple People Eater"".   		4 letters","SHEB.    	As well as having his huge hit in 1958 ""The Purple People Eater"", Sheb Wooley played Ben Miller in the movie ""High Noon"" and co-starred in the TV show ""Rawhide"", playing the role of Pete Nolan. Wooley also wrote the theme song for long-running show ""Hee Haw""."
Missile that might be tipped with curare.   		4 letters,DART.    	Curare is the name given to the toxin(s) used historically by South American peoples to paralyze their prey. The tips of arrows and blowgun darts are dipped in curare so that when a hunted animal is pierced with a poisoned projectile it asphyxiates as the curare paralyzes the respiratory muscles.
Sam Adams alternative.   		4 letters,BASS.    	The red triangle on the label of a bottle of Bass Ale was registered in 1875 and is UK Registered Trade Mark No: 00001.
Pentateuch peak.   		8 letters,"MT SINAI.    	According to the Bible, Mount Sinai is the mountain on which Moses was given the Ten Commandments. The Biblical Mount Sinai is probably not the mountain in Egypt that today has the same name, although this is the subject of much debate. The Egyptian Mount Sinai has two developed routes that one can take to reach the summit. The longer gentler climb takes about 2 1/2 hours, but there is also the steeper climb up the 3,750 ""steps of penitence""."
Skewed to one side.   		4 letters,"ALOP.    	I had to go to one of my two huge volumes of the OED to find the definition of ""alop"". It means ""lop-sided"". A lovely word, I think, but it's amazing that it seems to have avoided the Internet!"
Old U.S.P.S.   		4 letters,"RFDS.    	Rural Free Delivery (RFD) was started in the US in 1891. Prior to RFD, rural Americans had to travel to the nearest post office to pick up their mail."
"""Tropic Thunder"" director and co-star.   		7 letters",STILLER.    	Ben Stiller is the son of actors Jerry Stiller and Anne Meara. Ben is perhaps as well-known as a director as he is an actor. He made his debut as a director in the film 'Reality Bites' in 1994.
Painter who had a point to make?.   		6 letters,"SEURAT.    	Georges Seurat was a French Post-Impressionist. His most famous work in the pointillist style can be viewed in the Art Institute of Chicago, ""A Sunday Afternoon on the Island of La Grande Jatte - 1884"". If you've seen the movie ""Ferris Bueller's Day Off"", it features quite prominently in a wonderful, wonderful scene shot at the gallery."
Sound of silence?.   		6 letters,LONG I.    	The 'i' in the word 'silence' is a 'long i'.
"Julie of ""The Early Show"".   		4 letters","CHEN.    	As well as co-anchoring ""The Early Show"", Julie Chen has been host of the American version of ""Big Brother"" since it graced our screens in 2000."
