"Body image, briefly.   		3 letters","TAT.    	The word ""tattoo"" was first used in English in the writings of the famous English explorer Captain Cook. In his descriptions of the indelible marks adorning the skin of Polynesian natives, Cook anglicized the Tahitian word ""tatau"" into our ""tattoo""."
Some hotel lobbies.   		5 letters,ATRIA.    	In modern architecture an atrium (plural 'atria' or 'atriums') is a large open space usually in the center of a building and extending upwards to the roof. The original atrium was an open court in the center of an Ancient Roman house. One could access most of the enclosed rooms of the house from the atrium.
When the French toast?.   		4 letters,ETES.    	In France the weather is toasty warm in the summer ('été').
Carol.   		4 letters,"NOEL.    	'Noël' is the French word for the Christmas season, ultimately coming from the Latin word for ""birth"" (natalis). Noel has come to be used as an alternative name for a Christmas carol."
Carrier that had a pioneering transpolar route.   		3 letters,"SAS.    	SAS, formerly known as Scandinavian Airlines System, is the flag carrier of three countries: Denmark, Norway and Sweden."
Half a bikini.   		3 letters,"BRA.    	The origin of the name ""bikini"", a type of bathing suit, seems very uncertain. My favorite story is that it is named after the Bikini Atoll, site of American A-bomb tests in the forties and fifties. The name ""bikini"" was chosen for the swim-wear because of the ""explosive"" effect it had on men who saw a woman wearing the garment!"
Where you may be on a French map.   		3 letters,"ICI.    	""Ici"" is the French word for ""here""."
August hrs.   		3 letters,"DST.    	On the other side of the Atlantic, Daylight Saving Time (DST) is known as ""summer time"". The idea behind summer/daylight-savings is to move clocks forward an hour in spring and backwards in the fall, so that afternoons have more daylight."
Badlands sight.   		4 letters,"MESA.    	""Mesa"" is the Spanish for ""table"" and is of course is how we get the term ""mesa"" that describes a geographic feature. ""What's the difference between a butte and a mesa?"" I hear you cry! Both are hills with flat tops, but a mesa has a top that is wider than it is tall. A butte is a much narrower formation, taller than it is wide. Now we know ..."
"Portrayer of Buffett in ""Too Big to Fail"".   		5 letters","ASNER.    	Ed Asner is most famous for playing the irascible but lovable Lou Grant on ""The Mary Tyler Moore Show"" and on the spin-off drama ""Lou Grant"". Off-screen Asner is noted for his political activism. He served two terms as president of the Screen Actors Guild, and was very involved in the 1980 SAG strike. When ""Lou Grant"" was cancelled in in 1982, despite decent ratings, there was a lot of talk that the cancellation was a move by the network against Asner personally. In fact, one of Asner's activist colleagues, Howard Hesseman (who played Johnny Fever) found that his show ""WKRP in Cincinnati"" was also cancelled ... on the very same day."
N.C.A.A.'s Conference ___.   		3 letters,USA.    	Conference USA is a Southern US college athletic conference that was founded in 1995.
Contra-contraband org.   		3 letters,DEA.    	Drug Enforcement Administration (DEA)
"Luau instrument, informally.   		3 letters",UKE.    	The ukulele originated in the 1800s and mimicked a small guitar brought to the Hawaiian Islands by Portuguese immigrants.
"Conjugation part between ""sommes"" and ""sont"".   		4 letters","ETES.    	In French, we are (nous somes), you are (vous êtes), they are (ils/elles sont)."
Vientiane native.   		3 letters,"LAO.    	Vientiane is the capital city of Laos, situated on the famous Mekong River. The city was originally called the ""city of sandalwood"" by Buddhist monks, naming after the valued trees that grew in the area. The French took the Pali words for ""city of sandalwood"" and rewrote it as the French-sounding ""Vientiane""."
Raison d'___.   		4 letters,"ETRE.    	""Raison d'être"" is a French phrase meaning ""reason for existence""."
Twit.   		3 letters,"ASS.    	""Twit"" is a word not used very often here in America. It's a slang term that was quite common in England where it was used for ""someone foolish and idiotic""."
Nautilus captain.   		4 letters,"NEMO.    	In the 1954 movie version of ""20,000 Leagues Under the Sea"", Captain Nemo goes down with his ship. In the novel by Jules Verne, the fate of Nemo and his crew isn't quite so cut and dry, although the assumption is perhaps that they did indeed head for Davy Jones's Locker."
Skater Midori.   		3 letters,"ITO.    	Midori Ito is a Japanese figure skater. She was the first woman to land a triple/triple jump and a triple axel in competition. In fact, she landed her first triple jump in training, when she was only 8 years old ..."
KLM alternative.   		3 letters,"SAS.    	SAS, formerly known as Scandinavian Airlines System, is the flag carrier of three countries: Denmark, Norway and Sweden."
Red three-year-old of TV.   		4 letters,"ELMO.    	The man behind/under the character Elmo on 'Sesame Street' is Kevin Clash. If you want to learn more about Elmo and Clash, you can watch the 2011 documentary 'Being Elmo: A Puppeteer's Journey'."
Height.   		4 letters,"ACME.    	The ""acme"" is the highest point, coming from the Greek word ""akme"" which has the same meaning."
Aurora's Greek counterpart.   		3 letters,"EOS.    	In Greek mythology, Eos is the goddess of the dawn who lived at the edge of the ocean. Eos would wake each morning to welcome her brother Helios the sun. The Roman equivalent of Eos is Aurora."
Locale of a Horatio Nelson victory.   		4 letters,NILE.    	Lord Nelson was known as the Hero of the Nile after his decisive victory over the French at the Battle of the Nile in 1798.
"Not present when expected, for short.   		3 letters",MIA.    	Missing in action (MIA).
See 17-Across.   		3 letters,PDA.    	PDA is an acronym used for 'public display of affection'.
Rank above viscount.   		4 letters,"EARL.    	In the ranking of nobles, an earl comes above a viscount and below a marquess. The rank of earl is used in the British peerage system and is equivalent to the rank of count in other countries. Other British ranks have female forms (e.g. marquess and marchioness, viscount and viscountess), but there isn't a female word for the rank of earl. A female given the same rank as an earl is known simply as a countess."
"___ Prize, annual international award for mathematics.   		4 letters","ABEL.    	The Abel Prize is awarded for outstanding achievement in the field of mathematics. It has been presented annually by the King of Norway since 2001, and is sometimes described as 'the mathematician's Nobel Prize'."
Mobile info organizer.   		3 letters,"PDA.    	A device like perhaps an iPhone, Droid, or Treo, can be termed a Personal Digital Assistant (PDA)."
"""Doctor Zhivago"" role.   		4 letters",LARA.    	Olga Ivinskaya was the mistress of the writer Boris Pasternak. Ivinskaya was the inspiration for the famous Lara character in Pasternak's novel 'Doctor Zhivago'.
"""Jane ___"".   		4 letters","EYRE.    	""Jane Eyre"" is of course the novel written by Charlotte Bronte under the pen name Currer Bell. I've been sharing here on the blog that the storyline is a little too dark and Gothic for my taste, but a very persuasive blog reader convinced me to look more at the romantic side of the story and give it a second chance. I watched a wonderful 4-hour television adaptation of the novel made by the BBC very recently, and I have to say that because I was focused on the relationship between Jane and Rochester, I was able to push past the Gothic influences (that depress me) so I really enjoyed the performance. I thoroughly recommend this latest BBC adaptation to fans of the novel."
Jazz quintet's home.   		4 letters,"UTAH.    	The Utah Jazz professional basketball team moved to their current home in Salt Lake City in 1979. As one might guess from the name, the team originated in New Orleans, but only played there for five seasons. New Orleans was a tough place to be based because venues were hard to come by, and Mardi Gras forced the team to play on the road for a whole month."
"Lover of Orion, in Greek myth.   		3 letters","EOS.    	In Greek mythology, Eos is the goddess of the dawn who lived at the edge of the ocean. Eos would wake each morning to welcome her brother Helios the sun. The Roman equivalent of Eos is Aurora."
HI-strung instrument?.   		3 letters,UKE.    	The ukulele originated in the 1800s and mimicked a small guitar brought to the Hawaiian Islands by Portuguese immigrants.
"Actor whose last name is a 41-Down of his first name, after a D is changed to an N.   		4 letters","ALDA.    	Alan Alda has had a great television career, especially of course on 'M*A*S*H'. Alda won his first Emmy in 1972, for playing Hawkeye Pierce on 'M*A*S*H'. He won his most recent Emmy in 2006 for his portrayal of Presidential candidate Arnold Vinick in 'The West Wing'. When it comes to the big screen, my favorite of Alda's movies is the 1978 romantic comedy 'Same Time, Next Year' in which he starred opposite Ellen Burstyn."
"Calendar keeper, for short.   		3 letters",PDA.    	Personal digital assistant (PDA)
"Figurehead, for short?.   		3 letters",CPA.    	Certified Public Accountant (CPA)
Bikini part.   		3 letters,"BRA.    	The origin of the name ""bikini"", a type of bathing suit, seems very uncertain. My favorite story is that it is named after the Bikini Atoll, site of American A-bomb tests in the forties and fifties. The name ""bikini"" was chosen for the swim-wear because of the ""explosive"" effect it had on men who saw a woman wearing the garment!"
Mekong native.   		3 letters,"LAO.    	The official name for the country of Laos is the Lao People's Democratic Republic. In the Lao language, the country's name is ""Meuang Lao"". The French ruled Laos as part of French Indochina, having united three separate Lao kingdoms. As there was a plural of ""Lao"" entities united into one, the French added the ""S"" and so today we tend to use ""Laos"" instead of ""Lao""."
Subject of Kaplan or Princeton Review prep.   		4 letters,LSAT.    	The Law School Admission Test (LSAT) has been around since 1948.
Mystery writer Deighton.   		3 letters,"LEN.    	I used to walk my dog right past author Len Deighton's house years ago, as we used to live in the same village in Ireland (probably my only claim to fame!). Deighton wrote the excellent espionage thriller ""The IPCRESS File"", made into a 1965 movie starring Michael Caine."
Well-financed grp.?.   		4 letters,OPEC.    	OPEC is 'financed' by 'oil wells'.
Grp.   		4 letters,"OPEC.    	The OPEC cartel (the Organization of the Petroleum Exporting Countries) was formally established in 1960, and has been headquartered in Vienna since 1965."
"Tuna type, on menus.   		3 letters","AHI.    	Yellowfin tuna is usually marketed as ""ahi"", its Hawaiian name. Yellowfin tuna is one big fish, often weighing over 300 pounds."
"First responder, for short.   		3 letters",EMT.    	Emergency medical technician (EMT)
To be in Paris?.   		4 letters,ETRE.    	The French for 'to be' is 'être'.
About.   		5 letters,"IN RE.    	The term ""in re"" is Latin, derived from ""in"" (in) and ""res"" (thing, matter). It literally means ""in the matter"", and is used as ""in regard to"", or ""in the matter of""."
Friend of Frodo.   		3 letters,SAM.    	Samwise Gamgee is the sidekick to Frodo Baggins in Tolkien's 'The Lord of the Rings'.
Mixed bag.   		4 letters,"OLIO.    	Olio is a term meaning a hodgepodge or a mixture, coming from the mixed stew of the same name. The stew in turn takes its name from the Spanish ""olla"", the clay pot used for cooking."
Word in the titles of six songs by the Beatles.   		3 letters,"SHE.    	Six Beatles song titles feature the word 'she', and they are:"
"So-called ""mansiere,"" essentially, in a ""Seinfeld"" episode.   		3 letters","BRA.    	Male bras do exist, although they typically are used to 'flatten' any breast tissue that has developed rather than 'lift'. Some male runners opt to wear male bras in order to avoid nipple chafing."
One going to court?.   		4 letters,"EARL.    	In the ranking of nobles, an earl comes above a viscount and below a marquess. The rank of earl is used in the British peerage system and is equivalent to the rank of count in other countries. Other British ranks have female forms (e.g. marquess and marchioness, viscount and viscountess), but there isn't a female word for the rank of earl. A female given the same rank as an earl is known simply as a countess."
About.   		5 letters,"IN RE.    	The term ""in re"" is Latin, derived from ""in"" (in) and ""res"" (thing, matter). ""In re"" literally means ""in the matter"", and is used to mean ""in regard to"", or ""in the matter of""."
Quod ___ demonstrandum.   		4 letters,"ERAT.    	QED is used at the end of a mathematical proof or a philosophical argument. The QED acronym stands for the Latin ""quod erat demonstrandum"" meaning ""that which was to be demonstrated""."
Relative of Manx.   		4 letters,"ERSE.    	There are actually three Erse languages. Irish, Manx (spoken on the Isle of Man) and Scots Gaelic. In their own tongues, these would be Gaeilge (in Ireland), Gaelg (on the Isle of Man) and Gaidhlig (in Scotland)."
Loan letters.   		3 letters,APR.    	Annual percentage rate (APR)
Carrier in the Star Alliance.   		3 letters,"SAS.    	SAS was formerly known as Scandinavian Airlines System and is the flag carrier of three countries: Denmark, Norway and Sweden."
Many a Wall St.   		3 letters,"MBA.    	The world's first MBA degree was offered by Harvard's Graduate School of Business Administration, in 1908."
Christmas song.   		4 letters,"NOEL.    	'Noël' is the French word for the Christmas season, ultimately coming from the Latin word for ""birth"", ""natalis"". Noel has come to be used as an alternative name for a Christmas carol."
Carrier to Oslo.   		3 letters,"SAS.    	SAS was formerly known as Scandinavian Airlines System and is the flag carrier of three countries: Denmark, Norway and Sweden."
___ Maria.   		3 letters,"TIA.    	Tia Maria is a coffee liqueur that was invented just after WWII in Jamaica, using Jamaica coffee beans. The name of course translates to ""Aunt Maria""."
Big part of an elephant.   		3 letters,"EAR.    	There are only three species of elephant living today, with all others being extinct. These are the African bush elephant, the African forest elephant, and the Asian elephant (or ""Indian elephant""). As is well known, the African elephant is distinguished from the Asian/Indian elephant by its much larger ears."
"""Help wanted"" inits.   		3 letters",EEO.    	Equal Employment Opportunity (EEO) is a term that has been around since 1964 when the Equal Employment Commission was set up by the Civil Rights Act.
Nieuwpoort's river.   		4 letters,"YSER.    	The Yser originates in northern France and flows through Belgium into the North Sea. The Yser is often associated with WWI as it figured in a major battle early in the conflict. In the first three months of the war, the German Army pushed almost completely through Belgium, inflicting heavy losses on the Belgian Army as the defenders were forced to fight a fast-moving rearguard action. The Germans were intent on pushing right through Belgium and across France in a ""race to the sea"". But the Belgians, with the help of their Allies, decided to make a final stand at the Yser Canal in an effort to prevent the Germans reaching the French ports of Calais and Dunkirk. The 22-mile long defensive line was chosen at the Yser because the river and canal system could be flooded to create a barrier that might be defended. The plan was successful and the front was ""stabilized"". As we now know, millions of lives were lost over the coming years with very little movement of that battle line."
Advancement aid.   		3 letters,"TAB.    	Like most features on our computer keyboards, the tab key is a hangover from the days of typewriters. When using a typewriter, making entries into a table was very tedious, involving lots of tapping on the space bar and backspace key. So, a lever was added to typewriters that allowed the operator to ""jump"" across the page to positions that could be set by hand. Later this was simplified to a tab key which could be depressed, causing the carriage to jump to the next tab stop in much the same way that the modern tab key works on a computer."
Indent key.   		3 letters,"TAB.    	Like most features on our computer keyboards, the tab key is a hangover from the days of typewriters. When using a typewriter, typing entries into a table was very tedious, involving lots of tapping on the space bar and backspace key. So, a lever was added to typewriters that allowed the operator to ""jump"" across the page to positions that could be set by hand. Later this was simplified to a tab key, which could be depressed, causing the carriage to jump to the next tab stop, in much the same way that the modern tab key works on a computer."
Culmination.   		4 letters,"ACME.    	The ""acme"" is the highest point, coming from the Greek word ""akme"" which has the same meaning."
Hawaiian yellowfin tuna.   		3 letters,"AHI.    	Yellowfin and bigeye tuna are usually marketed as ""ahi"", the Hawaiian name. They are both big fish, with yellowfish tuna often weighing over 300 pounds, and bigeye tuna getting up to 400 pounds."
"1040 preparer, for short.   		3 letters",CPA.    	Certified public accountant (CPA)
"""Sister, Sister"" sister.   		3 letters","TIA.    	Sister, Sister' is a sitcom that originally aired from 11994 to 1999 starring identical twin sisters Tia and Tamera Mowry. Tia and Tamera play two sisters who were separated at birth, one being adopted by a single mother, and the other by a single father. The sisters happen up each other 14 years later, and hilarity ensues (I am told ...)."
2013 Spike Jonze love story.   		3 letters,"HER.    	Spike Jonze is a movie director whose first feature film was 'Being John Malkovich' (1999). Jonze also directed a couple of films for which he wrote the screenplays, namely 'Where the Wild things Are' (2009) and 'Her' (2013). Jonze also co-created the MTV show 'Jackass'. I can't stand that show, said he grumpily ..."
"Literary character who says ""I'll chase him round Good Hope"".   		4 letters","AHAB.    	Captain Ahab is the obsessed and far from friendly Captain of the Pequod in Herman Melville's ""Moby Dick""."
Major suit.   		3 letters,CEO.    	Chief executive officer (CEO)
Ski lift.   		5 letters,"T-BAR.    	A T-bar is a type of ski lift in which the skiers are pulled up the hill in pairs, with each pair sitting on either side of T-shaped, metal bar."
___ Croft (Angelina Jolie role).   		4 letters,"LARA.    	Lara Croft was first introduced to the world as the main character in a pretty cool video game (I thought) called ""Tomb Raider"", back in 1996. Lara Croft moved to the big screen in 2001 and 2003, in two pretty awful movie adaptations of the game's storyline. Angelina Jolie played Croft, and she did a very energetic job."
One that may balk.   		3 letters,ASS.    	To balk is to stop and refuse to go on. It's not just a baseball term!
Pathet ___ (old revolutionary group).   		3 letters,LAO.    	The Pathet Lao was a communist organization in Laos that assumed political power 1975 after the Laotian Civil War.
Where phone nos.   		3 letters,PDA.    	Personal digital assistant (PDA)
Vardalos of the screen.   		3 letters,"NIA.    	Not only is the delightful Nia Vardalos the star of the 2002 hit movie ""My Big Fat Greek Wedding"", she also wrote the screenplay. The film never made it to number one at the box office, but it still pulled in more money than any other movie in history that didn't make it to number one. That record I think reflects the fact that the film wasn't a blockbuster but rather a so-called ""sleeper hit"", a movie that people went to see based on referrals from friends. The big fat mistake came when a spin-off TV show was launched, ""My Big Fat Greek Life"". It ran for only 7 episodes."
"Orangutan, e.g.   		3 letters","APE.    	Orangutans are arboreal creatures, in fact the largest arboreal animals known to man. Orangutans are native to Indonesia and Malaysia, living in the rain forests. Like many animals in rain forests these days, orangutans are endangered, with only two species surviving. The word ""orangutan"" is Malay, meaning ""man of the forest""."
Airline to Stockholm.   		3 letters,"SAS.    	SAS was formerly known as Scandinavian Airlines System and is the flag carrier of three countries: Denmark, Norway and Sweden. SAS is based at Stockholm Arlanda Airport located just north of the Swedish capital."
Forward-moving occasion?: Abbr..   		3 letters,"DST.    	On the other side of the Atlantic, Daylight Saving Time (DST) is known as ""summer time"". The idea is to move clocks forward an hour in spring and backwards in the fall, so that afternoons have more daylight."
Latin 101 word.   		4 letters,"ERAT.    	'Esse' is the Latin for 'to be'. 'Sum' means 'I am' and 'erat' means 'he, she was'."
Dr.   		4 letters,"IGOR.    	Igor has been the assistant to Dracula, Frankenstein and Young Frankenstein among others. Igor is almost invariably portrayed as a hunchback."
Physician-turned-revolutionary.   		3 letters,"CHE.    	Ernesto ""Che"" Guevara was born in Argentina, and in 1948 he started to study medicine at the University of Buenos Aires. While at school he satisfied his need to ""see the world"" by taking two long journeys around South America, the story of which are told in Guevara's memoir later published as ""The Motorcycle Diaries"". While travelling, Guevara was moved by the plight of the people he saw and their working conditions and what he viewed as capitalistic exploitation. In Mexico City he met brothers Raul and Fidel Castro and was persuaded to join their cause, the overthrow of the US-backed government in Cuba. He rose to second-in-command among the Cuban insurgents, and when Castro came to power Guevara was influential in repelling the Bay of Pigs Invasion and bringing Soviet nuclear missiles to the island. Guevara left Cuba in 1965 to continue his work as a revolutionary. He was captured by Bolivian forces in 1967, and was executed. Fidel Castro led the public mourning of Guevara's death, and soon the revolutionary was an icon for many left-wing movements around the world."
Tuna type.   		3 letters,"AHI.    	Yellowfin and bigeye tuna are usually marketed as ""ahi"", the Hawaiian name. They are both big fish, with yellowfish tuna often weighing over 300 pounds, and bigeye tuna getting up to 400 pounds."
Music sheet abbr..   		3 letters,"ARR.    	""Arr."" is short for ""arranged by"", when written on a musical score."
"""Fusses"" is a form of it.   		4 letters","ETRE.    	""Tu fusses"" is what's called the imperfect subjunctive tense in French, of the verb ""être"" (to be). An example of its use is:"
Member of la familia.   		3 letters,"TIA.    	In Spanish, an aunt (tia) is a member of the family (la familia)."
Stereotypical lab assistant's name.   		4 letters,"IGOR.    	Igor has been the assistant to Dracula, Frankenstein and Young Frankenstein, among others. He is almost invariably portrayed as a hunchback."
"Marilyn Monroe played one in ""Some Like It Hot"".   		3 letters","UKE.    	""Some Like it Hot"" is such a fun movie, released in 1959, directed by Billie Wilder. The big three in the cast are of course Marilyn Monroe, Tony Curtis and Jack Lemmon. A few years ago a stage version of ""Some Like It Hot"" was playing in San Francisco, with Tony Curtis in the cast. This time he played the older man who was wooing the Jack Lemmon character in the movie."
Brand name with 2/3 capital letters in its logo.   		3 letters,"TAB.    	Tab was the first diet cola introduced by the Coca-Cola company, in 1963. It was produced as a competitor to the very successful Diet Rite cola that was made by RC Cola. The name 'Tab' was used as the beverage was aimed at people who wanted to keep 'tabs' on their weight. The name 'Tab' is stylized as 'TaB' in the drink's logo."
Defib operator.   		3 letters,EMT.    	A defibrillator might be operated by an Emergency Medical Technician (EMT).
Aspiring atty.'s exam.   		4 letters,LSAT.    	The Law School Admission Test (LSAT) has been around since 1948.
Gaelic language.   		4 letters,"ERSE.    	There are actually three Erse languages: Irish, Manx (spoken on the Isle of Man) and Scots Gaelic. In their own tongues, these would be Gaeilge (in Ireland), Gaelg (on the Isle of Man) and Gaidhlig (in Scotland)."
Fraternity T.   		3 letters,"TAU.    	Tau is the 19th letter of the Greek alphabet, the letter which gave rise to our Roman ""T"". Both the letters tau (T) and chi (X) have long been symbolically associated with the cross."
Jane at Thornfield.   		4 letters,"EYRE.    	Thornfield Hall is the home of Mr. Rochester, and where all the action takes place in ""Jane Eyre"". ""Jane Eyre"" is of course the novel written by Charlotte Bronte, and published as ""Jane Eyre. An Autobiography"" under the pen name Currer Bell. The storyline is a little too dark and Gothic for my taste ..."
Flight ticket abbr..   		3 letters,ARR.    	Arrival time.
