"Some ""CSI"" figs.   		3 letters",DAS.    	District Attorney (DA)
___ de la Société.   		4 letters,"ILES.    	The Society Islands (in French, 'Îles de la Société') are a group of islands in the South Pacific that are part of French Polynesia. It is thought that the islands were named by English explorer Captain James Cook in honor of the Royal Society. The Society Islands are divided into two groups: The Windward Islands (the most famous of which is Tahiti) and the Leeward Islands (which includes the island of Bora Bora)."
Many a noble element.   		3 letters,"GAS.    	The noble gases are those elements over on the extreme right of the Periodic Table. Because of their ""full"" complement of electrons, noble gases are very unreactive. The noble gases are Helium, Neon, Argon, Krypton and Xenon."
Roping event.   		5 letters,"RODEO.    	""Rodeo' is a Spanish word, which is usually translated as 'round up'."
Asian nurse.   		4 letters,"AMAH.    	""Amah"" is an interesting word, one that we associate so much with Asian culture and yet it actually comes from the Portuguese ""ama"" meaning ""nurse"". Ama was imported into English in the days of the British Raj in India when a wet-nurse became known as an ""amah""."
Actress Elizabeth with older twins.   		5 letters,"OLSEN.    	Elizabeth Olsen is an actress and singer, and the younger sister of the famed Olsen twins Mary-Kate and Ashley."
Candy company whose first flavor was Pfefferminz.   		3 letters,"PEZ.    	PEZ is an Austrian brand name for a particular candy sold in a mechanical dispenser. The name PEZ comes from the first, middle and last letters of ""Pfefferminz"", the German word for ""peppermint""."
Witty Mort.   		4 letters,"SAHL.    	Mort Sahl is a Canadian-born actor and comedian who moved to the US with his family when he was a child. Sahl became friends with John F. Kennedy. When Kennedy became president, Sahl wrote a lot of jokes for the President's speeches, although he also told a lot of Kennedy jokes in his acts. After the President was assassinated in 1963, Sahl was intensely interested in finding out who was behind the crime and even got himself deputized as a member of one of the investigating teams. He was very outspoken against the results of the Warren Commission report on the assassination, and soon found himself out of favor with the public. It took a few years for him to make his comeback, but come back he did."
N.B.A.   		4 letters,CHET.    	Chet Walker is a former basketball player who played with the Syracuse Nationals (which team became the Philadelphia 76ers) and the Chicago Bulls.
Puppet of old TV.   		5 letters,"OLLIE.    	'Kukla, Fran and Ollie' is an early television show that aired from 1947-1957. Kukla and Ollie (Oliver J. Dragon) were puppets and Fran was Fran Allison, usually the only human on the show."
Documentarian Burns.   		3 letters,"RIC.    	Ric Burns is a documentary filmmaker, the younger brother of Ken Burns (who was behind ""The Civil War"", ""Baseball"" and ""The War"")."
"The Golf Channel co-founder, to fans.   		5 letters","ARNIE.    	Arnold Palmer is one of the greats of the world of golf. Palmer is very popular with many fans of the game, and his followers are usually referred to as 'Arnie's Army'."
"""Fargo"" director.   		4 letters","COEN.    	""Fargo"" is one of my favorite films of all time, and stars perhaps my favorite actress, Frances McDormand. Fargo was directed by the Coen brothers, Joel and Ethan. Frances McDormand is Joel's wife."
Singer India.___.   		4 letters,"ARIE.    	India.Arie is an American soul and R&B singer, born India Arie Simpson."
Suffix with Gator or Power.   		4 letters,"-ADE.    	Gatorade was developed at the University of Florida by a team of researchers at the request of the school's football team. And so, Gatorade is named after the Gators football team."
"""Lean Forward"" sloganeer.   		5 letters","MSNBC.    	MSNBC was founded in 1996 as a partnership between Microsoft (""MS"") and General Electric's ""NBC"" broadcasting operation. Microsoft only owns a minority share in MSNBC today, but is still an equal partner in the separate company that runs msnbc.com."
Enzyme suffix.   		4 letters,"-ASE.    	Enzymes are basically catalysts, chemicals that act to increase the rate of a particular chemical reaction. For example, starches will break down into sugars over time, especially under the right conditions. However, in the presence of the enzyme amylase (found in saliva) this production of sugar happens very, very quickly."
Cliffside home.   		5 letters,"AERIE.    	An aerie is the nest of an eagle, and is also known as an 'eyrie'."
Native Canadian.   		4 letters,CREE.    	The Cree are one of the largest groups of Native Americans on the continent. In the US most of the Cree nation live in Montana on a reservation shared with the Ojibwe people. In Canada most of the Cree live in Manitoba.
Tulipe relative.   		3 letters,"LIS.    	In French, a 'tulipe' is a tulip, and a 'lis' is a lily."
"Mmes., to Don Juan.   		4 letters","SRAS.    	Don Juan is a flighty character who has been featured by a number of authors, poets and composers, including Molière, Byron, and Mozart. In the underlying legend, Don Juan ends up talking to the statue of the dead father of one of his conquests. Don Juan dines with the ghost of the dead man and when shaking the hand of the ghost he is dragged away to hell. We now use the term 'Don Juan' to describe any womanizer or ladies' man."
Fleur-de-___.   		3 letters,"LIS.    	""Lys"" (also 'lis') is the French word for ""lily"", as in ""fleur-de-lys"", the heraldic symbol often associated with the French monarchy."
Easy-to-chew food.   		3 letters,"PAP.    	One meaning of ""pap"" is soft or semi-liquid food for babies and small children. ""Pap"" comes into English via French, from the Latin word used by children for ""food"". In the 1500s, ""pap"" also came to mean ""an oversimplified"" idea. This gives us a usage that's common today, describing literature or perhaps TV programming that lacks real value or substance. Hands up those who think there's a lot of pap out there, especially on television ..."
First name in the 2012 Republican primary.   		4 letters,"NEWT.    	Newt ... what a name! Newt Gingrich was born Newton Leroy McPherson in 1943, in Harrisburg, Pennsylvania. Newt's mother remarried when he was very young and his new father, Robert Gingrich, adopted Newt giving him the Gingrich name."
Linguist Chomsky.   		4 letters,NOAM.    	Noam Chomsky is a professor of linguistics at MIT. Chomsky is known as one of the fathers of modern linguistics.
"Blue Moon ___, three-time World Series winner for the 1970s A's.   		4 letters","ODOM.    	Blue Moon Odom's real name was Johnny Lee Odom, and he was a pitcher for the Oakland Athletics. With the A's, Odom won three consecutive World Series, from 1972 to 1974."
Staple of a vegan diet.   		4 letters,"TOFU.    	Tofu is another name for bean curd, and is a Japanese word meaning just that ... bean that has 'curdled'. Tofu is produced by coagulating soy milk, using either salt or something acidic. Once the protein has coagulated, the curds are pressed into the familiar blocks. Personally I love tofu, but my wife, she absolutely hates it ..."
Yawns might suggest this.   		5 letters,"ENNUI.    	'Ennui' is the French word for boredom, a word that we now use in English. It's one of the few French words we've imported that we haven't anglicized and actually pronounce ""correctly""."
"""My Cousin Vinny"" co-star.   		5 letters","TOMEI.    	Marisa Tomei's first screen role was in ""As the World Turns"", but her break came with a recurring role in ""The Cosby Show"" spin-off, ""A Different World"". Tomei won an Oscar for her delightful performance in ""My Cousin Vinny"" in 1992."
Tokyo stage shows.   		3 letters,"NOH.    	Noh is a form of musical drama in Japan that has been around since the 14th century. Many of the Noh performers are masked, allowing all the roles to be played by men, both male and female parts."
Common khakis go-with.   		4 letters,"POLO.    	René Lacoste was a French tennis player who went into the clothing business, and came up with a more comfortable shirt that players could use. This became known as a 'tennis shirt'. When it was adopted for use in the sport of polo, the shirts also became known as 'polo shirts'. And then the 'golf shirt' is basically the same thing."
McJob doer.   		4 letters,PEON.    	A peon is a lowly worker with no real control over his/her working conditions. The word comes into English from Spanish where it has the same meaning.
Parts of un archipel.   		4 letters,"ILES.    	In French, an archipelago (un archipel) is made up of islands (îles)."
Ocasek of the Cars.   		3 letters,"RIC.    	Ric Ocasek is an American musician of Czech heritage, and was the lead vocalist of the rock band known as the Cars."
Naval group.   		6 letters,"ARMADA.    	The most famous Armada was the Spanish fleet that sailed against England in order to overthrow Queen Elizabeth I in 1588. It failed in its mission, partly due to bad weather encountered en route. Ironically, the English mounted a similar naval attack against Spain the following year, and it failed as well."
Sp.   		4 letters,"SRAS.    	The equivalent of 'Mrs.' in French is 'Mme.' (Madame), in Spanish is 'Sra.' (Señora) and in Portuguese is also 'Sra.' (Senhora)."
"Conversely, in texts.   		4 letters",OTOH.    	On the other hand (OTOH)
Bering Sea port.   		4 letters,"NOME.    	Nome, Alaska has over 3,500 residents, the majority of whom are Native American. The next largest ethnic group is the white population."
"Marisa of ""My Cousin Vinny"".   		5 letters","TOMEI.    	Marisa Tomei's first screen role was in ""As the World Turns"", but her break came with a recurring role in ""The Cosby Show"" spin-off, ""A Different World"". She won an Oscar for her delightful performance in ""My Cousin Vinny"" in 1992."
Singer Ocasek.   		3 letters,"RIC.    	Ric Ocasek is an American musician of Czech heritage, and was the lead vocalist of the rock band known as the Cars."
Like some dessert orders.   		9 letters,"A LA MODE.    	In French, ""à la mode"" simply means ""fashionable"". In America, the term has come to describe a way of serving pie, usually with ice cream, or as I recall from when I lived in Upstate New York, with cheese."
Enzyme suffix.   		4 letters,"-ASE.    	Enzymes are basically catalysts, chemicals that act to increase the rate of a particular chemical reaction. For example, starches will break down into sugars over time, especially under the right conditions. However, in the presence of the enzyme amylase (found in saliva) this production of sugar happens very, very quickly."
Disney dwarf with glasses.   		3 letters,"DOC.    	In the original Brothers Grimm fairy tale ""Snow White"", the seven dwarfs were not given any names. The names were created for the 1937 classic animated film ""Snow White and the Seven Dwarfs"" from Walt Disney. The seven dwarfs are:"
"___ Hughes, 2002 Olympic skating gold medalist.   		5 letters",SARAH.    	American figure skater Sarah Hughes won the Ladies Singles' gold medal at the 2002 Winter Olympic Games.
Gumshoe.   		3 letters,"TEC.    	Gumshoe is a slang term for a private detective or private investigator (P.I.). Apparently the term ""gumshoe"" dates back to the early 1900s, and refers to the rubber-soled shoes popular with private detectives at that time."
Something to believe in.   		5 letters,"TENET.    	A tenet is an article of faith, something that is held to be true. 'Tenet' is Latin for 'he holds'."
Lead-in to -drome.   		5 letters,"AERO-.    	Aerodrome is a general term for a facility where aircraft take off and land. An aerodrome could be a small airstrip, a large commercial airport or even a military airbase. The term 'aerodrome' is used quite often in the UK, but rarely here in the US."
39-Across commander.   		3 letters,DDE.    	
"""Cómo ___ usted?"".   		4 letters","ESTA.    	""?Cómo está usted?"" is the more formal way of asking, ""How are you?"" in Spanish."
"""Por ___ Cabeza"" (tango standard).   		3 letters","UNA.    	Por una cabeza' is one of the most famous Argentine tangos, oft-featured in memorable scenes in big Hollywood movies. You might recall tangos in 1992's 'Scent of a Woman' or 1994's 'True Lies', for example, both of which were danced to 'Por una cabeza'. The title of the song translates to 'by a head'. The 'by a head' in this context is the distance by which a horse might win a race. The lyrics tell of a man who compares his addiction to gambling on horses to his attraction to women."
Unmoved.   		5 letters,"STOIC.    	Zeno of Citium was a Greek philosopher famous for teaching at the Stoa Poikile, the ""Painted Porch"", located on the north side of the Ancient Agora of Athens. Because of the location of his classes, his philosophy became known as stoicism (from ""stoa"", the word for ""porch""). And yes, we get our adjective ""stoic"" from the same root."
Official state sport of Wyoming.   		5 letters,"RODEO.    	""Rodeo' is a Spanish word, which is usually translated as 'round up'."
Final word in a holiday tune.   		4 letters,"SYNE.    	The song ""Auld Lang Syne"" is a staple at New Year's Eve, the words of which were written by Scottish poet Robbie Burns. The literal translation of 'Auld Lang Syne' is 'old long since', but is better translated as 'old times'. The sentiment of the song is 'for old time's sake'."
Painter Chagall.   		4 letters,"MARC.    	Marc Chagall was a Russian-French artist, one of the most successful of the 20th century. Unlike so many painters, Chagall was able to achieve wealth and notoriety for his work during his own lifetime. It did help that Chagall lived to a ripe old age though. He passed away in 1985, when he was 97 years young."
Pier grp.   		3 letters,ILA.    	The International Longshoremen's Association.
___ Rose.   		3 letters,"AXL.    	Axl Rose is the lead vocalist of the American rock band, Guns N' Roses."
Garment usually with two buttons.   		4 letters,"POLO.    	René Lacoste was a French tennis player who went into the clothing business, and came up with a more comfortable shirt that players could use. This became known as a 'tennis shirt'. When it was adopted for use in the sport of polo, the shirts also became known as 'polo shirts'. And then the 'golf shirt' is basically the same thing."
___ Dei (Catholic group).   		4 letters,"OPUS.    	Opus Dei is Roman Catholic institution that was founded in Spain in 1928, and officially approved by the church in 1950. In 2010, Opus Dei had over 90,000 members, mostly lay people. The institution's mission is to promote certain aspects of the Roman Catholic doctrine. Opus Dei was portrayed as a sinister organization by Dan Brown in his novel 'The Da Vinci Code'."
Jean-___ Picard (U.S.S.   		3 letters,"LUC.    	When Gene Roddenberry was creating the 'Star Trek' spin-off series 'Star Trek: The Next Generation', I think he chose a quite magnificent name for the new starship captain. The name ""Jean-Luc Picard"" is imitative of one or both of the twin-brother Swiss scientists Auguste and Jean Felix Piccard. The role of Picard was of course played by the wonderful Shakespearean actor Patrick Stewart."
Symbol of Middle America.   		6 letters,"PEORIA.    	The phrase, 'Will it play in Peoria?' is used to mean, 'Will it appeal to the mainstream?' It is believed the expression originated as a corruption of, 'We shall play in Peoria', a line used by some actors in the 1890 novel ""Five Hundred Dollars"" by Horatio Alger, Jr."
Photographer Adams.   		5 letters,"ANSEL.    	As an amateur photographer, I have been a big fan of the work of Ansel Adams for many years and must have read all of his books. He was famous for the clarity and depth in his black and white images. Central to his technique was the use of the zone system, his own invention. The zone system is a way of controlling exposure in an image, particularly when there is a high contrast in the subject. Although the technique was developed primarily for black & white film, it can even apply to digital color images. In the digital world, the main technique is to expose an image for the highlights, and one or more images for the shadows. These images can then be combined digitally giving a final image with a full and satisfying range of exposures."
"Mine, in Madrid.   		3 letters",MIO.    	Madrid is the largest city in Spain and the capital. Madrid is located very close to the geographical center of the country. It is the third-largest city in the European Union (after London and Paris). People from Madrid called themselves Madrileños.
"""Auld Lang ___"".   		4 letters","SYNE.    	The song ""Auld Lang Syne"" is a staple at New Year's Eve, the words of which were written by Scottish poet Robbie Burns."
Some M.I.T.   		3 letters,EES.    	Electrical Engineers (EEs).
Many a South Seas island.   		5 letters,"ATOLL.    	An atoll is a coral island that is shaped in a ring and enclosing a lagoon. There is still some debate as to how an atoll forms, but a theory proposed by Charles Darwin while on his famous voyage aboard HMS Beagle still holds sway. Basically an atoll was once a volcanic island that had subsided and fallen into the sea. The coastline of the island is home to coral growth which persists even as the island continues to subside internal to the circling coral reef."
President pro ___.   		3 letters,"TEM.    	Pro tempore can be abbreviated to ""pro tem"" or ""p.t."" It is a Latin phrase which best translates as ""for the time being"". It is used to describe a person who is acting for another, usually a superior."
"""Reading Rainbow"" network.   		3 letters","PBS.    	The Public Broadcasting System (PBS) was founded in 1970, and has to be my favorite of the broadcast networks. I love PBS's drama and science shows in particular, and always watch the election results with the NewsHour team."
One doing the lord's work.   		4 letters,"SERF.    	A serf was a member of the lowest feudal class, someone attached to land owned by a lord. ""Serf"" comes from the Latin ""servus"", meaning ""slave""."
Kind of dispenser.   		3 letters,"PEZ.    	PEZ is an Austrian brand name for a particular candy sold in a mechanical dispenser. The name PEZ comes from the first, middle and last letters of ""Pfefferminz"", the German word for ""peppermint""."
Large bill holder.   		4 letters,"IBIS.    	The ibis is a wading bird that was revered in ancient Egypt. ""Ibis"" is an interesting word grammatically speaking. You can have one ""ibis"" or two ""ibises"", and then again one has a flock of ""ibis"". And if you want to go with the classical plural, instead of two ""ibises"" you would have two ""ibides""!"
Department in Picardy.   		4 letters,OISE.    	The department in northern France known as Oise is named for the River Oise. The river rises in Belgium and joins up with the River Seine just outside Paris.
"""Fargo"" director.   		4 letters","COEN.    	""Fargo"" is one of my favorite films of all time, and stars perhaps my favorite actress, Frances McDormand. Fargo was directed by the Coen brothers, Joel and Ethan. Frances McDormand is Joel's wife."
Vagabond.   		4 letters,"HOBO.    	No one seems to know for sure how the term ""hobo"" originated, although there are lots of colorful theories. My favorite is that ""hobo"" comes from the first letters in the words ""ho-meward bo-und"", but it doesn't seem very plausible. A kind blog reader tells me that according to Click and Clack from PBS's ""Car Talk"" (a great source!), ""hobo"" comes from ""hoe boy"". Hoe boys were young men with hoes looking for work after the Civil War. Hobos differed from ""tramps"" and ""bums"", in that ""bums"" refused to work, ""tramps"" worked when they had to, while ""hobos"" traveled in search of work."
"Beethoven's ""Sinfonia ___"".   		6 letters","EROICA.    	Beethoven originally dedicated his Symphony No. 3 to Napoleon Bonaparte. Beethoven admired the principles of the French Revolution and as such respected Bonaparte who was ""born"" out of the uprising. When Napoleon declared himself Emperor, Beethoven (and much of Europe) saw this as a betrayal to the ideals of the revolution so he changed the name of his new symphony from ""Bonaparte"" to ""Eroica"", meaning ""heroic"" or ""valiant""."
One of the Jacksons.   		4 letters,"TITO.    	Tito Jackson was the third eldest of the Jackson children, and was known in Motown as the ""quiet Jackson""."
Sea eagle.   		3 letters,"ERN.    	The ern (also erne) is sometimes called the white-tailed eagle, or the sea-eagle."
Brass component.   		4 letters,"ZINC.    	Brass is an alloy of copper and zinc. Compare this with bronze, an alloy of copper and tin. Copper and bronze are often mistaken for each other."
D.D.E.   		3 letters,"AES.    	Adlai Stevenson ran for president unsuccessfully against Dwight D. Eisenhower in 1952 and in 1956. Some years after his second defeat, Stevenson served under President Kennedy as Ambassador to the United Nations. Stevenson was always noted for his eloquence and he had a famous exchange in a UN Security Council meeting during the Cuban missile crisis. Stevenson bluntly demanded that the Soviet representative on the council tell the world if the USSR was installing nuclear weapons in Cuba. His words were ""Don't wait for the translation, answer 'yes' or 'no'!"" followed by ""I am prepared to wait for my answer until Hell freezes over!"""
Dockworker's org.   		3 letters,ILA.    	The International Longshoremen's Association.
"""The Wrestler"" actress.   		5 letters","TOMEI.    	Marisa Tomei's first screen role was in ""As the World Turns"", but her break came with a recurring role in ""The Cosby Show"" spinoff, ""A Different World"". Tomei won an Oscar for her delightful performance in ""My Cousin Vinny"" in 1992."
Old TV news partner of David.   		4 letters,CHET.    	Chet Huntley was a newscaster who co-anchored 'The Huntley-Brinkley Report' on NBC with David Brinkley from 1956 to 1970.
Bygone flightless bird.   		3 letters,"MOA.    	Moas were flightless birds native to New Zealand, and are now extinct. The fate of the Moa is a great example of the detrimental effect that humans can have on animal populations. The Maoris arrived in New Zealand about 1300 AD, upsetting the balance of the ecosystem. The Moa were hunted to extinction within 200 years, which in turn caused the extinction of the Haast's Eagle, the Moa's only predator prior to the arrival of man."
Eastern princess.   		4 letters,"RANI.    	A ranee (also spelled rani) is a queen or a princess, the female equivalent of a raja in India."
Lamar who married a Kardashian.   		4 letters,"ODOM.    	Lamar Odom is a basketball forward playing for the LA Clippers. Apparently Odom loves candy, and that's how he earned his nickname, ""The Candy Man"". Odom is married to Khloé Kardashian, and the couple's wedding featured on an episode of the reality show 'Keeping Up with the Kardashians'. Not a show that I have ever seen ..."
Exceeds the speed limit?.   		3 letters,"ODS.    	'Speed' is a slang name for some stimulant drugs, especially amphetamine or methamphetamine."
Ending with Gator.   		4 letters,"-ADE.    	Gatorade was developed at the University of Florida by a team of researchers at the request of the school's football team. And so, Gatorade is named after the Gators football team."
Sci-fi character remembered for her large bus (buns).   		4 letters,"LEIA.    	Princess Leia is Luke Skywalker's sister in the original ""Star Wars"" trilogy and was played by Carrie Fisher. Carrie Fisher has stated that she hated the famous ""cinnamon bun hairstyle"" that she had to wear in the films, as she felt it made her face look too round. She also had to to sit for two hours every day just to get her hair styled. Two hours to get your hair done? It takes me just two seconds ..."
"Quick ""however"".   		4 letters",OTOH.    	On the other hand (OTOH)
Chess champ Mikhail.   		3 letters,"TAL.    	Mikhail Tal was truly a chess legend. Tal holds the record for the longest unbeaten streak in competition chess. And the second longest winning streak, well, that was by Tal as well."
"""The Wrestler"" actress Marisa.   		5 letters","TOMEI.    	Marisa Tomei's first screen role was in ""As the World Turns"", but her break came with a recurring role in ""The Cosby Show"" spinoff, ""A Different World"". Tomei won an Oscar for her delightful performance in ""My Cousin Vinny"" in 1992."
Disinheritor of Cordelia.   		4 letters,"LEAR.    	King Lear' is one of William Shakespeare's tragedies. Lear's three daughters figure prominently in the storyline. The three are, in order of age:"
Point of writing.   		3 letters,"NIB.    	""Nib"" is a Scottish variant of the Old English word ""neb"", with both meaning the beak of a bird. This usage of ""nib"" as a beak dates back to the 14th century, with ""nib"" meaning the tip of a pen or quill coming a little later, in the early 1600s."
Half of an old comedy duo.   		5 letters,"OLLIE.    	Stan Laurel was an English comic actor (born Arthur Stanley Jefferson), who made a great career for himself in Hollywood, of course. He ended up at the Hal Roach studio, directing films, intent on pursuing a career writing and directing. However, Laurel, a sometime actor, was asked to step in when another comic actor, Oliver Hardy was injured and couldn't perform. Laurel and Hardy started to share a stage together during that time, and when it was clear they worked so well together, the partnership was born."
