P.T.A. interest: Abbr..   		4 letters,EDUC.    	Parent-Teacher Association (PTA)
AOL and MSN.   		4 letters,"ISPS.    	An Internet Service Provider (ISP) is just what the name indicates, a company that provides its customers with access to the Internet. One way that ISPs differentiate themselves from each other is in the way in which end users are connected to the ISP's network. So, there are cable ISPs, DSL ISPs, dial-up ISPs and satellite ISPs. I'd go with cable if I were you, if it's available in your area ..."
Home to Morro Castle.   		4 letters,CUBA.    	Morro Castle is a fortress guarding the entrance to Havana Bay in Cuba. The castle was built by the Spanish in 1859. The name 'Morro' means a rock that is visible from the sea.
"""Répondez ___ vous plaît"".   		4 letters","S'IL.    	RSVP stands for ""répondez, s'il vous plaît"", which is French for ""please, answer""."
Packing a sting?.   		5 letters,APIAN.    	Something described as 'apian' is related to bees. 'Apis' is the Latin for 'bee'.
Mr.   		4 letters,"MOTO.    	The mysterious Mr. Moto is a Japanese secret agent who appears in six novels by American author, John P. Marquand. Mr. Moto was famously played by Peter Lorre in a series of eight films released in the 1930s."
"Some screens, for short.   		4 letters","LCDS.    	Liquid Crystal Displays (LCDs) are the screens that are found in most laptops today, and in flat panel computer screens and some televisions. LCD monitors basically replaced Cathode Ray Tube (CRT) screens, the old television technology."
"""Bleeding Love"" singer Lewis, 2007.   		5 letters",LEONA.    	Leona Lewis rocketed to fame after winning the British TV show called 'The X Factor' (the show that spawned the UK's 'Pop Idol' and America's 'American Idol').
Model wood.   		5 letters,"BALSA.    	Balsa is a very fast growing tree that is native to parts of South America. Even though balsa wood is very soft, it is actually classified as a hardwood, the softest of all the hardwoods (go figure!). Balsa is light and strong, so is commonly used in making model airplanes. Amazingly, in WWII a full-size British plane, the de Havilland Mosquito, was built largely from balsa and plywood. No wonder they called it ""The Wooden Wonder"" and ""The Timber Terror""."
Pueblo brick.   		5 letters,"ADOBE.    	The building material known as adobe has been around a long time, and has been used in dry climates all over the world. The original form of the word ""adobe"" dates back to Middle Egyptian times, about 2000 BC. The original spelling is ""dj-b-t"", and translates as mud (sun-dried) brick."
Tribe once along the Big Blue River.   		5 letters,"OTOES.    	The Otoe (also Oto) Native American tribe originated in the Great Lakes region as part of the Winnebago or Siouan tribes. The group that would become the Otoe broke away from the Winnebago and migrated southwestwards ending up in the Great Plains. In the plains the Otoe adopted a semi-nomadic lifestyle dependent on the horse, with the American bison becoming central to their diet."
Hat with a tassel.   		3 letters,"FEZ.    	""Fez"" is the name given to the red cylindrical hat worn mainly in North Africa, and by Shriners here in the US. The fez used to be a very popular hat across the Ottoman Empire. The etymology of ""fez"" is unclear, although it might have something to do with the Moroccan city named Fez."
Forerunner of Bach?.   		3 letters,"PDQ.    	P.D.Q. Bach is an alter ego used by musical satirist Peter Schickele. Schickele creates works that he bills as compositions written by P.D.Q. Bach, the 'only forgotten son' of Johann Sebastien Bach."
"Movie with the song ""I Remember It Well"".   		4 letters","GIGI.    	In the lovely musical ""Gigi"", released in 1958, the title song is sung by Louis Jourdan who plays Gaston. My favorite number though, has to be ""Thank Heaven for Little Girls"" sung by Maurice Chevalier. Many say that 'Gigi' is the last in a long line of great MGM musicals."
"""Cat ___ Hot Tin Roof"".   		4 letters","ON A.    	'Cat on a Hot Tin Roof' is the play that won Tennessee Williams the Pulitzer Prize for Drama in 1955. The play was adapted into a famous film version in 1958, with Elizabeth Taylor and Paul Newman playing the leads."
"It's ""sim"" in São Paulo.   		3 letters","YES.    	'Sim' is Portuguese for 'yes', and 'não' translates as 'no'."
Trinity member.   		3 letters,"SON.    	In the Christian tradition, the Father, Son and Holy Spirit are three persons in One Divine Being, the Holy Trinity."
Young salamanders.   		4 letters,EFTS.    	Salamanders are lizard-like amphibians found in all across the northern hemisphere. They are the only vertebrate animals that can regenerate lost limbs.
"Subject of the campaign slogan ""Fifty-four forty, or fight!"".   		6 letters","OREGON.    	The US participated in tripartite negotiations with imperial powers of Russia and Britain in the 1820s that established a boundary along the line of latitude at 54 degrees, 40 minutes north. Back then, the border separated Russian interests north of the border, and British and American interests to the south. Today, that border separates the US State of Alaska and the Canadian Province of British Columbia. The area south of the border was referred to as the Columbia District by the British, and the Oregon Country by the Americans, with the two nations disputing ownership. In the 1840s, the US Democratic Party took the position that America should annex the entire area, and coined the slogan 'Fifty-four Forty or Fight!'."
Unconscious state.   		4 letters,"COMA.    	The term ""coma"" comes from the Greek word ""koma"" meaning ""deep sleep""."
Kitty.   		3 letters,"POT.    	The ""pot"" in a card game has been referred to as the 'kitty' since the 1880s. It's not certain how the name ""kitty"" evolved but possibly it came from ""kit"", the necessary equipment for the game."
Pop singer from 27-Down.   		6 letters,"DON HO.    	The singer and entertainer Don Ho apparently had a pretty liberal arrangement with his wife. When Ho was touring with his two backing singers, Patti Swallie and Elizabeth Guevara, all three of them shared a room together. He had two children with each of his roommates, giving a total of ten kids including the six he had with his wife. The arrangement was quite open, it seems, with all ten kids visiting each other regularly. To each his own ..."
Fertilizer ingredient.   		4 letters,"PEAT.    	When dead plant matter accumulates in marshy areas, it may not fully decay due to a lack of oxygen or acidic conditions. We are familiar with this in Ireland, because this decaying matter can form peat, and we have lots and lots of peat bogs."
Tennessee senator ___ Alexander.   		5 letters,"LAMAR.    	Lamar Alexander is one of the US Senators representing Tennessee. Alexander is a great classical and country piano player, and you can actually hear him playing on a re-recording that Patti Page made of her 1950 hit 'Tennessee Waltz'."
"""Hooked on Classics"" record promoter.   		5 letters","K-TEL.    	I know that a lot of people detested the ""Hooked on Classics"" albums, but to be honest, I found them to be a lot of fun. But then again, I liked disco! The original ""Hooked on Classics"" album was recorded in 1981 by the Royal Philharmonic Orchestra from London. The music was a selection of recognizable extracts from the world of classical music played over a continuous, disco beat."
Apollo plucked it.   		4 letters,"LYRE.    	The lyre is a stringed instrument most closely associated with Ancient Greece, and with the gods Hermes and Apollo in particular. According to myth, Hermes slaughtered a cow from a sacred herd belonging to Apollo and offered it to the gods but kept the entrails. Hermes used the entrails to create the first lyre. Apollo liked the sound from the lyre and agreed to accept it as a trade for his herd of cattle."
SFO opponent in the 2012 World Series.   		3 letters,"DET.    	The San Francisco Giants won the 2012 World Series by sweeping the Detroit Tigers, winning the first four of the seven games scheduled."
"Former cave dweller, informally.   		5 letters","OSAMA.    	The famous cave that almost certainly housed Osama Bin Laden for a while was in Tora Bora in eastern Pakistan. Tora Bora is not far (~ 30 mi) from what used to be an even more famous spot, the Khyber Pass. ""Tora Bora"" is a Pashto name which translates to ""black dust""."
2014 Baseball Hall of Fame inductee.   		5 letters,"TORRE.    	As a manager, Joe Torre was part of four World Series wins, all of them with the New York Yankees baseball team. Torre is an Italian American who was born in Brooklyn, New York. During the run up (pun intended!) to the 2006 Winter Olympics in Turin, Torre carried the Olympic flame part of the way through Florence in Italy, handing it over to the next runner at the famous Ponte Vecchio. I'd guess that was quite a thrill for him ..."
Cleansing agent.   		5 letters,"BORAX.    	Borax is also known as sodium borate, and is a salt of boric acid. Borax is a white powder that dissolves easily in water. The compound has many uses, for example as an antifungal agent and an antiseptic."
Badly made dough?.   		5 letters,"LUCRE.    	Our word 'lucre' meaning 'money, profits' comes from the Latin 'lucrum' that means the same thing."
Latch (onto).   		4 letters,"GLOM.    	'Glom' is a slang term meaning 'steal', although it can also be used to mean 'latch onto' when used as 'glom onto'. The term probably comes from the Scots word 'glam' meaning 'to snatch at'."
Holmes of Hollywood.   		5 letters,"KATIE.    	Katie Holmes is an actress who first came to prominence in the television drama 'Dawson's Creek'. Off screen, Holmes is famous as the ex-wife of Tom Cruise."
Symbol of happiness.   		4 letters,"CLAM.    	Our phrase 'happy as a clam' dates back to the mid-1600s. Back then it was a more lengthy expression: 'happy as a clam in the mud at high tide'. The idea was that a clam would be happy in its muddy home at high tide, because no one from land could get to it and eat it."
"Actor John of ""American Pie"" films.   		3 letters","CHO.    	John Cho is an actor and musician who was born in Seoul, South Korea but who has lived in the US since he was a young boy. Cho's break in movies came in playing Harold Lee in the 'Harold & Kumar' films. He is now making a name for himself playing Mr. Sulu in the latest 'Star Trek' movies."
"De la Garza of ""Law & Order"".   		5 letters","ALANA.    	Alana de la Garza is an actress from Columbus, Ohio. De la Garza is perhaps best known for her recurring role as Connie Rubirosa on television's 'Law & Order'."
"Beyoncé, to Solange, or vice versa.   		3 letters","SIS.    	Solange Knowles is a singer/songwriter, and the younger sister of the incredibly successful singer Beyoncé. Solange was in the news recently when security camera footage was released showing her punching and kicking Beyoncé's husband Jay-Z in an elevator."
___ neanderthalensis.   		4 letters,"HOMO.    	The Homo genus includes the species Homo sapiens (modern humans), but we're the only species left in that genus. The last known species related to humans was Homo neanderthalensis (Neanderthal Man) which died off about 24,000 years ago. However, another species was discovered in Indonesia in 2003 that has been dubbed Homo floresiensis (Flores Man ... sometimes called ""hobbit""), and it may possibly have lived as recently as 12,000 years ago. Watch this space ..."
H*MES.   		7 letters,"ONTARIO.    	HOMES is a famous mnemonic for remembering the names of the Great Lakes, i.e. Huron, Ontario, Michigan, Erie and Superior."
Woodworking tool.   		4 letters,"ADZE.    	An adze (also adz) is similar to an axe, but is different in that the blade of an adze is set at right angles to the tool's shaft. An axe's blade is set in line with the shaft."
Biting remark?.   		7 letters,"SIC 'EM.    	'Sic 'em' is an attack order given to a dog, instructing the animal to growl, bark or even bite. The term dates back to the 1830s, with ""sic"" being a variation of ""seek""."
"Actress Christine of ""Chicago Hope"".   		5 letters","LAHTI.    	Christine Lahti is an actress probably best known for playing Dr. Kate Austen on the TV medical drama 'Chicago Hope'. If you read 'The Huffington Post' you might run across her as well, as Lahti is a contributing blogger."
Novelist Allende.   		6 letters,"ISABEL.    	Isabel Allende is a Chilean writer, apparently the world's most widely-read, Spanish-language author. Isabel is related to Salvador Allende, the ex-President of Chile."
Sports champion whose father twice represented Iran as an Olympic boxer.   		6 letters,"AGASSI.    	Renowned tennis professional Andre Agassi wrote an autobiography called ""Open"", published in 2009. An amazing revelation in the book is that Agassi's famous head of hair was actually a wig for much of his playing career. Can you imagine how hard it must have been to play tennis at his level with a rug stuck on?"
Obstacle for Odysseus.   		5 letters,"SIREN.    	In Greek mythology, the Sirens were seductive bird-women who lured men to their deaths with their song. When Odysseus sailed closed to the island home of the Sirens he wanted to hear their voices, but in safety. He had his men plug their ears with beeswax and then ordered them to tie him to the mast and not to free him until they were safe. On hearing their song Odysseus begged to be let loose, but the sailors just tightened his bonds and and the whole crew sailed away unharmed."
"Actress Cuthbert of ""24"".   		6 letters","ELISHA.    	Elisha Cuthbert is a Canadian actress who came to world attention playing Kim Bauer, Jack Bauer's daughter on TV's '24'. After '24', Cuthbert played one of the lead characters on the sitcom 'Happy Endings' that ran from 2011 to 2013."
Brit.   		3 letters,DSO.    	The Distinguished Service Order (DSO) is a British military award that is usually presented to officers with the rank of Major or higher.
Like shellfish.   		4 letters,"TREF.    	According to Jewish dietary law, ""kosher"" food is ""fit"" to eat, and food that is not kosher is called ""treif"" (or tref)."
Icelandic saga.   		4 letters,"EDDA.    	The Poetic Edda and Prose Edda are two ancient works that are the source for much of Norse mythology. Both Eddas were written in the 13th century, in Iceland."
Rice ___ (dish).   		5 letters,"PILAF.    	'Pilaf' is a Persian word, and we use it to describe rice that is browned in oil and then cooked in a seasoned broth."
"Jack of ""Twin Peaks"".   		5 letters","NANCE.    	Jack Nance was an American actor who worked a lot with director David Lynch. He was one of the stars of the TV series ""Twin Peaks"" in which he played Pete Martell, a henpecked lumberjack. Coincidentally, the Log Lady in ""Twin Peaks"" was played by Catherine E. Coulson, one-time wife of Nance."
"San ___, Italy.   		4 letters","REMO.    	The Italian city of San Remo sits on the Mediterranean, right on the border with France. In Italian the city is named Sanremo, just one word, although the spelling of ""San Remo"" dates back to ancient times."
Don-turned-con.   		5 letters,"GOTTI.    	John Gotti was the boss of the Gambino crime family from 1985. Gotti was known as the Teflon Don and took over leadership of the family from Paul Castellano when he was gunned down, allegedly on Gotti's orders. Gotti remained head of the New York family until he was sentenced to life in prison in 1992. Gotti died of throat cancer after ten years behind bars."
Plaid-clad miss.   		4 letters,"LASS.    	Tartan is sometimes called ""plaid"" over here in the US, a word not used in the same sense outside of this country. In Scotland a ""plaid"" is a blanket or a tartan cloth slung over the shoulder."
Physics Nobelist Niels.   		4 letters,"BOHR.    	The physicists Niels Bohr and Albert Einstein had a series of public debates and disputes in the twenties and thirties. Although the two respected each other very highly, they held very different views on quantum theory, different views on the laws of physics at the atomic level. The passage of time has shown that Einstein lost these debates."
Seductive singer.   		5 letters,"SIREN.    	In Greek mythology, the Sirens were seductive bird-women who lured men to their deaths with their song. When Odysseus sailed closed to the island home of the Sirens he wanted to hear their voices, but in safety. He had his men plug their ears with beeswax and then ordered them to tie him to the mast and not to free him until they were safe. On hearing their song Odysseus begged to be let loose, but the sailors just tightened his bonds and and the whole crew sailed away unharmed."
Dutch painter Vermeer.   		3 letters,"JAN.    	Johannes (also 'Jan') Vermeer was born in the city of Delft in 1632, and died there some 43 years later. I just love Vermeer's paintings, and his wonderful use of light. A great example of such a work is his ""Girl with a Pearl Earring"". If you haven't seen it, I thoroughly recommend the 2003 movie ""Girl with a Pearl Earring"" starring Scarlett Johansson as the girl in the painting, and Colin Firth as Vermeer. The movie is based on a novel of the same name by Tracy Chevalier, so it's all just a great story as opposed to a documentary. The way the movie is shot really reflects the qualities of a Vermeer work of art. And, my wife and i are planning on taking a peek at the original painting 'Girl with a Pearl Earring' in a couple of weeks as it is visiting one of our galleries here in San Francisco."
"""Check and ___"".   		4 letters","MATE.    	In the game of chess, when the king is under immediate threat of capture it is said to be ""in check"". If the king cannot escape from check, then the game ends in ""checkmate"" and the player in check loses. In the original Sanskrit game of chess, the king could actually be captured. Then a rule was introduced requiring that a warning be given if capture was imminent (today we announce ""check!"") so that an accidental and early ending to the game doesn't occur."
First name in footwear.   		4 letters,"THOM.    	Thom McAn footwear was introduced in 1922 by the Melville Corporation (now CVS Caremark). The brand was named after a Scottish golfer called Thomas McCann. The Thom McAn line is epitomized by the comfortable leather casual and dress shoe, so sales have really been hurt in recent decades by the growing popularity of sneakers."
Pink slip.   		3 letters,"AXE.    	The term ""pink-slip"" can be used as a verb meaning ""to terminate an employee"". No one really seems to know for sure where the term originated, but there are lots of stories."
Circa-W.W.   		4 letters,"DADA.    	Dadaism thrived during and just after WWI, and was an anti-war, anti-bourgeois and anti-art culture. The movement began in Zurich, Switzerland started by a group of artists and writers who met to discuss art and put on performances in the Cabaret Voltaire, frequently expressing disgust at the war that was raging across Europe. According to the Dada Manifesto of 1918:"
Skewered fare.   		5 letters,"KEBAB.    	The name ""kebab"" (also 'kabob') covers a wide variety of meat dishes that originated in Persia. In the West, we usually use ""kebab"" when talking about shish kebab, which is meat (often lamb) served on a skewer. 'Shish' comes from the Turkish word for 'skewer'."
Blob that divides.   		6 letters,"AMOEBA.    	An ameba (or ""amoeba"" as we spell it back in Ireland) is a single-celled microorganism. The name comes from the Greek ""amoibe"", meaning change. The name is quite apt, as the cell changes shape readily as the ameba moves, eats and reproduces."
"""The Gondoliers"" girl.   		5 letters","TESSA.    	""The Gondoliers"" is a delightful operetta by Gilbert & Sullivan, first performed in 1889 at the Savoy Theatre in London. Tessa is a maiden selected as a bride in a ""line up"" by one of the gondoliers. I last saw ""The Gondoliers"" decades ago, an amateur production in the small town where I was living at the time in Ireland. Great fun!"
Valentine letters.   		4 letters,"XOXO.    	In the sequence XOX, I think the X represents a kiss, and the O a hug. Hugs and kisses ..."
"""Charlotte's Web"" girl.   		4 letters","FERN.    	""Charlotte's Web"" is a children's novel by author E. B. White. Charlotte is a barn spider, who manages to save the life of a pig named Wilbur. Wilbur is a pet pig, owned by the farmer's daughter, Fern Arable."
Eastern hereditary title.   		5 letters,RAJAH.    	Raja' (also 'rajah') is word derived from Sanskrit that is used particularly in India for a monarch or princely ruler. The female form is 'rani' (also 'ranee') and is used for a raja's wife.
Map showing property divisions.   		4 letters,"PLAT.    	A plat is a map showing actual and planned features, so a town might have a plat showing existing and intended buildings."
Priebus's predecessor as Republican Party chairman.   		6 letters,STEELE.    	Michael Steele served as Chairman of the Republican National Committee from 2009 to 2011 and was the first African American to fill the post.
"Night that ""Friends"" aired: Abbr..   		3 letters","THU.    	The remarkably successful sitcom 'Friends' was created by David Crane and Marta Kauffman. For the first season, the six lead characters were each paid $22,500 per episode. That salary had increased to $1 million per episode by the show's last season. "
Stick in a dugout.   		3 letters,"BAT.    	A 'dugout' is an underground shelter. The term was carried over to baseball because the dugout is slightly depressed below the level of the field. This allows spectators behind the dugout to get a good view of home plate, where a lot of the action takes place."
Image Awards grp.   		5 letters,"NAACP.    	The NAACP Image Awards are presented annually to recognise people of color in the worlds of film, television, music and literature. The first awards were presented in 1967, and the ceremony usually takes place in Los Angeles."
Petrova of tennis.   		5 letters,NADIA.    	Nadia Petrova is a tennis player from Moscow who has ranked third in the world in doubles. Petrova has a good complement of athletic genes as her father was a successful hammer thrower and her mother won an Olympic bronze in the 400m track relay.
Sherlock Holmes appurtenance.   		4 letters,"PIPE.    	An appurtenance is an accessory, perhaps a piece of equipment for a specific task. It might also be an appendage, a suffix to a word, for example."
"1 + 2, in Germany.   		4 letters","DREI.    	The German for 'one, two, three' is ""eins, zwei, drei""."
"___ bin Laden, 2011 Navy SEALs target.   		5 letters","OSAMA.    	Osama bin Laden founded his militant Islamist group called al-Qaeda in the late eighties. 'Al-Qaeda' translates as 'the base', and can refer to a military base. It was originally the name of a training camp set up for mujahedin fighters opposing the Russians who occupied Afghanistan at the time."
"Florida city, for short.   		4 letters","BOCA.    	The name of the city of Boca Raton in Florida translates from Spanish as 'Mouse Mouth'. There doesn't seem to be a definitive etymology of the name but one plausible explanation is a nautical one. 'Boca', as well as meaning 'mouth' can mean 'inlet'. 'Ratón', as well as meaning 'mouse' was also used to describe rocks that chewed away at a ship's anchor cable. So possibly Boca Raton was named for a rocky inlet."
"Some airport postings, for short.   		4 letters",ETDS.    	Estimated time of departure (ETD)
What Khloé might call Kim.   		3 letters,SIS.    	Khloé Kardashian managed to parlay her exposure on the reality show 'Keeping Up with the Kardashians' into spin-offs called 'Kourtney and Khloé Take Miami' and 'Khloé & Lamar'. Guess how many episodes of those three shows that I've seen ...
TV alien's home.   		3 letters,"ORK.    	""Mork & Mindy"" was broadcast from 1978 to 1982. We were first introduced to Mork (played by Robin Williams) in a special episode of ""Happy Days"". The particular episode in question has a bizarre storyline culminating in Fonzie and Mork having a thumb-to-finger duel. Eventually Richie wakes up in bed, and alien Mork was just part of a dream! Oh, and ""Nanu Nanu"" means both ""hello"" and ""goodbye"" back on the planet Ork. ""I am Mork from Ork, Nanu Nanu"". Great stuff ..."
"""___ means nothing"" (1918 manifesto declaration).   		4 letters","DADA.    	Dadaism thrived during and just after WWI, and was an anti-war, anti-bourgeois and anti-art culture. The movement began in Zurich, Switzerland started by a group of artists and writers who met to discuss art and put on performances in the Cabaret Voltaire, frequently expressing disgust at the war that was raging across Europe. According to the Dada Manifesto of 1918:"
Class after trig.   		4 letters,"CALC.    	The Latin word 'calculus' was originally used for a reckoning or an account, and originally applied to a pebble that was used to maintain a count. The Latin word came from the Greek for a pebble, 'khalix'."
"""House,"" but not ""Full House"".   		5 letters","DRAMA.    	I think that 'House' is one of the best shows made by Fox television. It is fun for me to see English actor Hugh Laurie in the title role as coming from the other side of the Atlantic I have been watching him in various comedic roles for decades. Famously he played Bertie Wooster opposite Stephen Fry in P.G. Wodehouse's 'Jeeves & Wooster', as well as one of the bumbling 'bad guys' in '101 Dalmatians' (the version starring Glenn Close)."
All you can take with one hand.   		3 letters,"POT.    	The ""pot"" in a card game has been referred to as the kitty since the 1880s. It's not certain how the name ""kitty"" evolved but possibly it came from ""kit"", the necessary equipment for the game."
