P.T.A. interest: Abbr..   		4 letters,EDUC.    	Parent-Teacher Association (PTA)
Psychic mediators.   		4 letters,"EGOS.    	Sigmund Freud created a structural model of the human psyche, breaking it into three parts: the id, the ego, and the super-ego. The id is that part of the psyche containing the basic instinctual drives. The ego seeks to please the id by causing realistic behavior that benefits the individual. The super-ego almost has a parental role, contradicting the id by introducing critical thinking and morals to behavioral choices."
"Refine, as ore.   		5 letters","SMELT.    	Metals are found in ore in the form of oxides. In order to get pure metal from the ore, the ore is heated and the metal oxides within are reduced (i.e. the oxygen is removed) in the chemical process known as smelting. The oxygen is extracted by adding a source of carbon or carbon monoxide which uses up the excess oxygen atoms to make carbon dioxide, a waste product of smelting (and of course, a greenhouse gas)."
Some cheaters have them.   		6 letters,"TRYSTS.    	In its most general sense, a tryst is a meeting at an agreed time and place. More usually we consider a tryst to be a prearranged meeting between lovers. The term comes from the Old French 'triste', a waiting place designated when hunting."
Secret get-togethers.   		6 letters,"TRYSTS.    	In its most general sense, a 'tryst' is a meeting at an agreed time and place. More usually we consider a tryst to be a prearranged meeting between lovers. The term comes from the Old French 'triste', a waiting place designated when hunting."
Divas have big ones.   		4 letters,"EGOS.    	""Diva"" comes to us from Latin via Italian. ""Diva"" is the feminine form of ""divus"" meaning ""divine one"". The word is used in Italy to mean ""goddess"" or ""fine lady"", and especially is applied to the prima donna in an opera. We often use the term to describe a singer with a big ego."
Navratilova rival.   		4 letters,"GRAF.    	Steffi Graf is a former World No. 1 professional tennis player from Germany. Graf won 22 Grand Slam singles titles, more than any other man or woman other than Margaret Court. She is married to another former World No. 1, namely Andre Agassi."
R.A.F.   		3 letters,DSO.    	The Distinguished Service Order (DSO) is a British military award that is usually presented to officers with the rank of Major or higher.
Acrobat producer.   		5 letters,"ADOBE.    	Adobe Acrobat is the software used to create .pdf files. Most of us are more familiar with the associated application called Adobe Reader, because that's what we use to read those .pdf files."
Syndicated radio host John.   		4 letters,"TESH.    	John Tesh is a pianist and composer, as well as a radio and television presenter. For many years Tesh presented the show ""Entertainment Tonight"". For ""ET"" he once covered the filming of an episode of ""Star Trek: The Next Generation"". As part of the piece, he volunteered to act as a Klingon warrior and so if you see the ""Star Trek: TNG"" episode called ""The Icarus Factor"" in reruns, watch out for John Tesh engaging in ritual torture with Mr. Worf as his victim."
"Show of shows, with ""the"".   		5 letters","EMMYS.    	The Emmy Awards are the television equivalent of the Oscars in the world of film, the Grammy Awards in music and the Tony Awards for the stage. Emmy Awards are presented throughout the year, depending on the sector of television being honored. The most famous of these ceremonies are the Primetime Emmy Awards and the Daytime Emmy Awards. The distinctive name of ""Emmy"" is a softened version of the word ""immy"", the nickname given to the video camera tubes found in old television cameras."
Thor or Loki.   		3 letters,"GOD.    	In Norse mythology, Thor was the son of Odin. Thor wielded a mighty hammer and was the god of thunder, lightning and storms. Our contemporary word 'Thursday' comes from 'Thor's Day'."
Funny Margaret.   		3 letters,"CHO.    	Margaret Cho is a very successful stand-up comedian, but she is also a fashion designer with her own line of clothing. Cho also acts, and you might have seen her in the John Travolta/Nicholas Cage movie ""Face/Off"" in which she played John Travolta's FBI colleague."
Squeezes (out).   		4 letters,"EKES.    	To ""eke out"" means to ""make something go further or last longer"". For example, you could eke out your income by cutting back on expenses. I always have a problem with the commonly cited definition of 'eke out' as 'barely get by'. Close but no cigar, I say ..."
Something a chair has.   		6 letters,"AGENDA.    	'Agenda' is a Latin word that translates as 'things to be done', coming from the verb 'agere' meaning 'to do'."
Feature of many a Ludacris lyric.   		3 letters,"PUN.    	'Ludacris' is the stage name of rapper Christopher Bridges from Champaign, Illinois."
Church choir selection.   		5 letters,"PSALM.    	The Greek word 'psalmoi' originally meant 'songs sung to a harp', and gave us the word 'psalms'. In the Jewish and Western Christian traditions, the Book of Psalms contains 150 individual psalms, divided into five sections."
"""Vive ___!"" (old French cry).   		6 letters",LE ROI.    	'Vive le roi!' is French for 'Long live the king!'
Longtime Federer adversary.   		5 letters,"NADAL.    	Rafael 'Rafa' Nadal is a Spanish tennis player, noted for his expertise on clay courts, earning him the nickname 'The King of Clay'."
"Pinocchio, periodically.   		4 letters","LIAR.    	The Adventures of Pinocchio' is an 1883 children's novel by Carlo Collodi, which is all about an animated puppet called Pinocchio, and Geppetto, his poor woodcarver father. Pinocchio is prone to telling lies, the stress of which causes his short nose to become longer."
Rainbow maker.   		5 letters,"PRISM.    	When light passes through a prism, it is split up ('disperses') into differing wavelengths. It then becomes clear that white light is actually a mixture of different colors, which show up as beautiful spectra."
1879's Anglo-___ War.   		4 letters,"ZULU.    	The Anglo-Zulu War of 1879 was fought between British colonial forces and the Zulu kingdom of southern Africa. The war opened with a stunning victory by the Zulu as Isandlwana, but ended with Britain emerging victorious and the Zulu nation losing its independence."
Homeland of many Miamians.   		4 letters,CUBA.    	Cuba is the largest island in the Caribbean. The exact etymology of the name 'Cuba' seems a little unclear. Most believe 'Cuba' to be derived from the Taíno terms for 'where fertile land is abundant' (cubao) or 'great place' (coabana).
Pellet propeller.   		6 letters,"BB GUN.    	A BB gun is an air pistol or rifle that shoots birdshot known as BBs. Birdshot comes in a number of different sizes, from size 9 (0.080"" in diameter) to size FF (.23""). 0.180"" diameter birdshot is size BB, which gives the airgun its name."
Folded food.   		5 letters,CREPE.    	'Crêpe' is the French word for 'pancake'.
Downhill sport.   		4 letters,"LUGE.    	A luge is a small sled used by one or two people, on which one lies face up and feet first. The luge can be compared to the skeleton, a sled for only one person and on which the rider lies face down and goes down the hill head first."
Pie (pine) cutter's tool.   		4 letters,"ADZE.    	An adze (also adz) is similar to an axe, but is different in that the blade of an adze is set at right angles to the tool's shaft. An axe's blade is set in line with the shaft."
Biggest city on the Big Island.   		4 letters,"HILO.    	The largest island in the state of Hawaii is named Hawaii, and nicknamed 'the Big Island'. Of the Hawaiian islands that I've had the pleasure to visit, the Big Island is definitely my favorite."
Brit.   		3 letters,DSO.    	The Distinguished Service Order (DSO) is a British military award that is usually presented to officers with the rank of Major or higher.
Busy Apr.   		4 letters,CPAS.    	Certified public accountant (CPA)
Dreamboat.   		6 letters,"ADONIS.    	In Greek mythology, Adonis is a beautiful young god loved by Aphrodite. Adonis dies in a hunting accident (gored by a boar), but not before he gives Aphrodite a child. Adonis was originally a Phoenician god ""absorbed"" into Greek lore (Phoenicia is modern day Lebanon). The child born of Adonis to Aphrodite was called Beroe, after which is named Beirut, the capital city of Lebanon. We also use the term 'adonis' to mean 'beautiful male'."
"""___ in the Morning"" (radio show).   		4 letters","IMUS.    	Don Imus's syndicated radio show ""Imus in the Morning"" broadcasts from New York City. Imus has been described as a 'shock jock', a disc jockey who deliberately uses provocative language and humor that many would find offensive . I don't like shock jocks ..."
"What goes after cows, ducks and pigs?.   		9 letters","E-I-E-I-O.    	There was an American version of the English children's song ""Old MacDonald Had a Farm"" (E-I-E-I-O), that was around in the days of WWI. The first line of the US version goes ""Old MacDougal had a farm, in Ohio-i-o""."
"Game with a ""perfect score"" of 3,333,360.   		7 letters","PAC-MAN.    	The Pac-Man arcade game was first released in Japan in 1980, and is as popular today as it ever was. The game features characters that are maneuvered around the screen to eat up dots and earn points. The name comes from the Japanese folk hero ""Paku"", known for his voracious appetite. The spin-off game called Ms. Pac-Man was released in 1981."
Mexican wrap.   		6 letters,"SERAPE.    	""Serape"" is the English pronunciation and spelling of the Spanish word ""zarape"". A zarape is like a Mexican poncho, a soft woolen blanket with a hole in the middle for the head. Most serapes have colorful designs that use traditional Mayan motifs."
Winner of the most French Open singles titles.   		5 letters,"NADAL.    	Rafael Nadal is a Spanish tennis player who is noted for his expertise on clay courts, earning him the nickname ""The King of Clay""."
"""The Age of Anxiety"" poet.   		5 letters","AUDEN.    	The noted poet W. H. Auden was born and raised in England, but eventually became a US citizen. As well as hundreds of poems, Auden also wrote librettos for operas, including Igor Stravinsky's 'The Rake's Progress'."
"Wellesley grad, e.g.   		6 letters","ALUMNA.    	Wellesley is a private women's school located in the town of Wellesley, Massachusetts. Wellesley was founded in 1870 and is one of the original Seven Sisters Colleges."
Grab (onto).   		4 letters,"GLOM.    	'Glom' is a slang term meaning 'steal', although it can also be used to mean 'latch onto' when used as 'glom onto'. The term probably comes from the Scots word 'glam' meaning 'to snatch at'."
___ bin Laden.   		5 letters,"OSAMA.    	Osama bin Laden founded his militant Islamist group called al-Qaeda in the late eighties. 'Al-Qaeda' translates as 'the base', and can refer to a military base, and was originally the name of a training camp set up for mujahideen fighters opposing Russians occupying Afghanistan."
24-___.   		5 letters,"KARAT.    	A karat (also 'carat', the spelling outside of North America) is a measure of the purity of gold alloys, with 24-karat representing pure gold."
Last name in despotism.   		4 letters,"AMIN.    	Idi Amin received most of his military training in the British armed forces, eventually achieving the highest rank possible for a Black African in the British Colonial Army in 1959, that of Warrant Officer. On his return to Uganda Amin joined his country's military and quickly rose to the rank of Deputy Commander of the Army. During that time he was quite the athlete. He was a noted rugby player and swimmer, and for nine years held the Ugandan national light-heavyweight boxing title. By the early seventies, Amin was commander of all the armed forces of Uganda and in 1971 seized power in a military coup, displacing the country's president Milton Obote. There followed seven years of brutal rule by Amin during which it is estimated that between 100,000 and 500,000 people were murdered. Amin was ousted from power in 1979 after a war with Tanzania, and fled to Libya where he stayed for a year. He then moved to Saudi Arabia, where he was financially supported by the Saudi Royal Family for the remainder of his life. Amin died in 2003."
"""Super"" parts of the psyche.   		4 letters","EGOS.    	Sigmund Freud created a structural model of the human psyche, breaking it into three parts: the id, the ego, and the super-ego. The id is that part of the psyche containing the basic instinctual drives. The ego seeks to please the id by causing realistic behavior that benefits the individual. The super-ego almost has a parental role, contradicting the id by introducing critical thinking and morals to behavioral choices."
"""___ Doone"" (1869 historical novel).   		5 letters","LORNA.    	The novel 'Lorna Doone: A Romance of Exmoor' was written by Richard Doddridge Blackmore. R. D. Blackmore was an English novelist, very celebrated and in demand in his day (the late 1800s). His romantic story ""Lorna Doone"" was by no means a personal favorite of his, and yet it is the only one of his works still in print."
"Brent of ""Star Trek.   		7 letters","T.N.G."".    	Brent Spiner played Lieutenant Commander Data on television's 'Star Trek: The Next Generation'."
Painter Matisse.   		5 letters,"HENRI.    	Henri Matisse was a French artist renowned for his contribution to modern art. In his early career, Matisse was classed as a ""fauve"", one of the group of artists known as the ""wild beasts"" who emphasized strong color over realism in their works. He was a lifelong friend of Pablo Picasso, and the two were considered to be good-natured rivals so their works are often compared. One major difference between their individual portfolios is that Picasso tended to paint from his imagination, whereas Matisse tended to use nature as his inspiration."
Postpone.   		5 letters,"TABLE.    	These ""tabling"" and ""shelving"" idioms drive me crazy, because they are often misused. If a topic is shelved, it is set aside. If a topic is tabled, it is brought ""off the shelf"" and put 'on the table' for discussion. But, maybe it's just me ..."
"Label of the ""Singing to the Hits"" series.   		5 letters","K-TEL.    	K-Tel was founded in 1962 in Winnipeg, Manitoba by one Philip Kives. K-Tel's recipe for success was the sale of inexpensive goods with a simple sales pitch and mail-order distribution."
Stick in a cabinet.   		5 letters,"Q-TIP.    	Cotton swabs were originally marketed under the name ""Baby Gays"", but this was changed in 1926 to ""Q-Tips"", with the Q standing for ""quality""."
"Obama's signature health measure, for short.   		3 letters",ACA.    	The correct name for what has been dubbed 'Obamacare' is the 'Patient Protection and Affordable Care Act' (ACA).
"Object depicted on the cover of Pink Floyd's ""The Dark Side of the Moon"".   		5 letters",PRISM.    	Pink Floyd were an English rock band founded in 1965. The band's most famous albums are probably 'The Dark Side of the Moon' and 'The Wall'.
Seed cover.   		4 letters,"ARIL.    	The casing surrounding many seeds is called the aril, and it may be quite fleshy. This fruit-like characteristic makes it desirable as a food and aids in the dispersion of the seeds."
Song of praise.   		5 letters,"PAEAN.    	A paean is a poem or song that expresses triumph or thanksgiving. 'Paean' comes from the ancient Greek 'paian' meaning ""song of triumph'."
"Cerberus guards its gates, in myth.   		5 letters","HADES.    	Cerberus is a dog with three heads that appears in both Greek and Roman mythology. Cerberus had the job of guarding the gates of Hades and preventing those who had crossed the River Styx from ever escaping. A sop is a piece of food that has been dipped in some liquid, as one might sop a piece of bread in soup. There is an idiomatic expression, ""to give a sop to Cerberus"", which means to give someone a bribe, or pay someone off. The idea is that if one could bribe Cerberus, give him a sop to eat, then he would let you pass and escape from Hades."
Product that can maintain a bikini line.   		4 letters,NAIR.    	Nair is a hair removal product that has some pretty harsh ingredients. The most important active constituents are calcium hydroxide ('slake lime') and sodium hydroxide ('caustic soda'). Other Nair components seem to be there to soothe the skin after the harsher chemicals have done their job. The name 'Nair' probably comes from combining 'no' and 'hair'.
Olympic racing event.   		4 letters,"LUGE.    	A luge is a small sled used by one or two people, on which one lies face up and feet first. The luge can be compared to the skeleton, a sled for only one person and on which the rider lies face down and goes down the hill head-first. Yikes!"
Record of the year.   		5 letters,"ANNAL.    	'Annal' is a rarely used word, the singular of the more common 'annals'. An annal would be the recorded events of one year, with annals being the chronological record of events in successive years. The term 'annal' comes from the Latin 'annus' meaning 'year'."
Batman co-creator Bob.   		4 letters,KANE.    	The DC Comics superhero Batman was created in 1939 by Bob Kane and Bill Finger.
Love letter letters.   		4 letters,"XOXO.    	In the sequence XOX, the X represents a kiss and the O a hug. Hugs and kisses ..."
Eponymous chair designer.   		5 letters,"EAMES.    	Charles and Ray Eames were a husband-wife team of furniture designers. One of the more famous of their designs is the Eames lounge chair that comes with an ottoman. This trendy piece of furniture featured in a late episode of the television show 'Frasier'. In the show, Frasier's Dad remarks that the Eames chair is so comfortable that he might have gotten rid of his tatty old recliner a long time ago."
Sounds from Santa.   		3 letters,"HOS.    	Saint Nicholas of Myra is the inspiration for Santa Claus. Nicholas was the Bishop of Myra (now in modern-day Turkey) during the 4th century AD, and was known for being generous to the poor. Centuries after he died, his remains were desecrated by Italian sailors and moved to Bari in Italy. One legend has it that the relics were moved again centuries later and reburied in the grounds of Jerpoint Abbey in Co. Kilkenny in Ireland, where you can visit the grave today. I choose to believe that Santa Claus's relics are indeed buried in Ireland ..."
Gallimaufries.   		5 letters,"OLIOS.    	Olio is a term meaning a hodgepodge or a mixture, coming from the mixed stew of the same name. The stew in turn takes its name from the Spanish ""olla"", the clay pot used for cooking."
European hotel fixture.   		5 letters,"BIDET.    	""Bidet"" is a French word that we imported into English. In French, the word ""bidet"" originally described a small horse or a pony. What we know as a bidet was so called because one can straddle it like a horse in order to use it."
TV character whose middle name is JoJo.   		4 letters,BART.    	Bart Simpson is the main character in television's 'The Simpsons'. Bart's name was chosen by the writers as it is an anagram of 'brat'. Bart is voiced by actress and comedian Nancy Cartwright.
Nicholas Gage memoir.   		5 letters,"ELENI.    	Nicholas Gage is a Greek-American author and investigative journalist. Gage wrote two memoirs, ""Eleni"" and ""A Place for Us"". ""Eleni"" tells of his life in Greece during WWII and the Greek Civil War. The title is a tribute to his mother Eleni who was executed by Communists who occupied her village, simply because she helped her children escape from the ravages of a war of occupation. ""Eleni"" was adapted into a movie in 1985, with John Malkovich playing Gage."
Beethoven dedicatee.   		5 letters,"ELISE.    	""Fur Elise"" is a beautiful piece of music written by Beethoven, and is also known as ""Bagatelle in A Minor"". ""Fur Elise"" means simply ""For Elise"", but sadly no one knows the identity of the mysterious dedicatee."
"Figures in 2011's ""J.   		5 letters","G-MEN.    	The nickname 'G-men' is short for ""Government Men"" and refers to agents of the Federal Bureau of Investigation."
Forever ___ (Internet meme).   		5 letters,"ALONE.    	A ""meme"" (short for ""mineme"") is a cultural practice or idea that is passed on verbally or by repetition from one person to another. The term lends itself very well to the online world where links, emails, files etc. are so easily propagated."
"Place for a '55 45, say.   		5 letters","HI-FI.    	Hi-fi systems were introduced in the late forties, and is audio equipment designed to give a much higher quality reproduction of sound than cheaper systems available up to that point. 'Hi-fi' stands for 'high fidelity'."
House entered near the autumnal equinox.   		5 letters,"LIBRA.    	In the world of astrology, the horoscope is divided into twelve 'houses'. These houses are the birth signs with which we are familiar."
Grab (onto).   		4 letters,"GLOM.    	'Glom' is a slang term meaning 'steal', although it can also be used to mean 'latch onto' when used as 'glom onto'. The term probably comes from the Scots word 'glam' meaning 'to snatch at'."
Classic computer game set on an island.   		4 letters,"MYST.    	In the days when I played the occasional video game, the best of the bunch was undoubtedly 'Myst'. It is a game full of puzzles with the player wandering through a beautifully designed interactive world."
"""Remington ___"".   		6 letters","STEELE.    	The eighties detective show 'Remington Steele' stars Stephanie Zimbalist as a private detective, and Pierce Brosnan as the handsome bad boy, who's really a good boy. The show is unusual in that it melds the detective genre with elements of romantic comedy."
Republican politico Michael.   		6 letters,STEELE.    	Michael Steele served as Chairman of the Republican National Committee from 2009 to 2011 and was the first African American to fill the post.
June preceder.   		3 letters,"MAY.    	The month of May was named after Maia, the Greek goddess of fertility."
Fashion designer Browne.   		4 letters,THOM.    	Thom Browne is a fashion designer based in New York City.
Sacred hymn of praise.   		5 letters,"PSALM.    	The Greek word ""psalmoi"" originally meant ""songs sung to a harp"", and gave us the word ""psalms""."
Snake charmer's snake.   		5 letters,"COBRA.    	Snake charmers don't actually hypnotize their cobras, but they do train them. The snake is trained to 'follow' the movement of end of the pungi, the instrument that the charmer uses in the act. The snake presents no danger to the charmer or the audience, as it is typically defanged or has it's mouth partially stitched up so that only the tongue can be moved in and out. Not a very nice practice ..."
Product of the Nucor Corporation.   		5 letters,"STEEL.    	Nucor Corporation is the largest producer of steel in the US, bigger even than US Steel. Despite its size, Nucor doesn't own one blast furnace. Instead, Nucor's business was built on recycling steel using electric arc furnaces."
"""Veni, vidi, vici"" speaker.   		6 letters","CAESAR.    	The oft-quoted statement ""Veni, vidi, vici"" (""I came, I saw, I conquered"") is believed by many to have been written by Julius Caesar. The words date back to 47 BC and refer to the short war between Rome and Pharnaces II of Pontus."
Kinsey topic.   		3 letters,"SEX.    	Alfred Kinsey sure did create a stir with his work and publications. He founded the Institute for Sex Research in 1947, and published the famous 'Kinsey Reports' in 1948 and 1953. I enjoyed the 2004 biopic ""Kinsey"", starring Irish actor, Liam Neeson in the title role."
Key setting.   		5 letters,"OCEAN.    	A ""key"" (also ""cay"") is a low island offshore, as in the Florida Keys. Our term in English comes from the Spanish ""cayo"" meaning ""shoal, reef""."
"""Who goes there?"" response.   		7 letters","IT IS I.    	The much debated statement 'it is I' is actually grammatically correct, and should not be 'corrected' to 'it is me'. Traditionally, pronouns following linking verbs, such as 'is', 'appear' and 'seem', are written in the nominative case. Examples are:"
Chinese ___ (popular bonsai trees).   		4 letters,"ELMS.    	The term ""bonsai"" is used more correctly to describe the Japanese art of growing carefully shaped trees in containers. Bonsai has come to be used as the name for all miniature trees in pots."
Like Vatican guards.   		5 letters,"SWISS.    	The Pontifical Swiss Guard is a small force of about 110 men responsible for the safety of the Pope. To join the Swiss Guard, a recruit must be a single male citizen of Switzerland who has completed basic training with the Swiss military. The commandant of the Guard suggested in 2009 that the force might be open for admission to female recruits one day, but that would be well in the future."
"Good wife in ""The Good Earth"".   		5 letters","O-LAN.    	Pearl S. Buck's novel ""The Good Earth"" won a Pulitzer in 1932, and helped Buck win the Nobel Prize for literature a few years later. The story tells of life in a Chinese village and follows the fortunes of Wang Lung and his wife O-Lan. Although ""The Good Earth"" has been around for decades, it hit the bestseller list again in 2004 when it was a pick for Oprah's Book Club."
"San ___, Italy.   		4 letters","REMO.    	The Italian city of San Remo sits on the Mediterranean, right on the border with France. In Italian the city is named Sanremo, just one word, although the spelling of ""San Remo"" dates back to ancient times."
"""The accuser of our brethren,"" per Revelation.   		5 letters","SATAN.    	Revelation is the last book in the New Testament of the Bible. The book's author is said to be John of Patmos, as called out in this passage:"
