Household helper.   		7 letters,"AU PAIR.    	An 'au pair' is a domestic assistant from a foreign country working and living as part of a host family. The term 'au pair' is French, and means 'on a par', indicating that an au pair is treated as an equal in the host family."
Scene of confusion.   		5 letters,"BABEL.    	We use the babel now to describe a scene of confusion, lifting the word from the biblical story of the Tower of Babel. The Tower was built in the city of Babylon, and the construction was cursed with confusion of languages among the varied origins of all the builders."
Pro team with a horseshoe logo.   		5 letters,"COLTS.    	The Indianapolis Colts professional football team has been in Indiana since 1984. The team traces its roots back to the Dayton Triangles, one of the founding members of the NFL created in 1913. The Dayton Triangles relocated and became the Brooklyn Dodgers in 1930, and then the Brooklyn Tigers in 1944. The team merged with the Boston Yanks in 1945, playing in Boston. The Yanks were moved to New York in 1949, and then to Dallas in 1952 as the Dallas Texans. The Texan franchise moved to Baltimore in 1953, forming the Colts. The Colts made their last move, to Indianapolis, in 1984. Whew!"
#33 on a table.   		7 letters,"ARSENIC.    	Dmitri Mendeleev was a Russian chemist. When he classified elements according to their chemical properties he noticed patterns, and was able to group elements into his famous 1869 Periodic Table. So powerful was his table that he actually predicted the properties of some elements that had not even been discovered back in 1869. Appropriately enough, element number 101, mendelevium, was named after Mendeleev."
Green shampoo.   		5 letters,PRELL.    	Prell shampoo was introduced by Procter & Gamble in 1947. Back then it was a clear green concentrate sold in a tube (like toothpaste).
"Caustic soda, to a chemist.   		4 letters","NAOH.    	Caustic soda is sometimes called lye. Chemically is sodium hydroxide (NaOH). It's nasty stuff, a white solid in its pure form. When you add it to water it generates an awful lot of heat, a property that is used when incorporating NaOH into drain cleaner."
"Author Steinhauer with the 2009 best seller ""The Tourist"".   		4 letters","OLEN.    	Olen Steinhauer wrote the espionage thriller ""The Tourist"", published in 2009. It's about a CIA agent who specializes in black ops. George Clooney's production company has purchased the film rights and the word is that a movie may be in the works soon with Clooney in the lead role. The 2010 espionage movie ""The Tourist"" starring Angelina Jolie and Johnny Depp is a different project altogether (and a pretty predictable and forgettable film, by the way) that bears no relation to the Steinhauer novel."
Acronym for a small-runway aircraft.   		4 letters,"STOL.    	STOL is an acronym, and stands for Short Take-Off and Landing."
Parisian picnic spot.   		4 letters,PARC.    	Parisians sometimes picnic in a park (parc).
European fashion capital.   		5 letters,"MILAN.    	Milan is a European fashion capital alright, the headquarters for the big Italian fashion houses of Valentino, Gucci, Versace, Armani, Prada and others. Mario Prada was even born in Milan, helping establish the city's reputation."
"Percussion instrument in ""Maxwell's Silver Hammer"".   		5 letters","ANVIL.    	""Maxwell's Silver Hammer"" is a song written by Paul McCartney and released by the Beatles in 1969. Although it's a very jaunty tune, the lyrics are pretty gruesome:"
Rabbit punch target.   		4 letters,"NAPE.    	The rabbit punch, a blow to the nape of the neck, is illegal in boxing because it so dangerous. It can damage the vertebrae of the neck, and ultimately the spinal cord. The punch is named after the practice used by hunters to kill trapped rabbits, rendering a sharp strike to the back of the neck."
One of the Estevez brothers.   		5 letters,RAMON.    	Ramon Estevez is one of the children born to actor Martin Sheen. Ramon actually bears the name of his father as 'Martin Sheen' is the stage name of Ramón Estévez.
Soak up rays.   		4 letters,"BASK.    	Our word ""bask"" has a gruesome etymology. It comes from the Old English ""basken"" meaning ""to wallow in blood"". William Shakespeare used the word ""bask"" in his play ""As You Like It"" (about 1600) in reference to sunshine, and we've been basking in warmth ever since."
Kind of acid.   		5 letters,"OLEIC.    	Oleic Acid is a fatty acid, found in many animal and plants sources, but most notably in olives. As such, 'Oleic' means 'derived from the olive'."
When Macbeth dies.   		5 letters,"ACT V.    	There is a superstition in the theatrical world that uttering the name 'Macbeth' in a theater will bring disaster of some sort. To avoid this, the euphemism 'the Scottish Play' is used instead."
Peak east of Captain Cook.   		9 letters,"MAUNA LOA.    	Mauna Loa on the ""big island"" of Hawaii is the largest volcano on the planet (in terms of volume). The name ""Mauna Loa"" is Hawaiian for ""Long Mountain""."
Electronic music pioneer Robert.   		4 letters,"MOOG.    	Robert Moog invented the Moog Synthesizer in the sixties, an electronic device that he used to produce music. I used to own a few of his albums, including a Moog version of Mussorgsky's ""Pictures at an Exhibition"". What a great performance that was ..."
Dessert wine.   		4 letters,"PORT.    	The city of Oporto in Portugal gave its name to port wine in the late 1600s, as it was the seaport through which most of the region's fortified red wine was exported."
Tower of ___.   		5 letters,"BABEL.    	We use the word ""babel"" now to describe a scene of confusion, lifting the term from the biblical story of the Tower of Babel. The Tower was built in the city of Babylon, and the construction was cursed with a confusion of languages due to the varied origins of all the builders."
British terminals?.   		4 letters,"ZEDS.    	The letter named ""zed"" has been around since about 1400, and derives from the Greek letter zeta. The spelling and pronunciation of ""zee"" used in America today first popped up in the 1670s."
Mosquito fleet vessel.   		7 letters,"PT BOAT.    	Collectively, a group of WWII PT boats was referred to as a mosquito fleet."
It's never right.   		5 letters,"ACUTE.    	An acute angle is less then 90 degrees, less than a right angle. On obtuse angle is greater than the right angle."
It might have serifs.   		4 letters,"FONT.    	Serifs are details on the ends of characters in some typefaces. Typefaces without serifs are known as sans-serif (using the French word ""sans"" meaning ""without""). Some people say that serif fonts are easier to read on paper, whereas sans-serif fonts work better on a computer screen. I'm not so sure though ..."
Mario's video game brother.   		5 letters,"LUIGI.    	Mario Bros. started out as an arcade game back in 1983, developed by Nintendo. The more famous of the two brothers, Mario, had already appeared in an earlier arccade game ""Donkey Kong"". Mario was given a brother called Luigi, and the pair have been around ever since. In the game, Mario and Luigi are Italian American plumbers from New York City."
___ Hari.   		4 letters,"MATA.    	Mata Hari was the stage name used by Margaretha Geertuida Zella, born in the Netherlands in 1876. After an unsuccessful and somewhat tragic marriage, Zella moved to Paris in 1903 where she struggled to make a living. By 1905 she was working as an exotic dancer and using the name Mata Hari. She was a successful courtesan, notably moving in various circles of high-ranking military officers. She apparently worked as a double agent, both for the French and the Germans. When Mata Hari was accused by the French of passing information to the enemy, she was tried, found guilty and executed by firing squad at the height of WW1, in 1917."
Like a well-off señora.   		4 letters,"RICA.    	In Spanish, a 'señora' (woman) might be 'rica' (rich)."
Japanese port.   		5 letters,"OTARU.    	The Japanese city and port of Otaru is just a 25-minute drive northwest from Sapporo. Just like Sapporo, Otaru has a famous beer that shares the city's name."
"""Pride and Prejudice"" actress Jennifer.   		4 letters","EHLE.    	My favorite screen version of Jane Austen's ""Pride and Prejudice"" is the 1995 miniseries starring Jennifer Ehle and Colin Firth."
Scrooge-like cries.   		4 letters,"BAHS.    	The classic 1843 novella ""A Christmas Carol"" by Charles Dickens has left us with a few famous phrases and words. Firstly, it led to the popular use of ""Merry Christmas"", and secondly it gave us the word ""scrooge"" meaning a miserly person. And thirdly, everyone knows that the character Scrooge uttered the famous line ""Bah! Humbug!""."
"Adhering to Strunk and White's advice ""Omit needless words"".   		5 letters","TERSE.    	William Strunk, Jr. was co-author of the first editions of ""The Elements of Style"" back in 1918 (usually referred to as ""Strunk & White""). Strunk's fellow-author was Elwyn Brooks (E. B.) White, the creator of the children's stories ""Charlotte's Web"" and ""Stuart Little""."
Yellowstone sight.   		5 letters,"MOOSE.    	Yellowstone National Park was the first National Park to be established in the world, when it was designated as such by President Grant in 1872. What a great tradition it started! The American National Parks truly are a treasure."
Syrup brand.   		4 letters,"KARO.    	Karo is a brand of corn syrup, an industrially manufactured sweetener derived from corn."
Rains pellets.   		6 letters,"SLEETS.    	Apparently ""sleet"" is a term used to describe two weather conditions. One is a shower of ice pellets, smaller than hail, and the second is a mixture of rain and snow, with the snow melting as it falls. It's the second definition that I have always used ..."
Westminster ___.   		5 letters,"ABBEY.    	The correct name for the Gothic church we know as Westminster Abbey is the Collegiate Church of St. Peter at Westminster. The Abbey is a favored location for coronations and royal weddings and burials. The last royal wedding in the Abbey was the marriage of Prince Andrew to Sarah Ferguson in 1986, and the next planned wedding is between Prince William and Kate Middleton in April 2011."
Medicare add-on.   		6 letters,PART B.    	Medicare is divided into four parts:
Decorative fabric.   		5 letters,"TOILE.    	Toile fabric can be used as upholstery, or as a wallpaper, or even as a fabric for clothing."
Angel of the south wind.   		5 letters,URIEL.    	Uriel is one of the archangels in Jewish and Christian traditions.
Robert L.   		6 letters,"EDGARS.    	The Edgar Allan Poe Awards (the Edgars) are presented annually by the Mystery Writers of America. One of the Edgars if the Robert L. Fish Memorial Award, presented since 1984. Fish was a mystery writer, who won an Edgar himself for ""The Fugitive"" in 1962. Fish also wrote ""Mute Witness"" which was adapted for the big screen and released under the title ""Bullitt""."
Tactic used against Britain by Napoleon.   		7 letters,"EMBARGO.    	After Napoleon was defeated at the Battle of Trafalgar in 1805 he didn't have the resources to exact military revenge from his archenemy, the United Kingdom. So, he turned to economic warfare and imposed an embargo against British trade called the Continental System. The plan failed though, as Britain still had naval dominance making the embargo unenforceable."
Mr.   		6 letters,"A-TEAM.    	'The A-Team' is an action television series that originally ran in the eighties. The A-Team was a group of ex-US special forces personnel who became mercenaries. Star of the show was Hollywood actor George Peppard, ably assisted by Mr. T and Robert Vaughan."
Relish.   		5 letters,"GUSTO.    	The word ""gusto"" comes from the Latin word ""gustus"" meaning ""taste""."
"About 60% of a tot's body, to a tot.   		4 letters",WAWA.    	A tot drinks wawa (water).
Muslim palace divisions.   		6 letters,"HAREMS.    	""Harem"" is a Turkish word, derived from the Arabic for ""forbidden place"". Traditionally a harem was the female quarters in a household in which a man had more than one wife. Not only wives (and concubines) would use the harem, but also young children and other female relatives. The main point was that no men were allowed in the area."
Jungle vine.   		5 letters,LIANA.    	Liana is the name give to vines that generally grow in moist areas such as rain forests. They grow using the trees in the forest as structural support. My bet is that Tarzan swung from tree to tree on liana vines ...
Yellowish-brown.   		6 letters,"SIENNA.    	Our word ""sienna"", that describes a yellowish-brown color, comes from the Italian ""terra di Sienna"". This translates into ""earth of Siena"", the name given to the original coloring material produced near the Italian city."
One of two N.T.   		3 letters,COR.    	The seventh and eighth books of the New Testament are the First and Second Epistles to the Corinthians.
"On a scale of 1 to 10, what one amp in ""This Is Spinal Tap"" goes to.   		6 letters","ELEVEN.    	This Is Spın&#776;al Tap' is a rock musical mockumentary about the fictional band Spinal Tap, directed by the great Rob Reiner. I love Rob Reiner's work, but this movie ... not so much ..."
Perfect place.   		6 letters,"UTOPIA.    	The word Utopia was invented by Sir Thomas More for his book ""Utopia"" published in 1516, describing an idyllic fictional island in the Atlantic Ocean. More's use of the name Utopia comes from the Greek ""ou"" meaning ""not"" and ""topos"" meaning ""place"". By calling his perfect island ""Not Place"", More was making the point that he didn't think that the ideal could actually exist."
Musical intensifier.   		5 letters,ASSAI.    	The musical term 'assai' means 'very'.
Disturb a stand-up routine.   		6 letters,"HECKLE.    	The original use of ""heckle"" was to mean questioning severely, and for many years was associated with the public questioning of parliamentary candidates in Scotland. In more recent times, that questioning is a little less polite, and directed at comics."
Country music's Tucker.   		5 letters,"TANYA.    	Country singer Tanya Tucker's first hit was ""Delta Dawn"" in 1972, which she recorded at only 13 years of age."
"Tribe under attack in ""Hotel Rwanda"".   		5 letters","TUTSI.    	The Tutsi are the second largest population of people in Rwanda, with the Hutu being the largest group. The bloody conflict that has existed between the Tutsi and Hutu peoples dates back to about 1880 when Catholic missionaries arrived in the region. The missionaries found that they had more success converting the Hutus than the Tutsi, and when the Germans occupied the area during WWI they confiscated Tutsi land and gave it to Hutu tribes in order to reward religious conversion. This injustice fuels fighting to this very day."
Sidewalk vendors' offerings.   		5 letters,"GYROS.    	A gyro is a traditional Greek dish, a sandwich made with pita bread containing meat, tomato, onion and tzatziki (a yogurt and cucumber sauce). The meat for gyros is usually roasted on a tall vertical spit, and is sliced from the spit as required. The name ""gyro"" comes from the modern Greek word ""gyros"" meaning ""circle"", a reference to the meat turning as it is grilled, in a rotating circular motion."
Corday slew him.   		5 letters,MARAT.    	Jean-Paul Marat was a prominent figure in the French Revolution. Marat was famously murdered in his bath by a young woman called Charlotte Corday who was a Royalist. The gruesome event was immortalized in a celebrated painting by Jacques-Louis David.
"""CSI"" setting.   		5 letters","VEGAS.    	The 'CSI' franchise of TV shows has been tremendously successful, but seems to be winding down. 'CSI: Miami' (the 'worst' of the franchise, I think) was cancelled in 2012 after ten seasons. 'CSI: NY' (the 'best' of the franchise) was cancelled in 2013 after nine seasons. The original 'CSI: Crime Scene Investigation', set in Las Vegas, hung in there until 2015 when it ended with a two-hour TV movie. The youngest show in the series is 'CSI: Cyber', and it's still on the air."
Post ___.   		3 letters,"HOC.    	The term 'post hoc' is used to describe a conclusion made about an earlier event at the time of a later event. Post hoc reasoning is basically an argument late in the day that the earlier event caused the later event, if you know what I mean!"
"""The Eighth Wonder of the World,"" informally.   		4 letters","KONG.    	In the original 1933 movie 'King Kong', the huge ape was captured and taken to New York City where he was billed as the 'Eighth Wonder of the World'."
Vet.   		5 letters,"EX-GI.    	The initials G.I. stand for ""Government Issue"" and not ""General Infantry"" as is often believed. G.I. was first used in the military to denote equipment made from Galvanized Iron. During WWII, incoming German shells were nicknamed ""GI cans"". Soon after, the term GI came to be associated with ""Government Issue"" and became an adjective to describe anything associated with the Army."
"""The Battle Hymn of the Republic"" lyricist.   		4 letters","HOWE.    	In 1856 William Steffe wrote the tune that was eventually used for ""The Battle Hymn of the Republic"". Before long it was one of the most popular tunes of the day, sung with a number of different lyrics. After the outbreak of the Civil War, Thomas Bishop composed lyrics to a famous abolitionist version of the tune, ""John Brown's Body"". The word's to ""John Brown's Body"" became less remembered than the strident melody, so Julia Ward Howe wrote the famous patriotic lyrics that spread thought the ranks of the Union forces."
Nutty stuff.   		4 letters,"GORP.    	Gorp' is the name sometimes used for trail mix, particularly by hikers. It's not really known for sure how this name came about, but some say it stands for 'good old raisins and peanuts' or perhaps 'gobs of raw protein'."
"Some ""Hair"" hairdos.   		5 letters","AFROS.    	The full name of the famed stage show from the sixties is ""Hair: The American Tribal Love-Rock Musical"". This controversial work outraged many when it was first performed in the sixties as it attacked many aspects of life at the time. For example, the song ""Air"" is a satirical look at pollution, sung by a character who comes onto the stage wearing a gas mask. The opening lines are ""Welcome, sulfur dioxide. Hello carbon monoxide. The air ... is everywhere"". I've never had the chance to see 'Hair' in a live production, but it's on 'the bucket list' ..."
Henry Fielding title heroine.   		6 letters,"AMELIA.    	""Amelia"" was the fourth and last novel written by Henry Fielding, first published in 1751. The book is considered somewhat sentimental, and it is thought that the title character is based on Fielding's first wife, Charlotte, who passed away not long before he started writing ""Amelia"". The novel is noted partly for its position on ""female intelligence"", underscoring the need to create opportunities for the education of women, an unusual position for a man at that time."
Oslo Accords partner of Yitzhak and Bill.   		5 letters,"YASIR.    	The Oslo Accords grew out of secret negotiations between high level PLO and Israeli delegates in a residence in Oslo. The teams shared the same house while they conducted 14 meetings, and while eating all their meals together at the same table, the negotiators came to respect one another, and apparently friendships developed."
"Fraternity benefactors, for short.   		5 letters","ALUMS.    	An alumnus (plural ... alumni) is a graduate or former student of a school or college. The female form is alumna (plural ... alumnae). The word comes into English from Latin, in which alumnus means foster-son or pupil."
What atoms do.   		4 letters,"BOND.    	Atoms bond together, to make molecules!"
Place for a hammerlock.   		3 letters,"MAT.    	A hammerlock is a move used in wrestling, but also by law enforcement officers to subdue an individual and prior to applying handcuffs."
"Titus, e.g.: Abbr..   		3 letters","EMP.    	Titus Flavius Verspasianus was&nbsp;a successful military commander, and&nbsp;Roman Emperor from 79 to 81 AD. It was Titus who laid siege to and destroyed the city and temple of Jerusalem, for which he was honored with the erection of the Arch of Titus that stands in Rome to this day. &nbsp;The Arch of Titus is the inspiration for many other famous arches around the world, including the l'Arc de Triomphe in Paris."
Composer Shostakovich.   		6 letters,"DMITRI.    	Dmitri Shostakovich was Russian composer, producing works in the Soviet period. He had a difficult relationship with the Communist Party, twice being officially denounced."
Programming language that's also the name of an island.   		4 letters,"JAVA.    	Java is a large island in Indonesia, and home to the country's capital, Jakarta. With a population of over 130 million, Java is the most populous island in the world, with even more people than Honshu, the main island of Japan."
Big gun.   		6 letters,"HONCHO.    	A honcho is a slang term for a leader or manager. It comes to us from Japanese, where a ""hancho"" is a squad (han) leader (cho)."
Los ___ (Manhattan Project lab site).   		6 letters,"ALAMOS.    	The town of Los Alamos, New Mexico takes its name from the Spanish for ""the poplars"". Famously it is home to Los Alamos National Laboratory which was founded during WWII to work on the Manhattan Project, the development of the first atomic bomb. The town of Los Alamos didn't exist as such, until it was planned and constructed to support the employees working on development of the bomb."
They may be bookmarked.   		4 letters,URLS.    	Internet addresses (like NYTCrossword.com and LAXCrossword.com) are more correctly called Uniform Resource Locators (URLs).
Eight-time Best Opera Recording Grammy winner.   		5 letters,"SOLTI.    	Sir Georg Solti was a great Hungarian-British conductor, who spent 22 years as music director of the Chicago Symphony, one of many prestigious positions he held in the world of classical music and opera. Solti was awarded 31 Grammy Awards, the most won by any individual in any genre of music."
Eye muscles attach to it.   		6 letters,"SCLERA.    	The sclera is the white part of the eye. Usually the sclera is white, but in horses for example, it is black. Really, go check!"
Military march.   		5 letters,"ETAPE.    	""Étape"" is the French word for stage, as in a ""stage"" in the Tour de France. It is used in English military circles to describe where troops halt overnight, but can also describe the section of the march itself. So, a march can be divided into stages, into etapes."
What Rihanna or Prince uses.   		8 letters,"ONE NAME.    	Rihanna was born and grew up on the island of Barbados, moving to the US when she was 16-years-old to pursue a singing career."
Singer Washington.   		5 letters,"DINAH.    	Dinah Washington was the stage name of the blues and jazz singer Ruth Lee Jones. Apparently when she was once performing at the famed London Palladium, she announced (with Queen Elizabeth sitting in the Royal Box), 'There is but one Heaven, one Hell, one queen, and your Elizabeth is an impostor.' That would have created a bit of a stir ..."
They have hops.   		5 letters,"OASTS.    	An oast is a kiln used for drying hops as part of the brewing process. It might also be called an ""oast house""."
Actress Hayek.   		5 letters,"SALMA.    	Salma Hayek is a Mexican actress. Hayek was the first Mexican national to be nominated for a Best Actress Oscar, for her portrayal of artist Frida Kahlo in the 2002 movie ""Frida""."
"Like ""Wedding Crashers"" or ""Bridesmaids"".   		7 letters","R-RATED.    	Not only does the 2005 romantic comedy ""Wedding Crashers"" star Owen Wilson and Vince Vaughn, but if you rent it you'll see cameos from Democratic pundit James Carville and Republican Senator John McCain."
In thing.   		4 letters,RAGE.    	It's all the rage ...
"""Cheers"" barfly.   		4 letters","NORM.    	The character of Norm Peterson was the only customer of the bar to appear in every episode of ""Cheers"", something that one couldn't call ironic since he loved that barstool! George Wendt played Norm, and I suppose the fact the Wendt was expelled from Notre Dame after one semester, with a 0.0 GPA, that might have helped him get the role!"
Foot up.   		3 letters,"ADD.    	To ""foot up"" is to add a column of numbers."
"Ulster, for one.   		4 letters","COAT.    	If you've watched Victorian dramas you might have seen the original Ulster coat, which is very distinctive. It is a full length, heavy coat, with an attached cape made from the same material that hangs down as far as the waist. The cape was dropped in the 20th century, and now it's a relatively simple, hard-wearing, double-breasted overcoat."
"Like Napoleon, before Elba?.   		4 letters",ABLE.    	The three most famous palindromes in English have to be:
Parents' hermanos.   		4 letters,"TIOS.    	In Spanish, one's mother's brother (madre's hermano) is an uncle (tio)."
It blew in 1707.   		4 letters,"FUJI.    	Mount Fuji is Japan's highest and most famous mountain. It is an active volcano, situated just west of Tokyo."
Hoity-toity manners.   		4 letters,"AIRS.    	Believe it or not, the word ""hoity-toity"" has been in the English language since the 1660s, but back then it meant ""riotous behavior"". It began to be used to mean ""haughty"" in the late 1800s, simply because the two terms sounded familiar."
Instant decaf brand.   		5 letters,"SANKA.    	The first successful process for removing caffeine from coffee involved steaming the beans in salt water, and then extracting the caffeine using benzene (a potent carcinogen) as a solvent. Coffee processed this way was sold as Sanka here in the US. There are other processes used these days, and let's hope they are safer ..."
